id,title,author,published_date,categories,summary,page_count
8543436,Dragon Wing,Margaret Weis,1990,"{""/m/06n90"": ""Science Fiction"", ""/m/014dfn"": ""Speculative fiction"", ""/m/01hmnh"": ""Fantasy"", ""/m/02xlf"": ""Fiction""}","Arianus, the World of Air, is composed entirely of porous floating islands, aligned in three basic altitudes. In the Low Realm, the dwarves (called ""Gegs"", an elven word for ""insects"") live on the continent Drevlin and cheerfully serve the giant Kicksey-winsey, a city-sized machine that is the source of all water in Arianus. In the Mid Realm, elves and humans have warred for centuries with each other and amongst themselves for water, status, and advantage. Above them all in the High Realm live the Mysteriarchs, isolationist human wizards of the Seventh House rank. They were some of the most powerful wizards of their kind, leaving fellow humans behind in their disgust for the constant warfare, but they never equalled the likes of the missing Sartan and Patryn races. As the novel opens, the Lord of the Nexus instructs a follower on his task in Arianus. The follower will go to Arianus and discreetly spy against the Sartan, the race that has long imprisoned their people before mysteriously disappearing. There, the follower will spread chaos in preparation for the Lord's arrival, never revealing that he is actually one of the powerful Patryn race. When the time comes, the Lord will conquer all of the worlds and reunite them as one under his rule. The Patryns will have their revenge against their Sartan enemies. On Arianus, an assassin named Hugh the Hand is hired by King Stephen, nominally the ruler of all humanity, to kill Crown Prince Bane. Bane is not actually Stephen's child, nor that of Stephen's wife, Queen Anne; he was switched at birth for the child of the mysteriarch Sinistrad, and speaks to his real father through a feather talisman magically charmed to make others dote on him despite their disapproval of the changeling. Bane is a devious child&mdash;charming, but ambitious, and totally self-possessed. Hugh takes Bane away from Stephen's fortress, and the two are followed by Bane's manservant, the gangly, balding Alfred Montbank, whose greatest talents seem to be fainting at the first sign of danger and tripping over anything in his path (and several things that aren't). At this time on Drevlin, a Geg is on trial for the crime of thinking too much. Limbeck Bolttightner seems obsessed with the question of why, but his most heretical belief is that the god-like Welves, who land in their giant flying dragonships for tributes of water every month or so, are not actually gods at all. He once found a (W)elf dead in a crashed dragonship, and even his girlfriend, Jarre, won't believe that a god could actually die. Sentenced to death by being thrown off the continent on a hang-glider, Limbeck manages to crash-land on a smaller island some distance down, where he encounters an injured man whose damaged ship is covered with brilliantly shining runes. The Kicksey-winsey inadvertently destroys the ship, but Limbeck manages to rescue the man in time. He believes the injured man is also a god, one he can pit against the Welves, so he brings the unconscious man along as he rides back up to Drevlin in one of the Kicksey-winsey's help-hands. Joining them is a dog who refuses to leave the ""god""'s side despite its own injuries. Haplo&mdash;Limbeck's god and the follower from the prologue&mdash;awakens in Drevlin not long before Hugh, Bane and Alfred crash-land there as well. It becomes clear that Haplo's dog is more than the average canine; he is very intelligent, and Haplo can hear through his ears. Limbeck, hearing about the ""other gods"", takes Haplo to investigate, but chaos erupts, with the entire group split up and reassembling. All but Alfred and Jarre are quickly arrested; those two take a trip into the tunnels under the Kicksey-winsey, where they come across a room filled with glass coffins containing sad, beautiful people. This, Alfred says, is where he came from. Alfred is quickly arrested as well, though Jarre escapes. In prison, Alfred creeps over to the sleeping Haplo and confirms, to his horror, his suspicion of Patryn runes that were hidden by Haplo's bandages. The rulers of the Gegs present the prisoners to the Welves as false gods, with Limbeck thrown in for free in the hopes that the Welves will execute the lot. Various circumstances (a mutiny against the tyrannical elven captain, a dwarven rebellion against their overlords) leads to Bane hiring the ship to take him up into the High Realm, where his father will supposedly reward them all. The new captain of the ship agrees to the terms. In the High Realm, Haplo makes his decision: he will take Prince Bane back to the Nexus with him, as the Lord of the Nexus will almost certainly be able to make use of him. Hugh becomes smitten with Sinistrad's wife, Iridal, once a good and noble woman who thought her husband-to-be was joking when he told her, flat out, that he was an evil man. Limbeck agonizes over his revelations concerning the oppressive (W)elves and eventually decides to lead his peace-loving, optimistic people to war. Haplo is prepared to make his move when he hears, through the dog, Bane confront Alfred about being a Sartan. Bane has seen Alfred work Sartan rune-magic, something no one else on Arianus&mdash;not even the powerful Mysteriarchs&mdash;could do. In fact, Alfred's rune-magic brought Bane back from near-death. Haplo prepares to confront Alfred, but they both realize a magical battle would draw too much attention, something Haplo's Lord ordered him to avoid at all costs. Haplo instead satisfies himself by abducting Bane as planned. Hugh, in the meantime, attacks and kills Sinistrad to free Iridal and her son from Sinistrad's evil influence, but Hugh dies in the process. Sinistrad's pet quicksilver dragon, freed of his master's mind-control, begins to destroy the castle, but Alfred subdues it with his magic. Alfred and Iridal give chase to Haplo, but they are too late to recover Bane. Haplo returns to the Nexus to prepare for his next journey: to Pryan, the World of Fire.",0
8543441,Elven Star,Tracy Hickman,1990,"{""/m/06n90"": ""Science Fiction"", ""/m/014dfn"": ""Speculative fiction"", ""/m/01hmnh"": ""Fantasy"", ""/m/02xlf"": ""Fiction""}","Pryan, the World of Fire, does not orbit a sun&mdash; at least, not in the normal manner. It is a giant stone sphere containing four suns (similar to a Dyson Sphere), and it is always daytime. The ""ground"" is not the ground at all, but rather moss and the leaves of huge, mile-high trees; most people don't know where the real ground is, or if there even is a real ground. And, although there is no night, there are ""stars"": little pinpoints of light that appear sporadically in the sky, some apparently burning out while others remain longer. Paithan Quindiniar, an elven magical weapons merchant, makes a deal with a pair of human smugglers, half-siblings Roland and Rega Redleaf, who pretend to be married as a cover story. The two accompany Paithan to the dwarven buyer of the magical weapons in an attempt to swindle him. During the trip, Rega is supposed to seduce him; much to her surprise, however, she finds they are falling in love with each other, a romance tainted by distinct prejudice and interracial tensions. It all falls apart, however, when the convoy is attacked by the tytans, giant lumbering humanoids with no eyes and crude defensive rune-magic. These tytans ask only a single question&mdash; Where is the citadel?&mdash; and if they don't like the answer, they destroy everything in sight. They haven't yet found an answer they like. They are rescued by the dwarven buyer, Drugar, and the four set out for Paithan's home. Drugar has an ulterior motive, however; the tytans wiped out his people since they had no adequate means to defend themselves, thanks to the Redleafs' failure to sell him Quindiniar weapons in time. Conditions have deteriorated in the Quindiniar household. Paithan's father Lenthan is obsessed with the idea of rocketry, as he is sure his late wife now lives in the stars - a heretical belief among the elves of Pryan. Lenthan's eldest daughter, Calandra, is a tight-fisted spinster under the best of conditions, and is incensed that Paithan has brought humans into the household. His younger sister, Aleatha, is just as she has always been: an extremely lovely young woman, but shallow, vain and lazy. Lenthan has sent away for a human expert on rocketry but has instead gotten Zifnab, a bizarre long-bearded fellow who seems utterly senile, especially since he seems to think he's some person named ""James Bond"" one moment, and ""Dorothy Gale"" the next; his ""dog Toto"" (actually one of Pryan's native ""dragons"") spends a lot of time reining him in. Finally, the newest member of the household is Haplo. His dragonship proves extremely useful when the tytans show up; even Haplo's rune-magic cannot defeat them, and Calandra stubbornly chooses to stay behind during the evacuation. Haplo sets course, on Zifnab's suggestions, for one of the winking stars in the sky. This period of empty travel is devoted mostly to romance: Paithan and Rega struggle to handle their relationship, Aleatha and Roland resist each other with all their might and almost succeed, and Haplo himself has flashbacks to his time in the Labyrinth, and the woman he met there; they became lovers and travelled together for a time, and she was suspected by Haplo to be carrying his child when they separated. It doesn't bother him that he hasn't seen her in years. Or so he tells himself. Arriving at the white star, Haplo travels up a mountain to a glowing, abandoned city that is nearly identical to the Nexus. He leaves the mensch to fend for themselves and enters the central stronghold, where he discovers a great deal of data on the nature of the worlds, although all the Sartan here have disappeared. He then leaves for Death's Gate and his next mission. Meanwhile, Zifnab apparently sacrifices himself to save the Redleafs, Quindiniars and Drugar from his dragon; it chases the remaining mensch to the gates of the citadel, which Drugar is able to open with an amulet inscribed with Sartan runes. The mensch are now safe&mdash; a fact that Zifnab, hale and hearty, celebrates with his dragon companion.",0
8543444,Fire Sea,Tracy Hickman,1991,"{""/m/06n90"": ""Science Fiction"", ""/m/014dfn"": ""Speculative fiction"", ""/m/01hmnh"": ""Fantasy"", ""/m/02xlf"": ""Fiction""}","Abarrach, the World of Stone is just that: lava, stone, poisonous fumes, and precious little food that can be grown. The peoples of Abarrach rely on giant rune-inscribed stone pillars called colossi to provide warmth and breathable atmosphere, but the colossi have been failing slowly for many years. The mensch have all died out, and the only remaining people &mdash; all of them Sartan &mdash; are far reduced in power; most of their innate magic is consumed with simply keeping them alive. To bolster their numbers, they have taken to the forbidden art of necromancy: the raising of the dead. These reanimated corpses are not very smart, but they're better than nothing. Haplo is sent to this world and discovers, much to his alarm, that Alfred has somehow infiltrated the Nexus and stowed away on his ship. Before he can do anything, however, the vessel passes through Death's Gate, and their consciousnesses switch; the two are forced to relive each other's most painful memories: Haplo, as a boy of seven, seeing the slaughtered bodies of his parents and being taught that it is all the fault of the Sartan; and Alfred, waking up to find that he is the only Sartan left alive on Arianus... for all he knows, the only one in all the worlds. They have been forced to walk in each other's shoes, and the two are never able to look at each other with quite the same hatred (in Haplo's case) or fear (in Alfred's) as before. On Abarrach, Alfred is initially overjoyed to meet living Sartan, even bastardized ones, but is appalled at the state of things; the Sartan rune-language, highly evocative, is laden with images of death when spoken by Abarrach natives. He is even more horrified that they practice necromancy. It was taught that, when one is revived untimely, another dies untimely, and (though the series never spells it out) it is implied that Abarrach's necromancy is the reason most Sartan died during stasis. And the Sartan here regard Alfred with hungry eyes: he has powers, magics, abilities that they had long forgotten existed, and they want what he has. Even his simplest magic is beyond them. Haplo and Alfred make the acquaintance of Prince Edmund, who is leading his ragged band of people to the ""greener"" pastures around Abarrach's capital city (Necropolis), and his chief necromancer, Baltazar. In the realm of Kairn Necros, they meet minor nobles and necromancers Jonathan and Jera, just married and very clearly in love with each other. Haplo and Edmund meet with the Dynast Kleitus XIV, who is not a pleasant man; he orders Edmund executed on a whim, and imprisons Haplo when it becomes clear that he, too, still knows the secrets of rune-magic. Kleitus poisons Haplo so that the corpse will be left undamaged, the runes free to be studied at Kleitus's leisure. Alfred, Jonathan, and Jera manage to free Haplo, but Jera is killed, and Jonathan revives her immediately without waiting the customary three days to let her soul depart entirely. Jera now becomes a lazar (a reference to Lazarus of the Bible), a revived dead who still retains her intelligence and personality because her soul is so closely bound to the body... and whose existence is endless torment, caught between life and death. Haplo, Alfred, and Jonathan flee with the dead Edmund and Jera from Kleitus and his dead soldiers, and end up in a curious chamber: heavily warded, full of the skeletal remains of people who apparently killed each other or even themselves, with seven sealed doors spaced evenly around its perimeter and a white wooden table in the middle. It is called the Chamber of the Damned. Once rebels gathered here, and were ambushed and killed here by an ancestor of Kleitus, but he and all his forces were struck down by an unseen hand on the very spot. The chamber is entirely peaceful and seems to resist violence, and Alfred (and Haplo too, though he will not admit it) feels for a moment as if in the presence of a Higher Power. While Alfred and Haplo view this ancient scene, Jera is calling to the dead soldiers that Kleitus brings with him. He arrives at the chamber, only to be killed and resurrected as a lazar by Jera. She begins to reanimate many new lazar, culminating in a slaughter of nearly the entire population of the city. The living (and Edmund) are forced to run again, trying to reach Haplo's ship to flee Abarrach, as well as stop the dead from breaking through its runes to enter the other worlds and kill all the living. Jonathan sacrifices himself to aid their escape, and is murdered and turned into a lazar at his wife's hands; Prince Edmund, on the other hand, demonstrates how a lazar can surrender his/her anger and find true death by doing so. Baltazar gathers his remaining people on the outskirts of the city, in for the long haul, though the new army of lazar will make life difficult. Haplo and Alfred escape in Haplo's ship, and Haplo, driven by odd impulses, gives Alfred a chance to jump ship before he returns to the Nexus and his lord.",0
8543448,Serpent Mage,Tracy Hickman,1992,"{""/m/06n90"": ""Science Fiction"", ""/m/014dfn"": ""Speculative fiction"", ""/m/01hmnh"": ""Fantasy"", ""/m/02xlf"": ""Fiction""}","The novel picks up just where Fire Sea left off. Alfred jumps into Death's Gate as Haplo's ship passes through it, and finds himself in a stasis room like the one he woke up in; in fact, he believes he's on Arianus. Tired, he decides to put himself back to sleep... Only to find someone in ""his"" stasis chamber. And then to find a bunch of strangers in all the stasis chambers. And then to see them wake up. Alfred has stumbled across a cache of actually-living Sartan, and not just any Sartan; he is on Chelestra, the World of Water, and the chamber he has dropped into contains Samah, the ruler of the Council of Seven&mdash; nominally, the leader of all remaining Sartan. Meanwhile, Haplo is attempting to ready his ship as quickly as possible so he can avoid speaking to Xar. He sent ahead a letter that lied about the state of Abarrach, claiming he found an entirely dead world; he covered up the truth about the necromancy out of fear of what Xar would do with it. Xar catches up with Haplo, and Haplo confesses nearly everything about the world. He accepts harsh punishment for betraying and doubting his lord. Xar sends Haplo's ship on through Death's Gate. The arrival on Chelestra isn't a very glorious one; for some reason, Chelestra's seawater has the effect of totally nullifying all rune-magic, even erasing Haplo's tattoos and the carvings on his steering stone. His ship disintegrates in minutes, whereupon he discovers another odd fact: Chelestran seawater is breathable, just like air. Cold and wet, though not particularly thirsty, he clings to a spot of wreckage and tries to figure out what to do next. The narrative is also interwoven with the personal diary of Grundle, daughter and heir to the leaders of Chelestra's dwarven population. Unlike most worlds, here the mensch have made peace and live (mostly) in harmony. Grundle's two best friends are the daughters of the elven and human peoples (Sabia and Alake, respectively). The mensch, at the moment, are planning a migration. Chelestra has landmasses they call seamoons (""durnai"" to the Sartan) scattered liberally throughout its watery interior, but its seasun is migratory, and this particular seamoon is about to freeze over. They have assembled a series of giant submarines, the sun-chasers, but just as Grundle is about to christen them (with a lock of her hair instead of a champagne bottle), something destroys them: foul, oozing black serpents with red glowing eyes. These serpents demand that the daughters of each royal family be surrendered to them. The parents plan to refuse, but Grundle, Alake, and Sabia choose to leave on their own. Grundle and Alake meet up with ""Sabia"" and leave in a submersible; it is quickly revealed that Sabia's fiance, Devon, has actually replaced her. It is this submarine, sailing into almost certain death, that stumbles across Haplo. Once they arrive at Draknor, however, the serpents (which Haplo calls dragon-snakes) make a total about-face: they claim that they are here only to help the mensch, and ply the three with mountains of gifts generated from thin air. When they find out about Haplo, however, they are ecstatic; their leader, the Royal One, assures him that they would love to help him conquer this world, or all four worlds, or anything he desires. Haplo finds himself distinctly nervous; the runes on his body, which glow in times of danger, are at full force, and every danger sense he has urges him to flee from their presence. When Haplo asks them who they are and who created them, the Royal One whispers, ""You did, Patryn."" But the dragons swear fealty, and that is all that matters. Haplo, with his new allies, returns to the mensch. The news that Sabia has killed herself in despair does not stop the dragon-snakes from instantly reassembling the sun-chasers, and the migration continues as planned, though with a new target: the Chalice, Chelestra's only landmass permanently inhabited... by the Sartan. Alfred is having a hard time adjusting to life with his people for several reasons. For one, for some reason Haplo's dog is there with him. Second, Samah manages to find out that the Patryn threat has reawakened, and is already beginning to plan a counter-offensive. Third, there are many secrets the Sartan are hiding: such as how the Chamber of the Damned, with which Alfred is so intimately acquainted, is actually the Seventh Gate, from which the Sartans performed the Sundering. Samah and his followers knew about the Higher Power, but deliberately ignored it, something Alfred finds unconscionable. Furthermore, those few Sartans who objected to the plan were actually cast into the Labyrinth with the Patryns, where they were almost certainly fallen upon and slaughtered. And, finally, Alfred himself has changed&mdash; partially due to his time with the mensch on Arianus, but mostly because of his time with Haplo. He can no longer see the Patryns as a vicious, hated enemy. It is customary for Sartan to reveal their private Sartan names to each other, but Alfred continues to go by his human pseudonym, a fact that partially exasperates and partially amuses Samah's wife, Orla, whom Alfred is slowly falling in love with. The mensch arrive at the Chalice and attempt to negotiate for living space, but Samah is having none of it; he deals with them as if with willful children refusing to go to bed, and is astonished when they treat him as an equal: with dignity and respect, but refusing to be bullied. He is also distressed at their allies: Haplo, the evil dangerous Patryn, and the dragon-snakes, who attacked the Sartan thousands of years ago and forced them into hibernation. When asked who had created them, the dragon-snakes responded: ""You did, Sartan."" Samah refuses to compromise, and the mensch, reluctantly, turn to military force. They will use the dragon-snakes to burrow through the Chalice's landmass, bringing seawater in to temporarily neutralize the Sartans' magic, allowing the mensch to invade peacefully. Haplo returns to Draknor to explain the plan, with Devon, Grundle, and Alake following him in a second submersible. He explains the plan, but refuses the dragon-snakes' alterations, which would lead to increased casualties on both sides&mdash; even though those casualties would be to mensch and Sartan, populations whose well-being he doesn't care about and, to some extent, is required by Xar's orders to disregard. The mensch overhear the conversation (conveniently, it has been carried out in the human language) but do not overhear the Royal One's orders to have them killed and their bodies returned to their parents, making the coming conquest anything but bloodless. To Haplo's surprise, Alfred appears with the dog. In the presence of this Sartan enemy, Haplo admits what he dares not say to anyone else: the dragon-snakes are not his servants. They grow fat on chaos, fear, hatred, confusion, despair; they are using him, using everyone, in an attempt to destroy all the four worlds. Even when Samah teleports in, spewing hatred and vitriol, Haplo holds to his course. He and Samah fight, each attempting to take each other prisoner, and Samah wins with the help of Chelestra's seawater, but all events are halted when the dragon-snakes begin to attack the mensch. Haplo rushes to their rescue, magicless though he is, while Alfred counters Samah. Haplo is unable to save Alake's life and looks to be doomed himself when a huge, majestic green and golden dragon appears; it slays the Royal One and fends off the other dragon-snakes. Haplo, staggering back to the beach in search of this incredible magic, finds only Alfred unconscious on the beach. Grundle, who saw him transform, insists that Alfred was the dragon, but no one believes it&mdash; least of all Alfred himself. Samah has won. Haplo is imprisoned, though with the seawater rising, he won't be for long. Alfred is sentenced by the Council to be exiled into the Labyrinth for his crimes, and Orla chooses to go with him rather than remain with her people; either way, she will be stripped of her magic as her punishment. Devon and Grundle, no longer the children he first met, wish him luck and Grundle gives him her journal before they are returned to their parents. Haplo settles back in his cell; he knows, now, what he must do. The dragon-snakes&mdash; deceptive, cunning, whispering only what the listener wants to hear, growing fat on fear&mdash; are who he must defeat.",0
