id,title,author,published_date,categories,summary,page_count
526283,Something Fresh,P. G. Wodehouse,1915-09-16,"{""/m/02yq81"": ""Comic novel"", ""/m/01z4y"": ""Comedy"", ""/m/02xlf"": ""Fiction""}","The novel begins with Ashe Marson, a young writer employed by the Mammoth Publishing Company, the creator of the popular ""Gridley Quayle"" detective novels, doing his daily exercises. Joan Valentine, a young girl living in the same apartment building, looks on and laughs at him. Thus she and Ashe meet, discover that they work for the same publishing house, and Ashe is encouraged to look for a new opportunity among the newspaper ads. Meanwhile, Freddie Threepwood, the younger son of the 9th Earl of Emsworth, is engaged to be married to Aline Peters, the daughter of American millionaire J. Preston Peters. Freddie pays a visit to his friend R. Jones, hoping to ""recover"" some letters he sent in the past to a certain chorus-girl, feeling they might be dangerous in her hands, especially following the recent embarrassment of his cousin Lord Percy Stockheath. He pays Jones £500 to sort things out for him. Clarence Threepwood, the elderly Earl of Emsworth, calls on J. Preston Peters, Aline's father, a passionate collector of Egyptian scarabs. Peters shows him the most precious piece in his collection: a 4th dynasty Cheops. Mr. Peters is called to the telephone, and the absent-minded Earl, forgetting all about the scarab, puts it in his pocket. Aline Peters has lunch with her old friend George Emerson, a Hong Kong police officer who wishes to marry her. He proposes to her once more, and tells her that, having befriended Freddie Threepwood, he has been invited to Blandings. Mr Peters discovers the disappearance of his scarab, and suspects the Earl, but cannot confront him for fear of endangering his daughter's marriage. The Earl has already forgotten everything that happened, and thinks the scarab was a gift of Mr Peters. R. Jones finds the address of Freddie's ex-sweetheart, Joan Valentine, who tells him she has long since destroyed any letters she may have had from Freddie. As he is leaving, Aline Peters, a close friend of Joan, arrives on a visit, allowing the suspicious Jones to listen at the door. He hears Aline's father is offering £1,000 to anybody that can retrieve his scarab. Joan decides that she will go herself to Blandings Castle, posing as Aline's maid, recover the scarab and scoop the reward. Ashe, following Joan's advice, scours the adverts in the newspaper, and seeing one which grabs his attention, he goes along to an interview with Mr. Peters, who is looking for somebody to pose as his valet and steal the scarab. Ashe, showing Peters some pep, gets the job. Ashe tells Joan about this, and they both take the train to Blandings. During the trip Joan warns Ashe of the highly complicated system of etiquette observed among servants of a large house. She hopes her words will persuade him to give up his quest and remove himself as her competitor for the reward, but he resolves to do his best. After their arrival, Ashe meets Baxter, the Earl's efficient and suspicious secretary, on the way to Mr Peters' room, addressing him in a highly un-valet-like manner. He finds that Mr Peters, like Beach, the butler at the castle, has problems with his stomach, so persuades him to do some exercise and stop smoking cigars. At night, Ashe and Joan are both trying to get at the scarab when the watchful Baxter hears them. Ashe, with his prepared excuse of reading to the insomniac Mr Peters, helps Joan escape. Next morning, Ashe and Joan decide to become allies and, after flipping a coin, that Ashe will take first try at steaing the scarab. Aline is following the same diet as her father, composed mainly of legumes, and George, worrying she is suffering from malnutrition, prepares a feast to bring to her at night. As he makes his way to her room, he and Ashe collide in the dark hall of the castle and start a noisy fight. Baxter rushes in, but by the time the lights come on, Ashe and George have fled, leaving Baxter surrounded by food and broken china. He is blamed for waking everyone, and roundly criticised by his employer, Lord Emsworth, for sneaking food in the middle of the night. The next night is Joan's turn, but she finds the scarab is already gone. The following morning, Ashe finds that Freddie needs money to pay R. Jones for the letters to Joan; he confronts Freddie, who confesses to the theft, and Ashe gets the scarab and gives it to the rightful owner, Mr Peters. George Emerson, recalled to Hong Kong, sadly wishes Aline good luck with Freddie; Aline, her mothering instinct finally aroused by his disappointment, decides to leave Freddie and elope with him. Ashe and Joan finally realise they are made for each other, and enter Mr Peters' employ. Lord Emsworth agrees to let Freddie return to London, on condition he doesn't make a fool of himself again.",0
526665,The Light of Other Days,Stephen Baxter,2000-04-16,"{""/m/06n90"": ""Science Fiction"", ""/m/014dfn"": ""Speculative fiction"", ""/m/07g8l"": ""Transhumanism""}","The wormhole technology is first used to send digital information via gamma rays, then developed further to transmit light waves. The media corporation who develops this advance can spy on anyone anywhere it chooses. A logical development from the laws of space-time allows light waves to be detected from the past. This enhances the wormhole technology into a ""time viewer"" where anyone opening a wormhole can view people and events from any point throughout time and space. When the technology is released to the general public, it effectively destroys all secrecy and privacy. The novel examines the philosophical issues that arise from the world's population (increasingly suffering from ecological and political disturbances) being aware that they could be under constant observation by anyone, or that they could observe anyone without their knowledge. Anyone is able to observe the true past events of their families and their heroes. An underground forms which attempts to escape this observation; corruption and crime are drastically reduced; nations discover the true causes and outcomes of international conflicts; and religions worldwide are forced to reevaluate their divine histories. As the underground movement grows, it utilizes a direct neural interface coupled with the unlimited communication provided by the wormhole technology to develop a group mind. One of the central themes of the novel is that history is biased towards viewpoints of the person who wrote it. Hence many great ""historical"" events often did not occur as they now are collectively remembered. For example, during the book's progression the time viewer technology shows that Jesus was the illegitimate son of a Roman centurion (although the apocryphal story of his visiting Great Britain was proven to be true), and that Moses was based on a collection of stories rather than the actions of a real person. In a climactic time-viewing experiment at the end of the novel, a time hole is opened to the beginning of life on Earth and it is discovered that all existing life is descended from a biological sample placed by intelligent beings (labeled Sisyphans) who inhabited the Earth over three billion years ago, trying to preserve genetic samples when geological and climatic changes and a large Bolide threatened an extinction level event.",0
527498,Do I Hear a Waltz?,Richard Rodgers,UNK,UNK,"New York City secretary Leona Samish arrives in Venice, where she is staying at the Pensione Fioria. There she meets Americans Eddie and Jennifer Yeager, who are living in Rome and have come to Venice for a vacation, and the McIlhennys, an older couple on a package tour. While shopping, Leona sees a ruby glass goblet in a store window and goes inside to inspect it. The owner, Renato di Rossi, tells her it is an authentic 18th century piece, not a reproduction. He offers not only to find her a matching glass to make up a pair, but to show her the sights of the city, as well. Leona refuses his offer and leaves, but returns the next day to buy the goblet. Later that day, a package with a second goblet is delivered to the hotel. Soon after, Renato arrives to invite Leona to join him for coffee in Piazza San Marco that evening. When the McIlhennys show her their purchase of a set of glasses exactly like hers, Leona believes Renato misrepresented their value, but Signora Fioria assures her they are antiques. Later in the day, Renato's son Vito comes to tell Leona that Renato will be late for their meeting because one of his children is ill and needs to see a doctor. Realizing Renato is married, she cancels their rendezvous. He comes to the pensione and explains he and his wife have not loved each other for years but divorce is not an option, not only because the country doesn't permit it, but because they have their children to consider, as well. To Leona, his casual attitude about extramarital affairs is wrong, but she still finds herself attracted to him, and agrees to keep their date. Meanwhile, the Yeagers are facing problems of their own. Eddie, finding himself enamoured with Signora Fioria, announces he wants to put distance between himself and the woman by returning to the United States. Renato arrives with a garnet necklace for Leona, who is thrilled with his gift and agrees to extend her stay in Venice. She hosts a party in the garden of the pensione, and as the party is in progress, Renato's son Vito comes to tell his father that the jeweler wants his money; overhearing this, Leona happily gives him the money. However, when she discovers Renato has received a commission on the sale of the necklace, she accuses him of being interested only in her money, and he leaves. Fioria and Jennifer attempt to comfort Leona, who drunkenly reveals Eddie and Fioria spent the previous evening together, only to immediately regret her words. The following day both the Yeagers and the McIlhennys check out of the pensione. On hearing Renato had been there before she awoke, Leona goes to his store to make amends, but he tells her a relationship with her would be impossible because of her complicated outlook on life. His affection for her is gone, and they part as friends.",0
528116,The Integral Trees,Larry Niven,1984,"{""/m/06n90"": ""Science Fiction"", ""/m/014dfn"": ""Speculative fiction"", ""/m/02xlf"": ""Fiction"", ""/m/05hgj"": ""Novel""}","Quinn Tribe inhabits the ""in tuft"" of Dalton-Quinn tree. They normally subsist on the tree's cottony foliage, augmented by hunting and a flock of domesticated turkeys. But ever since the tree passed near Gold six earth years ago it has been falling in toward Voy, nearly dropping out of the Smoke Ring. As a result, the tribe is suffering from a severe drought. The tribe's leader, the Chairman, decides to send a party of nine up the tree, ostensibly to hunt and re-cut tribal markings into the trunk. The group consists mostly of cripples or people the Chairman dislikes, and including the Chairman's son-in-law (and rival), Clave, and Jeffer, the Scientist's apprentice. As they approach the midpoint they notice that the tribal markings are different. When the party reaches the midpoint of the tree, they are attacked by members of the Dalton-Quinn tribe living at the other end of the tree. During the battle a massive tremor splits the tree in half, causing the in tuft to fall farther in toward Voy (killing its inhabitants) allowing the out tuft to find a new equilibrium closer to the Smoke Ring's median. The seven surviving members of the Quinn Tribe and one of the attackers jump clear of the shattered tree, and are left adrift in the sky with only a few ""jet pods"" (high pressure seed cases that provide a temporary thrust when opened) as their only method of propulsion. Before dying of thirst, they manage to hook a passing ""moby"" (a flying whale-like creature), which takes them to a ""jungle"", a floating mass of plant life. They cut loose and crash, and find themselves in the middle of a battle between the Carther States, who live in the jungle, and slave-runners from London Tree. The group is split when six of them are captured by the slavers; the other two remain in the jungle. Carther States counter-attacks some weeks later, and the Quinn Tribe group is reunited. During the battle they manage to steal the London Tree's CARM (Cargo And Repair Module), a miniature spacecraft, a relic of the original settlers. Not fully understanding how to pilot the CARM, they engage its main motor, which sends them thousands of miles away before running out of fuel. As a result, they become the first Smoke Ring inhabitants in centuries to see the naked stars. Unknown to any of the inhabitants of the Smoke Ring, the ship their ancestors arrived in, Discipline, is still in orbit, and its AI autopilot, Kendy, is watching their progress. When Kendy sees the CARM dangerously far from the habitable area of the Ring he contacts them. With help from the on-board computer and after some interaction with Kendy, the occupants of the CARM eventually find their way safely back into the Smoke Ring. Unable to find their way back to any of the trees they know, they decide to settle on a new tree, which they dub Citizens Tree.",0
528860,The Age of Innocence,Edith Wharton,1920,"{""/m/02xlf"": ""Fiction"", ""/m/01qxvh"": ""Romance novel"", ""/m/05hgj"": ""Novel""}","Newland Archer, gentleman lawyer and heir to one of New York City's best families, is happily anticipating a highly desirable marriage to the sheltered and beautiful May Welland. Yet he finds reason to doubt his choice of bride after the appearance of Countess Ellen Olenska, May's exotic, beautiful thirty-year-old cousin, who has been living in Europe. Ellen has returned to New York after scandalously separating herself (per rumor) from a bad marriage to a Polish count. At first, Ellen's arrival and its potential taint to his bride-to-be's family disturbs him, but he becomes intrigued by the worldly Ellen who flouts New York society's fastidious rules. As Newland's admiration for the countess grows, so does his doubt about marrying May, a perfect product of Old New York society; his match with May no longer seems the ideal fate he had imagined. Ellen's decision to divorce Count Olenski is a social crisis for the other members of her family, who are terrified of scandal and disgrace. Living apart can be tolerated, but divorce is unacceptable. To save the Welland family's reputation, a law partner of Newland asks him to dissuade Countess Olenska from divorcing the count. He succeeds, but in the process comes to care for her; afraid of falling in love with Ellen, Newland begs May to accelerate their wedding date; May refuses. Newland tells Ellen he loves her; Ellen corresponds, but is horrified that their love will aggrieve May. She agrees to remain in America, separated but still married, only if they do not sexually consummate their love. Newland receives May's telegram agreeing to wed sooner. Newland and May marry. He tries forgetting Ellen but fails. His society marriage is loveless, and the social life he once found absorbing has become empty and joyless. Though Ellen lives in Washington and has remained distant, he is unable to cease loving her. Their paths cross while he and May are in Newport, Rhode Island. Newland discovers that Count Olenski wishes Ellen to return to him, but she has refused, despite her family pushing her to reconcile with her husband and return to Europe. Frustrated by her independence, the family has cut off her money, as the count had already done. Newland desperately seeks a way to leave May and be with Ellen, obsessed with how to finally possess her. Despairing of ever making Ellen his wife, he attempts to have her agree to be his mistress. Then Ellen is recalled to New York City to care for her sick grandmother, who accepts her decision to remain separated and agrees to reinstate her allowance. Back in New York and under renewed pressure from Newland, Ellen relents and agrees to consummate their relationship. However, Newland then discovers that Ellen has decided to return to Europe. Newland makes up his mind to abandon May and follow Ellen to Europe when May announces that she and Newland are throwing a farewell party for Ellen. That night, after the party, Newland resolves to tell May he is leaving her for Ellen. She interrupts him to tell him that she learned that morning that she is pregnant; she reveals that she had told Ellen of her pregnancy two weeks earlier, despite not being sure of it at the time. The implication is that she did it because she suspected the affair. Newland guesses that this is Ellen's reason for returning to Europe. Hopelessly trapped, Newland decides not to follow Ellen, surrendering his love for the sake of his children, remaining in a loveless marriage to May. Twenty-six years later, after May's death, Newland and his son are in Paris. The son, learning that his mother's cousin lives there, has arranged to visit Ellen in her Paris apartment. Newland is stunned at the prospect of seeing Ellen again. On arriving outside the apartment building, Newland sends up his son alone to meet Ellen, while he waits outside, watching the balcony of her apartment. Newland considers going up, but in the end decides not to; he walks back to his hotel without seeing her.",0
529052,With Fire and Sword,Henryk Sienkiewicz,1884,"{""/m/0hwxm"": ""Historical novel""}","Despite some deviations, the book's historical framework is genuine and the fictional story is woven into real events. Many characters are historical figures, including Jeremi Wiśniowiecki and Bohdan Khmelnytsky (Pol. Bohdan Chmielnicki). Sienkiewicz researched memoirs and chronicles of the Polish nobility, or the szlachta, for details on life in 17th-century Poland. The book was written, according to the author, ""to lift up the heart"" of the Polish nation in the unhappy period following the failed January Insurrection during the era of the partitions of Poland. Thus it often favors epic plots and heroic scenes over historical accuracy. Nonetheless, Sienkiewicz's vivid language made it one of the most popular books about that particular place and era.",0
529614,Sabriel,Garth Nix,UNK,"{""/m/06n90"": ""Science Fiction"", ""/m/0dwly"": ""Children's literature"", ""/m/01hmnh"": ""Fantasy"", ""/m/014dfn"": ""Speculative fiction"", ""/m/02xlf"": ""Fiction""}","After leaving her school, Sabriel crosses the Wall, using papers given to her by her father. Her goal is Abhorsen's House, the home of her father. After entering Death to obtain guidance from a projection of her dead mother, she narrowly avoids a fatal altercation with a Dead creature. As she continues her journey, she becomes aware that she is being stalked by a Mordicant, a powerful Dead creature. She is able to outrun the creature and reach the safety of Abhorsen's House, which is located on an island in the center of the river. (The Dead cannot cross fast and deep running water.) Inside Abhorsen's house, Sabriel is able to rest and obtain food and other supplies, as well as armor. She also meets Mogget, a Free Magic construct who takes the form of a small white cat, wearing a collar with a powerful binding spell on it and a miniature Saraneth hanging from it. Mogget insists on accompanying her on her journey to find her father. Later, they look out over the walls surrounding the house and discover the Dead attempting to build a bridge. Sabriel performs a ritual to summon a flood of water and then flees the house by Paperwing (a magically propelled plane-like structure.) While in the air, Sabriel and Mogget are attacked by the Dead, and Sabriel loosens Mogget's collar to avoid a fatal crash. They fall into a sinkhole, where Mogget, in his unbound form, attempts to murder Sabriel. However, she is able to bind him anew with a ring given to her for that purpose. The next day, Sabriel and Mogget walk through a tunnel to another sinkhole, which Mogget determines to be Holehallow, the historical burial place of the royal family. Each king is buried in a boat. Sabriel discovers that the figurehead on one of the boats is actually a man, who has been imprisoned in that form for two hundred years. The man tells Sabriel that he was a Royal Guard before his imprisonment, and asks to be called Touchstone (a jester's name) for reasons that remain cryptic. Sabriel, Touchstone, and Mogget continue their journey, stopping to help rid a seaside village of a Dead creature. They obtain a boat there and sail up the coast of the Old Kingdom until they reach Belisaere, the capital. They find the Abhorsen in an underground reservoir in Belisaere, trapped in Death. Since he has stayed too long in Death, he cannot return for long, but with what little time he has left, the Abhorsen tells Sabriel about the evil known as Kerrigor. Kerrigor has risen far from Death and intends to wreak havoc in the Old Kingdom and Ancelstierre. Sabriel releases her father from Death, and once they emerge from Death, father and daughter part for the last time — he, to ring the bell Astarael(the sound of which throws everyone who hears it far into the realm of Death) and delay Kerrigor's havoc; and she, to save Touchstone by bringing him (and herself) as far away from Astarael's music as possible. To prevent him from losing to Death, she kisses him roughly in order to keep him focused on Life. In the process of ringing Astarael, Sabriel's father releases Mogget. They succeed, but as long as Kerrigor's body is intact, he will rise from Death again and again. Sabriel and Touchstone use another Paperwing to bring them as close to the Wall as possible, and cross over to Ancelstierre to find Kerrigor's body, following the clairvoyant guidance of the Clayr twins Sanar and Ryelle. They find the body, and Sabriel finally defeats Kerrigor by binding him with Ranna and Mogget's collar. She dies but the previous Abhorsens prevent her from crossing into Final Death as she cannot die without someone else to take her place as Abhorsen. She wakes up with Touchstone before her, and both Mogget and Kerrigor asleep, bound by Ranna (the first of seven necromantic bells that instills sleep and quiescence in those who hear it).",0
