id,title,author,published_date,categories,summary,page_count
9064841,Across Five Aprils,Irene Hunt,1964,"{""/m/0dwly"": ""Children's literature"", ""/m/02xlf"": ""Fiction"", ""/m/0hwxm"": ""Historical novel""}","From Jasper County, Illinois, Jethro Creightonn lives on a farm just before the Civil War. The youngest child, he is busily helping tend his family's farm. However, when his schoolmaster and good friend, Shadrach Yale, returns from Newton with the news that the war has begun, Jethro’s world is turned upside-down. Jethro has three brothers, Bill, John and Tom, and his cousin Eb, most of them eager to join the fight. Jethro must struggle with the split between them, as three join the Union Army but Bill joins the Confederacy. Later on, Jethro's good friend and sister Jenny's boyfriend, Shad also joins the Union Army. John's wife Nancy and their two young sons live with the Creighton's during the war. Jenny is in love with Shad, but her father will not approve of the marriage because he thinks she is too young. As the war heats up, so do the tensions among the townspeople around Jethro. A gang of men led by Guy Wortman are angered by the fact that one of Jethro’s brothers, Bill, joined the Confederate cause. Eventually, Jethro's father suffers from a heart attack, leaving Jethro with the task of becoming the head of the house. The spotlight is set on the hardships of war on a family. One day Jethro travels to Newton, and, while shopping, overhears the men talking about how evil his brother is. While Jethro is riding back; however, he is warned that the men are up to no good. Dave Burdow, father of the young man responsible for Jethro's sister Mary's death prior to the events of the story, ends up saving Jethro's life and driving the troublemakers off. However, the trouble is far from over. After a few months, the men are at it again. They sabotage the family’s property by burning down the family's barn and contaminating the water in the well. Jethro is given little time to concentrate on this when he finds out that his brother Tom was killed and that cousin Eb left the Union Army. He now must face the hard decision of whether or not he should help his deserter cousin. He writes a letter to President Lincoln for help and begins to look up to him as a father during the crisis. President Lincoln replies, telling him that he is already working on a program to accept all willing deserters back into the Union with little punishment. Soon after, the family learns that Shad has been wounded and is staying in a hospital, being taken care of by his aunt. Jenny goes to take care of him, and after finally receiving her father's blessing, she and Shad get married. Shad gets better, the war ends, and he, Jenny, John, and Eb return to the Mossing farm. However, at the end of the war, just when the family is reunited safely, Jethro learns that the president has been shot. He runs off but is found by Shad who tells him that he and Jenny are going to college, and that they will take Jethro with them. It is in these turbulent times that Jethro has grown from an innocent boy into a young man.",0
9065049,Man of Earth,Algis Budrys,1958,"{""/m/06n90"": ""Science Fiction"", ""/m/014dfn"": ""Speculative fiction""}","In Man of Earth, Allen Sibley is a businessman who is about to be indicted for bribery of a public official. Desperate to escape prison, he pays a fortune to the mysterious Doncaster Corporation for a new identity (and a new body and personality to go with it). However, Doncaster tricks him, sending him as an unwilling emigrant to the extraterrestrial colony on planet Pluto. Although it has been terraformed into a pleasant enough abode, Pluto is thoroughly neglected by a narcissistic Earth, and only ne'er-do-wells and misfits settle it. Sibley, with no marketable skills, is drafted into the Plutonian army, which is building an anomalously large war machine. His new commanding persona makes him swiftly rise in rank, and he soon concludes that Pluto intends to invade and plunder its neglectful mother planet. Instead, Doncaster suddenly reveals that the Pluto colony was created by them as a stepping-stone to the stars, and that Earth will be left to go rancid, while ""new men"", like the rebuilt Sibley, conquer the universe.",0
9067493,Dragonfly,Frederic S. Durbin,1999,"{""/m/01hmnh"": ""Fantasy"", ""/m/014dfn"": ""Speculative fiction"", ""/m/03npn"": ""Horror""}","Ten-year-old Bridget Ann (nicknamed ""Dragonfly"") lives in her Uncle Henry's funeral parlor. Uncle Henry summons Mothkin, a hunter, to investigate strange things happening in the basement as Hallowe'en approaches. In the basement, Dragonfly and Mothkin discover a doorway to a spooky underground world, known as Harvest Moon, which is ruled by an evil despot, Samuel Hain. Dragonfly is separated from Mothkin and meets up with a werewolf named Sylva who protects her from Hain. Eventually, she reunites with Mothkin for a final battle with Hain.",0
9075044,The Immortals,James Gunn,1996-05-01,"{""/m/06n90"": ""Science Fiction"", ""/m/014dfn"": ""Speculative fiction"", ""/m/01hmnh"": ""Fantasy"", ""/m/02xlf"": ""Fiction""}","When a cure for AIDS turns out to be more virulent than the disease, the U.S. establishes quarantine camps in the desert southwest. Michael Barris, a TV producer, masquerades as one of the infected and travels to the camps in search of his son. He finds horrific conditions, and learns that the so-called quarantine camps are death camps where the infected are gathered, purposefully brutalized, and ultimately cremated alive, their ashes bulldozed into the desert sand. Barris's son escapes the camp before the cycle of immolation, carrying the evidence he needs to expose the governmental mis-information campaign.",0
9077612,The Bird in a Cage,UNK,UNK,UNK,"The Duke of Mantua plans to marry off his daughter Eugenia to the ruler of Florence; to do so, he shuts Eugenia in a tower and banishes her noble suitor Philenzo. But Philenzo returns in disguise, and brags to the court that he can succeed in any task the Duke assigns him &mdash; if the Duke grants him the financial resources necessary. The Duke (in the best fairy-tale tradition), sets Philenzo the task of gaining access to the princess Eugenia in her sequestered tower; the Duke considers the matter as something of a joke, but also a good opportunity to test the soundness of his security. Philenzo is allowed a month for the task, and a blank check on the Duke's treasure house. And of course, the penalty for failure is death. Philenzo tries bribes, which do not work. Facing the apparent failure of his effort, Philenzo decides that he can at least relieve the poor debtors in the Duke's dungeons. One of the debtors, however, provides Philenzo with a new strategy for reaching the princess. The Duke in presented with a large and elaborate cage full of rare birds; and the Duke sends the present to Eugenia. When she opens it, Philenzo steps out from concealment in the central pillar of the apparatus. Thus the title of the play applies to both Eugenia and Philenzo (as it does, in another sense, to the dedicatee, the imprisoned Prynne). The next day the still-disguised Philenzo informs the Duke that he has succeeded in his task. Eugenia, brought to the court for confirmation, supports Philenzo's claim &mdash; and asks that she be allowed to marry the clever stranger. The Duke is outraged at her request; to marry a stranger of no birth is worse than marrying Philenzo. Philenzo doffs his disguise, revealing his true identity; but the unyielding Duke orders him executed. Seemingly in the knick of time, a letter arrives from the Duke of Florence, who has heard of the matter of Eugenia and Philenzo and renounces any interest in the arranged match. Florence's letter advises Mantua to let the young lovers marry, and Mantua decides to make the best of a bad bargain. When Philenzo in summoned back, however, it is learned that the condemned man poisoned himself on the way to execution; his corpse is brought in as proof. When the ""dead"" Philenzo overhears that he and Eugenia were to be allowed to marry, he returns to life.",0
9079569,Slaughter City,Naomi Wallace,UNK,UNK,"The play was inspired by a number of labor-related incidents including the Triangle Shirtwaist Factory fire of 1911 and the 1993 strike at the Fischer's meat packing plant in Louisville, Kentucky. The drama follows the lives of a group of workers who work at a modern day plant. While work gets tougher and more dangerous, their wages are being cut, and benefits reduced. Into the fray walks Cod, a strange young man who tries to inspire them to action. But Cod has his own secrets, which include once being a scab, and is in a long term battle with the cool Sausage Man, a battle whose outcome will affect them all in deadly ways. The play is divided into two acts and moves back and forth (and sometimes seemingly sideways) through time. Love, desire and friendship between these workers is disrupted, and transformed by the political pressures swirling around them. And the boss is beginning to make strange noises, just when his assistant has had enough. The live stage performance rights are licensed by Broadway Play Publishing Inc.",0
9080089,The Foundations of the Nineteenth Century,UNK,UNK,UNK,"Published in German, the book focuses on the controversial notion that Western civilization is deeply marked by the influence of the Teutonic peoples. Chamberlain grouped all European peoples&mdash;not just Germans, but Celts, Slavs, Greeks, and Latins&mdash;into the ""Aryan race"", a race built on the ancient Proto-Indo-European culture. At the helm of the Aryan race, and, indeed, all races, were the Nordic or Teutonic peoples. Chamberlain's book focused on the claim that the Teutonic peoples were the heirs to the empires of Greece and Rome, something which Charlemagne and some of his successors also believed. He argued that when the Germanic tribes destroyed the Roman Empire, Jews and other non-Europeans already dominated it. The Germans, therefore, saved Western civilization from Semitic domination. Chamberlain's thoughts were influenced by the writings of Arthur de Gobineau who had argued the superiority of the ""Aryan race"". This term was increasingly being used to describe Caucasian or European peoples, as opposed to Jews, who were conceptualised as ""infusing Near Eastern poison into the European body politic"". For Chamberlain the concept of an Aryan race was not simply defined by ethno-linguistic origins. It was also an abstract ideal of a racial elite (see Racism). The Aryan, or 'noble' race was always in the process of creation as superior peoples supplanted inferior ones in evolutionary struggles for survival. Building somewhat on the theories of de Gobineau and Georges Vacher de Lapouge, Chamberlain developed a relatively complex theory relating racial origins, physical features and cultural traits. According to Chamberlain, the modern Jew (Homo judaeica) mixes some of the features of the Hittite (H. syriaca) - notably the ""Jewish nose"", retreating chin, great cunning and fondness for usury and of the true Semite - the Bedouin Arab (H. arabicus), in particular the dolichocephalic (long and narrow) skull, the thick-set body, and a tendency to be anti-intellectual and destructive. According to this theory, the product of this miscegenation was compromised by the great differences between these two stocks: Chamberlain also considered the Berbers from North Africa as belonging to the Aryan race. Chamberlain (who had graduate training in biology), rejected Darwinism, evolution and social Darwinism and instead emphasized ""gestalt"" which he said derived from Goethe. Chamberlain said that Darwinism was the most abominable and misguided doctrine of the day. Chamberlain used an old biblical notion of the ethnic make up of Galilee to argue that while Jesus may have been Jewish by religion, he was probably not Jewish by race. During the inter-war period, certain pro-Nazi theologians developed these ideas as part of the manufacture of an Aryan Jesus.",0
9081697,The Long Tomorrow,Leigh Brackett,1955,"{""/m/06n90"": ""Science Fiction"", ""/m/014dfn"": ""Speculative fiction""}","In the aftermath of a devastating nuclear war, Americans have come to blame technology for the disaster, and far from seeking to recover what was destroyed, are actively opposed to any such attempt. Religious sects which even before the war opposed modern technology and avoided its use in their daily life have adjusted to the post-apocalypse situation far more easily than anyone else, and feeling themselves vindicated have come to dominate the post-war society. They gained an enormous number of new members, though those families which had been such before the war are honoured and privileged, their special status indicated by slightly different clothing. All the pre-war American cities have been destroyed in the war, and their re-construction is expressly forbidden. The US Constitution has been amended to now disallow the presence of more than a thousand residents or the existence of more than two hundred buildings per square mile anywhere in the United States. Len Colter and his cousin Esau are adolescent members of the New Mennonite community of Piper's Run. Against their fathers' wishes, the boys attend a preaching where a trader named Soames is accused and stoned to death for his apparent involvement with a forbidden bastion of technology known as Bartorstown. Though sickened by the stoning and harshly punished by their fathers, Len and Esau are fascinated by the idea of a community that secretly still holds and harnesses the forbidden technologies. Len's grandmother, a little girl at the time of the destruction, sparks his interest in the technological past with her stories of big, brightly lit cities and little boxes with moving pictures. Despite even harsher punishment after being caught with a simple radio previously stolen from Soames' wagon, Esau and Len become determined to find their way to the fabled Bartorstown and leave Piper's Run in search of it.",0
9083504,Down There on a Visit,Christopher Isherwood,1962,"{""/m/05hgj"": ""Novel""}","Throughout the novel Isherwood is a character of extremes. At times he pursues physical pleasure, relentlessly devoting himself to all kinds of debauchery. Yet he also interrupts these binges with discipline, by learning German or regularly meditating. Somehow, his abandon never leads to personal disaster. The second section of the novel contains a scene that figuratively illustrates Isherwood's life as recounted in ""Down..."" Isherwood is visiting an island where a crew of inane Greeks blast rock for the foundations of a mansion. He observes that: Despite all their experience, they seem to have no idea how much dynamite they should use. It is always too little or too much. We become completely indifferent to their yells of warning, followed by an absurd little firecracker pop. And then, just when you're least expecting it, there will be a stunning explosion which shakes the whole island and sends big rocks spinning through the air... A couple of times things have been smashed, but no one has been hurt, so far. So it is with Isherwood. Despite his experience, he never seems to know how to live his life. He often makes mistakes, such as his neglect of Mr. Lancaster, Waldemar, Dee-Ann, and Paul. But somehow he becomes wealthy, works at his leisure, and even avoids fighting in World War II. The reader is led to believe that no one has been hurt, so far.",0
9084750,The Cleansing,John D. Harvey,2002,"{""/m/014dfn"": ""Speculative fiction"", ""/m/03npn"": ""Horror""}","The book tells the story of an American Indian wolf god, Wanata, who comes to earth to hold humanity accountable for its abuse of nature. In Alaska, freelance journalist Savannah Channing investigates the story of a rampaging wolf pack that is systematically destroying villages. She arrives to find that the problem is worse than she expected and that the military and a brutal bounty hunter have been employed. Wanata is changed into mortal human form by an Indian Shaman's magic and is forced to interact with those he was sent to punish. The paths of Wanata and Channing cross in a spine-chilling conclusion.",0
9086171,The Babylon Game,Katherine Roberts,2002-03-04,"{""/m/014dfn"": ""Speculative fiction"", ""/m/01hmnh"": ""Fantasy""}","It is the year 539 B.C. Inside the city of Babylon, known as the Gateway of God, is Tia, the adopted daughter of a perfume maker. She is picking herbs in the sacred Amytis garden. Next to the garden is a portion of the double defense wall surrounding the city. Tia soon discovered what is between the two walls; Sirrush, otherwise known as dragons. Fearing for the dragon's health, she leaves them food. A touch from the dragons grants Tia great magical powers, enough to threaten or save Babylon. These will be needed, as far in the plains the Persian king Cyrus the Great, plans to capture Babylon. The secret of its salvation might just lie in the hanging gardens themselves.",0
9089352,The Dawkins Delusion?,Alister McGrath,2007-02-15,"{""/m/06mq7"": ""Science""}","McGrath criticizes Dawkins for what he perceives to be ""a dogmatic conviction"" to ""a religious fundamentalism which refuses to allow its ideas to be examined or challenged."" He objects to Dawkins' assertion that faith is a juvenile delusion, arguing that numerous reasonable persons chose to convert as adults. He cites himself and Antony Flew as two specific examples. Like Dawkins, McGrath rejects William Paley's Watchmaker analogy as specious. To express his true feelings on the subject of Irreducible complexity, McGrath instead cites the work of Richard Swinburne, remarking that the capacity of science to explain itself requires its own explanation – and that the most economical and reliable account of this explanatory capacity lies in the notion of the monotheistic God of Christianity. When considering the subject of Aquinas' Quinque viae, to which Dawkins devotes considerable attention, McGrath interprets the theologian's arguments as an affirmation of a set of internally consistent beliefs rather than as an attempt to formulate a set of irrefutable proofs. McGrath proceeds to address whether religion specifically conflicts with science. He points to Gould's supposition of Non-overlapping magisteria, or NOMA, as evidence that Darwinism is as compatible with theism as it is with atheism. With additional reference to the works of Sir Martin Rees, Denis Noble, and others, McGrath advocates a modified version of NOMA which he terms ""overlapping magisteria"". He posits that Science and Religion co-exist as equally valid explanations for two partially overlapping spheres of existence, where the former concerns itself primarily with the temporal, and the latter concerns itself primarily with the spiritual, but where both can occasionally intertwine. McGrath strives to confirm his position by suggesting that a significant minority of scientists are also theists, pointing specifically to Owen Gingerich, Francis Collins and Paul Davies as examples. McGrath criticizes Dawkins' proposals that religion is both an evolutionary by-product and a memetic virus. McGrath examines Dawkins' use of Russell's teapot analogy as well as the basics of Dawkins' theory of Memetics. McGrath criticizes Dawkins for referencing Frazer's The Golden Bough as an authority on anthropology, as he considers the work to be more of ""a highly impressionistic early work"" than a serious text. McGrath also points to Dawkins' lack of training in Psychology as indicative of an inability to address the most important questions of faith. Quoting Dawkins' description of the Old Testament God as ""a petty, unjust ... capriciously malevolent bully"", McGrath counters that he does not believe in such a god and knows no one personally who does. Setting aside Dawkins' remarks, McGrath instead points to Jesus and the New Testament as superior examples of the true nature of Christianity. ""Jesus"", McGrath argues, ""...was the object, not the agent, of violence"". McGrath suggests that ""far from endorsing 'out-group hostility', Jesus commanded an ethic of 'out-group affirmation' and Christians may certainly be accused of failing to live up to this command. But it is there, right at the heart of the Christian ethic"". He believes that Dawkins is right when he argues that it is necessary to critique religion, and right to demand that there be an external criterion for interpreting texts; but argues that Dawkins appears unaware that religions and their texts possess internal means of reform and renewal, and that Dawkins seems to be unaware of the symbolism of several of the Bible passages which he quotes. McGrath cites the works of numerous authors, including Kenneth I. Pargament, Harold G. Koenig, and Terry Eagleton, to demonstrate how closely he feels religious faith to be tied to well-being. The Dawkins Delusion? concludes with the suggestion that belief in God has ""rebounded"", that Dawkins' work is more theatre than scholarship, and that The God Delusion denotes little more than ""panic"" on the part of non-believers.",0
9090882,The Amazon Temple Quest,Katherine Roberts,2002-12-02,"{""/m/014dfn"": ""Speculative fiction"", ""/m/01hmnh"": ""Fantasy""}","Lysippe, an Amazon princess, is suffering. Her tribe has vanished and her sister has been badly wounded. The Gryphon Stone can help, but the evil Alchemist, who has taken Lysippe as his slave, is after it also. With the help of her friend Hero, who has also been enslaved, they seek sanctuary in the Temple of Artemis. There, Lysippe makes new friends and enemies. While her sister Tanis is being healed, Lysippe stays in the temple, but she sometimes ventures out resulting in finding a nymph named Smyrna. As Smyrna instructs Lysippe in Amazon ways, Lysippe is formulating a plan to rid of the Alchemist and finally be free again.",0
9090930,The Mausoleum Murder,Katherine Roberts,2003-12-01,"{""/m/014dfn"": ""Speculative fiction"", ""/m/01hmnh"": ""Fantasy""}","In the beginning of the story, Alexis' home Halicarnassos is at war with Macedon. As the war rages on Alexis' stepmother still wants to make the pilgrimage to the river. Alexis has the gift to turn statues that have enough gold on them into real people. This gift gets him into trouble as his stepmother has the spirit of the old king who wants to reclaim his land. Alexis meets the princess and turns her fabled chimea to life and it rampages through the city attacking all who are known as their enemies. Alexis then goes to the river and reverses his gift and is shocked when his father and his best friend are still real when all of the other statues have turned back to stone.",0
9090978,The Olympic Conspiracy,Katherine Roberts,2004-09-17,"{""/m/014dfn"": ""Speculative fiction"", ""/m/01hmnh"": ""Fantasy""}","The story is about the young Sosi. Sosi has a curse, that makes him half-snake. At each full moon, he is able to ""shed his skin"" and adopt the look of anyone he wants. When his brother, Theron, is injured, Sosi uses his curse to take his place in the Olympic games so that Theron won't be disqualified. Although his brother Theron is nasty to him, Sosi wants to find out about his curse at Olympia, and redeem himself in his family's eyes. However, Sosi uncovers a terrorist plot at the Games. Boys competing in the Games, the favourites to win (including Theron), are all being targeted by the mysterious Warriors of Ahriman. Sosi soon discovers that the Warriors are targeting those that are sent dreams by the goddess of victory, Nike, who has manifested herself in the form of a priestess to oversee the Games. When the priestess reveals herself, it is up to Sosi and his friends to make sure that the ones who she sent victory dreams win their events. However, when three out of the four she picked lose, she becomes extremely weak. The Warrior of Ahriman reveals his plan to sacrifice Nike to arise an army from the dead, Sosi has to embrace his curse. He turns into a snake, and calls Zeus to bring his thunderbolt down on the Warrior, just like his past incarnation, Sosipolis, did 36 years ago. When the Warrior is defeated, fears arise that Soksi will go to the same fate as Sosipolis and be unable to change back from a snake. However, when Theron admits to everyone how much he loves his little brother (when Sosi's own mother cannot bring herself to) Sosi transforms back into his human self.",0
9091222,Spellfall,Katherine Roberts,2000-10-19,"{""/m/0dwly"": ""Children's literature"", ""/m/01hmnh"": ""Fantasy"", ""/m/014dfn"": ""Speculative fiction"", ""/m/02xlf"": ""Fiction""}",The story concerns a 12 year old girl named Natalie who is kidnapped by a wizard named Hawk who needs her to join his spellclave (group of bonded spellmages) to receive the Power of Thirteen and invade Earthaven (an enchanted realm) to get revenge on the Spell Lords that banished him for breaking a treaty.,0
9096487,The Jane Austen Book Club,Karen Joy Fowler,2004-04-22,"{""/m/02xlf"": ""Fiction""}","The novel takes place over the course of several months in a contemporary university town in California's Central Valley near Sacramento. Each of the six chapters is dedicated to one of the six book club members as well as one of Austen's six works. In turn, each of Austen's novels parallels the individual characters' experiences with relationships and love.",0
