id,title,author,published_date,categories,summary,page_count
27712654,The Pilgrim of Hate,Edith Pargeter,1984,"{""/m/02n4kr"": ""Mystery""}","In June 1141, the Abbey of St. Peter and St. Paul prepares to celebrate the anniversary of the arrival of St. Winifred's casket at Shrewsbury Abbey. The monks will carry the reliquary from the small chapel at St. Giles to its altar in Abbey church. Brother Cadfael recalls the decision he made in Wales, when he alone removed Winifred's actual remains from the casket, returned them to her Welsh soil and replaced them with those of a monk who died on their mission to seek these holy bones. He shares this tale with Hugh, relieving a burden. The saint has continued to work miracles in her home in Wales, but none in Shrewsbury. Is the saint displeased with Cadfael? Abbot Radulfus returns from the legatine council in early June after 8 weeks away. Henry, Bishop of Winchester called the council as an attempt to end The Anarchy, a civil war between the forces of King Stephen, the lawfully anointed king and Bishop Henry's brother, and Empress Maud, the lawful heiress of her late father King Henry I. He is held in prison in Bristol, while she seeks the approval of London for her coronation. This dispute has the nobility and clerics of England at each others' throats; it comes to a head in Winchester on day three of the council when Stephen's wife Queen Matilda sends a message to the bishop, requesting Henry to seek release of his brother the King, enraging Henry who had turned to the Empress. Later that evening, the Queen's messenger is ambushed in a Winchester alley by supporters of the Empress. Rainald Bossard, a knight supporting the Empress, intervenes to save the messenger and is murdered for his noble efforts. The attackers slip away. Abbot Radulfus feels Bossard's death very deeply, asking the monks to pray for his soul. Pilgrims arrive in large numbers. Arriving after three weeks of walking is a middle-aged widow, Dame Alice Weaver, with a crippled teen named Rhun and his beautiful sister, Melangell. Aunt Alice has brought her nephew to pray to St. Winifred for relief from the pain caused by his clubfoot; Rhun wants his sister to find a happier life than caring for him. He accepts Cadfael's help of powerful massages, but refuses any sleep aid. Two taciturn young men arrived with them. Ciaran, who suffers from a 'fell disease', is under vow to hobble barefoot to Aberdaron in Wales to die in peace, hampered by a great iron cross around his neck and protected by a bishop's ring. His inseparable friend Matthew has vowed to see Ciaran through to the end of his penitential journey. These two groups travelled together nearing the Abbey, Matthew giving aid to Rhun on occasion, and showing an attraction to Melangell. Cadfael notices a third party of pilgrims, four merchants who do not quite suit their trades. Their suspicious actions and a tip from Brother Adam lead him to warn Beringar that they may be thieves. While Beringar sets a net to catch the thieves working the fair, he meets Olivier de Bretagne and his companions, messengers from the Bishop's conference. Proceeding to Hugh's house in town, Olivier makes his request that the Sheriff accept Empress Maud as queen, which request Beringar politely turns down. Olivier tells Hugh that while in Shrewsbury he will search for Bossard's adopted son, Luc Meverel, who is missing following his lord's murder in April. Olivier mentions he may find the monk he met at Bromfield, who was kind to his liege lord's wards. Hugh is pleased to meet by name this man with whom he had worked to save the Hugonin children. Beringar's net caught one of the thieves, and recovered the ring stolen from Ciaran. The ring was on the hand of a local goldsmith, Daniel Aurifaber, who bought it from one of the suspicious tradesmen as a side deal in a crooked dice game. Near dawn on the day of the procession, Melangell sees Ciaran who tells her that he is leaving Shrewsbury for Wales now that his ""safe-passage"" ring is returned to him. Melangell promises to keep his secrets. Ciaran leaves. After Mass is over at the Abbey church and St. Winifred's reliquary is in place on her altar, pilgrims line up to make their requests of the saint. Prior Robert presides. Rhun approaches on his crutches, but says he can kneel. Rhun drops his crutches; as he puts his foot to the ground and climbs the stairs to the altar, the congregation can see his leg fill out and his foot untwist. He prays in an atmosphere of complete silence; when he steps back, his foot whole and fully functional, the church is filled with shouts of praise for the saint who has performed such a miracle. At the midday meal, Matthew notices that Ciaran is missing. Melangell tries to stop Matthew pursuing Ciaran, saying Ciaran wants them to be together. He reacts with unusual rage, shoving Melangell down. Moments later he leaves the Abbey, hot on Ciaran's trail. After the meal shared with the Abbot, Olivier and Hugh seek out Cadfael from Winifred's altar, for aid in finding Luc. The presence of Olivier is Cadfael's own miracle; his saint is pleased. The description of Luc—that of a dark-haired, dark-eyed, well-bred, taciturn young man—applies to Ciaran and Matthew, who arrived together but could have met en route. The Abbott requests them to appear before him, to learn they are both gone. When Matthew left, he claimed his dagger and left a generous gift of money. On this news, Olivier leaves quickly to search for them, promising to return that evening, with Hugh as his immediate guide. Left with Cadfael, Abbot Radulfus asks if Rhun's recovery could be feigned. Cadfael replies that the boy is thoroughly honest and that his defect could not have been repaired by any doctor. Radulfus, reassured of this miracle, asks Cadfael to bring Rhun to him. They return to the Abbott with the scrip left behind by Matthew or Ciaran. Rhun states his wish to stay where the saint called him. The saddened Melangell tells Cadfael that the two young men left separately, heading out over the fields instead of along the north road. The Abbott opens the scrip, finding a book with Luc Meverel's name in it. Now is the time for quick action. Sending word to Hugh Beringar, Cadfael goes on horseback to follow the two young men on the overland route. At the edge of twilight, he hears Ciaran and Matthew in a clearing around a great beech tree some miles west of Shrewsbury. Then he hears Matthew fighting off the three felons. The felons wait for darkness to finish the fight. Cadfael, unarmed, approaches on foot, bellowing as if he is part of a large party in pursuit. He forcefully knocks down Simeon Poer. That loud cry leads Hugh and his men to light up the scene and nab the three attackers. Olivier heard it, too, and appears on scene, telling Cadfael to look round, he has won his field. In the brawl, Simeon pulled the cross off Ciaran's neck. Looking up to Matthew, Ciaran says 'I am forfeit, now take me.' Cadfael agrees gently. Matthew glares at Cadfael, looks back contemptuously at Ciaran and throws down his dagger. In a daze, he walks away with Olivier close behind. Ciaran, a man from Danish Dublin in the service of Bishop Henry, tells how he stabbed Bossard, wrongly believing that his master would condone the impulsive crime. Henry banished Ciaran from England, telling him that he must make his entire journey to Dublin barefoot while wearing a heavy iron cross. If anyone finds him wearing shoes or without the cross before Dublin, his life is forfeit. Luc Meverel overhears these words, as he followed the attacker back to the Bishop's house unseen. Luc appoints himself enforcer of this vow. Luc accompanies Ciaran under the name ""Matthew"", motivated by grief turned to hate and vengeance. At the crucial moment, Luc's grief softened away from vengeance. Bishop Henry would not sanction murder, rather forced Ciaran away. Hugh allows Ciaran to walk away, taking up his issues with God on his own. Olivier returns with Luc/Matthew to Shrewsbury, where Luc once again pays court to Melangell. Matthew begins life anew with confession to the Abbott, and marriage to Melangell. Rhun stays at the Abbey as a novice, while their aunt prepares to return home alone. Cadfael and Olivier talk in the herbarium, where Olivier reports he and Ermina Hugonin had married this past Christmas, as Cadfael had hoped. Arriving suddenly, Hugh has the latest news from London: the Empress Maud has lost London and retreated to the southwest. The weight of the failure rests on the Empress's shoulders, her weakness being her inability to praise her allies or ever forget a past slight, but the pressure of the Queen's army in Kent helps to change minds in London.,,, Olivier must follow his own liege lord to Oxford, leaving Shrewsbury before he wanted. Hugh and Olivier are friends but on opposite sides of this civil war, and both close to Cadfael, who will be ever neutral in these politics. Watching Olivier leave, Hugh says that he resembles Cadfael in some ways; the monk replies, no, he looks completely like his mother. ""I always meant to tell you, some day,"" he said tranquilly, ""what he does not know, and never will from me. He is my son.""",0
27715209,Promises in Death,Nora Roberts,2009,"{""/m/0lsxr"": ""Crime Fiction""}","On being called in to investigate a dead body, NYPSD homicide detectives Eve Dallas and Delia Peabody discover that the woman is a fellow officer, Detective Amaryllis Coltraine, who worked out of another precinct. To add to the emotion of the case, Coltraine was the lover of Li Morris, the Chief Medical Examiner and a good friend of Eve and Peabody. Coltraine was shot with her own police stunner; it also appears that she may have known her killer. Meanwhile, Eve's contact from Internal Affairs Bureau Donald Webster clues her on the victim's connection with Alex Ricker Max Ricker's son back in Atlanta, Georgia, from where the victim requested a transfer to New York following a fallout. Initial evidence suggests that the kill may have been ordered by Alex Ricker. The suspect's reactions, however, as well as Roarke's impressions from a private discussion they have, tend to steer the blame away from him. Eve is beginning to sense that the killer may have been one of the detectives Coltraine worked with at her precinct. A humorous minor subplot revolves around Eve's performing another duty of friendship she has never tackled before: hosting a wedding shower for Louise Dimatto, who is marrying former ""licensed companion"" Charles Monroe. In the middle of the shower, Eve gets a call from dispatch informing her of the death of Rod Sandy, Alex's Personal Assistant. After she gets back, Eve requests Charlotte Mira and Cher Reo to sit in for a debrief and ends up explaining the case to all her friends which leads Mavis to point out the killer who was the victim's partner at her precinct. Further digging reveals the killer to be the illegitimate daughter of Max Ricker,who set her up to extract his revenge on Eve and Roarke for putting him in a cage.",354
27717189,The Overton Window,Glenn Beck,2010-06-15,"{""/m/02xlf"": ""Fiction"", ""/m/05hgj"": ""Novel""}","The novel is based on the Overton window concept in political theory, in which at any given moment there is a range of policies related to any particular issue that are considered politically acceptable (""in the window""), and other policies that politicians seeking to gain or hold public office do not feel they can recommend without being considered too far outside the mainstream (""outside the window""). Moving the window would make previously radical ideas seem reasonable. Beck has referred to the book as ""faction"" – fiction based on facts. The plot revolves around a man named Noah Gardner, a public relations executive who has no interest in politics. He changes his mind when he meets a woman, Molly Ross, who is ""consumed by the knowledge that the America we know is about to be lost forever,"" an idea Gardner dismisses as a conspiracy theory. After America comes under attack, however, he works to expose the conspirators behind the attack.",0
27720678,Abercrombie Station,Jack Vance,1952-02,"{""/m/06n90"": ""Science Fiction""}","Jean Parlier, a beautiful but deadly teenager, is hired by a mysterious man to seduce and marry the supposedly terminally ill heir to Abercrombie Station for the fee of one million dollars. Abercrombie Station orbits the Earth and exists as a pleasure resort that caters to the whims of the obese. In space, freed from the demands of gravity, rich, corpulent people frolic in decadent excess. Within the mini-society of the station, obesity becomes the ultimate standard for beauty. The heir to Abercrombie Station, Earl, is sour and churlish, and Jean, working as a servant, makes a direct play for him, which only raises his ire. Forced to engage in subterfuge, Jean breaks into his private apartments and discovers that Earl has amassed a veritable zoo of malignant creatures from across the galaxy held in suspended animation. Earl engages in unwholesome activities with these aliens and Jean realizes she cannot follow through with her plan to marry him. Back on Earth, she renegotiates with the mysterious man who hired her and discovers he is actually Lionel, the missing heir to the station who is living in exile. He is normal sized, and has gone to Earth to find a fat woman willing to love him. Jean and Lionel return to the station, force Earl to expose his zoo where he has also entrapped his older brother Hugo, who was presumed dead. Earl is revealed to be a murderer who conspired to rob his family of their rightful heir. In his anger, he unleashes all his animals, killing himself and almost everyone except Jean, Lionel, and a witness. Jean had created a contract with Lionel, using Abercrombie Station as collateral, guaranteeing herself a two million dollar payoff. At the end of the story, she doesn't know what to do with her sudden wealth.",0
27721834,The Wolf-Sisters,Susan Price,2001-01-18,"{""/m/035qb4"": ""Historical fantasy""}","Kenelm begins his tale by telling of the hardships and misery he suffered during his time at the monastery, and of how he was gifted to the Christians by King Guthlac, his uncle, aged ten. The young Kenelm resents Guthlac and longs to be back at court, to enjoy the bright colours, good food, excellent storytelling and beautiful women there. He hates the life of boring prayers, bad food and degrading menial chores as a monk, and despite years of being taught the Christian ways, he still believes fervently in his own Norse gods, and in his ancestor Woden. He prays to Woden desperately to be allowed to return there without disgracing himself or his family, as he cannot leave the monastery without doing so. As he finishes his prayer, a monk summons him to the dining hall, where he notices a trio of house-carls, kept warriors, that serve his uncle King Guthlac. Under the direction of his Abbot, he bathes and changes, and visits his Abbess, who informs him that it has been requested that he leave the monastery to do his uncle's business. Kenelm, overjoyed, realises that his ancestor Woden has granted his prayers. Despite the Abbess's disapproval, she allows him a month's leave, and makes him promise to pray three times a day. Kenelm agrees, but privately swears to himself that he will pray to Woden. He then leaves with the house-carls, who tell him about the deadly plague that has swept through the court, laying low almost everybody, including the king and queen. Fortunately, the monastery is so excluded that Kenelm has never heard of the plague they are talking about, and is fit and healthy. Upon arriving at the court, Old Egwin tells him of the murderous Foreigners that are invading the country, and that nobody is strong enough to stand against them. He commands Kenelm to go to find help, revealing that the only creatures capable of helping him are the Wood Women, powerful spirits related to Woden and the Norse gods that are famed for singing to men and leading them until they are lost in the woods. Kenelm journeys into the woods and breaks a twig, as instructed by Egwin. At this, three young, beautiful, naked women emerge from the trees, dark-haired and with big dark eyes, blood-red lips and sharp white teeth. Kenelm, though very afraid, begs them in Egwin's name to drive off the Foreigners, and they, after some persuasion, agree, because they knew Old Egwin when he was a young man.",0
27722629,The Passage,Justin Cronin,2010-06-08,"{""/m/0kflf"": ""Vampire fiction"", ""/m/06n90"": ""Science Fiction"", ""/m/03npn"": ""Horror"", ""/m/0kz5r"": ""New York Times Best Seller list"", ""/m/0c082"": ""Utopian and dystopian fiction"", ""/m/0hc1z"": ""Apocalyptic and post-apocalyptic fiction"", ""/m/01hmnh"": ""Fantasy"", ""/m/02xlf"": ""Fiction"", ""/m/05mpfk"": ""Epic Science Fiction and Fantasy"", ""/m/026ny"": ""Dystopia""}","The novel is broken into 11 parts of varying lengths. The story itself is broken into two sections: The first and shorter section covers the origins of the virus and its outbreak, while the second is set 93 years after the infections, primarily following a colony of survivors living in California. Several narrative devices are used, including email, journal entries, newspaper reports, and other documents. Occasional use is made of reference material from 1,000 years after the outbreak, coming from ""The Journal of Sara Fisher"", sourced from a future ""University of New South Wales, Indo-Australian Republic"". The U.S. government is conducting a top secret experiment referred to as ""Project Noah,"" which involves acquiring and transporting death row inmates to a secret military compound in Colorado for the purposes of modifying them into super-soldiers for the U.S. Army. These genetic experiments originate from patient zero Fanning - one of two surviving members of an expedition investigating a Bolivian bat-carried virus. The virus, while eventually causing hemorrhagic fever and death in initial subjects, is being refined to accentuate its other properties - boosting of the immune system, enhanced strength and agility. The FBI agents responsible for recruiting the prisoners are ordered to collect 6 year old Amy Bellafonte from a convent, and, although conflicted, deliver her to Dr. Lear, the head of the project. At Noah she is exposed to a refined version of the serum administered to ""The Twelve""—the original inmates. Lear theorizes that as Amy's immune system has not had chance to mature it will form a symbiosis with the virus and live with her sympathetically, instead of the violent forms it has taken with the other twelve. Of the inmates, the first and last recruited are depicted as being different from the others: Babcock, the original test subject, is stronger and appears to have developed psychic abilities, occasionally influencing his guards and cleaners; and Carter is in fact innocent, but was convicted of first-degree murder nonetheless. Zero (AKA Fanning) and the other twelve inmates mentally take control of their guards and escape their quarantine cells, rapidly killing all who stand in their way. Amy is rescued by Brad Wolgast (the FBI agent who brought her to Noah) and Sister Lacey (a nun who was looking after Amy when she was recruited). Lacey is taken by Carter, as Wolgast and Amy escape to a mountain retreat where they live for several months, occasionally picking up news of the contagion spread throughout America. The rest of the world's fate is not stated, but it is mentioned that most of Europe has imposed quarantine over travel. Despite living reasonably comfortably in the mountain site, Wolgast eventually succumbs to radiation sickness when a nuclear device is detonated relatively nearby - he assumes that the government is attempting to sterilize infected areas of the country - and Amy is left to fend for herself. The novel shifts forward in time approximately 93 years (with occasional reference retrospectively 1,000 years in the future), and the narrative is taken up around a self-sufficient and isolationist colony established by the military (specifically FEMA) not long after the initial outbreak. The colony is in slow decline, although only one character (a technician called Michael) seems to recognize this; he is trying to establish clandestine contact with the outside world to obtain spares for their failing equipment - specifically their batteries which power the high-wattage lights which protect the colony from the virals, who in traditional vampiric style are highly light-sensitive. During a nighttime attack, Amy arrives at the gates of the camp, having previously met Peter Jaxon (one of the colony's senior figures) during a foraging expedition. Amy's arrival also results in a break-in from the virals leading to the death of ""Teacher"" - the person responsible for the upbringing of all the children under eight in the colony. Amy now appears to be a fifteen year old girl, and upon her arrival is grievously wounded by a crossbow, but her own recuperative powers soon heal her and within days she is as healthy as she was before being injured. Amy's arrival, her healing abilities, Teacher's death and inner-colony friction (caused by Babcock's mental influence over several Colony figures) force several of the colony dwellers to abscond with Amy and seek out another military site in Colorado - from where Michael has been receiving faint radio signals. Amy demonstrates a psychic bond with the virals, and manages to keep the group of travelers relatively safe during their journey. They come across another settlement established in a Las Vegas prison, known as the Haven, which, while initially welcoming, is in fact Babcock's lair. The Haven ""feeds"" Babcock blood sacrifices in exchange for being left alone by the horde of virals at his disposal, referred to as ""The Many"" (as opposed to The Twelve). During a botched attempt to kill Babcock during one of the blood sacrifice rituals, sympathizers at the Haven enable the group to escape via railroad, and they meet up with a Texan military group, who assist them in finding the Colorado outpost. Once at the outpost, they discover that it is the same compound where the outbreak started, and still serves as home to Sister Lacey. Lacey, like Amy, was treated by Lear with a modified form of the serum, providing her with longer life and a psychic bond with not only Amy and the virals, but Babcock as well. It is decided to lure Babcock into the outpost - Amy and Lacey confirm that he is headed towards them in any case - where they will detonate a nuclear device originally designed to sterilize the compound, but never used. The group theorize that the virals are like a hive mind and once Babcock is dead his hold over the virals created exponentially by him will cease and they will no longer be a threat. While waiting for Babcock to arrive, the group is attacked, resulting in Alicia (""Lish"") becoming infected, and treated by Sara the medic with modified serum. Lacey hands over files on The Twelve, revealing their hometowns, to which she suggests The Twelve will have returned. Upon Babcock's arrival, Lacey lures him to a chamber where she detonates the bomb, destroying herself, Babcock, and much of the outpost. The attacking virals all collapse and die again, in most cases leaving behind nothing but dust, proving the hive theory correct. Lish adapts to the virus in a similar manner to Amy and Lacey before her, yet with differences - she has limited psychic abilities, but has the strength and endurance of a viral. Greer, one of the Texan soldiers traveling with them, comments that she would be a formidable soldier - suggesting that Lish has become the first true ""super soldier"" that the government was trying to develop 93 years ago. Part of the group - primarily Amy, Peter, and Lish - return to the First Colony only to find it deserted, with no sign of what happened or where the colonists may have gone. There are two bodies, a victim of a suicide and that of Auntie, who seemingly died of old age. They decide to hunt down the remaining Twelve using Lear's files to determine their locations, and Lish as their primary weapon. That night Amy meets the infected Wolgast, outside the Colony. The other group stays with the Texan Expeditionary force, and their remaining story is related through parts of Sara's diary - her last entry is at Roswell Base, and among comments about her own pregnancy she states that she can hear gunshots, and is going to investigate. This entry is presented as part of the future reference material, and is stated to have come from the site of ""The Roswell Massacre"". The novel ends ambiguously for all surviving characters.",0
27732586,The Gilt Kid,James Curtis,1936,['Detective and mystery stories'],"The protagonist of the novel is Kennedy, a 25-year-old spiv. Due to his blond hair he is known as ""The Gilt Kid"" from which the novel gets its title. The novel picks up as Kennedy has recently been released from prison having served a sentence for burglary. With no real plans to go straight and with Marxist sympathies he re-engages with the underworld of Soho and its associated culture. On his travels through London he observes and comments on the rituals of the destitute, prostitutes and criminals. Eventually ""The Gilt Kid"" finds himself involved in a robbery that doesn't go to plan. Fearing the inevitability that he will return to prison he struggles with the judicial system and attempts to ensure his freedom.",247
