id,title,author,published_date,categories,summary,page_count
535391,Firestarter,Stephen King,1980-09-29,"{""/m/01jfsb"": ""Thriller"", ""/m/06n90"": ""Science Fiction"", ""/m/0dwly"": ""Children's literature"", ""/m/03npn"": ""Horror"", ""/m/014dfn"": ""Speculative fiction"", ""/m/02n4kr"": ""Mystery"", ""/m/02xlf"": ""Fiction""}","Andy and Charlene ""Charlie"" McGee are a father-daughter pair on the run from a government agency known as The Shop, located in the fictional D.C. suburb of Longmont, Virginia. During his college years, Andy had participated in a Shop experiment dealing with ""Lot 6"", a drug with hallucinogenic effects similar to LSD. The drug gave his future wife, Victoria Tomlinson, minor telepathic abilities, and him an autohypnotic mind domination ability he refers to as ""the push"". Both his and Vicky's powers are physiologically limited; in his case, overuse of the Push gives him crippling migraine headaches and minute brain hemorrhages, but their daughter Charlie developed a frightening pyrokinetic ability, with the full extent of her power unknown. The novel begins in medias res with Charlie and Andy on the run from Shop agents in New York City. We learn through a combination of flashbacks and current narration that this is the latest in a series of attempts by the Shop to capture Andy and Charlie following an initial disastrous raid on the McGee family's quiet life in suburban Ohio. After years of Shop surveillance, a botched operation to take Charlie leaves her mother dead; Andy, receiving a psychic flash while having lunch with work colleagues, rushes home to discover his wife murdered and his daughter kidnapped. He then uses his push ability to track the slightly-cold trail of Charlie and the Shop agents, catching up to them at a rest stop on the Interstate. He uses the push to incapacitate the Shop agents, leaving one blind and the other comatose. Charlie and Andy flee and begin a life of running and hiding, using assumed identities. They move several times to avoid discovery before the Shop catches up to them in New York. Using a combination of the push, Charlie's power, and hitchhiking, the pair escape through Albany, New York and are taken in by a farmer named Irv Manders near Hastings, New York; however, they are tracked down by Shop agents, who attempt to kill Andy and take Charlie at the Manders farm. At Andy's instruction, Charlie unleashes her power, incinerating the entire farm and fending off the agents, killing a few of them. With nowhere else to turn, the pair flees to Vermont and take refuge in a cabin that had once belonged to Andy's grandfather. With the Manders farm operation disastrously botched, the director of the Shop, Captain James Hollister, or ""Cap"", calls in a Shop hitman named John Rainbird to capture the fugitives. Rainbird, a Cherokee and Vietnam veteran, is intrigued by Charlie's power and eventually becomes obsessed with her, determined to befriend her and eventually kill her. This time the operation is successful, and both Andy and Charlie are taken by the Shop. The pair is separated and imprisoned at the Shop headquarters. With his spirit broken, Andy becomes an overweight drug addict and seemingly loses his power, and is eventually deemed useless by the Shop. Charlie, however, defiantly refuses to cooperate with the Shop, and does not demonstrate her power for them. Six months pass until a power failure provides a turning point for the two: Andy, sick with fear and self-pity, somehow regains the push - subconsciously pushing himself to overcome his addiction - and Rainbird, masquerading as a simple janitor, befriends Charlie and gains her trust. By pretending to still be powerless and addicted, Andy manages to gain crucial information by pushing his psychiatrist. Under Rainbird's guidance, Charlie begins to demonstrate her power, which has grown to fearsome levels. After the suicide of his psychiatrist, Andy is able to meet and push Cap, using him to plan his and Charlie's escape from the facility, as well as finally communicating with Charlie. Rainbird discovers Andy's plan, however, and decides to use it to his advantage. Andy's plan succeeds, and he and Charlie are reunited for the first time in six months. Rainbird then interrupts the meeting at a barn, planning to kill them both. A crucial distraction is provided by Cap, who is losing his mind from a side effect of being pushed. Andy pushes Rainbird into leaping from the upper level of the barn, breaking his leg. Rainbird then shoots Andy in the head. Rainbird then fires another shot at Charlie, but she uses her power to melt the bullet in midair and then sets Rainbird and Cap on fire. A mortally wounded Andy then instructs Charlie to take revenge with her power and inform the public, to make sure the government cannot do anything like this ever again, and dies. A grief-stricken and furious Charlie then sets the barn on fire. She exits the barn and people start going after her. She uses her pyrokinesis to kill the employees and blow up their getaway vehicles. People try to flee and some do. Military men are called, but Charlie blows up their vehicles and when they fire at her she melts their bullets. Charlie blows up the building, shooting it sky-high. She leaves the Longmont facility burning, with almost all of its workers dead. The event is covered up by the government, and released to the papers as a terrorist firebomb attack. The Shop quickly reforms, under new leadership, and begins a manhunt for Charlie, who has returned to the Manders farm. After some deliberation, she comes up with a plan and leaves the Manders', just ahead of Shop operatives, and heads to New York City. She decides on Rolling Stone magazine as an unbiased, honest media source with no ties to the government, and the book ends as she arrives to tell them her story.",0
535765,Rage,Stephen King,UNK,"{""/m/014dfn"": ""Speculative fiction"", ""/m/03npn"": ""Horror""}","Charlie Decker, a Maine high school senior, is called to meeting with his principal over a previous incident in which Decker attacked his chemistry teacher with a heavy wrench. For unknown reasons, Charlie subjects the principal to a series of insulting remarks, resulting in his expulsion. Charlie storms out of the office and retrieves a pistol from his locker, setting its contents on fire. He then returns to his classroom and fatally shoots his Algebra teacher. The fire triggers an alarm, but Charlie forces his classmates to stay in the classroom, killing another teacher when he enters. As the students and teachers evacuate the school, police and media arrive at the scene. In the following four hours, Charlie toys with various authority figures who attempt to negotiate with him, including the principal, the school psychologist, and the local police chief. Charlie gives them certain commands, threatening to kill students if they do not comply. Charlie also admits to his hostages that he does not know what has compelled him to commit his deeds, believing he will regret them when the situation is over. As his fellow students start identifying with Charlie, he unwittingly turns his class into a sort of psychotherapy group, causing his schoolmates to semi-voluntarily tell embarrassing secrets regarding themselves and each other. Interspersed throughout are narrative flashbacks to Charlie's troubled childhood, particularly his tumultuous relationship with his abusive father. Several notable incidents include a violent disagreement between two female students, and a SWAT team sniper shooting Charlie in the chest. However, Charlie survives due to the bullet striking his locker's padlock, which he had earlier placed in his shirt pocket. Charlie finally comes to the realization that one student is really being held there against his will: a seeming ""big man on campus"" named Ted Jones, who is harboring his own secrets. Ted realizes this and attempts to escape the classroom, but the other students brutally assault him, driving him into a battered catatonic state. At 1:00 PM, Charlie releases the students. When the police chief enters the classroom, he shoots the now-unarmed Charlie when he attempts suicide by cop. Charlie survives and is found not guilty by reason of insanity, committed to a psychiatric hospital in Augusta until he is no longer a threat to society. The story ends with Charlie addressing the reader, ""I have to turn off the light now. Good night.""",0
535861,The Regulators,Stephen King,1996-09-24,"{""/m/06n90"": ""Science Fiction"", ""/m/014dfn"": ""Speculative fiction"", ""/m/03npn"": ""Horror""}","The story takes place in the fictional town of Wentworth, Ohio, a typical suburban community. On Poplar Street, an autistic boy named Seth has gained the power to control reality through the help of a being known as Tak. Soon, Poplar Street begins to change shape, transforming from a quiet suburb into a wild west caricature based on what Seth has seen on his television. Meanwhile, the other residents of the street are being attacked by the many beings that Seth's imagination is creating, due to Tak's control over them. These residents are forced to work together to stop Seth and Tak from completely transforming the world around them and stop Tak before he kills anyone else. Seth's imagination is heavily influenced by a western called The Regulators and a cartoon called MotoKops 2200. The novel contains excerpts from scripts for both.",0
536064,The Two Georges,Harry Turtledove,UNK,"{""/m/0mz2"": ""Alternate history"", ""/m/06n90"": ""Science Fiction"", ""/m/014dfn"": ""Speculative fiction"", ""/m/02xlf"": ""Fiction""}","For more than two centuries, what would have become the United States and Canada has been the North American Union, a territory encompassing the northern portion of the continent except Alaska, retained under the rule of Russia. The Two Georges, a Gainsborough painting, commemorates the agreement between George Washington and King George III that created this part of the British Empire. The painting itself has become a symbol of national unity. While being displayed in New Liverpool, the painting is stolen while a crowd is distracted by the murder of ""Honest"" Dick (a.k.a. ""Tricky"" Dick), the Steamer King, a nationally-known used car salesman. Colonel Thomas Bushell of the Royal American Mounted Police leads the search for the painting, accompanied by its former curator Dr. Kathleen Flannery and Captain Samuel Stanley. Some days later, a ransom note is received from the Sons of Liberty, a terrorist organization that wants to see America independent of Britain. The Governor-General of the North American Union, Sir Martin Luther King, informs Bushell in confidence that the painting must be recovered before King Charles III's state visit, or the government will have to pay the Sons' ransom demand of fifty million pounds. The search takes Bushell, Flannery, and Stanley across the country via airship (an advanced form of dirigible), train, and steamer. They also meet many members of the Sons of Liberty, including Boston newspaper editor John F. Kennedy. After chasing many false leads and the wrong suspects, Bushell and his associates arrive at Victoria and find The Two Georges an hour before the King arrives. They also uncover the true culprits: the Holy Alliance, a union of France and Spain controlling almost everything from the Rio Grande to Cape Horn, and Bushell's superior officer and covert fanatic Sons of Liberty sympathizer, Lieutenant General Horace Bragg. Bushnell then thwarts Bragg's two tries to assassinate the King. Bragg is sent to the gallows, while Bushell and Stanley are both knighted by the King for their accomplishments.",0
536586,The Adventure of the Lion's Mane,Arthur Conan Doyle,UNK,UNK,"Holmes is enjoying his retirement in Sussex when one day at the beach, he meets his friend Harold Stackhurst, the headmaster of a nearby preparatory school called The Gables. No sooner have they met than Stackhurst's science master, Fitzroy McPherson, staggers up to them, obviously in agony and wearing only an overcoat and trousers. He collapses, manages to say something about a ""lion's mane"", and then dies. He is observed to have red welts all over his back, administered by a flexible weapon of some kind, for the marks curve over his shoulder and round his ribs. Moments later, Ian Murdoch, a mathematics teacher, comes up behind them. He has not seen the attack, and has only just arrived at the beach from the school. Holmes sees a couple of people far up the beach, but thinks they are much too far away to have had anything to do with McPherson's death. Likewise, the few fishing boats off the beach are too far out. It emerges that Murdoch and McPherson were friends, but had not always been. Murdoch is an enigmatic fellow with an occasional bad temper. He once threw McPherson's dog through a plate-glass window, for instance. Despite this, Stackhurst is sure that they were friends. McPherson also had a lover, and on further investigation, it turns out that Maud Bellamy was McPherson's fiancée. A note confirming a meeting with her was found on McPherson, but it gave no clear details. Holmes goes to look at the lagoon formed by a recent storm that local men have been using as a bathing pond. He sees McPherson's towel lying there dry and concludes that he never went into the water. Holmes arranges to have the caves and other nooks at the foot of the cliffs searched, expecting that that will turn up nothing and no-one. He is right. Stackhurst and Holmes decide to go and see Miss Bellamy to see whether she can shed any light on this perplexing mystery. Just as they are approaching The Haven, the Bellamys' house, they see Ian Murdoch emerge. Stackhurst demands to know what he was doing there, and an angry exchange ensues with Murdoch declaring in effect that it was none of Stackhurst's business. Stackhurst loses his temper and sacks Murdoch on the spot. He storms off to get ready to move out. They visit the Bellamys and find an amazingly beautiful woman in Maud Bellamy, but two most unpleasant men in her father and muscular brother. It seems that they did not approve of the liaison between Maud and McPherson. They do not even find out about the engagement until this meeting, such has been the secrecy of their affair. Maud says that she will help however she can, but it does not seem likely that she can do anything. It emerges, however, that Ian Murdoch was once a potential suitor to Miss Bellamy. Holmes begins to suspect that Murdoch may be responsible for McPherson's death, out of jealousy. A further mystifying clue presents itself when McPherson's dog is found dead at the very pool where McPherson met his end. It obviously died in agony, much as its master did. At this point, Holmes begins to suspect something else. The dead man's dying words, ""lion's mane,"" have triggered a memory, but he cannot quite call it back to mind. Inspector Bardle of the Sussex Constabulary visits Holmes to ask if there is enough evidence to arrest Ian Murdoch. Holmes is sure that there is not. The case is most incomplete, especially as Murdoch has an alibi. He also could not have singlehandedly overcome McPherson, who was quite strong, despite having heart trouble. The two men also consider McPherson's wounds. The weals actually looked as though they may have been administered by a hot wire mesh, or perhaps a cat o' nine tails. Holmes has formed a theory which might explain McPherson's death and is about to go back to the bathing pond to test it. As he is about to leave, Murdoch arrives, helped in by Stackhurst, who is afraid that Murdoch might be dying; he fainted twice in pain. He has the same wounds on him that McPherson had. In great agony, he calls for brandy, passes out, but finally recovers. At the bathing pond, Holmes spots the murderer: it is a Lion's Mane Jellyfish (Cyanea capillata), a deadly creature about which Holmes has read. Holmes takes a rock and kills it. He shares the story by John George Wood of an encounter with just such a jellyfish with the other men. Murdoch is exonerated, of course. It turns out that he was acting as a go-between for McPherson and Maud, and did not wish to discuss it with anyone. The story ends on an upbeat note as Stackhurst forgives Murdoch and gives him his job back.",0
537049,Oryx and Crake,Margaret Atwood,UNK,"{""/m/026ny"": ""Dystopia"", ""/m/06n90"": ""Science Fiction"", ""/m/014dfn"": ""Speculative fiction"", ""/m/05hgj"": ""Novel"", ""/m/0c082"": ""Utopian and dystopian fiction""}","The novel begins after the collapse of civilization by an event that is not immediately identified. The protagonist is Snowman, a post-apocalyptic hermit character. He resides near a group of what he refers to as Crakers—strange human-like creatures. They bring Snowman food and consult him on matters that surpass their understanding. In addition, strange hybrid beasts such as wolvogs, pigoons and rakunks roam freely. As the story develops, these assorted lifeforms are revealed to be the products of genetic engineering. In flashbacks, we learn that Snowman was once a young boy named Jimmy, who grew up in the near, yet undefined past. His world was dominated by multinational corporations which kept their employees' families in privileged compounds separated from a global lower moiety of pleeblands. Shortly after Jimmy's family moved to the HelthWyzer corporate compound (where his father worked as a genographer) Jimmy met and befriended Glenn (referred to throughout the novel as Crake), a brilliant science student. Jimmy and Crake spend a lot of their leisure time playing online computer games such as Kwiktime Osama (a reference to Osama bin Laden) and Blood and Roses, smoking ""skunkweed"", or watching live executions, Noodie News, frog squashing, graphic surgery and child pornography. One of Crake's favourite pastimes is an online game called Extinctathon, a trivia game which requires immense knowledge of extinct animal and plant species. Using the codenames ""Thickney"" (Jimmy) and ""Crake"" (Glenn), they both play as teenagers. It is not until they are both in university that Jimmy discovers that Crake has advanced through the game to become a Grandmaster of Extinctathon. On another trip through the dark underbelly of the Web, they come across an Asian child pornography website, where Jimmy is struck and haunted by the eyes of a young girl. The two male characters pursue different educational paths: Crake attends the highly respected Watson-Crick Institute where he studies advanced bioengineering, but Jimmy ends up at the loathed Martha Graham Academy, where students study literature and the humanities, which are not valued fields of study except for their commercial and/or propaganda applications. After finishing school, Jimmy ends up writing ad copy, while Crake becomes a bioengineer. Crake uses his prominent position at the biotechnology corporation to launch a project to create the Crakers. His goal is to create a peaceful society where people will live harmoniously with each other and nature. These genetically engineered humans are leaf and grass-eating herbivores who only have sexual intercourse during limited breeding seasons when they are polyandrous. Crake eventually finds the girl from the child pornography website (or a woman who could be her) and hires her, as both a prostitute for himself, and a teacher for the Crakers. She takes the pseudonym Oryx, derived from the entry for Oryx beisa in Extinctathon. Jimmy identifies the haunting memory of the young girl with Oryx, though it is never made clear whether or not the two are the same person. Oryx eventually becomes intimately involved in the lives of Jimmy and Crake, and both fall in love with her. Oryx, however, views their relationship as strictly professional and only admires Crake as a scientist and ""great man"". For fun and affection she turns to Jimmy, though her feelings for him are not as clear. The two hide their relationship from Crake, and Jimmy is often plagued with the thought of Crake finding out about his betrayal. At the same time, Crake creates a virulent genetic pandemic disguised as a prophylactic agent that, apparently, killed off most humans except for Jimmy. Jimmy was unknowingly vaccinated by Crake with the intention of acting as a guardian for the Crakers. Crake's rationale is that he is heroically saving intelligent life from an inevitably dying society. In the story's climax, Crake's perfected ""hot bioform"", present in one of his company's products, is activated and spreads throughout the world. During the chaos, Crake presents himself to Jimmy, then kills Oryx by slitting her throat. Jimmy shoots Crake, resulting in his being left to obsess over his vanished world and unanswered questions. Jimmy contemplates abandoning the Crakers but is constantly haunted by the voice of Oryx, and reminded of his promise to her to watch over them. Snowman instills the Crakers with his own invented religion revolving around Crake and Oryx. Oryx becomes the guardian of the animals and Crake the creator god. During Snowman's journey to scavenge supplies, he is uncomfortable wearing shoes now that his feet have become toughened without them. He cuts his foot on a tiny sliver of glass. Infected by some descendant of transgenic experiments, his body cannot fight back, and his foot becomes inflamed. Returning to the Crakers, he learns that three ragged true humans have camped nearby. He follows the smoke from the fire and watches as they cook a rakunk. Uncertain of how he should approach them (Blast them to bits to protect the Crakers? Approach with open arms?) he checks his now not-working watch and thinks, ""Time to go,"" leaving the reader to speculate as to what his actions and future will be.",0
537301,Temple,Matthew Reilly,1999-08,"{""/m/01jfsb"": ""Thriller"", ""/m/017rf8"": ""Techno-thriller"", ""/m/014dfn"": ""Speculative fiction"", ""/m/02xlf"": ""Fiction"", ""/m/05hgj"": ""Novel""}","Professor William Race is a young linguist, working for NYU. One day, he is approached by a retired Col. Frank Nash, a physicist from the Defence Advanced Research Projects Agency, or DARPA, to translate a manuscript written in ancient Latin. Initially, Race is reluctant because Nash only describes what is required from him on the most vaguest terms and does not appear to be interested in the alternatives Race gives him. Race is relectant to join even when he hears that his brother, Marty, was the one who suggested his name. What clinches it, is that when Nash mentions the names of the civilians who are going to be on the trip, one of the names turns out to be Race's college sweetheart, Lauren, who left him many years ago. In a sudden impulse to see what she has done with herself, Race agrees to join the team. Nash assigns Van Lewen, a Sergent in the Green Berets, as Race's bodyguard and they move to the airport to fly to Peru. En route, Nash provides Race with photocopied pages of what turns out to be a copy of the Santiago Manuscript, which describes the adventures of Alberto Santiago a Spanish missionary in Peru whilst also holding the key to the final resting place of a legendary Incan idol, allegedly made of thyrium-261, an element that, when combined with the mass destruction weapon the Supernova, would destroy a third of the Earth's mass throwing it off from the orbit and effectively killing the planet. The team lands in Peru with mission leader Frank Nash, physicist Troy Copeland, archaeologist Gaby Lopez, anthropologist Walter Chambers, five Green Berets, his personal bodyguard, and his college sweetheart. But when the manuscript leads the team to an ancient Incan temple, the hunt becomes a fight for survival when their raid of the temple is taken over by hostile German terrorists. And the situation becomes even worse for Race and the team when an army of giant ""rapa"" cats, hellbent on ripping throats, snapping spines and mauling anyone who comes near them. Can Race lead the team to the idol, or is he leading them into disaster, and violent death?",0
