id,title,author,published_date,categories,summary,page_count
10601195,Hrolf Kraki's Saga,Poul Anderson,1973,"{""/m/014dfn"": ""Speculative fiction"", ""/m/01hmnh"": ""Fantasy""}","The story is presented as if related by a female story-teller in an Anglo-Saxon court, the author feeling it would have been about that time that the legend would have reached its fullest development, and such a teller would have been least likely to abbreviate it. The Danish king Halfdan is murdered and his position usurped by his brother Frodhi. Halfdan's young sons Helgi and Hroar go into hiding to escape his fate, successfully eluding Frodhi until they reach adulthood and can take vengeance on their father's killer. On attaining the kingship themselves they rule together. Helgi, a warrior and sea-rover, visits the equally warlike queen of the Saxons, whom he woos overbearingly. Sent packing, he later returns and rapes her, a union resulting in a daughter, Yrsa, who years later becomes an instrument of vengeance when Helgi encounters and marries her. Only after they are wed does her mother reveal Yrsa's parentage. Haunted, Yrsa leaves Denmark to wed Adhils, King of the Swedes, and Helgi is ultimately killed in battle attempting to win her back. Hrolf, the son of Helgi and Yrsa, is raised in the household of Hroar, becoming his adherent and supporter. After Hroar's death Hrolf eventually becomes his successor. He builds up the realm and assembles a band of famous warriors, most notably Hjalti and Bodvar Bjarki, a were-bear and one of a trio remarkable brothers, the others being Elk-Frodhi and Thorir Houndsfoot. The story goes on to relate the personal tales of these champions. After a reign notable for prosperity at home and successful war abroad, Hrolf visits the court of Adhils to see his mother and attain recompense for his father's death. Feigning hospitality, Adhils does his best to destroy his unwanted visitors through rigged tests of their prowess, while Yrsa warns Hrolf of his treachery. At length the animosity is brought into the open and the Danes fight their way out of Adhil's stronghold, taking his treasure with them. Pursued by the Swedes, they scatter the treasure along the ground to delay them and successfully escape. This ""sowing"" of the field of Fyrisvellir later becomes a famous incident in Norse legend. But during this adventure Hrolf has managed to offend the treacherous god Odin, giver of victory. He returns to Denmark knowing he must henceforth avoid war, as his luck in battle has left him. The end comes through treachery from Hrolf's half-elven half-sister Skuld, a witch married to Hjorvard, one of his sub-kings. Inciting her husband to revolt, they secretly raise an army and rise suddenly, besieging Hrolf in his hall. Hrolf's champions are roused from sleep and rallied by the chanting the Bjarkamál, a famous Old Norse poem whose origins supposedly lie in this event; it has been largely lost, but Anderson presents a partial reconstruction as part of his story. Hrolf's warriors fight valiantly, but the witchcraft of Skuld prevails, and after a long, terrible battle the defenders fall. Hjorvard does not last long as king, being killed by Vogg, a weakling Hrolf had befriended who in consequence had sworn to avenge him. Skuld herself is soon overthrown by an army led by Elk-Frodhi and Thorir Houndsfoot, come to avenge their brother Bodvar Bjarki. The realm goes to pieces, to be eventually pulled back together in part by a remote kinsman of Hrolf's.",0
10602330,"To Sir, with Love",E. R. Braithwaite,1959,"{""/m/012jgz"": ""Autobiographical novel""}","Ricky Braithwaite is a British Guiana-born engineer who has worked in an oil refinery in Aruba. Coming to Britain on the verge of World War Two, he joins the RAF as aircrew. Demobbed in 1945, he is unable to find work, despite his qualifications and experience, meeting overt anti-black attitudes. But after discussing his situation with a stranger whose name he never learns, he applies for a teaching position and is assigned to Greenslade School, a secondary school in London's East End. Most of the pupils in his class are totally unmotivated to learn and largely semi-literate and semi-articulate. But he persists, despite finding that they are unresponsive to his approach. Braithwaite decides to try a new approach, and sets some ground rules. The students will be leaving school soon, and will enter an adult society, so he will treat them as adults, and allow them to decide what topics they wish to study. In return, he demands their respect as their teacher. This novel approach is initially rejected, but within a few weeks, the class is largely won over. He suggests out-of-school activities, including visits to museums, which the kids have never thought about before. A young teacher, Gillian Blanchard, volunteers to assist him on these trips. Some of the girls start to speculate whether a personal relationship is budding between Braithwaite and Gillian. The trip is a success and more are approved by the initially sceptical Head. The teachers and the Student Council openly discuss all matters affecting the school and what is being taught. The general feeling is that Braithwaite's approach is working, although some teachers still advocate a tougher approach to the kids. The mother of one of the girls comes to speak to Braithwaite, feeling that he has more influence than she has with her impressionable daughter, who is staying out late and might be getting into trouble. In the meantime, Braithwaite and Gillian are deeply in love and are discussing marriage. Her parents are openly disapproving of a 'mixed-race' marriage, but realise that they're serious and both intelligent people who know what they are doing. de:To Sir, With Love tr:Öğretmenimize Sevgilerimizle",0
10605939,The Ascent of Rum Doodle,William Ernest Bowman,UNK,"{""/m/014dfn"": ""Speculative fiction""}","The narrator, ""Binder"" (his radio codename), is asked by the ""Rum Doodle Committee"" and its chairman, ""Sir Hugeley Havering,"" to lead an expedition to climb ""Rum Doodle"", the highest mountain in the world (with an elevation of 40,000 and 1/2 feet), in the remote (fictional) country of ""Yogistan"". He assembles a team of climbers to play all the roles seen in the parodied literature: * Burley, the ""strong man""; * Constant, the ""linguist""; * Jungle, the ""route finder""; * Prone, the ""physician""; * Shute, the ""photographer""; * Wish, the ""scientist."" It rapidly develops that each of the climbers is utterly inept in his nominal field of competence, as they demonstrate in a series of chaotic adventures en route to Yogistan; for example, Prone endures a never-ending series of illnesses, while Constant mispronounces a Yogistani word (the language hinges on variously ""pronounced"" belches and gastrointestinal rumbles) and offends a ""short but powerful"" Yogistani wielding a knife, having informed him that he lusted for the man's wife — not his intention at all. Binder handles these mishaps with typically British aplomb, having been reassured by the expedition's sponsor that ""to climb Mont Blanc by the Grépon route is one thing; to climb Rum Doodle is, as Totter once said, quite another."" Somehow the group does make it to Yogistan, where they hire Yogistani porters, parodies of the Sherpas who were the indispensable indigenous porters and mountain guides (and sometimes climbing partners) to many of the great mountaineering expeditions. However, the Yogistanis do not share the invariable positive attributes of the Sherpa — quite the contrary. Hijinks ensue, as the expedition cook, ""Pong"", produces food so inedible that the expedition tries (unsuccessfully) to continue on up the mountain without him; the inevitable fall into a crevasse leads to the consumption of the party's champagne (brought along to celebrate reaching the summit and for ""medicinal purposes"") during the rescue attempt; and scientist Wish embarks on a never-ending quest for ""Wharton's warple"", an endangered species indigenous to the mountains. Eventually, Binder and a colleague manage to stumble to the top of the lofty spire the group has been approaching ... only to find that they have climbed the wrong mountain (and to see the porters, with Prone in tow, climbing the right one).",0
10608174,Curious George Flies a Kite,H. A. Rey,1958,"{""/m/0dwly"": ""Children's literature""}","One day, George is left alone at his house, and of course he is curious. As he is looking out the window he sees a tiny house he wants to explore. Curious George jumps out the window, crawls over a fence and makes his way to the small house he sees. Inside the house are many bunny rabbits, and George accidentally lets one out. He struggles for a bit but finally is able to get the bunny back into the house. As he is walking back, he sees a man fishing and wants to join. As George is trying to fish, he falls in and a neighbor boy named Bill comes to help him as he gets out of the water. Bill is very friendly and wants to show George his new kite. George loves the kite and Bill trusts George to watch the kite while he leaves to get his bicycle. Of course, George is curious so he begins to fly the kite. At first he thinks it will be OK but soon the kite takes off, along with George. Curious George flies high up in the sky, and has to be rescued by the Man in the Yellow Hat in a helicopter. He returns the kite to Bill who then rewards George with his very own pet bunny from the bunny house he explored in the beginning of the book.",0
10609869,The Queen of Air and Darkness,T. H. White,1939,"{""/m/014dfn"": ""Speculative fiction"", ""/m/01hmnh"": ""Fantasy""}","The Queen of Air and Darkness is the second book in the four-part work The Once and Future King which chronicles White's own version of the legend of King Arthur. Although it is the shortest book in the series, it is a vital point in the story for several reasons: *Arthur invents the idea of the Round Table, which was central to the plot of the third and fourth books. *Arthur also defeats barons those rebelling against him, thereby securing his role as king. *Arthur's understanding of ""might vs. right"" is explored more deeply in this book. *The Orkney faction is introduced. These four children (Gawain, Agravaine, Gaheris, and Gareth) become major characters for the rest of White's work. *King Pellinore gets married and has several children who will become important in The Ill-Made Knight. The novel begins with the four Orkney children, Gawaine, Agravaine, Gaheris, and Gareth, telling each other stories late at night. As they speak, it becomes clear that they have great respect and love for their mother, the beautiful Queen Morgause, although she does not devote herself entirely to motherhood, but has a desire to understand and unlock her magical powers whilst her husband, King Lot, is off to war against King Arthur. We also learn that Arthur's father, Uther Pendragon, had raped Morgause's mother, Igraine, making Morgause Arthur's half-sister (although no one is yet aware of this fact except for Merlyn, who had forgotten to tell it to Arthur). Arthur is still being tutored by Merlyn, although the relationship between the two has changed. Instead of seeing Merlyn as an almighty sage, Arthur treats him as more of a friend throughout the novel. Despite this, Merlyn still attempts to teach Arthur how he can create a perfect society out of his newly-formed kingdom. Arthur is unimpressed, and would rather be off fighting wars than taking care of peasants. Meanwhile, back in the Orkney Isles, the four Orkney children are bored and seek a story from their own tutor, St. Toirdelbach, a very different teacher from Merlyn. He tells them a story, but quickly becomes annoyed with the boys, and threatens to hit them with his shelleleigh if they refuse to leave him alone. This is one of White's best examples of how different the loveless childhoods of the Orkney children were from the happy childhood of Arthur. As the children are walking on the beach after visiting St. Toirdelbach, Sir Grummor Grummursum and King Pellinore arrive on the shore in a magic barge. Along with them is a Saracen knight named Sir Palomides who has apparently befriended them between the previous book and their arrival on the Orkney islands. The trio had previously been in Flanders where Pellinore fell in love with the Queen of Flander's daughter. The knights entered the boat and had been unable to turn it around, causing Pellinore to become so lovesick, he no longer wishes to hunt the Questing Beast, his lifelong passion. Arthur, meanwhile, is preparing for the battle against Lot's Gaelic warriors which lies ahead. He has begun to buy into the idea of chivalry, and of ""might vs. right."" He announces to Merlyn that he plans to first put down Lot's rebellion and then use that power to enforce justice throughout his kingdom. Morgause is pleased that the three bumbling knights have landed because they have no idea that England is at war with Orkney. She takes advantage of their ignorance and attempts to make them fall in love with her. She attempts an unsuccessful unicorn hunt with the knights. The boys consult St. Toirdelbach and then attempt to catch a live unicorn to present to their mother. They almost succeed but Agravaine kills the unicorn in a fit of rage (the boys were pretending the virgin who lured the unicorn was their mother and Agravaine hated the unicorn for touching their ""mother""). The other three brothers are angry, as they believe Agravaine has ruined their chances of getting a reward from their mother. Only Gareth feels sorry for the unicorn. Morgause is not pleased at all that they succeeded where she failed; on the contrary, she has them whipped. Meanwhile, on the plains of Bedegraine, Arthur is making final preparations for his battle. Arthur announces his idea of the round table, and Merlyn informs Arthur that another king has such a table. Ironically, this king is the father of Arthur's future wife, Guenever (sic). Sir Kay, Arthur's foster-brother, says that he believes that if war will help the conquered race to live a better life, they should be conquered. Merlyn angrily informs him that there is a certain Austrian who shared Kay's views, and ""plunged the world into bloody chaos."" This is an allusion to Adolf Hitler. Sir Palomides and Sir Grummore, concerned about King Pellinore's lovesickness, plan to impersonate the Questing Beast and lure him back to chasing it. Their plan backfires when the real Questing Beast appears and chases them; they spend the night caught half-way up a cliff. Morgause, frustrated that the knights have not fallen for her, decides that her children matter more to her. Gareth rushes to the stables to tell his brothers that she loves them, and he arrives to find that Gawaine and Agravaine are in a heated argument. Agravaine wants to send a letter to Lot, informing him of the three knights and telling Lot that Morgause is cheating on him. Gawaine is infuriated by the idea, and he considers it betrayal to their mother. The argument ends when Agravaine threatens Gawaine with a hidden knife, and Gawaine nearly kills him. White explains that Gawaine was never able to get over these kind of sudden passions he underwent, and that they would plague him for life. Merlyn knows that his time with Arthur is nearly up, as he will soon be locked up for a thousand years. Arthur is distressed, and asks why Merlyn can't avoid the imprisonment that awaits him. Merlyn tells Arthur a parable which explains that no-one can escape fate (the famous story of a man who learns of his death, then rides to escape death, but ends up running into Death while escaping.) He also warns Arthur about Guinvere and Lancelot, but Arthur is too saddened by Merlyn's departure to take the warning to heart. Early the next morning, King Pellinore is walking alone on the beach when he spots Palomides and Grummore stuck on the cliff, with the Questing Beast waiting for them below. He explains that the beast has fallen in love with them (as she thinks that they are her mate when they were in disguise), and refuses to slay the creature. He simply holds it down while Grummore and Palomides escape to Morgause's castle. Pellinore is reunited with Piggy, the daughter of the Queen of Flanders. He returns to the castle to find that the Questing Beast is waiting outside the castle. Around this same time, Merlyn has begun his journey to find Nimue and passes by them. He advises the pair of knights to psychoanalyse the Questing Beast. They do so, but it backfires and the Questing Beast falls in love with Sir Palomides instead. Pellinore gives up chasing the beast then and Sir Palomides takes up the job. Arthur has engaged Lot in a fateful battle which would determine who would rule Britain. Arthur overcomes Lot with a sneaky ambush in the night, despite Lot's larger number of soldiers. Contrary to the code of ""chivalric"" battle (or White's version, at any rate) he also attacks the enemy knights first rather than the foot soldiers. Arthur seemingly finally realizes the wrong behind slaughtering the peasants for the fun of the rich knights, as Merlyn had insisted in his lessons. Assisted by the French noblemen, Ban and Bors, Arthur wins the battle. The defeated Lot returns home, and the three English knights are shocked to learn that Orkney has been at war with England. Morgause heads south to England in order to reconcile with the English, and brings with her children and the three knights. Arthur holds Pellinore's wedding to Piggy, as he remembers Pellinore fondly as being the first knight he ever met. At the same time, St. Toirdelbach also has a marriage. After the ceremony, Morgause seduces Arthur and becomes pregnant. It is then that Merlyn, far away in North Humberland, remembers that he had forgotten to tell Arthur that Morgause was Arthur's half-sister. Therefore, Arthur's adultery is also incest, a very grave sin. Morgause becomes pregnant with Mordred, who will one day come to ruin his father's kingdom.",0
10610261,Dragons of Glory,UNK,UNK,UNK,"Dragons of Glory is both a sourcebook and a strategic-level board wargame which depicts the overall war between the draconians and the defenders of Krynn. The set describes the war and the opposing armies, using Battlesystem statistics for both sides. Dragons of Glory is a simulation game, designed to allow players to produce their own historical timeline of the events in the world of Krynn for an ongoing Dragonlance campaign. By keeping a record of forces' positions over time, news can be related to the player characters, who can encounter various armies, creatures, or leaders at appropriate points.",0
10610909,Dreamside,Graham Joyce,2001-03,"{""/m/014dfn"": ""Speculative fiction"", ""/m/01hmnh"": ""Fantasy""}","The novel opens in February 1986 with Lee Peterson waking up and going about his daily routine before heading to work. But something is off. Lee takes an egg from the refrigerator and tries to break it into a frying pan. It doesn't break. He tries again; it wobbles. Lee then wakes up. He begins his routine again only to wake up again. This happens a number of times, like the peeling of one layer of onion off another. Lee calls these occurrences repeaters. The phone rings and he wakes up again to hear a voice that he hadn't heard since his college days: Ella Innes. The first thing they say to each other is that it's happening again. They thought they could escape Dreamside only to find that over ten years later, it is once again worming its tendrils back into their lives. Lee and Ella meet to discuss why this was happening to them now and what to do about it. Believing that either Brad or Honora is traveling to Dreamside and causing the effects to manifest in the others, Ella convinces Lee that they must find their other two classmates. Lee reluctantly agrees to go find Brad while Ella searches for a reclusive Honora. The novel flashes back twelve years earlier to April 1974 when Lee, wanting desperately to start a conversation with Ella, joins a lucid dreaming study that she shows interest in. The group consists of a variety of students, some pretending that they lucid dream and those that legitimately can. Over the semester, the group dwindles to a few students. At the end, Professor L.P. Burns picks Ella and Lee along with Brad and Honora. Burns' decision to select two pairs of the opposite sex may have been deliberate: over the course of the study, Lee and Ella become intimate. Brad, an obnoxious yet skilled lucid dreamer, wishes the same scenario between him and the shy Honora. The professor is conducting a double-blind study. The lucid dreaming serves as a distraction to study group dynamics. However, Burns' interest in the dream data increases as the four began showing promising results with the exercises. Brad and Ella are the first to contact one another in a shared lucid dream. The dreamscape mirrored a park setting that the couple had copulated in near the beginning of their relationship. Brad and Honora have less luck. The Professor, wishing to set the foundation for a share dream space between the four, takes the students for a weekend vacation to a rural cabin owned by a colleague of his. A few miles down the road is a scenic lake with a single ancient tree leaning over it. After the trip, the four finally meet in Dreamside. This world vaguely mimics the lake area. As Lee and Ella perform sexual experiments in Dreamside, Brad aggressively pursues Honora in hopes of being able to experience what the other couple is. Honora rejects him, saying that she wishes to remain a virgin. Brad argues that it wouldn't count in Dreamside. Around this same time, the group discovers certain frightening aspects of Dreamside. If they stop paying attention to themselves, the dreams begin to meld and sink into the ground, water, or tree. Also, the occurrence of repeaters have increased. The students feel as if the waking world and the dreaming world are beginning to interweave. Concerned, Professor Burns decides to bring the experiment to a conclusion. Before the matter can be discussed further, the students find out the next day that Burns has died. Against Professor Burns' wishes, Brad, Lee, and Honora decide to continue the experiments. During one particular session, Brad finally forces himself upon Honora in Dreamside and rapes her. Honora wakes up in her own bed to find that her sheets are stained with blood. At this point Honora goes into seclusion and withdraws from any more experiments. The novel flashes back into the present where Ella finds Honora who is now a grade school teacher. Honora confides with Ella that she had a miscarriage in the real world, but gave birth to a daughter in Dreamside. This girl, who is now approximately twelve years of age, is now making appearances in the waking world. The four dreamers meet together in the real once again and try to figure out how to rectify the problem they left behind. Then one night they are all pulled in back to Dreamside. The world is now ice-covered and barren. A hurricane-strength storm whips through the dream and in the middle of it, they find Honora and Brad's daughter. They try to escape, but the storm rages on. Honora lets go of the others, saying that the girl wants her to join her in the raging waters. Brad chases after her and pulls her from the water before either falling or jumping in. He's never found, in either world.",0
10613695,Knitting Under the Influence,UNK,UNK,UNK,"Sometimes it feels like their weekly knitting circle is the only thing that keeps Kathleen, Sari, and Lucy from falling apart. Their fine-gauge scarves may look fabulous, but their lives are starting to unravel... For years, beautiful, flighty Kathleen has been living off of her famous actress sisters. When she moves out, she misses her life of luxury and begins to think that marrying rich might be an easy way to get it back. Lucy is dating the man of her dreams-gorgeous, a brilliant scientist, going places-but when an animal rights group targets him, she wonders whose side she's really on. And Sari finds herself suddenly face-to-face again with the ""it"" boy from high school who still has ""it""- he's gorgeous, sensitive, and kind, and he has a son who needs Sari's help. But can she ever forgive him for what he did to her brother a decade ago? Caught between life, love, and pursuit of the perfect cast-on, these three friends learn that there are never any easy answers, except maybe one-that when the going gets tough, the tough gets knitting.",0
