id,title,author,published_date,categories,summary,page_count
9045476,Thrice Upon a Time,James P. Hogan,1980-03,"{""/m/03lrw"": ""Hard science fiction"", ""/m/07s2s"": ""Time travel"", ""/m/014dfn"": ""Speculative fiction"", ""/m/06n90"": ""Science Fiction"", ""/m/02xlf"": ""Fiction""}","It is December 2009. Murdoch Ross and his friend Lee Francis Walker visit Murdoch's grandfather, Sir Charles Ross, in his castle in Storbannon, Scotland. Sir Charles is a Nobel Prize winner for his work in particle physics — more specifically the isolation of free quarks. In this novel, when a nucleon decays into three quarks, the first two quarks appear immediately, while the third quark appears only a brief moment later, on the order of a a few millionths of an ""yoctosecond"". A widely-accepted theory is that the original decay produces two quarks and also a third unknown particle, dubbed the quason. This is subsequently transformed into a third quark. However, Sir Charles offeres a different, radical explanation: all three of the quarks are created at once, but the first two are propagated back in time. Charles dubs the energy which had allowed the propagation through time as tau waves. Although his theory is seemingly valid and consistent, the physicists of his time refuse to accept it because of its implications — namely the failure of some of the physical laws of conservation. Sir Charles then retreats to his family's castle in Scotland to continue his research in private. There, he succeeds in building a time machine capable of sending messages to the future and the past. When the two young men arrive, Sir Charles takes them down into the basement, where the machine is found. As they enter the basement, a computer attached to the machine produces data on a sheet of paper, which Sir Charles hides from the other men. He asks Murdoch to type in a six-character random message into the computer. Sir Charles next activates his machine and transmits the message one minute back in time. Finally, he shows the paper printed out previously, and Murdoch and Lee are amazed: the printout contained exactly the same random characters that Murdoch typed, and these were printed before Murdoch had typed them in. After Murdoch and Lee have gotten over their initial amazement, they decide to experiment with the machine. Murdoch tries to fool the machine into creating a causality paradox, by deliberately receiving a message from the future, and not sending the message back at the due time. Suddenly, the entire system turns bizarre, and they are flooded with messages from all over the ten-minute range of the machine. Then they abruptly turn off the machine and leave. While outside, Murdoch and Lee talk about the implications of the machine's existence and how the space-time continuum could allow for time travel without introducing a paradox. They formulate theories similar to the many-worlds interpretation, finally deciding that none of the theories they discus fit their previous observations. The next day, Ted Cartland, a friend of Charles and a former Royal Air Force officer, arrives to examine the machine he had helped build. They repeat the experiment, and Ted is bewildered as well. Ted, however, has a trick up his sleeve. He writes a computer program to do what Murdoch had done the day before, to remove the human element from the experiment. The machine picks up an unexpected message, telling the experimenters that a glass jar had been broken. True enough, Lee was on the verge of accidentally pushing a jar off a shelf. However, they are unable to contact their future selves with the broken jar, since they apparently no longer exist. Sir Charles decides that upon sending the message back, the copies of themselves in the future had changed their past and thus had been erased from existence. The altered timeline, with its unbroken jar, overwrote the old one rather like recording over an old TV program on a videotape. Thus causality had been preserved. The fear of being erased chills them, and so they quickly disable the machine again. As time goes by, they establish an experimental protocol, and they set up automated tests to gain more information about the physics behind the machine. The machine is upgraded to allow for more data throughput and a tiem range of about 24 hours. Murdoch also meets a young woman named Anne Patterson when she trips over Sir Charles's kitten while she was out shopping in Kingussie. They immediately fall in love. It turns out later that she is a physician in the new fusion reactor in Burghead. Elizabeth Muir, another close friend of Sir Charles, works there as well, and he invites her to his castle to investigate the peculiar machine. The (fictional) European Fusion Consortium (EFC) has commissioned a large thermonuclear fusion reactor in Burghead to compete with the technologies located in the United States and the Soviet Union. The colossal energy obtained from fusion meant that huge amounts of power might someday be available at low costs. All three parties used inertial confinement technology, with the EFC opting to use ion beams. During this time, Murdoch and Lee get to tour the large Burghead facility through Elizabeth, who is a principal physicist there, and Murdoch builds a relationship with Anne. One day, the reactor, still in the testing phases of power production, is shut down when apparent erosion is detected in the fusion chamber. Two days before, the team at Storbannon had experienced an apparent failure in its time machine, with Lee asserting that the failure had to be due to interference. Their time machine then suddenly resumes operation again, and they elect to ignore the problem. Shortly after the incident, strange events start occurring around the world, with so-called bugophants (a blend of bug and elephant) drilling tiny, long, straight holes through a myriad of objects, from human bodies to telescope mirrors. Finally, the team finds out the cause of the erosion in the Burghead plant, the interference with the machine, and the bugophants themselves: the repeated fusion tests at the plant had, over the course of two days, had produced some two million microscopic black holes, which then tunnelled through the basement of the plant and concentrated around the core of the Earth. As the black holes annihilated matter, they emitted tau waves and caused interference even before the reactor tests. Although conventional theory stated that black holes could not form from the comparatively low pressure produced in the reactor, and small black holes could not survive long anyway, the conventional theory had failed to take into account the existence of tau waves and their effects. Lee suddenly goes into spasms and loses consciousness during a dinner with Murdoch and Anne. He is rushed to a local hospital, and then she is transferred to a special unit created to deal with a new outbreak, which had apparently affected him and several others in Burghead. While the rest of the team is away, Murdoch finds that the machine is about to be swamped with interference, and may soon be unusable. He decides to take matters into his own hands and transmit a message far back into the past to remedy the situation. To get around the 24 hour limit of the machine, he asks Anne, who had learned machine code programming at her university, to write a program that would repeatedly bootstrap itself back in time until it reached the date desired. Anne complies, despite her deep misgivings. They manage to send the message, knowing they will be reset into the new timeline, and that anything could be different. Their selves in the past receive the message, and they act on it immediately. They have no choice but to tell the bewildered managing committee at Burghead of their findings, including revealing their time machine. Given the necessary investigations, the thermonuclear reactor is shut down indefinitely. And although neither Murdoch nor Anne is aware of it, the flood of tau particles accompanying the message upset delicate quantum probabilities. She did not trip over the kitten and then begin a relationship with Murdoch. In the new timeline, word of the time machine spreads to the EFC headquarters in Brussels and to other places. Lee turns ill in the castle one day and suddenly collapses. As a doctor, Anne contacts Murdoch, who is away, and suggests that Lee has succumbed to a new outbreak of a disease, apparently a version of multiple sclerosis, but progressing much faster, taking only a few weeks rather than years, and also very deadly. Murdoch pressures Anne to reveal more information about the outbreak, which appears to be highly classified. Anne does not know much, either. However, Murdoch finds out that a distinguished medical specialist, Sir Giles Fennimore, has arrived from London to investigate the outbreak. He learns that the disease is somehow connected to the West Coast of the United States, where Lee had been residing in September 2009, and his suspicions are raised further. Ted and Elizabeth help Murdoch investigate. After interrogating Ralph Courtney, chairman at the Burghead facility, and a chance meeting by Ted with a young R.A.F. pilot, they eventually find out (Ted knowing much of this from his previous R.A.F. experience) that Anglo-American authorities had wished to establish an advanced laboratory for potentially dangerous research into viruses, genetic manipulation, and similar subjects. Naturally, this project stirred up a large controversy over public fears of containment failures and contamination and was eventually scrapped. However, the possible scientific advancements offered were simply too great to pass up. Thus a satellite, the QX-37, was constructed and launched into outer space, purporting to be an astronomical observatory. The QX-37 continued the experiments secretly. In August 2009, the satellite passed right through the path of the Perseids meteor shower, and it was hit by a meteor. It broke up and disintegrated into the Earth's atmosphere. After the breakup and fallout, to prevent public panic, the entire effort was tightly classified and codenamed Centurion. Again, surpassing the odds, a single mutant strain of multiple sclerosis survives on its way back to the Earth, and infects the entire population of the West Coast, with an incubation period of nine months. It was during this time that Lee was infected, since he was on the West Coast at the time. The West Coast of the United States is one of the most densely populated areas on the planet, and soon thousands of people start reporting symptoms and being hospitalized. The new strain is named omnisclerosis Californians. A vaccine is announced and vaccinations begin in California. However they are stopped after 811 of the people treated die from neurological disorders triggered by one of the production batches, which had not been manufactured properly. Even though the vaccine worked, members of the public would not trust it anymore, and there are now left with no defense against the virus. The members of the team decide to contact Fennimore through the Minister of Advanced Technology and Science Graham Cuthrie. Although he is initially skeptical, he is convinced of the machine's authenticity after a demonstration. They propose a pilot test: instead of changing many months of history, they offer to reset the events leading to the vaccine mishaps that had caused Fennimore much distress, five days ago. Cuthrie reluctantly agrees. He is asked to prepare a comprehensive document detailing the manufacturing problem, with additional measures taken to ensure its authenticity. In the new reset timeline, the faulty vaccine batch is retracted and the 811 deaths do not occur. Fennimore becomes a spokesman for the team, convincing world governments to take action. It is decided that the information needed to produce and distribute the vaccine will be sent back several months in time, as well as other current events, to help their past selves to make better decisions. The message is sent to the afternoon of January 16, 2010, from July 28, 2010, shortly after the message about the black holes is received. The message is split up into two parts, a header announcing the message, and then the message body itself to arrive an hour later, to allow the team to attach more computer memory to the machine for the message to be received completely. That very day, in this third iteration of the timeline, Murdoch and Lee go out shopping in Kingussie, and a certain young woman named Anne trips over Sir Charles's kitten... This is the origin of the story's title, Thrice Upon A Time.",0
9046144,Lafcadio: The Lion Who Shot Back,Shel Silverstein,1963,"{""/m/0dwly"": ""Children's literature""}","A young lion is living in the jungle. On a night, when all the lions are sleeping, they awaken to hear a gunshot. All the lions run away except for one named Grmmff, who is the protagonist of the story. He is confused about why the other lions are running away, until an old lion tells him that hunters are coming. He does not know what a hunter is, but thinks that he likes the sound of the word ""hunters,"" so he stops running and hides in the tall grass. The hunters pass by wearing red caps and carrying funny sticks that make loud noises (obviously guns). The lion likes their looks, so when a hunter passes, he stands up, says hello, and tries to make friends with the hunter. This offends the hunter's sense of the proper relationship between lion and hunter, and the hunter says he will shoot Grmmff. When the hunter finds, however, that he has not loaded his rifle, Lafcadio decides he does not like the hunter after all, and eats him up, red cap and all. He tries to eat up the gun and the bullets, but he cannot chew them. He brings them to the other lions. The old lion says to throw them away, but the young lion shoots the gun with his tail. The lions initially run away. They are angry with the young lion when they discover that he is the one shooting. However, the young lion likes shooting the gun so much that he practices to become the best shot in the whole world. A year later, another man comes walking through the jungle, the young lion wants to shoot him. However he is revealed that the man is a circus man. Finchfinger, the circus man, persuades the reluctant lion to come with him to the circus with the promise of marshmallows. They arrive in the city, which is not at all like the jungle. There are ""tall square things"" (buildings) and ""things that look like hippopotamuses that move very fast with people inside them"" (cars). The lion goes into the hotel and goes up and down the elevator many times. He then meets Uncle Shelby, (obviously Shel Silverstein, as he tells the story) goes to the barbershop, gets his paws shined, his claws manicured and a free haircut. He has dinner, and eats lots of marshmallow dishes, then finally eats his napkin for dessert. He wears a marshmallow suit, but it gets ironed and it melts all over him. He goes back to the hotel and stays up very late singing the ""marshmallow song:"" <poem> Marshmallows Marshmallows Marching Marshing Mellow Malling Mallows Marshing Fellows Marshy-Murshy- </poem> The young lion&#39;s name is changed to Lafcadio the Great. The next morning, there is a big parade for him. Lafcadio goes into the tent, shoots six bottles off the table, a hundred balloons off the ceiling, a marshmallow off everybody&#39;s head including some monkeys, shoots 12,322 of the Ace of Spades (but misses once), shoots in many different ways, and then joins the circus. He shoots for many different governments, becomes rich and very famous and signs six autographs at once. He then becomes more like a man, standing on his back paws, wearing clothes, playing golf and tennis, going swimming and diving, painting pictures (despite being unable to draw a straight line), doing exercises, going skating, and attempting to learn to ride a bicycle. He goes to the beach at Cannes, sings, plays the guitar, bowls and seldom says &#34;GRAUGRRR&#34; except on very special occasions. He writes his autobiography, becomes a clothes lion, and becomes very happy, rich and famous. But suddenly, Lafcadio is crying because he is tired of what he has, and wants something new. Uncle Shelby asks if he has gone up and down the elevator a few times or eaten marshmallows, but that is old stuff. Then Finchfinger gets the idea to take Lafcadio on a hunting trip in Africa. Uncle Shelby cannot come because he has to water his philodendron plant. So Lafcadio, along with Finchfinger and some other hunters, goes back to Africa and begins hunting lions. A very old lion realizes that Lafcadio is a lion too and comes up to him. Lafcadio remembers that he was a lion, and that he still is a lion. All the lions want him to come back and be a lion with them, but the hunters also want Lafcadio to stay a hunter. Lafcadio cannot make up his mind and says that he does not want to do either and that he does not think that he belongs anywhere. He puts down his gun and walks away, not knowing where he&#39;s going and not knowing what&#39;s happening to him. Lafcadio has not been heard from since.",0
9046472,The Good Guy,Dean Koontz,2007-05-29,"{""/m/01jfsb"": ""Thriller"", ""/m/02n4kr"": ""Mystery""}","Timothy Carrier is an unassuming stonemason who, while having a beer at his regular bar, is accidentally mistaken for a hitman by a stranger who hands him an envelope containing $10,000 and a photo of the intended victim, a writer named Linda Paquette. The real killer arrives soon afterwards, and Tim manages to bluff him by pretending to be the client, saying he's had second thoughts, and is cancelling the hit while giving the killer the $10,000 as a ""no-kill fee"". Tim covertly follows the killer outside, and is shocked when the killer places a roof-mounted police light on top of his car before driving off; implying the hitman is a cop. Tim tracks down Linda and flees. He phones his old Marine buddy Pete, who's a homicide detective, and asks him to trace the plates of the killer's car. Tim and Linda barely manage to stay one step ahead of the killer, and they begin to suspect that he has almost unlimited access to cell phones, financial transactions and GPS tracking; implying that he is working for someone very powerful. As Tim manages to foil the killer again and again, Linda begins to suspect that Tim is more than just a mason. The supremely confident/psychotic killer isn't deterred, but appears to become increasingly unstable as the chase continues. Over time, Tim and Linda develop feelings for one another. Linda confesses to Tim about her haunting childhood; her parents, former preschool teachers, were unjustly accused of committing horrific sexual crimes to their students, including their daughter. Linda was separated from her parents, as both of them had to go to jail and eventually die. The killer finally tires of chasing Tim, and instead goes to Tim's house and kidnaps Tim's Mom, and then calls Tim to set up a trade for Linda. During the call Tim's Mom covertly lets Tim know they're still at her house(the hitman implied they were far away). Tim and Pete rush home to save Tim's Mom and kill the hitman. FBI agents raid the house and begin to clean up the mess. However, before they enter the house, Tim and Pete see them coming, and being suspicious, Tim calls his neighbor across the street and asks him to covertly videotape the agents. As the clean up proceeds the lead agent reveals that the hitman had actually been working for an American politician who's part of a shadowy conspiracy to take over the American government from the inside. Two and a half years earlier, an aide of that politician had lunch with a member of a terrorist organization. In that restaurant, the owner snapped several pictures of his regular customers, catching the aide and terrorist in the background. Later on, the terrorist was recognized as member of a terrorist organization, while the politician became popular and was being talked about as the next president, plus the pictures surfaced on the restaurant's website. Fearful that this relationship with a known terrorist organization would become known, the conspiracy, in the spirit of thoroughness, sent the hitman to kill the customers who were in the pictures; Linda Paquette being one of them. Before leaving, the lead agent politely apologizes for causing so much trouble, but makes it clear to Tim that if any of them ever say anything about what happened, Tim and everyone he loved would be killed, and it would be made to look like a murder/suicide because of Tim suffering from PTSD. Moments later, Pete shows Linda the story about Tim winning the Medal of Honor for saving numerous civilians during his experiences as a Marine. Tim takes the video to the current American president and explains what he knows about the shadowy group of government insiders. The story ends with Tim and Linda marrying and the conspiracy falling apart; there are multiple arrests and suicides.",0
9050114,A Solitary Blue,Cynthia Voigt,1983,"{""/m/0dwly"": ""Children's literature"", ""/m/02xlf"": ""Fiction""}","Jeff Greene is a second grade student who comes home one day to find his mother, Melody, has left. Jeff's father ""the professor,"" is a reserved man and keeps to daily routines. Trying not to be a burden to his father, when Jeff feels sick he makes light of it until he is seriously unwell with a chest infection. After many years without any contact from his mother, she asks him to visit her in her family's home in Charleston, South Carolina for the summer. He connects with Melody and has a wonderful time, the first one since Melody left. After his visit, he writes letters to Melody on the first day of every month even though she never writes back. For Christmas he sends Melody a beautiful scarf but receives nothing from her in return. Jeff convinces himself to excuse her for ignoring him so he can keep loving her. On his second summer visit, Melody doesn't spend much time with Jeff. She has a boyfriend and is never at home for more than a day. Jeff's second summer with his mother is very different from his first one, and by the end of it, Jeff is forced to see that Melody doesn't really care about him. Jeff is heartbroken and withdraws himself. Melody and Jeff have a huge fight.' He begins to fail his classes and doesn't open up to anyone about his feelings. He becomes so withdrawn his father becomes convinced he is on drugs but finds out the truth and decides to make a change for Jeff's good, moving to Crisfield. Jeff makes some friends and gets his life back on track, taking an interest in schoolwork and learning to play the guitar. He learns to accept himself, and starts to build a real relationship with his father. After a year in Crisfield, Jeff meets the Tillermans and becomes good friends with Dicey, whom he attracts with his music. Finally, Jeff becomes able to put his mother behind him and bond with his father.",0
9053484,CHERUB: Man Vs. Beast,Robert Muchamore,2006-10-19,"{""/m/01jfsb"": ""Thriller"", ""/m/06wkf"": ""Spy fiction"", ""/m/0dwly"": ""Children's literature""}","The book starts with a 14 year old boy called Andy Pierce witnessing his mother getting assaulted by two masked men who are working for the Animal Freedom Militia. The book then skips to Kerry being annoyed by her boyfriend, James. James goes into his room and he is met by his sister Lauren. She asks him to help her and her best friend Bethany to sneak into the basic training compound to give Bethany's brother, Jake, and Lauren's crush, Rat, some food. James refuses but Lauren blackmails him by threatening to tell Kerry about him cheating on her during a mission a year before. James joins the girls on the mission to get the food to the trainees. All goes fine but Mac watches them on the back up CCTV and they get caught. James is not punished for being blackmailed and he, Lauren and Kyle and sent on a mission to bring down the AFM (Animal Freedom Militia). Lauren is stuck with the ex-con while he meets up with his old animal rights protest group. They get invited to rescuing dozens of dogs from the compound which were supposed to be sold onto the testing company. All goes well in the rescue, but the rescuers were overwhelmed because many more dogs were rescued than they thought. This chapter ends with Lauren saving a puppy from getting run over by Zara's car. They end up keeping the dog in the chairwoman's house. Lauren always visits the puppy, who was called Meatball (due to Lauren being a vegetarian). Together James, Lauren and Kyle succeed in their mission and return home. On the mission Lauren becomes a vegetarian and at the end James puts meat in her bag on the plane to annoy her. Zara Asker becomes chairman succeeding Dr. McAfferty who retires.",0
9053935,The Innocent,Ian McEwan,1990,"{""/m/02xlf"": ""Fiction""}","The novel takes place in 1955-56 Berlin at the beginning of the Cold War and centres on the joint CIA/MI6 operation to build a tunnel from the American sector of Berlin into the Russian sector to tap the phone lines of the Soviet High Command. Leonard Marnham is a 25-year-old Englishman who sets up and repairs the tape recorders used in the tunnel. He falls in love with Maria Eckdorf, a 30-year-old divorced German. The story revolves around their relationship and Leonard's role in the operation.",0
