id,title,author,published_date,categories,summary,page_count
544481,The Seven Crystal Balls,Hergé,1948,UNK,"On board a train, Tintin reads a newspaper article about seven explorers who have returned from a two-year ethnographic expedition in the Andes, where they unearthed the tomb of the Inca, Rascar Capac. A man says to him, ""Think of all those Egyptologists, dying in mysterious circumstances after they'd opened the tomb of the pharaoh...You wait, the same will happen to those busybodies violating the Inca's burial chamber."" Tintin's train arrives at Marlinspike Hall, the new home of his friends Captain Haddock and Professor Calculus. The Captain, now a member of the aristocracy, invites Tintin to an evening at the music hall. There they witness an unsettling performance of a clairvoyant who predicts the illness of one of the members of the expedition. They also view the act of Bianca Castafiore, as well as a knife thrower—whom Tintin recognizes is General Alcazar (stage name Ramon Zarate) former President of San Theodoros. They have a glass of aguardiente with the general who introduces them to his assistant Chiquito. A mysterious illness begins afflicting the members of the expedition; one by one, they fall into a mysterious coma. The only clue is fragments of a shattered crystal ball found near each victim. Concerned, Tintin, Captain Haddock, and Professor Calculus go to stay with Calculus's old friend and only expedition member yet to be affected, the ebullient Professor Tarragon. Tarragon is keeping Rascar Capac's mummy in his house and is being tightly guarded against any attack. A lightning storm strikes the house and sends a ball of fire down the chimney and onto the mummy—which evaporates. Tarragon, clearly shaken, informs them a prophecy has come true: Rascar Capac has returned to his element and punishment will descend upon the desecrators. After Tintin, Captain Haddock, and Professor Calculus are each visited in their nightmares by the mummy, the three awaken to find Professor Tarragon comatose with the telltale shards of crystal by his bed. The attacker bypassed the police watch by coming down the chimney. The police shoot the attacker as he flees, but fail to capture him. Tintin states the crystal balls have done their work and claimed the last of the seven. Tarragon awakens and screams about mysterious figures attacking him, before slipping back into a coma. The plot thickens even further when Calculus takes a stroll around Professor Tarragon's house, discovers a striking gold bracelet, puts it on (remarking on how nicely it goes with his coat), and then mysteriously disappears. The bracelet had previously been worn by the now-vanished mummy. While searching the grounds, Tintin and Haddock discover the attacker had eluded them by taking refuge in a tree and deduce that he then jumped Calculus and stole the mummy's jewels. Tintin and the Captain are then fired upon by an unseen gunman who escapes, having kidnapped Calculus, in a black car. The alarm is raised and the police set up road blocks, but the kidnappers switch cars and slip through the net. Tintin visits a hospital where all seven of the stricken explorers go through the same horror—they awaken from their coma, scream about figures attacking them, and slip back into their coma—at a precise time of day. Back at Marlinspike Hall, Captain Haddock is devastated by the loss of Professor Calculus. But after he receives a telephone call from the police, he disappears into his bedroom, then reappears—dressed as a sailor again and ready for travel. As he and Tintin drive to Westermouth, he explains the kidnapper's car was seen there; he believes the kidnappers boarded a ship with Calculus and he intends to follow. When they reach the docks, they find the kidnapper's car abandoned and they spot General Alcazar boarding a ship to South America. The General informs them his music hall career is over since the disappearance of his partner, Chiquito, one of the last descendants of the Incas. Tintin realizes Chiquito disappeared the same night Professor Tarragon was attacked and Calculus kidnapped and deduces he could be one of the kidnappers. Out of leads, Tintin and Haddock decide to go to a different dock, Bridgeport, to visit Haddock's friend, Captain Chester. Snowy retrieves an old hat found there, and Tintin recognizes it as belonging to Professor Calculus. Checking with the harbour master, they discover that Calculus must be on board the Pachacamac, which is bound for Peru. They board a flight and resolve to meet his ship there. The story is continued in Prisoners of the Sun.",0
544947,In the Skin of a Lion,Michael Ondaatje,UNK,"{""/m/02xlf"": ""Fiction""}","The first chapter, ""Little Seeds,"" describes the growing years of the main character, Patrick Lewis, providing causation for his subsequent actions in the novel. As a young boy in Depot Creek, Ontario, Patrick watches the loggers arrive in town in the winter, work in the mills in the other seasons, and skate on the frozen river. Patrick's father, Hazen Lewis becomes a dynamiter and is meticulous in washing his clothes each evening to remove remnants of explosives on his apparel. These elements form the foundation of the subsequent narrative: Depot Creek, the loggers skating, learning about dynamite, etc. ""The Bridge"" deals with the construction of the Bloor Street Viaduct, which will link eastern Toronto with the center of the city and will carry traffic, water and electricity across the Don Valley. R.C. Harris, the city's Commissioner of Public Works often visits the bridge at night. One night, five nuns wander onto the unfinished bridge and one falls off. Nicholas Temelcoff, a Macedonian immigrant worker on the bridge, saves the nun who fell off the bridge, dislocating his arm. The nun, already missing her veil, tears her habit to make him a sling. Later, at a bar, he offers her brandy, compliments, and a new lease on life. Temelcoff is a silent man who struggles with English yet they are able to transcend their social and language barriers through the commonality of their scars— his from work, hers from being ""always unlucky."" This moment is the beginning of the nun's eventual transformation into the character Alice. He eventually falls asleep and wakes to find a doctor treating his arm and the nun gone. As a young man, Patrick leaves the profession that killed his father and sets out to find the vanished millionaire Ambrose Small. This leads him to Small's mistress Clara Dickens, and to a relationship with her. Eventually, Patrick loses interest in finding Small, hoping only to remove Clara from Small. Clara tells Patrick that she will leave him to go after Small and warns him not to follow her. Patrick is broken-hearted. Three years later Clara's friend Alice unexpectedly arrives. Alice shows Patrick great tenderness and tells him that Clara's mother might know where Clara is. Patrick sets out to search for Clara. On meeting Clara's mother, Patrick learns that Clara and Small are living in his old hometown. Patrick finds Small living in a house owned by a timber company and Small attempts to set him on fire&mdash;once by dropping kerosene on him and then by throwing a Molotov cocktail. Patrick manages to escape to his hotel room and is visited by Clara, who dresses his wounds and makes love to him before returning to Small. In 1930, Patrick is working as a dynamiter on a tunnel under Lake Ontario, a project of Commissioner Rowland Harris. Patrick rents an apartment in a Macedonian neighborhood. He is accepted into the neighborhood and is invited by Kosta, a fellow dynamiter, to a gathering at the Waterworks&mdash;a place where various nationalities gather for secret political discussions and entertainment. Patrick witnesses a performance in which an actor repeatedly smashes her hand against the stage and rushes forward to help her. He recognizes her as Alice Gull. His act of helping her turns out to be part of the show. Patrick visits Alice and learns about Hana, her nine-year-old daughter. Patrick and Alice become lovers. Patrick finds work in a leather company through Alice's friends and meets Nicholas Temelcoff, now a baker. On studying the bridge, Patrick learns about the nun that had fallen off, whose body was never found. He makes the connection after talking with Temelcoff and promises to look after Hana. Patrick travels by train, north of Huntsville. He takes a steamer to a Muskoka hotel frequented by the rich, carrying nothing but a black suitcase. He burns down the hotel, then leaves on a small boat. Arriving at an island, he meets the blind Elizabeth. We learn that Alice has died and Patrick has committed the act of arson out of anger. Patrick swims out to a boat. He knows he will be caught by the authorities and takes the time to recuperate and dry out his clothes. Three prisoners, Buck, Lewis and Caravaggio, are painting the roof of the Kingston Penitentiary. Patrick and Buck paint Caravaggio in the blue of the roof so he can hide and escape. He steals new clothes and changes his dressing. Jumping a milk train, he makes his way north toward cottage country. He has a scar from an attack from which Patrick saved him by yelling out a square dance call. Caravaggio recalls his first robbery, in the course of which he broke his ankle while retrieving a painting, so he had hidden in a mushroom factory where a young woman named Gianetta helped him recover, with whom he had escaped by dressing as a woman. Caravaggio enters the cottage of a woman whom he met on the lake and calls his wife to let her know he's all right. After talking to the cottage owner, he returns to his brother-in-law's house, reuniting with Gianetta. Four years later, Patrick is released from prison and meets Temelcoff at the Geranium Bakery. Hana, now sixteen, has been living with Temelcoff's family. Patrick takes responsibility for Hana. One night, she wakes him to say that Clara Dickens has called. She tells him that Small is dead and asks him to pick her up from Marmora. Realizing that the water supply is vulnerable to being cut off or poisoned, Harris installs guards at the Waterworks, which he built. Caravaggio introduces Patrick to his wife. They fraternize at a party for the rich, then steal a multi-million dollar yacht from a couple they chloroform. Patrick intends to blow up the Filtration Plant with dynamite and Caravaggio's help. Patrick enters the plant through the water intake. He places dynamite about the plant testing facility and carries the detonating box to Harris' office, where he accuses Harris of exploiting the workers and ignoring their plight. Patrick tells Harris how Alice Gull was killed and we learn that she accidentally picked up the wrong satchel, containing a bomb. Patrick exhausted, falls asleep, and in the morning Harris asks the police to defuse the bombs and bring a nurse for Patrick. Patrick awakes and goes with Hana to retrieve Clara. At Hana's urging, Patrick tells her about Clara. Patrick asks Hana to drive to Marmora. The book ends with "" 'Lights' he said""",0
544984,The World of Null-A,A. E. van Vogt,1948,"{""/m/06n90"": ""Science Fiction"", ""/m/014dfn"": ""Speculative fiction"", ""/m/05hgj"": ""Novel""}","Gilbert Gosseyn, a man living in an apparent utopia where those with superior understanding and mental control rule the rest of humanity, wants to be tested by the giant Machine that determines such superiority. However, he finds that his memories are false. In his search for his real identity, he discovers that he has extra bodies that are activated when he dies (so that, in a sense, he cannot be killed), that a galactic society of humans exists outside the Solar system, a large interstellar empire wishes to conquer both the Earth and Venus (inhabited by masters of non-Aristotelian logic), and he has extra brain matter that, when properly trained, can allow him to move matter with his mind.",0
545026,The Black Arrow: A Tale of the Two Roses,Robert Louis Stevenson,1888,"{""/m/0dwly"": ""Children's literature"", ""/m/08sdrw"": ""Adventure novel"", ""/m/014dfn"": ""Speculative fiction"", ""/m/01qxvh"": ""Romance novel"", ""/m/02xlf"": ""Fiction"", ""/m/0hwxm"": ""Historical novel"", ""/m/02p0szs"": ""Historical fiction""}","In the reign of ""old King Henry VI"" (1422–1461, 1470–1471) and during the Wars of the Roses (1455–1487) the story begins with the Tunstall Moat House alarm bell being rung to begin mustering troops for its absent lord Sir Daniel Brackley, who intends to join the Battle of Risingham. It is then that the ""fellowship"" known as ""The Black Arrow"" headquartered in Tunstall Forest begins to strike with its ""four black arrows"" for the ""four black hearts"" of Brackley and three of his retainers: Nicholas Appleyard, Bennet Hatch, and Sir Oliver Oates, the parson. The rhyme that is posted in connection with this attack gets the protagonist Richard Shelton, ward of Sir Daniel, to become curious about the fate of his father Sir Harry Shelton. Having been dispatched to Kettley, where Sir Daniel was quartered, and sent to Tunstall Moat House by return dispatch, he falls in with a fugitive from Sir Daniel, Joanna Sedley, disguised as a boy and going by the alias of John Matcham. She is an heiress kidnapped by Sir Daniel, who wanted to obtain guardianship over her. Coincidentally, Sir Daniel was intending to marry Joanna to Dick himself; and, in her male disguise, Joanna brings up the matter to Dick, affording her the opportunity of feeling him out on the subject. Dick says he is not interested, but he does ask her if his intended bride is good-looking and of pleasant disposition. While making their way through Tunstall Forest, Joanna tries to persuade Dick to turn against Sir Daniel in sympathy with the Black Arrow outlaws, whose camp they discover near the ruins of Grimstone manor. The next day they are met in the forest by Sir Daniel himself disguised as a leper and making his way back to the Moat House after his side was defeated at the Battle of Risingham. Dick and Joan then follow Sir Daniel to the Moat House. Here Dick changes sides when he finds out that Sir Daniel is the real murderer of his father and escapes injured from the Moat House. He is rescued by the outlaws of the Black Arrow with whom he throws in his lot for the rest of the story. The second half of the novel, Books 3-5, tells how Dick rescues his true love Joanna from the clutches of Sir Daniel with the help of both the Black Arrow fellowship and the Yorkist army led by Richard Crookback, the future Richard III of England. The second half of the narrative centers around Shoreby, where the Lancastrian forces are well entrenched. Robert Louis Stevenson inserts seafaring adventure in chapters 4-6 of Book 3 as Dick and the outlaws steal a ship and attempt a seaside rescue of Joanna, who is being kept in a house by the sea. They are unsuccessful, and after Joanna is moved to Sir Daniel's main quarters in Shoreby, Dick then visits her in the guise of a Franciscan friar, which was a disguise used during the Wars of the Roses. Stevenson, the popularizer of the tales of the Arabian nights, has Dick tell the tale of Ali Baba and the Forty Thieves in Book 4, chapter 6 to help him escape from the ruined sea captain Arblaster, whose ship Dick and the outlaws had stolen. In the course of shadowing Sir Daniel in his goings to and from the house by the sea, Dick and the outlaws, who have made their Shoreby headquarters the ""Goat and Bagpipes"" alehouse, encounter another group of spies interested in Joanna. After a skirmish in the dark in which the outlaws prevail, Dick finds that he has conquered Joanna's lawful guardian Lord Foxham. Foxham, a Yorkist, promises to give Joanna to Dick in marriage depending on the outcome of a contemplated seaside rescue. There is irony in Foxham scolding Dick, who is nobly born, for consorting with outlaws when the outlaws are recruited in Dick and Foxham's plans to rescue Joanna. Seriously wounded in the failed seaside rescue, Foxham writes letters of recommendation for Dick to Richard Crookback since he must retire temporarily from action. Richard Crookback, Duke of Gloucester, makes his appearance in Book 5, with whom Dick keeps Lord Foxham's rendezvous. Dick's accurate knowledge of the Lancastrian forces in Shoreby aid Crookback in winning the battle. Dick is also successful as one of Crookback's commanders. A delighted Crookback knights Dick on the field of battle and, following their Yorkist victory, gives him fifty horsemen to pursue Sir Daniel, who has escaped Shoreby with Joanna. Dick succeeds in rescuing Joanna, but loses his men in the process. He, Joanna, and Alicia Risingham travel to Holywood where he and Joanna are finally married. In this way he keeps his initial pledge to Joanna to see her safe to Holywood. In the early morning of his wedding day Dick takes a walk on the outskirts of Holywood. He encounters a fugitive Sir Daniel trying to enter Holywood seaport to escape to France or Burgundy. Because it is his wedding day, Dick does not want to soil his hands with Sir Daniel's blood, so he simply bars his way by challenging him either to hand to hand combat or alerting a Yorkist perimeter patrol. Prudently, Sir Daniel opts to go away. Just after he leaves Dick he is shot by Ellis Duckworth with the last black arrow. Duckworth found in prayer by Dick tells him, ""But be at rest; the Black Arrow flieth nevermore - the fellowship is broken."" Sir Richard and Lady Shelton live in Tunstall Moat House untroubled by the rest of the Wars of the Roses. They provide for both Captain Arblaster and the outlaw Lawless by pensioning them and settling them in Tunstall hamlet. Lawless does a volte face by returning to the Franciscan order as a friar by the name of Brother Honestus.",0
545049,Interesting Times,Terry Pratchett,UNK,"{""/m/06n90"": ""Science Fiction"", ""/m/0dwly"": ""Children's literature"", ""/m/014dfn"": ""Speculative fiction"", ""/m/01hmnh"": ""Fantasy"", ""/m/0c3351"": ""Suspense"", ""/m/02xlf"": ""Fiction""}","The events of the novel are a ""game"" between the Discworld gods Fate and The Lady (Luck) with the Discworld as their game board. At the end, the Lady says ""I never play to win but I do play not to lose"", and shows the gods Rincewind confronted by Australian-aborigine-type warriors. After Eric. The Patrician of Ankh-Morpork is sent a letter from the Agatean Empire on the Counterweight Continent commanding him to ""send us the Great Wizzard"", the spelling on the hat of Rincewind. The Hex brings Rincewind, and exchanges him in the Aurient Agatean Empire with a live cannon. As usual, The Luggage follows, but having returned to the land of his wood and construction, feels free to seek a mate and reproduce, re-appearing at the end. On the Counterweight Continent, Rincewind joins a previous companion Cohen the Barbarian who intends to steal the country with six other aged heroes, The Silver Horde. Child rebels have been inspired by ""What I did on My Holidays"", written by Twoflower, his companion in The Colour of Magic and The Light Fantastic. The villainous Vizier Hong leads one of the five families — Hong, Tang, Fang, Sung, and McSweeney, and secretly funds the revolution which is only good for putting up polite posters, and sets them up to take the blame after killing the Emperor. When captured with two young rebel girls, Rincewind discovers Twoflower in the next cell, missing father to the girls, and tries to convince them to stay safe in the cells while he scouts, that is, runs as far away as possible. Meanwhile, the Cohen Horde infiltrate the Forbidden city via underground sewers, take the empty throne, but are called out to face the besieging army. Back in the University, Hex is calculating the spell to bring Rincewind back, but the butterfly of Luck drops a small glob of honey, distracting an ant, altering the calculation. Rincewind falls into a mysterious cave, filled with terracotta statues, the original, legendary Red Army of the first Emperor. In magic armour, he leads the terracotta army against the five family armies, winning mostly by accident. Cohen returns to Hunghung victorious, and re-proclaims himself Emperor. Just as Twoflower challenges Hong for the death of his wife, the Unseen University returns the lit cannon, that kills Hong and Horde's ""Teach"" Ronald Saveloy, who tried to civilize the barbarians with alternative vocabulary for swear words and polite behavior, but finally agreed to fight alongside and rides off with a Valkyrie. Rincewind is transported to ""XXXX"", an unexplored continent and another adventure.",0
546875,Prisoners of the Sun,Hergé,1949,UNK,"In the previous adventure, The Seven Crystal Balls, seven explorers have been afflicted with a mysterious illness after unearthing the tomb of the mummified Inca, Rascar Capac. Professor Calculus has been kidnapped by a band of men including the Quechua native Peruvian Chiquito, one of the last descendants of the Incas. Tintin and Captain Haddock discover their friend is on board the cargo ship Pachacamac bound for Callao, Peru and are on a flight to rescue him. When Tintin and Haddock intercept the ship, Tintin encounters Chiquito and learns Calculus is to be put to death for wearing the bracelet belonging to the Inca mummy. Unable to rescue Calculus, Tintin and the Captain must set off on the trail of the natives who have taken him. It leads them through the small town of Santa Clara, to the mountain town of Jauga, where a train is sabotaged in an attempt to kill them. They find both the authorities and the locals extremely unwilling to help them track Calculus' kidnappers because of the wrath of the Inca. Tintin encounters a young Quechua native boy named Zorrino, whom he protects from two bullying men of white descent. For that, a mysterious Indian gives Tintin a medallion, telling him it will save him from danger. Zorrino then offers to take them to the Temple of the Sun, where he claims their friend is being held prisoner by the Inca. ""The Inca, in these days?"" asks Tintin. ""White men not know, señor."" replies Zorrino. ""Only you know."" The Temple lies deep in the Andes, and the journey there is long and eventful, involving hindrance from natives and the Captain being terrorised by local wildlife. Finally, Tintin, Haddock, and Zorrino come upon the Temple of the Sun—and stumble right into a group of Inca who have survived until modern-day times. They are brought before the noble Prince of the Sun; on the left stands Chiquito, on the right stands Huascar, the mysterious Quechua Tintin encountered in Jauga. Zorrino is saved from harm when Tintin gives him Huascar's medallion, but Tintin and Haddock are sentenced to death for their sacrilegious intrusion. The Inca prince tells them they may choose the hour that the Sun himself will set alight the pyre for which they are destined. Tintin and Haddock end up on the same pyre as Professor Calculus. Tintin has, however, chosen the hour of their death to coincide with a solar eclipse, and the terrified Inca believe Tintin can command Pachacamac, their god, the Sun. The Inca prince implores Tintin to make the Sun show his light again. At Tintin's command, the Sun obeys, and the three are quickly set free. Afterwards, the Prince of the Sun tells them the seven crystal balls used against the explorers who had excavated Rascar Capac's tomb contained a ""mystic liquid"" obtained from coca, which plunged the seven explorers into a deep sleep. Each time the Inca high priest cast his spell over seven wax figures he could use them as he willed, as punishment for their sacrilege. Tintin convinces the Inca prince the explorers wished only to make known to the world the splendours of their civilisation. The Inca prince orders Huascar to destroy the wax figures and at that moment in Europe the seven explorers awaken. After swearing on their own accord to keep the colony's existence secret, Tintin, Captain Haddock and Professor Calculus are bestowed with a gift of gold and jewels, only a sample of the treasure of the Incas for which the Spanish conquerors searched in vain for so long. Zorrino decides to stay with the Incas; his new friends return safely to Europe.",0
