id,title,author,published_date,categories,summary,page_count
808425,The Sword of Shannara,Terry Brooks,1977,"{""/m/06n90"": ""Science Fiction"", ""/m/0dwly"": ""Children's literature"", ""/m/014dfn"": ""Speculative fiction"", ""/m/01hmnh"": ""Fantasy"", ""/m/02xlf"": ""Fiction"", ""/m/03qfd"": ""High fantasy""}","The Sword of Shannaras events take place 2000 years after an apocalypse has occurred: nuclear holocaust has wiped out most of the planet. During this time, Mankind mutated into several distinct races: Men, Dwarves, Gnomes, and Trolls, all named after creatures from ""age-old"" myths. Also, the Elves begin to emerge after having been in seclusion and hiding for centuries. The warring that caused the holocaust is referred to as the ""Great Wars"" throughout the novel. These wars rearranged the planet's geographical attributes and wiped out most life forms on Earth. As a result of the Great Wars, most advanced technology has been lost, thus most of the events in the Shannara series take place in a medieval setting. However, magic is also back into the world, rediscovered after the loss of technology. 1000 years before The Sword of Shannara, an Elf named Galaphile gathered all of the people who still had some knowledge of the old world to Paranor in an attempt to bring peace and order to all of the races. They named themselves the First Druid Council. However, a rogue Druid named Brona and a few followers left, taking the Ildatch with them; this magical tome had subverted their minds and had brought them under its control. 250 years later, Brona began the First War of the Races when he convinced all Men to attack the other races. He almost succeeded in seizing rule of the Four Lands, but the tide turned, and the war ended with his defeat and subsequent disappearance. The Druids divided the Four Lands among the races to reduce interracial tension, and then became reclusive, withdrawing to Paranor because of their shame at the betrayal by one of their own members. Two and a half centuries after the First War of the Races, Brona returned as the Warlock Lord, now with Skull Bearers as his servants. Chronicled in the prequel novel First King of Shannara, the Second War of the Races began with the destruction of the Druid Order. A lone Druid, Bremen, then forged a magical talisman for the express purpose of destroying the Warlock Lord; it was given to the Elven King, Jerle Shannara. As it takes the form of a blade, the talisman was named the Sword of Shannara. It succeeded in banishing the Warlock Lord, though he was not killed, while his entire army was subsequently defeated by the combined armies of the Elves and Dwarves. Yet peace came at a high price, as interracial tension was renewed and the Druids had seemingly vanished from the land. About five centuries later, the Ohmsford family of Shady Vale in the Southland took in the half-Elven child Shea. He took the name Ohmsford and was raised as a brother to the family's son Flick. Becoming inseparable, the brothers helped to run the family inn. The novel begins with Shea as a young man and the mysterious Allanon arriving in the Vale. Tall and dark, his face perpetually shadowed under his hood, he was the last of the Druids. Allanon warned the Ohmsford brothers that the Warlock Lord had returned to the Skull Kingdom in the Northland and was already coming for Shea, as he was the last descendant of Jerle Shannara—and therefore the only one capable of wielding the Sword of Shannara against the Warlock Lord. Allanon departed, leaving Shea three Blue Elfstones for protection. He told Shea to flee at the sign of the Skull. A few weeks later, a creature bearing a symbol of a skull showed up: a Skull Bearer, one of the Warlock Lord's ""winged black destroyers"", had arrived in town to search for Shea. The brothers were forced to flee with the Skull Bearer on their heels. They eventually took refuge in the nearby city of Leah where they found Shea's friend Menion, the son of the city's lord. Menion decided to accompany the two, and he traveled with them to Culhaven, to meet with Allanon and also encountering various monsters like the creature from the Mist Marsh and the Sirens. While at Culhaven, they are joined by a prince of Callahorn, Balinor Buckhannah, two elven brothers, Durin and Dayel Elessedil, and the dwarf Hendel. The party sets out for Paranor. But along the way, Shea falls over a waterfall and becomes separated from the group. Allanon spurs the group to continue on to Paranor, and they eventually reach it. Once there, the party gets into a battle with minions of the Warlock Lord and find that the Sword of Shannara has already been removed. The party then learns of the Warlock Lord's invasion of the Southland, and decide to split up to do what they can to stop it. Disguised by Allanon, Flick infiltrated the enemy camp and rescued the captive Elven King, Eventine Elessedil; at the same time, in Kern, Menion saved a woman named Shirl Ravenlock and immediately fell in love with her. Together, they organized an evacuation of Kern before the Northland army reached the city. Balinor returned to Tyrsis in order to activate the Border Legion, only to find that it had been disbanded. Balinor was then imprisoned by his insane brother Palance Buckhannah, who had taken control of Callahorn's rule. His advisor, Stenmin, had driven Palance insane by drugs fed to him, making him his pawn. With help from Menion, Balinor escaped and confronted both Palance and Stenmin. Practically cornered, Stenmin stabbed Palance as a distraction and fled. Now commanded by Balinor, Callahorn's reformed Border Legion marched out of Tyrsis and engaged the Northland army at the Mermiddon River, killing many Northlanders before being forced to pull back; the Border Legion used the time gained to retreat to Tyrsis and make preparations for defense. During the siege of Tyrsis, Hendel and Menion come upon Stenmin and some of his supporters. Hendel is killed, but Menion kills Stenmin. After about three days, the Border Legion was finally beaten back from the Outer Wall of Tyrsis as a result of treachery—the wall fell when the traitors destroyed the locks on the main gate, jamming it open. At the defenders' last stand on the Bridge of Sendic, the Northlanders abruptly broke and ran. After being captured by Gnomes as soon as he had gotten out of the river, Shea was rescued by the one-handed thief Panamon Creel and his mute Troll companion Keltset Mallicos. Journeying to the Northland, they reached the Skull Kingdom, where the insane Gnome deserter Orl Fane had carried the Sword of Shannara in his madness. Infiltrating the Warlock Lord's fortress in the Skull Mountain, Shea reached the sword and unsheathed it. He finally learned about its true power, which was its ability to confront those, when touched, with the truth about their lives. The Warlock Lord materialized and tried to destroy Shea, but the youth stood his ground and confronted his enemy with the sword. Although immune to physical weapons, the Warlock Lord vanished after being forced to confront the truth about himself: though he had deluded himself into believing that he was immortal, this is impossible. The Sword forced him to confront this paradox, and it killed him. Keltset sacrificed himself to save his companions during the Skull Kingdom's destruction. In the south, the Northland army retreated after the Warlock Lord's downfall. Allanon saved Shea's life and revealed himself as Bremen's centuries-old son, before disappearing to sleep. Peace returned to the Four Lands. Balinor took up his country's rule, while Dayel and Durin returned to the Westland, and Menion returned to Leah with Shirl. Reuniting, Shea and Flick returned to Shady Vale.",0
810224,Summer of Night,Dan Simmons,1991-01,"{""/m/014dfn"": ""Speculative fiction"", ""/m/03npn"": ""Horror""}","Set in Elm Haven, Illinois, in 1960, Summer of Night recounts its five pre-teen protagonists’ discovery that eerie, terrifying events are unfolding in the Old Central School. Operatives, including a dead soldier; giant worms with rows of sharp, serrated teeth; the animated corpse of a deceased teacher; schoolyard bullies; the driver of a rendering truck; their school teacher, and the principal of the school, serve a centuries-old evil that seeks to be reborn in their time—and in their town. It is only by banding together that the pre-teens can hope to defeat the monstrosity before it destroys them, their friends, their families—and, possibly, the world. The sequel to Summer of Night is called A Winter Haunting, in which Dale Stewart, now grown, returns to Elm Haven. Another sequel is Children of the Night, which features Mike O'Rourke, now a Roman Catholic priest, who is sent on a mission to investigate bizarre events in a European city. Another Summer of Night character, Dale's younger brother, Lawrence Stewart, appears as a minor character in Simmons' thriller Darwin's Blade while the adult Cordie Cooke appears in Fires of Eden.",0
811486,The Elfstones of Shannara,Terry Brooks,1982,"{""/m/03qfd"": ""High fantasy"", ""/m/0dwly"": ""Children's literature"", ""/m/01hmnh"": ""Fantasy"", ""/m/014dfn"": ""Speculative fiction"", ""/m/02xlf"": ""Fiction""}","The magical Ellcrys tree was beginning to die, thus weakening the spell that held the Forbidding. The Ellcrys spoke to the Chosen, telling them of a rebirth, a process which enables a new Ellcrys to be born—but this can only be done at the fountain of the Bloodfire. The Chosen then informs their Prince Ander Elessedil and King Eventine Elessedil of the matter. However, there is no one who knows of the location of the Bloodfire. A search in the ancient Elven library reveals one reference to the Bloodfire. It states that it lies in a place named ""Safehold"". At the same time, a powerful Demon, the Dagda Mor, escapes from the waning Forbidding, bringing with it the Reaper and the Changeling. The Dagda Mor then sends the Reaper to kill all the Chosen, and the Changeling to act as a spy for the demons within the Elven city. Eventine finds himself at a loss, for only the Chosen can make the rebirth of the Ellcrys happen. The Druid Allanon appeared, telling Eventine that his coming must remain a secret, and promising to find out the location of Safehold. He went to the ancient Druid keep, Paranor, in an attempt to locate Safehold. After learning its location, Allanon was ambushed by the Dagda Mor and a handful of Furies. He retreated to Storlock for a time, and then went to Havenstead with Wil Ohmsford--who is a Healer, a descendant of Jerle Shannara and bearer of the Elfstones--to find Amberle Elessedil, who is King Eventine's granddaughter and a Chosen, who abandoned her duty to the Ellcrys and fled the Elven capital, Arborlon. She eventually agreed to return to Arborlon with them, only giving in when Demon Wolves were closing in upon them. En route, close to the Silver River, Allanon, Amberle and Wil were ambushed by Demon wolves. Allanon fended off the Demons while Wil and Amberle escaped to safety. The King of the Silver River took them in and sheltered them just before they would have been caught; after talking with him, the duo discover they have been transported miles away from where they started, and have no idea if Allanon survived or where he was. They decided to continue on to Arborlon and hoped to meet him there, but on the way their horse was stolen by Rovers, a gypsy-like group of people who travel in caravans and recognize no laws but their own. Wil insisted that they get the horse back, and ingratiated himself to the Rovers and their leader Cephalo by using his skills as healer to help some of the sick or mildly injured members of the family. He met Eretria, a beautiful Rover girl Cephalo said was his daughter; in reality, she was not his daughter at all and would be sold now that she was of an age to marry. She was immediately attracted to Wil and wanted to help him get the horse back, if he promised to take her with him when he escaped. A giant demon attacked the caravan and Wil was forced to use the Elfstones to defend the Rovers, finally destroying the demon, but damaging himself somehow in a way he did not understand. Cephalo was angry with him, but let he and Amberle leave with their horse. Eretria was left behind but promised to Wil that they would meet again. After being pursued by demons, Wil and Amberle managed to regroup with Allanon and return to Arborlon. Amberle received a seed from the dying Ellcrys and prepared to go to Safehold with Wil, six Elven companions and the Captain of the Home Guard, Crispin. After they journeyed by boat to the Elven outpost at Drey Wood, the group found the entire garrison that had been stationed at the outpost dead—and the Reaper, who had killed all of them. They managed to escape by setting off down the river once more, but two of the Elven guards were run down and killed in the process. Wil realized that there must have been a spy in Arborlon, and that if the spy knew about Drey Wood, then it was likely their mission was known and they would be pursued the entire way. The party then goes to the Matted Brakes, where another two of the group are killed by an unknown massive creature. After escaping from the Brakes, the remaining group of five found themselves at an ancient Elven fortress named Pykon. The group made the decision to rest the night there, but the Reaper found them again and killed the final two Elven hunters. Wil and Amberle ran into the network of tunnels inside of the Pykon to try to find Crispin, who had gone into there to try to find a way out. Wil and Amberle finally lost the Reaper by destroying a bridge over a gorge, but they lost Crispin as well. During the battle, Wil failed to unlock the power of the Elfstones and believed that his human blood was blocking him from using them. He was resigned to not being able to use the stones anymore, and decided that they would just have to get along without them. The duo met the young Wing Rider Perk soon after, who agreed to take them into the Wilderun on his Roc, Genewen. He also agreed to fly over the Hollows every day for a week in case the duo had need of his help. Meanwhile, Allanon and the Elves went to war with the Demons, beginning the War of the Forbidding. The Elven army took up two positions in two mountain passes named Halys Cut and Worl Run. Having no weapons, the Demons used human-wave tactics in the ensuing battles and literally ran over the Elven army, even managing to injure King Eventine. Ander's brother, Arion Elessedil, was killed as well in Worl Run. Defeated, the Elven force retreated first to Baen Draw, successfully defending it until it was discovered that they were being flanked. They then retreated to Arborlon, their last line of defense. In the process, they lost their commander, Kael Pindanon. Shortly after their return to Arborlon, Dwarf and Troll contingents joined them, uniting banners from all four of the Four Lands for the first time in history. Eventine was recovering in his room when the Changeling, disguised for months as Eventine's pet dog Manx, tried to kill the old king in his bed. Eventine killed the Demon, but was badly wounded and near death. Amberle and Wil traveled to Grimpen Ward, a town of thieves and cutthroats in the Widlerun. Wil caused a stir by healing an old inkeeper woman and jokingly claiming he did it with magic. Thieves try to rob he and Amberle, but they were rescued by Cephalo and Eretria. Wil told Cephalo of his need to go to the Hollows, claiming it was for a rare medicine for Eventine's daughter. Cephalo takes them to Hebel, an old hermit who lives in the Wildrun. Hebel recognized the name Safehold and knew where it was; under a lonely mountain in the hollows, the domain of the Witch Sisters. Wil and Amberle went on despite Hebel's warnings, after parting ways with the Rovers. They soon found out that the Elfstones were stolen by Cephelo, and that he had wanted them ever since he had seen Wil use them on the demon that attacked the caravan. Wil left Amberle at the edge of the Hollows and pursued Cephelo. Eretria once again helped Wil to locate Cephelo only to find that he and the rest of his followers were killed by the Reaper. Wil regained the Elfstones and traveled back to the rim of the Hollows with Eretria. He found Amberle missing. Hebel appeared and agreed to track Amberle for Wil. Together with Hebel's dog, Drifter, they tracked Amberle to the witch Mallenroh's tower. Mallenroh captured them and decided to keep the Elfstones for herself, locking up Wil and the rest as prisoners until Wil agreed to give her the stones. Mallenroh's identical twin sister Morag arrived, and the Witch Sisters fought and killed each other. Wil, Eretria, Hebel, and Drifter escaped with Amberle, the Elfstones, and Mallenroh's servant, Wisp; who brought them to the Bloodfire. Amberle absorbed both the Bloodfire and bathed the seed of the Ellcrys in it. The Reaper attacked them and killed Wisp, but Wil destroyed it be realizing that he wasn't unable to use the Elfstones because of his human blood, but because he was afraid of them and had formed a mental block against using them. He broke the block, focusing the power of the Elfstones upon the Reaper's cloaked face and destroying it. Wil had Amberle called Perk, who brought Wil, Amberle and Eretria back to Arborlon while Hebel returned home. By this point, the Demons had begun a full frontal assault upon Arborlon. Despite desperate attempts to blunt the attacks, the seven gates fell one by one to the superior numbers of the Demons. The Demons eventually broke through the last of the Elven capital's major defenses (the seventh gate). At this point, Allanon engaged and defeated the Dagda Mor in a titanic battle while the forces of ""good"", now severely depleted, regrouped at their last line of defense: the Gardens of Life, where the Ellcrys resided. The Demons tried to reach the Ellcrys to destroy her, but they were held back by those forces of ""good"" just long enough so that Wil and Amberle could fly in. Amberle touched the dead Ellcrys and was transformed into the new Ellcrys; and with this action, Amberle restored the Forbidding, banishing the Demons back to their alternate universe. It was revealed by Allanon to Wil that he knew all along that Amberle would become the new Ellcrys. Wil was angry and told Allanon he should have been honest, but Allanon claimed that she would not have believed him. He reminds Wil that Amberle knew what would happen and made the choice herself, and that no one forced her. She did what only she could do, and in so doing saved humanity from the Demons. Wil was still bitter about the deception, because he had loved Amberle and didn't want to lose her the way he had. It is then revealed that Allanon has aged, because he used too much of the magic in the fighting with the Demons. He said he was going to Paranor to sleep, and then left in the middle of the night without seeing or speaking with anyone else. Eventine passed away, and Ander became the new King. With the Demons banished once again, the survivors the War returned to their homes. Wil visited the Ellcrys and came to terms with Amberle's sacrifice. He then left Arborlon to continue his studies as a healer, taking Eretria with him.",0
811651,The Mysterious Island,Jules Verne,1874,"{""/m/06n90"": ""Science Fiction"", ""/m/0dwly"": ""Children's literature"", ""/m/05hgj"": ""Novel"", ""/m/08sdrw"": ""Adventure novel"", ""/m/02xlf"": ""Fiction"", ""/m/01gw42"": ""Scientific romance""}","The book tells the adventures of five Americans on an uncharted island in the South Pacific. The story begins in the American Civil War, during the siege of Richmond, Virginia, the capital of the Confederate States of America. As famine and death ravage the city, five northern prisoners of war decide to escape by the unusual means of hijacking a balloon. The five are Cyrus Smith, a railroad engineer in the Union army (named Cyrus Harding in some English translations); his black manservant Neb (short for Nebuchadnezzar), whom Verne repeatedly states is not a slave but an ex-slave who had been freed by Smith; the sailor Bonadventure Pencroff (who is addressed only by his surname, but his ""Christian name"", Bonadventure, is given to their boat; in other translations, he is also known as Pencroft); his protégé Harbert Brown (called Herbert in some translations), a young boy whom Pencroff raises as his own after the death of his father (Pencroff's former captain); and the journalist Gedéon Spilett (Gideon Spilett in English versions). The company is completed by Cyrus' dog 'Top'. After flying in stormy weather for several days, the group crash-lands on a cliff-bound, volcanic, unknown (and fictitious) island, described as being located at , about east of New Zealand. (In reality, the closest island is located at . In location and description though, the phantom island Ernest Legouve Reef may correspond to the rock that is left of the mysterious island at the end of the novel. ) They name it ""Lincoln Island"" in honor of American President Abraham Lincoln. With the knowledge of the brilliant engineer Smith, the five are able to sustain themselves on the island, producing fire, pottery, bricks, nitroglycerin, iron, a simple electric telegraph, a home on a stony cliffside called ""Granite House"", and even a seaworthy ship. They also manage to figure out their geographical location. Throughout their stay on the island, the group has to overcome bad weather, and eventually adopts and domesticates an orangutan, Jupiter, abbreviated to Jup (or Joop, in Jordan Stump's translation). The mystery of the island seems to come from periodic and inexplicable dei ex machina: the unexplainable survival of Cyrus Smith from his fall from the balloon, the mysterious rescue of his dog Top from a dugong, the presence of a box full of equipment (guns and ammunition, tools, etc.), the finding of a message in the sea calling for help, the finding of a lead bullet in the body of a young pig, and so on. Finding a message in a bottle, the group decides to use a freshly built small ship to explore the nearby Tabor Island, where a castaway is supposedly sheltered. They go and find Ayrton (from In Search of the Castaways) living like a wild beast, and bring him back to civilization and redemption. Coming back to Lincoln Island, they are confused by a tempest, but find their way to the island thanks to a fire beacon which no one seems to have lit. At a point, Ayrton's former crew of pirates arrives at the Lincoln Island to use it as their hideout. After some fighting with the heroes, the pirate ship is mysteriously destroyed by an explosion. Six of the pirates survive and considerably injure Harbert through a gunshot. They pose a grave threat to the colony, but suddenly the pirates are found dead, apparently in combat, but with no visible wounds. Harbert contracts malaria and is saved by a box of sulphate of quinine, which mysteriously appeared on the table in the Granite House. The secret of the island is revealed when it turns out to be Captain Nemo's hideout, and home harbour of the Nautilus. It is stated that having escaped the Maelstrom at the end of Twenty Thousand Leagues Under the Sea, the Nautilus sailed the oceans of the world until all its crew except Nemo had died. Now an old man with a beard, Nemo returned the Nautilus to its port under Lincoln Island. All along it was Captain Nemo who had been the savior of the heroes, provided them with the box of equipment, sent the message revealing Ayrton, planted the mine that destroyed the pirate ship, and killed the pirates with an ""electric gun"" (Most likely one of the air rifles that is used in the previous novel Twenty Thousand Leagues Under the Sea). On his death bed Captain Nemo reveals his true identity as an Indian Prince Dakkar, a son of a Raja of the then independent territory of Bundelkund and a nephew of the Indian hero Tippu-Sahib. After taking part in the failed Indian Rebellion of 1857, Prince Dakkar escaped to a deserted island with twenty of his compatriots and commenced the building of the Nautilus with the new name of Captain Nemo. Nemo tells his life story to Cyrus Smith and his friends and dies, saying ""God and my country!"" The Nautilus is then scuttled and serves as Captain Nemo's tomb. Eventually, the island explodes in a volcanic eruption. Jup the orangutan falls down a crack in the ground and dies. The colonists, warned by Nemo, find themselves at sea on the last remaining boulder of the island that is above sea level. They are rescued by the ship Duncan, which has come to pick up Ayrton and was itself informed by a message left on Tabor Island by Nemo.",0
