id,title,author,published_date,categories,summary,page_count
10309074,The Tale of Pigling Bland,Beatrix Potter,1913,"{""/m/0dwly"": ""Children's literature"", ""/m/02xlf"": ""Fiction""}","Aunt Pettitoes, an old sow, can no longer cope with her eight troublemaking offspring and thus makes them leave home, with the exception of a well-behaved sow named Spot. Two of them, boars named Pigling Bland and Alexander, go to market. Pigling Bland is very sensible but the more frivolous Alexander loses his pig license and, when he fails to produce them to a passing policeman, is made to return to the farm. Reluctantly going on alone, Pigling Bland later finds the missing papers, which ended up in his pocket as a result of an earlier scuffle with Alexander. He tries to find his brother but ends up getting lost in the woods and has to spend the night in a stranger's chicken coop. He is found in the morning by a gruff farmer, Peter Thomas Piperson, who allows him to stay in his house, but Pigling is not sure the farmer is trustworthy. His fears are quickly confirmed when he discovers that Piperson has a second pig in his house who was stolen from her owner and whom he intends to turn into bacon and ham. The second pig, a beautiful black Berkshire sow named Pig-wig, suggests they run away so that they won't be sold, or worse, eaten. Pigling Bland has in any case decided to avoid the market and become a potato farmer instead. At dawn the pair sneak off but in the course of their escape they come across a grocer in a cart who recognises Pig-wig as the recently stolen pig for whom a reward has been issued. By being co-operative, and with Pigling Bland faking a limp, the two pigs manage to gain time and, once the grocer is at a safe distance, flee to the county boundary and finally, over the hills and far away, where they dance to celebrate their new found freedom.",0
10310839,Démolir Nisard,Eric Chevillard,2006,"{""/m/05hgj"": ""Novel""}","The book is about the struggle of the narrator (who seems very much like the author himself) to annihilate Désiré Nisard, a French author and critic (1806–1888). One of the characteristics of Nisard that so infuriates Chevillard's narrator is the fact that the critic so loathed the burgeoning modern French literature of his times. As Nisard considered that only classicism had a value, Chevillard's book can also be considered a form of meta-criticism upon contemporary trends in Literary criticism.",0
10311041,Stanford Wong Flunks Big-Time,Lisa Yee,2005-10-01,UNK,"A slack-off, fun-loving, basketball prodigy, Stanford Wong is ready for summer. He's going to spend every day at the park with his best friends (Stretch, Gus, Tico and Digger) and he's going to basketball camp where he'll learn from the pros. But his English teacher, the horrible Mr. Glick, presents him with some bad news: he got an F on his last book report on Holes and failed English class. Now Stanford must trade basketball camp for summer school - and as if this weren't bad enough, his mom hired a tutor for him: his arch-enemy Millicent Min. A child genius, Millicent Min is a senior in high school at age eleven, not to mention a world-class jerk. She hates Stanford as much as he hates her. Stanford's situation deteriorates as his father continues to distance himself from home, his grandmother becomes senile and moves to a dead retirement home, Millicent tortures him in their study sessions, and his lie to his friends becomes harder and harder to cover up - because he's told them that he passed English with flying colors. Life improves slightly when the beautiful new girl, Emily Ebers, takes an immediate liking to Stanford (the feeling is mutual) but Emily is Millicent Min's one and only friend. Apparently, though, Millicent doesn't want Emily to know of her sky-high IQ, because Emily is under the impression that Millicent is not only home schooled, but tutored by Stanford. Stanford goes along with this lie because he believes that Emily will never like him if she knows he is stupid. In a strange way, Millicent and Stanford form a tentative friendship; they are bound by their affection for Emily, and in the process, the two become closer as well. Soon, everything falls apart: Emily inadvertently discovers Stanford and Millicent's secret. She shuns them both, not because of their varying intelligence levels, but because they lied to her. A classmate and basketball player, Digger Ronster, knows what Stanford really got on his book report, and blackmails Stanford into purposely losing whenever they play basketball with the other guys. Stanford descends into depression because all of his lies have fallen through. He is saved, though, when Emily forgives him. Also, Stanford doesn't have any more trouble with his friends because even though they know that Stanford lied about his English grade, they forgive him, too. Digger leaves Stanford alone after realizing that his blackmail no longer works. Millicent and Stanford make up after getting in a fight over Emily. Emily kisses Stanford on the cheek and the two start dating. At the end of the story, Stanford's father reveals that he has been working so incredibly hard all the time because he was hoping for a promotion - which his boss granted him. However, the promotion required a relocation to New York. Stanford protests angrily, but his father tells him that he didn't take the job. He says that he just recently realized how distant he became from his family, and that wants to reconnect with them. Now that he had rejected the promotion, he says, he would probably have a lot more free time on his hands to spend with Stanford. The book ends with Stanford thinking, ""I have so much to tell my dad."" Later that night, he falls asleep wearing Alan Scott BK620s, what he always wanted the whole summer.",0
10311192,Shadow Game,Christine Feehan,UNK,"{""/m/014dfn"": ""Speculative fiction"", ""/m/01hmnh"": ""Fantasy"", ""/m/01qxvh"": ""Romance novel""}","Dr. Peter has succeeded in enhancing the psychic abilities of a group of men in the Special Forces. These men, called Ghostwalkers, have the ability to move objects, control animals, even walk in dreams. Despite the resounding success, there are problems. Some of the men suffer great pain due to psychic overload, unable to block or filter the thoughts and feelings of others, and need to have anchors (someone to draw the overwhelming emotions away) in order to function. A year into the experiment, some of the men began to die, supposedly from side effects of the process. To help find the answers, Dr. Whitney brings in his daughter, Lily, who is psychic. Lily is at first reluctant to join, but her father is insistent. She is stunned by her immediate and powerful attraction to Captain Ryland Miller, the leader of the Ghostwalker team. He thinks that Peter has betrayed him and his men, separating them from their anchors. He is sure that the men have been murdered and suspects that he’s next. She is also jarred by the evident animosity between her father and Colonel Frank Higgens, Miller’s immediate commanding officer. He and Whitney argue over Whitney’s denying Higgens access to his notes about the enhancing process. Higgens even admits to breaking into Whitney’s computer. Peter Whitney asks Lily to meet him for dinner after leaving the lab, but he doesn’t show. Despite his lack of psychic ability, he somehow telepathically contacts his daughter. He’s dying; someone at Donovan’s is responsible for his murder. He tells her that believes that someone is trying to sabotage the experiment and that that person is within the project itself. He also tells her that there’s a secret laboratory with all his notes on the project. The then begs her forgiveness, and that she has to help the remaining men and find “the others”. Before he can say anything more, she feels him being dumped into the ocean. Stunningly, someone forces her to break contact with her father, Ryland Miller. Several days after her father’s murder, she meets with Ryland Miller again and confronts him. She asks him if he was involved Peter’s death. He denies it; he felt that Dr. Whitney was the only man who could help his men. Realizing that the men cannot stay at Donovans, Lily agrees to help Captain Ryland Miller and the others escape. In her large home, the men can hide while she teaches them the techniques and exercises to help them rebuild their mental barriers. She also finds her father’s hidden lab. Once she does, she’s hit with several brutal shocks. She is not Peter Whitney’s biological daughter. She, along with eleven other psychic girls, all under the age of three, were taken from European orphanages by him and experimented on, just like Ryland and his men. He chose girls because there was an abundance of female children abandoned by their families. Even more alarming, he experienced the same complications with the girls as he had with the men: painful headaches, brain bleeds, seizures. Just like the men, they had lost their natural barriers and Whitney couldn’t undo what he had done. So, he stopped the experiment; he had the other girls adopted and kept Lily. He tried the experiment again because he thought that he had gone wrong by choosing such young subjects. He felt that adult, well-trained subjects wouldn’t have the same problems, but he was wrong. Once the men escape to Lily's home, she discovers that one of the men had electrodes planted in his head. This could only be done for one reason, to induce brain bleeds and kill him. Now it all become clear to Lily; someone is trying to steal the process and sell it on the open market. When they were unable to break into Whitney's computer and get his notes, they resorted to killing the men to dissect them in order to discover how process worked. When Dr. Whitney became suspecious of the deaths, he too was murdered. The situation is even more complicated by Ryland and Lily's powerful attraction to one another. Lily fears that it's the result of her father's manipulation, and doesn't trust it. Ryland knows he's in love with Lily and doesn't care it is because of what Whitney has done. Lily thinks that Higgins and Philip Thornton, CEO of Donovans are responsible but she has no real proof. Luckily she finds a recording of Higgins (secretly made by her father) plotting not only Ryland's death, but also of General Ranier, Higgins' commanding officer. With the tape, they stop Higgins and restore the reputations of the Ghostwalkers. Now Lily and Ryland begin to search for the young women Peter put up for adoption.",0
10312547,Peter Pan,J. M. Barrie,UNK,UNK,"The Darling Nursery As Mr. and Mrs. Darling prepare for an evening out, two of their children, Wendy and John, play their parents. When Mrs. Darling comes in and sees Michael is left out, she gets him in the game and joins in with all of them (""1, 2, 3"") while their nursemaid, the dog Nana, watches. Mr. Darling comes in to have his tie tied, and he questions using a dog as a nursemaid, but Mrs. Darling defends her. The previous week, while the children slept, Nana was surprised to see a boy in the room. Before she could catch him, he flew out the window. She did manage to catch his shadow, however, which Mrs. Darling has tucked away in a drawer. Nevertheless, Mr. Darling insists that Nana spend the night downstairs. Mrs. Darling and the children sing a lullaby (""Tender Shepherd""). The children fall asleep. A fairy, Tinker Bell, and Peter Pan fly in through the window. Tinker Bell shows Peter where his shadow is hidden. He tries to reattach it and starts to cry when he can not get it to stick. Wendy wakes up and asks, ""Boy, why are you crying?"" When he explains, she offers to sew his shadow to his foot. Peter is thrilled when his shadow is reattached (""I've Gotta Crow""). Peter tells Wendy about how he has lived a long time among the fairies, and how one of them dies every time a child says he or she does not believe in fairies. Peter tries to introduce Wendy to Tinkerbell (who accidentally got shut in the drawer when Peter found his shadow), but Tink is jealous and will not be polite. Wendy asks where he comes from, and Peter tells her of his island, called Neverland (""Never Never Land""). Peter says he sometimes came to Wendy's window to listen to her mother's stories and tells them to the Lost Boys, forgotten children who end up living in Neverland; Wendy says she will tell him and the Lost Boys all the stories she knows, if Peter will let her bring Michael and John along, to which Peter agrees. Wendy wakes her brothers up, and Peter invites them all to Neverland, and promises to teach them to fly. They happily agree and ask Peter to show them. Peter happily launches himself into the air (""I'm Flying""). Peter covers the kids in fairy dust and tells them to ""think lovely thoughts."" Soon the children are flying just like Peter. (""I'm Flying – Reprise"") Grabbing some belongings, the children follow Peter, but Michael doubles back when Liza comes into the room, giving her some of his fairy dust and telling her to come to Neverland with them. Peter and children fly through the night to Neverland. Never Land Peter's ""Lost Boys"" are standing outside their underground lair, wondering when he will return, when they hear Captain Hook and his pirates (""Pirate Song""). The boys hide. Hook tells Smee, his right-hand man, that he wants to kill Peter most of all, because Peter is the one who cut off his hand and threw it to a crocodile, which has developed a taste for Hook and follows him around, hoping to eat more of him, but luckily ate a clock that ticks and will alert Hook to its presence. Hook accidentally stumbles upon the entrance to the hideout, and summons Smee and his men to provide background music while he plans the Boys' demise (""Hook's Tango""), a rich cake with poisonous icing. Hook suddenly hears a loud tick-tock; the crocodile appears but Hook escapes. The pirates flee, and the Boys reappear, thinking they are safe. Suddenly, a group of ""Indians"" appears, led by Tiger Lily (""Indians""). They leave the Boys alone, and go on hunting the pirates. The boys suddenly see Wendy, whom they confuse for a bird, in the sky, and one of the Boys fires an arrow (the Indians run away in fear). Peter, Michael and John land to find the arrow lodged in her heart. She is not dead, but she can not be moved into the hideout, so the Lost Boys build a house around her, hoping that she will agree to be their mother (""Wendy""), to which, when she wakes up, she agrees. Hook plants the cake, but Wendy thinks it too rich; instead, she will tell the Boys stories. Hook is infuriated that the Boys have found a mother. He plots to kidnap Wendy and the Boys, while Smee and the pirates play a ""Tarantella"". After the pirates leave for their ship, Liza arrives and does a ballet with the animals of Never Land while Peter sleeps outside the house. A few days pass with everyone having adventures. One day in the forest, after Peter leads the Boys in their anthem (""I Won't Grow Up""), they almost run into the pirates, who arrive with a pirate carrying Tiger Lily over his shoulder. They tie her to a tree for the wolves to eat. Peter hides and, feeling sorry for Tiger Lily, throws his voice in mimicry of the Captain and convinces the men to let her go. Hook arrives and becomes enraged at the news of her release. He demands that the ""spirit of the forest"" speak to him, so Peter tricks them all to think he is Hook, and the real Hook is a codfish. The pirates abandon Hook, but Hook convinces the ""spirit"" to reveal its true identity. Peter obliges, disguising himself as a ""beautiful lady"" (""Oh, My Mysterious Lady""). Hook catches on and tries to ambush Peter (and the pirates rejoin), but the pirates are chased away by Tiger Lily and her Indians. Back at the hideout, Tiger Lily and the Indians rush in, and are almost shot by the Boys, until Peter reveals the truce between them. They smoke a peace pipe and vow eternal friendship (""Ugg-a-Wugg""). Tiger Lily and her Indians leave to stand guard around the house above. Wendy asks Peter to sing the Boys a lullaby (""Distant Melody""). Michael and John want to return home, and Wendy admits to being homesick, too. The Boys wish they had parents, and Wendy offers hers to all of them. Everyone is excited about being adopted, except Peter, who says he will not go because he knows he will grow up if he does. Wendy tells him she will come back once a year to do his spring cleaning. The pirates attack and subdue the Indians. They give Peter a fake all-clear signal, so Peter sadly sends Wendy, her brothers, and the Lost Boys on their way. Before she leaves, Wendy sets out Peter's ""medicine"" for him to take before bed. After she tearfully leaves, Peter, who pretended not to care, throws himself on a bed and cries himself to sleep. As the they leave the underground house, Wendy and the boys are captured by the pirates. Once the boys and Wendy are carried off to the pirate ship, Hook sneaks into the lair and poisons Peter's medicine. Tinker Bell awakens Peter, tells him of the ambush, and warns him about the poison, but he waves her off as he prepares for a rescue. Desperate, she drinks the poison herself. Dying, she tells Peter that if every boy and girl who believes in fairies would clap their hands, she would live. Peter asks the audience to believe and clap their hands. They do, and Tinker Bell is saved. Peter grabs his sword and heads off to rescue Wendy and the Boys. The Jolly Roger Hook revels in his success (""Hook's Waltz""). As the plank is prepared, Hook hears the tick-tock of the crocodile and panics. It is actually Peter with a clock, and while Hook cowers, Peter and the Boys help the Indians, the animals and Liza onto the ship and hide. Peter hides in a closet and kills two pirates Hook sends in. The pirates then carry the Boys in, and the Boys pretend to be afraid as they are carried in. Peter disguises himself as a pirate, and the pirates think the ""doodle-doo"" (named so as Peter still crows after killing the pirates) killed all the Boys. Hook believes the ship is now cursed, and everyone thinks Wendy is the source. The pirates push Wendy to the plank. Peter ditches his disguise, and the Indians and animals attack, as well as the Boys who are alive and armed. The pirates are all defeated, and Peter challenges Hook to a duel and defeats him. Hook threatens to blow up the ship with a bomb, but runs into the real crocodile (whom Peter also brought on the ship). Peter catches the dropped bomb and tosses it in the sea after Hook slides down the plank (which is shaped like a slide) with the crocodile chasing behind him. Hook is presumably blown to smithereens. Everyone sings Peter's praises (""I've Gotta Crow"" (reprise)). Before the Darling children and everyone goes to London, Liza asks Peter to teach her to crow (""I Gotta Crow – 2nd reprise""). Back home, the Darlings sit by the nursery window night after night, hoping for their children to return. The children silently reappear and sing to their mother (""Tender Shepherd"" reprise). Joyous over their return, the Darlings happily agree to adopt the Lost Boys (""We Will Grow Up""). Wendy prays to the window that Peter will return to her. Years pass, and Peter comes to the nursery, surprising a much older Wendy, who no longer expected him. He wants her to come to Never Land for spring cleaning, but she tells him that she cannot – she has grown up; she is married and has a daughter of her own now, Jane. Peter begins to cry, and Wendy leaves the room at the sound of her husband's offstage voice. Jane awakes, and like her mother before her, asks, ""Boy, why are you crying?"" Peter introduces himself, but Jane knows all about him from her mother's stories. She has been waiting for him to come take her to Never Land and to learn to fly. Peter, now happy again, throws fairy dust on her, but as they are about to leave, Wendy tries to stop them, saying, ""Oh, if only I could go with you!"" In the most poignant moment of the show, Peter answers with a sad but understanding smile, ""You can't. You see, Wendy, you're too grown up"". And so, Wendy reluctantly lets Jane go, ""just for spring cleaning."" Her daughter and the ""boy who refuses to grow up"" fly off into the night. (""Finale: Never Never Land – Reprise"")",0
10313824,The Treasure in the Royal Tower,Carolyn Keene,1995-12,"{""/m/02n4kr"": ""Mystery"", ""/m/028v3"": ""Detective fiction"", ""/m/0dwly"": ""Children's literature"", ""/m/03mfnf"": ""Young adult literature"", ""/m/02xlf"": ""Fiction""}","Nancy takes a vacation in Wisconsin when the library of the place she is vacationing at is vandalized. Nancy, along with her friends George Fayne and Bess Marvin, must survive an unknown assailant while discovering the secret passageway's inside of an old castle. Later, Treasure in the Royal Tower was made into a Computer (PC) Game where you can play as Nancy and find Marie Antoinette's tower.",0
