id,title,author,published_date,categories,summary,page_count
1904437,Creature Tech,UNK,UNK,UNK,"The book tells of the adventures of Dr. Michael Ong, a paranormal scientist and former seminarian, who is given a head researcher's position at an Area 51-esque laboratory in Turlock, California called Research Technical Institute. In exchange for granting the government the lease to build the facility, the City of Turlock demanded that it be staffed primarily by locals. Ong's task is to open, catalog, and classify each of the hundreds of crates in the facility's warehouse. Many of the artifacts found inside are proven to be highly dangerous and thoroughly insane...Russian teleporter technology, aliens, mutants, even a were-pig. During what is apparently just another day at the office, the ghost of the evil Dr. Jameson looses a slug-beast from its stasis capsule. Jameson was killed a century prior, after making a deal with a demon named Hellcat in exchange for the power to bring a ""giant space eel"" to Earth. Jameson succeeds a little too thoroughly, and he is crushed when the eel crash-lands into gold-rush-era Turlock. The ghost of Dr. Jameson, generations later, seeks an artifact in one of the crates at Creature Tech, the authentic Shroud of Turin. Jameson released a slug-beast in order to distract the facility staff and abscond with the shroud. During the ensuing battle, Ong is stabbed through the heart by a parasite attached to the slug-beast. The parasite detaches itself from the beast and attaches to Ong, replacing his heart, but creating a permanent symbiosis. Using the Shroud, Jameson resurrects his old body and begins a search for the remains of the space eel that killed him. In the meantime, he unleashes an army of demonically-possessed cats upon Turlock. It's a race against time as Ong, the parasite, and all the human/monster residents of Turlock defend their town against the demon onslaught and attempt to stop Jameson from resurrecting the space eel.",0
1905285,Stray,Rachel Vincent,1987-04-30,"{""/m/014dfn"": ""Speculative fiction"", ""/m/05hgj"": ""Novel""}","A cat named ""Pufftail"" (he says that he truly has no name) tells his life story to his daughter Tabitha and his grandson. He tells of his life on the streets, in a pet shop, at a convent, with a kind grandmother, and with the cruel ""June and Jim,"" among others and says that he has three tragic parts in his life. In chronological order, the most important events of Pufftail's life are: # Being born # Separated from his mum with his brother # Being taken to a pet shop # Being taken in by Grandma Harris, until she dies # Being taken in by June and Jim Harbottle # The death of his brother # Being taken in by a convent of nuns # Joining the gang called ""The Commune"" # Being used to test a shampoo # Meeting his ""wife"" # The birth of his children # The death of his ""wife"" # Meeting his daughter, Tabitha # The birth of his grandchildren",0
1905676,London Fields,Martin Amis,1989,"{""/m/0vgkd"": ""Black comedy"", ""/m/014dfn"": ""Speculative fiction"", ""/m/02xlf"": ""Fiction""}","London Fields is set in London in 1999 against a backdrop of environmental, social and moral degradation, and the looming threat of world instability and nuclear war (referred to as ""The Crisis""). The novel opens with Samson explaining how grateful he is to have found this story, already formed, already happening, waiting to be written down. This is the story of a murder. It hasn't happened yet. But it will. (It had better.) I know the murderer, I know the murderee. I know the time, I know the place. I know the motive (her motive) and I know the means. I know who will be the foil, the fool, the poor foal, also utterly destroyed. I couldn't stop them, I don't think, even if I wanted to. The girl will die. It's what she always wanted. You can't stop people, once they start. You can't stop people, once they start creating. What a gift. This page is briefly stained by my tears of gratitude. Novelists don't usually have it so good, do they, when something real happens (something unified, dramatic, and pretty saleable), and they just write it down? The characters have few, if any, redeeming features. Samson Young (Sam), the unreliable narrator of the novel, is an American, a failed non-fiction writer with decades-long writer's block, and is slowly dying of some sort of terminal disease. Recently arrived in London, he immediately meets Keith Talent, a cheat (small-time criminal) and aspiring professional darts player, at Heathrow Airport where Keith is posing as a minicab driver. Keith gives Sam an extortionately priced ride into town. The two converse in Keith&#39;s car, and Keith invites Sam to the Black Cross, a pub on the Portobello Road, Keith&#39;s main hangout. At the Black Cross, Sam meets Guy Clinch, a rich upper-class banker who is bored with life, with his terrifyingly snobbish American wife, Hope, and his out-of-control toddler, Marmaduke. Shortly after, the two both meet the anti-heroine, Nicola Six, a 34 year old local resident, of uncertain nationality, who has entered the pub after attending a funeral, a hobby of hers. Later that the same day, Sam sees Nicola dramatically dumping what turn out to be her diaries in a litter bin outside the flat where he is staying (it belongs to Mark Asprey, a wildly successful English writer). The diaries tell Sam that Nicola believes she can somehow see her own future, and, bored with life and fearing the aging process, is plotting her own murder for midnight on November 5, her 35th birthday. Sam, who considers that he lacks the imagination and courage to write fiction, realises he can simply document the progress towards the murder to create a plausible, lucrative, story. He assumes that Keith, the bad guy, will be the murderer. Sam enters into a strange relationship with Nicola where he regularly interviews her and is updated on the &#34;plot&#34;. The novel proceeds on the basis that Keith Talent, the known criminal, will kill Nicola Six, with Guy Clinch as the fall guy necessary to provoke him into doing it (and, incidentally, to provide funds to help Talent avoid being beaten up by loan sharks, and to further his darts career so he can appear in the Sparrow Masters darts final the day before the planned murder). But there is an unexpected twist at the finale. Amis hints at a false ending, in one of Samson Young&#39;s terrifying dreams, simply to confuse the reader.",0
1906129,The Bride of Lammermoor,Walter Scott,1819,"{""/m/0hwxm"": ""Historical novel""}","The story recounts the tragic love of Lucy Ashton, and Edgar, Master of Ravenswood. Edgar's father was stripped of the title for supporting the deposed King James II. Lucy's ambitious father, Sir William Ashton(fiction = Dalrymple) then bought the Ravenswood estate (fiction = Rutherford estate). Edgar hates Sir William for this usurpation of his family's heritage, but on meeting Lucy, falls in love with her, and renounces his plans for vengeance. Sir William's haughty and manipulative wife, Lady Ashton, is the villainess of the story. She is determined to end the initial happy engagement of Edgar and Lucy, and force Lucy into a politically advantageous arranged marriage. Lady Ashton intercepts Edgar's letters to Lucy and persuades Lucy that Edgar has forgotten her. Edgar leaves Scotland for France, to continue his political activities. While he is away, Lady Ashton continues her campaign. She gets Captain Westenho, a wandering soldier of fortune, to tell everyone that Edgar is about to get married in France. She even recruits ""wise woman"" Ailsie Gourlay (a witch in all but name) to show Lucy omens and tokens of Edgar's unfaithfulness. Lucy still clings to her troth, asking for word from Edgar that he has broken off with her; she writes to him. Lady Ashton suppresses Lucy's letter, and brings the Reverend Bide-the-bent to apply religious persuasion to Lucy. However, Bide-the-bent instead helps Lucy send a new letter. But there is no answer. Lady Ashton finally bullies Lucy into marrying Francis, Laird of Bucklaw. But on the day before the wedding, Edgar returns. Seeing that Lucy has signed the betrothal papers with Bucklaw, he repudiates Lucy, who can barely speak. The wedding takes place the next day, followed by a celebration at Ravenswood. While the guests are dancing, Lucy stabs Bucklaw in the bridal chamber, severely wounding him. She descends quickly into insanity and dies. Bucklaw recovers, but refuses to say what had happened. Edgar reappears at Lucy's funeral. Lucy's older brother, blaming him for her death, insists that they meet in a duel. Edgar, in despair, reluctantly agrees. But on the way to the meeting, Edgar falls into quicksand and dies. In the story, Caleb Balderstone, an eccentric old Ravenswood family retainer, provides some comic relief.",0
1906167,Ourika,Claire de Duras,UNK,"{""/m/05hgj"": ""Novel""}","Ourika, a Senegalese infant, is ""saved"" from the slave trade by the governor of Senegal, and brought back to Paris as a gift for Madame de B. She is raised well, according to the standards for white Parisian girls of high society; she is accomplished in many areas and is even a débutante. After Ourika's society outing, things begin to go awry. She overhears a conversation between her benefactress and a Marquise as they discuss her future, or lack thereof. The Marquise's famous line is: ""Ourika ... has been placed into Society without its consent; Society will avenge this indiscretion."" Ourika is then struck by the realization of her color, and undergoes a psychological reaction akin to Frantz Fanon's account of racial awareness in Peau Noire, Masques Blancs (Black Skin, White Masks). She sinks into profound melancholy and is physically affected by it to the point where her life is endangered.",0
1906331,The Call of Earth,Orson Scott Card,UNK,"{""/m/06n90"": ""Science Fiction"", ""/m/014dfn"": ""Speculative fiction"", ""/m/02xlf"": ""Fiction""}","The book focuses on several key events that happen after Nafai, Elemak, Issib, Mebbekew, Zdorab and the father Volemak leave for the desert. Elemak has a dream from the Oversoul, foretelling Volemak's sons going back to the city of Basilica to get wives. The sons proceed to Nafai's and Issib's mother, Rasa, who is attempting to keep order within the city. However Hushidh, a raveler under Rasa's care, makes the disastrous mistake of severing the ties between Rashgallivak and his men, leading to widespread riots across the city. At the same time, General Moozh, leader of the ""Wetheads"" nation (Gorayni), is attempting to conquer cities around Basilica. He sees a strategic chance, and taking only 1000 soldiers, marches across the desert to conquer the city. He arrives in time to help the local city guard quell the uprising, and slowly begins taking control of its affairs. The remainder of the book deals with Nafai and his brothers' (Elemak and Mebbekew, who had come) attempts at finding wives. In the end, they are all forced into a house arrest along with Rasa, where Elemak takes Eiadh as his wife, Mebbekew takes Dol, Nafai takes Luet, the waterseer, with Rasa and Hushidh deciding to come as wives for Volemak and Issib, respectively. Shedemei (a Basilican geneticist) is dragged along with enough plants and animals to populate the future earth with new species, also as a wife to Zdorab. The ending comes when Moozh decides to marry Hushidh to politically tie himself with the city. Hushidh's original mother arrives to stop the ceremony, since Hushidh is actually the daughter of Moozh. Nafai's party is escorted out of the city with the women and supplies for the camp. Moozh ends up conquering the ""Wetheads"" he had been working for, while his Basilican second-in-command defends the city against the rival nation, Potokgavan. In the end he is killed during an invasion and Basilica falls, scattering the citizens to various other nations and cities on Harmony. Earlier in the book, the Oversoul had revealed the purpose of this dispersal was to force people with a strong connection to it to breed with people who had a weak connection, and so delay the eventual time when the Oversoul loses control of the people of Harmony.",0
1906832,The Talisman,Walter Scott,1825-06-22,"{""/m/02xlf"": ""Fiction"", ""/m/0hwxm"": ""Historical novel""}","During a truce between the Christian armies taking part in the third Crusade, and the infidel forces under Sultan Saladin, Sir Kenneth, on his way to Syria, encountered a Saracen Emir, whom he unhorsed, and they then rode together, discoursing on love and necromancy, towards the cave of the hermit Theodoric of Engaddi. This hermit was in correspondence with the pope, and the knight was charged to communicate secret information. Having provided the travellers with refreshment, the anchorite, as soon as the Saracen slept, conducted his companion to a chapel, where he witnessed a procession, and was recognised by the Lady Edith, to whom he had devoted his heart and sword. He was then startled by the sudden appearance of the dwarfs, and, having reached his couch again, watched the hermit scourging himself until he fell asleep. About the same time Richard Coeur de Lion had succumbed to an attack of fever, and as he lay in his gorgeous tent at Ascalon, Sir Kenneth arrived accompanied by a Moorish physician, who had cured his squire, and who offered to restore the king to health. After a long consultation, and eliciting from Sir Kenneth his visit to the chapel, the physician was admitted to the royal presence; and, having swallowed a draught which he prepared from a silken bag or talisman, Richard sank back on his cushions. While he slept Conrade of Montserrat secretly avowed to the wily Grand-master of the Templars his ambition to be King of Jerusalem; and, with the object of injuring Richard's reputation, incited Leopold of Austria to plant his banner by the side of that of England in the centre of the camp. When the king woke the fever had left him, and Conrade entered to announce what the archduke had done. Springing from his couch, Richard rushed to the spot and defiantly tore down and trampled on the Teuton pennon. Philip of France at length persuaded him to refer the matter to the council, and Sir Kenneth was charged to watch the English standard until daybreak, with a favourite hound as his only companion. Soon after midnight, however, the dwarf Necbatanus approached him with Lady Edith's ring, as a token that his attendance was required to decide a wager she had with the queen; and during his absence from his post the banner was carried off, and his dog severely wounded. Overcome with shame and grief, he was accosted by the physician, who dressed the animal's wound, and, having entrusted Sir Kenneth with Saladin's desire to marry the Lady Edith, proposed that he should seek the Saracen ruler's protection against the wrath of Richard. The valiant Scot, however, resolved to confront the king and reveal the Sultan's purpose; but it availed him not, and he was sentenced to death, in spite of the intercessions of the queen and his lady-love; when the hermit, and then the physician, arrived, and Richard having yielded to their entreaties, Sir Kenneth was simply forbidden to appear before him again. Having, by a bold speech, revived the drooping hopes of his brother Crusaders, and reproved the queen and his kinswoman for tampering with the Scot, Richard received him, disguised as a Nubian slave, as a present from Saladin, with whom he had been induced to spend several days. Shortly afterwards, as the king was reposing in his pavilion, the ""slave"" saved his life from the dagger of an assassin secretly employed by the grand-master, and intimated that he could discover the purloiner of the standard. A procession of the Christian armies and their leaders had already been arranged in token of amity to Richard; and as they marched past him, seated on horseback, with the slave holding the hound among his attendants, the dog suddenly sprang at the Marquis Conrade, who was thus convicted of having injured the animal, and betrayed his guilt by exclaiming, ""I never touched the banner."" Not being permitted to fight the Teuton himself, the king undertook to provide a champion, and Saladin to make all needful preparations for the combat. Accompanied by Queen Berengaria and Lady Edith, Richard was met by the Saracen with a brilliant retinue, and discovered, in the person of his entertainer, the physician who had cured his fever, and saved Sir Kenneth, whom he found prepared to do battle for him on the morrow, with the hermit as his confessor. The encounter took place soon after sunrise, in the presence of the assembled hosts, and Conrade, who was wounded and unhorsed, was tended by the Sultan in the grand-master's tent, while the victorious knight was unarmed by the royal ladies, and made known by Richard as the Prince Royal of Scotland. At noon the Sultan welcomed his guests to a banquet, but, as the grand-master was raising a goblet to his lips, Necbatanus uttered the words accipe hoc, and Saladin decapitated the templar with his sabre; on which the dwarf explained that, hidden behind a curtain, he had seen him stab his accomplice the Marquis of Montserrat, obviously to prevent him from revealing their infamous plots, while he answered his appeal for mercy in the words he had repeated. The next day the young prince was married to Lady Edith, and presented by the Sultan with his talisman, the Crusade was abandoned, and Richard, on his way homewards, was imprisoned by the Austrians in the Tyrol.",0
1906837,The Talisman,Stephen King,1984-11-08,"{""/m/01hmnh"": ""Fantasy"", ""/m/014dfn"": ""Speculative fiction"", ""/m/03npn"": ""Horror"", ""/m/02xlf"": ""Fiction""}","Jack Sawyer, twelve years old, sets out from Arcadia Beach, New Hampshire in a bid to save his mother, who is dying from cancer, by finding a crystal called ""the Talisman."" Jack's journey takes him simultaneously through the American heartland and ""the Territories"", a strange fantasy land which is set in a universe parallel to that of Jack's America. Individuals in the Territories have ""twinners,"" or parallel individuals, in our world. Twinners' births, deaths, and (it is intimated) other major life events are usually paralleled. Twinners can also ""flip"" or migrate to the other world, but only share the body of their alternate universe's analogue. In rare instances (such as Jack's), a person may die in one world but not the other, making the survivor ""single-natured"" with the ability to switch back and forth, body and mind, between the two worlds. Jack is taught how to flip by a mysterious figure known as Speedy Parker, who is the twinner of a gunslinger named Parkus in the Territories. In Parkus's world, the beloved Queen Laura DeLoessian, the twinner of Jack's mother (a movie actress known as the ""Queen of the B Movies"") is also dying. Various people help or hinder Jack in his quest. Of particular importance are the werewolves, known simply as Wolfs, who inhabit the Territories. These are not the savage killers of tradition: they serve as royal herdsmen or bodyguards, and can sometimes under stress voluntarily change to wolf form. A sixteen-year-old Wolf, simply named Wolf, is accidentally pulled into America by Jack Sawyer and adopts Jack as his herd, serving as his companion. Wolf is extremely likeable, kind, loyal and friendly, much like a dog, though his wolf nature shows through on occasion. On the other hand, some Wolfs have joined the malevolent faction which is trying to stop Jack. As the story goes back and forth between the Territories and the familiar United States, or ""American Territories"" as Jack comes to call them, Jack escapes from one life-threatening situation after another. Accompanied by Wolf and later by his childhood friend Richard, Jack must retrieve the Talisman before it falls into the hands of evil schemer Morgan Sloat, Richard's father, who, we later learn, was Jack's father's business partner before arranging to have the latter murdered. He wants to seize their business from Jack's mother. Morgan Sloat's twinner, Morgan of Orris, also plans to seize the Territories in the event of Queen Laura's death.",0
1907430,The Good Apprentice,Iris Murdoch,UNK,"{""/m/02xlf"": ""Fiction"", ""/m/05hgj"": ""Novel""}","Edward Baltram, a college student living in London, gives his best friend Mark a sandwich laced with a hallucinogenic drug for a joke. After Mark, still high, falls to his death from a window, Edward is wracked with guilt and depression &mdash; worsened by daily letters from Mark's mother cursing him as a murderer. In search of his father, Jesse, Edward sets off for Seegard, the family home, away from the harsh reality of London. As Edward progresses through the novel, he revives somewhat, thanks to the love of his eccentric father and his extended family of supportive women. He eventually finds, however, that he must come to terms with Mark's death. Meanwhile, Edward's stepbrother Stuart Cuno decides to give up his studies and goes in search of the ""pure"" life of an aesthete, to his family's bewilderment. Stuart has 'sexual feelings' for thirteen-year-old Meredith, the son of Thomas and Midge McCaskerville. While Edward seeks redemption and Stuart salvation, Midge is having an affair with her husband's best friend, Harry Cuno - stepfather to Edward and father to Stuart. Her passionate love affair comes to a head after two years when she is disgraced publicly and falls unexpectedly in love with Stuart. Left with a difficult decision, Midge turns to Edward for support.",0
1908089,The Ring of Charon,Roger MacBride Allen,1990,"{""/m/06n90"": ""Science Fiction"", ""/m/014dfn"": ""Speculative fiction"", ""/m/02xlf"": ""Fiction""}",- ==Charonian Life Cycle==--&#62; it:L'anello di Caronte,0
