id,title,author,published_date,categories,summary,page_count
1420750,One for the Morning Glory,John Barnes,1996-04,"{""/m/014dfn"": ""Speculative fiction"", ""/m/01hmnh"": ""Fantasy""}","There is a saying in the land that someone who drinks the Wine of the Gods before he is ready is only half a man thereafter. Amatus, the prince, manages to swig down a significant amount of the Wine of the Gods, and his entire left half vanishes. His father, the normally gentle King Boniface, orders the executions of the four people responsible for this travesty—the maid, the alchemist, the witch, and the captain of the guard—and then begins the long and arduous process of interviewing to fill these four positions. A year and a day later, four strangers arrive in the kingdom. This is a magical time, and noted by all as being very auspicious. The strangers are hired by the king and become known as the prince's Companions. The rest of the tale deals with Amatus's growth into manhood, kingship, and love. It is filled with adventure, laughter, tragedy, unexpected reunions and royal pomp.",0
1420771,Stations of the Tide,Michael Swanwick,1991,"{""/m/06n90"": ""Science Fiction"", ""/m/014dfn"": ""Speculative fiction"", ""/m/05hgj"": ""Novel""}","Stations of the Tide is the story of a bureaucrat with the Department of Technology Transfer who must descend to the surface of Miranda to hunt a magician who has smuggled proscribed technology past the orbital embargo, and bring him to justice before the world is transformed by the flood of the Jubilee Tides.",0
1421363,The Blank Slate: The Modern Denial of Human Nature,Steven Pinker,2002,"{""/m/05h83"": ""Non-fiction""}","Pinker argues that modern science has challenged three ""linked dogmas"" that constitute the dominant view of human nature in intellectual life: * the blank slate (the mind has no innate traits) &mdash; empiricism * the noble savage (people are born good and corrupted by society) &mdash; romanticism * the ghost in the machine (each of us has a soul that makes choices free from biology) &mdash; mind/body dualism Much of the book is dedicated to examining fears of the social and political consequences of his view of human nature: * ""the fear of inequality"" * ""the fear of imperfectibility"" * ""the fear of determinism"" * ""the fear of nihilism"" Pinker claims these fears are non sequiturs, and that the blank slate view of human nature would actually be a greater threat if it were true. For example, he argues that political equality does not require sameness, but policies that treat people as individuals with rights; that moral progress doesn't require the human mind to be naturally free of selfish motives, only that it has other motives to counteract them; that responsibility doesn't require behavior to be uncaused, only that it respond to praise and blame; and that meaning in life doesn't require that the process that shaped the brain must have a purpose, only that the brain itself must have purposes. He also argues that grounding moral values in claims about a blank slate opens them to the possibility of being overturned by future empirical discoveries. He further argues that a blank slate is in fact inconsistent with opposition to many social evils since a blank slate could be conditioned to enjoy servitude and degradation. Evolutionary and genetic inequality arguments do not necessarily support right-wing policies. Pinker writes that if everyone was equal regarding abilities it can be argued that it is only necessary to give everyone equal opportunity. On the other hand, if some people have less innate ability through no fault of their own, then this can be taken as support for redistribution policies to those with less innate ability. Further, laissez-faire economics is built upon an assumption of a rational actor, while evolutionary psychology suggests that people have many different goals and behaviors that do not fit the rational actor theory. Raising living standards, also for the poor, is often used as an argument that inequality need not be reduced, while evolutionary psychology may suggest that low status itself, apart from material considerations, is highly psychologically stressful and may cause dangerous and desperate behaviors, supporting a society reducing inequalities. Finally, evolutionary explanations may also help the left create policies with greater public support, suggesting that people's sense of fairness (caused by mechanisms such as reciprocal altruism) rather than greed is a primary cause of opposition to welfare, if there is not a distinction in the proposals between what is perceived as the deserving and the undeserving poor. Pinker also gives several examples of harm done by the belief in a blank slate of human nature: * totalitarian social engineering. If the human mind is a blank slate completely formed by the environment, then ruthlessly and totally controlling every aspect of the environment will create perfect minds. * Inappropriate or excessive blame on and guilt for parents since if their children do not turn out well this is assumed to be entirely environmentally caused and in particular due to the behavior of the parents. * release of dangerous psychopaths who quickly commit new crimes. * construction of massive and dreary tenement complexes since housing and environmental preferences are assumed to be culturally caused and superficial. * persecution and even mass murder of the successful who are assumed to have gained this unfairly. This includes not only individuals but entire successful groups who are assumed to have become successful unfairly and by exploitation of other groups. Examples include kulaks in the Soviet Union; teachers and ""rich"" peasants in the Cultural Revolution; and city dwellers and intellectuals under the Khmer Rouge.",0
1421478,Death to the French,C. S. Forester,1932,"{""/m/02xlf"": ""Fiction"", ""/m/0c3351"": ""Suspense"", ""/m/0hwxm"": ""Historical novel""}","The hero is Matthew Dodd, a rifleman in the 95th Regiment of Foot of the British Army. The novel takes place in Portugal early in the Peninsular War. The British had sent a small force of about 10,000 men to the aid of her ally, Portugal. Rather than face the overwhelming numbers of the opposing French forces under Marshal André Masséna, the British commander, Lord Wellington, secretly constructed the Lines of Torres Vedras and withdrew behind them, leaving the French force no options but to lay siege to the lines, or retreat. For three months the French encamped outside the lines, waiting for reinforcements from the other side of the Tagus River, but in the end hunger and disease forced them to retreat. During the course of the British withdrawal, Dodd becomes separated from his regiment and is cut off from the British forces, with the entire French army between him and the lines at Torres Vedras. In an attempt to get around the French, he heads for the Tagus River, hoping to follow it to Lisbon. However, the French are there ahead of him and he has no option but to live off the land and try to survive. He joins a group of Portuguese guerrillas and spends two months with them, harassing the encamped French army, killing sentries and laying ambushes for scouting parties and supply animals. After two months of guerrilla fighting, Dodd hears artillery fire from about ten miles away. He can tell by the sound that it is neither a battle nor a siege. He knows that anyone exchanging artillery fire with the French is an ally of his, so he takes his friend Bernardino and sets out to see what is happening. They meet another Portuguese guerrilla, whose name they never learn, who leads them to the site of the firing. There he sees British soldiers on the other side of the Tagus firing rockets at the town of Santarém, and the French returning cannon-fire to stop them. Dodd deduces that there must be something in the town that the British want to set on fire; furthermore it must be something near the river. From this he can guess what the target must be: the French are trying to construct a pontoon bridge across the Tagus, and the British are firing the rockets to try to burn the pontoon boats, rope, timber, and paint that are warehoused by the river. Unable to dislodge the British rocketeers from their entrenchments on the far side of the river, the French gather up all the bridge-building supplies and move them farther up the river, to a position where the British can neither see them nor fire on them. Dodd determines to destroy the bridge materiel himself. He, Bernardino, and the unnamed guerrilla return to their band's headquarters, only to find that while they were gone the French had discovered and destroyed the whole band, hanging the men on trees and taking away the women and the food. The three have nothing to eat so the unnamed guerrilla visits the French encampment that night, kills a sentry and steals a pack mule. They slaughter the mule and smoke the meat, giving them enough food in their packs for several weeks. Then they set out to find the new bridge-building headquarters. Before they find it they are surprised by a French patrol; they run for cover, but Dodd's two friends fall and are captured. From the safety of the rocks Dodd looks back to see his friends hanged. He resolutely goes on alone, and finds the French encampment. He patiently hides in the rocks watching the business of the camp for several days. Finally he goes in by night, kills two sentries, and spreads highly flammable grease and oil (kept in cauldrons by the French for tarring rope, greasing cordage, and waterproofing their boats) over the pontoons and timber and rope, and sets it all on fire. From his hideout in the rocks he sees the whole encampment burn, and is pleased with his success; he never learns that orders had arrived only that day for the French to burn the encampment themselves, since Masséna had ordered a retreat. Dodd avoids the retreating French army and happily rejoins his regiment, unacknowledged, unthanked and unconcerned about his months of demanding effort.",0
1422145,Tom Sawyer Abroad,Mark Twain,1894,"{""/m/0dwly"": ""Children's literature"", ""/m/0d6gr"": ""Reference"", ""/m/05hgj"": ""Novel"", ""/m/08sdrw"": ""Adventure novel"", ""/m/01hmnh"": ""Fantasy"", ""/m/02xlf"": ""Fiction""}","In the story, Tom, Huck, and Jim set sail to Africa in a futuristic hot air balloon, where they survive encounters with lions, robbers, and fleas to see some of the world's greatest wonders, including the Pyramids and the Sphinx. Like Adventures of Huckleberry Finn and Tom Sawyer, Detective, the story is told using the first-person narrative voice of Huck Finn. It is a sequel, set in the time following the title story of the Tom Sawyer series.",0
1422446,War for the Oaks,Emma Bull,1987,"{""/m/0dwly"": ""Children's literature"", ""/m/01hmnh"": ""Fantasy"", ""/m/014dfn"": ""Speculative fiction"", ""/m/02xlf"": ""Fiction""}","Walking home one night through the streets of Minneapolis after quitting her rock band and breaking up with her boyfriend, Eddi McCandry discovers that she is being pursued by a threatening man and an even more threatening black dog. They turn out to be one and same: a shapeshifting prankster faerie known as a phouka, who drafts Eddi to be the key linchpin in the ongoing battle between faerie's good and noble Seelie Court and the evil Unseelie Court, ruled by the Queen of Air and Darkness. Eddi soon finds herself in a struggle for survival against the Unseelie Court, all while trying to put a new rock band together. Meanwhile, her initial feelings of resentment toward the phouka develop into gratitude for his efforts to protect her against the dark queen, and ultimately turn into love. The novel climaxes in a rock concert playoff between Eddi and the Queen of Air and Darkness, which decides the fate of both faerie courts, as well as the fate of her loved one.",0
1422844,The Garden of Eden,Ernest Hemingway,1986,"{""/m/02xlf"": ""Fiction""}","The novel is fundamentally the story of five months in the lives of David Bourne, an American writer, and his wife, Catherine. It is set mainly in the French Riviera, specifically in the Côte d'Azur, and in Spain. The story begins with their honeymoon in the Camargue. The Bournes soon meet a young woman named Marita, with whom they both fall in love, but only one can ultimately have her. David starts an affair with Marita, while his relationship with his wife deteriorates. The story continues until the apparent separation of David and Catherine.",0
1423977,Marabou Stork Nightmares,Irvine Welsh,1995,"{""/m/014dfn"": ""Speculative fiction"", ""/m/05hgj"": ""Novel""}","Roy Strang narrates the book from an (at first) unexplained coma, which he has been in for the previous two years. His life in this state is a miserable affair, surrounded by uncaring doctors and his extremely dysfunctional family. In his fantasy life, however, he is an adventurer in the wilds of South Africa, where he and his loyal guide, Sandy Jamieson, hunt for an elusive, deadly creature called the Marabou Stork. When not hallucinating, Strang tells his life story, beginning in a ""scheme"" (local authority housing) in Leith, Scotland, with his violent, delusional parents, two half-brothers (one a womanizer, the other flamboyantly gay), and his promiscuous sister, all of whom he despises. The family relocates to apartheid-era South Africa when he is an adolescent, where he is repeatedly molested by his uncle. When his father is jailed for the violent assault of a taxi driver, the Strangs are forced to return to Scotland &mdash; a mere 18 months after they left. Over the next few years, Strang grows into a violent, misogynistic thug. He maintains a full-time job in as a systems analyst for the fictional investment group, 'Scottish Spinsters' (a probable reference to the real Scottish Widows firm). He joins a gang of football hooligans who are attached to Hibernian F.C., the Capital City Service, and led by the fearsome Lexo. Strang enjoys his life as a ""top boy,"" feared by the entire town, until the gang kidnaps a young woman who rejected their advances and gang rapes her; Strang informs the reader that he is horrified, but too intimidated to try and stop them, even though he himself does not join in. The gang evades prison, but Strang is stricken with guilt and withdraws completely into depression. He briefly revives a few months later when he meets a woman and genuinely feels love for the first time. Around the same time he begins to take ecstasy, and even befriends his gay half-brother. The memory of what he has done continues to haunt him, however, and his depression soon completely engulfs him, taking him away from his lover and his drug-driven escapism. He attempts suicide but survives, putting him in the coma he began the novel in. One day, the gang's rape victim visits him in the hospital. She tells him that she has been murdering her rapists one by one, and now she has come for him, saying that he was by far the most brutal; it is left ambiguous whether or not this is true. She then castrates him and stabs him to death. In his final moments, Strang realizes that the only person he has ever really hated is himself, and makes peace with everyone he has wronged and who has wronged him. The novel's other, more stream-of-consciousness narrative, intertwined with the story of Strang's past, takes place in the fantasy world he creates for himself in the coma. At first a bizarre but rousing adventure, it gradually becomes darker as Strang reveals the uglier parts of his life and personality, involving surreal images of brutality and sexual violence.",0
1426168,The Word for World is Forest,Ursula K. Le Guin,1976,"{""/m/06n90"": ""Science Fiction"", ""/m/0dwly"": ""Children's literature"", ""/m/05hgj"": ""Novel"", ""/m/014dfn"": ""Speculative fiction"", ""/m/01hmnh"": ""Fantasy"", ""/m/02xlf"": ""Fiction""}","""The Athshean word for 'world' is the same as their word for 'forest'."" Raj Lyubov, one of the novel's major characters. Colonists from Earth take over a planet that the locals call Athshe, which means ""forest,"" rather than ""dirt,"" like their home planet. They follow the 19th century model of colonization: cutting down trees, planting farms, building mines, and enslaving indigenous peoples. The natives are ill equipped to comprehend this, since they're a subsistent people who rely on the forests, and have no cultural precedent for tyranny, slavery, or war. The invaders take the land of these tiny forest people without any resistance. Earth has suffered some environmental disasters and people in North America have known starvation. The military culture has some familiar aspects, but there have been cultural shifts. Both drug-use and homosexuality are acceptable, even in the military. Some Terrans feel a rivalry with the other humanoid cultures, especially the Cetians. Former national rivalries have faded, with North Americans, Vietnamese and Indians working together harmoniously. (The book was written during the Vietnam War, of which Le Guin was an outspoken opponent; the depiction of Americans and Vietnamese as cooperation in the conquest and subjugation of a forest-dwelling people could hardly be accidental.) The innocent, ingrained obedience of the Athsheans and the fact that they never seem to sleep makes them seem to be ideal slaves, practicing what in humans is called polyphasic sleep. One of the worst slave-masters is Captain Davidson (who is not the leader of the Terrans, a common misconception), who regularly beats the ""creechies"", as he calls the Athsheans. But the fact is that they take a few dreamless catnaps spread throughout the day and go into a state of lucid dreaming at will, and quite often. They also see the ""dream-time"" as a world just as real as the ""world-time"" and hate hallucinogens which the humans use, because they have no control over the dreams generated by the ""poisons"". Most of the ""yumens"" make no effort to understand this and drive them harder when they catch the Athsheans ""daydreaming."" Deprived of REM sleep, the slaves' mental and physical health deteriorates. The only human who begins to understand this is the colony's anthropologist, Raj Lyubov, who saves several slaves from grisly deaths at Davidson's hands. When a tiny native woman is raped by Davidson and dies of her wounds, her husband, Selver, begins to dream of war. No one has dreamed of war before, but Selver is able to share his dream and sing his plans with the rest of his people. He organises a raid on a logging camp, killing more than 200 humans and humbling Davidson. To his people, he has becomes a sha'ab, a word that means both ""translator"" and ""god"". Meantime, a starship arrives bringing an ansible intended for another nearby world, and also two non-Terrans, a Cetian and a man of Hain. Via ansible, they learn that there is now a ""League of All Worlds"" and that Terran colonial policies have changed. The ansible is left at the colony so that the Terrans can be controlled by their own superiors. Instructions are issued to free the Athshean slaves and generally moderate the policies. Outraged by all this, and suspecting that the ""ansible"" is a fraud or controlled by Cetians, Davidson secretly organises a raid and mass slaughter of a nearby Athshean tree-city. The Athsheans respond by staging a massive raid on ""Central"", the main Terran base, which they manage to overrun. Particularly shocking is that the Athsheans intentionally kill the Terran women, reasoning that the women will otherwise establish a fast-breeding Terran colony. This is indeed the intention; the settlers plan to make a permanent home on ""New Tahiti"", not just to take its logs. For their part, the Athsheans have no tradition of warfare and therefore no rules, and anyway, their own women take part in the fighting. The revolution upends the Athshean culture but succeeds in ending Terran domination. For the atrocities he has committed, Davidson is exiled to an island of bare rock, which had been a thriving forest village before his rule, to be given food and medicine but no human contact for the rest of his life. The surviving humans (not including Lyubov, who was accidentally killed in the revolt) return home on the next ship to arrive.",0
1426398,Darwinia,Robert Charles Wilson,1998,"{""/m/0mz2"": ""Alternate history"", ""/m/06n90"": ""Science Fiction"", ""/m/014dfn"": ""Speculative fiction"", ""/m/05hgj"": ""Novel""}","In March 1912, in the event some people called the ""Miracle,"" Europe and parts of Asia and Africa, including its inhabitants, disappear suddenly overnight and are replaced with a slice of an alien Earth, a land mass of roughly equal outlines and terrain features, but with a strange new flora and fauna which seems to have followed a different path in evolution. Seen by some as an act of divine retribution, the ""Miracle"" affects the lives of people all around and transforms world history. The book describes the life and the adventures of Guilford Law, a young American photographer. As a 14-year-old boy, Guilford Law witnessed the ""Miracle"" as shimmering lights moving eerily across the ocean sky. As a grown man, he is determined to travel to the strange continent of Darwinia and explore its mysteries. To that end, he enlists as a photographer in the Finch expedition, which plans to travel up the river that used to be known as the Rhine and penetrate the bizarre new continent's hidden depths as far as possible. He lands in the middle of the jungle in the midst of nationalistic skirmishes, in which partisans attack and wipe out most of the party of the Finch expedition on the continent that they believe to belong to them. Law brought an unwanted companion with him, a mysterious twin who seems to have both lived and died on an alternate Earth unchanged by the Miracle. The twin first appears to Guilford in dreams, and he brings a message that Darwinia is not what it seems to be, and Guilford is not who he seems to be. A startling revelation soon arrives. By the end of the story, it is revealed to all the characters that it is really now the End of Time and that the Universe, the Earth, and all the consciousness that ever existed are really being preserved in a computer-like simulation known as the Archive. The Archive was built by a coalition of all the sentient beings in the Universe in an effort to save consciousness from death. However, ""viruses"" (parasitic artificial life-forms) known as Psions have invaded the system of the Archive. Guilford Law eventually learns that he and those like him serve as instruments in a cosmic struggle against the Psions for the survival of consciousness itself.",0
