id,title,author,published_date,categories,summary,page_count
3603737,Doomsday Deck,Diana G. Gallagher,2000-12,"{""/m/0dwly"": ""Children's literature"", ""/m/03npn"": ""Horror"", ""/m/014dfn"": ""Speculative fiction"", ""/m/02xlf"": ""Fiction""}","Joyce Summers is running a local art show for people from around the United States. A girl named Justine shows up the first day to sign in and Xander is immediately attracted to her. She offers to do a Tarot reading for him which he agrees to. Once Xander has touched her magickal deck he comes under her control and has no will of his own. Justine is building a powerful deck of Tarot cards which will allow her to control the fate of the world with the help of the goddess Kali, who, in return, wants ultimate peace on Earth. Only Justine doesn't realize what ultimate peace is and she's come to Sunnydale to collect the last four people she needs to complete her deck of cards. Once her deck has been completed the four people remaining needed for the deck will die like the other eighteen she's used to make the deck. Buffy must figure out how her friends are being controlled and find a way to fight herself out of the power of Justine's Tarot cards. Buffy novels such as this one are not usually considered by fans as canonical. Some fans consider them stories from the imaginations of authors and artists, while other fans consider them as taking place in an alternative fictional reality. However unlike fan fiction, overviews summarising their story, written early in the writing process, were 'approved' by both Fox and Joss Whedon (or his office), and the books were therefore later published as officially Buffy merchandise.",0
3603752,Immortal,Christopher Golden,1999-10,"{""/m/06n90"": ""Science Fiction"", ""/m/0dwly"": ""Children's literature"", ""/m/03npn"": ""Horror"", ""/m/014dfn"": ""Speculative fiction"", ""/m/01hmnh"": ""Fantasy"", ""/m/02xlf"": ""Fiction""}","Veronique is an immortal vampire that continues to return in the body of a newly dead person every time she has been staked. However, she wants to become truly immortal by summoning an ancient demon called the Triumvirate. And of course her choice spot to do so would be in Sunnydale, especially with the extra magical vibes emanating from the Hellmouth. Unfortunately, while Buffy is trying to keep Veronique's vampire henchmen at bay, she also has to deal with the fact that her mother is sick in the hospital. There's a chance that she has cancer, but they won't know for sure until they've performed surgery on her. Buffy has to decide where she's needed most: with her mother, or to stop the end of the world. Buffy and her friends battle Veronique and the Trumverate with help from Lucy Hanover and other spirits who possess them as the Triumverate need to drain the life-force of nearby souls. Without being able to do so, they revert into their hatchling forms and are killed. With them dead, Veronique loses her immortality and is killed by the last of the hatchlings before it dies.",0
3603755,Prime Evil,Diana G. Gallagher,2000-03,"{""/m/06n90"": ""Science Fiction"", ""/m/0dwly"": ""Children's literature"", ""/m/03npn"": ""Horror"", ""/m/014dfn"": ""Speculative fiction"", ""/m/02xlf"": ""Fiction""}","Crystal Gregory is a beautiful new teacher at Sunnydale High, who also happens to give Buffy panic fits whenever she's in the same room as her. Buffy can't sense anything unusual about the teacher and begins to wonder if she's losing her mind. But lately, Anya and Michael seem to be getting awfully close to Crystal and would appear to do anything for her. While out for her usual patrol at night, Buffy has two strange encounters; one, a man is completely incinerated by red and lighting and the other being a girl from school who has a burn mark on her neck in the shape of the symbol for infinity. As soon as Giles gets cracking on his books, he finds out that Crystal is in fact Shugra, a powerful primal witch which is trying to activate the source. She needs a coven of 13 willing people to participate in order to draw the proper energy, unfortunately, it seems that Willow is one of those people. Cordelia is nervous about her father's tax position but does not tell the others. This foreshadows later events. Giles and Joyce are nervous in each other's company Characters include: Buffy, Joyce, Giles, Xander, Anya, Cordelia, Willow, and Oz",0
3603761,Power of Persuasion,Elizabeth Massie,1999-10,"{""/m/06n90"": ""Science Fiction"", ""/m/03npn"": ""Horror"", ""/m/014dfn"": ""Speculative fiction"", ""/m/02n4kr"": ""Mystery"", ""/m/02xlf"": ""Fiction"", ""/m/0c3351"": ""Suspense""}","When dead guys start turning up as soon as the Moon family appears in Sunnydale Buffy knows that something is wrong. Mo, the mother, and her two daughters, Calli and Polly, all go to Sunnydale High. Within several days Calli and Polly have attracted a huge crowd of females. The Moons are trying to create a ""Womyn Power"" group at the school that basically detests guys for even living. Willow gets pulled into the group and Buffy resolves to stop the Moons before they brainwash all the girls and turn all the guys into blithering idiots.",0
3603770,Revenant,Mel Odom,2001-01,"{""/m/0dwly"": ""Children's literature"", ""/m/03npn"": ""Horror"", ""/m/014dfn"": ""Speculative fiction"", ""/m/02xlf"": ""Fiction""}","A Chinese gang arrives in Sunnydale and suddenly they're committing criminal acts all over the town. Immediately racial tension begin to increase and one of Willow's friends, Jia Li, is feeling the effects more than anyone else. She's discovered that her brother Lok is delving into the occult in order to learn more about their great grandfather's death in Sunnydale many years ago. Coinciding with these events, a man named Zhiyong is trying to raise the men that died in a cave many years ago in order to raise Sharmma, a demon that would give him power in return. A beautiful warrior called Shing arrives on the scene at the same time and she's just as strong as Buffy. Xander feels an immediate attraction for her but there's something about her that he doesn't know.",0
3603773,Resurrecting Ravana,Ray Garton,2000-01,"{""/m/014dfn"": ""Speculative fiction"", ""/m/03npn"": ""Horror""}","It's midterm exam time at Sunnydale High School and tensions are rising high in the usual group. Particularly between Buffy and Willow who seem to have some sort of unspoken dislike of the other. Meanwhile, horrible murders have been occurring throughout Sunnydale; two close friends end up dead, one kills the other and then the murderer ends up as a pile of bones. The murders also coincide with the arrival of a large group of demons called the Rakshasa who seem to have a sort of wicked control over their victims. As Buffy and Willow become more and more violent towards each other, Giles does some research which indicates that the Rakshasa are in town to help with the resurrection on an ancient Hindu demon called Ravana. And when Giles spots Ethan Rayne in town, he knows that something chaotic is at hand. Characters include: Buffy, Joyce, Giles, Xander, Angel, Cordelia, Willow, Oz, and Ethan Rayne. Cordelia's web page in the book is www.shrew.com",0
3603781,Return to Chaos,Craig Shaw Gardner,1998-12,"{""/m/06n90"": ""Science Fiction"", ""/m/03npn"": ""Horror"", ""/m/014dfn"": ""Speculative fiction"", ""/m/02n4kr"": ""Mystery"", ""/m/02xlf"": ""Fiction"", ""/m/0c3351"": ""Suspense""}","When four Druids arrive in town everyone knows that something is going on. Three of the Druids are brothers and the other is their uncle. They're in town to try a spell on a certain night to close the gateway in the Hellmouth so that demons would not be allowed to pass through. They'd done it a year before with their father but the spell was not completed and the brothers lost their father in the midst of the spell. Giles is a little put off by the uncle and feels that he's not being told everything that he should know. Also gathering is a large community of vampires run by Eric and his apprentice Naomi, who has been playing nasty tricks with Cordelia's mind by hypnotizing her. Things start to go wrong; magic appears everywhere and the brothers turn against their uncle. On the night of the spell Buffy must manage to fix the spell or deter the uncle from his task as well as figure out what is going on with Eric and his gang. Characters include: Buffy, Joyce, Giles, Xander, Cordelia, Willow, Oz and Angel. Drusilla is found to be a user of a spell that would explain her ease in killing Kendra.",0
3603791,Visitors,Caroline Macdonald,1999-04,"{""/m/06n90"": ""Science Fiction"", ""/m/0dwly"": ""Children's literature"", ""/m/03npn"": ""Horror"", ""/m/014dfn"": ""Speculative fiction"", ""/m/02n4kr"": ""Mystery"", ""/m/02xlf"": ""Fiction"", ""/m/0c3351"": ""Suspense""}","Lately, while patrolling, Buffy's been getting the distinct impression that she's being stalked by a demon that emits a high pitched giggle. After discussion and research with Giles, they discover that Buffy's being stalked by a 'korred'; a nasty hairy beast that feeds on peoples life forces by making them dance to his magical song until they die. The korred is particularly attracted to Buffy because of her Slayer aura. Buffy must stop to korred before he makes her dance to her death.",0
3603794,Unnatural Selection,Mel Odom,1999-06,"{""/m/06n90"": ""Science Fiction"", ""/m/0dwly"": ""Children's literature"", ""/m/03npn"": ""Horror"", ""/m/014dfn"": ""Speculative fiction"", ""/m/02n4kr"": ""Mystery"", ""/m/02xlf"": ""Fiction"", ""/m/0c3351"": ""Suspense""}","Willow is baby-sitting one night when suddenly the baby she's taking care of changes into an evil faerie and tells her that she needs to work harder to save Weatherly Park from being converted into an amusement park. The faerie then attacks Willow before vanishing. After some research, Giles discovers that the fairy is a Russian variety called the domovoi, apparently hiding out beneath Weatherly Park. The faeries also have plans for Willow; they need the blood of a witch in order to resurrect the Homestone which will renew the faeries' strength. Characters include: Buffy, Joyce, Giles, Xander, Angel, Cordelia, Willow, and Oz. First original Buffy novel not to feature Sarah Michelle Gellar on the cover.",0
3603802,Deep Water,Laura Anne Gilman,2000-02,"{""/m/06n90"": ""Science Fiction"", ""/m/0dwly"": ""Children's literature"", ""/m/03npn"": ""Horror"", ""/m/014dfn"": ""Speculative fiction"", ""/m/02n4kr"": ""Mystery"", ""/m/01hmnh"": ""Fantasy"", ""/m/02xlf"": ""Fiction"", ""/m/0c3351"": ""Suspense""}","After an oil spill on a nearby Sunnydale beach, Willow discovers a 'selkie'; that is, a girl that can turn into a seal with her sealskin. The selkie, dubbed Ariel by the gang, cannot return to the ocean because her sealskin was damaged by the oil spill. Willow's trying to find a spell to clean it. At the same time, mermaid-like creatures called merrows have come ashore in search of food and the vampire population gets territorial and try to kill the merrows. Buffy and the gang get stuck in the middle of a turf war while trying to save Ariel.",0
3603811,Here Be Monsters,Cameron Dokey,2000-06,"{""/m/014dfn"": ""Speculative fiction"", ""/m/03npn"": ""Horror""}","After Buffy kills twin teenage vampires, their vampire mother steps in to seek revenge for the death of her sons. The mother summons the goddess of Balance and Buffy is faced with a trial in order to save her life as well as her mother's. In this trial, Buffy discovers what she fears most and her love for her mom must triumph over the vampire mother's love for her dead sons.",0
3603822,The Book of Fours,Nancy Holder,2001-04,"{""/m/06n90"": ""Science Fiction"", ""/m/0dwly"": ""Children's literature"", ""/m/03npn"": ""Horror"", ""/m/014dfn"": ""Speculative fiction"", ""/m/01hmnh"": ""Fantasy"", ""/m/02xlf"": ""Fiction""}","Taking place during Buffys third season, Faith and Buffy are the current Slayers. When mayhem caused by tidal waves and burning forests begin to erupt in Sunnydale as well as vicious attackers appearing with ceremonial axes, the gang knows that something is up. A woman named Cecile Lafitte has sent her Servants to kill the Slayers with special axes, Faith being the Slayer of Fire and Buffy being the Slayer of Air. Each Slayer has a special axe made to destroy the Slayer of that particular element. There are four axes in total; air, fire, water and earth. Should Faith and Buffy both be killed then it's believed that the line of Slayers would die out forever. Cecile wants to bring forth the Gatherer, and the only way to do so is to have the Slayers killed, which would feed the demon enough power to bring him forth into the world. Meanwhile, Willow ends up in the hospital with major brain trauma while Giles figures they need answers from the Watcher of the Slayer that preceded Buffy, India Cohen. During the final confrontation with the Gatherer, Willow and Cordelia briefly serve as hosts for India and Kendra respectively. Eventually with the help of the spirits of the former Slayers, Lucy Hanover and the spirits that live in the woods where the battle takes place, the group defeats the Gatherer and destroys it by each absorbing parts of its soul. Buffy also decapitates Cecile with the axes.",0
3603849,Oz: Into the Wild,Christopher Golden,2002-05,"{""/m/014dfn"": ""Speculative fiction"", ""/m/03npn"": ""Horror""}","Determined to find a solution to his lycanthropic problem, Oz sets out to discover the beast within himself, as well as the rest of the world. His journey takes him to LA, Fiji, Australia, China and finally to Tibet in his quest for peace. Oz finds himself running from Gib Cain, the werewolf hunter who wants his skin, battling vampires and all around, just running for his life. His journey takes him to China where he meets a young woman named Jinan, who is something more than human, and the two of them travel to Tibet in search of answers. A monk can guide Oz through his journey, but he can only take him so far into his own self-discovery. During the meantime, Muztag, an evil demon who has been the monk's lifelong enemy, is gathering forces in an attempt to take over a particular valley in Tibet and he must be stopped before he kills the monk, or Oz's hopes for hiding the beast within him will be totally lost.",0
3603856,These Our Actors,Dori Koogler,2002-09,"{""/m/06n90"": ""Science Fiction"", ""/m/014dfn"": ""Speculative fiction"", ""/m/03npn"": ""Horror""}","Even though Buffy decided to drop drama class to concentrate on her slaying and taking care of Dawn, Willow still decided keep the class on her course list. She becomes engrossed in it, especially when the teacher, Professor Addams, begins discussing rituals and chants involved in old dramatic works. Unfortunately, the professor, realizing that Willow has some power of her own, decides to use her for his own ends. He needs to locate a particularly powerful book used to summon the Fates, which he believes is located somewhere in Sunnydale. Spike and Willow realise that the professor is actually the father of Spike's mortal love interest, Cecily, who is attempting to use the power of the fates to resurrect his daughter after he accidentally killed her due to Spike's actions in his early days as a vampire.",0
3603859,Tempted Champions,Yvonne Navarro,2002-03,"{""/m/06n90"": ""Science Fiction"", ""/m/014dfn"": ""Speculative fiction"", ""/m/03npn"": ""Horror""}","A young, vicious and beautiful woman named Celina comes to Sunnydale and there's nothing but an uproar caused by her appearance. She's a deadly fighter that is willing to kill both humans and vampires alike. Upon her arrival in Sunnydale, she scares Anya, demanding to know where the Slayer is. As Buffy becomes involved in a short battle with Celina at sunrise, she realizes that she's in way over her head as Celina's method of fighting is far superior to her own. Meanwhile, Anya wrestles with her humanity and realizes that a lot of pain can come from being human and no longer immortal. D'Hoffryn offers her back her demonhood and she must decide which path is right for her. Buffy, after her encounter with the violent Celina, has Giles research who this mysterious woman is to better prepare her for the next time they meet. Unfortunately, the news of what Celina actually IS, is a lot more shocking than Buffy had expected.",0
3603864,Little Things,Rebecca Moesta,2002-08,"{""/m/06n90"": ""Science Fiction"", ""/m/014dfn"": ""Speculative fiction"", ""/m/03npn"": ""Horror""}","Ever since her mother's death, Buffy has been having problems keeping herself and Dawn living together peacefully, and the lack of money is affecting both of them. When Buffy suddenly develops an acute toothache, with no dental insurance, she can't afford to have it fixed. She must bear through the pain and keep it a secret from her friends while the town of Sunnydale becomes terrorized by miniature vampires. The miniature vampire fairies are led by Queen Mab who has come to Sunnydale with her troop in order to hunt down Anyanka. Back in the day, Anyanka was accidentally involved in turning these fairies into vampires and Queen Mab wants revenge on this act. Unfortunately, Buffy has to figure out how to kill vampires that are smaller than her palm.",0
3603867,Crossings,Mel Odom,2002-06,"{""/m/06n90"": ""Science Fiction"", ""/m/0dwly"": ""Children's literature"", ""/m/03npn"": ""Horror"", ""/m/014dfn"": ""Speculative fiction"", ""/m/01hmnh"": ""Fantasy"", ""/m/02xlf"": ""Fiction""}","While at the theater for a Star Trek marathon with Anya, Xander recognizes a friend of his, from the arcade, enter the theater and begin threatening and beating humans in a very demonic way. Upon further inspection, Xander learns that his friend, Robby, was involved in total immersion VR video game beta testing. But the testing was a little too secretive, according to Robby's girlfriend. Meanwhile, Buffy and Dawn are having issues with one another, and Buffy doesn't know how to deal with being Dawn's new ""mom"" after the recent death of their own mother. After much research concerning the bizarre video game tests, and the appearance of a man named Bobby Lee Tooker, the group discovers that the video game isn't so much a video game, as much as it is another dimensional portal while the human bodies are being taken over by demons. Buffy needs to find a way to get these beta testers (including a very reluctant Xander) back into the real world and destroy the evil demon who's using the testers to conjure a powerful being.",0
3603873,Sweet Sixteen,Scott Ciencin,2002-04,"{""/m/06n90"": ""Science Fiction"", ""/m/0dwly"": ""Children's literature"", ""/m/03npn"": ""Horror"", ""/m/014dfn"": ""Speculative fiction"", ""/m/02xlf"": ""Fiction""}","Buffy has a run-in with a couple demons at store while a gangly blonde girl watches on. Afterwards Buffy tries to talk to her but she runs off, faster than Buffy can catch her. Meanwhile Dawn has befriended a girl named Arianna at her school. Arianna has no friends and an abusive mother and has always longed to become a heroine. After it becomes clear that Arianna is the exceptionally strong girl that Buffy ran into, the gang tries to find out where Arianna's powers are coming from. Meanwhile, a demon called Aurek is searching for his daughter Arianna who is to become the Reaver, a being used for mass destruction of the dimensions. He finally locates her and tries to convince her that all humans are against demons. Just as Arianna starts to befriend Buffy, she then begins to pull away. Fearing that Buffy will just kill her in the end. Arianna has to make a decision on whether or not to keep her humanity.",0
3603881,Wisdom of War,Christopher Golden,2002-07,"{""/m/0dwly"": ""Children's literature"", ""/m/03npn"": ""Horror"", ""/m/014dfn"": ""Speculative fiction"", ""/m/02xlf"": ""Fiction""}","Two strange breeds of sea creatures are beginning to appear in Sunnydale, and none of them appear to be all too friendly. The Moruach and the Aegeirie are their names, the latter being followers of the immense sea beast Aegir who was once captured by the Moruach but later set free. As soon as Buffy is beginning to discover these creatures, the Watcher's Council steps in with a team with Quentin Travers leading the way. When Buffy does not agree to slay all the demons until she knows more about them and what they're doing in Sunnydale, Travers has Faith released from jail in Los Angeles for a temporary time in order to eradicate the demons in Sunnydale. Buffy begins to question her decision as well as her actions when innocent humans, including some of her friends, begin to transform into Aegir followers.",0
3603887,Apocalypse Memories,Melinda Metz,2004-03,"{""/m/06n90"": ""Science Fiction"", ""/m/014dfn"": ""Speculative fiction"", ""/m/03npn"": ""Horror""}","Willow has arrived back in Sunnydale after spending time with Giles in England. She is terrified of using her magic powers again for fear of a return to dark magic consuming her. However, suddenly Sunnydale once again becomes a center of the weirdness when an angel named Michael brings on signs of the Apocalypse. The angel insists that this is not an artificial one, the type Buffy had stopped before, this is the natural and long-established end of the world. Willow must find a way to overcome her fear of magic in order to perform one of the most dangerous spells known to mankind; the Belial Siphon, which has not been performed before. Meanwhile, Buffy is trying to stop an Apocalypse of her own accord, yet Buffy cannot seem to fight what is thrown at her.",0
3603894,Mortal Fear,Denise Ciencin,2003-09-01,"{""/m/014dfn"": ""Speculative fiction"", ""/m/03npn"": ""Horror""}","Something new has swept into the lives of the Scooby Gang, but all through different sources as they try to find acceptance with other people outside their tight knit slayage group; Xander with his co-workers, Willow with her professor at university and Dawn with a new group of not so straight-laced friends. Meanwhile, Buffy is being sent on random missions by a man that goes by the name of Simon. He wants her to retrieve parts of a mystical sword and put them together, but he refuses to say why or who he even is. When her friends suddenly start to turn against her, Buffy has to figure out how the sword and Simon ties into all the odd goings-on in Sunnydale.",0
