id,title,author,published_date,categories,summary,page_count
11083394,Señor Vivo and the Coca Lord,Louis de Bernières,1991,"{""/m/014dfn"": ""Speculative fiction"", ""/m/0127jb"": ""Magic realism""}","When the philosophy lecturer Dionisio Vivo confronts drug lords and the government through letters and a series of newspaper articles in La Prensa, he becomes the enemy of the ruthless coca lord El Jerarca, the character of which is probably based on the notorious Colombian drug lord Pablo Escobar. His implausible escapes from the assassins sent by El Jerarca compel the people of the country to regard him as a magical 'brujo' and the saviour to their conflict and poverty. Indeed, hundreds of women follow him in a pilgrimage across the country, each carrying the hope of bearing his child. His excellency President Veracruz attempts to put an end to the country's soaring inflation through a series of foolishly unrealistic measures, and searches for spiritual enlightenment with his ex-prostitute wife through magical potions and alchemy. An array of prostitutes, guerrillas and townspeople from the first book re-appear throughout.",0
11084310,The Troublesome Offspring of Cardinal Guzman,Louis de Bernières,1992,"{""/m/0127jb"": ""Magic realism""}","Cardinal Guzman lives extravagantly in the capital, and immorally, due to the discoveries of his having had a young son and his loathing of the poor shanty-dwellers who live below his palace. Despite the downfall of El Jerarca in Señor Vivo and the Coca Lord, the drug trade continues and the economy of the country spirals ever downward. Cardinal Guzman's clergy and the corrupt military of the country set out to destroy the heresy of the countryside, and, more specifically, Cochadebajo de los Gatos, home of Dionisio and many of the other characters. In so doing the hypocrisy of the Cardinal's faith with his own promiscuity is revealed.",0
11084602,The Glory,Herman Wouk,1994-11,"{""/m/02p0szs"": ""Historical fiction"", ""/m/02xlf"": ""Fiction""}","Interweaving the lives and fates of fictional characters and real-life notables, the sequel to The Hope continues the story of Israeli history to the climactic events of the Yom Kippur War and the promise of peace. Historical events in the book include: * The sinking of the Israeli ship Eilat by Soviet rockets fired by the Egyptian Navy. * The War of Attrition. * The Yom Kippur War. * Operation Entebbe. * The visit of Anwar Sadat to Israel. Families whose history is chronicled in The Glory: * Barak-Berkowe-Berkowitz * Nitzan-Bloom-Blumenthal * Luria * Pasternak Real historical personages in the novel include Yonatan Netanyahu, Golda Meir, Ariel Sharon, Anwar Sadat, Moshe Dayan, and David Elazar.",0
