id,title,author,published_date,categories,summary,page_count
11244666,The Diamond as Big as the Ritz,F. Scott Fitzgerald,1994,"{""/m/06n90"": ""Science Fiction"", ""/m/02xlf"": ""Fiction"", ""/m/0l67h"": ""Novella""}","John T. Unger, a teenager from the Mississippi River town of Hades, is sent to a private boarding school near Boston. During the summer he visits the homes of his classmates, the majority of whom are from wealthy families. In the middle of his sophomore year, a young man named Percy Washington is placed in Unger's dorm. He rarely speaks, and when he does, it is only to Unger. Percy invites Unger to his home for the summer, the location of which he only states as being ""in the West"". Unger accepts. During the train ride Percy boasts that his father is ""by far the richest man in the world"", and, when challenged by Unger, boasts that his father ""has a diamond bigger than the Ritz-Carlton Hotel."" Unger later learns that he is in Montana, in the ""only five square miles of land in the country that's never been surveyed,"" and Percy's boasts turn out to be true. Percy's ancestry traces back to both George Washington and Lord Baltimore. His grandfather, Fitz-Norman Culpepper Washington, decided to leave Virginia and head west with his slaves to enter the sheep and cattle ranching business. However, on his claim he discovered not only a diamond mine, but a mountain consisting of one solid diamond. Washington immediately finds himself in a quandary; the value of diamonds multiplied by the sheer number available for him to mine would make him the richest man ever to live, but, based on the economic law of supply, the sheer number of diamonds, if ever discovered by outsiders, would drive their value to near zero, thus making him a pauper. He immediately hatches a plan, whereby his brother reads to the African-American slaves a fabricated proclamation by General Nathan Bedford Forrest that the South had defeated the North in the American Civil War, thus keeping them in perpetual slavery. Washington travels the world selling only a few diamonds at a time, in order to avoid flooding the market, but enough to give him enormous wealth. The Washington family goes to appalling lengths in order to keep their diamond a secret. Airmen who stray into the area are shot down, captured, and kept in a dungeon. People who visit are killed and their parents told that they have succumbed to an illness while staying there. John falls in love with Percy's sister, Kismine, who accidentally lets slip that he too will be killed before he's allowed to leave. That night, aeroplanes launch an attack on the property, being told by an escaped Italian language teacher. Percy's father offers a bribe to God, ""the greatest diamond in the world"", but God refuses. John, Kismine, and Jasmine, another sister, escape while Percy and his mother and father choose to blow up the mountain rather than leave it in the hands of others. Penniless, the three survivors are left to ponder their fate.",240
11247103,Baby Is Three,Theodore Sturgeon,1950,"{""/m/014dfn"": ""Speculative fiction""}","The story describes the creation and ""bleshing"" of a new life form, Homo Gestalt, on Earth. It is formed by the symbiosis of four or more humans with paranormal abilities. One person, the ""head"" of the organism, assembles and directs the various parts through telepathy, another is the ""hands"" of the organism, able to move and change physical objects by telekinesis, the third and fourth persons are twins able to teleport at will, and the fifth person of the organism is a silent Down Syndrome baby with a brain like a computer and who acts as the ""brain"". ""Bleshing"" is how the organism describes its own completeness and functionality. The plot follows the psychiatric evaluation of a fifteen-year-old boy named Gerry, who believes he has murdered his caregiver Miss Kew for endangering the ""bleshing"" of his new organism. fr:Cristal qui songe",0
11250291,The Free Lunch,Spider Robinson,UNK,"{""/m/06n90"": ""Science Fiction"", ""/m/014dfn"": ""Speculative fiction""}","Twelve-year-old Mike is looking for a safe place to escape from the real world. Like Peter Pan, he seeks a fantastic sanctuary where he can stay without worry. Tomas Immega's amusement park, Dreamland, provides a completely immersive theme park experience, and seems to be just what Mike is looking for. Soon after escaping the guest tracking system, Mike meets Annie, a midget known as the Mother Elf, who has eked out a living in Dreamland for thirteen years caring for the park. Annie takes Mike in, but all is not well in Dreamland... The story is full of references to other works: * ""Strawberry Fields Forever"" * Callahan's Crosstime Saloon * Have Space Suit—Will Travel",0
11255306,Operation Columbus,Hugh Walters,1959,"{""/m/06n90"": ""Science Fiction"", ""/m/014dfn"": ""Speculative fiction""}","Both America and Russia plan manned missions to the Moon to examine the wreckage of the structures destroyed in The Domes of Pico. The American astronaut, Morrison Kant, breaks his leg shortly before takeoff, so Chris Godfrey steps in. Both spacecraft arrive at the same time. Unlike Chris Godfrey, the Russian pilot, Serge Smyslov, is unable to leave his Lunar Rover vehicle and both head for the wrecked domes, leading to a tense standoff... The book predates the first use of a Lunar Rover by 11 years.",0
11257737,The Monkey's Raincoat,Robert Crais,1987,"{""/m/0lsxr"": ""Crime Fiction"", ""/m/028v3"": ""Detective fiction""}","Cole is hired by Ellen Lang to find her missing husband and son and in the end, with Cole and Pike's help, she kills former matador and crime boss Domingo Garcia Duran, the man responsible for her husband's death and her son's kidnapping. The facts behind the events leading to Ellen's husband's involvement with Duran and his death are revealed and her son Perry is restored to her.",0
11257745,Moon Base One,Hugh Walters,1960,"{""/m/06n90"": ""Science Fiction"", ""/m/014dfn"": ""Speculative fiction""}","Thousands of young people are terminally ill as a result of the radiation produced by the lunar structures destroyed in The Domes of Pico. In an attempt to determine whether the fall-out from the domes can have a curative effect on the disease a joint East-West mission is planned under the auspices of the newly formed United Nations EXploration Agency (UNEXA). The mission is commanded by Chris Godfrey, accompanied by American, Morrison 'Morrey' Kant and Russian Serge Smyslov. The 'patient' will be Tony Hale, from Aston near Birmingham (who goes on to feature in the rest of the series). The mission starts well, but is soon in trouble when a supply rocket crashes...",0
11257813,Scales of the Serpent,Richard A. Knaak,2007-05,"{""/m/014dfn"": ""Speculative fiction"", ""/m/01hmnh"": ""Fantasy""}","This book begins with the attack on the Temple of the Triune by Uldyssian and his followers in the city of Toraja. After destroying the Temple and converting much of the cities populace to his cause, Lilith makes her presence known to Uldyssian, who leaves to confront her. He defeats the demon Gulag at this point by tearing him in two. Astroga (the spider demon) also seeks to attack Uldyssian here, but Lilith sends him away and seals her confrontation with Uldyssian from his sight. A brief fight occurs, during which Lilith reveals that she wants Uldyssian to destroy the Triune and the Temple. While this is happening, the rest of Uldyssian's followers including Mendeln and Serenthia continue to attack the temple, slowed by the statues of Mefis (Mephisto: Lord of Hatred), Dialon (Diablo: Lord of Terror) and Bala (Baal: Lord of destruction) coming to life and attacking them. Rathma communicates with the dragon Trag’oul, revealing he is the Son of Lilith and Inarius, and decides to take a more active role in things despite the fact that it would mean revealing his survival to both his parents. When Uldyssian returns to his followers, he displays astonishing power by keeping the entire temple from collapsing until his followers can escape. He warns the Council Senior of Toraja that he will attack again should the Temple of the Triune grow again in the city. Inarius decides that his power is such that he can now fly again without fear of the Angiris Council discovering Sanctuary, and does so. While he is contemplating Sanctuary's future, he is struck by a familiar sense and realises that his son Rathma is still alive. He doesn't care though, knowing he wouldn't hesitate to treat him any differently than Lilith. While Uldyssian is camping outside Toraja, some of its people come to see him, hoping to learn of the gift. During this time, some Peace Warder's under the disguise of common folk attack Uldyssian. One of the attackers was outside, and is found slain by an arrow shortly afterwards. This is later revealed to be a reanimated Achilios, brought back by Rathma. After speaking to the cities new converts to ensure they understand, they come up with a new name for Uldyssian's followers, ""Edyrem"", meaning ""those who have seen"". Serenthia goes to a stream alone to obtain more water for her flask, and unknown to Uldyssian encounters Lilith, who takes possession of her. Astroga has begun to suspect that Lucion is not who he seems to be, and after speaking to his master, Diablo, decides to put his own plan into action. On the journey to Hashir, a malevolent force begins to target Serenthia, but Uldyssian and Mendeln manage to draw its attention away from her by using their power to attack the structure they sense it emanates from. Mendeln meets with Achilios, and decides to tell Uldyssian that he is back. Rathma appears at this point and takes him to Trag’oul, preventing Uldyssian and Serenthia (Lilith) from detecting him, even though they combine their powers in a way they haven’t previously. When they continue their journey they are interrupted by heavy storms, which Serenthia disperses. Astroga takes on the form of the Primus, and has his high priest Arihan attack Uldyssian’s group when they reach Hashir, believing that taking Serenthia as a hostage will allow him to capture Uldyssian. Trag’oul and Rathma explain to Mendeln the history of Sanctuary, that mankind is the offspring of Lilith and Inarius (Rathma being their son). Trag’oul says that when Demons and Angels discover a potential advantage, such as the Nephalem, they fight over it relentlessly, usually resulting in its total destruction. They ask Mendeln to stand with them. Two morlu abduct Serenthia while Uldyssian is talking to the citizens of Hashir, but she quickly reappears and reveals their presence to everyone. When Uldyssian is telepathically attacked by Arihan from the temple, Mendeln appears and takes him to Trag’oul. Arihan, frustrated with the plans failure leaves the morlu and the peace wardens to their fate, returning to the Primus. Needing a scapegoat, Astroga murders Arihan and brings his head to Diablo. Uldyssian grows angry with Rathma and Trag’oul, believing they are corrupting Mendeln, and uses his power to escape. He ends up on mount Arreat, where Rathma appears and takes him to the World Stone. There, Uldyssian tries to use it to give his followers more power, but ends up altering its structure, something Rathma believed was impossible. Upon returning to Trag’oul, they discover that Inarius is active, heading for the world stone. The return Uldyssian to the Jungle to confront Lilith, and they go to mount Arreat to confront Inarius. Inarius overcomes them both easily, and inspects the world stone. Upon discovering the change in its structure, he states that Uldyssian may have condemned them all, hinting that he will decide to destroy Sanctuary and start over. Lilith has seduced Romus, and corrupts him into blindly following her and betraying Uldyssian to her. She kills Romus and attempts to sacrifice Uldyssian and her other corrupted followers to take control of the Edyrem. She fails thanks to Achilios intervening with the spell and freeing Serenthia from her. When Lilith retreats to the temple she finds traces of Astroga in the Primus’s chamber, and realises he had been masquerading as the Primus as well. Astroga confronts her, and they briefly fight. Astroga being the less powerful retreats and decides to form his own followers (this story is described in Moon of the Spider). Lilith decides enough is enough and gathers a huge army, intending to attack the Edyrem from behind and from the main temple. Uldyssian tries to remove Lilith’s taint from her corrupted followers, but is forced to kill them all when the evil within them starts to grow, he vows to make Lilith pay for what she’s done. Achilios decides to speak to Serenthia, but is abducted by an Angel. Rathma and Trag’oul can see no reason for Inarius to do this, and believe another Angel has taken him. They teach Mendeln how to summon spirits, and he summons the dead high priest Malic, offering him revenge against Lilith for information on the main temple. Lilith’s army attacks and she reveals the Thonos, a tentacle creature that attacks from the ground. They are almost overcome until Achilios is sent back to them with arrows that explode on impact. Lilith casts a spell that has the dead from both sides rise and attack the Edyrem, but Mendeln returns and destroys them. Uldyssian accidentally summons Lilith to him, who teleports him into the main temple. Uldyssian defeats Lilith and brings down the temple, leaving her for dead. Rathma enters the temple and finds Lilith dead, not realising it is an illusion Inarius has cast. After he leaves, Inarius enters and confronts a badly injured Lilith, revealing that he has been boosting the power of the Edyrem so they could defeat her. He traps Lilith in a glowing ball and shrinks it down to nothing. He states that her fate is fortunate, compared to what awaits Uldyssian and his followers who in their arrogance, believe themselves to be more than they are. The story continues in third and final installment of the trilogy, The Veiled Prophet.",0
11258391,Expedition Venus,Hugh Walters,1962,"{""/m/06n90"": ""Science Fiction"", ""/m/014dfn"": ""Speculative fiction""}","An unmanned probe returning from Venus crashes in the African desert; a Venusian spore on board thrives in its new environment; a grey mould quickly spreading and killing all it touches. An urgent manned mission to Venus is launched from Lunaville, the now permanent Moon base. Chris Godfrey, Morrey Kant, Serge Smyslov, Tony Hale and Pierre a scientist are sent to try and discover what limits the mould's growth in its natural environment. The plan is to collect samples from the Venusian atmosphere but in the end a forced landing is required...",0
11259604,Love and War,Margaret Weis,UNK,"{""/m/01hmnh"": ""Fantasy""}","The book is a compilation of 10 short stories from various authors taking place in the fictional world of Krynn: 1. ""A Good Knight's Tale"" by Harold Bakst. Told by a Knight of Solamnia, this is a tale that of a selfish father, Aron, who is overprotective over his daughter, Petal, which ultimately leads to a broken heart. 2. ""A Painter's Vision"" by Barbara Siegel and Scott Siegel. When a passionate artist Seron dies in an accidental fire, his widow Kyra, finds the strength to carry on his memory through a painting. Kyra carries on a strange relationship with a dragon named Tosch, who had befriended her husband before he died. 3. ""Hunting Destiny"" by Nick O'Donohoe. This is the tale of the undead who haunt Darken Wood, in another of Donohoe's interpretation of an event that took place in the novel, Dragons of Autumn Twilight. 4. ""Hide and Go Seek"" by Nancy Varian Berberick. Starts with a captive boy named Keli who is captured by a man named Tigo and a goblin named Staag. No sooner is Tasslehoff Burrfoot captured. They are later rescued by The Companions. 5. ""By the Measure"" by Richard A. Knaak. 6. ""The Exiles"" by Paul B. Thompson and Tonya C. Cook. It is the story of Sturm Brightblade's childhood as he and his mother are captured by a ship with guards from an island called Kernaffi. 7. ""Heart of Goldmoon"" by Laura Hickman and Kate Novak. 8. ""Raistlin's Daughter"" by Margaret Weis and Dezra Despain. The mysterious tale of the legend of a daughter fathered by the mage, Raistlin Majere. This tale is also reprinted in the novel, The Second Generation. 9. ""Silver and Steel"" by Kevin Randle. 10. ""From the Yearning for War and the War's Ending"" by Michael Williams.",0
11260253,Mararía,UNK,UNK,UNK,"The novel talks about a traveller - we don’t know much about him - who goes to the village of Femés in Lanzarote; there he’s interested about an old woman, who walks in the shadows at night. She is María, who everybody calls Mararía. Woman, lover or witch, but a myth over all. His interest is fed by the stories that he can listen to the people who live in the village, in which everyone fell in her net in the past.Whenever she loved someone, their relationship ended badly, and everybody in the village thinks she is guilty for their suffering. Now she is an old woman who walks in the dark and endures barking dogs and people’s comments. She is a symbol of purification and self-destruction.",0
11260902,Exit Ghost,Philip Roth,2007-09,"{""/m/02xlf"": ""Fiction"", ""/m/05hgj"": ""Novel""}","The plot centers on Zuckerman's return home to New York after eleven years in New England. The purpose of Zuckerman's journey, which he takes the week before the 2004 U.S. presidential election, is for him to undergo a medical procedure that might cure or reduce his incontinence. While in New York, Zuckerman meets Amy Bellette, whom he had last encountered during a visit to the writer E.I. Lonoff's house in December, 1956, as depicted in Roth's novel The Ghost Writer. Zuckerman also agrees to a housing swap with a young writing couple, Billy Davidoff and Jamie Logan, and quickly becomes attracted to Logan. In his hotel room at night, Zuckerman writes a play, He and She, composed of imagined conversations between him and Logan. Through Davidoff and Logan, Zuckerman meets Richard Kliman, a young, brash Harvard graduate who is working on a biography of Lonoff. Kliman was Logan's boyfriend in college. Because of Kliman's zealous interest in a potentially scandalous secret from Lonoff's adolescence, neither Zuckerman nor Bellette wants to help him complete his project. Zuckerman may also be motivated by his own confused feelings about Logan and Kliman. Although critics once considered that Lonoff, deceased and neglected, was modelled partly on the writer Bernard Malamud, he now seems to be based on a number of writers. Henry Roth is a major influence, as becomes clear in Exit Ghost. Roth's biographer is Steven G. Kellman. It is known that Philip Roth has read the later novels of Henry Roth, though some of these remain unpublished. The rationale for Henry Roth is that in his novels published after his death he reveals that he had an incestuous affair with his sister when he was young; it also known that Henry Roth suffered from writer's block for much of his career after publishing Call It Sleep, his only major novel. In Exit Ghost it is revealed that Lonoff also had an incestuous affair with his sister — which led to his writer's block — and the fact that while content to teach in oblivion, he never published again. American politics forms a backdrop to the novel. Zuckerman, Davidoff and Logan watch the results of the 2004 presidential election together. Logan, whose father always voted Republican, was enraged and devastated by the results. The older Zuckerman, though not pleased, was more philosophical and was able to place the results into a more historical context.",0
11263766,Diary of a Wimpy Kid,Jeff Kinney,2007-04-01,"{""/m/01z4y"": ""Comedy"", ""/m/02xlf"": ""Fiction"", ""/m/09kqc"": ""Humour""}","As Greg Heffley is getting ready for middle school, he is teased by his older brother Rodrick Heffley because his mom, Susan Heffley, bought him supplies for school, including a blank red diary,instead of his mom buying him a journal like he asked her to. He has a little brother, Manny who is ""spoiled rotten"" because he gets everything he wants and also gets away with everything he does wrong, unlike Greg, who gets in trouble for everything he does wrong. His father Frank Heffley does not encourage Greg's way of life - playing video games all day - rather than going outside and playing sports. Greg, during the first day of school, is immediately rejected and is forced to sit with another outcast who lives near Greg, Fregley, from whom Greg tries to keep ""a safe distance"". He is initially unsure of Rowley Jefferson being able to fit in, and tries to change Rowley, who Greg considers immature. Greg and Rowley decide to participate in wrestling at school, although Greg quits after losing a match against Fregley. On Halloween, Greg and Rowley go trick-or-treating, but are challenged by there of teens who they irritate and enrage and spray them with a fire extinger. The two friends barely escape to safety so they decide to go and stay in Gregs grandmother's house until the teens leave them alone. After getting few presents for Christmas, Greg decides to play a game with Rowley in which Rowley must ride a Big Wheel while Greg tries to knock him off. On one of Greg's tries, the ball gets under the front wheel, which causes Rowley to fall off and break his arm. The next day, a bunch of girls crowd around Rowley so they could feed him. Greg and Rowley decide to enroll in the Safety program in which they walk younger kids to their homes. One day, as Greg is walking the kids by himself,he chases the young children, only after scaring them with a stick with worms on it. A neighbor contacts the school and tells them about Greg's unusual behavior. The principal suspects Rowley, as Greg was wearing Rowley's coat. Rowley is quickly fired. Greg initially wants to tell him it is his fault that he was fired, but doesn't, only to let the truth slip later. This leads to Rowley breaking off his friendship with Greg. Greg tries to befriend Fregley to make Rowley jealous, although he is uncomfortable around Fregley. Resorting to auditioning for the school play (based on The Wizard of Oz) Greg lands the role as a tree, while Patty is cast as Dorothy, the protagonist of the novel. During the show's opening performance, Rodrick unexpectedly brings a camera to film the play. Greg becomes too nervous to sing, confusing the other ""trees"" who also fail to sing. Patty gets frustrated and angers Greg, who then throws props at Patty, and then everyone gets in the fight, ending the play in chaos. Rowley confronts Greg, which leads to a non-physical fight. The teens return and the younger kids scatter. The teens force Greg and Rowley to eat the ""Cheese Touch,"" a moldy piece of cheese that had been left on the grounds of the school. Greg refuses, dishonestly claiming that he is allergic to cheese and will die if he eats it, thus leaving Rowley to eat it. The other students notice that the Cheese is gone, assuming that someone has destroyed it; however, Greg takes the blame instead of Rowley as he feels pity on him. He and Rowley again become friends and Greg begins to anticipate a relaxing summer of playing video games.",0
11264071,Destination Mars,Hugh Walters,1963,"{""/m/06n90"": ""Science Fiction"", ""/m/014dfn"": ""Speculative fiction""}","The first man to pass close to Mars is driven insane by strange 'voices' he hears on his radio. He is unable to record the voices as the Van Allen radiation belts wipe the magnetic tapes clean, so doubt is cast on his account. U.N.E.X.A. (United Nations Exploration Agency) send their crack team (Chris Godfrey, Serge Smyslov, Morrey Kant and Tony Hale) to investigate. After landing on the planet's surface they find traces of an ancient civilisation, but then a disembodied Martian appears and demands its people be transported to Earth, where they will enslave the human race. One-by-one the crew are taken over. This novel introduces the concept of the Ion drive, allowing continuous acceleration of one-fifth g.",0
