id,title,author,published_date,categories,summary,page_count
24340683,The Little Stranger,Sarah Waters,2009-04,"{""/m/02xlf"": ""Fiction""}","Faraday, a country doctor with humble beginnings, is called to Hundreds Hall, an 18th century estate that has lived far beyond its former glory. He treats a young maid who dislikes the large, drafty emptiness of the house, but strikes a friendship with Caroline Ayres, the unmarried daughter of the family, her brother Roderick, who continues to heal physically and mentally from his experiences as a pilot in World War II, and their mother, the lady of the estate. He begins treating Roderick's lingering badly healed wounds and becomes a family friend, knowing them well enough to realise they are in dire financial straits and unable to keep the house in any comfortable condition without selling their lands or objects in the house. In an attempt to cheer up the family and possibly match Caroline to a potential husband, they throw a party for a few family friends when disaster strikes. A couple brings their young child who is mauled by Caroline's ancient and previously gentle Labrador retriever. Roderick begins to behave moodily and drink heavily. Faraday believes the strain of managing the estate is at fault. Roderick, however, divulges that something appeared in his room the night the dog attacked the girl. It was first in his room trying to harm him, and that he must keep the unseen force focused on him so as not to direct its attention to his sister or mother. Spots begin appearing on his walls looking like burns, and he is committed to a mental hospital after Caroline awakes in the middle of the night to find his room on fire though he is passed out in a drunken stupor. Faraday and Caroline waver between romance and confused platonic friendship. Other sounds in the house alarm Caroline and Mrs Ayres and their two maids. They find curious childish writing on the walls where these activities have taken place. The maids' bells sound without anyone calling them; the phone rings in the middle of the night with no one on the line. A 19th century tube communication device linking the abandoned nursery to the kitchen begins to sound, scaring the maids. When Mrs Ayres goes to investigate, she is locked in the nursery where Susan, her much-loved first daughter, died of diphtheria at eight years old. Experiencing shadows and indiscernible fluttering and frantic to escape, Mrs Ayres pounds the windows open, cutting her arms. After Caroline and the maids free her and she recovers, she comes to believe and take comfort that Susan is around her at all times, that Susan is impatient to be with her though she sometimes harms her. Caroline and the maid find one morning Mrs Ayres has hanged herself. The day of Mrs Ayres' funeral, Faraday and Caroline set plans to marry in six weeks' time. Caroline, however, is listless and uninterested in the wedding, eventually calling it off and making plans to sell Hundreds Hall. Faraday is unable to believe it and tries several times to talk Caroline out of it to no avail. On the night of their would-be wedding, Faraday has a call that keeps him out and comes home to learn that Caroline hurled herself off of the second floor onto a marble landing, killing herself. The maid reports at the inquest that she awoke to hear Caroline go upstairs to inspect a sound she heard in the darkened hall. She simply said ""You!"" then fell to her death. Three years later, Faraday continues to visit the abandoned mansion, unable to find what Caroline saw.",0
24342325,Monsters of Men,Patrick Ness,2010,"{""/m/06n90"": ""Science Fiction"", ""/m/03mfnf"": ""Young adult literature"", ""/m/02xlf"": ""Fiction""}","The book picks up where the previous one left off. A Spackle army marches on New Prentisstown from one direction, and the forces of the Answer from the other direction. Mayor Prentiss has been freed by Todd to help defend the city, whilst Viola is with the Answer and the scout ship, in hopes of acquiring additional aid. The Mayor assembles his army and orders attacks on the Spackle army at the waterfall near the city. The Spackle, however, while outgunned, are thousands in number, and their weaponry has evolved since the first war thirteen years prior. While keeping the bows and arrows, a new weapon that unleashes white 'sticky' fire is mounted on the back of their bullock -like creatures, labelled ‘battlemores’ by the settlers. This, along with another weapon - white sticks that shoot a mixture of organic chemicals - easily beat back the Mayor's first wave. Todd is nearly obliterated by the fire weapon, but uses his Noise in the same way he used it against the Mayor to incapacitate the rider of the battlemore. A second wave of soldiers, this time utilising artillery to cover them, are able to send the Spackle back in retreat. Meanwhile, Viola finds Mistress Coyle with the scout ship, which has landed at the base of the demolished communications tower. Two friends from the settler convoy, Simone and Bradley have been sent to look for Viola, and are shocked at the state she, and the settlement, is in. Mistress Coyle, at first surprised that Viola is alive, quickly recovers, and tries to explain her actions. But Viola silences her and warns Simone and Bradley not to trust the healer. Then, concerned with Todd’s safety, Viola asks Bradley to launch a survey probe to scope out the scene. After seeing the war and Spackle weaponry, and faced with the risk of losing Todd, Viola nearly launches one of the scout ship's point-to-point missiles at the battle. However, the Mayor’s secret artillery is fired first. Bradley and Simone accept Viola's decision that nobody is trustworthy, save for Todd, and send the probe to observe the Spackle encampment, revealing the enormous numbers they have. The narrative then switches to a Spackle in the midst of the Spackles’ camp. The spackle is 1017, called the Return, and exists as a separate entity to the Land, the Spackles. He is the only surviving Burden, and seeks revenge on the Clearing for killing his ‘one’. His viewpoint ends with Bradley's probe being shot down. The next day, Spackle dam off the river far down, blocking the water supply, and attack the Mayor's camp with a bow-launched burning boomerang that is capable of returning after hitting several targets and then being re-launched in a matter of seconds. Coyle attempts to manipulate Viola to launch a missile to save ‘her boy’, but Bradley is heavily against it. Todd, being watched by a new probe, becomes a stationary target when his horse, Angharrad, refuses to move and he refuses to leave her (he cannot do the same thing he did to Manchee). When Viola thinks she sees Todd getting hit by one boomerang, though it was actually the Mayor's horse, she launches the missile, which causes a catastrophic explosion. This kills all the Spackle archers and blocks the way up and down the hillside, separating the two armies. The Mayor then sends the thought ‘I am the circle and the circle is me’ into Todd, softly, though Todd objects and threatens to hurt him. Then he notices that this quietens his Noise, and pushes away the memories of war, and so he finds himself repeating it for comfort and power. Viola arrives at the town square, shaken that she caused a war for Todd. Todd tells her that he would have done the same, but she finds little comfort. She then notices that Todd’s Noise is quieter, and he sees that she is ill, but the two do not elaborate on either conditions. The narrative switches again to the Return, who is arguing with the Sky, the leader of the Spackle, and demands more action and attacks. The Sky refuses to do anything that will not be for the good of the Land, but asks the Return to trust him, and takes his to the Pathway’s End. He reveals ‘the Source’, a human captured before the war began. The Sky offers the Source to the Return if the two armies reach peace. The Return is unsure why such a person would be considered a reward until he recognises the Source as Ben, Todd's adoptive father. Meanwhile, refugees begin to pour in from the outskirts of New Prentisstown - most of the men joining the Mayor's forces in the town square, while most of the women joining Coyle's forces at the landing site. The Spackle begin attacking the town at random, destroying various targets and killing any scout parties the Mayor sends. The white stick weapons are realised to be some sort of ballistic weapon that shoot acid, which vaporizes on leaving the barrel, but keeps cohesion until it hits a target. Eventually, the water store is attacked, and nearly all of the remaining water is lost. During this time, the Mayor loses control over ordering soldiers with his Noise, and Todd hits him and takes over. The Mayor praises him for having such ability, but Todd is preoccupied with the discovery of James’ body (a soldier who feeds the horses, drowned in the water tank flood). He would not have been killed if Todd had not controlled him to go get extra water for Angharrd, and this causes Todd to regret having controlled him for his own desires. Now without water, and the Answer without food, the two parties are forced into a peace talk at the destroyed House of Healing. The Mayor and Todd meet Coyle, Simone, Bradley and Lee, and Todd and Viola quickly disclose the fact that they have brought additional soldiers who are in hiding. However, Todd doesn’t reveal why his Noise is becoming harder to hear, and Viola refuses to acknowledge that the infection from her arm band is starting to seriously affect her. After negotiations, a peace is reached and a transfer of food is made from New Prentisstown to Coyle's camp. Now that the two groups are working together, the Mayor lures Spackle out to fight them, and the Answer provides bombs to destroy the attacking Spackle. Bradley, nicknamed ‘the Humanitarian’, angrily convinces Todd and Viola to stop this. A Spackle is captured by the Mayor, and then sent back to the encampment with two messages. The Mayor sends one of absolute silence, and Todd tells them that they want peace. He hears the Spackle call him ‘the Knife’ before running away. Angry that the Mayor undermined her, Mistress Coyle sends a bomb into the Spackle stronghold. The Spackle respond by sending the same Spackle that was captured, telling them to send two people to meet the Sky on the hill tomorrow morning. Viola and Bradley, who has caught the Noise germ and will thus appear more trustworthy, are sent to talk. The Sky greets them, but one individual - 1017, the survivor of the Mayor's genocide, and the Spackle who had sworn vengeance on Todd when he was saved - recognizes Viola as Todd's ‘one’, and attempts to murder her. However, he stops when he sees the ID band that had been banned onto her wrist, and in his surprise is taken away by the Land. Hesitantly, the peace talks resume. That night, however, the Spackle launch a surprise attack on the Mayor and Todd. But the Mayor, who had read the Sky’s Noise through the messenger, knew of this plan beforehand and had already set up his artillery and soldiers. After killing the attacking Spackle, the Mayor grabs Todd’s comm and tells the Sky that he can read him and that he should forfeit. The Sky, shocked, agrees. The Return, meanwhile, has returned to the Pathway’s End to kill Ben as peace has now been reached. The Sky meets him there, and watches as the Return fails to murder Ben, unable to kill just like Todd. He resents this, but the Sky tells him he will need this knowledge when he becomes the Sky, and then wakes up Ben, ignoring the Return’s confusion at this statement. When Ben wakes, he can speak in the language of the Land. The next day, peace is reached, though negotiations are scheduled to continue. The Mayor strategically announces that they have beaten the Spackle to the hilltop campers, and that a cure for the ID band infection has been found. Mistress Coyle is outraged and convinced that the Mayor planned this, and takes to testing the cure, warning that audience that the Mayor is up to something. Her accusations are met with booing and anger, and she recedes in bitter anger. Soon, testing reveals that the cure uses an aggressive antibiotic mixed with an aloe the Mayor claims he found in Spackle weaponry, which allows the medicine to disperse ten to fifteen times faster. Viola asks Todd to decide if she should take the cure. At the town square, the Mayor teaches Todd how to read by giving his skill of reading through Noise. After reading his mother’s diary, Todd asks the Mayor if the cure is real, and the Mayor simply says it will. Convinced, Todd brings the bandages to Viola the next morning to treat her infection. A little later, Mistress Coyle delivers a speech on her intentions to resign and hand over leadership to the Mayor fully. However, it quickly turns out to be a plot to kill the Mayor using a bomb strapped to her own person. Todd, in an attempt to save Simone who is in front of Mistress Coyle, inadvertently saves the Mayor instead, foiling her plan and revealing that he can control people with his Noise (as he ordered Wilf to jump from his position near Mistress Coyle). The Mayor thanks Todd endlessly but Todd is horrified that he has saved the Mayor subconsciously and not Simone, as proven by the replay on nearby probes. Viola is similarly horrified, unsure of who Todd has become. She tells him that she hates his silence, and they fight, Todd convinced that the Mayor has changed and Viola accusing him of turning into the Mayor. She then tells him that she cannot trust him anymore; that he isn’t him anymore, causing his Noise to flare up in anger, shock and hurt. The Mayor interrupts before more can be said, intent on delivering another speech to show the citizens that he is okay. As the Mayor starts the speech, and asks Todd to be his son, Ben and the Return arrive. Todd, overwhelmed by happiness, launches himself at Ben and leaves the Mayor on stage, ordering people to get out of his way as he runs. The two embrace, and the Mayor is left feeling betrayed and unwanted. Now that Ben can speak the Spackle’s language, he prefers using his Noise to communicate, and, consequently, Todd’s noise opens up around Ben as they talk. After this, Todd asks Viola to leave New Prentisstown with him when the war is over, and declares that he doesn’t care about what will happen to everyone without his supervision. His Noise is audible once more, and he openly thinks about how beautiful Viola is and how he wants to hold her. He hastily apologises, but Viola kisses him, and thinks that it feels like ‘finally’. The present party splits to settle a peace immediately, leaving Todd and the Mayor alone. Angered that Todd no longer cares about him, and wishes to leave him the moment peace is established, the Mayor shoots Ivan and steals the scout ship, kidnapping Todd in the process. Learning how to operate the scout ship by stealing Bradley’s Noise, the mayor launches the missiles at the Spackle, where Bradley, Viola and Ben are still negotiating terms. However, the missiles and 'cluster bombs' later fired does not explode. The Mayor decides to try something different, remembering a trick Bradley’s grandfather had taught his grandson. He remixes the fuel and releases it. The fuel mixture is the same used by Viola's campfire box in 'The Knife of Never Letting Go' when only a few drops blew up the bridge between old Prentisstown and Farbranch. The fire kills many Spackles, including the Sky, and the Return becomes the new Sky. Todd attempts to call Viola, but is cut off by the mayor. However, Todd manages to convey that they are headed for the ocean. The new sky then releases the water as a retort. In this process, the town is swept away, and the army, previously controlled by the mayor, returns to self-control. Humans and the Sky then manages a ceasefire. The Mayor then lands at the ocean. The new Sky decides to attack the settlers, while the Mayor had ordered his remaining captains to attack the Answer and march into the town square to die. However, Lee, using a rifle with Wilf's help, kills Captain Tate and the soldiers join the remaining people. Wilf and Ben manage to dissuade the Sky from the attack, Wilf’s honest and open Noise showing the Sky how to listen to the Land, leaving the Mayor disappointed. Viola and Bradley now ride to the ocean in hopes of aiding Todd. However, Acorn, Viola's horse, dies from exhaustion, and she is forced to ride Angharrad while Bradley is left behind. At the ocean, the Mayor congratulates Todd, then says he will be a fine leader of New World - a world he doesn't want to be a part of, as the mayor is dying, by his 'too much knowledge'. The mayor then fights with Todd, using only their noises, and Todd wins. The mayor then commits suicide by walking into the sea, where the killer fish eats him. The Sky arrives on his battlemore with Ben. He sees Viola and Todd, but mistakes Todd for the Mayor and shoots him in the chest with the acid rifle. Todd’s Noise disappears, and he dies, driving Viola to threaten shooting the Sky back. The Sky, revealing that he shot despite knowing that it might have been Todd, realises how wrong he was to do so, and feels the regret Todd felt when killing a Spackle in book one. Viola stops short of killing him, realising that it would cause never-ending war, and that no one would remember Todd, and everything that he had done, after. She warns the Sky to get out of her sight, and returns to Todd. Ben suddenly asks if she can hear anything, swearing that he can hear Todd’s Noise. The Spackle attempt to cure Todd with their medicine, and house him in the Pathway’s End. The remedies are working, and his Noise returns in burst on and off. The main convoy is about to arrive to a large ceremony, one which Viola will not attend because she will not leave Todd’s side until he wakes up, though she knows that he will be changed, like Ben was. The Sky has promised not to take the cure for the band infection until Todd is cured, in an act of self-discipline, but Viola does not forgive him and will not let him enter to see Todd. Everyday, Viola continues to read Todd's mother's journal to him, hoping that he will hear and come back. The epilogue cycles through Todd's experiences in the coma. He is entering his old memories, at his school, at Farbranch, but also human and Spackle memories from all over New World. He searches for Viola, unsure who she is, who he is. Every now and then, he hears abstracts from his mother’s diary, and Viola, and he begs Viola to keep calling for him. The novel ends with hope that he’ll return, the last lines being ""Keep calling for me Viola-, Cuz here I come"".",0
24349475,Freddy and the Ignormus,UNK,UNK,"{""/m/02yq81"": ""Comic novel"", ""/m/0dwly"": ""Children's literature""}",":""'When you’re alone,' said Freddy firmly, 'and you hear or see something scares you, the thing to do is walk right up and find out what it is.'"" (p. 9) In answer, the stuttering frog Theodore challenges him to visit the Big Woods. The Woods were owned by Mr. Grimsby, who attacked animals. After he left, the Woods' reputation worsened. Not for the first or last time, Freddy and Theodore find it is easier to be brave when not in the Woods. When startled, they flee outside, only to meet their enemy Simon the Rat, who has seen their flight. He warns about a mysterious, killer ""Ignormus"". Simon’s return prompts a general meeting of the F.A.R. (First Animal Republic), a group once organized to tend the farm while the Beans vacationed. Many do not believe that Freddy was in the Big Woods, including Charles the rooster. :""'Or is it, as some old legends tell, a bird with the head of a lion?...Is its name, as Simon says, the Ignormus? No one knows.' :'If you just got up to tell us that you don’t know anything,' said Old Whibley...'you can sit down again. We knew that before.'"" (p. 51) Freddy dares Charles to go into the Big Woods with him. Charles is frightened, but his wife Henrietta bullies him. The rooster and Freddy arrive independently in the woods. Freddy’s imagination turns a sighting of the rooster into a creature with a long snout and tail feathers. Charles in turn mistakes the pig. After Charles brags widely, they discover that they only saw one other. The animal’s bank is robbed, the Ignormus is suspected. Freddy disguises himself as a hunter, borrowing Mr. Bean’s shotgun. While investigating the old Grismby house Freddy fires at what he thinks is a snake, knocking himself out. When he revives the shotgun is missing. At the farm, the practical cow, Mrs. Wiggins modestly questions why such a terrible Ignormus would not confront Freddy. ""'I don’t know what I mean...I just say what I think. You’re smart. It’s up to you to figure out what I mean.'"" (p.&nbsp;130) The Bean farm is robbed, and missing items are found in Freddy’s pigpen. Freddy gets a report that animals are being threatened in the name of the Ignormus. Investigating, an extortion letter in familiar handwriting is found. Jinx the cat is unimpressed with the pig’s deductions: :""'To the eye of the trained detective nothing is ever just what it seems to be.' :'What does that make you, then?' said the cat."" (p. 160) Suspiciously, walking the Big Woods road, seeking the letter writer, they once again meet Simon. Then a huge white shape with horns floats from the woods, and they flee. Returning to the Grimsby house, the missing shotgun is pointed at Freddy and Theodore from a window. Retreating to the bridge where the animals are leaving goods extorted from them, they encounter Charles talking with the Ignormus’ small henchman. Hidden, Freddy mimics the henchman’s voice, insulting the rooster and sending him into a fighting fury. Charles wins the fight (and gains the reputation that follows him through the rest of the series). They discover that the henchman is Simon’s son just before he escapes. Frightened animals are starting to leave the farm when Freddy gives a speech pointing out that they are ""deserting under fire"". Animal patriotism and fighting spirit are roused. A beetle volunteers to climb up the shotgun barrels to gnaw out the gunshot. F.A.R. president Mrs. Wiggins organizes her troops. Charging the Grimsby house, they are halted by Simon. But he just has insults and seeks no compromise. The charge continues, the gun goes off, the gunpowder alone slightly injuring Freddy. The house is overrun, but they only find Simon and his gang. Old Whibley the owl reveals the final mystery, dropping on Freddy the weighted bedsheet used to allow the ""Ignormus"" to drift through air. Mrs. Bean is sympathetic about the rats' trials, and they accept her offer of hospitality, except Simon, ""I don’t want kind words, and I don’t deserve them."" (p.&nbsp;278) The rest of the animals throw a party. But at the end, Jinx observes that there will always be ""Ignormuses"".",0
24351089,The Other Lands,David Anthony Durham,2009-09-15,"{""/m/01hmnh"": ""Fantasy""}","Several years have passed since the demise of Hanish Mein. Corinn Akaran rules with an iron grip on the Known World's many races. She hones her skills in sorcery by studying The Book of Elenet, and she dotes on her young son, Aaden – Hanish's child – raising him to be her successor. Mena Akaran, still the warrior princess she became fighting the eagle god Maeben, has been battling the monsters released by the Santoth's corrupted magic. In her hunt she discovers a creature wholly unexpected, one that awakens emotions in her she has long suppressed. And Dariel Akaran, once a brigand of the Outer Isles, has devoted his labors to rebuilding the ravaged empire brick by brick. Each of the Akaran royals is finding their way in the post-war world. But the queen's peace is difficult to maintain, and things are about to change. When the League brings news of upheavals in the Other Lands, Corinn sends Dariel across the Grey Slopes as her emissary. From the moment he sets foot on that distant continent, he finds a chaotic swirl of treachery, ancient grudges, intrigue and exoticism. He comes face to face with the slaves his empire has long sold into bondage. His arrival ignites a firestorm that once more puts the Known World in threat of invasion. A massive invasion. One that dwarfs anything the Akarans have yet faced. <!--",0
