id,title,author,published_date,categories,summary,page_count
10170289,Oakleaf Bearers,John Flanagan,2006-05-01,"{""/m/014dfn"": ""Speculative fiction"", ""/m/01hmnh"": ""Fantasy"", ""/m/0dwly"": ""Children's literature""}","The book continues from where the previous book left off. In The Icebound Land, Evanlyn and Will have been captured and sold as slaves. As the time went on, Halt and Horace travelled across Gallica, defeating false knights, and ridding Gallica of the evil warlord Deparnieux. They are now in Gallica ready to board a ship and save Will. Meanwhile, Will has overcome his addiction to warmweed and finally regains his senses. Evanlyn, revealed to be Princess Cassandra, is out checking traps for food when she is taken hostage by the Temujai. Halt and Horace, still on their rescue mission, find a gate of which a dozen Skandians lay dead, shot. Halt manages to recognise an arrow, shot by the Temujai and becomes instantly worried. Two decades ago, the Temujai had nearly conquered the world, but with politics and a dish of bad clams, the invasion was stopped. Halt and Horace, after managing to track the Temujai down, came to Will's aid and they try to get Evanlyn back. Halt and the group, after being reunited, were then captured by Erak, the Skandian Jarl who had set Evanlyn and Will free. Erak had been trying to track down the people who shot the Skandians at the other gate, and hastily came to a conclusion that Halt was the one who did it. Halt gave a list of reasons, which convinced the senior Jarl to listen to him. The Skandians have no chance, as they are greatly outnumbered and the Temujai have long-range archers, versus the Skandians one-on-one close combat. Halt, Evanlyn, Will, and Horace are now forced to stay in Skandia because the Temujai have blocked their only exit to their homeland. Erak came to a decision into trying to get Ragnak, the Oberjarl, to let Halt become their strategist as he had lived and fought with and against the Temujai before, thus knowing their battle plans and style of fighting. Halt and Erak also manage to find the main army of the Temujai, followed with a very narrow escape because of Erak's clumsiness. Halt and Will also manage to convince the Oberjarl into getting the slaves to become archers with their reward being freedom, of which Ragnak had to very reluctanctly accept. 20 Skandians were also supposed to raid the army's food supplies, wagons, and release their horses as the army, who had not expected the Skandians to be strategic. Further on in the story, the Temujai begins their first attack and, as Halt had said, made a fake retreat of which the Skandians purposelly followed their ""ambush"". Halt, however, had placed a group of Skandians to ambush the Temujai. This made them driven back and the General of the army, along with the Colonel, were very surprised because the Skandians were not behaving anything at all from what they've heard. In the battle, Will manages to keep his archers concealed for a while, but soon, they are spotted. Will kept his archers firing their arrows, but they were defeated. Meanwhile, the Skandians, made an impact on the opposing army, and the General had to retreat back to his homeland because he lost too many warriors. The Skandians had won. Erak takes the group back to their home. After a long happy union, Will and Evanlyn then find out that Halt has been banished; Erak saves the awkward moment by trying to include it in their treaty to pardon him, of which King Duncan agrees. In the end, Halt was rewarded with his reunion back with the Rangers, Horace with his knighthood and position as the Royal Guards, and Will was offered to become one of the Royal Scouts, a high position of the King's army that trains archers and that only nobles could probably have; this would give him fame and reputation, but Will, in his heart, turns the offer down. Will wants to continue his training to became a full-fledged Ranger. Evanlyn, near the end as well, is sad because her friendship with Will is breaking up and Alyss is a little glad about that in later books.",0
10178524,The Princess Diaries,Meg Cabot,2000,"{""/m/0dwly"": ""Children's literature"", ""/m/03mfnf"": ""Young adult literature"", ""/m/02xlf"": ""Fiction""}","Mia Thermopolis an average urban ninth grader. She lives in Greenwich Village with a single, liberal mom who is a semi-famous painter, but Mia puts on her Doc Martens one at a time, and the most exciting things she ever dreams about are kissing senior Josh Richter (""six feet of hotness"") and passing Algebra. Mia's dad comes to town and drops a major bomb: he's not just a European politician as he's always led her to believe, but actually the prince of a small country. And Mia, his only heir, is now considered the crown princess of Genovia. She doesn't even know how to begin to cope: ""I am so NOT a princess.... You never saw anyone who looked less like a princess than I do. I mean, I have really bad hair... and... a really big mouth and no breasts and feet that look like skis."" Mia's troubles are worsened: her mom has started dating her algebra teacher, the paparazzi are showing up at school, and she has a fight with her best friend Lilly after this they don't talk for a while so they become distant from each other. Mia goes to her Grandmère's Plaza Hotel room in order to train to be a princess and she starts to develop into a great princess. Throughout story Mia also makes another friend named Tina, who is shunned because of her overprotective father, who makes her have a body guard.",0
10181071,Exile's Honor,Mercedes Lackey,UNK,"{""/m/014dfn"": ""Speculative fiction""}","Alberich is a Captain of the army in Karse, the youngest person to receive this promotion. He has flashes of Foresight and one day gets a vision of bandits invading a village while grooming his horse, a gift from the priesthood upon his promotion. He musters his men and is able to save the village. After, a Red-robe priest of the god Vkandis proclaims that Alberich has a ""witch-power"" and therefore is condemned to death. He is locked in a barn and the barn is set afire. However, the horse given to him after his promotion rescues him and turns out to be a Companion named Kantor who Chooses Alberich. Alberich is unwillingly taken to Valdemar, where he recovers from his injuries. When he recovers, he is informed by King's Own Talamir that he is now a Herald Trainee. Alberich had been taught that Heralds were demons along with their ""Hellhorses"" - the Companions. Alberich now has to deal with this fact, as well as the realization that he no longer can return to Karse. A priest of Vkandis and his acolyte are able to help Alberich accept matters in Valdemar as they had fled from Karse as well. Alberich settles into life at the Collegium as the Weaponmaster's Second. Alberich is later made the bodyguard of Princess Selenay and accompanies her when she does her circuit training at the courts in the city. Karse and Valdemar have been at war for generations, and Karse hired a nation of mercenaries not tied to the Mercenary Guild to fight on their behalf. Alberich helps Valdemar fight what are later known as the Tedrel Wars. Alberich uses his connections in the Karsite military to acquire intelligence on the Tedrel Mercenaries as the battles go on season after season. In a dramatic final battle, Valdemaran forces fight the entire nation of Tedrel mercenaries. When all seems lost, King Sendar, Selenay's father, rushes into battle and is killed. King's Own Talamar loses his Companion, Taver, as well and another King's Own Companion named Rolan arrives to pull him out of his grief. Selenay becomes queen, and a funeral procession is arranged for Sendar to return to the captiol city of Haven. Upon his return, Alberich is made full Weaponmaster, the old one deciding to retire, and he finally settles into his new life in Valdemar.",0
10191858,Come Back for More,Ralph Salaway,UNK,"{""/m/0lsxr"": ""Crime Fiction""}","After testifying against the murderer of bank guard Pop Walters, ""Swede"" Anderson finds himself number one on the River City, California crime syndicate's hit list. He barely escapes fiery death after the mob wires a bomb into the door of his car. Captain Domms of the city police is unable to protect him or, worse, has his own hand in the mob's pocket. Seeing no refuge for himself in River City, Anderson rides the rails out of town and fades from local memory. Anderson realizes that after four years of hobo living has melted away his flab, the sun has turned his formerly pale skin to leather, and a run-in with a railyard bull has left his nose broken and his cheek scarred, he is scarcely recognizable as his old self. With a bottle of henna he completes the transformation by coloring his blond hair red. Under the name of his late hobo pal, Mac McCarthy, Anderson returns to River city with revenge on his mind. There, he signs on as a driver with Tyler Trucking. The firm is being run by Gail Tyler, following her father's death—under suspicious circumstances—in a high-speed truck wreck. Anderson soon learns that between the union and the crime syndicate it fronts, the lifespan of a trucker in River City is not entirely in the trucker's hands. Using a mix of guts, muscle, and brains, Anderson builds a reputation as a cool-headed tough whose only interest is in a quick dollar. He manages to infiltrate the mob, but soon finds himself in over his head. In what he thinks will be simple heist, he becomes an unwilling accessory to the murder of the head of a rival trucking firm. In this he implicates not just himself but also Tyler Trucking and Gail, with whom he has developed a romantic attachment. Investigating the crime, Captain Domms fails to see through Anderson's Mac McCarthy disguise and proves himself no more able to enforce the law than he'd been four years ago. Never losing his nerve, Anderson ultimately wins the mob bosses' full confidence and is taken into a plot to rob the same bank he worked in when Pop Walters was killed. While rehearsing for the robbery, Anderson sees through the mob's plan to murder him after he plays his part—to avoid making the generous payoff it's promised him. Anderson develops a counter-strategy, but realizes the mob has turned the tables on him when the next rehearsal suddenly becomes the real thing. As the story reaches its climax, Anderson has only moments to adapt his half-formed plan to the new scenario, save his life, and find the revenge he has sought.",0
10192978,Jeffrey and Sloth,Kari-Lynn Winters,2007,"{""/m/0dwly"": ""Children's literature""}","Jeffrey can't think of how to start his writing assignment so he doodles instead, only to have his doodle of a sloth come to life and order him about. Jeffrey struggles against the strong-willed Sloth, in the process telling a tale and completing his homework.",0
10197451,The Alexandria Link,Steve Berry,2007,"{""/m/01jfsb"": ""Thriller"", ""/m/02p0szs"": ""Historical fiction"", ""/m/02xlf"": ""Fiction"", ""/m/05hgj"": ""Novel""}","The Library of Alexandria was the most important collection of ancient knowledge ever assembled. The building stood for six hundred years and contained more than half a million manuscripts. Then suddenly it vanished. No trace of this literary treasure has ever been unearthed. The book starts in Palestine in 1948, just as the state of Israel was being established. During Israel's War of Independence, a man is captured by Arab soldiers and taken to George Haddad who is surprised to find that this man is actually looking for his father and has some hidden truth to share. He mentions that Arabs are fighting a war that is unnecessary, against an enemy that is misinformed. Unable to learn more, the leader decides to shoot the mysterious man. In present day Copenhagen, Denmark, Cotton Malone is in trouble. His son Gary is being held hostage by unknown enemies who want to trade him for the secret of the Alexandria Link. Malone is the only living person who's aware of it. He receives an anonymous email saying that he has only 72 hours to get it and trade with them. He and his ex-wife Pam visit Malone's influential friend Henrik Thorvaldsen's mansion to get some answers. A mysterious man, Dominick Sabre, is following them all the time. Stephanie and her boss, US Attorney General Brent Green, contacts Larry Daley, the main contact in the White House who knows more than them about the Link. Green says that the Link is in fact a person named George Haddad, a Palestinian biblical soldier. Malone uses Thorvaldsen's computer to log in to his ""Magellan Billet"" secure server, which was accessible to him when he used to work for the justice department. He contacts his former boss, Stephanie Nelle, for more information. She mentions that there was some security breach and some secured files may have been exposed. Malone meets agent Durant, who works for Stephanie, but he gets killed before he learns more. Malone follows the killer and eventually rescues Gary after killing his captors. What he apparently does not realize is that that was the plan by Sabre, who had anticipated this from the start. He delivers this message to his employer, the mysterious Blue Chair, the head of ""The Chairs"", according to whom they have different interests in the Alexandria Link; while Sabre wants the link, the Chairs want it to be obliterated. Later Thorvaldsen reveals to Stephanie the whereabouts of ""The Chairs"" and that it is a recreation of the Order of the Golden Fleece) - a European economic cartel. The head of this circle is called the Blue Chair, currently Alfred Hermann, an Austrian industrialist. This circle has many controls over Europe and their highest priority is the Middle East. Malone is on his way with Pam to meet Haddad. He keeps Gary at Thorvaldsen's mansion, hoping that will keep him safe. He goes to London with Pam and meets Haddad to learn more about the Library of Alexandria and the mystery. Haddad tells them about the probable translation inaccuracies of the Old Testament and how he is working to show how it has been translated from Old Hebrew. But before he finishes explaining everything to Malone, Israeli agents arrive and kill Haddad. Stephanie meets Heather Dixon, an Israeli citizen attached to the Washington mission, who tries to kill her. Cassiopeia Vitt, Thorvaldsen's associate, appears and tranquilizes her with a dart. Brent Green helps her to learn a lot about the current situation and reveals that Pam Malone might be the conduit of Israel. Sabre meets Malone and Pam and tries to buy some information from them in exchange for decoding a word-play of Haddad. Henrik flies to Austria with Gary to attend the Order of Golden fleece's meeting, thus playing a psychological game with Hermann.",0
10207282,Terrarium,Scott Sanders,1985,"{""/m/06n90"": ""Science Fiction""}","In the late 21st century, humans have been forcibly moved into an enclosed network of domed cities connected by travel tubes known as 'The Human System'. The outside world was left because of extreme pollution, and the cities rely on harvesting the seas. Inside these cities, (called the ""Enclosure"") taboos extend so far as to make uncovered legs and unpainted faces a horrific sin. Due to likely ongoing large scale social engineering there are 12 stages for mating but most women have their reproductive organs removed or are used as breeders starting at the age of 13. Fear of the outside is extreme, another aspect of the social engineering that was incorporated into The Human System. Hence it is called the ""wilder"" and people who enter these lands legally on maintenance work are called wildergoers. Exiting The Human System without permission is illegal and might result in execution. The book focuses on a man named Phoenix and a Wildergoer called Teeg Passio, daughter of a renowned deconstructer of the original Earth cities whose pieces and materials were used to create the Enclosure. The book details how they and a group of others escape out into the wilds and find an outside world they didn't expect.",0
