id,title,author,published_date,categories,summary,page_count
11088412,In Limbo,A.D. Aliwat,1985,"{""/m/06n90"": ""Science Fiction""}","In the first chapter Michael Carpenter awakes in a windowless institution. Although the regime in Limbo is quite liberal, Carpenter is not permitted to leave nor to know its purpose. Carpenter's fellow inmates are introduced: leftist intellectual Wright, corpulent joker Riley, fitness fanatic Treadwell and the nervous Sinnott. The highlights of Carpenter's time are his meetings with the glamorous Dr Dempster. The long second chapter details the inmates' increasing conflicts with their guards but is interspersed with flashbacks to Carpenter's earlier life. After leaving university, Carpenter has drifted from one dead-end job to another, and also moved between various unsatisfactory sexual relationships, with the strident feminist Veronica, the kleptomaniac Karen, married colleague Eleanor and the unstable Penny. The chaper ends with an escape attempt by all the inmates. The book concludes with a short third chapter describing Carpenter's first steps back in the outside world.",544
11094464,Dougy,UNK,UNK,"{""/m/0dwly"": ""Children's literature""}","The story details the events surrounding an aboriginal family living in southwest Queensland, Australia. The story centers around Dougy and his sister Gracey, who has been selected for the State 100m running championships. The story opens with a flashback to a picture in Dougy's past of him and his family sitting by the riverbank in their town drinking. Dougy spends most of this time monologuing about his family and when a flood comes they have to try to escape.",0
11095942,Skulduggery Pleasant,Derek Landy,2007,"{""/m/014dfn"": ""Speculative fiction"", ""/m/01hmnh"": ""Fantasy"", ""/m/0dwly"": ""Children's literature""}","Stephanie Edgley's novelist uncle dies, leaving her his vast mansion and the royalties from his best-selling books. At the reading of the will, a strange man in a tan overcoat, a hat, sunglasses and a scarf is present, who is left a piece of advice, along with Fergus and Beryl, Stephanie's none-too-liked aunt and uncle. Stephanie's aunt and uncle are given something as well: a seemingly useless brooch, a boat, and a car, which they both do not want. Spending a night alone in the mansion, Stephanie is attacked by a strange man, demanding she gives him a ""key"". As the man attacks Stephanie, the mysterious man in the tan overcoat from Gordon's funeral, known as Skulduggery Pleasant, arrives and saves her, throwing a fireball and then shooting the attacker. Skulduggery's disguise of a hat, wig and sunglasses fall off to reveal that he is an undead wizard, made up of only a skeleton held together by magic. He takes Stephanie as his partner and races to save the world from the Scepter of the Ancients, a mysterious staff located only in folklore. However, one of his old rivals has already retrieved it and Skulduggery may be too late to save the world, with or without Stephanie. There are many similarities to H. P. Lovecraft in the story. The Faceless Ones are likely inspired by the Great Old Ones of Lovecraft's Cthulhu Mythos and Lovecraft actually gets a mention by Skulduggery saying that his stories were inspired by myths about the Faceless Ones. Serpine also uses Lovecraft's name as an alias.",0
11096681,The Hundred Year Lie,UNK,UNK,UNK,"The book covers a wide range of topics to do with the issue. It starts by describing the myths that the public believes, that toxicity health issues are 'someone else's problem', and then goes on to talk about what is known to the scientific and chemical communities, and charts the history of the cover-up of chemicals in relation to human health, and the level of business made from this by the chemical companies. The book then goes on in detail about the dangers of food additives, the toxic threats of the processed food humans and animals currently eat, and how this chemical contamination has now affected the water that people drink, and how this has brought on increased biological changes, genetic mutations and newly discovered and increasing illnesses and diseases, in both human and animals. The book ends with a discussion on Western and Eastern medical approaches and philosophies, a focus on alternative medicine and eating healthily, avoiding synthetic foods, and a practical guide on how to detoxify one's body.",0
11097620,The Mystery of the Great Pyramid Volume 2: The Chamber of Horus,UNK,UNK,UNK,"Captain Blake having been assassinated at Athens Airport, Olrik seems to have won the first round. A furious Mortimer swears that he’ll never stop trying to avenge his friend. He goes on the hunt, but information is scarce. Sheik Abdel Razek, an old man with mysterious powers, protects him against Doctor Grossgrabenstein’s crew. The doctor is a devoted Egyptologist who has undertaken excavations not far from the Great Pyramid. Strange happenings occur and Mortimer may sometimes feel like he’s losing his way in this investigation that will lead him into the darkest depths of the Great Pyramid.",0
11097723,Original Sin: Illuminating the Riddle,UNK,UNK,UNK,"Blocher begins by outlining the doctrine of Original Sin in its four parts. Universal sinfulness, the shared culpability of all humanity. Natural sinfulness, the innate or natural tendency to sin in people. Inherited sinfulness, the transmission of the Adam's original sin. Adamic sinfulness the idea that sin had its origin in the Garden of Eden with an act of rebellion by Adam, also known as ""The Fall"". Blocher then analyses the status of ""The Fall"" in the context of Genesis, modern science and a wider theological context. Blocher favours the 'framework' interpretation of the early chapters of Genesis, which means he understands ""The Fall"" as a complex type of 'myth' containg historical elements such as Adam, Eve, the Garden itself and an actual act of original rebellion. The core of the book is centred around Blocher's discussion of Romans 5. In this chapter Blocher compares two common theological views of understanding the ""The Fall"" with some of his own ideas about the topic. Blocher concludes the book with two chapters about the significance of ""The Fall"" for humanity and the solution provided by the atonement of Jesus Christ.",0
11097865,Venture to the Moon,Arthur C. Clarke,1956-05,"{""/m/06n90"": ""Science Fiction""}","*""The Starting Line"" tells of the launch of the first lunar expedition jointly by British, American and Russian rockets which have been assembled in Earth orbit. The plan is for all three ships to leave Earth orbit and land simultaneously, but the narrator has secretly been ordered to depart ahead of the other two ships. *""Robin Hood FRS"" tells of the efforts by the joint expedition members to recover an automatic supply rocket that has landed just out of reach, through the unorthodox method of utilising one team member's archery skills. *""Green Fingers"" describes how a Russian team member - a botanist - secretly engineers plant life that could survive on the Moon's surface, and the accident that causes his death. *""All that Glitters"" deals with a geophysicist who discovers diamonds on the moon - only to learn that back on Earth, synthetic diamonds have just been successfully created at negligible cost. *""Watch this Space"" tells how a scientific experiment conducted on the moon - creating a giant sodium cloud that is made luminescent by the sun's rays and visible from Earth - is sabotaged by ""the greatest advertising coup"" in history. *""A Question of Residence"" tells of how at the end of the mission one of the ships would have to stay behind to clean up their equipment while the others return and get the early glory, and how the British team end up volunteering... in order to take advantage of a legal loophole so they can sell their stories tax-free.",0
11098939,The Golden Rendezvous,Alistair MacLean,1962,"{""/m/01jfsb"": ""Thriller""}","Aboard the cargo vessel converted into a luxury cruise ship SS Campari somewhere in the Caribbean, all is not well. For Johnny Carter, the Chief Officer, the voyage has already begun badly; but it's only when the Campari sails that evening, after a succession of delays attributable to sabotage that he realizes something is seriously wrong. A member of the crew is suddenly missing and the unsuccessful stem-to-stern search only increases tension. Then violence erupts and suddenly the whole ship is endangered by a master criminal whose intention is not a simple hijacking and ransoming of the wealthy hostages on board. Exactly what his goal is forms part of the mystery",324
11099422,An Ice-Cream War,William Boyd,2011,"{""/m/0vgkd"": ""Black comedy"", ""/m/098tmk"": ""War novel""}","The story focuses on the battle fought in East Africa between British and German forces during World War I, and how it affects several individual people whose paths will eventually converge. The first character introduced is Walter Smith, an American expatriate farm owner/mechanic/engineer who runs a successful sisal plantation in British East Africa near Mount Kilimanjaro. Before war breaks out in August 1914, Smith is on cordial terms with his German half-English neighbour, Erich von Bishop. Smith even shops for coffee plant seedlings at the botanical garden in the capital of German East Africa, Dar es Salaam. Major von Bishop burns Smith's sisal and linseed plantation in the opening campaign of the Great War, and then dismantles the massive Decorticator, the industrial centrepiece of Smith's sisal farm operations. Now made a penniless refugee, and unable to secure any war reparations from the colonial British bureaucracy, Smith parks his wife and children with his missionary father-in-law and joins the British military forces in Nairobi, pursuing personal vengeance against von Bishop over the next four years of war in East Africa. The second narrative strand involves Felix Cobb, the studious youngest son of an aristocratic and traditional British military family, everyone of whom he despises apart from his older brother Gabriel, a captain. The latter soon marries his sweetheart Charis (inspiring a certain jealousy in Felix), but World War I breaks out while Gabriel is on his honeymoon in Normandy, and he makes haste back to his regiment. Gabriel is posted to Africa, where he befriends psychotic fellow soldier Bilderbeck and is quickly wounded by German soldiers. Whilst recovering in a POW hospital, he develops an infatuation for Erich von Bishop's plump, stubborn wife Liesl, who works there as a nurse... The novel could be considered a satire on the ineptitude of authority in wartime. A recurring character, English District Officer Wheech-Browning, spreads chaos wherever he goes, such that Smith observes that every time he goes somewhere with Wheech-Browning, someone in their company meets an unfortunate death.",416
11106289,Armadillo,William Boyd,1978,['Armadillos'],"The story concerns Lorimer Black a successful loss adjuster, His original name is Milomre Blocj and he comes from a family of Transnistrian gypsies who arrived in London in 1957 and set up an import-export business to Eastern Europe. They now run a taxi cab firm and are always borrowing money off Milo (as they still call him). Lorimer suffers from insomnia and spends many nights at the ""Institute for Lucid Dreaming"" in search for a cure. He collects antique helmets, listens to African music and is having an affair with Stella Bull, the owner of a scaffolding company. The book includes extracts taken from Lorimers journal The Book of Transfiguration in which he philosophizes on his situation and quotes from Gerard de Nerval. Hogg, his overbearing boss describes his profession thus: ""people turn to insurance to remove uncertainty from areas of their lives. Insurance companies turn to loss adjusters to put uncertainty into insurance, and thus reintroduce uncertainty to insured people"". The narrative itself begins when he turns up at a routine business appointment only to find the man he was to meet has hanged himself. From then on his already complicated life begins to unravel as he falls in love with Flavia Malinervo an unhappily married actress, is assigned to investigate a case of suspected insurance fraud in which a colleague Torquil Helvoir-Jayne is implicated, and suffers the death of his father...",49
11106963,Midnighters 2: Touching Darkness,Scott Westerfeld,2005,"{""/m/06n90"": ""Science Fiction""}","Touching Darkness begins shortly after The Secret Hour ends. It starts with Jessica's meeting Jonathan in the secret hour. As they return home, Jonathan discovers a ""stiff"" - non-midnighter - outside Jessica's house, taking multiple exposures of her window across midnight. Meanwhile, Dess has been having strange dreams, which have led to some theories about co-ordinates affecting the secret hour. She discovers a GPS co-ordinate finder in her father's map drawer, and begins to use it to map the secret hour. Investigating Jessica's stalker, Melissa overhears someone thinking about Jessica. She and Rex visit his house in the secret hour and discover people there are using dominoes with lore symbols on them to communicate with the darklings at midnight, with the help of a 'halfling' -Anathea- a girl who has been merged with a darkling. Melissa discovers that the halfling is sick, and that the darklings will soon try to take Rex, another Seer, to replace her. They steal some of the dominoes so that the darklings will not be able to communicate about the Midnighters to their human allies. They also find that the house belongs to Ernesto Grayfoot - a cousin of Jessica's friend Constanza Grayfoot, who says that even though her grandfather used to live there, he left nearly fifty years ago - around the time the Midnighters seem to have disappeared from Bixby - and now the rest of her family avoid the town at all costs - her father was even cut off for moving there. Meanwhile, Dess discovers a house in which another Midnighter - Madeline - has lived hidden for nearly fifty years. Madeline explains that fifty years ago, when the town's population boomed suddenly, someone let out the secret of the Midnighters to an outsider - Constanza's grandfather - who learned how to communicate with the darklings, and got rich doing their bidding. The darklings used him to kill off the Midnighters, leaving only the new, younger generation, who were seen as harmless with no one older to teach them. They also made the halfling using a young girl called Anathea, to communicate with the darklings better. She also explains that her house is in a contortion in the secret hour which hides her, and that Dess must keep the knowledge of it hidden from the others so that the darklings do not find it. After ransacking Constanza's house, the Midnighters learn that the darklings are trying to prevent a new runway being built outside Bixby. From Madeline, Dess learns that she needs to get Jessica's help in scouring the site of the runway with light: it is the only place halflings can be made, and light will destroy it. However, before she manages it, Rex is kidnapped. Dess draws a map to where they will find him, then suppresses the memories using a trick Madeline taught her so that Melissa will not learn about Madeline from her mind. However, Melissa suspects Dess is hiding something, and touches her, giving herself full access to Dess's memories. She learns about Madeline, and Dess begins to resent her for the intrusion on her privacy. When the secret hour begins, Jonathan, Melissa, Jessica and Dess are only a mile from the spot Rex has been taken, but Melissa is injured when she continues through the windshield when the car stops abruptly at the start of the secret hour. Jessica and Jonathan go ahead and find Anathea, freed from the darkling, who tells them that Rex is already a halfling. Luckily, they catch up with him, and Jessica uses her torch to burn away the darkling flesh, making him (mostly) human again. They return to Anathea, who dies from the darkness after Jonathan grants her last wish to fly again. They leave her in front of the Grayfoots, along with a message spelled out in English: 'You're next'. Finally, Madeline introduces herself to all of the Midnighters - as soon as Melissa knew about her, the darklings could read it from her mind. She begins to teach Melissa how to mindcast properly. Meanwhile, Rex is struggling to come to terms with his enhanced abilities; his time as a halfling has left him with the darkling's ability to sense human thoughts and emotions, as well as a desire to hunt.",0
11108448,The Troika,Stepan Chapman,1997,"{""/m/06n90"": ""Science Fiction"", ""/m/014dfn"": ""Speculative fiction"", ""/m/05hgj"": ""Novel""}","The novel introduces three beings - a jeep, a dinosaur, and an old Mexican woman - travelling across a desert under the glare of three suns. They have been travelling for centuries though they do not know why they are crossing the desert or if they will ever reach the other side. The characters have each changed bodies several times. Their travels are interspersed with dream-sequence-like flashbacks describing various transformed versions of the 20th Century.",0
11108504,The Survivors of the 'Jonathan',Jules Verne,UNK,UNK,"The novel tells the story of a mysterious man named Kaw-djer. Kaw-djer lives in the land of Magellania, that is, the region around the Straits of Magellan. Kaw-djer, whose motto is ""Neither God nor master"", helps himself survive and also provides assistance to the indigenous peoples of Magellania. However, when a group of settlers is shipwrecked on a nearby island (Hoste Island), Kaw-djer assists them establish their colony, though he refuses to rule over them or control them in any way. However, when the colony falls victim to fight for power, Kaw-djer is forced to temporarily abandon his own anarchistic principles. After he restores order, he abdicates and becomes a lighthouse-keeper, thereby retaining his individualism.",0
