id,title,author,published_date,categories,summary,page_count
8561156,The Night Walker,John Fletcher,UNK,UNK,"The plot of the play focuses on an arranged marriage. The heroine, Maria, is in love with a suitable potential mate, Frank Heartlove; but her mother (known only as the Lady) coerces Maria into a marriage with a rich old miser, Justice Algrip. Maria's Nurse describes him as ""this old stinking dog's flesh,"" among other choice epithets. At the marriage feast, Maria's cousin, the prankster Jack Wildbrain, urges the heartbroken and rejected Heartlove to attempt to cuckold the Justice on his wedding night, and arranges Heartlove's opportunity to be with Maria alone. But Maria, a virtuous young woman, resists Heartlove's advances, even drawing a dagger and threatening to harm herself if he persists. Unfortunately, they are caught together by the Justice and other members of the wedding party; Maria, her reputation ruined, falls into a swoon, and is perceived to be dead. Meanwhile, Wildbrain's friend Tom Lurcher, a down-and-out gentleman turned thief, is recruiting a new apprentice in thievery, a boy who calls himself Snap (he is the ""little thief""). Lurcher's modus operandi involves disguise and trickery: it's easier to burgle a house when the inhabitants are terrified of devils. Lurcher and the boy break into the Lady's house, to make off with the chest that holds the wedding gifts; instead they steal the coffin containing Maria's body. When they discover their error, they take the coffin out to bury it; but they encounter Justice Algrip, on his way home from the Lady's house. The boy pretends to be Maria's ghost to frighten him off. In so doing, the boy mentions a woman the Justice abandoned in order to marry Maria &mdash; a broad hint that Snap is more than he appears to be. No sooner is he gone, though, that Maria wakes from her swoon, and the thieves flee the scene. The Lady drives Jack Wildbrain from her doors, blaming him for the wedding disaster and even for the disappearance of the coffin. Wandering in the night, Wildbrain meets a dejected Heartlove, who now blames Wildbrain for getting him drunk and manipulating him into his disgraceful conduct earlier. Heartlove challenges Wildbrain to a duel. As they fight, a disoriented Maria stumbles upon them; she pretends to be her own ghost to frighten and shock them out of the duel. Afterward her Nurse takes her in, under the disguise of a Welsh cousin; the Lady soon penetrates the guise, but agrees to maintain it till Maria's reputation can be restored. Lurcher and the boy, under various disguises, fool and rob the Justice, and then waylay and drug him; when the Justice wakes, he is confronted with ""furies"" and ""hellhounds"" ready to drag him to Hell for his sins. His soul is saved, however, when an angel (the boy in costume) intervenes; Justice Algrip repents his past misdeeds and promises to make amends. The Justice keeps his word: he returns Maria's dowry and admits that his precontract with another woman makes his marriage to Maria null and void. He also yields up the mortgage he holds on Lurcher's property, thus restoring Lurcher's fortunes. Maria is revealed and restored to Heartlove; and the boy thief turns out to be Lurcher's sister, and the woman to whom the Justice was previously committed. She has manipulated Lurcher to keep his bad deeds under control; it was her doing that they stole the coffin instead of the wedding treasure. And she accepts the Justice as her intended husband once again...""old dry ham of horse flesh"" though he may be. Even Wildbrain is restored to the Lady's good graces.",0
8561256,The Black Swan: The Impact of the Highly Improbable,Nassim Nicholas Taleb,2007-04-17,"{""/m/05h83"": ""Non-fiction""}","Nassim Nicholas Taleb refers to the book variously as an essay or a narrative with one single idea: ""our blindness with respect to randomness, particularly large deviations."" It is Taleb's questioning of why this occurs and his explanations of it that drive the book forward. The book's layout follows ""a simple logic"" moving from literary subjects in the beginning to scientific and mathematical subjects in the later portions. Part One and the beginning of Part Two delve into Psychology. Taleb addresses science and business in the latter half of Part Two and Part Three. Part Four contains advice on how to approach the world in the face of uncertainty and still enjoy life. Taleb acknowledges a contradiction in the book. He uses an exact metaphor, Black Swan Idea to argue against the ""unknown, the abstract, and imprecise uncertain—white ravens, pink elephants, or evaporating denizens of a remote planet orbiting Tau Ceti."" In the first chapter, the black swan theory first is discussed in relation to Taleb's coming of age in the Levant. The author then elucidates his approach to historical analysis. He describes history as opaque, essentially a black box of cause and effect. One sees events go in and events go out, but one has no way of determining which produced what effect. Taleb argues this is due to The Triplet of Opacity. In the second chapter, Taleb tells a fictional story of a character named Yevgenia Nikolayevna Krasnova and her book A Story of Recursion. She published her book on the web and was discovered by a small publishing company; they published her unedited work and the book became an international bestseller. The small publishing firm became a big corporation, and Yevgenia became famous. This incident is described as a Black Swan Event. Taleb seems to be using ""recursion"" as a hint that he is predicting the story of his own book The Black Swan—Yevgenia's rejection of fiction and nonfiction as categories is reminiscent of Taleb's idea, and her character seems autobiographical as Taleb may be poking fun at his own intolerant temperament. In the third chapter, Taleb introduces the concepts of Extremistan and Mediocristan. He uses them as guides to define how predictable is the environment one's studying. Mediocristan environments safely can use Gaussian distribution. In Extremistan environments, a Gaussian distribution is used at one's peril. Chapter four brings together the topics discussed earlier in the narrative, about a turkey. Taleb uses it to illustrate the philosophical problem of induction and how past performance is no indicator of future performance. He then takes the reader into the history of Skepticism. In Chapter nine, Taleb outlines the multiple topics he previously has described and connects them as a single basic idea.",0
8563808,Le Rêve,Émile Zola,1888,"{""/m/05hgj"": ""Novel""}","Le rêve is a simple tale of the orphan Angélique Marie (b. 1851), adopted by a couple of embroiderers, the Huberts, whose marriage is blighted by a childlessness which they attribute to a curse uttered by Mme Hubert's mother on her deathbed. Angélique is enthralled by the tales of the saints and martyrs — particularly Saint Agnes and Saint George — as told in the Golden Legend of Jacobus de Voragine. Her dream is to be saved by a handsome prince and to live happily ever after, in the same way the virgin martyrs have their faiths tested on earth before being rescued and married to Jesus in heaven. Her dream is realized when she falls in love with Félicien d'Hautecœur, the last in an old family of knights, heroes, and nobles in the service of Christ and of France. His father, the present Monseigneur, objects to their marrying for reasons of his own. (Before entering the Church he had married for love a woman much younger than himself; when she died giving birth to Félicien, he sent the child away and took holy orders.) Angélique falls ill and pines away. Won over by her virtue and innocence, the Monseigneur finally relents and the lovers are married; but Angélique dies on the steps of the cathedral as she kisses her husband for the first time. Her death, however, is a happy one: her innocence has freed the Huberts and the Monseigneur from their curses.",0
8564876,Beyond the Wall of Sleep,H. P. Lovecraft,UNK,UNK,"An intern in a mental hospital relates his experience with Joe Slater, an inmate who died at the facility a few weeks after being confined as a criminally insane murderer. He describes Slater as a ""typical denizen of the Catskill Mountain region, who corresponds exactly with the 'white trash' of the South"", for whom ""laws and morals are nonexistent"" and whose ""general mental status is probably below that of any other native American people"". Although Slater's crime was exceedingly brutal and unprovoked he had an ""absurd appearance of harmless stupidity"" and the doctors guessed his age at about forty. During the third night of his confinement, Slater had the first of his ""attacks"". He burst from an uneasy sleep into a frenzy so violent it took four orderlies to strait-jacket him. For nearly fifteen minutes he gave vent to an incredible rant. The words were in the voice and couched in the paltry vocabulary of Joe Slater but the onlookers could construe from the inadequate language a vision of: :green edifices of light, oceans of space, strange music, and shadowy mountains and valleys. But most of all did he dwell upon some mysterious blazing entity that shook and laughed and mocked at him. This vast, vague personality seemed to have done him a terrible wrong and to kill it in triumphant revenge was his paramount desire. In order to reach it...he would soar through abysses of emptiness 'burning' every obstacle that stood in his way. The ranting stopped as suddenly as it had started. This was the first of what would become nightly ""attacks"" of a similar nature. The peripheral otherworldly images of Slater's visions were different and more fantastic with each successive night, but always there was the central theme of the blazing entity and its revenge. The doctors were perplexed with the Slater case. Where did a backward man like Slater get such visions, when surely an illiterate rustic like him would have had little if any exposure to fairy tales or fantasy stories? Not that there were stories similar to Slater's. Why, too, was Slater dying? As an undergraduate, the intern had built but never tested a device for two-way telepathic communication. The device was designed around his principle that thought was ultimately a form of radiant energy. Heedless of any ethics, he attached himself with Slater to the device as Slater lay near death. With the device switched on, he received a message from a being of light whose experiences had been what were transmitted through the medium of Joe Slater. This being explained that, when not shackled to their physical bodies, all men are light beings. The thought-message went on to explain that, as light beings within the realm of sleep, humans can experience the vistas of many planes and universes which remain unknown to waking awareness. The intern understood that the light being would now become completely incorporeal, and undertake at last a final battle with its nemesis near Algol. Joe Slater died then, and there were no further transmissions. That night an enormously bright star was discovered in the sky near Algol. Within a week it had dimmed to the luminosity of an ordinary star and in a few months it had vanished completely.",0
8565283,Couples,John Updike,UNK,UNK,"The novel focuses on a promiscuous circle of ten couples in the small Massachusetts town of Tarbox. (The author was living in Ipswich, Massachusetts when he composed the book.)",0
8566524,Shadow Moon,Chris Claremont,UNK,"{""/m/01hmnh"": ""Fantasy""}","Willow Ufgood is worrying over planting his crops for the harvest, once again in the life of a farmer. He falls asleep, distraught over not being able to attend a party for Elora Danan, of whom he served as protector about a year ago. He dreams that night of riding on the back of a great dragon, who drops him off at Tir Asleen. After bantering with Madmartigan and Sorsha, during which Sorsha bestows upon him a new name, ""Thorn Drumheller,"" he continues on to see Elora and give her a gift that he has created: a teddy bear with crystal eyes that Willow says will protect her when he is not there to do so. Leaving the sleeping child with her gift, he converses with the two brownies, Rool and Franjean, and leaves. He wakes up the next morning to find two Brownies sitting at the end of his bed and that a horrific cataclysm has wiped out 12 areas in the world, including Tir Asleen.",0
8568251,A Luneta Mágica,UNK,UNK,UNK,"The book tells the story of Simplício, a naïve and near-sighted man who lives alongside his brother Américo, an ascending politician, his cousin Anica and extremely religious aunt Domingas, and wishes to be able of seeing again one day. A friend of his, old man Nunes, takes him to Reis, an optometrist who is able to make very powerful lenses; however, none of them are able to make Simplício see again. Reis then suggests Simplício to go see a friend of his, an unnamed Armenian wizard who makes magical lenses. Simplício is finally able to see again, but the Armenian tells him that if he looks to someone or something for more than three minutes, he would see the evil enclosed on them. However, Simplício does not pay attention to the Armenian's warning, and starts seeing the evil parts of all things, and considered to be crazy, becomes a recluse. Simplício accidentally destroys the ""evil"" lenses one day, and returns to see the Armenian — this time he gives to Simplício new lenses that makes him see the good parts of all things. Being seduced and ludibriated, after many mishaps Simplício finally obtains the ""sanity"" lenses, and is able to live happily again. gv:A Luneta Mágica pt:A Luneta Mágica",0
8568732,Blart II: The Boy Who was Wanted Dead or Alive - Or Both,Dominic Barker,2007,"{""/m/0dwly"": ""Children's literature"", ""/m/01hmnh"": ""Fantasy""}","Blart, after the imprisonment of Zoltab, is living the good life on his own pig farm. But a wily merchant named Uther has conned him out of everything he owns and his freedom by a game of cards called ""Muggins"". To play Muggins, the dealer simply picks two cards from the deck, hands one to the non-dealer and keeps one himself. Each player turns over their cards. If the cards were the same, say, a king and a king, then the dealer wins. If the cards are different, say, a three and a five, then the non-dealer wins. Even Blart has grasped it that the chances of the non-dealer winning is drastically in his favour and resolves to play the game with Uther to make money. However, no sooner than Blart bets stakes in the game of Muggins than Uther begins to win every round. But then quite out of the blue, Capablanca arrives to tell him that Blart and the other questors are wanted, dead or alive - or both. They are wanted because it is believed that they are minions of Zoltab, even though it was them that imprisoned him. So Blart, Capablanca and Uther (who must help them as he is wanted for associating with Blart) must find and warn the other questors. After gathering the original company (with the exception of the deceased dwarf Tungsten) they must travel to where Capablanca has imprisoned Zoltab, so as to prove their innocence. However, Capablanca has difficulty remembering where he has imprisoned the last lord. As soon ddakjfdioasdjfoasdfjs it:Blart 2",0
8570900,A sucessora,UNK,UNK,UNK,"A Sucessora follows the character of Mariana, a young woman that has married the widower Roberto Steen. As Mariana attempts to acclimate to her new marriage and responsibilities, she discovers that his dead wife Alice still seems to have a hold over the household.",0
8570979,From an Abandoned Work,Samuel Beckett,1957,UNK,"The first person narrative revolves around three days in the early life of a neurotic old man. “None of the days is described clearly or coherently and few details are given for the second and third days.” It is unlikely that the days are actually chronologically contiguous although the general framework does tend to be, digressions aside. The story begins with the old man remembering back to when he was young, probably a young man rather than a child per se (based on the assumption that the man is modelled on Beckett himself who only came to appreciate Milton in his early twenties whilst at Trinity College). He begins arbitrarily; at least he maintains, “any other [day] would have done”. Despite feeling unwell he rises early and leaves the house but not so early that his mother isn’t able to catch his eye from her window. He appears unclear in his own head if she is even waving at him – he’s already at a fair distance when he notices her – and puts forth the notion, calculated to reduce any significance that could be attributed to her actions, that she may simply have been exercising, her latest fad, and not really trying to communicate anything at all. The young man is prone to sudden rages. As he is walking away he feels “really awful, very violent [and starts to] look out for a snail, slug or worm” to squash. Despite his propensity towards violence – or perhaps to find excuse for it – he makes a point of never avoiding things that might exacerbate it whether these be small birds or animals or simply difficult terrain. He becomes aware of a white horse at such a distance that despite the excellent sight he boasts of he cannot tell if a man, woman or child is following it. White is a colour that has a strong effect on him and he flies into a rage simply at the thought of it (See Classical conditioning). In the past he had tried “beating his head against something” but has discovered that short bursts of energy, “running five or ten yards”, works best. After this he walks on for a bit and then heads home. On the second day, despite having had another bad night, he leaves the house in the morning and doesn’t return until nightfall. He describes being “set on and pursued by … stoats” which – perhaps significantly – he refers to as “a family or tribe” rather than using the more common collective noun, pack. This is noteworthy because he specifically mentions he has a good head for facts having “picked up a lot of hard knowledge”. He survives the attack but regrets that he did not let them finish him off. The events of the third day are distilled into the look he gets from an old road worker named Balfe of whom he had been terrified of as a child. Once he has finished with these recollections we learn a little about where he is now. It appears he is still going for his daily perambulations, “out, on, round, back, in” as he puts it. And he is still in poor health. His throat, which has bothered him for as long as he can remember, still troubles him and he has developed earache. He regards himself now as a “mild” person and yet for some reason the violence of old erupts and he begins lashing about with his stick and cursing. His final thoughts are of vanishing from view in the tall ferns. The man’s constant sore throat may well be a psychosomatic condition; he suffers from fidgeting and cites one instance where he collapses in some kind of fit. He is clearly a disturbed individual with a great deal of pent up hostility particularly toward his parents. He refers to himself as “mad” but then acknowledges that he is probably merely “a little strange”. His behaviour is obsessive, he has a propensity towards self-harm (“beating [his] head against [things])” – Waiting for Godot). His relationship with his parents is not good; he says he would rather go to hell than join them in paradise in fact. He is glad that his father died early in his life so that he wouldn’t have to be disappointed with the directionlessness of his son’s life (“I have never in my life been on my way anywhere”). The mother’s own somewhat eccentric behaviour meant that the two of them never became close; neither had spoken to the other in years following a dispute over money (perhaps his inheritance). The man talks of love but a love of the local flora (he is not far travelled) and imaginary fauna (creatures he has dreamt of), certainly not people. He wonders if he killed his parents and suspects that in a way, probably due to years of having to cope with his aberrant behaviour, he at least brought them a little closer to death. He has never married and so the family line – assuming he has no brother – will end with him, effectively killing off the family name.",0
8575021,Dawn Undercover,Anna Dale,2005,"{""/m/0dwly"": ""Children's literature"", ""/m/05hgj"": ""Novel""}","Rustygate Primary School does not teach espionage and sleuthing, so when Dawn Buckle is asked by S.H.H. (Strictly Hush Hush) to become a highly trained spy with P.S.S.T (Pursuit of Scheming Spies and Traitors) she feels rather at a disadvantage. But showing an incredible ability and very quick thinking she soon finds herself caught up in an incredible adventure to unearth the wicked 'spy-gone-bad' Murdo Meek. Can Dawn piece together all the parts of the incredible riddle before Murdo does away with his hostage? Can she outwit this master criminal while at the same time keeping herself safe?",0
8575069,A Golden Age,Tahmima Anam,2007-03,"{""/m/098tmk"": ""War novel"", ""/m/0hwxm"": ""Historical novel""}","The plot of the novel describes the true story of the writer's grandmother during the Bangladesh Liberation War. During the war her grandma helped the Freedom Fighters by protecting their ammunitions. Once when the army came to her house and threatened that they would take the youngest son of the family if she did not give them the information about the fighters, she somehow successfully tackled them. The person who portrays the character is named Rehana Haque. The story also covers the inner conflict of Rehana as she loses the custody of her children after her husband's death. Along with her desperate attempt to win the minds of her children, she tries to protect them as they get involved in the war.",0
8575602,Hunted,James Alan Gardner,2000,"{""/m/06n90"": ""Science Fiction"", ""/m/014dfn"": ""Speculative fiction""}","At the opening of the story, Explorer Edward York (son of one of the High Council's most ruthless Admirals) is freshly arrived on board an Outward Fleet spaceship, the Willow, which is leaving the Troyen solar system where he has been stationed for the past twenty years. The atmosphere aboard ship is febrile; the shy and retiring York is roped into attending a party, a masquerade-cum-orgy, by a woman in an Admiral's uniform with a large port-wine birthmark on her cheek. (Readers of the previous novels will recognize the recurring character of Festina Ramos.) The reason for the crew's semi-hysterical state quickly becomes clear: the crew has violated the League's single basic rule, and suddenly everyone aboard ship, except for York, drops dead, cryptically executed by the high authorities of the League of Peoples. Alone aboard the ship, York, who by his own testimony suffers from at least mild mental retardation (he's not a genuine Explorer, but merely an Admiral's black-sheep son who's been shunted into the Corps), begins to unravel an increasing complex plot. In the ship's hold, he discovers, dead like everyone else, a queen of the Mandasar species that has spent the past two decades consumed in a violent civil war. The Mandasars are the key alien species and society in the novel: they resemble giant lobsters, with eight legs, pairs of claws and arms, with whiskered faces and brain humps on their backs. Their species comes in four castes or orders, varying in size and color, from small brown females called ""gentles,"" through workers and warriors, up to the hive-queens, who are four meters long, saffron yellow, with four claws instead of two and bright green venom sacs. Their social order is something of a cross between an ant farm or beehive, and feudal Japan. What is a dead hive queen doing on a ship of the Outward Fleet? And what did the crew do to earn themselves an infallibly just death sentence from the League of Peoples? As York tries to plumb deep waters of conspiracy and corruption, he meets the real Admiral Festina Ramos, and realizes that the woman aboard the Willow was costumed as the Admiral for the masquerade party. He also falls in with genuine Explorers, and ends up on a desperate expedition back to Troyen, the Mandasars' home world, in an attempt to unravel an Admiral's corrupt scheme and stop a civil war. In the process, York learns the real meaning of his status as his father's genetically-engineered clone; he learns too that his beloved twin-sister-clone, whom he saw dead twenty years before, is still alive, but not the person he thought he knew; and he discovers the nature of the double within himself that sometimes takes over his mind and body. The story expands to include a formidable nanotechnology, a sentient and telepathic moss that can overwhelm a human being, and members of a mysterious species who are never seen outside their personal robot craft. The ending manages to tie up all the loose ends, as well as provide anticipations of further stories to come.",0
8581105,The Flesh Mask,Jack Vance,UNK,UNK,"Taunted by four of the school's prettiest girls at a high school party, a star athlete with a severely disfigured face lashes out at one of them in his drunken frustration. Sent to reform school for assault, the boy undergoes extensive facial reconstructive surgery at state expense. Years later, the girls are in college when one of them is murdered, her face mutilated, and the others receive threats. The young man's whereabouts are unknown and it is learned there is no photographic record of his new face. Then, several years later a bizarre mutilated dog lands in a suburban garden. The animal, still alive has had its legs surgically removed, and the stubs 'smoothed' down.",0
