id,title,author,published_date,categories,summary,page_count
27910639,According to Mark,Penelope Lively,1984,UNK,"Mark Lamming, a biographer, leads a quiet life in London with his wife Diana, who works at a gallery. In order to gain information about the dead writer and essayist Gilbert Strong who he is going to write a book about, Mark visits Strong's granddaughter, Carry. She runs a garden centre at Dean Close, a mansion Strong used to live in. Mark regularly stays at Dean Close for several days, and in the course of this falls in love with Carry. After some time he comes up with the idea to visit Hermione, Carry's mother who lives in France, so as to ask her some questions about the relationship between her and her father, Gilbert Strong. He asks Carry to join him – partly because he needs her to speak to her mother and partly because he wants to spend time with her. Hesitantly Carry agrees, and together they leave for France – Diana, Marks wife, plans to join them later. The trip to France turns into a fiasco. During their journey, Mark and Carry have sex at several hotels. When they arrive at Hermione's place, Carry becomes extremely reclusive because of the way Hermione, her mother, is treating her. Diana, who in the meantime has arrived there too, is shocked by the state the house is in, and Mark finds that, after all, Hermione is not the right person to get information from for his book. They leave Hermione's place and plan to visit several French cities and villages. As Carry feels extremely uncomfortable while travelling with Mark and Diana, she simply leaves them without saying a word while they are in a supermarket. She travels to Paris where she gets to know Nick, an Englishman. Back to England Carry tells Mark the she has fallen in love with Nick. Mark and Carry sort out their problems and Mark leaves for Porlock, a village in the north of England where he hopes to find out more about Gilbert Strong's life. He moves in with a Major whose aunt Irene was associated with Strong years ago. To Mark's delight, the Major produces a bunch of letters that Strong wrote to Irene. These letters solve the mystery of Strong's life that Mark has been intent to find out about ever since he started working on the biography: Strong had been deeply in love with Irene, who died a short time after their first encounter. Strong had never really got over this heavy loss. These findings enable Mark to understand what made Strong tick and why he had never in his further life been able to develop any happy long-term relationship with women. Having found out about this, Mark feels that he has all the information he needs to finish his book about Strong. He leaves Porlock and heads for London where he visits Carry for what seems to be the last time. In the last chapter of the book, Mark is at a broadcast station where a radio transmission about Gilbert Strong is being produced.",0
27910683,Passing On,UNK,UNK,UNK,"The book starts with a funeral. The atmosphere is not, as one would assume, oppressive, but rather buoyant. When the coffin is carried to the graveyard, Helen remarks that her mother is still, even after her death, making her presence felt. As her mother had had a row with the priest when choosing the grave years ago, he keeps casting Helen and her brother distrustful looks throughout the funeral. From the very beginning of the book it is clear that Dorothy Glovers must have been a nasty woman. A woman who did not treat her children with love and affection, but ruled them and deprived them of life’s pleasures. Only Louise, her youngest daughter, had had the strength to escape from her dominant influence. When the ceremony of burying is held at the grave and the priest is giving his sermon, Helen thinks: „Eternal life is an appalling idea, especially in mother’s case.“ Slowly but steadily, Helen and Edward get used to their mother’s absence and they start to slightly change their lives. Helen feels much freer than before her mother's death and falls in love with Giles Carnaby, their lawyer. She becomes more confident and starts to perceive life differently. Nevertheless, Dorothy, Helen's and Edward's mother still, even after her death, makes her presence felt. At one point, Helen finds love-letters that a former boyfriend of hers had written to her in one of her mother's old cloaks. Her mother had never given these letters to her and therefore had caused the separation of Helen and her boyfriend. Helen is upset, but has to come to terms with it – she cannot confront her mother anymore. Edwards is a biology teacher. His mother’s does not change much about his life - he remains as reclusive as he had been before his mother's death. He spends most of his leisure time in the wood that is part of the estate he and Helen live at. There he tends plants and watches birds. In the course of the book he turns out to be homosexual. Helen helps Howard through what seems to be a life crisis. By doing so she feels strong. Helen and Edward live modestly. They only buy what they absolutely need; their lifestyle is rather old-fashioned. This is in complete contrast to the life their sister Luise and her husband Tom lead, who every once in a while drop in at Helen and Howard's place. Luise and Tom live an urban life in London, their problems are those typical of people that live in big cities: lack of time and psycho-somatic illnesses. Helen and Howard, by contrast, lead a calm, monotonous and rather rural life. Throughout the book it seems as though Helen and Giles Carnaby, the lawyer, will end up in a happy relationship. This does not happen, as in one of the last chapters Gilbert tells Helen that he does not want to see her anymore.",0
27918488,Lords of France: The Bankers Who Broke the World,Liaquat Ahamed,2009,"{""/m/05h83"": ""Non-fiction""}","The book discusses the personal histories of the four heads of the Central Banks of the United States, Great Britain, France, and Germany and their efforts to steer the world economy from the period during the First World War until the Great Depression. The book also discusses at length the career of the British economist John Maynard Keynes who criticized many of the policies of the heads of the Central Banks during this time.",0
27922600,After America,John Birmingham,UNK,"{""/m/0mz2"": ""Alternate history"", ""/m/017rf8"": ""Techno-thriller""}","Four years after an energy event damages America for a year the populace still does not understand what is going on. The President is almost slain; seemingly by organized looter gangs. Soon, a new threat arises out of the Middle East. After America is the first sequel to Without Warning.",0
27925395,Witz,Joshua Cohen,2010-05,"{""/m/05hgj"": ""Novel""}","In Witz, Joshua Cohen calls all religious Jews ""Affiliated"". After the sabbath meal a week before Christmas, Benjamin is born to Israel and Hanna Israelien in Joysey, the first son after 12 girls. This winter is particularly hard and in fact persists year round. Benjamin is born full grown (by a method explored by Flann O'Brien in At Swim-Two-Birds), with a beard and glasses. His foreskin continually sheds itself and grows back. Already too big for his father's shirts, he takes to his mother's maternity robes. On Christmas Eve, all of the Affiliated die except first-born sons. The Israelien's maid, Wanda, drives Benjamin down to Florida to live with his grandfather, Isaac, who is Unaffiliated. Meanwhile, a cabal of government operatives are quarantining all of the first-borns on Ellis Island, now called ""The Garden"" (incorporated), capitalized with the property of the dead. A week later, they come for Benjamin. Isaac dies from a heart attack. Benjamin escapes at a rest stop but is eventually caught and taken to The Garden, where they have moved the entire Israelien house, complete with Sabbath guest still on one of the toilets. The Garden markets Benjamin as the messiah, complete with travelling road show and merchandising. A team of unaffiliated women are trained to act as his mother and sisters and see to his needs. Then the first-borns start dying, and by Passover Benjamin is the only one remaining. It is arranged that he marry the President's daughter in Las Vegas, but Benjamin escapes again, to wander the country in his mother's robe. Back in New York, his ""sisters"" catch up with him, and during cunnilingus with ""Hanna"", his tongue gets stuck and is torn off when the sisters try to separate them. The scandal destroys The Garden, and Benjamin is shunned by all (he and the operators of The Garden are Disaffiliated). Without real Jews around to complicate things, America, and soon, the world, has become Affiliated. The President becomes chief of the Sanhedrin in Jerusalem. Those who refuse to Affiliate are sent to their ""homeland"", Polandland, where they are kept in ghettos, experimented upon, worked and starved to death, killed. Benjamin finds his way there, too, visiting the towns of his mother's and his father's ancestors. In his wanderings, he sprouts the horns of a cow and ultimately he turns into a woman. The Affiliated, however, revive the cult of his tongue, now displayed as a relic. And Wanda, now Affiliated, with a son of her own, remembers the visitor who came down the chimney to sit with Benjamin every night for the week after his birth: Isaiah? dressed as Santa Claus. 25 years later, we hear from a 108-year-old Jewish man who was in Auschwitz ... He has listed the punch line of a joke, who needs the setup any more, for every year that he has lived. Because what should you do only laugh.",0
27929731,First Light,Rebecca Stead,2007,"{""/m/02n4kr"": ""Mystery"", ""/m/06n90"": ""Science Fiction"", ""/m/0dwly"": ""Children's literature"", ""/m/03mfnf"": ""Young adult literature""}","First Light follows the adventure of two protagonists, Peter, who lives with his mother and father in New York but is in Greenland for his father's research, and Thea, who lives in an underground colony in Greenland called Gracehope. Gracehope was formed hundreds of years ago by a group called the Settlers who used to live in England. They possessed unusual abilities, such as extremely good vision and hearing, leading them to be called 'eye adepts' and 'ear adepts', respectively. These powers were seen as sorcery, prompting Grace, the leader of the Settlers, to bring the Settlers under the ice in Greenland where they could live in peace. While walking around her house, Thea finds a map in her room of Gracehope. The map shows a tunnel leading onto the surface. Thea and her cousin Mattias find the tunnel and meet Peter who helps them back to Gracehope. Reaching Gracehope, Peter realizes that several talismans of the people are in the shape of mitochondrial DNA, which his mom is studying. After waking up from a headache, Peter finds his mom next to his bed. She explains that she used to live in Gracehope, but was banished with her sister, after her sister ventured above the surface and contracted an illness that could not be cured. She also explains that her research of mitochondrial DNA relates to the ability of mutations to benefit the human body, which could cause their extremely good vision and hearing. In the end, she warns Peter that global warming is causing Gracehope to slowly melt away. The entire colony must learn the dangers they face and escape. One obstacle lies in their way: Rowen, Thea and Peter's grandmother who banished Peter's mom and did nothing to help Thea's mom when she was on her deathbed from an illness when she ventured aboveground. Rowen is the head of the Council in Gracehope and is strictly against going aboveground. To convince the rest of the colony, Peter and Thea plan to use a piece of mythology, that a dog with four white paws would be born when it was time to leave. Such a dog had been born several days ago but has yet to open his eyes. Thea decides to proceed without using the dog and tries to convince the colony at a reenactment of the Settler's escape to Greenland with several allies who know of Rowen's actions. Just as Thea and her allies are about to lose the argument, Peter arrives with the dog, whose eyes are open. That, coupled with the fact that Peter is an eye adept, the first in a hundred years, convinces the colony to listen to Thea instead of Rowen. The novel ends eight months later as the people of Gracehope are slowly educated on global warming and the dangers of staying in their colony.",0
27931190,The Bent Sword,UNK,UNK,UNK,"In Medieval England, a daydreaming peasant named Steffin wants to pursue his imaginary quest, but he feels trapped by society. When an eccentric storyteller insists that Steffin's quest is real, Steffin is forced to take his destiny into his own hands and seek out his arch nemesis, the dark Lord of Boredom. Through a reckless chain of Don-Quixote-like adventures, colorful friends catch Steffin's dream, and the powers that oppose them begin to unveil themselves. But when reality kicks in and his friends have had enough, will Steffin be able to pull them back together and complete their quest, or will Lord Bore succeed in quelling the greatest of all adventures?",0
27932573,Snuff,Bronja Hoffschlag,1719,"{""/m/01hmnh"": ""Fantasy""}","Commander Sam Vimes is forced by his wife, Lady Sybil, to take a vacation with their son, Young Sam, at her family's mansion Crundells. After a short time of enjoying his vacation, he discovers that the rural community has a dark past with the resident goblins, humanoid lifeforms that live in caves nearby. Vimes finds out that the son of Lord Rust has been enslaving goblins to force them to work on his tobacco plantations in Howondaland, allowing him to manufacture cigars cheaply that are then smuggled to Ankh-Morpork. After teaming up with the local constable, a young man called Upshot, Vimes manages to arrest those responsible for the crime. In the end, thanks to his wife's organizational skills and powers of persuasion, goblins are recognized as citizens by all major nations and rulers. While Rust's son flees abroad, Vetinari considers having him removed.",125
27933317,The Burning Wire,Jeffery Deaver,2010-06,"{""/m/01jfsb"": ""Thriller"", ""/m/0lsxr"": ""Crime Fiction"", ""/m/02xlf"": ""Fiction""}","The sabotage of a substation of the prominent electrical energy distributor Algonquin Consolidated Power and Light Company in Queens, New York, causing a deadly arc flash leads to an investigation managed by esteemed criminalist Lincoln Rhyme and his team of investigators. The initial primary suspect, Ray Galt, a disillusioned troubleman who is an employee of Algonquin Consolidated, is believed to blame Algonquin and society's reliance on electricity as the reason he developed leukemia due to radiation from working close to power lines. Signals intelligence (SIGINT) suggests that Galt is backed by a previously unknown eco-terror group named 'Justice For'. The collected intelligence fails to specify further details of the terrorist cell, other than the name 'Rahman'. A series of demand letters are sent after the first attack, ordering Algonquin to reduce its electrical distribution, or further acts of violence involving electricity would be executed. Rhyme must also deal with a parallel investigation into a recurring antagonist in the series: the criminal known as Richard Logan, who is nicknamed 'The Watchmaker'. A joint operation is conducted between Rhyme's office and the Mexican Federal Police after Logan is located in Mexico.",0
