id,title,author,published_date,categories,summary,page_count
1277241,Brokenclaw,John Gardner,1990-07,"{""/m/06wkf"": ""Spy fiction""}","After expressing frustration over a lack of action after his year-long mission with the Royal Navy (as detailed in Win, Lose or Die), Bond threatens to resign. Instead, M orders Bond to take a vacation. Bond travels to Victoria, British Columbia where he is intrigued by Lee Fu-Chu, a half-Blackfoot, half-Chinese philanthropist who is known as ""Brokenclaw"" because of a deformed hand. Later, Bond is ordered to San Francisco where he is tasked to investigate the kidnapping of several scientists who have been working on a new submarine detection system and an ""antidote"" known as LORDS and LORDS DAY. Bond and CIA agent Chi-Chi Sue go undercover using the codenames Peter Abelard and Héloïse that were assigned to two agents from the People's Republic of China that are sent to evaluate the submarine technology before purchasing it. Ultimately, Bond discovers that Brokenclaw is involved in this scheme on behalf of China, and also has plans of his own which involve sparking a worldwide economic disaster by bringing about the collapse of the dollar by tapping into the New York Stock Exchange, which would in turn bring down other major currencies worldwide. The plan, dubbed Operation Jericho was a long-term plan initially started by the Japanese, but now believed to have been worked on simultaneously by the Chinese before being acquired by Brokenclaw. Brokenclaw's hideout in California is raided by Special Forces after he is located by Naval Intelligence officer Ed Rushia who was searching and attempting to help Bond and Chi-Chi while on their mission. Brokenclaw escapes the raid only to be tracked down by Bond and Rushia, off the books, to the Chelan Mountains of Washington where Bond is challenged to a torture ritual known as o-kee-pa. In the end, the competition comes down to a fight between the two using bow and arrows; Brokenclaw barely misses Bond and in turn is shot through the neck by Bond's arrow.",0
1277265,The Man from Barbarossa,John Gardner,1991,"{""/m/06wkf"": ""Spy fiction""}","The Man from Barbarossa begins with a prelude that includes some background information on the Nazi invasion of the Soviet Union codenamed Operation Barbarossa, the massacre at Babi Yar that occurred not long after, and information on Josif Voronstov, a fictional character said to be a deputy of real-life Paul Blobel who was primarily responsible for the massacre. When the story begins, an elderly American living in New Jersey is kidnapped by a Russian terrorist group called the ""Scales of Justice"". The man, Joel Penderek, was captured under the belief that he is Josif Voronstov, the war criminal partially responsible for the massacre at Babi Yar. The group demands the Soviet government put the man on trial for his crimes, and begins murdering government officials when leaders refuse and are slow to react. The situation is slightly more complicated as the CIA and the Mossad believe Voronstov to be a man located in Florida who they had under surveillance. Captain James Bond is partnered with an Israeli Mossad agent, Pete Natkowitz, and two agents from the French Secret Service, Henri Rampart and Stephanie Adoré. They are assigned to work with Bory Stepakov and his assistant Nina Bibikova from the KGB to infiltrate the Scales of Justice posing as a TV crew so as to discover their real motive. Accomplishing this, they learn that the group plans to sabotage perestroika and supply Iraq with nuclear weapons before the United Nations-led coalition invades. The man behind the Scales of Justice, General Yevgeny Yuskovich, is a cousin of Josif Voronstov who is identified as Joel Penderek. The trial was staged in order to shift focus away from Yuskovich's other plans.",0
1277287,Death is Forever,John Gardner,1992,"{""/m/06wkf"": ""Spy fiction""}","The aftermath of the Cold War provides the setting for the plot of Death Is Forever. After the deaths of a British Intelligence agent and an American agent with the CIA working in Germany under mysterious and surprisingly old-fashioned circumstances, James Bond and CIA agent Elizabeth Zara (""Easy"") St. John are assigned to track down the surviving members of ""Cabal"", a Cold War-era intelligence network that received a mysterious and unauthorized signal to disband. Soon, Bond finds himself playing a life-or-death game of ""Who do You Trust?"" as he and Easy track down Wolfgang Weisen, the power responsible for killing off Cabal's members one by one. Bond uncovers Weisen's plot to kill off the heads of each European country during the inaugural run of the Eurostar from London to Paris in an effort to create havoc in the west and usher in a second era of Communism. More than most other Gardner novels, Death Is Forever is grounded in current events, with the fallout from the end of the Cold War and the failed 1991 Russian coup being important backdrops to the story. The Eurotunnel connecting England and France, which was still under construction at the time the book was written, also serves as a major setting.",0
1277302,Never Send Flowers,John Gardner,1993-07-15,"{""/m/06wkf"": ""Spy fiction""}","A murder in Switzerland of Laura March with MI5 connections follows assassinations in Rome, London, Paris & Washington. Left at each scene is a rose with marks of drops of blood on the petal. He also left a branch from an oak tree. Bond is sent to investigate where he meets the lovely Swiss agent Fredericka von Grüsse whom he later calls Flicka when on better terms. Trails lead to a former international stage actor, David Dragonpol, a friend of March who lives in a castle on the Rhine called Schloss Drache which he is turning into a theatre museum. They also meet a widow and flower grower, Maeve Horton.",0
1277351,SeaFire,John Gardner,1994-08,"{""/m/06wkf"": ""Spy fiction""}","With the help of his latest girlfriend Flicka von Grüsse, James goes after billionaire Sir Maxwell Tarn, who thinks he's the next Hitler. Captain Bond now works for MicroGlobe One rather than an ill M whom he visits to cheer up and keep informed of the plot. The global trail takes 007 to Puerto Rico via Spain, Israel and Germany. During the story, Bond proposes to Flicka. An old friend reappears to aid James and split up this spy twosome.",0
1277425,COLD,John Gardner,1996-05-02,"{""/m/06wkf"": ""Spy fiction""}","The novel is split into two books, one called ""Cold Front"" and the second entitled ""Cold Conspiracy"". The time between each book appears to be the time period allotted to Gardner's previous Bond outings, Never Send Flowers and SeaFire. The story opens with the crash of a Boeing 747-400 at Dulles International Airport in Fairfax and Loudoun counties, Virginia, near Washington, D.C., and the apparent death of Bond's friend and lover, the Principessa Sukie Tempesta. Bond is then sent by M to the airport with an investigation team which leads to meetings with FBI agent Eddie Rhabb. The main action takes place in Italy at the home of the Tempesta brothers, Luigi and Angelo, where Bond gets caught in the act with one of the brothers' wives. As James later explains to M, the lady made the advances. The enemy of the story is provided by a terrorist army called COLD, which stands for Children Of the Last Days.",0
1277477,The Facts of Death,Raymond Benson,UNK,"{""/m/06wkf"": ""Spy fiction"", ""/m/02xlf"": ""Fiction""}","The Facts of Death starts off with several deaths from mysterious diseases. We first find Bond in Cyprus where a number of British troops have been discovered murdered, under mysterious circumstances. Bond gets too close for comfort for the group behind the actions and is attacked, but rescued by a fiery Greek female agent, Niki Mirakos. Bond then returns to Britain. He is invited to attend a dinner party being held by his former boss, Sir Miles Meservey. His current boss and her boyfriend are in attendance. After the party M's boyfriend is murdered. She then tells Bond that all of the killings are connected because near all the bodies there were statues of Greek deities and numbers counting the victims of the horrible killing spree. Bond is sent to Greece and partnered with his current love interest Niki Mirakos. They both seem to be suspicious of an internationally known mathematic cult called the Decada. The head of the group is Greek mathematician, Konstantine Romanos. Bond goes to a Greek casino that is about two hours away from Athens and battles Romanos in a game of bacaraat. He defeats Romanos and catches the attention of a pretty Greek woman named Hera Volopoulos, who is also a card carrying member of the Decada. Bond chats with and later beds Hera. He then is drugged by her after they have made love. She takes him to Konstantine who talks to Bond and tells Hera to kill him. Bond manages to escape Hera's evil clutches. He then manages to figure out Konstantine's plan, to start a major war between Greece and Turkey. Bond figures out where the hideout is and gets there just in time to witness Hera murder Konstantine. She leaves Bond to stop a nuclear missile that will be fired from Greece into Turkey. Bond then figures out Hera's plan, to profit from worldwide murder through a new virus. Bond, with assistance from the Greek military, boards a helicopter and prepares for battle with Hera. He kills her and stops the missile. Locations where the book takes place include: * Los Angeles * Tokyo * Austin, Texas * Cyprus * London * Greece",0
1277518,High Time to Kill,Raymond Benson,1999-05-06,"{""/m/02n4kr"": ""Mystery"", ""/m/06wkf"": ""Spy fiction"", ""/m/02xlf"": ""Fiction"", ""/m/0c3351"": ""Suspense""}","The world of James Bond is introduced to the ruthless terrorist organization called ""The Union"", whose brutal trademark is slashing the throat of those who cross them. Bond and his girlfriend Helena are attending a dinner party thrown by the Governor of The Bahamas. The Governor, who has a gambling debt with a member of The Union, has refused to pay up since he feels that he had been cheated, so there is much security detail at the event. However, the assassin disguises himself as one of the guards and kills the Governor, just as Bond realizes the danger. Bond almost catches the assassin but he commits suicide before he can be interrogated. A top secret British formula hidden in microfilm, codenamed ""Skin 17"", is stolen by traitors; scientist Steven Harding and RAF officer Roland Marquis. The microdot is surgically implanted in the pacemaker of an unhealthy old man, who is a former Chinese intelligence agent. James Bond is sent in to recover it before the Union can sell the microfilm to a foreign power. Bond tracks Harding and the Chinese ex-agent to Belgium, but the latter two slip away while Bond narrowly kills Harding's bodyguard Basil. MI6 tracks the Chinese man to Nepal. It turns out, however, that Harding planned to double-cross the Union, by having the plane of the pacemaker’s host hijacked. Le Gerrant, the blind leader of The Union, immediately deduces Harding's double-cross and has him executed; Harding's body later washes up on the beaches of Gibraltar. The plane containing the pacemaker's host crashed into the Himalayas, so a deadly race commences to recover Skin 17. Bond, sexy mountaineer Hope Kendal, and Roland Marquis, also Bond's schoolboy-days rival, lead one of the expeditions. Early on, they successfully destroy the Chinese base camp, forcing that team to withdraw. Not long after, however, everyone on the British expedition has been killed, save for Bond, Hope, and Marquis. The race climaxes with Bond battling Marquis atop the peak of Kangchenjunga. It turns out that Marquis had collaborated with Harding to steal Skin 17, though they were not planning to sell it to The Union. After a physical high elevation fight, Bond trades oxygen to receive Skin 17 from a mortally wounded Marquis. As Bond and Hope return to base camp, they realize that it has been infiltrated by The Union as Paul Baack, having earlier faked his death while killing the rest of the team, demands Skin 17. Bond and Hope manage to kill Baack and Skin 17 is returned to the British. Bond's now-estranged girlfriend Helena reveals herself to be in the employ of The Union due to blackmail and threats of violence to her family. However, she is killed just before Bond can reach her. Locations where the book takes place include: * The Bahamas * London, Buckinghamshire, Hampshire—England * Belgium * Delhi, India * Morocco * Nepal * Mt. Kangchenjunga * Brighton, England",0
1277536,Doubleshot,Raymond Benson,2000-05-04,"{""/m/06wkf"": ""Spy fiction"", ""/m/02xlf"": ""Fiction"", ""/m/0c3351"": ""Suspense""}","DoubleShot, the second novel in Raymond Benson's Union trilogy, again sets James Bond, 007 against the evil terrorist organization called the Union. Still smarting from their last encounter with 007 when he foiled their plans to get Skin 17 in High Time to Kill, the Union has decided that Britain and James Bond are their new number one priority, and targets. Coming up with an elaborate plan to plunge Britain into war and destroy Bond's reputation in the process, the Union sets up their scheme. Domingo Espada, a Spanish Nationalist/Gangster/Ex-Matador who wishes to see Gibraltar returned to Spain from Britain, is approached by Nadir Yassasin, the Union's master strategist, as the centrepiece to their plan. They plan to help Espada forcefully take control of Gibraltar, killing the British Prime Minister and the Governor of Gibraltar, and having a Bond-Double do it, thus ruining Bond's career and life. But first, through an elaborate series of events, they convince Bond he is losing his mind, and force him to investigate these happenings on his own, without approval from M or SIS. Since Bond's return from the Himalayas, he begins experiencing terrible headaches, hallucinations, and black-outs. This leads him to Dr. Kimberly Feare. She diagnoses a lesion on the back of Bond's skull that is causing these symptoms. After getting Dr. Feare in bed, Bond wakes up to find her murdered, her throat slit ear-to-ear, the Union's mark. This causes Bond to leave England. Bond's trek takes him from England to Tangier, where he encounters the Taunt twins, Heidi and Hedy, CIA agents asked by M to bring him back to London. Here Bond finds the connection between the Union and Espada, and that he has some part in the Union's plan. Convincing M and the Taunts to play out his hand, Bond goes to Spain. On arrival in Spain, he encounters Margareta Piel, Espada's female assassin and a member of the Union. Followed closely by the climax of Bond vs. his double in Espada's practice bullfighting ring, and the culmination of the Union's plot at the Gibraltar peace conference, Bond takes his double's place and along with the Taunt twins, prevent the assassinations, kills Espada, Piel, Jimmy Powers (a high-ranking American in the Union, and their number one expert in stealth and tailing), and captures Yassasin, foiling the Union's plans once again.",0
1277548,Never Dream of Dying,Raymond Benson,2001,"{""/m/06wkf"": ""Spy fiction"", ""/m/02xlf"": ""Fiction""}","It begins when a police raid goes horribly wrong, killing innocent men, women, and even children. Bond knows the Union is behind the carnage, and vows to take them down once and for all. His hunt takes him to Paris, into a deadly game of predator and prey, and a fateful meeting with the seductive Tylyn Mignonne, a movie star with a sordid past, who may lead Bond to his final target—or his own violent end... Eventually it leads him to the Union's latest attack on society, which involves Tylyn's husband, Leon Essinger, and his new movie, ""Pirate Island"", which stars Tylyn. (US Paperback) The conclusion to Benson’s Union Trilogy. Locations are Nice, Paris, Cannes, Monte Carlo, Corsica (also Los Angeles, Japan, and Chicago briefly).",0
1277590,The Man with the Red Tattoo,Raymond Benson,2002-05-02,"{""/m/06wkf"": ""Spy fiction""}","On a flight from Japan to the United Kingdom, a young Japanese woman dies of a mysterious illness. The illness is a mutated version of the West Nile virus. James Bond finds out that not only was she the daughter of an important Japanese businessman, her entire family is also dead. James Bond travels to Japan in search of the killer. Here Bond reunites with his longtime friend Tiger Tanaka, who introduces him to a female Japanese agent who is later killed by the mutant virus.",0
1277594,Facundo,Domingo Faustino Sarmiento,1845,UNK,"After a lengthy introduction, Facundos fifteen chapters divide broadly into three sections: chapters one to four outline Argentine geography, anthropology, and history; chapters five to fourteen recount the life of Juan Facundo Quiroga; and the concluding chapter expounds Sarmiento's vision of a future for Argentina under a Unitarist government. Facundo begins with a geographical description of Argentina, from the Andes in the west to the eastern Atlantic coast, where two main river systems converge at the boundary between Argentina and Uruguay. This river estuary, called the Rio de Plata, is the location of Buenos Aires, the capital. Through his discussion of Argentina's geography, Sarmiento demonstrates Buenos Aires' advantages; the river systems were communications arteries which, by enabling trade, helped the city to achieve civilization. Buenos Aires failed to spread civilization to the rural areas and as a result, much of the rest of Argentina was doomed to barbarism. Sarmiento also argues that the pampas, Argentina’s wide and empty plains, provided ""no place for people to escape and hide for defense and this prohibits civilization in most parts of Argentina"". Despite the barriers to civilization caused by Argentina’s geography, Sarmiento argues that many of the country's problems were caused by gauchos like Juan Manuel de Rosas, who were barbaric, uneducated, ignorant, and arrogant; their character prevented Argentine society's progress toward civilization. Sarmiento then describes the four main types of gaucho and these characterizations aid in understanding Argentine leaders, such as Juan Manuel de Rosas. Sarmiento argues that without an understanding of these Argentine character types, ""it is impossible to understand our political personages, or the primordial, American character of the bloody struggle that tears apart the Argentine Republic"". Sarmiento then moves on to the Argentine peasants, who are ""independent of all need, free of all subjection, with no idea of government"". The peasants gather at taverns, where they spend their time drinking and gambling. They display their eagerness to prove their physical strength with horsemanship and knife fights. Rarely these displays led to deaths, and Sarmiento notes that Rosas's residence was sometimes used as a refuge on such occasions, before he became politically powerful. According to Sarmiento, these elements are crucial to an understanding of the Argentine Revolution, in which Argentina gained independence from Spain. Although Argentina’s war of independence was prompted by the influence of European ideas, Buenos Aires was the only city that could achieve civilization. Rural people participated in the war to demonstrate their physical strengths rather than because they wanted to civilize the country. In the end, the revolution was a failure because the barbaric instincts of the rural population led to the loss and dishonor of the civilized city&mdash;Buenos Aires. The second section of Facundo explores the life of its titular character, Juan Facundo Quiroga&mdash;the ""Tiger of the Plains"". Despite being born into a wealthy family, Facundo received only a basic education in reading and writing. He loved gambling, being called el jugador (the player)&mdash;in fact, Sarmiento describes his gambling as ""an ardent passion burning in his belly"". As a youth Facundo was antisocial and rebellious, refusing to mix with other children, and these traits became more pronounced as he matured. Sarmiento describes an incident in which Facundo killed a man, writing that this type of behaviour ""marked his passage through the world"". Sarmiento gives a physical description of the man he considers to personify the caudillo: ""[he had a] short and well built stature; his broad shoulders supported, on a short neck, a well-formed head covered with very thick, black and curly hair"", with ""eyes ...&nbsp;full of fire"". Facundo's relations with his family eventually broke down, and, taking on the life of a gaucho, he joined the caudillos in the province of Entre Ríos. His killing of two Spaniards after a jailbreak saw him acclaimed as a hero among the gauchos, and on relocating to La Rioja, Facundo was appointed to a leadership position in the Llanos Militia. He built his reputation and won his comrades' respect through his fierce battlefield performances, but hated and tried to destroy those who differed from him by being civilized and well-educated. In 1825, when Unitarist Bernardino Rivadavia became the governor of the Buenos Aires province, he held a meeting with representatives from all provinces in Argentina. Facundo was present as the governor of La Rioja. Rivadavia was soon overthrown, and Manuel Dorrego became the new governor. Sarmiento contends that Dorrego, a Federalist, was interested neither in social progress nor in ending barbaric behaviour in Argentina by improving the level of civilization and education of its rural inhabitants. In the turmoil that characterized Argentine politics at the time, Dorrego was assassinated by Unitarists and Facundo was defeated by Unitarist General José María Paz. Facundo escaped to Buenos Aires and joined the Federalist government of Juan Manuel de Rosas. During the ensuing civil war between the two ideologies, Facundo conquered the provinces of San Luis, Cordoba and Mendoza. On return to his San Juan home, which Sarmiento says Facundo governed ""solely with his terrifying name"", he realized that his government lacked support from Rosas. He went to Buenos Aires to confront Rosas, who sent him on another political mission. On his way back, Facundo was shot and killed at Barranca Yaco, Córdoba. According to Sarmiento, the murder was plotted by Rosas: ""An impartial history still awaits facts and revelations, in order to point its finger at the instigator of the assassins"". In the book's final chapters, Sarmiento explores the consequences of Facundo's death for the history and politics of the Argentine Republic. He further analyzes Rosas's government and personality, commenting on dictatorship, tyranny, the role of popular support, and the use of force to maintain order. Sarmiento criticizes Rosas by using the words of the dictator, making sarcastic remarks about Rosas's actions, and describing the ""terror"" established during the dictatorship, the contradictions of the government, and the situation in the provinces that were ruled by Facundo. Sarmiento writes, ""The red ribbon is a materialization of the terror that accompanies you everywhere, in the streets, in the bosom of the family; it must be thought about when dressing, when undressing, and ideas are always engraved upon us by association"". Finally, Sarmiento examines the legacy of Rosas's government by attacking the dictator and widening the civilization–barbarism dichotomy. By setting France against Argentina—representing civilization and barbarism respectively—Sarmiento contrasts culture and savagery: France's blockade had lasted for two years, and the 'American' government, inspired by 'American' spirit, was facing off with France, European principles, European pretensions. The social results of the French blockade, however, had been fruitful for the Argentine Republic, and served to demonstrate in all their nakedness the current state of mind and the new elements of struggle, which were to ignite a fierce war that can end only with the fall of that monstrous government.",0
1278604,The Silencers,Donald Hamilton,1962,"{""/m/06wkf"": ""Spy fiction"", ""/m/05hgj"": ""Novel""}","When a female agent in Mexico is killed before Helm can complete his mission to extract her, he finds himself teamed up with the woman's sister as he fights to save the lives of a number of scientists and Congressmen.",0
1278608,The Ambushers,Donald Hamilton,1963,"{""/m/06wkf"": ""Spy fiction""}","Matt Helm conducts a by-the-book assassination in the (fictional) Central American nation of Costa Verde. Afterwards, he finds himself pursuing an ex-Nazi named von Sachs, who has obtained one of the nuclear missiles that had been bound for Cuba during the Cuban Missile Crisis, and who is threatening the United States with the weapon. Along the way he finds himself working with a Russian agent named Vadya (who would return in later Helm adventures).",0
