id,title,author,published_date,categories,summary,page_count
9008104,The Unbeheaded King,L. Sprague de Camp,UNK,"{""/m/014dfn"": ""Speculative fiction"", ""/m/01hmnh"": ""Fantasy""}","In this sequel to The Clocks of Iraz, ex-king Jorian of Xylar and Dr. Karadur flee the revolt-stricken city of Iraz in the bathtub of its lately deceased monarch Ishbahar, borne through the air by Gorax, an invisible demon in the service of Karadur. In accordance with the doctor's previous promise, the demon flies them to Xylar to rescue Jorian's favorite wife Estrildis, imprisoned there by the kingdom's authorities in the hope of enticing Jorian, whom they intend to execute, back into their power. The plan miscarries, and the demon is barely able to spirit the hapless rescuers off to the neighboring city-state of Othomae, where it deposits them, tub and all, in the park of the Grand Duke. There they are promptly arrested for trespassing. Effecting their release takes some time, largely because their sadistic jailer Maltho, who bears a grudge against Jorian from a previous acquaintance, balks their efforts to send word of their plight to friends outside. Finally free, they attempt to accumulate resources for another attempt to recover Estrildis; difficult, since Jorian must remain in hiding from the Xylarians. Ultimately, eschewing heroics, he hires Abacarus, a sorcerous colleague of Karadur to do the job, again by means of a demonic servant. To his dismay, the demon Ruakh returns with the wrong woman, Estrildis' attendant Margalit. He is further from his goal than ever, and now mired in a lawsuit over fulfillment of the contract to boot! Disenchanted with magical shortcuts, Jorian contacts his family in Kortoli and commissions his younger brother Kerin to reconnoiter Xylar. Kerin returns with word that Thevatas, one of Estrildis' guards is susceptible to bribery, and Jorian and Karadur accordingly return to Xylar in the guise of Mulvanians (traveling entertainers similar to Gypsies), where the subverted guard delivers Estrildis in return for the crown of Xylar, which Jorian had hidden after his initial escape from execution. But now Jorian discovers Estrildis had taken a lover in his absence and doesn't want to be rescued! Soft-hearted, Jorian surrenders her to her lover Corineus and takes up with Margalit instead, of whom he has grown fond in the interim. (As was manifestly clear long before this moment, the resourceful, practical and level-headed Margalit is a far more suitable mate for Jorian than the emotional Estrildis.) A Xylarian judge Jorian has taken hostage weds him to his new love, who is then able to free the cursed spirit of Lorc, a baronial ghost who has aided them. Beset by both bandits and pursuing Xylarians, the party makes its escape to Othomae again. In a postscript, Jorian has returned to Kortoli with his new wife and joined the family clockmaking firm; there he learns that a revolution in Xylar has overthrown the regicidal regime, and he is at last out of danger from his former subjects. In fact, he is now their national hero, and they want him back on an (unthreatened) throne - an offer he politely declines. This last scene is in fact the only one in the Jorian sequence showing the hero in his homeland of Kortoli - though the readers have gained a though acquaintance with it though the folk tales told by him and embedded in various books.",0
9008683,Necropolis,Basil Copper,1980,"{""/m/039vk"": ""Gothic fiction"", ""/m/02n4kr"": ""Mystery"", ""/m/014dfn"": ""Speculative fiction""}","The novel is set in Victorian England. Clyde Beatty, a private investigator, is hired by Angela Meredith to investigate her father's death. His investigations lead him to a nursing home in Surrey, directed by the sinister Dr. Horace Couchman. After an autopsy reveals the murder of Miss Meredith's father, Dr. Couchman flees to London leading Beatty eventually to the eerie Brockwood Cemetery and a criminal conspiracy involving millions of pounds worth of gold bullion.",0
9009551,The Third Grave,David F. Case,1981,"{""/m/01hmnh"": ""Fantasy"", ""/m/014dfn"": ""Speculative fiction"", ""/m/03npn"": ""Horror""}","The novel is the story of a young Egyptologist, Thomas Ashley, who, while on an archeological expedition, discovers ancient Egyptian secrets of resurrection and immortality. Accompanied by the beautiful Arabella Cunningaham, the two are menaced by a horror spawned by an ancient curse.",0
9010959,Kai Lung Unrolls His Mat,Ernest Bramah,1928,"{""/m/014dfn"": ""Speculative fiction"", ""/m/01hmnh"": ""Fantasy"", ""/m/02xlf"": ""Fiction""}","Kai Lung adventures usually serve as mere excuses to bring up side stories along the way, which typically take up the better part of a Kai Lung book. However, this is one of the few books that has a purposeful main narrative as well as intriguing side stories. Kai Lung comes home one day to meet his wife, but finds everything in a state of disarray. An elderly neighbour tells him that the village has been devastated by Ming Shu. Kai Lung goes in the direction of Ming Shu. Along the way, he meets barbarians, a poor farmer named Thang, a bandless captain in the city of Chi-U, and finally (disguised as Mang-hi, a foreigner from the land of Kham) Ming Shu himself. =====Wan and the Remarkable Shrub===== A sage, finding sleep to be an unwelcome obstruction to his pursuit of enlightenment, cuts off his eyelids and throws them away. At the spot where his eyelids land grows a shrub whose leaves look like his eyelids. Later, during a famine, the shrub is rediscovered and used to make a potion that soon becomes famous enough to catch the attention of the emperor, who subsequently bestows great honors on Wan. =====Wong Tsoi and the Merchant Teen King's Thumb===== A case of two people with the same fingerprints creates difficulties which are resolved by the mandarin Wong Tsoi. =====Tong So, the Averter of Calamities===== A ring of thieves realizes that its members don't need to take the trouble to steal to make a living, if they exact a tribute from everyone in the town in return for a promise not to give them any trouble. =====Lin Ho and the Treasure of Fang-tso===== Lin Ho, an ugly boy, is orphaned and sent to live with his rich uncle, who employs him as a slave. Lin Ho has been taught to do the best he can and not worry about the reaction to his actions, so he accepts this lot stoically. Then, one day, his uncle decides to get rid of him by sending him to make an offering at a shrine, giving him a lunch that contains a poisoned onion. At the foot of the hill containing the shrine, Lin Ho meets a proud warrior named Lam-Kwong, who, on the pretense that one cannot speak to the gods with onion breath, takes his onion, devours it greedily, and then dies—but not before killing Lin Ho with a stone directed at his head. Lin Ho goes to heaven, but the beings there are not quite ready to receive him, and so, as a reward for the virtuous life he has led so far, he is allowed to reënter his body. However, once he comes back to earth, he sees his own body lying beside that of Lam-Kwong, and decides that it would be much nicer to inhabit the forbidding body of a warrior than to resume his original post. This, however, poses a problem, for now he needs to work out what is expected of him… =====Kin Weng and the Miraculous Tusk===== The apprentice to an ivory-carver, who works diligently but without much reward, wanders into the woods one day, and sees a tree, a pagoda, and a young woman, all of perfect proportion… Some years later, Kai Lung tells a story to an unwilling listener, a suitor of one of his daughters. At an early mythical period of imagined history, a young man redeems his word to cut a crescent off the moon, in order to win a young lady's hand. Kai Lung is informed by his neighbors that he has received official honorable recognition, though he is displeased when he discovers it is for rumored skills he does not possess, rather than for his real accomplishments. The last scion of a deposed dynasty overthrows a corrupt monarch and finds happiness, and a prophecy comes true, though not in the expected way.",0
9012736,Why Paint Cats,Burton Silver,1994,"{""/m/02yq81"": ""Comic novel"", ""/m/01z4y"": ""Comedy""}","Why Paint Cats describes the practice of ""cat painting"", the decorating of cats with paint.",0
9015125,A Tale of a Tub,Ben Jonson,UNK,UNK,"The plot, which unfolds on St. Valentine's Day, concerns the inept attempts of a variety of suitors to win the hand of Audrey Turfe, the daughter of a Middlesex constable. To break Audrey's engagement to John Clay the tilemaker, Squire Tub, a romantic rival, has the man falsely accused of theft. As Constable Turfe pursues the innocent man, yet another suitor, Justice Preamble, plays a comparable ruse against Squire Tub. All told, Audrey is chased after by four separate suitors, and apparently she has no particular preference among them. (She hesitates to accept Squire Tub, however, because of the social gap between them: ""He's too fine for me, and has a Lady / Tub to his mother."") Amid the disorder, Pol-Marten, Lady Tub's usher, marries Audrey before the others realize it. Their marriage is celebrated with a wedding masque, also titled ""A Tale of a Tub,"" which retells the story of the play. (In the colloquial usage of the time, a ""tale of a tub"" is the same as ""a cock and bull story."") Jonson, here as often elsewhere in his plays, borrows elements from the Classical plays of Aristophanes and Plautus. The play was published with a motto from Catullus: Inficeto est inficetior rure.",0
9020079,Sacred Games,Vikram Chandra,2006,"{""/m/02n4kr"": ""Mystery"", ""/m/02xlf"": ""Fiction"", ""/m/05hgj"": ""Novel""}","Sacred Games combines the ambition of a 19th-century social novel with a cops-and-Bhais detective thriller. (Bhai is a Hindi slang term for gangster.) As sprawling as the heat-drenched city it richly portrays, Sacred Games delves into many emotionally charged worlds of contemporary India, in particular the spidery links between organized crime, local politics and Indian espionage that lie below the shimmering surfaces of its economic renaissance. Money and corruption form the golden thread. In interweaving narratives and voices, Sacred Games takes on even larger themes, from the wrenching violence of the 1947 partition of India to the specter of nuclear terrorism.",0
9024632,The Brimstone Wedding,Ruth Rendell,1996-03-28,"{""/m/0lsxr"": ""Crime Fiction"", ""/m/02n4kr"": ""Mystery""}","Jenny Warden, a care-assistant in a retirement home, is in a loveless marriage, and has a lover. She befriends Stella Newland, a resident with cancer. Stella slowly reveals to Jenny the events of her own life, which in some ways parallels Jenny's. Stella gives Jenny the keys to a house that Stella owns, and the intrigue and their relationship deepens.",0
9024690,No Night is Too Long,Ruth Rendell,1994-05-26,"{""/m/0lsxr"": ""Crime Fiction"", ""/m/02n4kr"": ""Mystery""}","Set in Alaska and Suffolk, this story is written in three first-person narrations, the first and longest of which is the memoir-confession of Tim Cornish. Tim, a would-be novelist of twenty-four, has just received his master's degree. He travels to Alaska for a nature-exploration cruise with his somewhat older male lover, Ivo, a paleontologist who will be lecturing during the cruise. Tim has been living with and supported by Ivo, but, since Ivo's recent declaration of love, Tim has tired of him. Ashore in Juneau while Ivo is elsewhere, Tim meets Isabel, an unhappily married, somewhat older woman, with whom Tim immediately falls in love, and he promises to meet her in Seattle in ten days after breaking up with Ivo (who he pretends is a woman). When Tim tells Ivo their relationship is over, Ivo refuses to accept it. On an excursion to an uninhabited island, the two men tussle; Tim strikes Ivo, who then strikes his head against a tree and moves no more. Leaving Ivo for dead, Tim flees the island and rejoins the cruise, saying nothing of what has happened. He helps himself to the cash and credit card Ivo left behind and flies to Seattle, hoping to find Isabel, but his guilt causes him to abandon that plan and he returns to the UK, where he settles into an unchallenging job in his hometown and lives alone in his parents' house. As there has been no word of a police inquiry, no report of the finding of Ivo's body, Tim seems to have committed the perfect crime, though he is increasingly haunted by what he has done, believing he sees Ivo everywhere. Then he begins to receive a series of anonymous letters, each of which describes the island ordeal--and rescue--of a castaway. Someone knows what he did. Isabel's own brief memoir, in the form of a letter of sorts to Ivo, and a concluding letter to his wife by a schoolboy friend of Tim's who becomes Tim's solicitor, complete the book, which explores questions of sexual identity, fidelity, and guilt.",0
9024728,Asta's Book,Ruth Rendell,1993-03-25,"{""/m/0lsxr"": ""Crime Fiction"", ""/m/02n4kr"": ""Mystery""}","This is set in the 1990s, with flashbacks to 1905 via Asta's diary. Asta and her husband Rasmus have come to east London from Denmark with their two sons. With Rasmus constantly away on business, Asta keeps loneliness and isolation at bay by writing her diary. These diaries, published over seventy years later, reveal themselves to be more than a mere journal, for they seem to hold the key to an unsolved murder, to the quest for a missing child and to the enigma surrounding Asta's daughter, Swanny. It falls to Asta's granddaughter Ann to unearth the buried secrets of nearly a century before.",0
9024830,Gallowglass,Ruth Rendell,1990-03-01,"{""/m/0lsxr"": ""Crime Fiction"", ""/m/02n4kr"": ""Mystery""}","When Sandor snatches Joe from the path of a London tube train, he makes it clear that Joe's life now belongs to him. Sandor begins to tell him a mysterious story and teaches Joe that he is a ""gallowglass"", the servant of a chief. Sandor comes from a wealthy home and is highly educated. Joe, longing for a friend, falls under his spell. Some years earlier, Sandor had taken part in the kidnapping of a former model, Nina. He now plans to kidnap her again so that they can live together. At present, Nina lives in a heavily-guarded residence with her husband and many servants. Eventually, Joe's colourful stepsister, Tilly, is also dragged into the plot. However, things don't turn out as Sandor had planned. Most of the story is seen through Joe's eyes, but Paul Garnet, Nina's driver, also tells part of the tale.",0
9024982,A Dark-Adapted Eye,Ruth Rendell,1986-03-01,"{""/m/0lsxr"": ""Crime Fiction"", ""/m/02n4kr"": ""Mystery""}","Largely set during World War II, the story is told by Faith Severn, who at the prompting of a true-crime writer recounts her memories of her aunt, the prim, fastidious, and snobbish Vera Hillyard. Vera's life is initially centred on her beautiful younger sister, Eden, even to the exclusion of her own son, Francis, with whom she has a poor relationship. Later, Vera has a second son, Jamie, to whom she is intensely devoted, while Eden marries the scion of a wealthy family. When Eden is unable to have children with her husband, she begins to demand custody of Jamie, who she claims is being poorly raised by Vera. To the bewilderment and shock of the rest of the family, the custody battle escalates to violent levels, leading to tragedy and a series of disturbing revelations.",0
9025584,The Darkling,David Kesterton,1982,"{""/m/014dfn"": ""Speculative fiction"", ""/m/01hmnh"": ""Fantasy""}","Set in the distant future, a young tribesman, Maradek searches for his father, Afurad. In the course of this search, he helps to foil the forces that threaten the world's destruction.",0
9025839,The Centurion's Empire,Sean McMullen,UNK,"{""/m/06n90"": ""Science Fiction"", ""/m/014dfn"": ""Speculative fiction""}","The Roman centurion Vitellan enters into multiple periods of hibernation through a concotion developed from snow-dwelling insects. He 'emerges' into various periods throughout history, many times assisting the locals in defending themselves from outside threats. Unfortunately Vitellan is not doing so well, the artificial suspension is severely injuring him. The novel continues into the future, where several organizations vie for the control of Vitellan. fr:L'Empire du centurion",0
9025963,Glass Dragons,Sean McMullen,2004,"{""/m/014dfn"": ""Speculative fiction"", ""/m/01hmnh"": ""Fantasy""}","The use of the weapon in the first book has led to storms that sweep the planet and make travel by sea nearly impossible. A group of magicians thinks it has the way to stop the storms: Dragonwall, a device that will drain the storms' energy. But when Dragonwall's true purpose is discovered, it's up to the priestess to destroy it by any means necessary. Meanwhile, the world has a new vampire, looked after by the old one and an unlikely genius who travels with a fallen courtier. All of them, plus a motley crew of soldiers and a sorceress (who wants nothing more than good food and pleasant company) must help the priestess destroy Dragonwall before it's too late.",0
9026192,The Miocene Arrow,Sean McMullen,2000,"{""/m/06n90"": ""Science Fiction"", ""/m/014dfn"": ""Speculative fiction""}","In isolated pockets of what used to be America, humans fight stylized duels in small, biodiesel-powered airplanes. In a land where chivalry and honor are everything, what happens when rebels from Australia, enamored of the amazing technology held by the Americans, hatch a plot to bring some of it back to their homes?",0
9026250,Eyes of the Calculor,Sean McMullen,2001,"{""/m/06n90"": ""Science Fiction"", ""/m/014dfn"": ""Speculative fiction""}","Mirrorsun, which orbits earth and prevents electrical machines from functioning, had been defunct for some time. However, when it comes back to life with a vengeance, the new Highliber must reform the Calculor, a large computer whose components are human beings. At the same time, Americans are working with an underground group to bring their airplanes and weapons to Australia. Can the Highliber and the Overmayor of Rochester, the capital of Australia, stop the American technology from destroying their way of life?",0
