id,title,author,published_date,categories,summary,page_count
936381,Tipping the Velvet,Sarah Waters,1998,"{""/m/02xlf"": ""Fiction""}","Nancy ""Nan"" Astley is a sheltered 18-year-old living with her working-class family and helping in their oyster restaurant in Whitstable, Kent. She becomes instantly and desperately enamoured with a ""masher"", or male impersonator, named Kitty Butler, who performs for a season at the local theatre. They begin a friendship that grows when, after Kitty finds an opportunity to perform in London for better exposure, she asks Nan to join her. Nan enthusiastically agrees and leaves her family to act as Kitty's dresser while she performs. Although Kitty and Nan acknowledge their relationship to be sisterly, Nan continues to love Kitty until a jealous fight forces Kitty to admit she feels the same, although she insists that they keep their relationship secret. Simultaneously, Kitty's manager Walter decides that Kitty needs a performing partner to reach true success, and suggests Nan for the role. Nan is initially horrified by the idea, but takes to it. The duo become quite famous until Nan realises she is homesick after being gone from her family for more than a year. Her return home is underwhelming, so she returns to London early to find Kitty in bed with Walter. They announce that the act is finished and they are to be married. Astonished and deeply bruised by the discovery, Nan wanders the streets of London, finally holing herself in a filthy boarding house for weeks in a state of madness until her funds run out. After spying the male costumes she took as her only memory of her time with Kitty, Nan begins to walk the streets of London as a man and easily passes. She is solicited by a man for sex and begins renting, but dressed only as a man for male clients, never letting them know she is a woman. She meets a socialist activist named Florence who lives near the boarding house, but before she can get to know her, Nan is hired by a wealthy widow with licentious tastes named Diana. Although realising—and initially enjoying—that she is an object to Diana and her friends, Nan stays with her for over a year as ""Neville"", dressed in the finest men's clothes Diana can afford. The relationship erodes, however, and Diana throws Nan into the streets. Nan stumbles through London trying to find Florence, which she eventually does; Florence is now melancholy, however, with a child. Nan stays with Florence and her brother Ralph, working as their housekeeper. Nan and Florence grow closer during the year they live together, and Nan learns that the previous boarder with Florence and Ralph had a child and died shortly after giving birth. Florence was deeply in love with the boarder but her affections were not returned. During an outing to a women's pub, Nan is recognised by former fans, to Florence's astonishment, and Nan divulges her own spotty past to Florence. Cautiously, they begin a love affair. Putting her theatrical skills to use, Nan assists Ralph in preparing a speech at an upcoming socialist rally. At the event Nan jumps onstage to help Ralph when he falters, and is noticed once more by Kitty, who asks her to come back so they can continue their affair in secret. Realising how much shame Kitty continues to feel, how much of herself was compromised during their affair, and that her truest happiness is where she is now, Nan turns Kitty away and joins Florence.",0
937142,Darkover Landfall,Marion Zimmer Bradley,1972,"{""/m/06n90"": ""Science Fiction"", ""/m/014dfn"": ""Speculative fiction"", ""/m/01hmnh"": ""Fantasy"", ""/m/02xlf"": ""Fiction""}","Darkover Landfall concerns the crew and colonists of a spaceship that is forced to crash land on Cottman IV, an inhospitable planet in orbit around a red giant. The crew become accidental colonists when the ship loses contact with Earth and they realize rescue is impossible. The book introduces surnames, religious and cultural themes that echo throughout the Darkover series of books. This series spans millennia, as the ship's descendants populate the world and develop unique cultures and psi abilities. Though Darkover Landfall is not the first book written in the series, in the Darkover timeline its events are the beginning for all that follows.",0
937151,Stormqueen!,Marion Zimmer Bradley,1978,"{""/m/06n90"": ""Science Fiction"", ""/m/014dfn"": ""Speculative fiction"", ""/m/01hmnh"": ""Fantasy""}","The novel is set in Darkover's Ages of Chaos where feuding families, the Elhalyn and the Ridenow, are engaged in a breeding scheme to develop children with frightening psychic powers, called laran. The main protagonist is Dorilys Aldaran, the heir to the Rockraven line who develops a fearsome power to alter the planet's weather patterns.",0
938210,Pompeii,Robert Harris,2003,UNK,"Marcus Attilius Primus arrives in the Bay of Naples from Rome to take charge as aquarius (hydraulic engineer) of the Aqua Augusta, the aqueduct that supplies water to the many towns in a region encompassing the Bay of Naples and Mount Vesuvius. The nine important towns are, in sequential order, Pompeii, Nola, Acerrae, Atella, Naples, Puteoli, Cumae, Baiae, and Misenum. Attilius' predecessor as aquarius, Exomnius, has mysteriously vanished as the springs that flow through the aqueduct begin to fail, lowering the supply of water available to the region's reservoir, the Piscina Mirabilis in Misenum. Then, dramatically, the flow of water stops entirely. Attilius concludes that the aqueduct must be blocked somewhere close to Mount Vesuvius, since reports claim a shut down of the system just before Nola, meaning that towns from there through Naples and Misenum are without any water supply. With aid from Pliny the Elder, whose fleet is docked at Misenum, Attilius assembles an expedition to travel to Pompeii, the only town not connected to the water grid, and then on to the blocked section of the Aqua Augusta. While Attilius' expedition is there, the aquarius himself becomes embroiled as part of a plot of the former slave and land speculator Numerius Popidius Ampliatus. Ampliatus is planning on offering a cheap water supply to Pompeii, which Exomnius, the previous aquarius, had helped him do while stealing from the imperial treasury. Attilius' questions and studies make Ampliatus suspicious of what Pliny the Elder and his nephew later discover—thousands of Roman sesterces at the bottom of the reservoir that should have gone to Rome and which Attilius' predecessor had intended to retrieve once he'd emptied the reservoir. Ampliatus' daughter Corelia gets Attilius the proof he needs from her father's written records when he is performing repairs to a collapsed section of tunnel in the region around Mount Vesuvius. The eruption of Mount Vesuvius on August 24 overwhelms Pompeii, Oplontis, and Herculaneum. Attilius risks his life and comes back to Pompeii to find Corelia. Attilius and Corelia dig their way through the aqueduct tunnel, which the springs are beginning to fill—which carries a high risk of drowning. Ampliatus is killed when he refuses to evacuate the city, and Pliny dies from the effects of fumes on a corpulent body when he tries to evacuate the citizens. At the end of the book Attilius and Corelia enter the aqueduct just as the waters are coming back to full flow. The last sentence of the novel reports a local legend that a man and woman had emerged from the aqueduct after the eruption—implying that Attilius and Corelia likely survived the trip up the aqueduct. The incident of Ampliatus feeding a slave to his eels is based on the actual historical case of Vedius Pollio.",0
941708,The Leaky Establishment,David Langford,UNK,"{""/m/06n90"": ""Science Fiction"", ""/m/014dfn"": ""Speculative fiction"", ""/m/02xlf"": ""Fiction""}","Roy Tappen works for the Robinson Heath Nuclear Utilisation Technology Centre, a nuclear weapons facility in Britain. He fights bureaucracy while trying to use it for his purpose, which is to undo the potentially disastrous results of a practical joke gone wrong. Smuggling plutonium out of a nuclear research centre turns out to be surprisingly easy. The difficult part is smuggling it back in again without getting caught.",0
941838,Pnin,Vladimir Vladimirovich Nabokov,1957,"{""/m/02xlf"": ""Fiction"", ""/m/05hgj"": ""Novel""}","The book's eponymous protagonist, Timofey Pavlovich Pnin, is a Russian-born professor living in the United States. Pnin, a refugee in his 50s from both Communist Russia and what he calls the ""Hitler war"", is an assistant professor of Russian at fictional Waindell College, possibly modeled on Wellesley College or Cornell University, at both of which Nabokov himself taught. At Waindell, Pnin has settled down to an uncertain, untenured, but semi-respectable academic life, full of various tragicomic mishaps, misfortunes, and difficulties adjusting to American life and language. Characters in the book include his departmental supervisor, various professors and university staff, his landlord, his ex-wife, and her son. The book's seemingly unreliable narrator identifies himself as one 'Vladimir Vladimirovich N---' and bears similarities to Nabokov himself, such as his interest in lepidoptery and his landed-gentry Russian émigré past. Pnin is last glimpsed fleeing Waindell College, jobless, for an unknown destination.",0
944096,Digital Fortress,Dan Brown,1996,"{""/m/02n4kr"": ""Mystery"", ""/m/06n90"": ""Science Fiction"", ""/m/017rf8"": ""Techno-thriller"", ""/m/02xlf"": ""Fiction""}","When the United States National Security Agency's code-breaking supercomputer (TRANSLTR) encounters a new and complex code—Digital Fortress—that it cannot break, Commander Trevor Strathmore calls in Susan Fletcher, their head cryptographer, to crack it. She discovers that it was written by Ensei Tankado, a former NSA employee who became displeased with the NSA's intrusion into people's private lives. Tankado intends to auction the code's algorithm on his website and have his partner, ""NDAKOTA"", release it for free if he dies. Essentially holding the NSA hostage, the agency is determined to stop Digital Fortress from becoming a threat to national security. When Tankado does indeed die in Seville, of what appears to be a heart attack, Strathmore asks David Becker (Susan's fiancé) to travel to Seville and recover a ring that Tankado was wearing when he died. The ring is suspected to have the code that unlocks Digital Fortress. However, Becker soon discovers that Tankado gave the ring away immediately before his death. Each person he questions in the search for the ring is murdered by Hulohot, a mysterious assassin. Meanwhile, telephone calls between ""North Dakota"" and Numataka (chairman of a large computer company in Tokyo) reveal that North Dakota hired Hulohot to kill Tankado in order to gain access to the passcode on his ring and speed up the release of the algorithm. At the NSA, Fletcher's investigation leads her to believe that Greg Hale, a fellow NSA employee, is North Dakota. Phil Chartrukian, an NSA technician who is unaware of the Digital Fortress code breaking failure and believes Digital Fortress to be a virus, conducts his own investigation into whether Strathmore allowed Digital Fortress to bypass Gauntlet (NSA's virus/worm filter). However, Chartrukian is murdered in the sub-levels of TRANSLTR by an unknown assailant. Since Hale and Strathmore were both in the sub-levels, Fletcher assumes that Hale is the killer; however, Hale claims that he witnessed Strathmore killing Chartrukian. Chartrukian's death by falling off a balcony also damages TRANSLTR's cooling system. Hale holds Fletcher and Strathmore hostage to prevent himself from being arrested for the murder. It is then that Hale explains that the e-mail he supposedly ""received"" from Tankado was actually in his inbox because he was snooping on Strathmore, who was also watching Tankado's e-mail account. After the encounter, Hale's name is cleared when Fletcher discovers through a tracer that North Dakota and Ensei Tankado are actually the same person, as ""NDAKOTA"" is an anagram of ""Tankado"". Strathmore's role as the primary antagonist is revealed when Strathmore fatally shoots Hale, and arranges it to appear as a suicide. Susan later discovers through Strathmore's pager that he is the one who hired Hulohot. Becker later kills Hulohot in a violent confrontation. Chapters told from Strathmore's perspective reveal his motives. By hiring Hulohot to kill Tankado, having Becker recover his ring, and at the same time arranging for Hulohot to kill him, would help facilitate a romantic relationship with Fletcher, regaining his lost honor, and enable him to unlock Digital Fortress. By making phone calls to Numataka impersonating as ""North Dakota"", he thought he could partner with Numataka Corporation to make a Digital Fortress chip equipped with his own backdoor Trojan so that the NSA can spy on every computer equipped with these chips. However, Strathmore was unaware that Digital Fortress is actually a computer worm once unlocked, ""eating away"" at the NSA databank's security and allowing ""any third-grader with a modem"" to look at government secrets. When TRANSLTR overheats, Strathmore commits suicide by standing next to the machine as it explodes. The worm eventually gets into the database, but soon after Fletcher figures out the password, and is able to terminate the worm before hackers can get any significant data. The NSA allows Becker to return to the United States, reuniting him with Fletcher. At last it is revealed that Numataka is Ensei Tankado's father. Numataka left Tankado the day he was born since Tankado was a deformed child.",0
944932,Slow River,Nicola Griffith,1995,"{""/m/06n90"": ""Science Fiction"", ""/m/014dfn"": ""Speculative fiction"", ""/m/02xlf"": ""Fiction""}","Lore Van de Oest was born in one of the mightiest families on earth. However, she suddenly loses everything.",0
946564,Mr. Adam,Pat Frank,UNK,UNK,"After a nuclear power plant in Mississippi explodes, it's soon realized that a previously unknown form of radiation is released. The radiation has caused all men on Earth to become sterile, even boys that are still inside the mother's womb. However, ten months after the explosion in Mississippi, a doctor delivers a perfectly healthy baby girl. It's soon discovered that the child's father, who has the surname Adam was more than a mile under the surface of Earth inside an old silver and lead mine during the explosion. It would appear that this Mr. Adam is humanity's only hope to stave off extinction.",0
946596,Artemis Fowl: The Opal Deception,Eoin Colfer,2005-04-30,"{""/m/0dwly"": ""Children's literature"", ""/m/01hmnh"": ""Fantasy""}","The book begins with the pixie Opal Koboi faking a coma inside an asylum to avoid incarceration by the Lower Elements Police (LEP) after her failed rebellion and attempt at world domination (which took place in Artemis Fowl: The Arctic Incident). Opal Koboi, who was under 24-hour surveillance and had DNA tests done every 4 hours by the LEP to ensure that Opal was actually in the asylum cell, with help from the Brill Brothers manages to replace herself with a clone, which is identical to herself (the only difference being that the clone is brain dead). Opal lures Commander Julius Root and Captain Holly Short into a lava chute alone. Koboi then kills Commander Root of the LEP (framing Captain Holly Short as the murderer), and launches a bio-bomb at Artemis Fowl, which fails to kill him and his bodyguard Domovoi Butler. Opal then proceeds with her plan to help Italian environmentalist Giovanni Zito send a probe downward, which, at least in Koboi's plan, will cause the humans to find the fairies and start an inter-species war, leading to fairy genocide. Artemis Fowl was mindwiped in the third book of the series, Artemis Fowl: The Eternity Code and has no memory of meeting the fairies. This has also caused him to revert back to his former self- the one cruel enough to kidnap a fairy. But he has a conscience, the difference is he chooses not to listen to it. Artemis is rescued from the scene of the bio-bomb attack by Holly. She tells him who she is, in hopes to ignite his memory. He does not regain his memories of the past adventures, but agrees to help her for a fee. They are then recaptured by Koboi and thrown into a troll-infested abandoned fairy theme park known as the Eleven Wonders of the Human World (containing scale-models not only of the Seven Wonders of the Ancient World but also the additions of Abu Simbel, Borobodur, Rapa Nui and the Throne Hall at Persepolis). After a desperate battle against the troll hordes on a model of the Temple of Artemis at Ephesus, they are rescued by former criminal Mulch Diggums and Butler. Holly and Artemis become friends ""bonded by trauma"" and Artemis says he feels that he doesn't need money to help a friend. After being rescued, Mulch gives Artemis the disk that had been passed off as a gold medallion, which Butler was given earlier in the book. Artemis views the disk and regains his memories. He is overcome with guilt of what he had done to the fairies but to Holly the most and for the first time, he apologises for kidnapping her. He realises that Holly, Butler, and Mulch were the only friends he had. Together, the four friends take on Opal Koboi, knowing that they are the only ones that know she's escaped. It becomes a more difficult task with the LEP on their tail, who still thinks Holly is the one who killed the Commander. The new Commander refuses to believe anything, despite the fact that everyone knows Root was like a father to Holly. Afterward, the story follows the struggle over the probe, which is closing in on the E7 chute. The probe eventually misses the chute, Koboi is detained by the LEP, and Holly is cleared of all charges over Commander Root's murder. However, she is frustrated by Commander Root's replacement, Ark Sool, so she resigns and starts a private investigation firm with Mulch Diggums. It is also apparent that Artemis has had a change of heart, as he anonymously donates the famed painting The Fairy Thief, which he had stolen directly before Koboi's bio-bomb attack, to the Louvre museum.",0
947323,The Paper Chase,"John Jay Osborn, Jr.",UNK,UNK,"The story centers on Hart, a young law student from Minnesota who attends Harvard Law School and becomes obsessed with one of his teachers, Professor Charles W. Kingsfield, Jr. Hart becomes an expert on Kingsfield's subject, contracts; he reads everything about the subject, including all of Kingsfield's papers, most of which are not on the reading list. He goes so far as to break into the law library to read Kingsfield's original law school notes. Hart becomes such an expert that Kingsfield asks him to contribute to a paper. At the same time, he begins a relationship with Susan Field, who turns out to be Kingsfield's daughter. Susan stands aloof from the law-school rat-race and dismisses all the things Hart cares about most. At the end of the term, Professor Kingsfield really means something to his students, but he still does not know their names; indeed, he appears to be unable to smile. For him, the class is only a group of people, the students simply names on a paper. He does not even recognize Hart after several encounters and classroom debates. After one incident, wherein Kingsfield asks Hart to leave the class, Hart says in front of the lecture hall, ""You are a son of a bitch, Kingsfield,"" to which Kingsfield merely responded with ""Mr. Hart! That is the most intelligent thing you've said all day. You may take your seat."" After much effort preparing for the final exam, Hart's grade is delivered to him, but he simply makes a paper airplane out of his final report card, and sends it sailing into the Atlantic Ocean without looking at it.",0
948759,Prague: A Novel,Arthur Phillips,2002,"{""/m/0hwxm"": ""Historical novel""}","Prague opens on the afternoon of May 25, 1990 with five North American expatriates living in the city of Budapest. The expatriates are, for the most part, optimistic about their prospects in the Central European city. John Price seeks a reconciliation with his older brother, Scott, who has come to Budapest to separate himself from his earlier life in the United States. Emily Oliver, an idealistic worker at the American Embassy, hopes to begin a distinguished diplomatic career. Mark Payton, a Canadian researching a history of nostalgia, relishes the chance to be immersed in a place with interesting history. Only Charles Gábor, a Hungarian-American venture capitalist who resents his co-workers and has contempt for his fellow Magyars, displays any pessimism at the story's outset. The five young expatriates enjoy the nightlife and new opportunities in the historic city. John is instantly attracted to Emily, and plots to win her love, but she ignores him. He finds a job as a columnist for an English-language newspaper, BudapesToday. Still a virgin at the age of 24, he is initiated by his co-worker Karen, but finds the experience to be quite anticlimactic. He later commits ""fradultery"" with his brother's future wife, Mária. Part II presents the complex history of the Horváth Kiadó (Horvath Press), a family-run publishing company – which also serves as a history of Budapest from the early nineteenth century to the present day. Presently, the head of the publishing house is Imre Horváth, who until recently had been exiled in Vienna. During the Communist regime, the Horváth Kiadó was a state-owned business; after the fall of communism, it is due to be privatized. Imre seeks an investment from Charles' venture capital firm in order to buy the press's assets and restart it in Budapest. John frequently fraternizes with an elderly jazz bar pianist named Nádja. He is entranced by the romantic stories she tells of her past, but his friends are less than convinced of their veracity. In particular, John is dismayed by Emily's dismissal of Nádja as an ""amazing liar"". He is also dismayed that Emily pulls away when he tries to kiss her. John becomes involved with Nicky, a photographer and artist who wants a physical, but not an emotional, relationship. Charles' firm rejects his proposal to fund the Horváth Kiadó. With the help of John, who writes supportive newspaper columns and serves as Charles' aide, Charles secures independent funding for this venture. He resigns from his firm and becomes a partner in the new Horváth Kiadó. Mark Payton's research into nostalgia becomes a personal obsession. He takes an inordinate interest in gramophone music and riding in a funicular carriage. He later becomes preoccupied with the contemporary Gulf War and its continuous coverage on CNN. In September 1990, Mark leaves Budapest suddenly, due to his declining mental health. In autumn 1990, Scott marries Mária and moves to Romania with her, telling John that he never wants to see him again. John continues to desire Emily and be jealous of other men she talks to. Charles and John learn that other parties may want to bid for the Horváth Kiadó assets. In January 1991, Imre Horváth suffers a stroke and goes into a coma. Charles Gábor effectively becomes sole head of the publishing company. He accepts a takeover bid by a multinational media corporation, headed by the Australian billionaire Hubert Melchior (a parody of Rupert Murdoch and News Corporation). Horváth recovers, but not in time to prevent his historic publishing firm from being absorbed into the multinational publishing empire. In March, John says that he loves Emily, even though he knows she is a ""spy."" The next day, John is fired from his job for having accused an embassy employee of being a spy. Emily, who was having a lesbian relationship with Nicky, leaves the city to escape the accusation. Charles returns to America. Finally, John leaves Budapest as well, traveling by train to the more promising city of Prague.",0
949331,Cloudstreet,Tim Winton,1991-05,"{""/m/02xlf"": ""Fiction"", ""/m/05hgj"": ""Novel""}","Precipitated by separate personal tragedies, two families flee their rural livings to share a ""great continent of a house"", Cloudstreet, in the Perth suburb of West Leederville. The two families are contrasts to each other; the Lambs find meaning in industry and in God’s grace; the Pickles, in luck. The Lambs’ God is a maker of miracles; the Pickles’ God is the ‘Shifty Shadow’ of fate. Though initially resistant to each other, their search and journey for meaning in life concludes with the uniting of the two families with many characters citing this as the most important aspect of their lives. As a novel, Cloudstreet is tightly structured, opening and ending with a shared celebratory family picnic - a joyous occasion which, ironically, is also the scene of Fish’s long sought-after death or return to the water. The novel is narrated effectively by flashback ""in the seconds it takes to die"" by Fish Lamb, or the 'spiritual' omniscient Fish Lamb, free of his restricting retarded state. As such the novel gives a voice to social minorities, the Australian working class and the disabled. (However, its treatment of Fish Lamb as somebody incomplete in his physical existence may also be interpreted as demeaning towards the intellectually disabled, depending on the reading position adopted.)",0
