id,title,author,published_date,categories,summary,page_count
2839535,Asterix and Son,UNK,UNK,UNK,"A baby boy inexplicably appears at the porch of Asterix's house one morning. While taking care of him - a horrifying task for two single men - Asterix and Obelix along with Dogmatix, set out to discover who left the baby there and who are its parents, following a lead left with the baby's wrappings. Curiously, they find that the Romans seem to be very inquisitive about the child, too - and all in the interests of Marcus Junius Brutus, Caesar's adopted son. Asterix finds out that some people suspect the baby is his illegitimate child, causing shock for him. As the Romans are using deceptive methods to try getting the baby, it is decided the baby needs protection from the Romans. While in the village, the baby twice drinks a great deal of magic potion (the second time, he falls in a nearly-empty cauldron, prompting Obelix to remark that he 'really take[s] to [the baby]), after which he becomes a ""terrible little monster"" to every door in the neighborhood and every spy sent to capture him, including a legionnary disguised as a peddlar selling rattles, and a centurion disguised as a nursemaid, driving both up the centurion's tent pole. Finally, Brutus, who is keeping his presence secret from Caesar, takes matters into his own hands, attacking the village with his own legions and burning it to the ground, while he himself goes after the baby. He demands the baby from the Women, who think he still has superhuman strength, but it turns out the potion has worn off, and Brutus manages to kidnap him temporarily - with the help of the ever-present pirates -, but soon Asterix and Obelix catch up with him and give him a taste of why they are considered the terror of the Romans, while the Pirates leap overboard. Just as the Gauls try to make Brutus reveal the truth, the unexpected arrivals by Caesar, and then Cleopatra resolve the child's mystery; he is none other than Ptolemy XV Caesarion (born 23 June 47 BC), the son of Julius Caesar and Cleopatra VII of Egypt. Brutus had been attempting to kill the baby while Caesar was away on campaign so that he could guarantee his accession to the throne, so Cleopatra had the boy sent to the village to protect him on the grounds that the village was the one place she could guarantee the child's safety from Brutus's soldiers. Brutus is sent away by Caesar. The story ends with the banquet on Cleopatra's royal barge where even Caesar joins in, having promised to rebuild the village in thanks for the Gauls' efforts to protect his son.",0
2839541,Asterix in Belgium,UNK,UNK,UNK,"After fighting the Belgians in the northern part of Gaul, Caesar states that they are the bravest enemies he's ever faced (historically this statement really was made by Caesar). His soldiers agree with him, to the point when they consider being posted to the camps outside Asterix' village as a period of leave. Chief Vitalstatistix is aghast at the idea that his village, which has been the terror of the Romans for years, is now looked upon as relatively harmless. He is further outraged when he hears of Caesar's remarks. He claims that his villagers are in fact the bravest men of Gaul, and travels to Belgium to prove his point. A reluctant Asterix and Obelix go with him after Getafix tells them not doing so could make the story come to a sticky end. After crossing the border, they encounter a village of Belgians who rely on brute strength (and a regular diet of meat and beer) to successfully scare off Caesar's troops. These Belgians are led by two chiefs, Beefix and Brawnix (though Brawnix comes across mainly as a second-in-command). To prove that the Gauls are the bravest, Vitalstatistix proposes a competition. The contest consists of raiding and destroying Roman camps on either side of the village. The Belgians and Gauls destroy the camps, telling the soldiers who they are. By the end they have destroyed an equal number of camps, and word is sent to Rome. Meanwhile the Pirate's ship is wrecked when Obelix throws a boulder catapulted at him too high, causing the Captain to complain, saying he and his men are neutrals. Word is sent to Rome, though the facts are exaggerated, talking about vast hordes of Gauls, a savage pack of hounds, and a mysterious fleet of neutrals. Caesar goes to Belgium himself to restore order unaware of the fact that the whole thing is to get him to decide once and for all which side is the bravest. Outraged at being reduced, in the eyes of the Gauls and Belgians, to a mere umpire (as opposed to emperor), Caesar furiously declares that he will meet them in battle. The Belgians tell the Gauls to stay away as it is now a purely local issue. Through the use of catapults the Romans get their way in the early stages of the battle. But then the three Gauls, and their magic potion, join the Belgians after they thwart an attempted attack on the Belgian lines from behind through a forest, and, by combining their efforts, the Gauls are the final victors. Caesar decides to leave for Rome. On his way he comes across the Gaulish and Belgian chiefs. Caesar proudly announces that he will lay down his life, but they say that they are there to remind him of their competition and want to know who is the bravest. Caesar angrily declares them simply all crazy and leaves. Vitalstatistix and Beefix laugh the incident off. They have to face the fact that they are all equally brave and, after a victory feast, part on good terms.",0
2839568,Obelix and Co.,UNK,UNK,UNK,"After Obelix single-handedly defeats the newly-arrived Romans from the camp of Totorum (as a birthday present), Caesar once again ponders with any possibility to take down the rebellious Gaulish village. A young Roman know-it-all called Preposterus, who has been studying economics, proposes to integrate the Gauls into the stream of capitalism, pointing out that Caesar's once-brilliant officers are now corrupt, venal politicians in Rome. For that purpose, he moves into the camp of Totorum and proceeds to make the acquaintance of Obelix, who is carrying a menhir through the forest. Preposterus claims to be a menhir buyer, and buys every menhir Obelix can make, on the pretext that a rich man is a powerful man. Obelix begins by making and delivering a single menhir a day, but when Preposterus demands more menhirs in exchange for more money, Obelix hires other villagers to help him make menhirs, and an equal number to hunt boar for him and his sculptors. Although he tries to include Asterix in this, Asterix will have no part of Obelix's growing corporation. This corporation later includes a cart-and-oxen from a travelling salesman with which to deliver half-a-dozen menhirs to the camp in one go. Obelix's workload also means that he neglects Dogmatix. Obelix's increasing wealth causes problems for the village men, whose wives reproach them for not matching his success. Obelix himself shows off this wealth by wearing ostentatious clothes, hiring Mrs Geriatrix to be his tailor. Deciding that the time has come to teach Obelix a lesson, Asterix encourages the other villagers to start building menhirs, selling them to the Romans and putting their subsequent wealth on display. Getafix agrees to dole out magic potion for anyone who makes menhirs, in spite of nobody knowing what menhirs are for. Because the menhir makers can no longer spend time hunting wild boar, they hire the other half of the male village populace to do it for them. Only Asterix, Getafix, Cacofonix and Vitalstatistix are not engaged in the new economic system. Asterix estimates that it is only a matter of time before things come to a head, explode and get back to normal. With Preposterus buying up every menhir at ever-increasing prices, it is not long before the camp of Totorum is filled with menhirs, and Caesar's finances heavily in debt. This abundance of rock reaches Rome where Preposterus sells them to the patricians. He does this by making out that a menhir is a symbol of great wealth and high rank, therefore prompting insecure people to buy them. But before he can go further, a Roman businessman jumps onto the bandwagon and sells Roman menhirs at a cheaper rate. Anxious to sell off his stock of Gaulish menhirs and recover the money that was paid to the Gauls for them, Caesar imposes a ban on the sale of Roman menhirs. In protest the unemployed Roman menhir makers (actually slaves) block the Roman roads with menhirs. A slaveowner meets with Caesar and demands a lift of the ban saying that his employees are out of work because of the ban. A confused Caesar points out that it's ridiculous because the ""employees"" are slaves. The slaveowner replies: Exactly! The right to work is the only right a slave has. He must not be deprived of it! The ban is lifted in the face of a possible civil conflict and Preposterus suggests a price war to deal with the competition. But then menhirs from other countries such as Egypt and Greece start pouring in. Even the pirates are faced with the growing Menhir Crisis since (as revealed in the French version) every ship they attack contains nothing but menhirs and taking these stones away as loot causes their own ship to sink. Soon, even free menhirs are unwanted. Facing financial ruin, an angry Caesar then orders Preposterus back to Gaul to stop the menhir trade before it goes one stone further. Preposterus fears that the Gauls will not take this news lightly but Caesar tells him that if he does not comply with the order, he will find himself thrown to the lions in the arena. The Gaulish village meanwhile is unaffected by the Menhir Crisis since the centurion at the local camp has continued buying their menhirs in order to keep the peace. Obelix however is quite miserable: he has had too much of this tomfoolery with menhirs, markets, money, meat and mayhem, which he never understood at all. All the other menhir makers are now wearing garish clothes and he is demoralised. He wants to go back to the easy days of having fun with Asterix and Dogmatix and eating (an obvious comment on the dullness of corporate life). Asterix agrees to go hunting boar with him if he changes back into his old clothes, rather than the fancy ones he has been wearing. Asterix and Getafix then exchange winks: the next stage of the plan is approaching. Preposterus returns to Gaul and announces that he is not buying another menhir if his life depends on it (as it does). He thus turns down Unhygienix's delivery of menhirs. Although Fulliautomatix is apt to blame this on the fact that Unhygenix's menhirs have an odour of rotten fish, it becomes clear that even menhirs made by a cynical blacksmith do not suffice. When the men of the village notice that Obelix has himself called a halt, they criticize him on the wrongful grounds that he knew that the Romans were no longer buying menhirs and did not tell them. Annoyed by these accusations, Obelix starts a fight between the villagers. Asterix and Getafix are glad to see their friends back to their old ways. Asterix then ends the fight with the suggestion that they turn their anger on the Romans, since they started the whole thing. In gratitude for their earlier present, Obelix for once takes no part in the fight, allowing the other villagers to attack the Romans on their own. The Roman camp is wrecked, and so is Preposterus. Asterix wants to know what his neighbours will do with all their money. Getafix tells him that due to certain events in Rome the sestertius has devalued; in other words, the villagers are now stone-broke. But they hold a traditional banquet to celebrate the return to normality and a menhir proves useful in literally holding Cacofonix down.",0
2839582,Asterix and the Great Crossing,UNK,UNK,UNK,"Unhygienix is out of fresh fish (as always), which is carted overland in ox-drawn carts from Lutetia (Paris), and causing it to get unhealthy on the long trip, and Getafix says that he needs some for his potion. Asterix and Obelix borrow a boat from Geriatrix and go fishing. After a storm, they get lost, but despite Obelix's concerns, they do not reach the edge of the world; instead- following a brief encounter with the pirates-, they arrive on an island (which is actually North America) with delicious birds that the Gauls call ""gobblers"" (turkeys), bears and ""Romans"" with strange facial paintings (Indians). Soon they earn the ""Romans""' affection, but they decide to leave after the ""centurion"" chooses Obelix as his rather rubenesque daughter's fiancé. They go to a small island. Seeing a boat coming, Asterix climbs a cairn of rocks holding a torch and a book like the Statue of Liberty to attract it. The crew are anachronistic Vikings (with names like Herendethelessen, Steptøånssen, Nøgøødreåssen, Håråldwilssen, Irmgard, Firegård, and their Great Dane, Huntingseåssen) - who managed a Pre-Columbian trans-oceanic contact and take the Gauls, who they thought to be the local natives, to their homeland as proof that there are continents beyond Europe. Their mutual desperation, the Gauls wanting to return home, and the Vikings' eagerness to prove their story of a new world, results in a trip back to Europe to the Vikings' homeland. The Vikings' chief, Ødiuscomparissen, greets them and is skeptical of their stories, until he sees the Gauls. They plan a celebration, then attempt to sacrifice the ""natives"", much to the chagrin of the other Vikings (""Why? They haven't done anything!""). Before this can be carried out, a Gaulish prisoner called Catastrofix, who can understand both Gallic and Norse, stirs up Ødiuscomparissen's suspicion that Herendethelessen is a liar, causing a fight between the Vikings with the assumption that Herendethelessen has simply gone to Gaul rather than to a new world. Meanwhile, the Gauls escape. This escape is conducive to their original purpose, since Catastrofix is a fisherman and hence able to procure some fish for the magic potion. Unhygenix, however, prefers the scent of his own stock; a preference that explains why his product is such a delicate and filthy topic.",0
2839587,Asterix and Caesar's Gift,UNK,UNK,UNK,"Having completed twenty years of service in the Roman Army, Veteran legionaries Tremensdelirious and Egganlettus await their honesta missio (Latin:honorary discharge) for the morning but that night Tremensdelirious expresses his opinion on Julius Caesar in his drunken state and gets arrested. The following morning Caesar is informed of Tremensdelirious's mishap the night before. Caesar suggests playing a practical joke. He will receive his honorary discharge after all but Caesar has a ""special"" gift for him. In the ceremony, Egganlettus receives a share in Nicaea and the still drunk Tremensdelirious receives his special gift: a Gaulish village in Armorica, the only territory of Gaul not yet conquered by the Roman legions. The village is inhabited by Asterix and his friends. Tremensdelirious sees little merit in a gift he cannot drink and attempts to sell his land share immediately, but Egglanlettus refuses, wanting to grow salad in Nicaea. A few days later Tremensdelirious is drunk again and is unable to pay the innkeeper. So, he offers his land share. The innkeeper, Orthapedix agrees to the bargain. Soon Orthapedix, his wife Angina and Influenza, their daughter, arrive at ""their"" new village only to be disappointed to find it already inhabited but hope the seal of Julius Caesar will convince the villagers to leave. They request a meeting with Vitalstatistix and state their claim. The village chief bursts into laughter and is soon joined by Asterix, Obelix and a number of villagers. Vitalstatistix dismisses their claim as absurd. Angina berates her husband for selling their inn to travel to Armorica. Vitalstatistix, decides to offer Orthapedix a chance to get out of his situation and informs him that their village has no inn and offers him a building for him to use next to the fish-stall. Obelix helps the new family and soon has a crush on Influenza. Geriatrix doesn't like Orthapedix, saying he isn't against Foreigners but he doesn't like ones that don't come from the Village. The opening night of the new inn, the villagers are invited to attend but the merriment seems to end when Vitalstatistix and his wife Impedimenta arrive. Impedimenta and Angina greet each other coldly and soon the two women enter an argument about who owns the village. Meanwhile a comment by Impedimenta about the smell of fish has set off Unhygienix and Fulliautomatix's rivalry. A fight starts with all the villagers present. The morning finds the inn abandoned except for the bruised Orthapedix, a sobbing Angina and Influenza. Orthapedix is ready to quit and return to Lutetia, but Angina wants to have revenge on Impedimenta and makes a claim to the leadership of the village on behalf of her husband. Vitalstatistix is shocked to have his long-held position challenged but soon has Cacofonix obtain an opinion poll of the villagers and the results are disappointing for Vitalstatistix. Soon both candidates and their families search for supporters by offering their markedly insincere voice of support to the individual concerns of each villager. The villagers become very involved in the political race. Geriatrix originally supports Vitalstatistix due to his distrust of Orthapedix, but then thinks the Chief is weak and tries to stand for Chief himself. Asterix, however, becomes worried that internal conflict could benefit the Romans. Meanwhile, Tremensdelirious arrives at the village to visit Orthapedix and explains that since their last meeting he unsuccessfully tried all kinds of trade. Thus he wants to claim his land share saying that veterans are not allowed to sell their shares to Gauls. The family attempts to throw him out but he draws the sword on the family. Meanwhile Astrix arrives and the two proceed in a demonstration of their swordsmanship. Asterix wins. Influenza is impressed by the diminutive Gaulish warrior and Tremensdelirious leaves. Tremensdelirious visits one of the four Roman camps surrounding the village and finds his old friend Egganlettus serving as an aide-de-camp under the local centurion, as he found retirement boring and signed up for another 20 years. With his support Tremensdelirious makes an official request on the centurion to restore a stolen land share to a veteran soldier. The centurion is rather reluctant to face the Gauls but the veterans threaten to report him to Caesar who would not like the Gauls taking advantage of his veterans. He agrees to prepare a military attack but Egganlettus has clearly fallen out of favor and his rank is reduced to Legionary second class. The following day, Influenza expresses her admiration to Asterix. A jealous Obelix feels betrayed by both his best friend and his love interest. Asterix attempts to express his concerns about the mysterious Roman from the previous day but it falls on deaf ears. Hence, Asterix decides to investigate the forest area himself and soon finds that in one of the Roman camps they are preparing siege weapons for an extended campaign. He listens to their plans but lacks the magic potion needed to end their preparations. The Romans see him, but are afraid to attack, enabling him to escape. However his escape means the Romans become convinced that the Gauls can no longer resist the Romans, thus Roman morale rises. Egganlettus is given his position back. Asterix returns to the village and attempts to sound the alarm, but the village pays no attention to him. Everybody is gathered to witness the public debate between Vitalstatistix and Orthapedix, with Cacofonix serving as a referee. When Vitalstatisix questions the impartiality of Cacofonix his allotted time is ended abruptly. While the debate is in progress, they are interrupted by rocks thrown into the village by the Roman catapults outside. Vitalstatistix begs for Getafix to give them magic potion but the druid refuses even though he must know the village is under attack. He is just too disgusted by the Gaulish in-fighting. There is a change of attitude in Orthapedix and Vitalstatistix and they stop fighting each other. Getafix approves of this and agrees to help them. Obelix single-handedly attacks the Romans and delays their attempts to enter the village. His efforts provide enough time for the potion to be prepared. The rival factions of villagers combine their efforts against the Romans and counterattack, demolishing the war machines. Orthapedix himself confronts Tremensdelirious and returns the stone tablet that claims ownership of the village and smashes it on Tremensdelirious' head. Egganlettus realizes his friend's treacherous nature and is furious and follows this up with a blow with a stick. This results on Tremensdelirious falling into unconsciousness with a very pronounced lump on the head. Both Gauls and Romans seem to want nothing more to do with him and his body is left on the field. The centurion has Egganlettus demoted to second-class legionary and assigns him to clean up the remains of the war machines with a mere broom. The Gauls are reconciled following their victory. A much more confident Orthapedix befriends his former rival who says he will make a good Chief, but he decides to withdraw his claim for leadership and return to Lutetia. Angina is about to object, but Orthapedix angrily puts her in her place, making it clear that the decision has been made and there is no room for argument. Now he has something to brag about to his brother-in-law. Impedimenta and Angina have nothing left to fight about. They exchange recipes and addresses of their relatives in Lutetia. Obelix mourns the loss of Influenza but is reconciled with Asterix, as they are no longer rival suitors. There is a victory celebration at night and everyone takes part. The narration claims that the events happened long ago, when such matters were not considered so important.",0
