id,title,author,published_date,categories,summary,page_count
828307,The Lathe of Heaven,Ursula K. Le Guin,1971,"{""/m/06n90"": ""Science Fiction"", ""/m/014dfn"": ""Speculative fiction"", ""/m/01hmnh"": ""Fantasy"", ""/m/02xlf"": ""Fiction"", ""/m/026ny"": ""Dystopia""}","The book is set in Portland, Oregon in the year 2002. Portland has three million inhabitants and continuous rain. It is deprived enough for the poorer inhabitants to have kwashiorkor, or protein deprivation. The culture is much the same as the 1970s in the United States, though impoverished. There is also a massive war in the Middle East, with Egypt and Israel allied against Iran. George Orr, a draftsman, has long been abusing drugs to prevent himself from having ""effective"" dreams, which retroactively change reality. After having one of these dreams, the new reality is the only reality for everyone else, but George retains memory of the previous reality. Under threat of being placed in an asylum, Orr is forced to undergo ""voluntary"" psychiatric care for his drug abuse. George begins attending therapy sessions with an ambitious psychiatrist and sleep researcher named William Haber. Orr claims that he has the power to dream ""effectively"" and Haber, gradually coming to believe it, seeks to use George's power to change the world. His experiments with a biofeedback/EEG machine, nicknamed the Augmentor, enhance Orr's abilities and produce a series of increasingly intolerable alternative worlds, based on an assortment of utopian (and dystopian) premises familiar from other science fiction works: * When Haber directs George to dream a world without racism, the skin of everyone on the planet becomes a uniform light gray. * An attempt to solve the problem of overpopulation proves disastrous when George dreams a devastating plague which wipes out much of humanity and gives the current world a population of one billion rather than seven billion. * George attempts to dream into existence ""peace on Earth"" – resulting in an alien invasion of the Moon which unites all the nations of Earth against the threat. Each effective dream gives Haber more wealth and status, until late in the book where he is effectively ruler of the world. Orr's economic status also improves, but he is unhappy with Haber's meddling and just wants to let things be. Increasingly frightened by Haber's lust for power and delusions of Godhood, Orr seeks out a lawyer named Heather to represent him against Haber. Heather is present at one therapeutic session, and comes to understand George's situation. He falls in love with Heather, and even marries her in one reality; however, he is unsuccessful in getting out of therapy. George tells Heather that the ""real world"" had been destroyed in a nuclear war in April 1998. George dreamed it back into existence as he lay dying in the ruins. He doubts the reality of what now exists, hence his fear of Haber's efforts to improve it. Heather has seen one change of reality and has a multiple memory – remembering that her pilot husband either died early in the Middle East War or else died just before the truce that ended the war in the face of the alien threat. She tries to help George but also tries to improve the world, saying that the aliens should no longer be on the Moon. George dreams this, but the result is that they have invaded the Earth instead. In the resultant fighting, Mount Hood is bombed and the dormant volcano starts to erupt again. They go back to Haber, who has George dream another dream in which the aliens are actually peaceful. For a time there is stability, but Haber goes on changing things. His suggestion that George dream away racism results in everyone becoming gray; Heather, whose parents were of different races, never existed in this new reality. George manages to dream up a gray version of her, married to him and with a less prickly personality. Mount Hood continues to erupt and he fears the world is losing coherence. Orr has a conversation with one of the aliens, suddenly comes to understand his situation, and thereby gains the courage to stand up to Haber. Haber, frustrated with Orr's resistance, uses what he has learned from studying George's brain during his sessions of hypnosis and controlled dreaming, and decides to take on effective dreaming himself. Haber's first effective dream represents a significant break with the realities created by Orr, and threatens to destroy reality altogether. Orr is able to shut off the Augmentor – even as coherent existence is dissolving into undifferentiated chaos – reaching the ""off"" switch through pure force of will. The world is saved, but random bits of the various recent realities are now jumbled together. Haber's mind is left broken. Heather, presumably her original self, exists, though with only a slight memory of George.",0
833593,The Lost World,Arthur Conan Doyle,1912,"{""/m/06n90"": ""Science Fiction"", ""/m/08g5mv"": ""Lost World"", ""/m/014dfn"": ""Speculative fiction"", ""/m/01gw42"": ""Scientific romance""}","Edward Malone, a reporter for the Daily Gazette, goes to his news editor, McArdle, to procure a dangerous and adventurous mission in order to impress the woman he loves, Gladys Hungerton. He is sent to interview Professor George Edward Challenger, who has assaulted four or five other journalists, to determine if his claims about his trip to South America are true. After assaulting Malone, Challenger reveals his discovery of dinosaurs in South America. Having been ridiculed for years, he invites Malone on a trip to prove his story, along with Professor Summerlee, another scientist qualified to examine any evidence, and Lord John Roxton, an adventurer who knows the Amazon and several years prior to the events of the book helped end slavery by robber barons in South America. They reach the plateau with the aid of Indian guides, who are superstitiously scared of the area. One of these Indians, Gomez, is the brother of a man that Roxton killed the last time he was in South America. When the expedition manages to get onto the plateau, Gomez destroys their bridge, trapping them. Their ""devoted negro"" Zambo remains at the base, but is unable to prevent the rest of the Indians from leaving. Deciding to investigate the lost world, they are attacked by pterodactyls in a swamp, and Roxton finds some blue clay in which he takes a great interest. After exploring the plateau and having some adventures in which the expedition narrowly escapes being killed by dinosaurs, Challenger, Summerlee, and Roxton are captured by a race of ape-men. While in the ape-men's village, they find out that there is also a tribe of humans (calling themselves Accala) inhabiting the other side of the plateau, with whom the ape-men (called Doda by the Accala) are at war. Roxton manages to escape and team up with Malone to mount a rescue. They arrive just in time to prevent the execution of one of the professors and several other humans, who take them to the human tribe. With their help, they defeat the ape-men, taking control of the whole plateau. After witnessing the power of their guns, the human tribe does not want the expedition to leave, and tries to keep them on the plateau. However the team finally discovers a tunnel that leads to the outside, where they meet up with Zambo and a large rescue party. Upon returning to England, they present their report which include pictures and a newspaper report by Edward, which many dismiss as they had Challenger's original story. Having planned ahead, Challenger shows them a live pterodactyl as proof, which then escapes and flies out into the Atlantic ocean. When the four of them have dinner, Roxton shows them why he was so interested in the blue clay. It contains diamonds, about £200,000 worth, to be split between them. Challenger plans to open a private museum, Summerlee plans to retire and categorize fossils, and Roxton plans to go back to the lost world. Malone returns to his love, Gladys, only to find that she had married a clerk while he was away. With nothing keeping him in London, he volunteers to be part of Roxton's second trip.",0
833834,Alexander's Bridge,Willa Cather,1912,"{""/m/02xlf"": ""Fiction"", ""/m/05hgj"": ""Novel""}","Professor Wilson arrives at the Alexanders' house in Boston, after Mr Alexander has talked him into attending a Congress of Psychologists there. He is greeted by Mrs Alexander; later her husband comes home and they have a talk; his wife plays the piano for them. The next day, she tells him how she met her husband through her aunt. In London, Bartley Alexander meets with Maurice Mainhall to see a play starring Hilda Burgoyne, an erstwhile lover of his. Back in his hotel room, he thinks back to how he broke up with her in a letter after he met Winifred in Canada. Later, he walks to her house to see where she lives and reminisces about his youth. At a party at Lady Warford's, he talks to her after many years apart and she says she has been reading in the newspapers about his success with bridges in Japan and Canada. Later, he goes to another party also held by Lady Warford. The following Thursday, he takes Hilda to dinner and they reminisce about Madame Anger and Angel, and a beggar they had seen in the street once. He asks her to sing for him and she asks if he will let her love him. On Christmas Eve, the Alexanders are getting ready for the Christmas dinner, and Bartley tells Wilson he is in trouble with the bridge in Canada. Later, he gives his wife pearl earrings. On New Year's Day, Alexander is getting ready to leave for London again. Later, on the ship, he battles with sharp gales and goes into a bar, where he gambles at bridge. Once in London, Bartley visits Hilda and tells her he cannot go on having two relationships; she must forget about him and leave him alone. She is distressed. The day before he is due to return to America however, he takes her out to dinner. Later, Hugh MacConnell walks Hilda back to her house on a foggy day, and she says she isn't attracted to him because they are just close friends. Back in her house, she receives a letter from Bartley, saying he is going mad away from her. This prompts her to visit him in America to tell him she will marry another man and thence be bound to someone else; he doesn't like the idea. They spend one last evening together. Soon after, Bartley is called to Canada by Philip Horton to inspect the bridge. Bartley discovers that one of the lower chords of the bridge was failing, compromising the structural integrity of the entire bridge. Horton was afraid to halt construction, but had first attempted to contact Bartley even earlier - the very day Bartley was with Hilda. As Bartley is on the bridge stopping the work crews, the bridge collapses, killing many of the workers. Bartley's body is recovered the next day and taken to Horton's house. Winifred comes back to look after the dead body. Finally, Wilson visits Hilda. The latter expresses her jealousy over Winifred, but Wilson reminds her that she will not live again, she will be haunted by her husband's death. Hilda concludes that she will be too.",0
835302,Nevada,UNK,UNK,UNK,"A young boy, Meade Slaughter, works along with his uncle Charlie Brent as a carny barker at a carnival and amusement park in early 1900s San Diego. Charlie had retrieved Meade from the custody of a sheriff of a small Texas town where his mother, working in a whorehouse, was killed by a John. The story follows Meade and Charlie as they work various games of chance in various amusement parks all over the U.S. Meanwhile, Meade meets, falls for, courts and marries a comely young lady named Shirley Reed. By 1929, Meade is invested heavily in the Stock Market, and loses a great deal of money. Meade is in trouble because he owes thousands of dollars. Charlie bails him out, same as Meade did when Charlie's wife wanted half of their bankroll to divorce him a few years earlier. With only a few hundred dollars between them, Charlie and Meade start over running some new concessions. They run into long-time friend Bob Terhune, a major Nevada politician who tries to convince them to set up shop in Reno. Both Charlie and Meade believe that Nevada doesn't really have enough potential to be worth going there. Low on funds, and with his and Charlie's business hurting because of low turnout, Meade decides to go to Chicago and run a series of amusements while Charlie continues to run their spots in San Diego. The rigors of the trip are so severe that Shirley and David, Meade's new son, would not be able to go. Meade returns home months later with only a few hundred dollars. On the way back he decides to take a side trip through Reno, and after a short visit to the town deciding that the place is still lacking adequate interest to be worth starting business there. While working one day, Meade returns home early due to stomach flu to discover that his wife has been with a lover. Meade leaves in a hurry, then goes to see Charlie, only to discover not only that Charlie knew about it, but that she has had more than one. Meade realizes it is partially his fault, if he had given her more attention this would not have happened. A few months later, in a moment of tenderness he lets Shirley discover he knew about it, and holds no bitterness. Realizing they need to make a clean break, a few months later Meade takes his half of the money in their business, and moves his family to Reno to try to make it on his own. Meade starts a small gambling club, called the Plush Wheel, and is almost bankrupted his first day. One of the customers he meets is a very smart man who decides to let Meade know that some of his employees have been rigging the game to rob him blind. The man realizes that Meade is an honest operator, and he doesn't want to see his type chased away. Meade learns that the man who helps him is Frank Smith, a well-known wealthy Nevada real estate investor known as Smitty. As Meade builds his business, his family life suffers. His wife, unhappy by her lack of friends and activities to be interested in, becomes seriously depressed and turns to alcohol for solice. One of the issues that drove her to acoholism include a serious incident in which two thugs, in attempting to beat up and rob Meade, are killed by Meade while defending himself. He even asks Charlie to come to Reno to help run his club so he can spend more time with her. Unable to breach the gulf between himself and Shirley, they drift further apart, until, at one point, she is killed in a tragic accident while drunk in public. Smitty convinces Meade to visit Las Vegas for the Helldorado celebration, and to scout out possible future places to open a Las Vegas Plush Wheel. While there, Meade spots an extremely attractive lady named Sandra Farley. The two hit it off and over a few weeks become lovers. They make plans to marry. Janice Terhune, Bob's wife and friend of Meade and Charley, takes David under her wing, feeling that Meade really isn't capable of taking proper care of him. In the mean time, Carlo Guiliano, owner of a number of casinos, who has been the cause of sending ""crossroaders"" (crooked gamblers) to try to bankrupt Meade, and was responsible for sending the thugs who were killed tried to break up Meade's club, decides he wants to drive Meade out of the business. He sends some more thugs, who attack Meade on a side street. Sandra, waiting for Meade, sees the men and tries to stop them, but is murdered by one of them. Meade sees the face of one of the killers and realizes it's one of the top enforcers for Carlo. The men run, leaving Meade severely injured and paralyzed from the waist down. Meade decides to sell his business and move to San Francisco. Living in San Francisco, Meade's hatred and anger over the murder of his fiancee Sandra, drives him to hire a local carpenter to build him various devices to allow him to strengthen his wasted body. Over time, his body heals and he secretly regains the ability to walk, hiding his ability. He decides that he wants to be able to walk by August 10. A few days before, he goes back to Reno, and lying in an alley, pretends to be a bum as Carlo Guliano exits his casino. He pulls out a sawed-off shotgun, shoots and kills the man who killed Sandra, then speaks to Guliano, letting him recognize who he is, and to make him realize that he must die too. Meade shoots and kills Guliano a few minutes after midnight, August 10, 1938, two years to the day that Sandra was murdered by Guiliano's men. Smitty picks up Meade and they hole out for a few days until the police stop looking for the killer. Meade decides to come back to Nevada, only to stay away from Tony Guiliano, Carlo's son, Meade decides to reopen his business in Las Vegas. As Meade is believed to be crippled, Tony figures it was a mob hit. Later discovering that Meade is able to walk again, he is incensed and wants to have him killed, but because Meade now has bodyguards, he can't get to him. Tony decides to wait to exact revenge. Over the years, Meade meets a number of people involved in the gambling trade, including Moe Sedway, whom Meade literally throws out of his office when he discovers that Sedway wants kickbacks in exchange for anyone wanting race results for bookmaking. Meade becomes friends with Benjamin ""Bugsy"" Siegel, a mob-connected casino operator. Because of knowing Siegel, Meade meets an extremely attractive woman named Cindy Guest. They become attracted to each other and start a romance. This sours David because he sees Cindy's relationship with his father forcing a wedge between him and Meade as well. At one point, David, miserable, gets into a fight with Meade and when Meade confronts him about his attitude, asks Meade if he is going to ""blow him away"" like he did to Carlo Guliano, then turns white realizing he didn't mean to admit it. The fight can't be reconciled and David grows even more distant from his father; he runs home to ""mama"", that is, to Janice Terhune, who has been defacto mother to him and her own kids over the years. Meanwhile Tony Guliano tells one of his employees, Carlo Gatori, to become friends with David so Carlo can use it as an edge to try to go after Meade. Cindy discovers she's pregnant, then decides if she wants more out of her relationship with him, then decides to ask Meade (without telling him that she's pregnant) if he would want to get married. Meade asks for a day or two to think about it. He comes to the conclusion that no matter how much he loved Sandra, he does love Cindy and would want to marry her. He heads home to find a ""Dear John letter""; Cindy has confused his reticence, believes she pushed too hard, and decides that since he doesn't want to get married, that it's best she leave. After considerable fruitless searches by detectives, Meade decides to give up looking for her: she has effectively dropped off the face of the earth. David joins the Marines, fights in the Korean War, and is wounded in his left arm. He returns and meets a Vegas Showgirl named Gari Carter, with whom he strikes up a romance. David and his father reconcile when Meade tells David everything, including why he had killed Carlo. David decides to ask Gari to marry him; she figures it would be a bad idea, in view of the fact that as a showgirl, it was well known that she also did part-time work as a high class hooker. David is persistent, until she tells him to stop asking or he won't see him any more. Meade goes to meet Gari, and tries to talk her into taking a bribe to leave town. A fight ensues and Meade, after unintentionally insulting her, leaves hastily. Realizing she does care about David, she later calls Meade, not wanting to drive a wedge between him and David, tells him that she told David she would marry him. Janice Terhune is killed in an automobile accident, which devastates her family as well as close friends, especially David, who saw her as his mother. Gari has a baby girl, named Ann. David's war injury becomes worse, requiring him to take pain pills. Tony Guliano has plans for a large casino in Lake Tahoe, only he is unable to buy the land after its owner died because Meade had bought it from the owner's daughter, who was executor of his will. In a rage, Tony decides to strike at Meade by paying Carlo Gatori to do something to David. Meade and Gari notice David's physiological and psychological deterioration, and decide to try to find out what is wrong, even going so far as to become friends as a result of their concern over him. They suspect Gatori may have something to do with it, David's friendship with him seeming unsavory. Charlie dies of a massive heart attack. David goes missing, and a few weeks later, Meade is informed by the San Francisco police that David has been picked up, suffering from an addiction to heroin. Meade puts David in one of the best sanitoriums in the country so he can go through withdrawal. Meade hires the best private detective he can find to discover who got David addicted. David will be in Holton Sanitarium for at least six months, so Meade convinces Gari to move out to his ranch and rebuild the place. He decides also to give her a job as Vice President of Special projects for the casino, because of her ability to get things done. Meade goes back to San Francisco to meet with Thorton, the private investigator he hired, who has discovered that Gatori had gotten David hooked. Meade goes to see Smitty, who knows some tough characters. Smitty asks Meade what he thinks should be done. Meade admits ""Gatori can't live after what he's done."" Tony Guliano is kidnapped and taken out to the desert, where he is forced by two men at gunpoint to dig a grave in the desert; he figures they are going to bury him in it. When he is forced at gunpoint to get in the hole, and believes his captors are about to kill him, another man appears above him. The man is Meade. He asks Tony about David; he claims not to know him. Meade says that Gatori said otherwise while being tortured, as Gatori's bullet-ridden corpse is dumped into the hole next to Tony. He then tells Tony that he's not killing him because he wants him to remember this if he ever tries to evoke revenge against Meade. David comes out of the sanitarium; Meade and Gari decide to try to make things easy for him, hopefully so he can go back into some work he can handle. The attempt fails and Meade ends up having to re-commit David to the sanitarium.",0
836740,Petersburg,Andrei Bely,UNK,"{""/m/05hgj"": ""Novel""}","The novel ends with a surprise twist, when Nikolai's worst fears are realized. The Mongol hordes that the Tsar kept at bay for hundreds of years are finally unleashed on the weakened empire of Russia via a complex labyrinth of tunnels. The inhabitants of Petersburg, unable to defend themselves from the ravaging horde of Tartars, quickly capitulate to the rule of the Khan. Appolon Appolonovich is beheaded by the tyrannical Khan and his son Nikolai assumes his rightful place as guardian of the Russian people. This was intended to be the first in an epic trilogy detailing the resistance movement of the intelligentsia against the alien invaders. However, with the onset of post-revolutionary censorship, the series was deemed to be too monarchist and was therefore abandoned. Bely presents the idea of the entire world being connected by a series of tunnels. As a symbolist he saw tunnels as a gateway to the soul. By having the Mongols use these tunnels to breach Russia's defenses, he expresses the widely held fear of Orientalism defiling the Russian soul.",0
837805,Raw Spirit,Iain Banks,2003,UNK,"The book is about whisky, or finding the perfect dram while travelling in Scotland. Other recurring themes in the book are George W. Bush, the 2003 invasion of Iraq, and Banks's love for motor vehicles.",0
