id,title,author,published_date,categories,summary,page_count
10448894,So Totally Emily Ebers,Lisa Yee,2007-04-01,"{""/m/0dwly"": ""Children's literature"", ""/m/01j1n2"": ""Coming of age""}","Moving is not a pleasant experience- especially moving to the other side of the country with a moody mother who insists on stopping at every museum along the way. The road from Allendale, New Jersey, to Rancho Rosetta, California, is not a smooth one for fun-loving Emily Ebers. The only reason she had to move was because her parents divorced, and it was all because of Alice, her boring journalist mother. It was she who wanted to divorce, to tear the family apart, and to sell the house that Emily loved. Alice definitely cares about Emily. Emily only chose to live with Alice because if she lived with her father, she would get in his way- and the way of his band, Talky Boys, which is touring the East Coast. Just when her summer looked like it couldn't get any worse, Emily is signed up for volleyball by Alice. During these torture sessions, Emily must learn to hit the ball over the net, live with the awful Coach Gowin, and endure and reflect insults from popular girl, Julie and her ""back-up singers."" However, in a twist of fate, she meets Millicent Min, a home-schooled Chinese girl who was forced to play volleyball because there wasn't a gym at home. Surprisingly, Millie and Emily become friends instantly, and Millie even goes to Emily's for a sleepover. But here's where the problem arises- is it possible for Alice to dematerialize so that her ugly hippie clothing and boring talk about journalism doesn't embarrass Emily? Luckily, Millie fakes interest in Alice and is safely whisked off to Emily's room before Alice can drone on about her newest articles. After this sleepover, everything gets even better for Emily. First, she meets the other Mins- Mr. and Mrs. Min and Grandma Maddie- who are actually normal humans, unlike Alice. Then, she meets the boy of her dreams- Stanford Wong, who is athletic, smart, and handsome. He's the only seventh grader on the A-team for basketball, Millie's tutor, and someone that would ""never do anything to hurt anyone."" Emily's life is now back to normal, and even volleyball isn't so excruciating as it first was now that she has Millie. However, everything she didn't give a second thought about now comes back to her- why Millie used large words and carried a briefcase, why she was so uncomfortable talking about school, and why another girl on the volleyball team calls her a ""genius"". During the morning of a sleepover at Millie's, Emily uncovers everything she needs to know to fit the pieces of the puzzle together- trophies, plaques, certificates, diplomas, and newspaper articles labeled 'Millicent Min'. She realizes that Millicent isn't stupid, homeschooled, or tutored by Stanford Wong. She is a genius, whereas Stanford Wong is failing language arts. ""Best friends don't lie to each other,"" she thinks. How could they have lied to her the entire time? Disgusted with her ""friends,"" Emily decides to start anew and find real buddies who won't lie to her. First, she decides to become closer to Wendy, the other nice girl in volleyball. Through Wendy, she learns about Julie and her back up singers- how they could either ""make or break"" Emily when she started school. Though she isn't the type to join the popular clique, Wendy encourages her to start school with a good reputation. Plus, being popular can't harm her, can it? Thus, the two of them attend Julie's pedicure party (popular girls only) where Emily is encouraged to look at herself in a different way- that is, comparing themselves to ultra-thin models. Emily starts dieting (though she isn't fat) and plucking her eyebrows (though they aren't ugly). In this quest to find out who she really is, Emily is pressured to buy six identical purses, $112 each, for each of the six popular girls (Julie and her Triple A backup singers Alyssa, Ariel, and Ariana, plus Emily and Wendy) with her dad's credit card. That day, Emily not only spent $672 (plus tax), but also one of her final tokens of tolerance for the so-called popular clique. Though Wendy is a nice girl, no one beats Millie's ""deadpan sense of humor"" and the way she always had something to talk about. The timing was always perfect for Millie and Emily. Luckily, it still is. In an awkward telephone conversation, the two former best friends decide to meet at the mall. Though it takes some time for Millie to figure out that she had not ""sorely misjudged the dynamics"" of their relationship, but rather misjudged Emily's ability to look beyond IQ, she does figure out that Emily was and will always be her friend despite the intellectual barrier that had caused Millie to be friendless in the first place. With Millie back, Emily is able to face the fact that her dad is no father of the year. When he finally calls for the second time the entire summer, it's about the credit card, to ""confirm the purchase of six [expensive] purses"" and to tell Emily to stop using the credit card. Emily is heartbroken; she had believed that her father had been extremely busy with his band and that he still loved her very much. Fortunately, when the truth hits her, Millie is right next to her, handing her tissues. But that's not all that Millie does- she even asks for the makeover that Emily's always wanted to do to cheer Millie up. Emily also finds out that Alice had turned down a prestigious assignment to Paris, just to be with her for the summer! After realizing her serious error, Emily apologizes to her mother, saying, ""I'm so sorry,...about this summer and life and everything. I've been so mean to you."" Finally, after an entire summer, Emily is able to engage in an intimate relationship with her mother who she doesn't call ""Alice"" anymore, but ""mom""- short, sweet, and daughterly. After Millie's perfect definition of ""true friend"" in that noble act, Emily is able to break her bonds with Julie and the Triple A's. ""I may have been slow, but I finally figured out what a true friend is, and Julie never was one,"" she declares. When Julie attempts to persuade Emily that what she has been doing for Emily is all for Emily's own good (e.g. the dieting), even meek Wendy sticks up for Emily. With one more true friend, Julie can't break her in school. That's another problem solved and just one more to go. Although Stanford called almost everyday, he never said anything or left a message. He never apologized, and Emily thinks it's because he never liked her. However, several days before summer vacation ends, the two make it up to each other. In an ice cream shop, Emily kisses Stanford on the cheek and they become boyfriend and girlfriend. And finally, with a sweet letter to her father, Emily completes her diary. She is finally ""home"", as wise old Maddie says.",0
10452650,A Song for Summer,Eva Ibbotson,1997,"{""/m/02xlf"": ""Fiction"", ""/m/01qxvh"": ""Romance novel""}","Set in early 1940s Austria, the novel centers around a young English woman called Ellen Carr. Raised in a family of prominent suffragettes, Ellen, to the surprise of all friends and family, grows up with a great love of all things domestic. Inspired by Henny, the servant/partner of her grandfather, she enjoys cooking, cleaning and the various other chores that her mother and aunts have abandoned in their academic and feminist pursuits. While Ellen attends University to please her family, she leaves school before her final exams when Henny contracts cancer in order to be at her side. After Henny's death, Ellen travels to Henny's homeland of Austria to become housemother at Hallendorf School, a progressive school for children stocked with characters of all sorts. Ellen soon finds that everything is not as it should be - the school is based on the Arts and is an institution for wealthy children; however, the parents of many of these children have used the school simply as a place out of sight and mind, in which to dump children that they see as nuisances. Ellen takes on the role of mother to these children, giving them the love and encouragement that they deserve. In the beautiful Austrian countryside Ellen discovers an eccentric world occupied by wild children and even wilder teachers, experimental dancers and a tortoise on wheels. And then there is the particularly intriguing, enigmatic, and very handsome Marek: part-time gardener, fencing teacher, and the most romantic, compelling, swoon-worthy hero figure since Mr Darcy. Ellen is instantly attracted to the mysterious gardener, but Hitler’s Reich is already threatening their peaceful world. But when she discovers that Marek is actually a famous musician working with various Reistances to smuggle Jews to safety, Ellen begins to realize the depth of her feelings for him—and the danger their newfound love faces in the shadow of war.",0
10454339,Conspiracy Game,UNK,UNK,UNK,"Jack Norton, one of a group of Navy SEALs that were psychically and physically enhanced by Dr. Peter Whitney, called Ghostwalkers, is on a mission to the Democratic Republic of the Congo to rescue his twin brother, Ken from rebel forces. Ken had led a team sent to save an American senator whose plane had gone down. Unfortunately, Ken himself was then captured and tortured before he was retrieved. When he rescued his brother, Jack too was captured; however he was able to escape. Briony Jenkins takes a walk in the jungle, despite the danger of encountering rebel forces. She is a member of a circus family, called the Flying Five. But she has always been different; she cannot be around people without feeling constant pain. She is also stronger and faster than either of her four brothers. Jack encounters Briony while hiding in the jungle, and is immediately aware that she is a Ghostwalker like hemself. He is also stunned by his powerful attraction to her. Briony in turn is amazed that even with his numerous injuries, she cannot feel his pain nor hear his thoughts; it's the first time that has ever happened. She is also surprised to learn that Jack knows her older brother Jedediah, having served with him when Jeb was a SEAL. Briony is able to get Jack to her hotel and treat his wounds. The next day, Jeb arrives and is at first stunned then alarmed to see Jack with his sister. Jack has always had a formidable reputation, and he’s surprised that his sister seems comfortable in his presence. Jeb agrees to help Jack, and suggest he hides in the arena where they have been permitted to practice. Throughout the next few days as Jack waits to be picked up by his people, the attraction and intimacy between him and Briony grows. When it is time to leave, Jack coolly informs her that he doesn’t want to continue their relationship. Almost three months later, Briony discovers that she’s pregnant. Before she can get over that shock, her doctor tries to drug her and kidnap her. She and her brother escape and go on the run. Twice more enhanced soldiers find her and try to “return her to the lab”. Then a man calling himself Kaden Montague appears and shows her a file of her life. The story told to her adoptive family is a lie; she is not the daughter of a man whose wife died in childbirth. She is one of several orphaned girls who have been psychically and physically enhanced by a man named Peter Whitney. She was given to her family because he wanted to see if she was tough enough to survive the constant bombardment of human emotion without an anchor (a psychic who can filter strong emotion). Not only was that, but the overwhelming attraction between Jack and Briony is no accident. Whitney designed pheromones that would insure strong physical compatibility. All he needed to do was get them both at the same place at the time and nature would take care of the rest. All of this was done so that Briony and Jack would be the parents of the second generation of Whitney’s supersoldiers. Briony knows that she can’t remain with her family; as her pregnancy advances, she’ll be less able to defend herself. So she turns to the one person who might be able to protect her and her unborn child, Jack Norton. When Briony and Jeb appear on Jack and his twin brother’s remote cabin, he is stunned by her revelation that she’s pregnant. He’s even more surprised by the information that not only is Whitney still alive, but he’s also plotting to kidnap Briony. Somewhat to even Briony’s surprise, he agrees to protect her and the baby. It’s not all good news however; the attraction manufactured by Whitney is as intense as ever, if anything, it’s even stronger than before. As they spend time together, Briony realizes that Jack is not the “badass” he purports to be, but a man shattered by an abusive and painful childhood. His own father killed his mother and tried to kill him and his brother because of his intense jealousy. Jack has always feared that he too would by like that if he were ever to fall in love. Just as Jack and Briony reach this new understanding, the house comes under attack. Whitney’s men have found her again. Briony realizes that the only way they could be tailing her is with a tracking devise. She finds and removes it. She also makes another revelation; she remembers that she has a sister, a twin sister. A fact that Luther, one of the men sent to reacquire her conforms. Luckily Jack and Ken are able to fight off the soldiers until they can be rescued by their comrades. Both Jack and Ken pledge to help find Briony find her sister, Mari.",0
10454700,Without Seeing the Dawn,Stevan Javellana,UNK,"{""/m/02xlf"": ""Fiction""}","Without Seeing the Dawn was set in a small farming village called Manhayang in Santa Barbara, Iloilo. The residents of the barangay were living their simple life when the violence of war reached their place and brought death and suffering. Ricardo ""Carding"" Suerte, the young son of Juan Suerte wanted to marry Lucia (nicknamed ""Lucing""), the daughter of the teniente del barrio. Although Ricardo's father wished to send him to school first, the blessing to marry was given and the traditional asking the hand custom known as the pamamanhikan was done. Ricardo built a house for him and his wife on the land that was entrusted to Ricardo's father by Don Diego (a landlord) despite the advice of the elderly that building one's house in May will bring misfortune. Soon after, misfortune struck: their first child was stillborn, Lucia had an affair with Luis, the son of Don Diego, and the land the Suerte's had been tilling was given to another tenant. The couple went to Iloilo City where Ricardo met fellow stevedore and union member Nestong and Rosing, a prostitute. Lucia left Ricardo because of Rosing. Ricardo followed Lucia who was then in Badlan after receiving news that Lucia was pregnant and that the representante (representative) entrusted them with a land to till. They named their son Crisostomo. Misfortune came again because their landlord sold the land they were tilling, and a flood destroyed their harvest and killed their carabao. They went to Mindanao to find a land to own. However, Ricardo was drafted for military service. Upon his return, Lucia was pregnant but his father and their son died. At first he was not told the truth, the real reason why his father and son died was because they were killed by Japanese soldiers, not by illness. His wife was also raped by the Japanese occupiers. He was angered after knowing the truth and became an enemy executioner. Because of Ricardo's behavior, Lucia sent him away. When the Japanese invaders ordered the people to go to a designated barrio to be identified as non-guerrillas, the Manhayang villagers evacuated the area, except for Lucia who wanted to wait for Ricardo who would be leading the ""suicide attack"" at the enemies' garrison. When they met, Ricardo asked for Lucia's forgiveness but said farewell after giving Lucia some money. Lucia refused and stayed even if she had to welcome back Ricardo as a corpse.",0
10458884,Lee and the Consul Mutants,UNK,UNK,"{""/m/0dwly"": ""Children's literature""}","It is not every day that a part of your body explodes. But ten-year-old Lee's appendix does just that, landing him in hospital. After his operation, Lee discovers that being in hospital has its bright side. But his world turns dark again when he uncovers a fiendish plot by the white-coated Consul Mutants to take over the world. Other kids might quake in their boots at this news, but not Lee. He is determined to save the planet and formulates a cunning plan to stop the alien invasion. Lee and the Consul Mutants is the story of a fearless boy battling against intergalactic odds for the sake of mankind. Lee’s only weapon is his intelligence . . . which is a pity.",0
10458974,Lee Goes For Gold,UNK,UNK,"{""/m/0dwly"": ""Children's literature""}","Meeting his father's multizillionaire boss inspires ten-year-old Lee to come up with a brilliant get-rich-quick scheme of his own. But not everyone is keen for Lee to succeed. Local shopkeeper Panface certainly is not, and it seems that he has sneaky spies out there, trying to ruin Lee's plans Will Lee overcome those out to stop him making his fortune? Or will he spend the whole time daydreaming about how many houses he will own and how many butlers he will have? Lee will need to rely on his common sense and financial genius if he is to succeed . . . so it could be a struggle.",0
10459043,Lee's Holiday Showdown,UNK,UNK,"{""/m/0dwly"": ""Children's literature""}","Nothing is ever straightforward when Lee is around. Not even a summer holiday in Spain. It ought to be a case of lazing by the pool, but Lee is soon spying on dodgy men in shiny suits and sunglasses, battling with a family that seems determined to ruin everyone's holiday and haranguing horrendous holiday reps. With so much going on, how will Lee ever get a tan?",0
10462111,In the Sargasso Sea,UNK,UNK,"{""/m/08sdrw"": ""Adventure novel""}","The protagonist, Roger Stetworth, unwillingly joins a slave ship called the ""Golden Hind"" captained by Luke Chilton. (When Chilton demanded that Roger ""sign aboard"" he refused and was clubbed on the head and thrown overboard.) He is rescued by the ""Hurst Castle"" and doctored by a painfully stereotyped Irishman. The ""Hurst Castle"" is abandoned but does not founder in a gale and the crew accidentally leave Stetworth marooned aboard. The ship drifts into the center of the Sargasso Sea where Stetworth finds himself in a ships' graveyard in which survivors of previous shipwrecks still inhabit the forgotten ships. Stetworth must rely on his own ingenuity to get free from the choking sargasso weeds.",0
10470026,God's Spy,Juan Gómez-Jurado,2007,"{""/m/01jfsb"": ""Thriller"", ""/m/02n4kr"": ""Mystery""}","From the book cover: In the days following the Pope's death, a cardinal is found brutally murdered in a chapel in Rome, his eyes gouged and his hands cut off. Called in for the grisly case, police inspector Paola Dicanti learns that another cardinal was recently found dead; he had also been tortured. Desperate to find the killer before another victim dies, Paola's investigation is soon joined by Father Anthony Fowler &mdash; an American priest and former Army intelligence officer examining sexual abuse in the Church, who knows far more about the killer than Paola could possibly imagine.",0
10473325,Muddle Earth,Paul Stewart,2003,"{""/m/02xlf"": ""Fiction""}","Joe, a boy from ordinary Earth, has been summoned to Muddle Earth -a world full of monsters and mayhem and more- by the wizard Randalf. He is then exhorted as a 'warrior-hero'. In other words, he must fight evil on behalf of Randalf, who has in turn been contracted by the ruler of Muddle Earth, the Horned Baron. The Horned Baron, however, has problems that even Randalf cannot attend to: his wife Ingrid is a very demanding woman. This is a trait that the evil villain Doctor Cuddles pays heed to, and uses to his advantage in all three sections of the novel.",0
10481847,The House of the Sleeping Beauties,Yasunari Kawabata,1961,"{""/m/0l67h"": ""Novella""}","The titular house is an establishment where old men pay to sleep besides young girls that had been narcotized and happen to be naked, the sleeping beauties. The old men are expected to take sleeping pills and share the bed for a whole night with a girl without attempting anything of ""bad taste"" like ""putting a finger inside their mouths"". Eguchi is presented with a different girl each time he visits the house because of the short notice of his visits. He discovers that all girls are virgins which somehow compels him to comply with the house rules. Each girl is different and the descriptions of his actions are mixed with the dreams that he has sleeping besides the girls.",0
10483306,"Niagara Falls, or Does it?",Henry Winkler,2003,"{""/m/0dwly"": ""Children's literature""}","Hank starts a new year at his school and meets his new teacher who has her students write an essay about their summer vacations. Hank has a hard time with homework and with staying on task which makes writing an essay a difficult assignment. Meanwhile, his grandpa, Papa Pete, asks Hank and his friends Ashley Wong and Frankie Townsend to put on a magic show at his bowling league game. However, his teacher made a statement to Hank saying she can't wait to see his creative report, so he has to do his report and perform for Papa Pete. Hank decides to make a model of Niagara Falls, where he spent his vacation, rather than write about it but when he presents the project in class he accidentally floods the classroom. Hank is given two weeks of punishment at school and at home. His punishment includes not being able to participate in the magic show for Papa Pete's bowling league. Finally, after a lot of convincing, his parents allow him to do the magic show. It was a relief to all the people at the bowling lanes because class bully and overall idiot Nick McKelty was performing in Magik 3's (Hank, Frankie, and Ashley's magic group) place. The magic show happens, and McKelty gets laughed at and thrown off stage. In the end, things go well for Hank, as he also meets the new music teacher, Mr. Rock, during detention, and they instantly like each other. Mr. Rock helps Hank with his essay and talks to his parents about his learning disabilities, which no one knew Hank had.He lives in New York City.",0
10495616,Dragon Moon,Carole Wilkinson,2007-04,"{""/m/0dwly"": ""Children's literature"", ""/m/01hmnh"": ""Fantasy"", ""/m/02xlf"": ""Fiction""}","When the story starts out Liu Che,(Ping's former friend and the emperor of China),has his troops attacking the Duke of Yan's palace where Ping has been living for a year, because he believes that they kidnapped his former imperial dragon Kai. Meanwhile, Ping decides to wake Kai up from his winter hibernation for his safety, and finds that he has not only matured greatly in size, but knowledge as well. Ping leaves the palace with Kai to search for the Dragon Haven to further insure his safety. On the way, they find the emperor, Liu Che, wounded with a shard of Kai's dragon stone in his hand. He repents his crimes and decides to abandon his quest for immortality. At the morning, Ping refuses his offer of love and continues on her journey. On the way, she meets Jun, and together they find an old man, ""Lao Long Zi"", one of Danzi's former dragon keepers, at Tinkling Village. He brings them most of the way to Long Gao Yuan before dying. After getting there, however, Ping discovers only a heap of dragon bones from a massacre by dragon hunters. Ping and Kai are discouraged, and Kai refuses to leave. One day, a yellow dragon swoops down from the sky and carries Kai away. Ping stumbles towards the mountain in a half-dead state, until she too is picked up by the dragon(not too gently) and brought to the real, current dragon haven. There, she learns that many years ago, Hei Lei's dragon keeper had abandoned him for a woman, and that his girlfriend, in her old age, had then betrayed the location of the dragon haven to a band of dragon hunters for three pieces of gold. They had killed many of the dragons in hibernation. Only Hei Lei, the black dragon, was awake, and attacked the hunters just in time. Still, they managed to get away with many dead dragons in their greedy hands, with only a handful escaping. Ping is distraught as she watches Kai pick up many of the wild dragons' habits and feels him slowly drawing away from her. During a moon gathering, Kai and Hei Lei end up in a fight, and Kai, who wins, is revealed to be a ""dragon of five colors""(green, yellow, black, white, and red). A ""dragon of five colors"" will automatically assume the position of leader(and no one can challenge him, as the dragons formerly had none). Ping eventually wins the trust and friendship of all the dragons, but realizes that she must end the dragons' reliance on humans and leaves. The book ends with Ping beginning a new life with Jun, as she saw in one of her visions of her future.",0
