id,title,author,published_date,categories,summary,page_count
562222,A Wrinkle in Time,Madeleine L'Engle,1962,"{""/m/01hmnh"": ""Fantasy"", ""/m/06n90"": ""Science Fiction"", ""/m/014dfn"": ""Speculative fiction"", ""/m/03mfnf"": ""Young adult literature"", ""/m/0dwly"": ""Children's literature""}",":In the novel, the name of the protagonist Meg's mother is consistently written with a period after her title, but the names of the three angelic beings disguised as humans ""Mrs Whatsit"", ""Mrs Who"", and ""Mrs Which"" have no period after their titles of ""Mrs"". This plot summary and the remainder of the article reflect the convention of the novel. Meg Murry's classmates and teachers see her as a troublesome student. Her family knows that she is emotionally immature but also see her as capable of great things. The family includes her beautiful scientist mother; her mysteriously absent scientist father; her 10-year-old twin brothers, the athletic Sandy and Dennys; and her five year-old brother Charles Wallace Murry, a super-genius. The book begins with the line ""It was a dark and stormy night,"" an allusion to the opening words in Edward George Bulwer-Lytton's 1830 novel Paul Clifford. Unable to sleep during a thunderstorm, Meg descends from her attic room to find that Charles Wallace sitting at the table drinking milk and eating bread and jam . then they are joined by their mother, they are visited by their new eccentric neighbor, Mrs Whatsit. In the course of conversation, Mrs Whatsit casually mentions there is such a thing as a tesseract, which causes Mrs. Murry to almost faint. The next morning, Meg discovers the term refers to a scientific concept her father was working on before his mysterious disappearance. The following afternoon, Meg and Charles Wallace encounter Meg's schoolmate, Calvin O'Keefe, a high-school junior who, although he is a ""big man on campus"", considers himself a misfit as well. They go to visit an old haunted house near town which Charles Wallace already knows as the home of Mrs Whatsit. There they encounter a companion of Mrs Whatsit, the equally strange Mrs Who. She promises that she and her friends will help Meg find and rescue her father. A budding love interest develops between Meg and Calvin. In the evening, Charles Wallace declares it is time for them to go on their mission to save their father. This is accompanied by the appearance of the third member of the ""Mrs W's"", Mrs Which, who appears to materialize out of nothing. Mrs Whatsit, Mrs Who, and Mrs Which turn out to be supernatural beings who transport Meg, Charles Wallace, and Calvin O'Keefe through the universe by means of tesseract, a fifth-dimensional phenomenon explained as being similar to folding the fabric of space and time. Their first stop is the planet Uriel, a Utopian world filled with joyous, Centaur-like beings who live always in a state of light and love. There the ""Mrs Ws"" reveal to the children that the universe is under attack from an evil being who appears as a large dark cloud called The Black Thing. The children are then taken elsewhere to visit a woman who is a kind of medium (the ""Happy Medium"") with a crystal ball. In it, they see that Earth is partially covered by the darkness, although great religious figures, philosophers, and artists have been fighting against it. Mrs Whatsit is revealed to be a former star who exploded in an act of self-sacrifice to fight the darkness. The children then travel to the dark planet of Camazotz which is entirely dominated by the Black Thing. Meg's father is trapped there. They find that all the inhabitants behave in a mechanistic way and seem to be all under the control of a single mind. At the planet's central headquarters (described as CENTRAL Central Intelligence) they discover a red-eyed man with telepathic abilities who can cast a hypnotic spell over their minds. He claims to know the whereabouts of their father. Charles Wallace deliberately looks into the red eyes of the man allowing himself to be taken over by the mind controlling the planet in order to find their father. Under its influence, he takes Meg and Calvin to the place where Dr. Murry is being held prisoner because he would not succumb to the group mind. The planet turns out to be controlled by an evil disembodied brain with powerful telepathic abilities, which the inhabitants of Camazotz call ""IT"". Charles Wallace takes them to the place where IT is held, and in close proximity to IT, all of them are threatened by a possible telepathic takeover of their minds. To escape, Dr. Murry ""tessers"" Calvin, Meg and himself away from Camazotz, but Charles Wallace is left behind, still under the influence of IT. The experience of tessering through The Black Thing nearly kills Meg, because Murry does not know how to protect her from the Black Thing which surrounds the planet. When they arrive on the neighboring planet of Ixchel, Meg is nearly frozen and paralyzed. Calvin and the Murrys are discovered by the planet's inhabitants: large, sightless ""beasts"" with tentacles and four arms who prove both wise and gentle. Meg's paralysis is cured under the care of one inhabitant, whom Meg nicknames ""Aunt Beast"". When the trio of Whatsit, Who, and Which arrive, they charge Meg with rescuing Charles Wallace from IT. They each give her gifts. Mrs Whatsit gives Meg her love. Mrs Who quotes to Meg a passage from the Bible about God choosing the foolish of the world to confound the wise, and the weak to confound the strong. Mrs Which tells Meg that she has one thing that IT does not have. Upon arriving at the building where IT is housed, Charles Wallace is still there under IT's influence. Meg realizes that the one thing she has that IT does not is love. She focuses all her love at Charles Wallace and is able to free him from IT's control. Mrs Whatsit tessers the Murrys and Calvin back to Earth, where they are reunited with Mrs. Murry and the twins.",0
562243,Lord of Chaos,Robert Jordan,1994-10-15,"{""/m/014dfn"": ""Speculative fiction"", ""/m/01hmnh"": ""Fantasy""}","The deposed Queen of Andor, Morgase Trakand, goes to Amadicia to seek aid in returning to the throne. However, she is as good as taken captive by the Lord Captain Commander of the Children of the Light, Pedron Niall. In response to the declaration of amnesty for men who can channel by Rand al'Thor, the Dragon Reborn, Mazrim Taim, a previous False Dragon who had wrought destruction in the Borderlands, swears allegiance to him. Rand has Mazrim Taim lead and train the newly-established Asha'man at the so-called Black Tower. Rand is diplomatically courted by both the rebel Aes Sedai in Salidar, who send an envoy to Caemlyn, and the Aes Sedai of the White Tower, who send an envoy to Cairhien. In Emond's Field, Perrin Aybara, making his return to the series after his absence in the previous book, feels the pull of ta'veren upon ta'veren and heads to Caemlyn to join Rand. Wrongly thinking the Salidar Aes Sedai few in number and cowed, Rand sends Mat Cauthon to retrieve Elayne Trakand and win the allegiance of the rebel Aes Sedai. Mat discovers that Egwene al'Vere has been named the Amyrlin Seat of the rebel Aes Sedai, and when she sends Nynaeve al'Meara and Elayne to Ebou Dar in Altara to search for a ter'angreal with which to break the Dark One's control of the climate, Mat goes with them. Shortly after Perrin joins up with him, Rand is secretly kidnapped by Elaida's Aes Sedai, who begin journeying back to Tar Valon. Along the way Rand is tortured severely and constantly, which has long-lasting effects on his psyche. Learning of the kidnapping, Perrin leads a mixed force of Rand's followers after the Aes Sedai, leading to the climactic Battle of Dumai's Wells. At the end of the battle, the rebel Aes Sedai are forced to swear fealty to the Dragon Reborn while the surviving White Tower Aes Sedai, who kidnapped Rand, remain captives.",0
562456,The Outsiders,S. E. Hinton,UNK,"{""/m/0dwly"": ""Children's literature"", ""/m/03mfnf"": ""Young adult literature"", ""/m/014dfn"": ""Speculative fiction"", ""/m/02xlf"": ""Fiction""}","Ponyboy, a member of the Greasers gang, is leaving a movie theater when a group of Socs jumps him. His older brothers Darry and Sodapop save him. The next night, Ponyboy and his friends Dally and Johnny meet Cherry Valance and Marcia at a drive-in movie theatre. Ponyboy realizes that Cherry is nothing like the Socs he has met before. The Greasers walk Cherry and Marcia home, and Socs Bob Sheldon and Randy Adderson see them and think the boys are trying to pick up their girlfriends. Cherry and Marcia prevent a fight by leaving with Bob and Randy willingly. When Ponyboy comes home very late, Darry gets angry and hits him. Ponyboy runs away and meets up with Johnny. As they wander around the neighborhood, Bob, Randy, and three other drunk Socs confront them. After a Soc nearly drowns Ponyboy in a fountain, a terrified Johnny stabs Bob, accidentally killing him. Ponyboy and Johnny find Dally, who gives them money and a loaded gun and tells them to hide in an abandoned church. They stay there for a few days, during which time Ponyboy reads Gone with the Wind to Johnny and recites the poem ""Nothing Gold Can Stay"" by Robert Frost. When Dally comes to get them, he reveals that the fights between the rival groups have exploded in intensity since Bob's death. Johnny decides to turn himself in, but the boys then notice that the church has caught on fire and several children are trapped inside. When Johnny and Ponyboy rush to rescue them, burning timber falls on Johnny, breaking his back. Dally rescues Johnny. Ponyboy is relatively unscathed and spends a short time in the hospital. When his brothers arrive to see him, Darry breaks down and cries. Ponyboy then realizes that Darry cares about him, and is only hard on Ponyboy because he wants him to have a good future. Two-Bit informs Ponyboy that he and Johnny have been declared heroes for rescuing the kids, but Johnny will be charged with manslaughter for Bob's death. He also says that the Greasers and Socs have agreed to settle their turf war with a major rumble. The Greasers win the fight. After the rumble, Dally and Ponyboy visit Johnny and see him die. An overcome Dally rushes out of the hospital and robs a store. When he points is empty gun at the police, they shoot and kill him. Ponyboy faints and stays sick and delirious for nearly a week. While recovering, he tries to convince himself that Johnny is not dead and that he is the one who killed Bob. When Ponyboy goes back to school, his grades drop. Although he is failing English, his teacher says he will pass him if he writes a decent theme. In the copy of Gone with the Wind that Johnny gave him before dying, Ponyboy finds a note from Johnny describing how he will die proudly after saving the kids from the fire. Johnny also urges Ponyboy to ""stay gold"". Ponyboy decides to write his English assignment about the recent events, and begins: ""When I stepped out into the bright sunlight from the darkness of the movie house, I had only two things on my mind: Paul Newman and a ride home...""",0
563111,The Manuscript Found in Saragossa,Jan Potocki,UNK,UNK,"The Manuscript Found in Saragossa collects intertwining stories, all of them set in whole or in part in Spain, with a large and colorful cast of Gypsies, thieves, inquisitors, a cabbalist, a geometer, the cabbalist's beautiful sister, two Moorish princesses (Emina and Zubeida), and others that the brave, perhaps foolhardy, Walloon Guard Alphonse van Worden meets, imagines or reads about in the Sierra Morena mountains of 18th-century Spain while en route to Madrid. Recounted to the narrator over the course of sixty-six days, the novel's stories quickly overshadow van Worden's frame story. The bulk of the stories revolve around the Gypsy chief Avadoro, whose story becomes a frame story itself. Eventually the narrative focus moves again toward van Worden's frame story and a conspiracy involving an underground — or perhaps entirely hallucinated — Muslim society, revealing the connections and correspondences between the hundred or so stories told over the novel's sixty-six days. The stories cover a wide range of genres and subjects, including the gothic, the picaresque, the erotic, the historical, the moral, and the philosophic; and as a whole the novel reflects Potocki's far-ranging interests, especially his deep fascination with secret societies, the supernatural, and ""Oriental"" cultures. The novel's stories-within-stories sometimes reach several levels of depth, and characters and themes — a few prominent themes being honor, disguise, metamorphosis, and conspiracy — recur and change shape throughout. Because of its rich and varied interlocking structure, the novel echoes favorable comparison to many celebrated literary antecedents such as the ancient BCE Jatakas and Panchatantra as well as the medieval Arabian Nights and Decameron.",0
563269,The Power and the Glory,Graham Greene,1940,"{""/m/014dfn"": ""Speculative fiction"", ""/m/0dwly"": ""Children's literature"", ""/m/02xlf"": ""Fiction"", ""/m/05hgj"": ""Novel""}","The main character in the story is a nameless '[whisky priest]]', who combines a great power for self-destruction with pitiful cravenness, an almost painful penitence and a desperate quest for dignity. By the end, though, the priest ""acquires a real holiness."" The other main character is a lieutenant of the police who is given the task of hunting down this priest. This Lieutenant&mdash;also nameless but thought to be based upon Tomás Garrido Canabal&mdash; is a committed socialist who despises everything that the church stands for. The story starts with the arrival of the priest in a country town in an area where Catholicism is outlawed, and then follows him on his trip through Mexico, where he is trying to minister to the people as best as he can. He is also haunted by his personal demons, especially by the fact that he had fathered a child in his parish some years before. He meets the child, but is unable to feel repentant about what happened. Rather, he feels a deep love for the evil-looking and awkward little girl and decides to do everything in his power to save her from damnation. The priest's opposite player among the clericals is Padre José, a priest who has been forced to renounce his faith and marry a woman (by order of the government) and lives as a state pensioner. During his journey the priest also encounters a mestizo who later reveals himself to be a Judas figure. The lieutenant, on the other hand, is morally irreproachable, yet he is cold and inhumane. While he is supposedly ""living for the people"", he puts into practice a diabolic plan of taking hostages from villages and shooting them, if it proves that the priest has sojourned in a village but is not denounced. The lieutenant has also had bad experiences with the church in his youth, and as a result there is a personal element in his search for the whisky priest. The lieutenant thinks that all members of the clergy are fundamentally evil, and believes that the church is corrupt, and does nothing but provide delusion to the people. In his flight from the lieutenant and his posse, the priest escapes into a neighbouring province, only to re-connect with the mestizo, who persuades the priest to return in order to hear the confession of a dying man. Though the priest suspects that it is a trap, he feels compelled to fulfil his priestly duty. Although he finds the dying man, it is a trap and the lieutenant captures the priest. The lieutenant admits he has nothing against the priest as a man, but he must be shot “as a danger”. On the eve of the execution, the lieutenant shows mercy and attempts to enlist Padre José to hear the condemned man's confession. The lieutenant is convinced that he has ""cleared the province of priests"". In the final scene, however, another priest arrives in the town - which, among other possible readings, suggests that the Catholic Church cannot be destroyed.",0
563328,The End of the Affair,Graham Greene,UNK,"{""/m/014dfn"": ""Speculative fiction"", ""/m/02xlf"": ""Fiction"", ""/m/05hgj"": ""Novel""}","The novel focuses on Maurice Bendrix, a rising writer during World War II in London, and Sarah Miles, the wife of an impotent civil servant. Bendrix is loosely based on Greene himself, and he reflects often on the act of writing a novel. Sarah is based loosely on Greene's mistress at the time, Catherine Walston, to whom the book is dedicated. Bendrix and Sarah fall in love quickly, but he soon realizes that the affair will end as quickly as it began. The relationship suffers from his overt and admitted jealousy. He is frustrated by her refusal to divorce Henry, her amiable but boring husband. When a bomb blasts Bendrix's flat as he is with Sarah, he is nearly killed. After this, Sarah breaks off the affair with no apparent explanation. Later, Bendrix is still wracked with jealousy when he sees Henry crossing the Common that separates their flats. Henry has finally started to suspect something, and Bendrix decides to go to a private detective to discover Sarah's new lover. Through her diary, he learns that, when she thought he was dead after the bombing, she made a promise to God not to see Bendrix again if He allowed him to live again. Greene describes Sarah's struggles. After her sudden death from a lung infection brought to a climax by walking on the Common in the rain, several miraculous events occur, advocating for some kind of meaningfulness to Sarah's faith. By the last page of the novel, Bendrix may have come to believe in a God as well, though not to love Him. The End of the Affair is the fourth and last of Greene's explicitly Catholic novels.",0
563697,Master Harold...and the Boys,Athol Fugard,UNK,UNK,"Seventeen year-old Hally spends time with two middle-aged African servants, Sam and Willie, whom he has known all his life. On a rainy afternoon, Sam and Willie are practicing ballroom steps in preparation for a major competition. Sam is quickly characterized as being the more worldly of the two. When Willie, in broken English, describes his ballroom partner as lacking enthusiasm, Sam correctly diagnoses the problem: Willie beats her if she doesn't know the steps. Hally then arrives from school. Sam is on an equal intellectual footing with Hally; Willie, for his part, always calls the white boy ""Master Harold."" The conversation moves from Hally's school-work, to an intellectual discussion on ""A Man of Magnitude"", to flashbacks of Hally, Sam and Willie when they lived in a Boarding House. Hally warmly remembers the simple act of flying a kite Sam had made for him out of junk, which we learn later, Sam made to cheer Hally up after Hally was embarrassed greatly by his father's drunkenness. Conversation then turns to Hally's 500-word English composition. The play reaches an emotional apex as the beauty of the ballroom dancing floor (""a world without collisions"") is used as a transcendent metaphor for life and a creative paper topic... But almost immediately despair returns: Hally's tyrannical father has been in the hospital recently, undergoing medical complications due to the leg he lost in World War II, but it appears that today he is coming home. Hally, distraught with this news, unleashes on his two black friends years of anger, pain and the vicarious racism from his father, creating possibly permanent rifts in his relationship with them. For the first time, apart from hints throughout the play, Hally begins explicitly to treat Sam and Willie as subservient help rather than as friends or playmates, insisting that Sam call him ""Master Harold"" and spitting on him, among other things. Sam is hurt and angry but understands that Hally is really causing himself the most pain. There is a glimmer of hope for reconciliation at the end, when Sam addresses Hally by his nickname again and asks to start over the next day, hearkening back to the simple days of the kite. Hally responds ""It's still raining, Sam. You can't fly kites on rainy days, remember,"" then walks out into the rain. Sam and Willie end the play consoling each other by ballroom dancing together.",0
