id,title,author,published_date,categories,summary,page_count
4935162,The Eternal Champion,Michael Moorcock,UNK,"{""/m/01hmnh"": ""Fantasy"", ""/m/06n90"": ""Science Fiction"", ""/m/014dfn"": ""Speculative fiction"", ""/m/03npn"": ""Horror"", ""/m/02xlf"": ""Fiction""}","The Eternal Champion is narrated by John Daker, an inhabitant of 20th century Earth. At the beginning of the novel, his sleep is disturbed by dreams of other worlds and a repeated name: Erekosë. After many nights he understands that he is Erekosë and he finds the strength to answer the call. He arrives in a world that is strange to John Daker but somehow familiar to Erekosë (the narrator struggles to reconcile these two viewpoints throughout the book). He is welcomed by the aging King Rigenos of Necranal and his daughter Iolinda, and receives Erekosë's legendary sword Kanajana. The sword emits a deadly radiance that quickly kills anyone who receives even a minor wound from it. (Readers familiar with Elric will immediately recognize Kanajana as an Avatar of Stormbringer by virtue of its dark color and magical lethality.) Rigenos explains to Erekosë that all of humanity is united in a desperate fight against the inhuman Eldren, who have claimed the southern continent Mernadin and are said to be seeking to expand their empire. (The Eldren have some resemblance to elves as depicted in the works of Tolkien and others, but the term is not used). Privately John Daker harbors doubts, but decides that his allegiance must be to his own kind even if the Eldren are not as demonic as Rigenos claims. During this time and throughout the book, the narrator continues to have dreams in which he takes on the identity of many heroes engaged in constant, unending struggle. After secretly betrothing himself to Iolinda, he leads an expedition against the Eldren seaport Paphanaal. The human fleet destroys an Eldren fleet in a naval battle, then takes Paphanaal easily as the only remaining inhabitants are women and children. Erekosë is sickened by the actions of his human allies during the battle and the sack of the city. The only surviving Eldren is Ermizhad, sister of Prince Arjavh the Eldren commander; she is put in Erekosë's keeping during the return to Necranal. After the fleet returns, Erekosë and Iolinda announce their betrothal. Soon a large Eldren force lands near Necranal; it is Arjavh come to rescue his sister. Among the troops is a large contingent of halflings, relatives of Eldren from the Ghost Worlds who have the power to teleport themselves. The Eldren defeat the humans in battle and Erekosë is captured. He tells Arjavh, ""Trade me for Ermizhad."" During his captivity, Arjavh tells him about the history of his world, which was originally inhabited only by Eldren. After the arrival of humans, fearsome weapons during a war between the races nearly destroyed the planet. The Eldren hid away their weapons and vowed never to use such weapons again - not even to save themselves from total extinction, which would become a very real possibility in the later course of the book. The humans simply forgot how to build such weapons. Erekosë is released with the understanding that Ermizhad will be released in turn, but when he reaches Necranal he finds that she is still a prisoner. She tells him not to worry, then summons the halflings to help her escape. Jealous, Iolinda accuses him (rightly) of sympathizing with the Eldren. Erekosë makes a rash vow in a desperate attempt to prove his love for her: :""I swear I shall kill all the Eldren."" :""All?"" :""Every single Eldren life."" :""You will spare none?"" :""None! None! I want it to be over. And the only way I can finish it is to kill them all. Then it will be over--only then!"" :""Including Prince Arjavh and his sister?"" :""Including them!"" :""You swear this? You swear it?"" :""I swear it. And when the last Eldren dies, when the whole world is ours, then I will bring it to you and we shall be married."" In the course of a year-long campaign to destroy the Eldren, Rigenos is killed, Iolanda becomes queen, and the human army is exhausted. The last Eldren stronghold is Loos Ptokai. Before the siege begins, Arjavh invites Erekosë into the city to rest and see Ermizhad one last time. Erekosë regrets the need to kill these civilized people but feels bound by his vow. He had managed to suppress his dreams during the campaign, but when he falls asleep in Loos Ptokai, they return. This time, however, he dreams that not only the Champion, but all of humanity is trapped in eternal struggle. When he awakes, he decides to make one last attempt at peace. He returns with his army to Necranal, but Iolinda realizes that he has fallen in love with Ermizhad and commands that he be taken prisoner. He escapes and returns to Loos Ptokai. Too soon, the humans mount a new attack against the Eldren city. The Eldren are determined to fight bravely but hopelessly with medieval weapons, even though they have the ancient fearsome weapons available. However, when it is clear that the battle will soon be lost, Erekosë convinces Arjavh to allow him to unearth the ancient machines of destruction if it would preserve the Eldren. After destroying the human army, he proceeds to kill every human being on the planet. Then he returns to Loos Ptokai, marries Ermizhad, and knows peace, at least for a time. There is a very abrupt transition from Erekosë saving the Eldren at the very last moment - where he has the reader's complete symapthy - and his proceeding to destroy the human cites and villages and kill all their inhabitants, even when there is clearly no further threat to the Eldren, even hunting down and killing a few survivors hiding in caves. In effect, he has fulfilled the earlier-mentioned vow (""I will spare none! None! I want it to be over. And the only way I can finish it is to kill them all"") - only that it is now directed against the humans instead of the Eldren. The story clearly implies that Erekosë was foredoomed by some higher power to commit genocide, that his only choice was whether he would exterminate the Eldren or the humans, and that once the choice was made he was helpless to stop himself from carrying it through. The nature of that higher power and its motivations remain, however, unclear. The book's ending with this inevitable genocide might be a major reason for its relative lack of popularity.",0
4937163,The Tale of Johnny Town-Mouse,Beatrix Potter,1918,"{""/m/0dwly"": ""Children's literature"", ""/m/02xlf"": ""Fiction""}","Timmy Willie is a country mouse who falls asleep in a hamper of vegetables and is carried to the city. When the hamper is opened, Timmy escapes to find himself in a large house. He slips through a hole in the skirting board and lands in the midst of a mouse dinner party hosted by Johnny Town-mouse. Timmy is made welcome &ndash; and tries his best to fit in, but finds the noises made by the house cat and the maid frightening and the rich food difficult to digest. He returns via the hamper to his country home after extending an invitation to Johnny Town-mouse to visit him. The following spring, Johnny Town-mouse pays Timmy Willie a visit. He complains of the dampness and finds such things as cows and lawnmowers frightening. He returns to the city in the hamper of vegetables after telling Timmy country life is too quiet. The tale ends with the author stating her own preference for country living.",0
4937242,An Age,Brian Aldiss,1967,"{""/m/06n90"": ""Science Fiction"", ""/m/014dfn"": ""Speculative fiction""}","The story concerns Edward Bush, an artist searching for inspiration in the past. When Bush returns from a long stay in the Cryptozoic, he finds that his nation (presumably the United Kingdom) has been taken over by a totalitarian government. He is immediately drafted into the military and given the mission to kill the scientist Silverstone. As Bush mind travels again to fulfill his mission, he learns of Silverstone's new philosophical and scientific discoveries. Bush and Silverstone meet and decide together to usher in a new era of humanity, one enlightened by the realization that time flows backward.",0
4937548,Don't Stop the Carnival,Herman Wouk,1965,"{""/m/05hgj"": ""Novel""}","The novel takes place on the fictional island of Amerigo. According to the opening of the musical (a paraphrased excerpt from the novel): This book is said to be loosely based on Herman Wouk's experiences in managing an actual hotel, the Royal Mail Inn, in the early 1960s in St. Thomas, U.S. Virgin Islands. The hotel was on Hassel Island, located in Charlotte Amalie Harbour. Buffett refers to the development of the musical in his memoir of an aeronautical circumnavigation of the Caribbean shortly after his fiftieth birthday, A Pirate Looks at Fifty.",0
4938109,Green for Danger,Christianna Brand,1944,"{""/m/0lsxr"": ""Crime Fiction"", ""/m/02n4kr"": ""Mystery"", ""/m/014dfn"": ""Speculative fiction"", ""/m/02xlf"": ""Fiction"", ""/m/0c3351"": ""Suspense""}","A murder takes place in a rural British hospital. Inspector Cockrill is tasked to determine whodunit when the head nurse is killed after revealing that the death of a patient under anaesthesia was no accident. Cockrill states at one point, ""My presence lay over the hospital like a pall - I found it all tremendously enjoyable."" After another murder attempt leaves a nurse dangerously ill he re-stages the operation in order to unmask the murderer. it:Delitto in bianco",0
4938261,Bloody Jack,UNK,2002-09-01,"{""/m/0dwly"": ""Children's literature"", ""/m/03mfnf"": ""Young adult literature"", ""/m/0hwxm"": ""Historical novel""}","Mary Faber is an orphan in a gang on the streets of Cheapside, London, during the late 18th century. After the death of the gang's leader, she dons boy's clothing and goes to the docks, where she attempts to obtain a position as one of six ship's boys on the British warship H.M.S. Dolphin. Her endeavor is successful due to her ability to read, and she is signed under the alias Jack ""Jacky"" Faber. After boarding the ship, she meets the other ship's boys, named Tink, Willy, Benjy, Davy, and Jaimy. Jacky and the other ship's boys gain their sea legs and begin their duties on the ship. Jacky meets a seaman, Liam Delaney, who becomes her sea dad. Liam teaches her the ways of the ship and how to play the pennywhistle. After some time on the ship, Jacky finds that she's grown, and needing some new clothes, she makes her own. Jacky's new outfit catches the Captain's eye and is asked to sew up more for the others. As the plot develops, a pirate ship is spotted and a battle begins. The crew boards the enemy ship, and Jacky acquires a pistol from a dead pirate. She sees another pirate preparing to kill one of the ships boys, Jaimy, whom Jacky is starting to have feelings for. Then she shoots the pirate, who is carrying a chest of money, and thus gets the nickname ""Bloody Jack"". It is in this battle that Benjy, a ship's boy in The Brotherhood, (what Jacky and the other ship's boys call themselves), is killed. The ship heads for Palma to get there ship repaired after the battle. At about this time, Jacky first menstruates, and her upbringing having left her unaware of the details of female physical maturation, she believes that she is ill and about to die. After the ship lands at Palma, the ship's boys go to get a tattoo to show their brotherhood. Jacky then goes to a brothel to find a woman to ask 'for a friend' why she had bled before, where the madam quickly sees through her disguise and informs Jacky of the details of female bodies. The rest of the ship's boys consider Jack a rake after this, as they only know one nominal reason for a visit to a brothel. Then the ship heads for the Caribbean Sea. While Jacky is in the schoolroom, a sailor aboard the ship called Midshipman Bliffil starts to beat Jacky up, and only stops when the teacher yells at him. Jacky is put in the sick ward for her injuries. She convinces Midshipman Jenkins to stand up to Bliffil and teaches him some fighting moves. A crew member Bill Sloat threatens Jacky and her sea dad Liam Delaney tries to protect her, which causes some problems. When Bliffil attacks Jacky again, Jenkins stands up to him. Jacky begins to sleep in the rope locker because The Brotherhood's friendship is strained after recent events, and this is when Sloat tries to sexually assault her. Jacky tries to protect herself by stabbing him with her shiv, but she injures him more than she had meant to, and ends up stabbing him in the stomach and he stumbles overboard. Liam is put on trial for the murder and he is going to be hanged. Jacky intervenes and confesses to stabbing Sloat. She is put in confinement and thinks that she will be hanged instead, but she is set free because she had acted in self-defense. After that she is welcomed back by into the Brotherhood but the feeling is still weird. Jaimy admits to her that he has strange feelings for her, and that is when Jacky asks him to hold up a dress so she can mark it, and Jaimy learns that she is really a girl and that she has feelings for him. Soon after they arrive in Kingston, Jamaica. Jacky and Jaimy go out on the streets, and Jacky wears a dress that she bought. They eat at a café, and Davy and Tink see them. Davy and Tink do not know that the girl Jaimy is eating with is Jacky, and she leaves and changes back into her ship boy clothing. The group then finds a piercing shop, where they all get a gold hoop earring. Jacky and Jaimy exchange rings. Then they set sail again to hunt for the pirates. They soon encounter the pirate LeFievre (""The Fever"") at sea. There is a battle, but LeFievre gets away, and the Dolphin is damaged and in the process of sinking. Men are at the bilge pumps trying to keep the ship afloat when land is sighted, and the ship and crew stop for rest and repairs. Davy learns of Jacky's true identity when he discovers her and Jaimy curled up in a hammock together. Soon after, Mr. Tilden the teacher wants to put Jacky on a kite and fly her up so she can see more land, but the winds were blowing so hard that the tree she is tied to is ripped out of the ground and after many hours of flying she lands on an unknown island. She stays there for a few days and uses smoke signals to try to get the attention of HMS Dolphin. A boat crew from the Dolphin comes to rescue her and she finds out that LeFievre and his pirates are on the island with her and waiting to ambush the rescue crew. She tries to lead the rescue crew away but the pirates catch her and hold her for hanging and money. She is hanged, but is so scrawny and skinny that she just hangs there choking. The HMS Dolphin rescue crew lands, Jaimy quickly cuts the rope around her neck, and Jacky survives. Jacky is finally discovered to be a girl. She is guarded by someone everywhere she goes. She is confined from almost everyone on board, including her old mates, but they secretly sneak over to the grating above her room to talk to her. She is told by the captain that she will be enrolled in Lawson Peabody's School for Girls in Boston, and then the book concludes with her stepping off the ship.",0
4939886,Mistress of Spices,Chitra Banerjee Divakaruni,1997-02-06,"{""/m/014dfn"": ""Speculative fiction"", ""/m/05hgj"": ""Novel""}","Tilo, the titular ""Mistress of Spices,"" is a shopkeeper and an immigrant from India who helps customers satisfy their needs and desires with spices. Her life changes when she falls in love with an American man. When she was a little girl she could see what other people couldn't see.",0
4942424,The Lost Language of Cranes,David Leavitt,UNK,"{""/m/02xlf"": ""Fiction""}","Rose and Owen find out that their apartment is going co-op. Rose visits her son, who lives in a shabby neighborhood; he says he likes to go to the East Village. One Sunday, she takes a walk, goes to an automat, and bumps into her husband. The latter goes to a gay pornographic cinema, where a man leaves him his number. Philip and Eliot are in bed; Philip gets up to do the dishes. He thinks back to how they met through Sally. Back to the parents, Owen gets back to his apartment, soaked through. Philip and Eliot then wake up; Philip seems keen on flatmate Jerene's research on lost languages. There is then an account of Jerene's childhood up to her coming out to her parents and being spurned by them. Philip and Eliot then talk about their experiences with men. Philip goes on to remember the way he would masturbate a lot and how he tried to ask girls out - and they refused. Finally, he recalls going to a gay pornographic cinema when he was seventeen. Owen calls Alex Melchor and finds out it was a wrong number. Philip asks Eliot to introduce him to Derek and Geoffrey. Later, he goes to his parent's flat to look at Derek's books. Jerene is getting ready for a date. Philip meets Eliot's foster parents for dinner, then they go to a gay bar where Philip walks into old acquaintance Alex Kamarov. Outside, Eliot admits to being unsure about their relationship; nevertheless they return to Eliot's, where he teaches Philip how to shave properly. Philip eventually comes out to his parents. His mother is tersely averse; his father says it is fine, though he starts weeping as soon as the young man has left. In the library, Jerene reads an article about a child who emulates cranes as this was the only thing he would see out of his window from his cot, and his parents weren't about. He was then sent to a psych ward. Eliot doesn't return Philip's calls; when Jerene meets Philip for a drink, she admits there is not much that can be done. Later, Philip talks to his friend Brad. He then gets really drunk out on the town to forget. A few days later, he meets Rob in a bar and they return to the boy's dorm room where they have sex. Subsequently, Philip does not return his calls. Owen calls a gay hotline, then hangs up and calls Alex Melchor, who tells him to call someone else, and then Philip, hanging up before they can talk. Later, the Philip runs into his parents and tells them he's broken up with Eliot. Rose says to Philip that she needs more time to ruminate. Owen calls a gay sex phone-line and starts sobbing. He then goes to a gay bar and meets another man named Frank; they go to the man's flat and have sex. When he gets home, it's half past two in the morning, and Rose is hurt. Owen invites Winston Penn to dinner, and attempts to fix him up with Philip. That night, Rose finally realizes that Owen is gay too. While Philip and Brad get into bed together, Rose and Owen have a big argument. Owen goes off to a Burger King until he calls his son asking for a place to stay for the night. Before Philip goes to find with his father, he passionetly kisses Brad. There and then he confesses to being gay.",0
4943209,Wolfbane,Cyril M. Kornbluth,1959,"{""/m/06n90"": ""Science Fiction"", ""/m/014dfn"": ""Speculative fiction"", ""/m/02xlf"": ""Fiction""}","The story opens in the town of Wheeling, West Virginia. We first see Roget Germyn, a banker and model Citizen. An Eye forms over him while he is meditating, but he is interrupted and the Eye vanishes. He then returns to a more Earthly concern - whether or not the 'sun' will be regenerated, ending the current period of hunger and cold. Attention then shifts to Glenn Tropile, who lives among the Citizens, but regards himself as one of the feared Wolves. He has even managed to slowly coach his wife, Gala, toward a more Wolfish outlook. Despite this rebellious attitude, he maintains a genuine interest in meditation. Glenn Tropile is exposed as a Wolf while stealing bread. He escapes execution and is collected by a community of Wolves living in the town of Princeton. They find he doesn't entirely fit in there either, but hope he may get collected by an 'Eye', giving them a chance to measure this process in detail. This eventually happens and they find, as expected, that his disappearance was facilitated by the Pyramid on Everest. Glenn Tropile has been sent to the Pyramid's planet. We then learn his fate. To the Pyramids, the human race is nothing more than a useful source of 'Components' for a complex world-machine devoted mostly to feeding these artificial and semi-organic beings. Tropile is suspended in a fluid-filled tank and 'wired in' to the vast computer system. Later, he is linked to seven other humans as a 'Snowflake' - eight minds joined together to facilitate more complex tasks than a single human Component could manage. In this condition, Tropile wakes, manages to retain his sanity, and wakes the other humans. They eventually merge with one another to form a sophisticated collective mind. The freed Snowflake then spies on the Pyramids, finding that they have been traveling for some two million years, and have collected many species as Components, but seem locked in meaningless rituals surrounding an alien creature at the world's North Pole. They later realize that this is the last survivor of the race that created the Pyramids. In the meantime, they have modified the collection process of human Components so that it selects persons known to at least one of the eight people composing the Snowflake (which has become almost as ruthless and inhuman as the alien Pyramids). These humans are intended as 'mice,' disrupters of the planet, and later as an army with which to fight the Pyramids. Roget Germyn is one of them, as is Tropile's wife. Facing a philosophical dead-end, the 'Snowflake' decides to separate its component minds to study the problem. Restored to individual identity, Glenn Tropile becomes horrified at what he has done. However, the majority of the others want to carry on. While they are arguing, one of their number is taken over by the mind of the alien at the North Pole, who warns them that the Pyramids have noticed them and plan to wipe out half the planet to get rid of them. They initially re-merge their personalities as the Snowflake and expedite their plans. Tropile decides he must physically disconnect himself from the Snowflake and leave to lead the humans. They manage to defeat the Pyramids, but not before the remainder of the Snowflake is also destroyed. The humans free many of the other Components and ship them back to Earth. Tropile now finds he is a hero of sorts, but does not fit the role (though he never truly fit any role in which he was placed - Sheep, Wolf, or Component). He also sees that there is a need for someone to wire themselves back in to the alien planet's surviving systems, to re-kindle the 'sun' every five years and perhaps return the Earth to its original orbit. He doesn't want to do it alone, but most of the people he knows are either unwilling or unsuitable. On the last page, though, his wife agrees to join him. He expects that there will later be others, that ""[t]he ring of fire [will] grow.""",0
4943780,The Space Merchants,Cyril M. Kornbluth,1953,"{""/m/06n90"": ""Science Fiction"", ""/m/06nbt"": ""Satire"", ""/m/014dfn"": ""Speculative fiction"", ""/m/026ny"": ""Dystopia"", ""/m/02xlf"": ""Fiction""}","In a vastly overpopulated world, businesses have taken the place of governments and now hold all political power. States exist merely to ensure the survival of huge trans-national corporations. Advertising has become hugely aggressive and by far the best-paid profession. Through advertising, the public is constantly deluded into thinking that the quality of life is improved by all the products placed on the market. However, the most basic elements are incredibly scarce, including water and fuel. The planet Venus has just been visited and judged fit for human settlement, despite its inhospitable surface and climate; the colonists would have to endure a harsh climate for many generations until the planet could be terraformed. The protagonist, Mitch Courtenay, is a star-class copywriter in the Fowler Schocken advertising agency who has been assigned the ad campaign which would attract colonists to Venus. But a lot more is happening than he knows about. It soon becomes a tale of mystery and intrigue, in which many of the characters are not what they seem, and Mitch's loyalties and opinions change drastically over the course of the narrative.",0
