id,title,author,published_date,categories,summary,page_count
1889326,Night Mare,Piers Anthony,1983-01,"{""/m/06n90"": ""Science Fiction"", ""/m/014dfn"": ""Speculative fiction"", ""/m/01hmnh"": ""Fantasy"", ""/m/02xlf"": ""Fiction""}","Night Mare centers around Mare Imbrium, one of the night mares charged with delivering bad dreams to the people of Xanth. Imbri carries half a soul, her fee for carrying Chem Centaur out of the void in the previous book. She is unwilling to relinquish her soul, though the conscience that comes with it impedes her ability to deliver bad dreams. The Night Stallion, ruler of the gourd realm, makes Imbri the liaison to the day and night world and sends her to meet Trent, King of Xanth, with the ominous message, ""Beware the Horseman"". Imbri leaves the gourd realm and journeys to the day world, at first flinching from the touch of sunlight but realizing it would not harm her, though it nullified her ability to turn invisible and intangible. She sets out for Castle Roogna, determined to deliver the Stallion's message to King Trent. Along the way she meets a white stallion (wearing a ""thin brass band about his left foreleg, at ankle height""), which is rare in Xanth, because the offspring of most of the horses are half-breed animals like centaurs, created by the inbreeding most commonly induced by love springs. The ""Day Horse"" as she refers to him, is scared by her attempt at contact via a brief daydream, and runs away. She also meets an intelligent man wearing a brass bracelet, similar to that of the Day Horse, on his left arm. He asks her if she has seen the horse and says that he is wearing a bracelet like the one on his own arm. He convinces her to allow him to ride so they can track the Day Horse, but when she becomes confused by his verbal commands, she allows him to insert a bit into her mouth. Realizing she dislikes the bit, she asks him to remove it. When he refuses, she orders him off her, and to suborn her will to his, he uses spurs on her, and captures her. Imbri asks the man who he is, and he says ""I am the Horseman"". He then corrals her at his camp and builds a large bonfire to shine light on her and prevent her from turning intangible during the night. As the Horseman and his henchmen sleep, the Day horse approaches and courts her. She tells him of her plight and he affirms that he is terrified of the Horseman. The Day Horse, assists her anyway, and urinates on the fire, enabling her to escape. Imbri escapes and makes her way to Castle Roogna. When she arrives, the castle is preparing for the wedding of Prince Dor and King Trent's daughter, Princess Irene. Upon becoming acquainted with Chameleon, the wife of Bink and mother of Prince Dor, she is led to find King Trent, only to discover that he has been ensorcelled, staring blankly into space. Prince Dor, next in line to the crown and newly wed to Princess Irene, assumes the throne. He informs Imbri and others that the Nextwave Invasion is occurring; an army of barbarians from the neighboring, nonmagical land of Mundania has just entered Xanth. King Dor orders Imbri and Chameleon to seek advice from the Good Magician Humphrey. Imbri and Chameleon travel to Humphrey's castle and navigate through the standard three challenges, gaining access to the inside. Humphrey's wife, the fearsome Gorgon, leads the pair to the Magician. The old man casually repeats the Night Stallion's warning, ""Beware the Horseman"" and adds another cryptic instruction: ""Break the chain."" After battling with the Mundanes with King Trent's army from A Spell For Chameleon, Dor had fallen to the same ensorcellement as King Trent, and is now catatonic. Since the law of Xanth requires that a Magician sit on the throne, the Zombie Master (Jonathon) becomes the new king. Jonathan's magic talent is to reanimate the deceased, and he rallies his zombies to form an army to fight the Punic invasion from Mundania. Jonathan falls to the same bewitchment as Trent and Dor. Humphrey assumes the throne, and prepares himself for battle against the Punic horde and its leader Hasbinbad. He informs Imbri, much to the chagrin of the Gorgon, that he is not destined to be the savior of Xanth, and that he expects to make a tragic mistake in battle. Before departing to the battle, Humphrey identified his successor: Dor's father Bink, whom everybody assumed had no magic talent. Humphrey revealed to Queen Iris that Bink's talent was immunity from magical harm, and its nature had been hidden so his enemies would not revert to using nonmagical means to harm him. It was hoped that Bink would be immune from the effects of the Horseman's spell. Imbri was sent north to the border of Mundania, where Bink and the centaur scholar Arnolde were traveling. Imbri brought news to Bink and Arnolde of the invasion, and informed Bink that he was slated to become King of Xanth upon Humphrey's demise. Bink agreed to accompany Imbri back to the castle and instructed Arnolde to follow, for Arnolde would be king after Bink fell. Bink and Imbri traveled to the baobab tree and find Humphrey, taken by the power of the enemy. He has a bottle in his hand, and when Bink uncorks it, Humphrey's voice emits from it, with one word: ""Horseman"". Bink surmises that Humphrey's voice was identifying his assailant, and that they now knew who was ensorcelling the kings. Bink and Imbri prepare for battle alone, armed with Humphrey's numerous spells and potions. They set aside a box marked ""Pandora"". He and Imbri are victorious but are separated in the battle. When Imbri tracks down Bink, she finds that he has killed the Punic leader Hasbinbad, but has been taken with the Horseman's power nonetheless. Imbri returns to Castle Roogna to inform Arnolde the Centaur that he is now King of Xanth. Arnolde begins laying plans for his successor, and he interprets Xanthian law to his advantage. The law states that the king must be a Magician but had no precedence on whether the king had to be human or what sex. Arnolde states that a Sorceress is simply a female Magician, and that the law does not prohibit a woman from becoming king. He selects Queen Iris to be his successor, and he proclaims her daughter Irene to be a full Sorceress, thus establishing who would be the seventh and eights kings after him. Arnolde then instructs Imbri to report to the Night Stallion with an update. King Arnolde, realizing that the previous king's condition is similar to that of a person trapped by the hypno gourd, sends Imbri through, to the Night Stallion's dimension, to see if the missing Kings are within. Upon arrival, Imbri is amazed to learn that all five of the bewitched kings are present in the gourd. They surmise that the Horseman's magic talent is to connect a person's line of sight to another object, and that he has used this ability to make them all see into a hypnogourd, trapping their souls inside. Imbri brings this news to Castle Roogna, and eventually brings Princess Irene to the gourd to visit her new husband Dor, taken from her after their nuptials. Shortly after the pair return to Castle Roogna, Arnolde is taken by the Horseman, and Queen Iris becomes King Iris, the first female king. Iris uses her talent of illusion to inflict massive casualties on the Punic horde, who are now marching on Castle Roogna under the command of the Horseman. She briefly forms an image of her own face in front of the Horseman to mock him, whereupon he simply uses his talent to enscroll her. Princess Irene becomes king of Xanth next, and she identifies Chameleon as the next king, stating that, although Chameleon does not have Magician-Caliber talent, she would be the best option for king because she is in her ugly, but extremely intelligent phase. The Horseman expends nearly the rest of his forces in reaching Castle Roogna. Chameleon, realizing that the Day Horse and the Horseman are one and the same, lures him into the castle, and once he is inside, Irene uses her talent of accelerated plant growth to wrap the castle in a tight cocoon of plants, trapping him inside. Enraged, he uses his magic to ensnare her, whereupon Chameleon becomes king of Xanth and informs him that he will fail. He takes Chameleon with his power, too, and Xanth is left without a king. Imbri, having been previously named the Tenth King by Chameleon, because she is a creature of the Gourd, and can not enter the world via the peep hole, and therefore can not be forced into it, returns to castle Roogna. Imbri enters Roogna at night, so she is able to slip by the plants, and confronts the Horseman. He is now sitting on the throne, having proclaimed himself the new king of Xanth. As Imbri approaches, he shifts into his alternate form, and Imbri is stricken; she is in season, and he is a male horse. She is unable to act under his dominating power, but when the barbarians break into the castle and call out for their leader, he shifts back to his human form to answer. Imbri attacks and kills him, but the nine catatonic kings do not revive. Imbri realizes that the Horseman's magic talent was shape-shifting, and that the bands he wore around his wrists were magical bands that allowed him to perform his ensorcellment. Devastated, and with nothing to lose, she destroys the box marked PANDORA, and is surrounded by a pink smoke, and feels suddenly hopeful. She removes the band but does not destroy it, because that might not accomplish the goal of releasing the kings. She decides to travel to the Void, an area in the Elemental region of Xanth, from which nothing can escape. She takes the band there and throws it in, but is trapped by the gravitational pull of the Void. Terrified, her physical body is destroyed by the Void. The nine kings revive as the magical band is destroyed, and Imbri returns as a day mare, thanks to Humfrey, and is now charged with bringing pleasant daydreams instead of nightmares to the people of Xanth. King Trent and Queen Iris retire, leaving the throne to their new son-in-law, King Dor. pl:Nocna mara",0
1889337,Question Quest,Piers Anthony,1991-10,"{""/m/0dwly"": ""Children's literature"", ""/m/01hmnh"": ""Fantasy"", ""/m/014dfn"": ""Speculative fiction"", ""/m/02xlf"": ""Fiction""}","The book begins with Lacuna, one of the mischievous Castle Zombie twins, seeking a way to fix her ""dull"" life. To do so she comes to ask Grey, Ivy's betrothed and pro-tem magician of knowledge, for the answer. However, Grey doesn't want to answer her question because he knows that something terrible will come of it. Lacuna decides to make a deal that even Grey can't refuse, a way to outwit Com-Pewter. Lacuna plans to use her ability to change prints and write new ones to help Grey. Seeing no other choice, Grey decides to help her, but he realizes that he can't fathom what the book of knowledge is trying to say. Therefore, he sends her to the anteroom of hell to talk to Magician Humfrey. When Lacuna arrives to the anteroom, she finds Humfrey sleeping. After waking Humfrey up, she found out that he is waiting to talk to the Demon X(A/N)th to free his wife Rose. Humfrey tells her to write down his life story (and most of Xanth's history in the process), on the walls, so that he can get the demon's attention. It turns out that Humfrey has five wives. Humfrey manages to save his wives from the pits of hell (sort of) and Lacuna changes her life. pl:W poszukiwaniu odpowiedzi",0
1889339,The Color of Her Panties,Piers Anthony,1992-09,"{""/m/014dfn"": ""Speculative fiction"", ""/m/01hmnh"": ""Fantasy""}","Mela, like all merpeople, is able to turn into a full human so that she can walk on land. To follow ""landbound custom"", she finds clothing and shoes (conveniently growing on trees, as is common on Xanth). Of particular concern is which panties to choose - after all, there is significant interest in the color of her panties. After trying on dozens of pairs, Mela finally decides on plaid (the color she would choose was the subject of an Impossible Question that the Deamon X(A/N)th asked the Good Magician Humprey in Question Quest). Gwenny has to prove her courage to become leader of Goblin Mountain. Her task is to steal an egg from the Roc's nest. The two storylines are brought together when Mela has to help save Gwenny from a Roc and a hard place. pl:Barwa jej bielizny",0
1889342,Yon Ill Wind,Piers Anthony,1996-10,"{""/m/0dwly"": ""Children's literature"", ""/m/01hmnh"": ""Fantasy"", ""/m/014dfn"": ""Speculative fiction"", ""/m/02xlf"": ""Fiction""}","Hurricane Happy Bottom is causing problems in Mundania and Xanth. The Mundane Baldwin family is blown into Xanth by a Yon Ill Wind. Also, Demon X(A/N)th has made a deal with Demon JU(P/I)ter that he could get one Xanthian to shed a tear. The demons change up by making X(A/N)th into a dragon ass and is only able to talk once explaining to a Xanthian what the quest is. As Nimby, Demon X(A/N)th meets Chlorine and makes her beautiful and talented. Together with the Baldwin family, they must banish Happy Bottom From Xanth.",0
1889344,Zombie Lover,Piers Anthony,1998-10,"{""/m/01hmnh"": ""Fantasy"", ""/m/014dfn"": ""Speculative fiction"", ""/m/089m7"": ""Zombie"", ""/m/02xlf"": ""Fiction""}","Breanna, a beautiful young newcomer to the enchanted land of Xanth, must deal with a distressing dilemma. She has unwittingly attracted the affections of King Xeth, ruler of Xanth's Zombies, who yearns to make her Queen of the Undead! Her quest to preserve her innocence, and find her destiny, takes her on an exhilarating excursion packed with perils, puzzles, and piles of puns.",0
1889380,J.B.,Archibald MacLeish,UNK,UNK,"The play opens in ""a corner inside an enormous circus tent."" Two vendors, Mr. Zuss and Nickles, begin the play-within-a-play by assuming the roles of God and Satan, respectively. They watch J.B., a wealthy banker, describe his prosperity as a just reward for his faithfulness to God. Scorning, Nickles challenges Zuss that J.B. will curse God if his life is ruined. The two observe as J.B.'s children and property are destroyed in horrible accidents and the former millionaire takes to the streets. J.B. is visited by three Comforters (representing History, Science, and Religion) who offer contradicting explanations for his plight. He declines to believe any of them, instead calling out to God to show him the just cause for his punishment. When finally confronted by the circus vendors, J.B. refuses to accept Nickles' urging toward suicide to spite God or Zuss' offer of his old life in exchange for quiet obedience to religion. Instead, he takes solace in his wife Sarah and the new life they will create together.",0
1890954,Atonement,Ian McEwan,2001,"{""/m/02n4kr"": ""Mystery"", ""/m/02xlf"": ""Fiction"", ""/m/0c3351"": ""Suspense""}","Briony Tallis, a 13-year-old English girl with a talent for writing, lives at her family's country estate with her parents. Her older sister Cecilia attends University of Cambridge with Robbie Turner, the son of the Tallis family housekeeper and a childhood friend of Cecilia's. In the summer of 1935, Briony's maternal cousins, twins Jackson and Pierrot and Lola, come to visit the family. On this day Briony witnesses a moment of sexual tension between Cecilia and Robbie from afar. Briony misconstrues the situation and thinks that Robbie is acting aggressively toward Cecilia. Robbie, meanwhile, realizes he is attracted to Cecilia, whom he has not seen in some time, and writes several drafts of a love letter to her, giving a copy to Briony to deliver. By accident he gives her a version he had meant to discard, which contains lewd and vulgar references (""cunt""). Briony reads the letter and becomes disturbed as to Robbie's intentions. Later she walks in on Robbie and Cecilia making love in the library. Briony misinterprets the sexual act as rape and believes Robbie to be a ""maniac"". Later on at a family dinner party attended by Briony's brother Leon and his friend Paul Marshall, it is discovered that the twins have run away and the dinner party breaks into teams to search for them. In the darkness, Briony discovers her cousin Lola, apparently being raped by an assailant she cannot clearly see. Lola is unable or unwilling to identify the attacker, but Briony decides to accuse Robbie and identifies him to the police as the rapist, claiming she has seen Robbie's face in the dark. Robbie is taken away to prison, with only Cecilia and his mother believing his protestations of innocence. By the time World War II has started, Robbie has spent 2–3 years in prison. He is then released on the condition of enlistment in the army to fight in war. Cecilia has trained and become a nurse. She cuts off all contact with her family because of the part they took in sending Robbie to jail. Robbie and Cecilia have only been in contact by letter, since she was not allowed to visit him in prison. Before Robbie has to go to war in France, they meet once for half an hour during Cecilia's lunch break. Their reunion starts awkwardly, but they share a kiss before leaving each other. In France, the war is going badly and the army is retreating to Dunkirk. As the injured Robbie goes to the safe haven, he thinks about Cecilia and past events like teaching Briony how to swim and reflecting on Briony's possible reasons for accusing him. His single meeting with Cecilia is the memory that keeps him walking, his only aim is seeing her again. At the end of part two, Robbie falls asleep in Dunkirk, one day before the evacuation. Remorseful Briony has refused her place at Cambridge and instead is a trainee nurse in London. She has realized the full extent of her mistake, and decides it was Paul Marshall, Leon's friend, whom she saw raping Lola. Briony still writes, although she does not pursue it with the same recklessness as she did as a child. Briony is called to the bedside of Luc, a young, fatally wounded French soldier. She consoles him in his last moments by speaking with him in her school French, and he mistakes her for an English girl whom his mother wanted him to marry. Just before his death, Luc asks ""Do you love me?"", to which Briony answers ""Yes,"" not only because ""no other answer was possible"" but also because ""for the moment, she did. He was a lovely boy far away from his family and about to die."" Afterward, Briony daydreams about the life she might have had if she had married Luc and gone to live with him and his family. Briony attends the wedding of her cousin Lola and Paul Marshall before finally visiting Cecilia. Robbie is on leave from the army and Briony meets him unexpectedly at her sister's. They both refuse to forgive Briony, who nonetheless tells them she will try and put things right. She promises to begin the legal procedures needed to exonerate Robbie, even though Paul Marshall will never be held responsible for his (supposed) crime because of his marriage to Lola, the victim. The fourth section, titled ""London 1999"", is written from Briony's perspective. She is a successful novelist at the age of 77 and dying of vascular dementia. It is revealed that Briony is the author of the preceding sections of the novel. Although Cecilia and Robbie are reunited in Briony's novel, they were not in reality. It is suggested that Robbie Turner may have died of septicaemia, caused by his injury, on the beaches of Dunkirk and Cecilia may have been killed by the bomb that destroyed the gas and water mains above Balham Underground station. Cecilia and Robbie may have never seen each other again. Although the detail concerning Lola's marriage to Paul Marshall is true, Briony never visited Cecilia to make amends. Briony explains why she decided to change real events and unite Cecilia and Robbie in her novel, although it was not her intention in her many previous drafts. She did not see what purpose it would serve if she gave the readers a pitiless ending. She reasons that they could not draw any sense of hope or satisfaction from it. But above all, she wanted to give Robbie and Cecilia their happiness by being together. Since they could not have the time together they so much longed for in reality, Briony wanted to give it to them at least in her novel.",0
1891749,The Way Some People Die,Ross Macdonald,1951,"{""/m/0lsxr"": ""Crime Fiction"", ""/m/02n4kr"": ""Mystery"", ""/m/028v3"": ""Detective fiction"", ""/m/02xlf"": ""Fiction"", ""/m/0c3351"": ""Suspense""}","Mrs. Samuel Lawrence gives Lew Archer 50 dollars for one day of his time to find her daughter Galatea (a.k.a. Galley). Archer soon discovers she was married to a small-time mobster named Joe Tarantine. And shortly after that, a big-time mobster offers him five thousand to find Tarantine. The investigation quickly gains a body count and Lew is constantly drawn from Los Angeles to Pacific Point, Palm Springs, San Francisco, and back again, trying to tie together details that seem as random as they are violent.",0
1892513,The Tower Treasure,Franklin W. Dixon,1927-06-01,"{""/m/0dwly"": ""Children's literature"", ""/m/03mfnf"": ""Young adult literature""}","The story begins with Frank and Joe Hardy barely avoiding being hit by a speeding driver whom they notice has bright red hair. Later, this same red-haired driver attempts a ferryboat ticket office robbery and successfully steals a yellow jalopy called Queen from the Hardys' friend, Chet Morton. Due to one witness reporting that the villain had dark hair, the Hardys assume he is using a red wig. It is learned that the thief returned to Chet's home to steal a tire, helping Frank and Joe to find Queen abandoned in a public wooded area. The excitement of finding Queen is quickly gone when it is reported that there has been a robbery of forty thousand dollars in securities and jewels from the Tower Mansion owned by siblings Hurd and Adelia Applegate. Hurd Applegate is convinced that the Tower's caretaker, Henry Robinson, is the guilty party. The Hardys are especially concerned by this accusation because Henry's son, Perry, is a friend of theirs who will have to quit school to work since his father can no longer get a job as a result of Applegate's accusation. The only 'proof' of Henry Robinson's guilt is that he was suddenly able to pay off a debt, and refused to reveal where he got the money to pay off the debt. The Hardys suspect that the red-haired man may be involved with the Tower robbery and search the place where Queen was found, finding the red wig. The Hardys' dad, detective Fenton Hardy, learns that the wig was manufactured in New York City. The three Hardys go to New York and learn of a criminal named John ""Red"" Jackley who is fond of using disguises. Soon, Jackley is injured in a train accident causing him to be hospitalized. About to die, Jackley confesses that he committed the Tower Mansion robbery and put the loot ""in the old tower…"" Jackley dies before he is able to explain further. After searches inside and outside of the Tower Mansion the stolen loot is still not found. Frank and Joe decide to go to the railroad where Jackley used to work to find out more information. While investigating, they see two water towers nearby. The Hardys realize that Jackley was referring to the old water tower and not the Tower Mansion. Inside the water tower they find the stolen items but are locked in the tower by a man calling himself Hobo Johnny. Johnny feels that anything in the tower belongs to him. Frank and Joe broke out of the water tower and return the securities and jewelry. Then they are rewarded a thousand dollars for returning the missing jewels. In the original version of the book Henry admits that a man who owed him money repaid a debt to him, but he was not allowed to tell anyone in case the man's other debtors found out. This was revised in the 1959 version such that Adelia reveals that she loaned Henry Robinson the money to pay off his debt. Following the revelations and with the stolen loot returned, Hurd re-hires Henry with an increase in salary and Hurd builds a greenhouse for Henry.",0
