id,title,author,published_date,categories,summary,page_count
9328132,The Fur,UNK,2004,"{""/m/06n90"": ""Science Fiction""}","The Fur follows the late high school and early university years of the protagonist Michael Sullivan in an Alternate Reality version of Western Australia in the late 1990s following a meteor strike carrying an infectious and lethal fungus-like plague ('The Fur'). The entire state is under forced quarantine by Commonwealth and UN military forces. The novel revolves largely around Sullivan's struggles with his religious beliefs and dilemma on whether or not to attempt to break quarantine and start a new life in the uninfected Eastern States of Australia, at the risk of death and certain cost of abandoning his family and friends forever.",0
9331797,A Taste for Death,P. D. James,1986,"{""/m/0lsxr"": ""Crime Fiction"", ""/m/02n4kr"": ""Mystery"", ""/m/02xlf"": ""Fiction"", ""/m/0c3351"": ""Suspense""}","In the dingy vestry of St. Matthew's Church, Paddington, two bodies have been found with their throats slashed. One is an alcoholic vagrant, whereas the other is Sir Paul Berowne, a baronet and recently resigned Minister of the Crown. Poet and Commander Adam Dalgliesh investigates one of the most convoluted cases of his career...",0
9331930,In Evil Hour,Gabriel García Márquez,1979,"{""/m/05hgj"": ""Novel""}","In Evil Hour takes place in a nameless Colombian village. Someone has been placing satirical pasquinades about the town, outlining the locals' shameful secrets. Some dismiss these as common gossip. However, when a man kills his wife's supposed lover after reading of her infidelity, the mayor decides that action is called for. He declares martial law and sends soldiers (really just armed thugs) to patrol the streets. He also uses the 'state of unrest' as an excuse to crack down on his political enemies.",0
9333321,Surviving the Applewhites,Stephanie S. Tolan,2002,"{""/m/0dwly"": ""Children's literature""}","E.D.'s father Randolph is directing the local production of The Sound of Music, but is disheartened by the lack of genuine talent in the town. However, he hears Jake singing, and asks him to audition. Ultimately, Randolph casts the play, with Jake in the role of Rolf. However, Randolph is so bossy and demanding that the entire stage crew quits, leaving his family of artists to pool their collective talents to keep the show running. E.D. feels left out because she isn't creative, but her father makes her the stage manager because of her ability to organize. Resentful because her daughter wasn't cast as one of the Von Trapp children, the head of the theater ultimately cancels the show because of a small incident. E.D. proposes to continue the show in the family barn, and soon everyone is helping out to convert it into a theater. The night of the show arrives, and everything is going well. E.D. begins to believe that the play will be a success, but in the middle of the performance, the sound of rain and thunder become very loud. The performers stall until the weather lets up. They begin to sing and encourage the audience to join them. Soon after, the rain had calmed down and they continue the play. Just before the final scene, as the actors are about to head onstage, there is a blue and white flash and the electricity goes out. E.D. thinks the play is over until she thinks of an idea to save it. She tells the actresses playing the roles of nuns to hold candles so the audience can see what the actors are doing. Thanks to E.D. the show is a complete success. The next morning the family sits in the living room and reads the reviews. They say the play was outstanding, unlike any other. Because of what a report has written about Jake, he is now determined to be back onstage singing and acting again.",0
9333360,The Africa House,Christina Lamb,UNK,UNK,"The Africa House is an account of the life of soldier, pioneer white settler, politician and supporter of African independence Stewart Gore-Browne in relation to the building of his estate Shiwa Ngandu in Northern Rhodesia, now Zambia. Originating with a chance encounter in 1996 with Gore-Browne's grandson in Lusaka, the book uses Gore-Browne's diaries, letters, personal papers and photographs as well as those of his family, and interviews with family and friends, as its sources.",0
9335300,The Last Days,Scott Westerfeld,2007-08-02,"{""/m/06n90"": ""Science Fiction"", ""/m/0dwly"": ""Children's literature"", ""/m/03npn"": ""Horror"", ""/m/014dfn"": ""Speculative fiction"", ""/m/03mfnf"": ""Young adult literature"", ""/m/02xlf"": ""Fiction"", ""/m/04rlf"": ""Music""}","The narrative focuses around Moz, Zahler, Pearl, Alana Ray and Minerva, in an apocalyptic New York. Odd occurrences are taking place, the sewers are gushing black water, the earth shakes, and people are inexplicably going mad. In the midst of it all, two friends begin to see their dreams realized. Moz and Zahler have been friends for six years, playing their guitars without any clear direction. They have always dreamed of forming a band, but have never managed to quite get it done. Moz meets Pearl, a mysterious girl with a knack for music, who he teams up with to save a guitar that a crazy woman throws out of her window. When they begins learning more about one another, the image of a band becomes clear. With Pearl at their head, the band begins to recruit new members and take form. As the band becomes more and more real, new members join. Alana Ray, a skilled drummer and street performer with a mysterious condition that is never quite made clear (although is most likely to be some advanced form of synesthesia), joins them under the condition that Moz pays her. However, Moz keeps this deal secret from Pearl to gain something resembling control over the band. Alana Ray has the ability to see colored lights, which she considers to be hallucinations at times, and realistic at others. She often mentions that she is able to ""see"" the music they play. Pearl also convinces Minerva, her long-term friend, to join the band as their lead singer. Minerva was in a band with Pearl previously, but they broke up when Minerva contracted the parasite causing the madness in the city and begins to hate all the people she once loved, and she begins to hate her boyfriend, another member of the band, causing her to break up with him, thus breaking up the band. Minerva's parents have hired a woman, Luz, who believes in natural means to fight the parasite instead of the artificial means of modern doctors. Minerva uses these traditional methods such as garlic and rosemary to keep off the worst effects of the parasite, taught to her by Luz. Zahler eventually changes over from his position as lead guitarist to playing the bass, due to the fact he normally plays lower parts regardless and his fingers are suited for the larger instrument. Initially, he is unhappy that Pearl and Moz had devised this plan without his consent. However, he soon grows used to the bass. Meanwhile, Moz and Minerva begin to date in secret, causing the parasite to be passed on from Minerva to Moz. The band soon receives a recording contract with Astor Michaels, a man who is a carrier, who is known for having discovered a new type of music called ""New Sound"". He has been searching for a new type of music which involves a member of the band being infected, creating quite a unique effect. Because of Minerva, and soon the newly infected Moz, Astor Michaels soon believes to have discovered the perfect band. The five are still struggling to agree on a name for their band, but otherwise their band seems to be making its way quickly to fame. Moz begins playing in the subway to help raise money for the band, until things turn strange one night. A giant worm lurks in the nearby tunnels, and Moz is instinctively drawn to it, all of his instincts screaming to kill it. Before he gets the chance to attack it, the ""Angels"", seemingly defenders of the city against the people who have lost their minds, jump down to fight the worm. They soon reveal themselves to actually be carriers of the parasite from the New Watch (featured in Peeps), including Cal and Lace from Peeps. They attempt to bring Moz to New Jersey to treat his parasite, but he runs away, fearing letting down the band by missing their first gig. The band plays for its first time in a club at night, but it does not go perfectly as planned. Zahler freezes up in the beginning, although he eventually overcomes his stage fright and starts the song. But Minerva's song causes another giant worm to break through the ground, killing many people in the process. The New Watch comes to defeat the worm, and rounds up the whole band to take them to the New Jersey lab, but not before Moz smashes his beloved guitar because of the parasite. Moz receives treatment for the parasite in New Jersey, and when he has almost completely recovered, he and the rest of the band members visit the Shrink, a character included in Peeps. The Shrink believes that Minerva's singing has called up the worm, and that she can use this ability to help defeat them. Even the Nightmayor, centuries old, can barely remember this ancient talent as it was used in the previous resurfacing of the worms. None of the previous bands employed by Astor Michaels were able to achieve this same result because one member was infected, but not the lead singer. The New Watch recruits the band to sing to cause the worms to surface all around the country, thus allowing the New Watch to fight them on their own terms. The band goes on tour, travelling wherever they are needed, and Pearl finally comes up with the perfect name for the band: The Last Days. They become heroes of sorts, and finally achieve their dreams of fame, although not in the way that they originally planned. In the end, the worm attacks have ended, and civilization is rebuilding itself. Moz and Minerva are revealed to still be together, although they have broken up and gotten back together numerous times. Pearl has turned into a politician and is running for mayor of New York ""again"", leaving the fate of the rest of the characters unknown.",0
9336609,The Family Reunion,T. S. Eliot,UNK,UNK,"The play is in two acts, set in Wishwood, a stately home in the north of England. At the beginning, the family of Amy, Dowager Lady Monchensey are assembling for her birthday party. She is, as her doctor later explains, clinging on to life by sheer willpower: :...........I keep Wishwood alive :To keep the family alive, to keep them together, :To keep me alive, and I keep them. Lady Monchensey's two brothers and three sisters are present, and a younger relation, Mary, but none of Lady Monchensey's three sons. Among other things they discuss the sudden, and not to them wholly unwelcome, death at sea of the wife of the eldest son Harry, the present Lord Monchensey. Neither of the younger sons ever appears, both being slightly injured in motoring accidents, but Harry soon arrives, his first appearance at Wishwood for eight years. He is haunted by the belief that he pushed his wife off the ship. In fact Harry has an alibi for the time, but whether he killed her or not he wished her dead and his feelings of guilt are the driving force in the rest of the play. Lady Monchensey decides that Harry's state warrants the discreet observation of the family doctor, who is invited to join the party, ostensibly as a dinner guest. Mary, who has been earmarked by Amy as a future wife for Harry, wishes to escape from life at Wishwood, but her aunt Agatha tells her that she must wait: :...........You and I, Mary :Are only watchers and waiters, not the easiest role, Agatha reveals to Harry that his father attempted to kill Amy while Harry was in her womb, and that Agatha prevented him. Far from being grateful, Amy resented and still resents Agatha's depriving her of her husband. Harry, with Agatha's encouragement, announces his intention to go away from Wishwood, leaving his steady younger brother John to take over. Amy, despairing at Harry's renunciation of Wishwood, dies (offstage), ""An old woman alone in a damned house"", and Harry and his faithful servant, Downing, leave.",0
9337324,North Amerikkkan Blues,Evan X Hyde,UNK,"{""/m/012jgz"": ""Autobiographical novel""}","Evan Anthony Hyde tells the story of his last few months at St. John's College Sixth Form (now Junior College) in which he receives a scholarship from the local embassy to study at Dartmouth. After enduring threats from a Jesuit teacher who dislikes Hyde and wants to take his scholarship away despite his academic performance, the eighteen year old leaves Belize for Dartmouth. While there, he makes new friends and learns much more than he would have wished about the world outside of Belize. After two years and many adventures, Hyde makes a decision that affects his life irrevocably.",0
9338414,Politian,Edgar Allan Poe,UNK,UNK,"The play takes place in 16th century Rome. A man named Castiglione becomes engaged to a woman named Allessandra, inciting the jealousy of the orphan Lalage. Lalage meets a man named Politian and, after some flirtation, convinces him to take revenge on Castiglione. In the drama, Politian recites the poem ""The Coliseum,"" which Poe had previously published in 1833.",0
9340936,Undead and Unwed,MaryJanice Davidson,UNK,"{""/m/02n4kr"": ""Mystery"", ""/m/014dfn"": ""Speculative fiction"", ""/m/03npn"": ""Horror"", ""/m/01qxvh"": ""Romance novel"", ""/m/072lff"": ""Paranormal romance""}","Betsy Taylor—former model, newly unemployed secretary, 30, and still single—wakes up after being flattened by a Aztek Pontiac in a tacky coffin wearing cheap knock-off shoes. Her mother is glad she is back, albeit as a vampire, but her stepmother is enraged that Betsy has reclaimed her designer-shoe collection. With a wealthy best friend and a newly acquired doctor pal who is not susceptible to her formidable allure, she sets out to right wrongs but is abducted by Nostro, a tacky 500-year-old vampire who rules the undead roost. It seems that Betsy is an anomaly: a vampire who doesn't burn in sunlight, can fight the urge to feed, and is not repulsed by religious articles, all of which may make her the prophesied Queen of the Vampires. Teaming up with gorgeous vampire Eric Sinclair, who is in her opinion a major pervert, she takes on Nostro and his minions.",0
9341091,Undead and Unemployed,MaryJanice Davidson,UNK,"{""/m/02n4kr"": ""Mystery"", ""/m/014dfn"": ""Speculative fiction"", ""/m/03npn"": ""Horror"", ""/m/01qxvh"": ""Romance novel"", ""/m/072lff"": ""Paranormal romance""}","Nothing can make Betsy Taylor give up her shoe fetish- even dying and rising as the new Queen of Vampires. Only being royally undead doesn't mean that there aren't credit card bills to be paid. Luckily, Betsy lands her dream job selling designer shoes at Macy's Department Store. But then there's a string of vampire murders in town and Betsy has to enlist the help of the one vamp who makes her blood boil: the oh-so-sexy Eric Sinclair. Only the last time she ran into Sinclair she accidentally fulfilled an ancient prophesy- and ended up married to him...",0
9341164,Undead and Unappreciated,MaryJanice Davidson,UNK,"{""/m/02n4kr"": ""Mystery"", ""/m/014dfn"": ""Speculative fiction"", ""/m/03npn"": ""Horror"", ""/m/01qxvh"": ""Romance novel"", ""/m/072lff"": ""Paranormal romance""}","The novel has two prologues. The first prologue relates how the devil, out of boredom, possessed a ""not very nice"" woman and gave birth to a daughter; however, the devil soon returned to Hell, since she preferred it to living with a newborn. The devil's daughter, Laura, was given up for adoption by her biological mother, Antonia, for whom the possession was like a fugue state. Ironically, Laura is adopted by a Presbyterian minister and his wife, the Goodmans. The second prologue introduces the recently turned vampire Betsy Taylor, the heroine of the Undead series of paranormal romance novels, as she crashes a meeting of Alcoholics Anonymous, where she hopes to learn techniques to control her thirst for blood. The two prologues are related because Laura is Betsy's half-sister, sharing the same father; the not-very-nice Antonia is Betsy's stepmother. This third novel of the series has thirty-five chapters and, as usual, is told from the point of view of Betsy (first-person narrative). The early chapters introduce Betsy, who has become the Queen of the Vampires through odd circumstances, and her circle of friends/roommates. Her best friend is the very cool and very wealthy Jessica, whom she's known since the seventh grade; Jessica is patient with Betsy and supportive. Another close friend and confidante is Marc Spangler, an emergency-ward physician. Other major human characters include Betsy's father and stepmother Antonia (""the Ant""), who are expecting a baby, Betsy's professor mom Elise (a Civil War historian) and a policeman, Nick Berry. On the vampire side, Betsy is betrothed to the earnest Eric Sinclair, now King of the Vampires; although Eric is smitten with her, Betsy is not enthusiastic. The novel is framed by a minor story, a wedding between a vampire and a human, Andrea Mercer and Daniel Harris, who are friends with Betsy. Such marriages are almost unheard-of because vampires had traditionally viewed human beings as ""sheep"", that is, as food rather than romantic partners. In an early chapter, Betsy is asked to preside at the wedding; she does so in the final chapter, quoting from Romeo and Juliet: ""what love can do, that dares love attempt"". Throughout the novel, Betsy reminds herself that she needs to prepare for the wedding; Betsy's distractions are also highlighted by noting when she forgets about the upcoming wedding. The plot begins in earnest when Betsy receives a non-invitation to her stepmother's baby shower; the shower is scheduled for daylight hours, making it impossible for vampires to attend. To reinforce the snub, Betsy's weak-willed father visits Betsy at home to ask her to stay away, where he lets slip that the new baby is Antonia's second child. Betsy and her friends confirm this revelation from Antonia herself, who describes unwillingly how she woke up with no memories of the preceding ten months, and dropped the baby girl, Laura, off at the hospital. Much of the novel revolves around the search for Laura and getting to know her. Laura turns out to be a beautiful but bashful girl just beginning college, and eager to do the right thing for everyone. She's very sweet-natured and wholesome, always seeking peaceful solutions, and making friends with everyone, even people with difficult tempers. Getting to know Laura, Betsy likes her (although she envies her beauty) and can't bring herself to tell her about her sordid vampiric life or that Laura herself is the ""spawn of Satan"" and destined to conquer the world. Before finding Laura, Betsy is frustrated by not knowing enough and resolves to read the Book of the Dead, a holy relic for vampires analogous to the Bible. The Book was written by an insane vampire who could see the future; unfortunately, it also drives anyone reading it insane. Throwing caution to the wind, Betsy reads the Book for several hours. The Book describes Betsy's ascension to Queen of the Vampires and her marriage to Eric, and also predicts that her half-sister Laura is fated to take over the world. Unfortunately, the book drives Betsy insane or, rather, changes her into a traditionally thinking vampire, as shown by the novel's first-person perspective. In that state, she attacks her human friends Jessica and Marc, indulges unbridled passions with her consort Eric, and tries to kill his vampire assistant Tina, who defeats her handily. She wakes up with a bruised head, a recovered sanity and much remorse – and also a new power, to awaken before sunset, which she uses to take Laura to Antonia's baby shower, so that Laura can meet her birth mother. Throughout the remainder of the novel, she tries to recover her friends' trust, particularly Jessica's, and also make amends with Eric. The novel's climax occurs in a nightclub, Scratch. Betsy inherited the club, but the vampire staff are unhappy with her non-traditional changes, including not allowing them to drink blood from humans or kill them. The staff form a union and strike to demand better ""working conditions"". As their bargaining chip, the staff kidnap Betsy's half-sister Laura, mistaking her for an ordinary human girl. Unfortunately for them, they handle her too roughly and, despite her dislike of violence, Laura begins killing them with weapons formed from hellfire. Eric joins them and the three together win the fight with the vampires. Laura reveals that she'd known all along about Betsy and about herself, but she was waiting for Betsy to trust her enough. Laura is convinced that she can overcome her demonic heritage and be a good person, although she also displays a touch of temper. Later, Betsy meets the Devil herself—resembling a wonderfully dressed Lena Olin—who reveals that Laura will indeed take over the world. The novel is also marked by several minor stories that contribute to characterizing Betsy and her friends. It opens with a semi-serious discussion between Marc and Betsy about his recovery from alcoholism. Also near the beginning, Eric and his long-time assistant Tina return from a trip to Europe; Eric gives Betsy a little shoe necklace, playing on Betsy's well-known weakness for shoes and characterizing how much he cares for her. Betsy's compassion is highlighted by her treatment of ""George"", one of the Fiends she inherited from another vampire vanquished in an earlier novel. Fiends are vampires that have been driven insane, unable to speak or reason, by denying them blood. Most of the Fiends are being tended to by Betsy's vampire friend Alice, but George continually escapes and makes his way to Betsy's house. Betsy begins to feed him her own blood, and George begins to recover his sanity by learning to crochet.",0
9341218,Undead and Unreturnable,MaryJanice Davidson,UNK,"{""/m/03npn"": ""Horror"", ""/m/014dfn"": ""Speculative fiction"", ""/m/01qxvh"": ""Romance novel"", ""/m/02n4kr"": ""Mystery"", ""/m/01hmnh"": ""Fantasy"", ""/m/02xlf"": ""Fiction"", ""/m/072lff"": ""Paranormal romance""}","It's Christmastime in the Kingdom of the dead (Minneapolis), which is complicated as it sounds. Betsy Taylor isn't going to let a little thing like death and blood-drinking stop her from enjoying the holidays or planning her upcoming spring wedding to drop-dead gorgeous vamp Eric Sinclair. But all is not merry and bright-Betsy is plagued by ghosts who demand her help in rectifying their past mistakes, and a serial killer is on the loose. With his victims all being, blond women. Besty fits the profile exactly... The book starts out with the knowledge that Betsy is technically dead, however everyone but close family and friends think that she is still alive. In Betsy's life she has a stepmother, Antonia (the Ant) who gives birth to a younger brother, Jon, and her best friend, rich Jessica, and Laura, is technically her half-sister but also the devil's daughter after Satan possessed her stepmother (The Ant who gave her up to adoption to, ironically, the Goodman's) and produced a daughter. She also receives attention from a human boy who is a past member of a gang of vampie slayers. She also has a gay human friend called Marc, a doctor she saved in the first novel from suicide and a human policemen who is a former flame called Nick Berry. Aside from all of this she has vampire servants who work for her and a hostage wild vampire dubbed George the Fiend. George is a wild vampire created by a 500 year old vampire Betsy killed. She feeds him with her blood to make him stronger and Jessica teaches him different things such as crocheting. Laura later attacks George the Fiend thinking her mother (Satan) is using him to annoy her and meddle in her life. After Betsy tries to break up the fight Laura stabs her with a sword forged by Hellfire that kills magical creatures, however it doesn't kill her. After this Laura is sent to feed him. Eric and Betsy fight after she reveals she can hear his thoughts during sex. Eric is hurt she doesn't tell him earlier and goes back to his room which causes Betsy to point out that he hasn't fully committed to their relationship. Also, in an attempt to connect with her people Betsy starts an advice column intended for new vampires which others deem as stupid. Also, the human boy, with the decidedly shady past as an ex-vampire slayer, decides to write her life story as a fiction story and publish it through his university course, however Sinclair and his best friend Tina wipe his memory of it to save Betsy from exposure. After a serial killer known as the ""Driveway Killer"" kills her stepmother's next door neighbor a ghost starts plaguing Betsy. Laura and her set out to find him and discover him in a rundown house with a hostage. Laura kills him and the two set the hostage free. Betsy finds herself somewhat frightend of Laura doing the fight scene in which the overtake the serial killer and set the hostage free. In this novel it seems that Antonia knows that Laura is her daughter.",0
