id,title,author,published_date,categories,summary,page_count
773456,Smiley's People,John le Carré,1979-11,"{""/m/06wkf"": ""Spy fiction""}","Maria Andreyevna Ostrakova, a Soviet émigrée in Paris, is told by a Soviet agent calling himself ""Kursky"", that the daughter, Alexandra, who she was forced to leave behind, may be permitted to emigrate and join her for ""humanitarian reasons"". Ostrakova eagerly applies for French citizenship for her daughter, but time passes with no sign of Alexandra and no further contact with ""Kursky"". She realises that she has been duped, and writes to General Vladimir, an old friend of her late husband, also a former Soviet general and covert British agent, for help. Vladimir immediately realizes that Ostrakova was unwittingly used to provide a ""legend"", or false identity, for an unknown young woman in a scheme personally directed by KGB spymaster Karla. He also recognises that the operation is wholly unofficial, because Karla uses blundering Soviet diplomats instead of trained intelligence officers working under diplomatic cover. Vladimir attempts to contact ""Hector"" (Toby Esterhase), his old handler and ""postman"" in the British Secret Service, but Esterhase has left the service and refuses to be involved in Vladimir's plans. Nevertheless, Vladimir sends a confidante, Otto Leipzig, to interview Ostrakova in Paris. From a photograph, Ostrakova immediately identifies the agent ""Kursky"". Vladimir later sends another agent to Hamburg to collect vital proof from Leipzig. He contacts British Intelligence again, insisting on speaking to his former senior case officer ""Max"" (George Smiley), not realising that Smiley is also retired. The current Circus personnel, unfamiliar with Vladimir, are sceptical and uncooperative. Meanwhile, Vladimir's activities have been betrayed by Karla's network of informants within the Russian émigré community. Vladimir is assassinated while on his way to meet with a young and inexperienced handler from the Circus, evidently by Moscow agents. New Circus head Saul Enderby and Civil Service undersecretary Oliver Lacon are certain that the General was merely an obscure ex-agent seeking attention, and want to bury the matter quickly to protect themselves and the Circus from any scandal. They recall Smiley from his forced retirement in the hope that he will bury any links to the Circus. Unlike Enderby and Lacon, Smiley takes Vladimir's claims seriously and begins to investigate. He fortuitously recovers a letter sent to the General by Ostrakova, who is now being shadowed and fears for her life. Near where Vladimir was killed, he also discovers Vladimir's half-empty packet of Gauloises cigarettes, containing the negative of a compromising photograph of Leipzig and another man. Smiley recalls that Leipzig had often used a venal Soviet agent named Oleg Kirov, who was susceptible to blackmail, as a source of information. Smiley surmises that Kirov is probably the other man in the photograph. Meanwhile, Soviet agents bungle an attempt to kill Ostrakova. Smiley consults former Circus researcher Connie Sachs, who remembers some background information on Kirov, also known by the cover name ""Kursky."" Following Vladimir's logic that Karla was acting outside the dedicated system he himself devised, Connie also recounts rumours that Karla had a daughter by a mistress whom he had deeply loved but who ultimately turned against him and was sent to the Gulag on Karla's orders. The daughter, Tatiana, grew up without a mother and with a father she never knew, became mentally unstable, and was subsequently confined to a mental institution. Smiley flies to Hamburg, where he hopes to learn the rest of the story. He tracks down Claus Kretzschmar, an old associate of Leipzig and owner of the seedy night club where the photograph was taken. Kretzschmar gives him directions to Leipzig's temporary address on a boat in a gypsy encampment on the Baltic Sea near Lübeck, but two of Karla's agents have found Leipzig first, and tortured and killed him. Smiley's search of Leipzig's boat uncovers what Karla's agents did not; the torn half of a postcard hidden underwater in an old gym-shoe on the hook of a fishing-line. His discovery is witnessed by several people, and his rental car is severely damaged by two gypsy kids. Smiley rushes to finish his work in a small town near Hamburg before German police and Soviet agents close in on him. Here, Smiley appears as the spy of old and a master of ""tradecraft"". He takes the half of the postcard to Kretzschmar, who matches it to the other half and gives Smiley a tape recording made at the time the photograph of Leipzig and Kirov was taken, and the photocopy of Ostrakova's first letter to Vladimir, which he had sent to Leipzig. He lays a false trail in the direction of Heathrow, and then hastens by train and ferry to Copenhagen from where he flies straight to Paris, fearing for Ostrakova's life. With help from his old friend and former lieutenant Peter Guillam, who is serving out his days in the British Embassy in Paris, Smiley gets Ostrakova to safety. He also learns that Kirov has been summoned back to Moscow, and has probably been killed for his indiscretions. Smiley then returns to London where he meets in secret with Enderby. The transcribed tape of Kirov's confession to Leipzig shows that Karla is secretly diverting official funds (US $10,000 every month) to a bank in Thun in Switzerland and misappropriating other resources using a commercial attache of the Soviet embassy in Bern, named Grigoriev. The money is going to the care of Karla's daughter, who has been committed to an expensive Swiss psychiatric sanatorium under the faked citizenship papers of Ostrakova's daughter. Smiley explains that if British Intelligence can obtain proof of this activity, they may have the information necessary to blackmail (or ""burn"") Karla and force him to defect or face disgrace and possibly execution. Unexpectedly, Smiley obtains approval, and secret and deniable funding, from Enderby to mount an operation to secure the evidence from Grigoriev and close the trap on Karla. While Smiley does research at the Circus, Toby Esterhase, the former head of the Circus's ""lamplighters"" (covert surveillance operations) section, sets up a team in Bern to keep Grigoriev under observation. Smiley then visits his estranged wife, Ann, and makes a point of cutting all relations with her, deliberately shedding his illusions (Karla previously described Ann as 'the last illusion of an illusionless man') as he prepares to face down his greatest foe. Smiley recognises how ruthless he must become if he is to be Karla's nemesis. In Bern, Smiley learns that, like Kirov, Grigoriev is untrained in spycraft and hopeless at concealment. Esterhase's team soon gains ample evidence of his unofficial handling of funds for Karla and his affair with one of his secretaries. Although Grigoriev is normally accompanied everywhere by his formidable wife, Grigorieva, he makes an informal trip into Bern by himself to watch an open-air chess match one Sunday and is bundled into a car by Esterhase and his helpers. He is then subjected to Smiley's expert interrogation, and given the choice of cooperating and defecting, or being accused by Swiss authorities of using a faked Swiss passport and breaking banking laws. Following the official protest he would be returned overnight to the Soviet Union in disgrace with the prospect of a lifetime facing Karla's and Grigorieva's wrath. Grigoriev quickly confesses all he knows of the arrangements regarding ""Alexandra's"" care and the details of the visits he makes to her. Although it is unnecessary, Smiley visits ""Alexandra"", who is being treated in an institution run by an order of nuns. Among her ""symptoms"" is her insistence that she is actually called Tatiana and is the daughter of a powerful man who can make people disappear but who does not actually exist. Smiley then writes a letter to Karla, which Grigoriev passes on instead of his usual weekly report on ""Alexandra's"" condition and the minutiae of her treatment. Although not described, it is assumed the letter details Karla's illegal activities and offers him the stark choice between defection to the West and protection for Tatiana, or exposure, leading inevitably to his destruction by adversaries within Moscow Centre, and Tatiana being left to her fate. In a final scene reminiscent of the opening scene of The Spy Who Came in from the Cold, Karla, posing as a labourer, defects using a walk-bridge at the Berlin Wall. Unlike Karl Riemeck in The Spy Who Came in from the Cold, Karla does not panic during the crossing and makes it safely to the Circus's waiting car. Before crossing over into the waiting arms of Western agents, Karla stops and lights a new Camel. He drops the golden cigarette lighter near Smiley he had purloined from him years ago in an Indian prison, a gift to George from his unfaithful wife Ann. Given the opportunity, Smiley fails to pick up the lighter — another sign that he has become that which he resisted for so long. Karla is finally defeated, but the similarity of Smiley's methods to the cold and ruthless techniques of Karla himself robs Smiley of any apparent sense of triumph in the book's closing sentences.",0
776049,Harry Potter and the Deathly Hallows,J. K. Rowling,2007-07-21,"{""/m/0dwly"": ""Children's literature"", ""/m/01hmnh"": ""Fantasy"", ""/m/014dfn"": ""Speculative fiction"", ""/m/02xlf"": ""Fiction""}","Following Dumbledore's death, Voldemort continues to gain support and increase his power. When Harry turns seventeen, the protection he has at his aunt and uncle's house will be broken. Before that can happen, at Mad Eye Moody's suggestion, Harry flees to the Burrow with his friends, many of whom use Polyjuice Potion to impersonate him so as to confuse any Death Eaters that may attack. They are indeed attacked shortly after leaving Privet Drive; Mad Eye is killed, and George Weasley wounded, but the rest arrive safely at the Burrow. Ron and Hermione decide to accompany Harry, instead of returning to Hogwarts School for their seventh year, to finish the quest Dumbledore started: to hunt and destroy Voldemort's four remaining Horcruxes. They have little knowledge about the remaining Horcruxes except that one is a locket once owned by Hogwarts' co-founder Salazar Slytherin, one is possibly a cup once owned by co-founder Helga Hufflepuff, a third may be connected with co-founder Rowena Ravenclaw, and the fourth may be Nagini, Voldemort's snake familiar. The whereabouts of the founders' objects is unknown, and Nagini is presumed to be with Voldemort. Before leaving, they attend Ron's brother's Bill's wedding to Fleur Delacour, with Harry disguised by Polyjuice Potion, but the Ministry of Magic is taken over by Death Eaters during the wedding and they barely escape with their lives. Harry, Ron, and Hermione flee to 12 Grimmauld Place in London, which is Sirius Black's family's house, where they learn from the house-elf Kreacher the whereabouts of Salazar Slytherin's locket, which Sirius' brother Regulus stole from Voldemort at the cost of his own life. They successfully recover this Horcrux by infiltrating the Ministry of Magic and stealing it from Dolores Umbridge. Under the object's evil influence and the stress of being on the run, Ron leaves the others. As Harry and Hermione search for the Horcruxes, they learn more about Dumbledore's past, including the insanity and death of Dumbledore's younger sister and his connection to the evil wizard Grindewald. Harry and Hermione ultimately travel to Godric's Hollow, Harry's birthplace and the place where his parents died. They meet the eldery magical historian Bathilda Bagshot, who turns out to be Nagini in disguise and attacks them. They escape into the Forest of Dean, where a mysterious silver doe that appears to be a Patronus leads Harry to the Sword of Hogwarts co-founder Godric Gryffindor, one of the few objects able to destroy Horcruxes, lying at the bottom of an icy lake. When Harry attempts to recover the sword from the pool, the Horcrux attempts to kill him. Ron reappears, saving Harry and then using the sword to destroy the locket. Resuming their search, the trio repeatedly encounter a strange symbol that an eccentric wizard named Xenophilius Lovegood tells them represents the mythical Deathly Hallows. The Hallows are three sacred objects: the Elder Wand, an unbeatable wand; the Resurrection Stone, with the power to summon the dead to the living world; and an infallible Invisibility Cloak. Harry learns that Voldemort is seeking the Elder Wand, recognizes the Resurrection Stone from the second Horcrux, which Dumbledore had destroyed, and realizes that his own Invisibility Cloak is the one mentioned in the story, but he is unaware of the Hallows' significance. The trio are captured and taken to Malfoy Manor, where Bellatrix Lestrange tortures Hermione. Harry and Ron are thrown in the cellar, where they find Luna Lovegood, Ollivander, Dean Thomas, and Griphook. They escape to Shell Cottage (Bill and Fleur's house) with Dobby's help, but at the cost of the house-elf's life. Harry now realizes that the Hallows may have the power to defeat Death and knows that Voldemort robbed Dumbledore's tomb to procure the Elder Wand, but he decides to focus on finding the Horcruxes instead of the Hallows. With Griphook's help, they learn that Helga Hufflepuff's cup - a Horcrux - is hidden in Bellatrix's vault at Gringotts, break into her vault, retrieve the cup, and escape on a dragon, with Griphook swiping the sword and escaping on his own. From his connection to Voldemort's thoughts, Harry learns that another Horcrux is hidden in Hogwarts, which is under the control of Severus Snape. Harry, Ron, and Hermione enter the school through Hogsmeade (being saved by Aberforth Dumbledore, who explains more about Albus's backstory) and - with the help of the teachers - Snape is ousted from the school. Ron and Hermione go to the Chamber of Secrets and destroy the cup using a basilisk fang. The trio then finds Rowena Ravenclaw's diadem (another Horcrux) in the Room of Requirement. Vincent Crabbe casts a Fiendfyre curse in an attempt to kill Harry, Ron, and Hermione, but he instead destroys the diadem, the Room of Requirement, and himself. At this point, a total of five Horcruxes have been destroyed. The Death Eaters and Voldemort besiege Hogwarts, while Harry, Ron, Hermione, their allies, and various magical creatures defend the school. Several major characters are killed in the first wave of the battle, including Remus Lupin, Nymphadora Tonks, and Fred Weasley. Voldemort kills Severus Snape because he believes doing so will make him the Elder Wand's true master, since Snape killed Dumbledore. Harry discovers while viewing Snape's memories that Voldemort inadvertently made Harry into a seventh Horcrux when he attacked him as a baby, which is the true significance of Harry's scar, and that Harry must die in order to destroy Voldemort. These memories also confirm Snape's unwavering loyalty to Dumbledore and that his role as a double-agent against Voldemort never wavered after Voldemort killed Lily Evans, Harry's mother and Snape's one true love. Harry also learns that Dumbledore had less than a year to live when he died, that his death by Snape's hand had been per Dumbledore's request, and that Dumbledore had known that Harry must die. After using the Resurrection Stone to bring back his deceased loved ones for a short while, Harry surrenders himself to death at Voldemort's hand. Voldemort casts the Killing Curse at him, but it only sends Harry into a limbo-like state between life and death. While in this state, Dumbledore's spirit explains to Harry that when Voldemort used Harry's blood to regain his full strength, it protected Harry from Voldemort killing him; however, the Horcrux inside Harry has been destroyed, and Harry can return to his body despite being hit by the Killing Curse. Dumbledore also explains that Harry became the true master of the Deathly Hallows by facing Death, not by seeking to avoid it or conquer it. Harry returns to his body, feigning death, and Voldemort marches victoriously into the castle with his body. However, per Harry's prior instructions, Neville Longbottom kills Nagini, the last Horcrux, with the Sword of Gryffindor. Harry then reveals that he is still alive, and the battle resumes, with Bellatrix Lestrange being killed by Molly Weasley. Harry and Voldemort engage in a final climactic duel. Harry reveals that because he willingly sacrificed himself to death by Voldemort's hand, his act of love would protect the Wizarding community from Voldemort in the same way the sacrifice Harry's mother made protected Harry. Harry also reveals that Snape was not loyal to Voldemort, did not murder Dumbledore, and was never the master of the Elder Wand. Instead, Draco was the master of the Elder Wand after disarming Dumbledore, but, because Harry had disarmed Draco at Malfoy Manor, Harry is the true master of the Elder Wand. Harry claims that the wand will refuse to kill the one to whom it owes allegiance, further protecting Harry. During the duel, Harry refuses to use the killing curse and even encourages Voldemort to feel remorse, one known way to restore Voldemort's shattered soul. Voldemort dies when his own killing curse backfires against Harry's disarming curse, killing himself; the Death Eaters are finally defeated. The wizarding world is able to live in peace once more.",0
776736,Alphabet of Thorn,Patricia A. McKillip,2004-02,"{""/m/014dfn"": ""Speculative fiction"", ""/m/01hmnh"": ""Fantasy""}","Nepenthe is a sixteen-year-old orphan who was found and raised by the Royal Librarians of Raine. During the new queen's coronation, visitors and ambassadors from the Twelve Crowns (domains) that comprise Raine gauge Queen Tessera's strength. Bourne of Seale, a junior mage from the Floating School, meets Nepenthe in the library with a book inscribed with an unknown language, which seems to be written in configurations of plant thorns. Instead of delivering it to the Master Librarians, Nepenthe decides to transcribe it herself; she soon becomes obsessed with learning the book's outcome. On the surface, it appears to be an epic poem documenting the conquests of Axis and Kane, an emperor and ""the Hooded One,"" three thousand years early. As Nepenthe continues reading, the ruler of Seale prepares to usurp the throne from Tessera, whom he views as weak. (She is only fourteen years old.) Reading further as Seale's army marches (and Bourne is imprisoned for treason), Nepenthe learns that Axis and Kane traveled through time to expand the reach and strength of Axis' empire. Popular histories in Raine list the man Kane as Axis' court mage; Kane was, but the woman Kane was also his lover who opened the Gates of Time for him. Kane became pregnant with his child, and she traveled with the infant through time to a cliff side near Raine. She wrote a book about her life in the language of thorns and because of her enchantments, no one but her daughter could read it—by the book's climax, she has. The final words of the book open the Gates of Time that admit Axis and Kane, Nepenthe's parents, and their uncountable legions of followers near Raine, three thousand years in their future. When Queen Tessera learns of the planned invasion, with the help of Vevay, her own mage, and the magicians of the Floating School, she uses magic to make Raine seem a dilapidated ruin and thereby protect it from Axis. Nepenthe meets her mother and refuses Kane's offer to rule Raine, because it would require Nepenthe to turn her back on the only world she's ever known. Kane chooses to remain in Raine, where she can be with her daughter and won't have to hide her identity. This effectively stops Axis' conquests because without her; he can't travel through the Gates of Time. The forces of Seale see Axis's army retreat in fear, which strengthens Tessera's claim on the throne. Kane stays with her daughter, and Nepenthe remains in the Royal Library, the only life she ever wants to know.",0
779075,And the Ass Saw the Angel,Nick Cave,1989,"{""/m/039vk"": ""Gothic fiction"", ""/m/02xlf"": ""Fiction"", ""/m/05hgj"": ""Novel""}","And the Ass Saw the Angel tells the story of Euchrid Eucrow, a mute born to an abusive drunken mother and a father obsessed with cruel traps and animal torture. His father's dangerous traps could maim or kill an unwary person. An outcast, scorned even among outsiders, in a valley of fanatically religious Ukulites, Euchrid bears his mother's beatings, his father's inturned indifference, and the hatred and loathing of an entire town. Euchrid's increasingly fractured mind teems with words and horrible angelic visions, narrated by his silent Southern drawl. (To wit, Cave phonetically renders the boy-narrator's ""I"" as ""Ah."") Raised to inevitable madness in this world of inbreeding, moonshine, and fanaticism, Euchrid will exact his terrible vengeance on the people who have made his life one of nearly unrelenting pain.",0
779173,Super-Cannes,J. G. Ballard,UNK,"{""/m/014dfn"": ""Speculative fiction"", ""/m/02xlf"": ""Fiction""}","In the hills above Cannes, a European elite has gathered in the business-park Eden-Olympia, a closed society that offers its privileged residents luxury homes, private doctors, private security forces, their own psychiatrists, and other conveniences required by the modern businessman. The book's protagonist, Paul, quits his job as an editor and moves to Eden-Olympia with his wife Jane when she is offered a job there as a pediatrician. At first glance, Eden-Olympia seems the ideal workers' paradise, but beneath its glittering, glass-wall surface, all is not well. For if things are running smoothly, then why are all the residents &mdash; these well-established businessmen, doctors, architects, and producers &mdash; all suffering heavily from stress and insomnia? And why did Jane's predecessor, the well-liked and apparently quite sane David Greenwood, go to work one day with an assault rifle strapped over his shoulders, murdering several of his friends and co-workers, before he put the rifle to his own head? Quickly bored with life in Eden-Olympia (""the kind of adolescent society where you define yourself by the kind of trainers you wear""), Paul decides to investigate the events that led to Greenwood's death, and begins walking in his footsteps. He soon discovers that just beneath the calm, well-mannered surface of his new home lies an underworld of crime, deviant sex, and drugs that seems to be prospering and growing. And all the residents at Eden-Olympia seem not only to be aware of this, but to encourage and welcome this underworld, as it provides them with a means to relate to something other than their jobs, and &mdash; by entering that world &mdash; to let go of the social restraints and etiquette that define their lives. Paul discovers that Eden-Olympia's resident psychiatrist, Wilder Penrose, is eagerly encouraging his patients (and there are many of them) to indulge themselves in activities involving sex and violence, as a (successful) cure for their symptoms of stress. Says Penrose: ""Psychopathy is its own most potent cure, and always has been. At times, it grasps entire nations in its grip and sends them through vast therapeutic spasms. No drug in the world is that powerful."" ru:Суперканны",0
779580,Day of Al'Akbar,Allen Hammack,UNK,UNK,"Day of Al'Akbar is a scenario set in an Arabian Nights-style desert land, where the player characters search the sewers under the city of Khaibar for an entrance to the tomb of Al'Akbar to find the holy Cup and Talisman, which can save their home from a plague. The module describes Khaibar City and the sultan's palace. In this adventure, the player characters must save Arabic lands from a red plague by retrieving a magical artifact. The adventure involves wilderness encounters, dungeon crawling in a sewer, tomb-robbing, some detective work in a desert town, and a final confrontation in the Sultan's palace. The land of Arir, a once peaceful desert country, has fallen into the hand of infidels. The ruler, Sultan Amhara, was killed in the battle for the capital city of Khaibar. He left behind one of the greatest treasure stores ever amassed, including the Cup and Talisman of Al'Akbar. A deadly plague sweeps your land. The holy men could cure the deadly plague which sweeps the land, if they had the Talismanm which the player characters must find. {| class=""wikitable"" |- ! Chapter ! Page |- | Introduction | 2 |- | Journey to Khaibar | 3 |- | The sewers of Khaibar | 5 |- | Beyond the Walls | 14 |- | The Sultan's Palace | 35 |- | Artifacts | pullout section |- | Glossary of Useful Terms | pullout section |- | Prerolled Characters | pullout section |- | Players' Riddle Illustration | 39 |} * Al'Farzikh: 7th level assassin * Vahtak: 6th level thief * The Mad Dog of the Desert: 14th level Magic user/16th level assassin * The Crescent Witch: 8th level Magic user",0
779593,The Keep on the Borderlands,Gary Gygax,1979-12,"{""/m/06c9r"": ""Role-playing game""}","Player characters begin by arriving at the eponymous keep, and can base themselves there before investigating the series of caverns in the nearby hills teeming with monsters. These Caves of Chaos house multiple species of vicious humanoids. Plot twists include a treacherous priest within the keep, hungry lizardmen in a nearby swamp, and a mad hermit in the wilderness. It typifies the dungeon crawls associated with beginning D&D players, while permitting some limited outdoor adventures. When The Grand Duchy of Karameikos edition of the Gazetteer series was published, the Keep was given a specific location in the Known World of Mystara, in the Atlan Tepe Mountain region in northern Karameikos.",0
