id,title,author,published_date,categories,summary,page_count
1317181,The Gift,Vladimir Vladimirovich Nabokov,UNK,UNK,"Fyodor Konstantinovitch Cherdyntsev is a Russian émigré living in Berlin in the 1920s, and the chapter starts with him moving to a boardinghouse on Seven Tannenberg Street. He has recently published a book of poems, and receives a call from Alexander Yakovlevich Chernyshevski congratulating him on the poems and inviting him to come over to a party to read the favorable critique in the newspaper. The poems reach back to Feodor’s childhood that was spent with his sister Tanya in the pre-revolutionary St. Petersburg and the Leshino manor, the country estate of the Godunov-Cherdyntsevs. Fyodor arrives at the party only to learn that he fell victim to a crude April fool’s joke; his book had not received any attention in the literary circle. The Chernyshevskis had a son, Yasha, who ""looked like Fyodor"" who had loved poetry. Yasha died by suicide when caught in a tragic love triangle. His mother wanted Fyodor to use his story for his writing, but he declined. As a result of Yasha’s death, his father had episodes of insanity. When Fyodor returns to his “new hole” he notices that he had taken the wrong keys, fortunately, after a while a visitor is leaving and he can get back in. Fyodor “dawled away the summer”. In the fall he attends a literary meeting of Russian émigrés where he meets Koncheyev whom he considers a rival. A reading of a new play bores the audience. Upon leaving Fyodor has a lengthy and animated discussion about Russian literature with Koncheyev, a discussion that turns out to be largely fictitious. Fyodor is dreaming about his native Russia as he rides in the tramcar to his language student, but “could not stand it no longer “and returns to his place. His mother, Elizaveta Pavlovna, comes from Paris to visit him and the shadow of his lost father hangs over their encounter, his mother believing that he is still alive. Before her departure they attend a local Russian literary event, and Fyodor is the last almost unnoticed reader to recite one of his poems. Inspired by her visit and his study of Pushkin he seeks her support for his new project, a book about his father Konstantin Kirillovich. He collects material, stumbles over Sushoshchokov’s account of his grand father, Kirill Ilyich (a gambler who made and lost a fortune in America before returning to Russia), and starts to focus on the activities of his father, an explorer, lepidopterist, and scientific writer whose journeys between 1885 and 1918 led him to Siberia and Central Asia. Fyodor who only had come along on local trips and is imbued with the love of butterflies, imagines being a participant on his explorations to the East. In 1916 his father departed for his last journey and remains missing. Fyodor’s difficulty to proceed with his project gets complicated by the need to look for a new lodging. With the help of Mrs. Chernyshevski he finds a place with the Shchyogolevs. As it turns out later, the presence of a short pale blue dress in the adjacent room that he thinks belongs to their daughter makes him take the apartment. This chapters starts by describing a day in the life of the protagonist. In the morning Fyodor hears the Shchyogolevs get up and begins the day with thinking about poetry. He reflects on his development as a poet. Later he joins the family for lunch, Shchyogolev is talking about politics, his wife, Marianna Nikolavna, cooks, and the daughter behaves in an antagonistic way. Fyodor then gives his tutorial lessons, goes to a bookstore where among others he finds Koncheyev’s book of poems Communication and reviews that failed to understand it. He reads an article about Chernyshevski and Chess in the Soviet chess magazine 8x8, and visits his editor Vasiliev. After returning home and having supper in his room, Fyodor leaves the place to meet secretly Zina. Waiting for her he composes a poem embedded in the narrative. Zina Mertz has appeared in the narrative before on occasion,,- she had bought one of the few copies of Fyodor’s poems, and she is the daughter of Marianna Nikolavna, and Shchyogolev’s stepdaughter, living next door to the protagonist). The story of their encounters is recalled and it is learned that Zina knew of Fyodor the poet when he lived at his previous place. Their meetings are in secret and hidden from her parents. Shchyogolev implies that he may have married her mother to get to her which may explain the strain between him and Zina and why she hates him. Zina works for a law firm, Traum, Baum, and Kaesebier. Fyodor gets more involved with Chernyshevski’s work and declares that he wants to write about him for “firing practice”. He reads all by and about him, and passes from “accumulation to creation”. Zina is his muse and reader. The finished manuscript is handed to his publisher who rejects it as a “reckless, antisocial, mischievous improvisation.” However, Fyodor has more luck with another publisher. This chapter is a critical biography within the novel, a book within a book, about the Russian 19th century writer Chernyshevsky - Lenin's favorite author -titled The Life of Chernyshevski written by the protagonist. Fyodor ridicules Chernyshevsky's aesthetics and understanding of literature. The book about Chernyshevski finds itself in a “good, thundery atmosphere of scandal which helped sales”. Most reviews in the literary world of the émigrés are critical as the book debunks its subject as a writer and thinker, Koncheyev ’s review, however, is quite positive. Fyodor is unable to show the book to Alexander Yakovlevich Chernyshevski who had recently died. His death and funeral are described. On his way home, Fyodor walks with the writer Shirin, “a deaf and blind man with blocked nostrils”. Shirin tries to engage Fyodor in the activities of the Committee of the Society of Russian Writers in Germany. Fyodor declines but attends some meetings observing the infighting for control of the society. Shchyogolev is offered a job in Copenhagen, and plans to leave Zina in the Berlin apartment. Fyodor is elated and takes a walk in the Grunewald forest, where he imagines to have a talk with Koncheyev. His clothes including the key to the apartment get stolen, and he has to return in his bathing trunks. At night he dreams that his father has come back. Next morning the Shchyogolevs leave for Copenhagen, and Zina stays behind. Fyodor who is planning to write a ""classical novel"" (The Gift) and Zina can now live together. They are without money, both at the moment have lost the key to their apartment, but they are happy, they feel that fate brought them together, and Zina declares that he will be “a writer as has never been before“.",0
1318458,Triss,Brian Jacques,2002,"{""/m/0dwly"": ""Children's literature"", ""/m/01hmnh"": ""Fantasy"", ""/m/014dfn"": ""Speculative fiction"", ""/m/02xlf"": ""Fiction""}","At Riftgard, an isle in the far north, the ferret king, King Agarnu, and his cruel offspring, Princess Kurda and Prince Bladd hold sway over a Ratguard army and enslaved creatures. One of the slaves, Trisscar Swordmaid escapes with her friends Shogg and Welfo, southward to Mossflower. In the attempt, her friend Drufo is killed. Meanwhile, Kurda hires a pirate ship, the Seascab, captained by Plugg Firetail, to take her to Mossflower, where she must find the royal artifacts of Riftgard in order to seal her queenship. In Redwall Abbey, rebellious Dibbuns Ruggum and Bikkle run away into Mossflower Woods. They discover Brockhall, the ancestral home of badgers, but are chased away by serpents. Fortunately, they are rescued by the Skipper of Otters and Log-a-Log Groo, and they bring with them a golden pawring with strange markings. Sagaxus, heir to Salamandastron, and his friend Bescarum Lepuswold Whippscut (who go by Sagax and Scarum respectively), leave the mountain for adventure with Kroova Wavedog, in his ketch the Stopdog. Scarum's father, Colonel Whippscut of the Long Patrol, searches for them in the name of Lord Hightor, the Badger Lord. Sagax finds a bow on the ketch (the property of its previous owners) with similar markings to the pawring. They disregard it and decide to journey to Redwall, and on their way, they wind up in possession of a dagger with the same pattern. Triss and her friends, in their ship, see the same markings. Triss is able to interpret them as an R, H, O, and R, standing for ""Royal House of Riftgard"". On the journey, they become dehydrated, but are rescued by the hedgehogs of Peace Island. Welfo remains with her newfound love, Urtica, while Triss and Shogg continue south. They cross paths with Kurda on the Seascab in the middle of a lightning storm, but the contraband vessel escapes. Meanwhile, the Redwall denizens try to explore Brockhall, but it is inhabited by three serpents, one of which wears a crown with the Riftgard pattern. The adders, Zassaliss, Harssacss, and Sesstra, are the children of Berussca, an adder slain by and who in turn slayed King Sarengo, Agarnu's father; they remain bound by Sarengo's mace and chain. Ovus, a tawny owl, brings Bluddbeak, an ancient red kite from afar to defeat the adders, but in their attempt, both birds die. Mokug, a golden hamster who had been Sarengo's slave, is rescued and brings with him a message in Riftgard script. Martin the Warrior visits Skipper's niece, Churk, in her dreams, giving the Redwallers the hint they need to decode the message, but it is a riddle that's difficult to interpret. Elsewhere, Sagax, Scarum, and Kroova are captured by the crew of the Seascab, and the Stopdog is destroyed. Triss and Shogg meet up with them, and together they are able to escape. Kroova and Shogg set up a hidden stake that injures Plugg, and his firetail falls off, though he reattaches it with pine resin. Kurda and her vermin then cross paths with the Redwallers, who fend them off, while Triss, Shogg, Sagax, Scarum, and Kroova enter the safety of the abbey. Triss sees the Sword of Martin and is immediately drawn to it, wielding it as the Redwallers continue to battle the Ratguard army. Bladd is killed by a falling pot of oatmeal, and Plugg is killed by the snakes, while Kurda concentrates her efforts on destroying the denizens of Redwall. Eventually, Skipper's niece helps solve the riddle, which leads the Redwallers to Brockhall. There they encounter both the Ratguards and the snakes. During the ensuing battle, Shogg, Sagax, and Triss kill Sesstra, Harssacss, and Zassaliss, but Shogg is poisoned and dies by Triss's side. Later, Triss and Kurda face off, but Kurda falls on her own sword and dies. Triss, Kroova, Sagax, Scarum, Groo, Skipper, Mokug, and others sail to Riftguard and free the slaves. There, King Agarnu is drowned by the slaves. Kroova stays on Riftguard with the sea otter Sleeve, and the others return to Redwall Abbey.",0
1319279,Watch Your Mouth,Daniel Handler,2000-07,"{""/m/01z4y"": ""Comedy"", ""/m/05hgj"": ""Novel""}","The first part of the novel is laid out as an opera, with act and scene numbers as chapter titles and each of the characters being assigned a singing voice. Joseph quickly begins to suspect that Cynthia's entire family is engaging in incestuous behaviour, and that her mother, Mimi, is building a golem in the basement. The first part of the novel ends (operatically) in death. The second part is presented somewhat more conventionally, as Joseph attempts to recover from the events of the first part; this half of the book follows the form of a 12-step program. The first section of the novel is printed in black ink, while the 12-step program is printed in dark red.",0
1319463,Blinded by the Right,David Brock,2002,"{""/m/05h83"": ""Non-fiction""}","Brock recalls his days at the University of California, Berkeley and how he was turned off by hecklers at a speech by then United States ambassador to the United Nations, Jeane Kirkpatrick. Brock's main attraction to conservatism was his disdain for communism. After college, Brock moved with his then-partner (called ""Andrew"" to conceal his identity) to Washington, D.C. In D.C., Brock worked for The Washington Times and The American Spectator. Brock claims while he was working for those publications he thought he was doing honest journalism, but later stated that he had never corroborated his facts. While working for The American Spectator, he wrote an article on Anita Hill, which he later expanded into The Real Anita Hill, a book that made him popular in the conservative movement. Brock would later say that many of the details he used were false. After Bill Clinton was elected, Brock was assigned to write a story, later dubbed Troopergate, about four Arkansas state troopers who held a grudge against Bill Clinton. He claims that the troopers made up stories about affairs that could never be corroborated. Brock was given assurances that the troopers would not get paid for telling their stories. He later discovered he was deceived and that the troopers had been paid by Richard Mellon Scaife, who bankrolled The American Spectator and the Arkansas Project, a secret project to discredit Clinton. Brock made sure to conceal the identities of the women identified by the troopers, with the exception of one woman named ""Paula"". Brock thought that by not revealing her last name, it would be enough to conceal her identity. Brock did not take into account that Little Rock is a small city. Eventually her identity would be revealed as Paula Jones, which led to her civil lawsuit against Bill Clinton. Following the Troopergate story, Brock wrote a book about Hillary Clinton, The Seduction of Hillary Rodham. Unlike the Anita Hill book, Brock decided not to put anything in the book that he could not corroborate. The book was not as critical of Hillary Clinton as it was promised to be. Brock claims that conservatives planned on the book being so damning as to influence the outcome of the 1996 presidential election. The Seduction of Hillary Rodham was the beginning of Brock's falling out with the conservative movement. The issue that forced him to leave the conservative movement was the movement's intolerance towards homosexuality. Brock had reluctantly come out of the closet prior to writing the Hillary Clinton book, and believes this contributed to his being shunned by many in the movement. Brock voted for Al Gore in 2000, the first time he voted since he voted for Ronald Reagan in 1984. During the period in which he did not vote, he had two rationalizations for his non-voting: * He believed that his vote didn't count in liberal Washington D.C. * He believed that not voting allowed him to stay neutral Brock proclaimed that the latter rationalization was bogus, as he was not neutral during that time period.",0
1319473,The Republican Noise Machine,David Brock,2004-05-18,UNK,"Brock details the conservative media strategy subsequent to the time of (Brock hero) Barry Goldwater, predicated on corporate funding of think tanks, such as the Heritage Foundation. Brock believes such think tanks serve not only as propagandists, but as tutors for industry lobbyists, and a training ground for conservative journalists who are not limited by the standards of objectivity and impartiality emphasized in the conventional news media. Conservative and Republican strategists ""concoct smears, distortions, and outright lies"", and then disseminate the product as 'talking points' to right-wing radio and Fox News, which Brock says set a narrative echoed by more mainstream news sources.",0
1323179,Prochain épisode,Hubert Aquin,UNK,UNK,"The narrator, like Aquin himself, turns his adventures into a spy thriller to while away the time he is forced to spend in the psychiatric ward of a Montreal prison, where he is awaiting a trial for an unspecified revolutionary crime. The novel was translated by Penny Williams in 1967, and later again by Sheila Fischman.",0
1323542,Visa for Avalon,Bryher,UNK,UNK,"During a fishing vacation to Trelawney in an unidentified country, Mr. Robinson (his first name is never given) receives word that the Movement, a protest group with the tacit approval of the government, is planning a General Strike. Mr. Robinson's landlady, Mrs. Blunt, is given notice that the government is claiming her land as eminent domain. The pressures of mass industrialization and scattered reports of Movement activity lead Robinson, Blunt, Alex, Mr. Lawson, and Sheila Willis to seek refuge in the country of Avalon before the borders are closed for good. Avalon is not specifically identified in the story; only a glimpse is seen of white sandy beaches there at the book's end.",0
1325312,Something Wicked This Way Comes,Ray Bradbury,UNK,"{""/m/01hmnh"": ""Fantasy"", ""/m/014dfn"": ""Speculative fiction"", ""/m/03npn"": ""Horror"", ""/m/070l2"": ""Soft science fiction""}","The novel opens on an overcast October 23. Two friends, William ""Will"" Halloway and Jim Nightshade, both on the verge of their fourteenth birthdays, encounter a strange lightning rod salesman who claims that a storm is coming their way. Throughout that same night, Will and Jim meet up with townsfolk who also sense something in the air; the barber says that the air smells of cotton candy. Among the townspeople is Will's 54-year-old father, Charles Halloway (who works in the local library, and who broods philosophically about his position in life, including on how he misses being young like his son). Both Charles Halloway and the boys learn about the carnival that is to start the next day. Will's father sees a sign in a store window that advertises Cooger & Dark's Pandemonium Shadow Show, while Jim and Will find a similar handbill in the street. The boys are excited that a carnival has come so late in the year, but Charles Halloway has a bad feeling about it. The boys run out to watch the carnival arrive at three in the morning, and they run home after seeing the tents get set up mysteriously. Mr. Halloway talks about this time of night as ""soul's midnight"", when men are closest to death, locked in the depths of despair. The boys go the next day to explore the carnival and they help their seventh grade teacher, Miss Foley, who is dazed after visiting the Mirror Maze. Later in the day, Jim goes into the maze and Will has to pull him out. Jim insists on coming back that night, and Will agrees, but when they bump into the lightning-rod salesman's bag, they realize that they must stay to learn what has happened to the man. Finally, after searching all of the rides, they go up to a carousel that is supposedly broken. A huge man grabs Will and Jim and tells them that the merry-go-round is broken. Another man tells him to put them down, introduces himself as Mr. Dark and tells them the huge man's name is Mr. Cooger. Mr. Dark is the Illustrated Man, covered in tattoos, and he pays attention only to Jim, who is enthralled by what he sees. Mr. Dark tells them to come back the next day and the boys run off but then hide and wait. What they see is unbelievable. Mr. Cooger rides backwards on the carousel (while the music plays backwards), and when he steps off he is twelve years old. They follow Mr. Cooger to Miss Foley's house, where he pretends to be her nephew who got lost earlier at the carnival. Jim tries to meet up with Mr. Cooger because he wants to ride the carousel, but Will stops him briefly before Jim takes off toward the carnival. When Will reaches the carnival Mr. Cooger is on the carousel, growing older, and Jim is about to join him. Will knocks the switch on the carousel and it flies out of control, spinning rapidly forward. Mr. Cooger ages over 100 years before the carousel stops, and Jim and Will take off. They return with the police, but Mr. Cooger is nowhere to be found. Inside the tents he is set up as a new act, Mr. Electrico, a man they run electricity through. Mr. Dark tells the boys to come back to the carnival the next day. Will tries to keep his father out of the situation, promising him that he will tell all soon. That night, the Dust Witch comes in her balloon to find Jim and Will, but Will outsmarts her and destroys her balloon. They later both dream of a bizarre funeral for the balloon, featuring a giant, misshapen coffin. The next day the boys see a young girl crying and realize after talking to her that she is Miss Foley. They go to her house but when they come back their path is blocked by a parade. The carnival is out searching the streets for them. They hide and the little girl is gone. Will's father sees them hiding under an iron grille in the sidewalk and the boys convince him to keep quiet because the Illustrated Man comes to talk to him. Will's father pretends not to know the two boys whose faces are tattooed on the man's hand, and then when the Witch comes and begins to sense the boys' presence he blows cigar smoke at her, choking her and forcing her to leave. Mr. Dark asks Charles Halloway for his name, and Will's father tells him where he works and who he is. Later that night Will and Jim meet Mr. Halloway at the library, where he has done research and found out some things about the carnival. He tells them that their best weapon is love, but they are not sure how to fight. Then Mr. Dark shows up and the boys hide. He finds them and crushes Charles Halloway's hand when the man tries to fight him. The Dust Witch casts spells on the boys to make them easy to handle and goes to stop Mr. Halloway's heart. Just before he is about to die, Charles Halloway looks at the Witch and begins to laugh hysterically, and his laughter wounds her deeply and drives her away. He goes to the carnival to get the boys. At the carnival Charles Halloway outsmarts Mr. Dark, finds his son, kills the Witch, and destroys the Mirror Maze in a matter of minutes, all through the use of laughter and happiness. Then he and Will search for Jim. Mr. Cooger turns to dust and blows away before he can be saved at the carousel, and Jim moves towards the merry-go-round. Jim starts to ride and Will tries to stop him. They both end up going for a ride before Will jumps off and rips Jim away from the machine. Jim falls into a stupor, close to death. A child comes begging them to help him, but Mr. Halloway recognizes the boy as Mr. Dark. He holds the boy tight and kills him with affection, because Mr. Dark cannot survive in such close contact with someone good. The carnival falls apart as Will tries to revive Jim. They save Jim by singing and dancing and laughing; their happiness bringing him back from the edge of death.",0
1327856,Century Rain,Alastair Reynolds,2004,"{""/m/0mz2"": ""Alternate history"", ""/m/06n90"": ""Science Fiction"", ""/m/014dfn"": ""Speculative fiction"", ""/m/02xlf"": ""Fiction""}","Wendell Floyd is an expatriate American living in an alternate version of 1950s Paris. In this world, the Nazi invasion of France failed, and Hitler was deposed by the German High Command. Without World War II, technology in this world has stagnated at 1930s levels, and Fascist political parties have gained power in France. Floyd is a part time jazz musician whose career has stalled since his ex-girlfriend, Greta, left Paris to pursue a musical career touring with another jazz band. He and his band-mate André Custine earn a supplemental income working as private detectives. When the novel opens, Floyd and Custine are hired by a concerned landlord to investigate the death of one of his tenants. Blanchard, the landlord, is certain that the death of Susan White, which the Parisian police have written off as an accident, is murder. Floyd is not so certain, but he's willing to investigate. In a scene seemingly from another novel, Verity Auger finds herself responsible when her archaeology dig beneath the frozen ruins of some far-flung future Paris results in the death of one of her students. During her trial she is caught up in political infighting, and maneuvered into accepting a high risk assignment, without knowing what it entails. But when she is summoned on a mission to Mars by the top-secret security agency Contingencies, Auger is more than relieved to be exempt from her tribunal and the years of prison that she would otherwise have to face. However, when she is taken to a secret underground base on the Martian moon Phobos containing an ancient alien relic that opens a portal to a distant part of the galaxy, and told that she is to go through it, she begins to have second thoughts about continuing with her mission. Things get even more bizarre when she finds out that at the other end of the portal is an alternate-history version of Earth in the year 1959 - almost 300 years behind the present time - and that she is to retrieve a tin of documents that was left behind by Susan White, an earlier agent sent to ""Earth Two"", who died under mysterious circumstances.",0
1328942,The Way of the Wiseguy,Joseph D. Pistone,UNK,"{""/m/01pwbn"": ""True crime""}","The book records psychological portraits of the personalities Pistone associated with during his years undercover. Among the many recurring themes in the book: wiseguys are not nice people, they don't have friends (not even people they have known and worked with their whole life), and they will beat or kill you without hesitation. Pistone relays experiences with international organized crime, as a consultant and undercover agent for Scotland Yard, and infiltrating a drug lord's operation in a foreign country. An audio CD is included with the book, containing actual FBI surveillance recordings of Pistone, working undercover as Donnie Brasco, and his capo.",0
