id,title,author,published_date,categories,summary,page_count
4992567,Goth Opera,Paul Cornell,UNK,UNK,"As the Fifth Doctor and his companions vacation in Tasmania they get caught up in a scheme by the Time Lord Ruath to resurrect the vampire Yarven (from Blood Harvest). Ruath sends a vampire baby to attack the Doctor and turn him into a vampire, but the child instead attacks and converts Nyssa. Unable to provide Yarven with the Doctor's Time Lord blood, Ruath gives her own blood to Yarven, causing her to die and regenerate into a vampire Time Lord. Nyssa, while trying fight her new vampire nature, is drawn to Yarven's castle, where she learns more about Ruath's plan. Ruath has created a genetically enhanced mist that can turn normal humans into vampires, and kill those who use traditional methods (garlic, crosses, etc.) to protect themselves. Ruath has also invented a Time Freeze, a small Time Loop that can hold the Earth in a perpetual night, leaving the vampires free to roam and feed. Nyssa contacts the Doctor and aids him in entering the castle, which turns out to be Ruath's TARDIS. Ruath captures the Doctor and Tegan. She informs Yarven that his brain, now enhanced by Time Lord blood, will become the controller of the Time Freeze mechanism, and offers the Doctor the change to become her vampiric consort. Yarven, however, decides he doesn't want to sacrifice himself, and places the Doctor in the Time Freze. The Doctor manages to use Ruath's command ring to take control of her TARDIS and force it to materialize on a distant planet, where the rising sun incinerates Yarven and his vampire hordes. The death of the vampire child cures Nyssa of her vampirism. Ruath survives the dawn, but is sucked into the Time Vortex after Nyssa opens the doors to the Doctor's TARDIS while it is in flight.",0
4994110,Happy Baby,UNK,UNK,UNK,"Theo is addicted to sadomasochism. He insists on being hurt - whether by one he loves or by a professional dominatrix. Theo is a victim of the child welfare system. Told in reverse chronological order, 'Happy Baby' begins when 36-year-old Theo returns to Chicago after six years away, to visit an ex-girlfriend called Maria. He knows Maria from their years growing up together in a state institution, where Theo was sent aged thirteen after his abusive father was killed and his mother died from multiple sclerosis. Theo then drifts into relationships with women who are willing to abuse him. His need for pain stems from the brutal treatment he received as a child in state custody. He recalls the memory of Mr. Gracie, a pedophile caseworker who regularly raped him when he was aged twelve but also protected him from the other boys. Elliott explores the psychology of child sexual abuse and physical abuse.",0
4994522,"Heaven Knows, Mr. Allison",Charles Shaw,1952,"{""/m/098tmk"": ""War novel""}","The narrative deals with the developing relationship between the marine and the nun, especially Allison's growing attraction to Sister Angela. The novel is set earlier in the war than the film, with Allison escaping from the Battle of Corregidor at the time that the Allies are still on the defensive in the Pacific.",0
4995921,Fire in the Abyss,UNK,UNK,"{""/m/06n90"": ""Science Fiction"", ""/m/014dfn"": ""Speculative fiction""}","Gordon awakens in 1983 floating in the north Atlantic when all of a sudden a U.S. submarine emerges from the depths and plucks Gilbert from certain death. (The book's cover shows Gilbert on the deck of a modern submarine.) Together with some hundred other ""Temporally Displaced Persons,"" or DTIs, the government term for those it’s kidnapped from other times, Gilbert is illegally incarcerated in a secret installation in Horsefield, New Jersey where authorities conduct experiments designed to extract historical and linguistic secrets from the past. Gilbert is forced to live a pathetic existence of living in a prison and must wear a protective suit just to prevent from being infected with deadly modern day viruses and bacteria. Just when hope seems to have run dry Gilbert discovers that he and the other DTIs have developed a telepathic ring, coordinated by the Ancient Egyptian priestess Tari, a follower of the cult of Isis. In this ring they are able to share their dreams, fears and plans for escape. Together with Tari, a Norse giant, a dancer from ancient North America and many others, Gilbert escapes from his illegal confines. This is a deadly plan as the US government is eager, even willing to kill, to keep the scandalous DTIs a secret from the public. Once on the outside Gilbert, Tari and a handful of others find themselves on-the-run and overwhelmed by culture shock. Dodging murderous government agents and curious laymen Gilbert wanders across the American continent, meeting up with crazed Irish nationalists, an anti-government rock group and even working for a time in a San Francisco S&M parlor, indulging his homosexual desires. One by one Gilbert’s companions are killed off by accident or murder until he alone finally makes an escape back to merry-ole England, where again finds himself an outsider and fugitive. The book, written in the first person, is Gilbert's diary and is intended as proof of the government misdeeds committed against DTI’s. Gilbert makes many sardonic remarks on the life and institutions of the modern world in general and present-day Britain in particular, but also enjoys disabusing moderns who tend to romanticize the Elizabethan Age. Gordon is especially harsh in his mocking of the political paranoia that infected the United States during the Cold War. Gordon, a Scotsman, does manage to have Gilbert, an Englishman, visit the author’s home town of Buckie on the northeastern coast of Scotland.",0
4996811,Mountains Beyond Mountains,Tracy Kidder,2004,"{""/m/0xdf"": ""Autobiography"", ""/m/017fp"": ""Biography"", ""/m/05h83"": ""Non-fiction""}","The book is written from the point of view of author Tracy Kidder. It is set mainly in Haiti and Boston, Massachusetts. Kidder first met his subject, Dr. Paul Farmer, in Haiti in 1994. At the time, Kidder was researching a story about American soldiers sent to reinstate Haiti's democratically elected government led by president Jean-Bertrand Aristide. Kidder again met Farmer on his flight back to Miami, Florida from Haiti and began to learn small pieces of Farmer's life. Farmer was born in Massachusetts and grew up as one of six children in a poor household in Florida, going on to attend Duke and Harvard, where he earned his M.D and Ph.D. The rest of the book details Farmer's inspiring life and accomplishments, including Farmer's work with the health and social justice organization Partners in Health, especially in Haiti, Peru, and Russia. Kidder describes Paul Farmer as follows: :""And I was drawn to the man himself. He worked extraordinary hours. In fact, I don’t think he sleeps more than an hour or two most nights. Here was a person who seemed to be practicing more than he preached, who seemed to be living, as nearly as any human being can, without hypocrisy. A challenging person, the kind of person whose example can irritate you by making you feel you’ve never done anything as important, and yet, in his presence, those kinds of feelings tended to vanish. In the past, when I’d imagined a person with credentials like his, I’d imagined someone dour and self-righteous, but he was very friendly and irreverent, and quite funny. He seemed like someone I’d like to know, and I thought that if I did my job well, a reader would feel that way, too."" The book is primarily a biographical work broken into five parts. PART I: Doktè Paul Introduces Farmer's work at the Brigham in Boston, Massachusetts and at the PIH founded Zanmi Lasante in Cange, Haiti. PART II: The Tin Roofs of Cange Describes Farmer's family background and gives accounts of Farmer from sources close to him. Farmer's dedication to PIH led to his broken engagement with Ophelia Dahl, the daughter of famous author Roald Dahl and actress Patricia Neal. The two remained close confidantes however, with Ophelia continuing work for the PIH organization. PART III: Médicos Aventureros 1995 MDR-TB claimed the life of a close friend known as Father Jack, in Lima, Peru. PIH co-founder, Dr. Jim Kim convinces Farmer to extend PIH into Peru where they fight against the rigid orders of the DOTS program, outlined by the World Health Organization, largely under the financial support of an American benefactor, Tom White. PART IV: A Light Month for Travel Follows Farmer from Haiti to Cuba, Paris, France, Russia, and other locations on his quest to treat infectious disease. PART V: O for the P In 2000, PIH receives news of being awarded a $45 million grant to combat MDR-TB in Lima, Peru along with other organizations. ""O for the P"" refers to an expression within PIH that is a shortened form of saying “a preferential option for the poor”.",0
4996910,Donnerjack,Jane Lindskold,1997-08,"{""/m/06n90"": ""Science Fiction"", ""/m/014dfn"": ""Speculative fiction""}","The book combines gods with high technology. Computers have gone independent in a Virtual Reality that contains many elements borrowed from myth and legend. Death features as a major character, and the hero must rescue his lady-love from him. Other actual and virtual myth-figures come into it. It is not connected with Jack of Shadows",0
4997821,The House on the Borderland,William Hope Hodgson,1908,"{""/m/01hmnh"": ""Fantasy"", ""/m/06n90"": ""Science Fiction"", ""/m/014dfn"": ""Speculative fiction"", ""/m/03npn"": ""Horror"", ""/m/02xlf"": ""Fiction""}","Two good friends, Tonnison and Berreggnog, travel to the remote village of Kraighten in rural Ireland. On the third day of their trip, they stumble upon the ruins of a strangely-shaped house bordering a large lake. They discover the mouldering journal of the Recluse, an unidentified man who recorded his last days in the house before its destruction. The Recluse begins his journal with descriptions of how he acquired the house, along with his daily life with his sister and his faithful dog, Pepper. He confides that he is starting the diary to record the strange experiences and horrors that were occurring in and around the house. The Recluse relates a vision in which he travels to a remote and vast arena, ""the plain of silence,"" surrounded by mountains with representations of mythological beast-gods, demons, and other ""bestial horrors"" on their slopes. In the center of the plain stands a house almost identical to his own, save that the house in the arena is much larger and appears to be made of a green jade-like substance. Along the way, he sees a huge, menacing humanoid swine-thing. After his vision of the ""arena,"" he becomes fascinated with the pit adjacent to his house (Ireland), and begins to explore it. Shortly after this he is attacked by humanoid pig-like creatures that he names ""the swine-things"" which appear to have their origin from somewhere in the depths of a great chasm found under the house (accessed through a pit on the other side of the gardens) . The struggle with these creatures lasts for several nights of greater and greater ferocity, yet in the end, the man kills several of the swine things, and apparently drives them off. As he searches for the origin of the Swine-things, the man explores a pit in the gardens were the river ends and flows underground. There he finds a tunnel leading to a great chasm under the house. When rock slides dam the water in the pit, trapping the man, his dog Pepper rescues him. By the time that the two men find the journal, the obstructed water has overflowed the pit to create the lake. The house transports him inter-dimensionally to an unknown place called 'the sea of sleep' where he briefly reunites with his lost love. A short time later, the man notices that day and night have begun to speed up, eventually blurring into a never-ending dusk. As he watches, his surroundings decay and collapse to dust. The dead world slowly grinds to a halt as the sun goes out after several million millennia. Once the world ends, the man floats through space, seeing angelic, human, and demonic forms passing before his eyes. Later, he finds himself back in his own study on Earth, with everything apparently returned to normalcy—with the one exception of Pepper, who is dead. To make matters worse, the malicious swine-beast from his earlier journeys to the 'arena' has managed to follow him back to his own dimension. The creature infects the man's new dog with a luminous fungal disease. Although the man shoots the suffering animal, he also contracts the disease. The manuscript ends with the man locked (from the outside only) in his study as the creature comes through a trap door in the basement, that opened directly over the chasm under the house. Tonnison and Berreggnog search for information on the man and his circumstances. They find that the only knowledge of the house was that it was a place long of evil repute and had mysteriously fallen into the chasm. They leave Kraighten and never return.",0
4999964,The Hundred Dresses,Eleanor Estes,1944,"{""/m/014dfn"": ""Speculative fiction"", ""/m/02xlf"": ""Fiction""}","The book centers on Wanda Petronski, a poor and friendless Polish-American girl. Her teacher, outwardly kind, puts her in the worst seat in the classroom and she does not say anything when her schoolmates tease her. One day, after Wanda's classmates laugh at her funny last name and the faded blue dress she wears to school every day, Wanda claims to own one hundred dresses, all lined up in her closet at her worn-down house. This outrageous and obvious lie becomes a game, as the girls in her class corner her every day before school, demanding that she describe all of her dresses for them. She is mocked, and her father, Mr. Petronski, decides that she must leave that school. The teacher holds a drawing contest in which the girls are to draw dresses of their own design. Wanda enters and submits one hundred beautiful designs. Her classmates are in awe of her talent and realize that these were her hundred dresses. Unfortunately, she has already moved away and does not realize she won the contest. The students who teased her feel remorse and want her to know this, but they are not sure how. They decide to write her an apology letter and send it to her old address, hoping the post office can forward it.",0
5003381,A Dying Light in Corduba,Lindsey Davis,1996-06-06,"{""/m/0lsxr"": ""Crime Fiction""}","The Society of Olive Oil Producers of Baetica is throwing a big dinner party in Rome, trying to drum up business for their product. Falco is invited at the request of Claudius Laeta, Vespasian’s top clerk. The food, the garum and the dancing girl make a big impression on Falco. When two guests at a dinner are assaulted, one fatally, Falco realizes that being at the dinner was just the start of another job. The surviving victim, Anacrites, is Falco's rival and Vespasian's Chief Spy. Falco is asked to investigate the attack on Anacrites and its possible connection to an attempt to corner the market on Spanish olive oil. Trying to keep Anacrites safe, he moves him to the one place where no one will look, and if they do, they will regret it; his mother’s house. Soon, Falco is on his way to Hispania to track down some of the guests and that memorable dancer. Laeta hints that someone is looking to corner the market on Hispania’s olive oil production. Suspicion immediately falls on Quinctius Attractus, the host of the festivities that fatal evening. This is an assignment Falco does not take solo; he is bringing his very pregnant companion, Helena Justina. Helena's father Camillus Verus happens to own a small estate in Baetica, and her brother Aelianus has just returned for serving there, so he and Helena have a perfect excuse to show up. And Helena has made it very clear that Falco will be there for the birth of his child. Falco soon discovers, among other things, Quinctius Attractus, owns one of the largest estates in the region, producing massive quantities of olive oil. He also learns that against his initial suspicions, there does not appear to be much interest in cornering any market, at least on the part of the Baeticans. This does not mean the investigation is over; there is still the assault to solve, and pesky dancer is still on the loose. Helena becomes friendly with the daughters of two local magnates, Claudia Rufina and Aelia Annaea. Falco gets to know some of the sons, including Claudia’s brother Constans. Also appearing is Attractus’ son Quadratus, the new quaestor of Baetica. That one item alone keeps Falco on guard. While concluding the interviews of the dinner guests, Falco finally catches up with the dancer, Selia, who promptly tries to kill him with the help of her band. Before she strikes the final blow, she reveals that Laeta sent her too, not to find the killer, but to stop anyone following, a classic double cross. Now Falco knows all, or nearly all. Falco manages to escape, but fails to catch Selia. He rushes home to see if Helena is well. Falco finds Quadratus in his house, injured in a fall from a horse, and discovers that there has indeed been a death; Rufina Constans, Claudia’s brother. He was found dead in an olive press, moving a stone that no human could move alone. Falco suspects something, but the obvious suspect is his guest and claiming an injury. Yet Claudia is convinced it was not an accident, and she asks Falco to investigate. Seeing the site of the death, he is convinced someone else was there when Constans died. Now it is just one more thing he has to prove. Now the chase is on. Falco goes to the Quinctius estate, and finds Selia dead and Quadratus gone. But this death is much more elegant, and soon another Dancer appears; Perella. She is working for the Chief Spy Anacrites, who was still alive when she saw him last, now with the Praetorian guard, but still being nursed by Falco’s mother. Still not trusting Perella, Falco decides to share his information with her, and they piece together the real plot. It is not the Baeticans who want the cartel, it is Laeta, who wants to force Vespasian to take over production, pouring millions into Rome’s coffers, but causing the price of olive oil to go through the roof. Laeta had set up Falco in the hope that he will find enough to cause the Emperor to stave off the threat of anyone else controlling olive oil, and putting Laeta in charge of the new cartel. If Falco dies, instead, well, that is the cost of doing business. Attractus and Quadratus are part of the plan because Laeta needs some legitimacy, and the Quinctii have enough influence to make it at least appear to be on the up and up. Falco also learns that Quadratus was indeed with Constans when he died. It is now time to act. Helena is about to burst, but Falco is still fearful of local medical experts, and so he sends her east by land while he rides to catch Quadratus before he kills someone else, and then hopes to catch up. After visiting a couple of mines in search of Quadratus, he finally catches up with him. It turns out that Laeta did not have as much control over the Quinctii as he thought, and some of the killings were Quadratus’ idea. Quadratus tries to bluff, but he knows it’s too late to recover the dream of all that control. Ignoring Falco, he descends a ladder, slips and falls to his death. Falco can only wonder how much of an accident it was. It’s a girl. Falco makes it before the birth, Helena survives, and only breaks a couple of his fingers.",0
