id,title,author,published_date,categories,summary,page_count
14298413,Ruth Hall,Fanny Fern,1854,"{""/m/016lj8"": ""Roman \u00e0 clef""}","The autobiographical novel can be divided into three phases: Ruth's happy marriage, impoverished widowhood, and rise to fame and financial independence as a newspaper columnist. In the first chapter, young Ruth Ellet sits at her window on the night before her wedding, reflecting on her life so far. When her mother died long ago, she was sent away to boarding school, where she excelled at writing compositions. There is no love lost between Ruth and her father, who has plenty of money but begrudges her every penny; and although she adores her talented older brother, Hyacinth, he is a strange, cold-hearted man who slights his sister for her overtures of affection. Ruth, therefore, pins all her hopes on her impending marriage to Harry Hall. She duly marries Harry. He is a good, loving man, and handsome and prosperous, too. At this stage, the only thorn in Ruth's side is Harry's parents: old Mrs. Hall is so bitterly jealous of her son's pretty new wife that she finds fault with her constantly, and both in-laws meddle continually in Ruth's life. When Harry and Ruth move to a farm five miles away, they follow him. Harry and Ruth's first child, Daisy, brings them great joy. In the grandparents' eyes, however, the little girl is ""out of control"", and they consider Ruth a terrible mother. Ruth and Daisy play in the creek, and pick wild flowers together, which the grandmother hates. Daisy becomes ill in the winter and dies of croup because Dr. Hall, Ruth's father-in-law refuses to take Ruth's call for help seriously and fails to attend to the child immediately. Ruth and Harry have two more daughters, Katy and Nettie; then, while Nettie is still an infant, Harry contracts typhoid fever and dies. Ruth, left with very little money, applies to her relatives for help. The elder Halls and Ruth's father grudgingly provide her with a tiny income. She moves into a boarding house in a slum district, just up the road from a brothel, and searches unsuccessfully for employment as a schoolteacher or a seamstress. Her rich friends drop her, her relatives snub her, and only rarely does anyone offer help or encouragement. When Katy falls ill, Mrs. Hall persuades her to give up Katy to them and then treats the little girl harshly. Meanwhile, Ruth's funds continue to diminish, forcing her to move into a barren garret and live on bread and milk. Ruth, nearly desperate, hits on the idea of writing for the newspapers. She composes several samples and sends them to her brother Hyacinth, who is an influential publisher. He sends the samples back, along with an insolent note telling her she has no talent. Ruth perseveres, adopting the pen name 'Floy', and finally finds an editor, Mr. Lascom, who is willing to purchase her writings. Her columns are a hit; soon, she is publishing several pieces a week for Mr. Lascom and for another editor, Mr. Tibbetts. Subscription lists burgeon and fan mail comes pouring in, but Ruth is still barely getting by because neither editor will give her more money for her contributions. Accordingly, when a publisher named Mr. Walter offers her twice her present rate of pay to work exclusively for his magazine, she accepts. Mr. Walter becomes her best friend and advocate. Since she now has to write only one piece per week, Ruth has time to compile a book-length selection of her columns. This becomes a best-seller, making Ruth not only independent, but wealthy. She ransoms Katy and moves into a comfortable hotel with both her daughters. In the last scene, she visits her husband's grave and looks sadly at the space reserved for her at his side, then leaves the cemetery, thinking of the good things life might still have in store.",0
14301206,Magic for Marigold,Lucy Maud Montgomery,1929,"{""/m/0dwly"": ""Children's literature""}","Marigold Lesley is an imaginative young girl whose father died before she was born. She grew up at her paternal relatives' estate, Cloud of Spruce. Marigold's family includes her loving but bossy mother, steely Young Grandmother, shrewd Old Grandmother, her Uncle Klondike who is a former sailor, and her Aunt Marigold, a doctor who saved Marigold's life as a baby. Because of that, the Lesleys named Marigold after her Aunt, and Uncle Klondike married her. These people made Marigold's life mostly pleasant and carefree, but she nonetheless had her share of adventures, fancies and troubles, many related to the peculiar environment she grew up in. The book relates Marigold's seemingly incurable jealousy of her father's first wife, Clementine; an encounter with a Russian princess; several attempts to be ""good""' and a surprising cooking triumph. One long-lasting product of Marigold's imagination was Sylvia, her imaginary playmate whom she loved dearly and who took the place of many real-life friends for her. But as Marigold grew up and began having trouble with boys, she eventually had to say goodbye to Sylvia and her childhood.",0
14302298,The Beginning Place,Ursula K. Le Guin,1980,"{""/m/06n90"": ""Science Fiction"", ""/m/014dfn"": ""Speculative fiction"", ""/m/01hmnh"": ""Fantasy""}","The narrative focuses on the journey of the two main characters from adolescence to adulthood in two alternate worlds, the real world and the idyllic Tembreabrezi. The story is told in alternating chapters from two starkly alternating viewpoints: that of Irene Pannis, and of Hugh Rogers. They live in the suburbs of an unnamed US city, in difficult circumstances and with troubled families. They independently discover a place hidden in a local wood, where time flows much more slowly than in the outside world and it is always evening, a ""threshold"" between their own world and another; though Hugh finds it first within the story, Irene has already been visiting the other world for some years. She has another life there in the town of Tembreabrezi, an adoptive family of sorts, and has learned the local language. Both Irene and Hugh love the ""beginning place"", the threshold; they feel a sense of belonging and home there that they lack elsewhere in their lives. As Hugh stumbles upon the beginning place, Irene discovers that something is wrong in Tembreabrezi; the paths which connect the town with the rest of the country are closed somehow, and no one can reach or leave the town except for her. The closing is not material but emotional; the townsfolk are struck by a desperate fear which will not allow them to move beyond the town limits. Despite her anger with Hugh, and her resentment of his disturbance of her hidden sanctuary, they find that they must work together; she has had increasing trouble in passing through the gateway into the other place, while he cannot always cross back into the 'real' world. By travelling together they can pass back and forth through the gateway at will, and so they return to Tembreabrezi together. Hugh is welcomed in the town as the hero for whom they have waited; Irene is jealous, wanting desperately to win the admiration and respect of the townsfolk and especially the Mayor or Master, Sark, whom she has loved for a long time. Hugh is largely unaware of her feelings, but wants to complete the quest to become worthy of the Lord of the Manor's daughter Allia. In the end, they embark together on a mission to save the town and reopen the roads. Together they track down the monster that brings the fear and Hugh kills it. He is injured in the fight, but Irene helps him to keep going until they can reach the gateway back to their own world. On the other side, the trust and the love they have discovered together opens a different sort of gateway, providing them with a possible future together that avoids the destructive patterns of their own families.",0
14314461,Barracuda 945,Patrick Robinson,2015,['Fiction'],"* The story begins with the interrogation of SAS British Captain Ray Kerman who was Muslim born and Harrow educated. # Kerman's character is developed; he, now a Major i/c, is training and observing Israelis in an operation in Palestine. The operation goes wrong and Kerman meets the beautiful Shakira. He kills two British NCOs because they killed her children. He then disappears to join the Arabs. # The story reaches the ears of Admiral Morris, director NSA. Guided by Lt Jimmy Ramshawe, they suspect Kerman may be with Hamas, staging recent bold, successful, bank heists. Admirals Morgan (Nat Sec advisor) and Morris agree to keep watch on the situation. # Captain Kerman is now General Ravi Rashood of Hamas. He trains and leads a team of men into Israel and breaks into a gaol, freeing all the prisoners. # Rashood meets Iranian and Arab military leaders and proposes a plan to persuade the Americans to leave the Middle East. He suggests they buy two nuclear submarines (Barracuda 945s) from the Russians using the Chinese as their agents. # Rashood learns that Morgan is a threat to the terrorists' plans, that Morgan is coming to London and that his parents have a good horse entered at Ascot. He goes to Ascot, is spotted by an old school friend, sees his parents, returns to London, kills the friend and his porter. He decides it is too risky to assassinate Morgan. # Rashood learns about submarines from the Russians. # Rashood and Captain Badr take the first submarine from Araguba, near Murmansk to Petropavlosk, Kamchatka. The second submarine leaves Araguba and goes silently past Ireland, heading for Africa. Ramshawe watches both. # Rashood marries Shakira and makes her a Lt-Commander. She joins him on the first ship. They almost sink a fishing trawler by getting caught in its nets. They head for Alaska going north of the Aleutian islands. # They send cruise missiles at Valdez and destroy an oil port. They head south for Graham Island and frogmen to cause two major breaks in an oil pipe. They head south and destroy an oil refinery and fuel farm at Grays Harbor with more cruise missiles. # The Russians tell the Americans they sold the first submarine to the Chinese. They imply the second one was stripped for parts. # They fire more missiles at Lompoc Power Station. The second submarine arrives at Petropavlosk. # They enter the Panama Canal which is controlled by the Chinese who then close the canal. The personnel are spotted by three American tourists who are killed as they abandon the submarine. # Morgan sends SEALs to blow up a lock gate. The water released smashes the next gate. The lake drops and reveals the empty submarine. *Epilogue. USA takes over the Panama canal. Rashood has escaped to fight another day.",715
14321313,Dark Enough to See the Stars in a Jamestown Sky,Connie Lapallo,2006,"['Fiction', 'Fiction']","The story begins with Joan's early memories, and her first marriage. Her husband dies, and she marries Will Peirce. Together they make the decision to cross the sea and live in Jamestown, leaving Joan's daughter Cecily behind until she is old enough to earn the right to her own land. Joan and her younger daughter, Jane, are placed on a different ship than Will, where she meets Elizabeth, her highly irritable neighbor, and Maggie, a kind, cheerful woman. The ship sails through a hurricane, causing the ships to become separated. The ship eventually lands at Jamestown, where the settlers are already struggling. Maggie, Elizabeth, and Tempie share a house with Joan and Jane, and they work together to survive disease, starvation, and attack.",324
14321791,101 Ways to Bug Your Teacher,Lee Wardlaw,2005-07-21,"{""/m/0dwly"": ""Children's literature""}","The story opens with Sneeze, Hiccup, Goldie, Ace, and Pierre working on their Egyptian history projects. Their teacher, Ms. Pierce, has an unusual way of assigning punishments to her students: ""the death roll"". His parents tell him that he is going to skip the 8th grade and go straight to high school. Sneeze doesn't want to leave his friends so he makes a list of things to do to bug teachers. When Hayley confronts him, he kisses her smack on the lips. Sneeze enters the Inventors Club, and his mom has a baby named Alyssa Marie Wyatt, who inherits his allergies.",258
14322147,One Fine Day in the Middle of the Night,Christopher Brookmyre,1999,"{""/m/0lsxr"": ""Crime Fiction"", ""/m/0vgkd"": ""Black comedy"", ""/m/06nbt"": ""Satire"", ""/m/02xlf"": ""Fiction""}","Gavin Hutchinson, purveyor of non-threatening holidays to the British masses has organised a reunion for his old school classmates. The reunion will take place on his latest project - a unique ""floating holiday experience"" on a converted North Sea oil rig, a haven for tourists who want a vacation in the sun but without the hassle of actually interacting with any foreigners. And what better way to test out his venture than to host a fifteenth-year high school reunion, the biggest social event of his life... except no one remembers who Gavin is. Gavin may have been a non-entity while at school in Auchenlea but now he's made his fortune, he's looking forward to lording it over his old classmates, especially now he's having an affair with Catherine O'Rourke, PR specialist and one-time pin-up for his male classmates at St Michael's. Meanwhile Gavin's wife, who as 'Simone Draper' remains much more memorable to those from Auchenlea than her husband, is fed up with his philandering and aims to use the evening to publicly embarrass Gavin by announcing her plans to take the twins and leave him. Intent on ruining Gavin's evening, she's also added two extra names to the guest list - Hollywood star, famous comedian (and the recently suicidal) Matt Black, as well as class bampot, though now reformed artist, David ""Dilithium Dave"" Murdoch. As the ex-classmates gather on the almost finished holiday resort, currently moored off the coast of Scotland, little do they know that a troop of would be ""soldiers of fortune"" have been contracted to hit the rig for some blackmail action. The group of mercenaries (mostly recruited from the minimum wage end of the labour market, and already reduced in number due to some experiments with a rocket launcher) are made up of a variety of ex-terrorists from Ulster and Africa mixed in with a few professionals and to say they're not getting on well is a bit of an understatement...",0
14328220,My Legendary Girlfriend,Mike Gayle,1998,"{""/m/01z4y"": ""Comedy""}","Meet Will Kelly. English teacher. Film fan. King of sandwich construction. Still in love with The One, desperately searching for An-Other One. In his decrepit flat, Will's lifeline is the telephone. There's Alice (who remembers his birthday), Simon (who doesn't), Martina (the one-night stand), Kate (the previous tenant of his rented Archway fleapit) and of course Aggi - the inimitable Aggi. His Legendary Girlfriend. Or is she? Two men, three women and a donkey called Sandy... basically it's your classic love hexagon.",0
14329460,Day of Empire: How Hyperpowers Rise to Global Dominance - and Why They Fall,Amy Chua,2007-10,UNK,"The book discusses examples of ""hyperpowers"" throughout human history. Chua describes in rough chronological order the hyperpowers, from the Achaemenid Persian Empire to the British Empire, with reflections on the United States of America as a hyperpower. The empires of Rome, the Tang, the Mongols and the Dutch provide examples of successful hegemonies, while the failures of imperial Spain, Nazi Germany and the Greater East Asia Co-Prosperity Sphere counterpoint them. Chua argues that preconditions for hyperpower status include tolerance of ethnic divisions, and that preconditions for its loss include either a growing intolerance by the traditional ruling élites or a failure to ""glue"" together the subject peoples into an overarching identity.",0
14335797,The Alchemist,Donna Boyd,1988,"{""/m/06n90"": ""Science Fiction"", ""/m/014dfn"": ""Speculative fiction"", ""/m/05hgj"": ""Novel"", ""/m/08sdrw"": ""Adventure novel"", ""/m/05qfh"": ""Psychology"", ""/m/02p0szs"": ""Historical fiction"", ""/m/01hmnh"": ""Fantasy"", ""/m/02xlf"": ""Fiction"", ""/m/07s9rl0"": ""Drama""}","The Alchemist follows the journey of an Andalusian shepherd boy named Santiago. Santiago, believing a recurring dream to be prophetic, decides to travel to a gypsy in a nearby town to discover its meaning. She tells him that there is a treasure in the Pyramids in Egypt. Early into his journey, he meets an old king, Melchizedek, who tells him to sell his sheep to travel to Egypt, and his Personal Legend: what he always wanted to accomplish in his life. And that ""When you want something, all the universe conspires in helping you to achieve it."" This is the core philosophy and motto of the book. Along the way, he encounters love, danger, opportunity, disaster and learns a lot about himself and the ways of the world. During his travels, he meets a beautiful Arabian woman named Fatima who explains to him that if he follows his heart, he shall find what it is he seeks. Santiago then encounters a lone alchemist who tells about personal legends. He says that people only want to find the treasure of their personal legends but not the personal legend itself. He feels unsure about himself as he listens to the alchemist's teachings. The alchemist states ""Those who don't understand their personal legends will fail to comprehend its teachings."" It also states that treasure is more worthy than gold.",0
14339747,The Clue in the Old Stagecoach,Carolyn Keene,1960,"{""/m/02n4kr"": ""Mystery"", ""/m/028v3"": ""Detective fiction"", ""/m/0dwly"": ""Children's literature""}","Nancy searches for an antique stagecoach that, according to legend, contains something of great value to the people of Francisville.",0
14342236,Helmet for My Pillow,Robert Leckie,2003,"{""/m/098tmk"": ""War novel"", ""/m/05h83"": ""Non-fiction""}","Beginning with boot camp in MCRD Parris Island, South Carolina, the story follows Leckie through basic training and then to New River, North Carolina where he is briefly stationed, and follows him to the Pacific. Leckie is assigned to the 1st Marine Division and is deployed to Guadalcanal, northern Australia, New Guinea, Cape Gloucester, before being evacuated with wounds from the island of Peleliu. Helmet for My Pillow is told from an enlisted man's point of view; a reprint edition stated the book was about ""the booze, the brawling, the loving on 72-hour liberty, the courageous fighting and dying in combat as the U.S. Marines slugged it out, inch by inch, across the Pacific.""",319
14342758,Monsieur,Lawrence Durrell,1974,"{""/m/02xlf"": ""Fiction"", ""/m/05hgj"": ""Novel""}","In the first section, ""Outremer,"" Bruce Drexel is returning to Provence after learning of his lover / brother-in-law's suicide. His wife is institutionalized and has been for some time, and he revisits Avignon with his friend Toby while attending to the necessary funeral arrangements and reminiscing about his life with Piers and Sylvie. He recalls stylistically rich winter scenes when the three were first in love, as well as a novel written about them by Robin Sutcliffe. The second chapter, ""Macabru,"" recounts Bruce, Piers, and Sylvie's journey into Egypt where they meet Akkad, who initiates them into a Gnostic cult. Akkad takes them to Macabru in the desert in order to explain the group's rituals. There is an extended journey on the Nile in this section that parallels a later journey on the Rhone in Livia. ""Sutcliffe, or the Venetian Documents"" presents a new narrator, which renders the previous materials fictional, unless this is another fiction. Sutcliffe has various misadventures in Venice and recalls his failed marriage to Pia, Bruce's sister. ""Life with Toby"" returns to Bruce and Toby in Avignon discussing a theory about the Knights Templar that returns to the Gnostic theme; this section is interrupted by another text in ""The Green Notebook,"" which returns to Sutcliffe. Monsieur was initially composed in a green notebook, and ""A Green Notebook"" consists largely of the unrevised notes that preceded the novel. This section becomes highly fragmentary. ""Dinner at Quartilla's"" is the last section of the novel and introduces another author, Blanford, who is writing a book in which Sutcliffe is a character. He dines with his friend, the old Duchess Tu, who is actually long dead. The novel ends with an Envoi that gives a continuing list of who begat whom throughout the novel but without a final resolution.",0
14348829,Penny from Heaven,Jennifer L. Holm,2006,"{""/m/0dwly"": ""Children's literature""}","The book is set in New Jersey in the year 1953. Protagonist Penny Falucci is an eleven-year-old girl who lives with her widowed mother and grandparents. Since the death of Penny's father, Mrs. Falucci shuns her big Italian-American family, but she won't give Penny a good reason. Penny loves that side of the family and spends as much time with them as she can. After an accident that puts her in the hospital for several weeks, Penny learns the truth about her father, his death, and how it tore apart the two halves of her family. Penny's mother won't let her go to the movies or the pool, for fear of her catching polio. Her favorite uncle is living in a car and on top of it all, her mother is dating the milkman, Mr. Mulligan. In the end, Mulligan professes his love for Penny's mother after Penny agrees on his marriage to her mother,and they get married after Penny's terrible accident. She ends up living as a ""normal"" twelve-year-old in New Jersey.",0
14354699,The Maytrees,Annie Dillard,2007,"{""/m/05hgj"": ""Novel""}","Literate Provincetown bohemians Toby and Lou Maytree meet and marry, have a son, and begin to grow old before Toby decides to leave for Maine to build a new life with a family friend. Toby and Lou remain estranged as the book follows both characters through life's progress: Lou raises their son and Toby and Deary develop a successful business. When Deary falls ill and Toby loses his ability to care for her, the families are reunited.",0
14356271,Trapped in the USSR,UNK,1984,"{""/m/0dwly"": ""Children's literature""}","Richard Duffy promised Stephen an uneventful week when the latter's parents went for a week-long trip to Clearwater, Florida, for business. Reasoning if they were not home, they would not receive emergency phone calls or visitors asking for help, the uncle-nephew duo went out for dinner. Yet barely a block from their residence, they were surrounded by 4 heavy-set men who forced them into a limousine, driven directly to an airport runway and made to board a waiting plane, bypassing all normal customs, immigration and security channels. They were flown to Estonia, and transferred to a submarine where a past adversary of Richard, Igor Borisov of the KGB, forced Richard to carry out a secret investigation into a plot by Soviet officials in the highest circle. Igor selected Richard because he could trust few people, and one of his own reliable men had been killed recently. In order to get himself and Stephen safely home, Richard had to agree, and even had to work with the beautiful Natasha Golovina whom Richard had outmanoeuvred in the past in Paris. To make things worse, Stephen had to mention Michelle LeBlanc whom he met in the previous story Pursuit of the Deadly Diamonds, arousing Natasha's jealousy. Convinced too that the plot Igor was facing was a threat to his own country and the world as a whole, they undertook feverish trips across the USSR, from Leningrad, to Moscow, to Tashkent, Bratsk, and finally, Odessa. Their assignment was to steal vital documents kept by five men identified as being chief conspirators in the plot.",0
