id,title,author,published_date,categories,summary,page_count
4956429,Changeling,Roger Zelazny,1980-06,"{""/m/014dfn"": ""Speculative fiction"", ""/m/01hmnh"": ""Fantasy""}","The people had long suffered under Det Morson's power. When at last, the wizard Mor joined the fight, Det and his infamous Rondoval castle were destroyed. But the victory was not complete, for the conquerors found a baby amidst the rubble: Det's son, Pol. Unwilling to kill the child, Mor took him to a parallel world where technology ruled and the ways of magic were considered mere legends. He substituted Pol for a baby of the same age, using a spell to persuade the parents to recognize him as their own. In order to retain the balance between the worlds, Mor took the baby from the other world and brought it back to his own, leaving it with a local artisan, Marak.",0
4956449,Madwand,Roger Zelazny,1981,"{""/m/014dfn"": ""Speculative fiction"", ""/m/01hmnh"": ""Fantasy""}","Pol Detson, son of Lord Det, has come home, now a powerful sorcerer of unsurpassed natural ability. But Pol is still an untrained talent, a ""madwand."" To take control of his powers, to rule in his father's place, he must survive arduous training and a fantastic initiation into the rites of society. The story implied that a sequel was necessary to complete the story, but no sequel was ever written.",0
4959546,Barney's Version,Mordecai Richler,1997,"{""/m/05hgj"": ""Novel""}","The story is written as if it is an autobiography by Barney Panofsky recounting his life in varying detail. At the end of the book he is diagnosed with Alzheimer's Disease, explaining his previous memory lapses and footnote corrections by his son Michael. Barney's version of events may be viewed as that of two unreliable narrators, in that his recollections are told from varying mental states and then posthumously edited by his son. Underlying the story of Barney's three marriages is the mysterious disappearance of his friend Boogie. Though there is no body, police suspect murder, and Barney himself is tried but acquitted of murder. An explanation for the mystery is given at the novel's end.",0
4963176,The House with a Clock in Its Walls,John Bellairs,UNK,"{""/m/01hmnh"": ""Fantasy"", ""/m/0dwly"": ""Children's literature"", ""/m/03npn"": ""Horror"", ""/m/014dfn"": ""Speculative fiction"", ""/m/02xlf"": ""Fiction""}","The book begins when the recently orphaned Lewis Barnavelt moves to the (fictional) town of New Zebedee, Michigan, to live with his mysterious uncle Jonathan Barnavelt. Jonathan turns out to be a mediocre, though well-intentioned, wizard, while his next-door neighbor and good friend, Florence Zimmermann, is a far more powerful good witch. Jonathan's house was previously owned by Isaac and Selenna Izard, a sinister couple who had dedicated their lives to evil magic, and plotted to bring about the end of the world. Before dying, Isaac constructed the titular clock that he hid somewhere inside the walls of the house, where it eternally ticks, still attempting to pull the world into the magical alignment, which would permit him to destroy it. Lewis manages to befriend a local boy named Tarby, who is everything he is not—popular, athletic, thin, and so on—but the two soon begin to drift apart. Lewis tries to win Tarby back by demonstrating how to raise the dead in the local cemetery on Halloween but only succeeds in releasing Selenna from her tomb. An escalating series of encounters with the sorceress' ghost builds to a final confrontation in the basement of Jonathan's house, where Lewis must summon up his courage and prevent her from finishing her husband's work and bringing on Doomsday. As the story ends, Lewis announces that he has found a new friend, a girl named Rose Rita Pottinger.",0
4965456,The Viceroy of Ouidah,Bruce Chatwin,1980,"{""/m/05hgj"": ""Novel""}","Chatwin's novel portrays the life of a fictional slave trader named Francisco Manuel da Silva, who is loosely based on the life of an historical Brazilian, Francisco Felix de Sousa. He became powerful in Wydah (or Ouidah), the so-called Slave Coast of West Africa, now Benin and Togo. (Note: Chatwin was caught up in the violence of a coup in Dahomey (now Benin) when he was researching the book.)",0
4968585,Brian's Hunt,Gary Paulsen,2003,"{""/m/03mfnf"": ""Young adult literature"", ""/m/05hgj"": ""Novel""}","Brian, who is now sixteen years old, is canoeing through the Canadian wilderness. He realizes that the woods are now his home and he will never be happy in modern society, with its noise, pollution, and fake people. He now spends his time in the wild, hunting, fishing, and home schooling himself. While Brian does not miss human contact, he finds his thoughts frequently turning to Kay-gwa-daush (also known as Susan), the teenage daughter of the Cree family who rescued him at the end of Brian's Winter. Though he has only seen her photograph, her family has described her as an adventurous, self-reliant young woman, and Brian wonders if she might be a kindred spirit. While canoeing, Brian finds a seriously wounded Malamute dog, which he nurses back to health. The dog is clearly domesticated, and Brian begins to worry that whatever maimed the dog may have done the same to her owners. He remembers his Cree friends and decides to go check on them. When Brian reaches their cabin, he finds that it was a bear that had killed the parents and apparently chased Susan into hiding. Brian returns her to her home, radios for help, and buries the family. The authorities arrive to take Susan to relatives in Winnipeg. Brian, along with the dog, stays behind in order to hunt down and kill the bear, knowing very well that the hunt could cost him his life. Brian, using skills he had learned in past books like Hatchet and Brian's Winter, searches for the bear that killed his friends. But soon, the hunter becomes the hunted. Brian finds bear tracks on an island and begins to follow them. He later realizes that he was walking in a circle. The bear is actually hunting Brian. The next day, instead of moving on, he waits for the bear, and after a hard fought battle with the bear, Brian is triumphant.",0
4974066,Xavras Wyżryn,Jacek Dukaj,1997-01,"{""/m/0mz2"": ""Alternate history"", ""/m/06n90"": ""Science Fiction""}","In 1996, a young American reporter, Ian Smith, is sent by his news network to the Soviet republic of Poland, to document guerrilla actions of Polish freedom fighters against the Soviet regime. His task includes interviewing the charimastic leader of Polish Freedom Army, Colonel Xavras Wyżryn. Ian does not realize that during his long trip from Ukrainian steppes to Moscow, alongside hardened veterans of Polish forces, he will experience the horror of war in which there is no good and evil side. Neither does he expect to find himself in the midst of the most reckless of Wyżryn's campaigns - when the Polish forces capture a Soviet atomic bomb and start to smuggle it towards Moscow.",0
4974074,Flashman,George MacDonald Fraser,1969,"{""/m/02p0szs"": ""Historical fiction"", ""/m/02xlf"": ""Fiction"", ""/m/0hwxm"": ""Historical novel""}","Flashman's expulsion from Rugby for drunkenness leads him to join the Army for what he hopes will be a sinecure. He joins the 11th Regiment of Light Dragoons commanded by Lord Cardigan whom he toadies in his best style. After an affair with a fellow officer's lover, he is forced to fight a duel but wins after promising a large sum of money to the pistol loader to give his opponent a blank load in his gun. He does not kill his opponent but instead delopes and accidentally shoots the top off a bottle thirty yards away, an action that gives him instant fame and the respect of the Duke of Wellington. However, once it was found out what they were fighting over, Flashman is stationed in Scotland. He is quartered with the Morrison family, and soon enough he takes advantage of one of the daughters, Elspeth. After a forced marriage, Flashman is required to resign the Hussars due to marrying below his station. He is given another option, to make his reputation in India. By showing off his language and riding skills in India, Flashman is assigned to the worst frontier of the British Empire at that time, Afghanistan. His adventures include the retreat from Kabul, Last Stand at Gandamak and the Siege of Jalalabad, in the First Anglo-Afghan War. Despite being captured, tortured, and escaping death numerous times, and hiding and shirking his duty as much as possible, he comes through it all alive and with a hero's reputation&nbsp;... although his triumph is tempered when he realises his wife might have been unfaithful while he was away.",0
4974452,Lost City,Clive Cussler,2004,"{""/m/01jfsb"": ""Thriller"", ""/m/05hgj"": ""Novel"", ""/m/08sdrw"": ""Adventure novel""}","The Story begins with a flashback to August 1914, where Jules Fauchard is flying his Morane-Saulnier N, mono-winged aircraft. Fauchard is heading to meet the pope's emissary in Switzerland but as he is coming to the border and the French Alps, a squad of six Aviatik biplanes find him. The planes attack Fauchard and though he destroys four planes he is eventually shot down and killed. His plane lands in a glacial river and Fauchard along with his helmet and strong box are buried in a glacier. Cut to the present day in the Scottish Orkney Islands. A reality television show is being filmed when that evening a group of animals attack the crew and cast. Everyone is killed except for Jodie Michaelson; the only reason she is not killed is because as she was running from the creatures she fell into a deep crevace in the rocks and the animals lost her scent. At about the same time yet another plotline is developing. This part of the story takes place in Monemvassia, The Greek Peloponnese. The storyline follows Dr. Angus MacLean, a research Chemist. MacLean is on the run. He is living in a monastery on a small island in Greece. As MacLean reminisces it becomes clear why he is running. The trouble began when he was hired to research enzymes in France. As the leader of a team of scientists doing enzyme research, the hours were long but the pay was great and MacLean had no complaints. That was until he began asking questions. The owners of the lab decided to send home the scientists, telling them ""not to worry."" MacLean headed to Turkey to see the ruins. This probably saved his life. When he came home he was greeted with an envelope full of newspaper clippings and a telephone message from one of his former colleagues that asked him if he had been watching the news and urged MacLean to call him back. When MacLean tried to call him back he was informed that the man had been killed in a hit-and-run accident. This leg of the story ends with MacLean being kidnapped by a hit team that had been hired by the company that ran the lab. The story then cuts to the French Alps where a team of scientists is studying a glacier named Le Dormeur. The scientists, Hank Thurston and Bernard LeBlanc are accompanied by Derek Rawlins, a journalist for Outside magazine. As the three scientists are giving Rawlins a tour they get a phone call saying that a body frozen in the ice had been discovered. Two hundred feet below the surface of Lac du Dormeur, Kurt Austin and a beautiful woman named Skye Labelle are inside a submersible searching for remnants of trade routes between Europeans and the Mediterranean civilizations, when Skye is recalled back to land. Skye is an expert in arms and armour. It seems that the authorities need her help to identify the helmet found with the frozen body in the glacier. When Skye arrives where the body is frozen, she sees her arch-nemesis, Renaud. Auguste Renaud is one of the higher-ups at the State Archaeological board of France. He is attracted to Skye but she is repulsed by him. Skye is puzzled by the body. The deceased is dressed in an early twentieth century flight suit but in his possession is a very old helmet. The helmet is a riddle in itself, as it is of very high quality and very distinctive yet it isn't like anything she has ever encountered. Needless to say Skye cannot identify the artifact on the spot. Much to Skye's chagrin, Renaud has called a press conference in the underground laboratory to announce the discovery to the world. During the press conference something terrible occurs. A very large and muscular bald man comes up to Renaud and demands the strongbox found with the body saying, ""Give the box to me."" Renaud responds saying with a grin, ""Not on your life!"" To this the bald man says, ""No, Not on your life!"" and with that he pulls a pistol out of his coat and brings it down on Renaud's hand. The large man then takes off with the box. A few seconds later the group hears a loud explosion as a barrier that holds back the glacial waters is destroyed, water is flowing into the laboratory. Then they are trapped in a flooding tunnel. When Kurt Austin hears the news, he sends a rescue team and the they start an operation. Then, another chopper lands on the shore. Austin had called Joe Zavala on his cellphone. Austin and Zavala got into the submersible and crack a hole in the flooding tunnel from under water. They got everyone safely to shore within the next hour.",0
4976216,Hunter,James Byron Huggins,1989,"{""/m/014dfn"": ""Speculative fiction""}","The story is set in the United States, presumably during the late 1980s or early 1990s. It begins with Yeager in the middle of a personal campaign of assassination, initially gunning down racially mixed couples in parking lots, before escalating to more sophisticated methods against higher-profile targets, including prominent journalists and politicians whom Yeager sees as promoting racial mixing. At the same time, Yeager and his girlfriend are developing connections with a white nationalist group. After several successful and increasingly ambitious attacks, Yeager is found and confronted by a senior agent of the FBI who himself is disgusted with ""Jewish control"" of the FBI and the American social situation. This agent blackmails Yeager into assisting him with his career by assassinating several Jewish FBI agents and targeting Mossad agents in the United States so that the agent can be appointed as the head of a newly-formed antiterrorist secret-police agency, assume increasing control of the United States, and use his power to challenge and remove Jewish control of the government and media. At the same time, Yeager's white nationalist group is achieving greater and greater prominence through the insertion of one of their members into a Christian evangelist television broadcasting ministry, from which he is broadcasting increasingly racially-conscious and anti-Jewish messages. Yeager's campaign of assassination and terrorism, the actions of copycats and imitators, the white nationalist broadcasting effort, the efforts of the antiterrorist official, and a rapid decline of the U.S. economy all work to push the United States towards increasing racial and social violence and fragmentation. Eventually, Yeager is faced with a dilemma when the government official for whom he has been working finally orders him to kill the undercover evangelist minister, whose efforts oppose the agent's intent to establish order and strike a temporary bargain with the Jews. Yeager attempts to avoid the assignment, and then deliberately appears to bungle the assassination. At this point, Yeager is caught between the intentions of his government confederate, who intends to consolidate his own power and control over the government and reform the system from the top down after suppressing upcoming black nationalist riots; and the white-nationalist group who wishes to stir up the chaos even further, draw white Americans into battle, and eventually overthrow the government. Ultimately, Yeager kills the government agent. Following this, the Jewish-controlled media side with the black rioters, revealing that the government official would have been double-crossed had he attempted to strike his deal. Yeager and the other members of the group, now under increasing government scrutiny, resolve to continue their efforts and to go ""underground"" to continue the fight against the system.",0
4976673,The Dragon Society,Lawrence Watt-Evans,UNK,"{""/m/014dfn"": ""Speculative fiction"", ""/m/01hmnh"": ""Fantasy"", ""/m/02xlf"": ""Fiction""}","After the events of the first book, Dragon Weather, Arlian finds himself armed with the knowledge of how dragons reproduce. It is a nasty and terrible business and Arlian wishes to prevent dragons from ever reproducing. Using the magic gathered in Arithei, he continues his quest. He realizes that if he is to fulfill his quest of destroying the dragons he must destroy the entire dragon society which is made up of dragon hearts. Dragon hearts are those who have drunk a mixture of human blood and dragon venom and gain a long extended life and a baby dragon growing in their heart. Arlian and his best friend Black hunt down the dragons in the hope that if Arlian kills a dragon the duke will assist him in destroying the dragon menace. In the end he removes a dragon from the heart of a Lady Rhime which wakes up its mother. The mother dragon comes to Manfort to kill Arlian but instead falls victim to an obsidian spear. This means Arlian is the first man to kill a dragon ever. He receives the full assistance of the duke and named warlord in the coming battle against the dragons. Even with the success of killing a dragon Arlian's task is far from over.",0
4977689,The Day of the Scorpion,Paul Scott,1968-09,"{""/m/03g3w"": ""History"", ""/m/05hgj"": ""Novel""}","In this novel an old Raj family comes newly on the scene, the Laytons of Pankot, an imaginary hill station in India. Now an army captain, Ronald Merrick, a self-made man of the lower middle class and the former police official in charge of the Daphne Manners case, begins to insinuate himself subtly into the Layton family. We learn what the Laytons do not know that in a searing session with the incarcerated Hari Kumar, Merrick tortured and molested him. Susan, the younger Layton sister, driven by a sense of her own nothingness, marries Teddie Bingham, a colorless and conventional officer in the prestigious Pankot Rifles regiment. By accident, Teddie and Merrick are roommates, and when his designated best man falls ill at the last minute, Teddie asks Merrick to act as best man. The wedding is held in Mirat, a native state ruled by a Nawab. On the way to the wedding ceremony, someone throws a stone at the car in which Teddie and Merrick are riding. Teddie is injured and has to be patched up. At the wedding reception, the Nawab of Mirat becomes a victim of heightened security when he is denied entrance to his own property as he is an Indian. When the newlyweds are being seen off at the railway station, Shalini Gupta Sen appears and makes a scene, beseeching him. She is later revealed to be begging Merrick to reveal the whereabouts of her nephew, Hari Kumar. Nigel Rowan, an officer serving in the civil service, takes Lady Manners to observe the debriefing of Hari Kumar, who was tortured and jailed after the rape of Lady Manners's niece, Daphne, and who has been held in prison for a year under the Defense of India Act for vague alleged political crimes. The panel, consisting of Rowan and an Indian member, is horrified to learn of Hari's treatment at Merrick's hands. It comes out that Hari has never been informed that Daphne conceived a child and then died. The questioners realize that Hari's statements will be too inflammatory in the fragile political climate of India. They also realize that Hari is innocent, however, and suspect that at some point in the future, he will be quietly released from custody. Teddie and Merrick are sent to the front in Manipur against the Japanese and their surrogates, the Indian National Army (known as ""Jiffs"" among the British). Teddie, against Merrick's warnings, falls victim to an INA ambush while trying to induce INA soldiers from his regiment to surrender. Merrick does his best to save Teddie, but is unsuccessful, and comes away horribly disfigured. Teddie goes forward, it is implied, because he is concerned about the methods Merrick might employ on the turncoats. Sarah Layton, the older sister, comes to the fore as the morally fine-tuned mainstay of the family. To show the family's gratitude for his efforts, Sarah visits Merrick in Calcutta, where he is convalescing at an Army hospital. Merrick explains to her why he believes himself partly responsible for Teddie's fate. She is horrified by his disfigurement and learns that much of Merrick's left arm is to be amputated. While in Calcutta, Sarah is staying with Aunt Fenny, who is eager to get Sarah matched up with a young man. She gets her husband, Uncle Arthur, to bring several of his junior officers over for dinner. In particular, she is enthusiastic about introducing Sarah to Jimmy Clark. After an unsuccessful evening on the town, Clark takes Sarah to the Indian side of Calcutta, where they attend a fancy party at the home of a wealthy socialite. There, Clark seduces Sarah by challenging her to taste life. On her way back to Pankot, Sarah encounters Count Bronowsky, a White Russian emigre who is the Nawab's wazir or chief advisor, whom she had met during Susan and Teddie's wedding. With him is Nigel Rowan. They are there to meet Mohammed Ali Kasim, a prominent politician who is being released after a period of imprisonment under the Defense of India Act. Kasim learns from his younger son, Ahmed, that his elder son, Sayed, an officer in the Indian Army, has become turncoat and joined the INA and now faces charges of treason. Barbie Batchelor, the friend and paying guest of Mabel Layton discovers the secret of the enmity between Mabel and Mildred one night when both the elderly women are unable to sleep. Mabel also tells Barbie she will never go to Ranpur again until after she's buried, which Barbie interprets to mean that she wishes be buried next to the grave of her late husband, James Layton, in Ranpur. Susan Bingham, Teddie's newlywed and pregnant bride, is unhinged when having received news of Teddie's death she witnesses her aunt Mabel's death. As it is, Susan depends on others to define her role and character. Without Teddie to serve as the anchor for her identity, Susan is lost and afraid to be responsible for a fatherless child. Coming unhinged, she makes a ring of fire with paraffin and places the baby with it, in imitation of a native treatment of scorpions which she witnessed as a child. The baby is rescued unharmed by its nurse.",0
4981238,Betsy and Tacy Go Downtown,Maud Hart Lovelace,1943,UNK,"In this volume in the series, horseless carriages arrive in Deep Valley for the first time when Mr. Poppy, the owner of the Opera House, buys an automobile. Betsy's friend Tib is his first passenger &mdash; along with his wife &mdash; due simply to her having the boldness to ask for a ride. Although the girls' classmate Winona Root is initially jealous of Tib over this experience, she soon gets over it and invites Betsy, Tacy, and Tib to their first real theatrical experience, a dramatized version of Uncle Tom's Cabin at the Opera House. Betsy befriends the lonely Mrs. Poppy, who welcomes the chance to share the little girls' affection after having lost her only daughter in the years before moving to town. Through this friendship, the girls not only enjoy parties at the Poppy Hotel, but also participate in a theatrical production of Rip Van Winkle that lets Mrs. Poppy reunite Betsy's mother, Mrs. Ray, with her long-lost brother. Betsy and her friends also discover the temptations of dime novels, prompting Betsy to try her hand at writing her own. Eventually, Betsy shares her secret writings with her mother, who successfully encourages her to write fiction of more elevated character. Betsy's parents decide that in order to foster a love of classic literature and make Betsy a better writer, she will be allowed to go alone to the new Carnegie library every two weeks, with spending money for a special mid-day treat to let her stay all day.",0
