id,title,author,published_date,categories,summary,page_count
759793,The Golden Ass,Apuleius,UNK,"{""/m/0g_jj"": ""Picaresque novel""}","Book One The prologue establishes an audience and a speaker, who defines himself by location, education, and occupation. The narrator journeys to Thessaly on business. On the way, he runs into Aristomenes and an unnamed traveler. The unnamed traveler refuses to believe Aristomenes’ story. The narrator scolds the unnamed traveler and tells a short story about a sword swallower. He promises Aristomenes a free lunch if he will retell his tale. The narrator believes Aristomenes’ tale and becomes more eager to learn about magic. The narrator arrives at Hypata, where he stays with Milo, a family friend and miser, and his wife Pamphile. Photis, Milo’s servant, takes the narrator to the baths, after which the narrator goes to the marketplace. There, he buys some fish and runs into his old friend Pytheas, who is now a magistrate. Pytheas reveals the narrator’s name as Lucius. Pytheas says that Lucius overpaid for the fish and humiliates the fish-monger by trampling on the fish. Lucius returns to Milo’s house, hungry and empty-handed. Milo asks Lucius about his life, his friends, and his wanderings. Lucius goes to sleep hungry. Book Two The next morning, Lucius meets his aunt Byrrhena in the town, and she warns him that Milo's wife is an evil witch who will kill Lucius. Lucius, however, is interested in becoming a witch himself. He then returns to Milo's house, where he repeatedly makes love to the slave-girl Fotis (also spelled Photis). The next day, Lucius goes to his aunt's home for dinner, and there meets Thelyphron, who relates his tale of how witches cut off his nose and ears. After the meal, Lucius drunkenly returns to Milo's house in the dark, where he encounters three robbers, whom he soon slays before retiring to bed. Book Three The next morning, Lucius is abruptly awoken and arrested for the murder of the three men. He is taken to court where he is laughed at constantly and witnesses are brought against him. They are just about to announce his guilt when the widow demands to bring out the dead bodies; but when the three bodies of the murdered men are revealed, they have miraculously transformed into puffed-up wineskins. It then turns out that it was a prank played by the town upon Lucius. Later that day, Lucius and Photis watch Milo's wife perform her witchcraft and transform herself into a bird. Attempting to copy her, Lucius accidentally turns himself into an ass, at which point Photis tells him that the only way for him to return to his human state is to eat a rose. Book Four Lucius the ass trots over to a garden to munch on a rose when he is beaten by the gardener and chased by dogs. He is then stolen from Milo's house by thieves, who talk about how their leader Thrasileon has been killed while dressed as a bear. The thieves then kidnap a young woman, Charite, who is housed in a cave with Lucius the ass. Charite starts crying, so an elderly woman who is in league with the thieves begins to tell her the story of Cupid and Psyche. Psyche is the most beautiful woman on earth, and Venus jealously arranges for Psyche's destruction. Book Five The elderly woman continues telling the story of Cupid and Psyche. Cupid, Venus's son, secretly preserves Psyche; Cupid becomes Psyche's anonymous lover. Psyche's jealous sisters arouse her curiosity and fear; Psyche, against Cupid's commands, looks at him; Cupid abandons Psyche, who wanders in search of him. Book Six The elderly woman finishes telling the story of Cupid and Psyche. Lucius the ass and Charite escape from the cave but they are caught by the thieves, and sentenced to death. Book Seven A man appears to the thieves and announces that he is the renowned thief Haemus the Thracian, who suggests that they should not kill the captives but sell them. Haemus later reveals himself secretly to Charite as her fiancé Tlepolemus, and gets all of the thieves drunk. When they are asleep he slays them all. Tlepolemus, Charite and Lucius the ass safely escape back to the town. Once there, the ass is entrusted to a horrid boy who torments him but the boy is later killed by a she-bear. Enraged, the boy's mother plans to kill the ass. Book Eight A man arrives at the mother's house and announces that Tlepolemus and Charite are dead, caused by the scheming of the evil Thrasillus who wants Charite to marry him. After hearing the news of their master's death, the slaves run away, taking the ass Lucius with them. The large group of travelling slaves is mistaken for a band of robbers and attacked by farmhands of a rich estate. Several other misfortunes befall the travelers until they reach a village. Lucius as the narrator often digresses from the plot in order to recount several scandal-filled stories that he learns of during his journey. Lucius is eventually sold to a catamite priest. He is entrusted with carrying the statue of a goddess on his back while he follows around the group of sinful priests. While engaging in lewd activity with a local boy, the group of priests is discovered by a man in search of a stolen ass who mistakes Lucius' braying for that of his own animal. The priests flee to a new city where they are well received by one of its chief citizens. They are preparing to dine when his cook realizes that the meat that was to be served was stolen by a dog. The cook, at the suggestion of his wife, prepares to kill Lucius in order to serve his meat instead. Book Nine Lucius' untimely escape from the cook coincides with an attack by rabid dogs, and his wild behavior is attributed to their viral bites. The men barricade him in a room until it is decided that he is no longer infected. The band of priests packs up and moves out. The narrative is interrupted by The Tale of the Wife's Tub. After the arrest of the priests Lucius is sold into labor, driving a baker's mill-wheel. Lucius, though bemoaning his labor as an ass, also realizes that this state has allowed him to hear many novel things with his long ass-ears. The Tale of the Jealous Husband and The Tale of the Fuller's Wife mark a break in the narrative. The theme of the two intervening stories is adultery, and the text appropriately follows with the adultery of the baker's wife and the subsequent murder of the baker. Lucius the ass is then auctioned off to a farmer. The Tale of the Oppressive Landlord is here told. The farmer duly assaults a legionary who makes advances on his ass (Lucius), but he is found out and jailed. Book Ten Lucius comes into the legionary's possession, and after lodging with a decurion Lucius recounts Tale of the Murderous Wife. He is then sold to two brothers, a confectioner and a cook, who treated him kindly. When they go out Lucius secretly eats his fill of their food. At first a source of vexation, when the ass was discovered to be the one behind the disappearing food it was much laughed at and celebrated. Again he was sold, and he was taught many amusing tricks. Rumor spread, and great fame came to the ass and his master. As it happened, a woman was so enamored of the sideshow ass that she paid off his keeper and took him to bed with her. The Tale of the Jealous Wife is aired. The murderess depicted in this tale is precisely she whom Lucius is made to mate with at the Shows. After an enactment of the judgment of Paris and a brief but important digression, the time comes for Lucius to make his much awaited appearance. At the last moment he decides against this, fearing for his life, and he runs away to Cenchreae eventually to nap on the beach. Book Eleven Lucius wakes up in a panic during the first watch of the night. Considering Fate to be done tormenting him, he takes the opportunity to purify himself by seven consecutive immersions in the sea. He then offers a prayer to the Queen of Heaven, for his return to human form, citing all the various names the goddess is known by to people everywhere (Venus, Ceres, Paphos, Proserpine, etc.). The Queen of Heaven appears in a vision to him and explains to him how he can be returned to human form by eating the crown of roses that will be held by one of her priests during a religious procession the following day. In return for his redemption, Lucius is expected to be initiated through the Navigium Isidis into Isis’ priesthood (Isis being the Queen of Heaven’s true name, according to her). Lucius follows her instructions and is returned to human form and, at length, initiated into her priesthood. Lucius is then sent to his ancestral home, Rome, where he continues to worship Isis, under the local name, Campensis. After a time, he is visited once more by the goddess who speaks again of mysteries and holy rites which Lucius comes to understand as a command to be initiated into the cult of Isis. He does so. Shortly afterwards, he receives a third vision. Though he is confused, the god appears to him and reassures him that he is much blessed and that he is to become once more initiated that he might supplicate in Rome as well. The story concludes with the goddess, Isis, appearing to Lucius and declaring that Lucius shall rise to a prominent position in the legal profession and that he shall be appointed to the College of Pastophori that he might serve Osiris and Isis’ mysteries. Lucius is so happy that he goes about freely exposing his bald head.",0
759873,Once Were Warriors,Alan Duff,1990,"{""/m/02xlf"": ""Fiction""}","Beth Heke left her small town and, despite her parents' disapproval, married Jake ""the Muss"" Heke. After 18 years, they live in a slum and have six children. Their interpretations of life and being Māori are tested. Since Beth is from a more traditional background, she relates to the old ways, while Jake is an interpretation of what some Māori have become. Beth sometimes tries to reform herself and her family - for example, by giving up drinking and saving the money which she would have spent on alcohol. However, she finds it easy to lapse back into a pattern of drinking and irresponsibility. The family are also shown disconnected from Western culture and ways of learning. Beth reflects that neither she nor anyone else she knows has any books in their home, and her daughter, Grace, is the only character with a real interest in school and learning. (This disconnection from books and education is a major concern of Duff's, for which reason he founded the charity Duffy Books in Homes, which gives free books to children from poor backgrounds and generally encourages reading). Jake is unemployed and spends most of the day getting drunk at the local pub with his friends. There he is in his element, buying drinks, singing songs and savagely beating any other patron whom he considers to have stepped out of line (hence his nickname of 'The Muss'). He often invites huge crowds of friends back to his home for wild parties. While Jake portrays himself as an easygoing man out for a good time, he has a vicious temper when drinking. This is highlighted when his wife dares to 'get lippy' at one of his parties and he savagely attacks her in front of their friends. Nig, the Hekes' eldest son, moves out to join a street gang. He cares about his siblings, but despises his father for his thoughtless brutality, a feeling returned by the elder Heke. Nig attempts to find a substitute family in the form of the gang, but this is unsuccessful as the gang members are either too brutal or, in the case of Nig's gang girlfriend, too beaten down to provide him with the love and support he craves. The second son, Mark 'Boogie' Heke, has a history of minor criminal offences, and is taken from his family and placed in a borstal. Despite his initial anger Mark finds a new niche for himself, as the borstal manager instructs him in his Māori heritage. Grace, the Hekes' 13-year-old daughter, loves writing stories as an escape from the brutality of her life. She also spends time spying on a wealthy Pākehā family who live nearby. She is amazed at the contrast between their lives and hers - not simply the material wealth, but also the lack of conflict in their lives. Grace's best friend is a drug-addicted boy named Toot who has been cast out by his parents and lives in a wrecked car. He is the one who really cares for her. Grace is raped in her bed one night, and she subsequently hangs herself. In her diary, later found by her family, Grace says she thinks it was her father who raped her (while in the movie she clearly identifies by name one of Jake's friends, who was at the house during a party, as the rapist); Jake, who had been too drunk to remember what happened that night, has no answer. (In the movie Grace's mother finds and reads the diary which reveals the dads friend who raped her. Jake and that friend are at a bar when the mother brings the diary to Jake, shows him the passage about who raped her. Jake flies into a rage savagely beats the rapist, including smashing the rapist's head into the glass front of the music jukebox.) He leaves his family and starts living in a park, where he reflects on his life and befriends a homeless young man. Meanwhile, Beth starts a Māori culture group and generally attempts to revive the community. A sequel to the book was published in 1996, What Becomes of The Broken Hearted?, which was made into a film in 1999. Both the book and film sequel were well received, though not as celebrated as the original. The third book in the trilogy, Jake's Long Shadow, was published in 2002, but has not been made into a movie. Once Were Warriors, and Duff's fiction in general, is strongly influenced by his childhood experiences. In his 1999 autobiography, Out of the Mist and Steam, he describes his Māori mother (and most of her relatives) as alcoholic, irresponsible and physically and emotionally abusive. His Pākehā father and his relatives, by contrast, were highly educated and sophisticated - one uncle, Roger Duff, was a well-known anthropologist; his paternal grandfather was liberal magazine editor and literary patron Oliver Duff. As a teenager, Duff himself spent some time in borstal, and he drew on this when writing about Boogie. The book's setting of Two Lakes is based on his hometown of Rotorua (which means 'two lakes' in the Māori language; roto lake, rua two), and on the Ford Block of state housing in the town.",0
760079,Eye of the Needle,Ken Follett,UNK,"{""/m/02xlf"": ""Fiction"", ""/m/0c3351"": ""Suspense""}","Operation Fortitude was an Allied counter-intelligence operation run during World War II. Its goal was to convince the German military that D-Day landings were to occur at Calais and not Normandy. As a part of Fortitude the fictitious First United States Army Group (FUSAG) was created. FUSAG used fake tanks, buildings and radio traffic to create an illusion of an army being formed to land at Calais. In 1940 Henry Faber is a German spy working at a London railway depot, collecting information on troop movements. Faber is halfway through radioing this information to Berlin when his landlady stumbles into his room hoping for intimacy. Faber fears that Mrs. Garden will eventually realize that he was using a transmitter and that he is a spy. Faber kills her with his stiletto. He then resumes his transmission. His repeated use of this stiletto leads to his nickname 'Die Nadel' ('The Needle'). The book then introduces David, a trainee RAF pilot, and his bride Lucy. On their honeymoon David and Lucy are involved in a car crash. David loses the use of both his legs. Unable to fly in the Battle of Britain David grows embittered as he and Lucy retire to the isolated Storm Island off the coast of Scotland. Meanwhile British Intelligence has executed or recruited all German spies. Faber is the only successful one still at large. A history professor, Godliman, and a widowed ex-policeman, Bloggs, are employed by MI5 to catch him. They start with the interrupted broadcast and his codename Die Nadel. They connect the landlady’s murder to Faber by him having used his ‘needle’ during the transmission. They then interview Faber’s fellow tenants from 1940. One identifies Faber from a photo of him as a young army officer. Faber is told by Berlin to investigate whether the FUSAG is real or not. Faber discovers the army is a fake. He takes photos of an army base constructed only to look real from the air. Faber realizes that Normandy is where D-Day is going to occur. Several soldiers try to arrest Faber, but he kills them with his stiletto. He then heads to Aberdeen, Scotland, where a U-boat will take him and his photos back to Germany. Godliman and Bloggs realize what Faber is trying to achieve. There follows a long chase across Northern England and Scotland with both Hitler and Churchill getting personally involved. Faber escapes many times but his repeated killings allow MI5 to track him to Aberdeen. Exhausted Faber finally sets out on a small trawler to meet the U-Boat. Caught by a fierce storm, he is shipwrecked on Storm Island. He collapses in front of the lonely house where David and Lucy live. He is tended to by Lucy. Stuck in a loveless marriage to the crippled David she begins a physical relationship with Faber. David soon discovers both Lucy's infidelity and Faber’s FUSAG photos. David then tries to kill Faber. After a struggle Faber kills David by rolling him and his Jeep off a cliff. Faber tells Lucy it was another accident. However, she discovers her husband's body and realizes the truth. Faber realizes he may be caught so he decides to radio the information about FUSAG directly to Germany. Lucy stops him by short-circuiting the electricity in the cottage. Unable to send a radio message, Faber attempts to descend the cliff and swim to the waiting U-boat. Lucy throws a rock at him, striking him and causing him to lose his balance and fall to his death. The RAF then appears and drives the U-boat away. A fictitious radio message is sent over Faber's call code, persuading the Germans that the invasion is targeting Calais. Bloggs comforts the widowed Lucy, eventually marrying her.",0
761443,Raptor Red,Robert T. Bakker,1995,"{""/m/06n90"": ""Science Fiction"", ""/m/05hgj"": ""Novel""}","In the book's opening, the title character and her mate ambush a herd of Astrodon, which are large herbivorous sauropods. The Astrodon are surprised, thinking that their bulk deters smaller predators. Utahraptor, however, are much larger than any resident raptor, and proceed to take down an Astrodon with teamwork. When Red's mate climbs onto the dead Astrodon, the corpse rolls in the mud, trapping the male under the bulk of the animal. Despite Red's best efforts, her mate suffocates. Despondent, Red wanders around the floodplain, nearly starving since a Utahraptor cannot successfully hunt big game on its own. Red follows a familiar scent and is reunited with her sister, a single mother with three chicks. The two hunt together and bring food back to the nest for the young. A white pterosaur, one Red has seen since she hatched, helps the two by finding carrion and prey in exchange for a helping of meat. On one hunting expedition, when the two adult Utahraptor are stalking a herd of Iguanodon, Red spies a young male Utahraptor that is watching their prey. He begins a courtship dance for Red, but Red's sister chases him off, hissing. Her growls agitate the Iguanodon, who stampede; the male hastily leaves. After climbing into a tree to escape a flash flood, Red encounters the male raptor again, who performs a courtship dance while hanging onto the tree branches. Red's sister begrudgingly allows the male to stay with them, provided he steers clear of her chicks. For a while, Red and her pack are happy, feeding off the plentiful carrion left by receding flood waters, but the pack's way of life is upset by an invasion of large Acrocanthosaurus, huge meat-eating dinosaurs. The added competition for food puts strain on the pack, as does the unexpected death of one of the chicks. A fight erupts between the male raptor and Red's sister. Red, torn between a prospective mate and her kin, tries to defuse the situation. Two Acrocanthosaurus watch the commotion and take the opportunity to attack the Utahraptor. Meanwhile, a Kronosaurus ambushes one of the chicks on the beach. Seeing the danger, Red lures the female Acrocanthosaurus into deep water where the larger predator is dragged under by the Kronosaurus. Red saves her family, but at a price—her consort is forced away by Red's sister. Facing continual threats from the Acrocanthosaurus, Red, her sister and the chicks are forced up into the mountains. They encounter ice and snow for the first time, and kill a segnosaur in a cave, turning the den into their nest. The older chick accompanies the two adults on hunting expeditions. One day the raptors encounter a strange creature they have never seen—a whip-tailed diplodocid who inflicts wounds on Red and her sister; the older chick is forced to set off alone and find the pack's food. This calamity coincides with the arrival of a large pack of smaller raptors known as Deinonychus. Sensing the weakness of the Utahraptor pack, they surround the nest and wait for the wounded raptors to become weak enough to attack. Red's sister dies, and Red is crippled and defenseless against the smaller dinosaurs. The Deinonychus close in and wait for Red to die, but are driven back by a sudden attack—the older Utahraptor chick returns with Red's consort to defend the nest, driving back the Deinonychus. Some time later, the old white pterosaur circles over Red's mountain stronghold, and finds the pack has grown considerably. Both Red and the older chick have found mates and have chicks, who are having fun rolling down a hill. The satisfied pterosaur leaves with a mate and offspring of his own.",0
