id,title,author,published_date,categories,summary,page_count
8586918,The Experiment,K. A. Applegate,1999-03,"{""/m/06n90"": ""Science Fiction"", ""/m/014dfn"": ""Speculative fiction"", ""/m/05hgj"": ""Novel""}","The Animorphs find out from Erek that the Yeerks have taken control of a meatpacking plant and a laboratory. They acquire chimpanzees and infiltrate the lab. They don't find very much information so Tobias and Ax morph into bulls (thinking they would morph into steer but not realizing that the DNA does not include surgical procedures) to go to the meatpacking plant. Inside the plant, they discover a room with humans in cages. The computer tells them that it is an experiment designed to destroy the free will of the human population so that the Yeerks can take over easily, but a Yeerk scientist eventually confirms that the experiment was a total failure.",0
8586970,The Sickness,K. A. Applegate,1999-06,"{""/m/06n90"": ""Science Fiction"", ""/m/014dfn"": ""Speculative fiction"", ""/m/05hgj"": ""Novel""}","Cassie and Jake are dragged along by Rachel and the others to the school dance. They have a few good laughs when Ax's unfamiliarity with human culture scares away some of the crowd. The laughter stops, however, when he demorphs involuntarily. It soon becomes apparent that Ax is suffering from an inflamed Tria gland (as well as a fever) - much like the lymphatic tonsils in the human mouth. Unlike humans, though, this gland is located at the back of Ax's brain. If it bursts, it will cause irreversible and fatal damage to the brain. Cassie hides the sick alien in her barn, and Erek the Chee erects a hologram around them both. At the same time, Mr. Tidwell, one of Cassie's teachers, informs her that Aftran has been captured by Visser Three. She will be tortured, and will thus be forced to divulge all of her secrets; including that of Cassie and the Animorphs. Cassie endures her friends' thinly-veiled blame, but they decide to act. They form a plan to enter the Yeerk pool via the facility's extensive piping system. Tobias brings them eels to morph. The children morph and enter the pipes, but Jake falls ill from Ax's virus (Although it is established that this virus will just make humans sick rather than having the fatal effects that the Andalite version has on Ax). The plan fails, and they return to the surface - through a fire hose and into a burning building! That night, Cassie has a bad dream. In the morning, she discovers that Rachel is ill. Mr. Tidwell reveals he shares control of his body with Illim, a Yeerk, and that he is a member of the Yeerk Peace Movement. He tells her the time and location of Aftran's interrogation. Marco is the next to fall ill. Then, while Cassie is with him, Tobias, too, falls ill to it, flying into one of the barn rafters. To keep Tobias safe, she locks him up next to a golden eagle, much to his dismay. Cassie is all alone, and she needs to infiltrate the Yeerk pool, so Illim allows her to acquire his Yeerk DNA and take control of Mr. Tidwell. Cassie and Mr. Tidwell enter the enemy stronghold, and she is disgorged into the Yeerk pool. She finds Aftran's cage, and manages to take control of a voluntary host. She rams the Visser, who drops Aftran. Cassie leaves the little girl, dives back into the pool, morphs her osprey, and carries Aftran away, pursued by Visser Three, who has morphed an eyeball with tentacles. Back at the barn, Cassie learns that Ax is in crisis. She allows Aftran to enter Ax's head and tell her the location of the Tria gland. Cassie makes her incision, and pulls the gland out, saving Ax's life. A few days later, the other Animorphs have recovered from the illness. Aftran is safe, but in order to keep her alive without access to the Kandrona, the Animorphs allow her to morph a humpback whale - on the condition that she stays in that form as a nothlit.",0
8587028,The Reunion,K. A. Applegate,1999-06,"{""/m/06n90"": ""Science Fiction"", ""/m/014dfn"": ""Speculative fiction"", ""/m/03mfnf"": ""Young adult literature"", ""/m/05hgj"": ""Novel""}","Enjoying a day to skip school, Marco unexpectedly runs into his mother (Visser One), and discovers she is hiding in an office building, planning to find the Hork-Bajir colony. Marco, Tobias and Ax confirm this on a late-night visit, in which they negotiate a deal with Visser One. Marco begins to formulate a plan that will destroy Vissers One and Three, and free his mother, and make the Yeerks believe they have destroyed the Hork-Bajir colony. The plan goes well for the most part, but a few miscalculations reveal to Visser One that at least one of the guerilla fighters is human and there is a misconception that Jake and Cassie have died. When the Animorphs spring the battle between the two Vissers, Visser Three is forced to retreat and Visser One is believed to have perished (over a cliff, butted by Marco in mountain goat morph), though not before realizing that Marco is one of the warriors. *Visser One reveals that she is wanted by Visser Three and the Council of Thirteen for treason (according to Visser Three), and the council has issued a gashad, or warrant, to kill her on sight. This plot element later comes up in Visser. *Visser One realizes that Marco is a member of the 'Andalite bandits', before being knocked off a cliff.",0
8587788,The Conspiracy,K. A. Applegate,1999-07,"{""/m/06n90"": ""Science Fiction"", ""/m/014dfn"": ""Speculative fiction"", ""/m/05hgj"": ""Novel""}","Jake returns from school to discover that his great grandfather has died. His father insists that the family go to his home in a wooded cabin far away and help plan the funeral arrangements. They plan to be gone for three or four days; however, this presents a problem for Tom, who can not stay away from the Yeerk Pool for more than three days at time. Tom fights relentlessly with Jake's father about going and when they leave for a Sharing meeting together Jake fears that Tom may force their dad into involuntary Yeerk infestation, or even kill him. Jake must save his father, but for the first time, his quick thinking tactical mind freezes up. A slight power struggle ensues between Jake and Marco who insists that Jake isn't thinking clearly on this matter. After several close calls protecting Jake's father, the Animorphs decide to make a distraction for the Yeerks so that Tom is no longer their top priority. The Animorphs kidnap Chapman holding him hostage in an abandoned house to distract the Yeerks from taking care of Jake's father. To make the kidnap seem convincing they have Ax interrogate Chapman for hours. Afterward, they allow him to escape, and Ax insists that he will never do such a thing again as it is not the conduct of a warrior. After this Jake insists on handling the situation by himself. With the distraction successful, Tom heads up to the cabin with the rest of the family. In the middle of the night, he tries to kill his father with a dagger, but is stopped by Jake with the help of rest of the Animorphs, who are running a plan devised by Marco. Tom is injured and taken back to the hospital in the city where he has access to a Yeerk pool.",0
8589403,Ruslan and Lyudmila,Aleksandr Pushkin,1820,UNK,"Pushkin dedicates the poem to unnamed young beauties, the “queens of my soul” (души моей царицы), and states that his reward is the hope that some lovesick girl will read the poem in secret. In a brief prologue, the narrator of the story describes a green oak by the sea, and makes reference to several other elements common in Russian folktales, such as a hut on hen’s legs (избушка на курьих ножках), Baba Yaga (Баба-Яга), and King Koschei (царь Кащей). Bound to the tree by a golden chain is a story-telling cat. The narrator remembers one of the cat’s stories in particular, namely the one that follows. This prologue was not part of the original 1820 edition; it first appeared in the 1828 edition. The story opens with a feast given by Prince Vladimir (Владимир) to celebrate the marriage of his daughter, Ludmila, to the bold warrior Ruslan. Among the guests are Ruslan’s jealous rivals, the bold warrior Rogday (Рогдай), the boastful Farlaf (Фарлаф), and the young khazar Khan Ratmir (Ратмир). On their wedding night, as Ruslan prepares to consummate the marriage, a strange presence fills the bedroom, accompanied by thunder and lightning. Ruslan finds that his bride has mysteriously vanished. On hearing of Ludmila's disappearance, the angered Vladimir annuls the marriage and promises his daughter’s hand to whoever is able to return her safely. Ruslan and his three rivals set off on horseback. Ruslan encounters an old man in a cavern who tells him that Ludmila had been abducted by the sorcerer Chernomor (Черномор), and that Ruslan would find her unharmed. The old man himself is a Finn who tells the story of how he had fallen in love with a beautiful young maiden, Naina (Наина), who spurned his attention. In order to win her love he tried to become a glorious warrior, but when she rejected him, spent years learning the magical arts instead. He finally cast a spell to win Naina’s love, only to find that she herself was actually an old crone, who now was bent on revenge. (This and each of the remaining songs begin with an “editorial comment” by the author. These comments often evoke classical mythology and sometimes contain contemporary references.) Rogday decides to abandon the quest for Ludmila and to find and kill Ruslan instead. Seeing a rider, he attacks, only to find it is Farlaf and not Ruslan, and leaves him shaken but alive. An old woman appears and points Rogday to the direction in which to find Ruslan. She then advises Farlaf to return to Kiev (Киев) to await his trophy. Ruslan is challenged by another rider and the story turns briefly to Ludmila’s fate. She finds herself in a lavish chamber where three maidens are ready to fulfill her every desire. Opening the chamber door, she discovers a marvelous garden to rival Solomon’s. However, she feels empty without Ruslan. She is startled by a hunchbacked dwarf approaching her, carried by ten manservants. She lashes out and he tumbles to the ground, tripping over his long beard. It is the wizard Chernomor, who leaves his hat as he flees. Back to Ruslan, who defeats the challenger and leaves him to drown in the Dnieper (Днепр). It is, of course, Rogday. Chernomor is visited by a flying dragon who turns out to be Naina, pledging her alliance in defeating the Finn. Encouraged, he decides to go to Ludmila and make advances toward her, but she is nowhere to be found. She had tried on the wizard’s hat and found that she could vanish and reappear at will by varying its position on her head. As Ruslan rides on, he finds himself in the midst of a deserted battlefield, strewn with bones, dead horses, and war relics. He momentarily mourns his own fate, then realizes it is an opportunity to arm himself. He leaves with a lance, helmet, coat of armor, and a battle horn. He could not, however, find a suitable sword. Continuing, he finds his path blocked by a huge hill emitting strange sounds. Closer inspection reveals it to be a giant slumbering human head. Ruslan awakens the head, which becomes angered and begins to taunt him. It sticks out its tongue. Ruslan seizes the opportunity and thrusts his lance into the tongue, then into its cheek. As the startled head leaps away, Ruslan finds a bright sword where it had been. As Ruslan prepares to attack with the sword, the head pleads for mercy. The head tells his story: He was once a mighty warrior, the brother of Chernomor, who envied him. Chernomor’s magic power lay in his beard, and he told his brother that they must secure the sword, which had the power to kill the both of them – Chernomor, by cutting his beard, the brother, by severing his head. They set off in quest of the sword, but then disputed to whom it should belong once they found it. Chernomor proposed that they both put their heads to the ground and the sword would go to the one who first heard a sound. Instead, he used the sword to sever his brother’s head, which magically remained alive. The head tells Ruslan that he bears no grudge and will be grateful if Ruslan uses the sword to defeat Chernomor. Ratmir is interrupted in his journey by a young maiden who beckons him into a castle, where he finds himself enveloped in luxury. He soon forgets Ludmila. Ludmila eludes Chernomor’s henchmen by remaining invisible, but then is tricked by the wizard into revealing herself when he takes the form of Ruslan and calls to her in his voice. He is thwarted by the sound of a horn and hurries off, leaving his hat behind. Chernomor confronts Ruslan, who has arrived at the wizard’s lair. They trade blows, and Chernomor flies off, with Ruslan holding on to his beard. For two days they fly, with Ruslan snipping away at the beard, until the bedraggled wizard pleads for mercy and agrees to take Ruslan to Ludmila. Ruslan searches the palace and wanders into the garden, all the time calling for Ludmila, who remains hidden. Finally, a chance thrust of his flailing sword knocks the hat from her head. However, his lover is in a trance and does not hear him calling. He hears the Finn’s voice from a distance telling him to return Ludmila to Kiev where she will awaken. Ruslan sets off, carrying his bride and Chernomor. He encounters the head, who, contented that he has been avenged, dies in peace. Ruslan comes to rest at a stream and is met by a fisherman, who turns out to be the Khan Ratmir. He explains that he has met his true love and no longer yearns for Ludmila. The two part as friends. Naina appears to Farlaf and tells him that his hour has arrived. He saddles up and rides off, finding Ruslan encamped and thrusting his sword into him as he sleeps. As Farlaf rides off with his prey, Ruslan lies unconscious and finally succumbs to his injuries. Chernomor awakens and is joyful to see Ruslan lying dead. Farlaf returns Ludmila to Vladimir, whose initial happiness soon turns to mourning as he finds that she cannot be awakened from her deep slumber. Farlaf hangs his head in remorse. To make matters even worse, the city of Kiev is under siege. The Finn finds Ruslan and resurrects him with magical waters. He gives Ruslan a ring which will break Ludmila’s spell, but tells him that he must first save the city from its attackers. Ruslan returns to Kiev, Chernomor still in tow, and leads the city’s warriors to victory. Ruslan touches Ludmila’s face with the ring and she awakens. Vladimir gives the couple his blessing. Ruslan forgives both Farlaf and Chernomor. Another editorial comment by the author, who bemoans better days gone by.",0
8593597,Eulalia,Brian Jacques,2007-10-04,"{""/m/014dfn"": ""Speculative fiction"", ""/m/01hmnh"": ""Fantasy""}","In the far, cold Northern Isles, the fox captain, Vizka Longtooth, sights a lonely farmhouse. Wanting plunder, he orders the crew of his ship, the Bludgullet to set ashore. The inhabitants of the farmhouse: the badger Gorath and his grandparents, were from the far south, escaping vermin and war. They had dreamed of going to the legendary havens Redwall Abbey and Salamandastron for peace. However, ill winds destroyed this dream, stranding them on the Northern Isles. Meanwhile, at Salamandastron, the Badger Lord Asheye has a prophecy that an unknown badger(which turns out to be Gorath) will succeed him in autumn. He sends a local troublemaker, Maudie (the Hon.) Mugsberry Thropple to search for the badger. Leading a series of events, Maudie finds herself trapped by sand lizards. At Redwall Abbey, a young hedgehog called Orkwil Prink is expelled from the abbey due to thieving. After a mean watervole tricks him, his luck quickly plummets when he finds himself without supplies and trapped in a swamp. Vizka, his brother Codj and the Sea Raiders have captured Gorath. Codj locked Gorath's grandparents inside the farmhouse and burned it. Gorath swears to kill Codj, and the crew soon realize he's a dangerous beast when he kills a taunting weasel.The ambitious Vizka decides to recruit Gorath into his crew. Maudie, meanwhile, has been rescued from the sand lizards by an owl named Asio Bardwing, who believed Maudie was a magic beast. He agrees to lead her to the Guosim shrews who'll take her to Redwall, where Lord Asheye ordered her to go. They find the Guosim in the midst of celebration. However, soon a baby shrew is kidnapped by an adder. Maudie, Asio and Log-a-Log Luglug find the adder. However, Asio is killed when rescuing the shrew. Vizka soon realizes that Gorath would rather die than join his crew, so he simply starves him. However, before Gorath dies, Codj captures Orkwil, who befriends Gorath. Being a thief, Orkwil soon frees himself and Gorath. During the escape, Gorath kills Codj. Maudie and the Guosim are being tagged by another vermin band: the Brownrats headed by the fat Gruntan Kurdly, who wanted the shrews' logboats. After meeting up with Barbowla the otter, his holt and Rangval the Rogue, a Guosim baby named Yik goes missing. Maudie and Luglug find Yik captured by the Brownrats. They rescue him, but Luglug is killed in the process. Gorath and Orkwil have made it to Redwall and had warned Abbot Daucus and Skipper Rorc of the Sea Vermin. They are then joined by Rangval, the Boulderdogs and the Guosim. Maudie appears later, bringing Yik and the sad news that Luglug was killed. His son Osbil becomes the new Log-a-Log and swears revenge on the Brownrats. Vizka had captured the mean vole and ordered him to disguise himself to gain entrance to Redwall, which he wants to conquer. This scheme fails, and the vole is captured by the Redwallers. He then decides to tunnel his way in. However, his crew encounters the scouts of the Brownrats, who chase them to the north. Gorath has seen Vizka besieging the Abbey and gets restless. He escapes during the middle of a feast and Orkwil, Rangval and Maudie attempt to find him. However, just as they were setting out, the vole kills Sister Atrata, the Healer, and steals the Sword of Martin. The Bronrats capture a Sea Vermin named Magger. When they were thinking of taking him to Kurdly, Gorath sweeps in, killing hordes of Brownrats. In the confusion, Magger escapes. He soon encounters the vole and kills him, stealing the sword and returns to Vizka. Vizka, however, kills him because he wanted the sword. Beforehand, Orkwil, Maudie and Rangval were captured by Vizka. After Vizka leaves 3 vermin to guard them, they easily overpower them and escape, knowing that Vizka has Martin's sword. Gorath, after the attack of Bloodwrath, faints, When he comes round, he finds company with two badgers, Salixa and her mentor: the Tabura. They return to Redwall, where Gorath and Salixa leave the Tabura. They soon are surrounded on top of a plateau with the Guosim, Barbowla and no rations. Maudie, Rangval and Orkwil, disguised as vermin, have a harrowing encounter with the two stoats Bilger and Jungo. They are able to worm out of trouble but Orkwil disappears. Maudie and Rangval join Gorath's army on the plateau. Gruntan Kurdly, meanwhile, has met his demise when he tried to rob a swan's egg. Osbil then kills Stringle, his father's murderer and the Brownrats' only other officer. Vizka takes control of the Brownrats and orders them to besiege the plateau. Just as Gorath's army were about to be annhilalated, Orkwil reappears leading a horde of Redwallers. They kill the Brownrats and the Sea Raiders, but Vizka and five vermin escape. Gorath pursues Vizka through Mossflower Wood. Vizka's vermin desert him because he killed two of them. Furious, Vizka returns to the Bludgullet. However, Gorath is already there and kills Vizka in an amazing fight with his friends watching. The Bludgullet is renamed the Eulalia and Gorath, Salixa, Orkwil, Maudie, Rangval and the Guosim sail down the River Moss to Salamandastron, where Lord Asheye gives the title of Badger Lord to Gorath. In the celebrations that follow, Lord Asheye realizes that it is near autumn and that he must depart Salamandastron. To cheer Asheye up, Salixa sings a song that the Tabura composed. Asheye suddenly recognizes the song, and realizes the Tabura is his long-lost brother Melutar. Asheye and his friend Major Mullein sail to Redwall.",0
