id,title,author,published_date,categories,summary,page_count
1446062,Shatterglass,Tamora Pierce,2003-03,"{""/m/0dwly"": ""Children's literature"", ""/m/01hmnh"": ""Fantasy"", ""/m/014dfn"": ""Speculative fiction"", ""/m/02xlf"": ""Fiction""}","Trisana (Tris) Chandler meets Kethlun (Keth) Warder, a glass mage with a dangerous power: lightning. During their first meeting, he was unconsciously using his ambient powers and accidentally created a living dragon out of glass. Tris saves the dragon from being smashed by Keth, and names it Chime. She later finds out that he had been struck by lightning less than a year ago, and this left him paralyzed and with a great fear of lightning. He learned to walk again, but his speech is a little slow, and he lost his ease at glass-blowing. A twenty-year-old man just as stubborn as Tris, Keth won't accept Tris or any of her teachings. He argues with her constantly, and refuses to learn about his lightning abilities, fearing a relapse into paralysis. Tris is surprisingly patient with him as she guides him through meditation and control over his powers. Eventually, Keth learns to trust Tris' instincts, and grudgingly accepts her as his teacher. Meanwhile, mysterious murders are taking place. All the murdered women are Yaskedasi, female entertainers who are looked down upon in the town for their immodesty. But when one of the murdered Yaskedasi turns up in the town's central fountain, everyone starts to take notice. The town has a culture of thanatophobia, an irrational fear of death. Each time a person dies, the place must be cleansed by the town's priests when they perform the traditional cleansing ceremony. This ceremony is not only religious, but magical as well, effectively erasing all traces of the murderer, making it impossible for the authorities to track the killer, nicknamed the 'Ghost' by locals. Keth has been asked to attempt to find the Ghost by way of glass balls that only he can make. These balls hold scenes of past crimes in them, causing him to be a suspect at first. Keth and Tris struggle, first against the local authorities, then against each other in the creation of these globes. When Keth's friend Yali is killed by the Ghost, the race takes on new meaning.",0
1446696,Nausea,Jean-Paul Sartre,UNK,"{""/m/0xdf"": ""Autobiography"", ""/m/017fp"": ""Biography"", ""/m/02xlf"": ""Fiction"", ""/m/037mh8"": ""Philosophy""}","Written in the form of journal entries, it follows 30-year-old Antoine Roquentin who, returned from years of travel, settles in the fictional French seaport town of Bouville to finish his research on the life of an 18th-century political figure. But during the winter of 1932 a ""sweetish sickness,"" as he calls nausea, increasingly impinges on almost everything he does or enjoys: his research project, the company of an autodidact who is reading all the books in the local library alphabetically, a physical relationship with a café owner named Françoise, his memories of Anny, an English girl he once loved, even his own hands and the beauty of nature. Over time, his disgust towards existence forces him into self-hatred and near-insanity. He embodies Sartre's theories of existential angst, and he searches anxiously for meaning in all the things that had filled and fulfilled his life up to that point. But finally Antoine comes to a revelation into the nature of his being when he faces the troublesomely provisional and limited nature of existence itself. In his resolution at the end of the book he accepts the indifference of the physical world to man's aspirations. He is able to see that realization not only as a regret but also as an opportunity. People are free to make their own meaning: a freedom that is also a responsibility, because without that commitment there will be no meaning.",0
1447103,"Abarat: Days of Magic, Nights of War",Clive Barker,2004,"{""/m/01hmnh"": ""Fantasy"", ""/m/014dfn"": ""Speculative fiction"", ""/m/03mfnf"": ""Young adult literature""}","The entire book is spread out over eight weeks of time, compared to the two or three in Book 1, titled simply Abarat. The book picks up several weeks after the original had left off; weeks wherein Candy Quackenbush and Malingo the Geshrat (a character introduced in the first book) have traveled from Hour to Hour to evade the bounty hunter Otto Houlihan. Christopher Carrion's whereabouts are revealed only in the second quarter of the book, wherein he plots with the Sacbrood in the Pyramids of Xuxux. Sacbrood are terrifying insects of all shapes and sizes which Christopher Carrion has been breeding in order to help him create Absolute Midnight. Under the cover produced by the Sacbrood, he expects, the destroyers called the Requiax will emerge from under the Sea of Izabella (which surrounds the Abarat) and annihilate everything they see, giving Carrion the opportunity to re-organize the world according to his will. Candy begins to develop powers of great magic, with which she frees the mysterious beings called Totemix from their imprisonment in the Twilight Palace on the island of Scoriae. Malingo, separated from her on the carnival island of Babilonium, joins with others of Candy's acquaintance to form a force of resistance against the armies of Midnight. Candy is eventually captured by Letheo, the lizard-boy servant of Christopher Carrion, and taken to the island Efreet. The enchantress Diamanda, having died of an encounter with a monster, travels as a ghost to the human world, where she finds her also ghostly husband Henry and with him works to prepare Candy's home town for the flood resulting from its imminent meeting with the Abarat. When this meeting occurs, Henry's opening of the factory farm which is the town's only industrial outlet is used as a comment on the variety-deprived lives of chickens raised in such factories. This book introduces readers to new characters including Finnegan Hob, the would-be husband of Princess Boa, who is discovered by other characters in search of himself. Having persuaded him to give up his vendetta against the Abaratian dragons, whom he blames for his fianceé's death, the seekers travel to Efreet, where Candy is held prisoner by Christopher Carrion. They rescue Candy and at her request return her to the human world, where she intends to hide from the Abarat's perils. The two worlds meet in a dramatic climax, wherein it is revealed by the magician Kaspar Wolfswinkel that Princess Boa's soul is contained within Candy's body, having been placed there by the Fantomaya in obedience to the belief that Princess Boa, or her reincarnation, could halt the Abarat's progressive degradation and revitalize the Abarat as a whole. Christopher Carrion clashes with his grandmother Mater Motley, having learned that she had concealed Candy's dual nature from him, and is severely wounded in the process (whether he dies or not is unclear). Candy and most of the major characters return to the Abarat when it is withdrawn from the human world. There, Mater Motley assumes control of Gorgossium Island, where she executes all of Christopher Carrion's living supporters. Kaspar Wolfswinkel's five hats, the source of his power, are left in the human world.",0
1448336,Brigitta,UNK,UNK,UNK,"The first person narrator, a German-speaking man, is sent a letter by a man called the Major who asks the narrator to visit him for a while in Hungary. He invites him to perhaps stay for months or years. The narrator accepts this invitation and wanders for a while through Hungary in order to gain some insight into the land. The two men had gotten to know each other during a trip in Italy and were, for a time, inseparable. The narrator meets a woman dressed and riding her horse like a man, and he first mistakes her for the Major himself. The woman guides him to the home of the Major. After their reunion, the Major shows the narrator around his land and the narrator becomes familiar with his surroundings. The Major is beloved by the people working his land and has a greenhouse in which he grows and sells various grains. He also has vines and cornfields. In Hungary, the Major finally accomplished his goal of finding fulfilling work. The Major tells the narrator that he had considered becoming an artist, but that he lacks the large and simple heart needed to inspire humanity with deep and penetrating words. The Major therefore satisfies himself with practical work. The Major was inspired to do his work on the land by a woman named Brigitta Maroshely, who had begun turning the previously barren landscape in that part of Hungary into something fruitful. The narrator finally is introduced to this energetic and capable woman himself after hearing about her from the Major. The Major spoke of Brigitta with the highest praises. The narrator notices that the Major and Brigitta act almost as if they were in love. This is unremarkable at first, but becomes more and more noticeable as the story progresses. Brigitta’s life story is thrown into the overall story as its own chapter in order to provide background and to make this remarkable woman more understandable. Brigitta lived with her family in a castle, but she more or less lived in her own apartment, isolated from the rest of the family. The development of Brigitta’s strong character is a result of almost complete lack of physical beauty. Brigitta grew up with two lovely younger sisters. As children, Brigitta was ignored by guests, who would always just ask how her more attractive sisters were doing. Brigitta was never noticed by anyone and played by herself most of the time, rejecting pretty dolls and bringing bits of wood and stones into bed with her. Brigitta was, however, clever and learned to ride. The beauty of her sisters attracted much attention when the girls grew older. Brigitta, on the other hand, was just strong and silent. She made her own plain dresses and strange headpieces for herself. A young man, recently returned from travels to the town of his birth, called Stephan Murai, came to one of the family’s social parties. This man was rumored to be one of the finest men that people had ever seen. The parents of Brigitta hoped to attract him to one of the two pretty sisters. Surprisingly, the handsome young man was fascinated by Brigitta and her ways. Murai fell in love with her. It takes Brigitta a long time to be convinced of Murai’s love and tells him it will only lead him to his downfall. She is eventually convinced and loves him immeasurably. They marry with the approval of both sets of parents and bear a son. During his work of the land, Murai meets the beautiful young daughter of a man from the area. They flirt, race horses and joke together and Murai feels drawn to her beauty and light manner. She is quite the opposite of Brigitta. One day Murai lets his feelings out and heartily embraces the young woman. The relationship between the girl and Murai ends after the embrace, but Brigitta had some idea of Murai’s fascination for the girl and confronts him. He clasps both of Brigitta’s hands and tells her that he hates her. Murai leaves and Brigitta must raise her son alone. Brigitta migrates to the region in which the story takes place and starts working the land with her son. Once as Brigitta lay sick with fever in bed, the Major came and cared for her during her illness. He stayed day and night by her bedside. Since that time, the Major and Brigitta experienced a true friendship. Often discussed are the Major’s watchdogs that are supposed to protect his houses from wolves. After a hard winter, the wolves begin to go after people. During a ride one night, the narrator and the major come across a pack of wolves attacking Gustav, Brigitta’s son. Gustav is bitten in the leg and loses much blood. The Major brings Gustav back to his lodgings and calls for a doctor and for Brigitta. The doctor says that Gustav will be fine, but in a fever for several days. Brigitta stays by her son’s bedside in the Major’s house. The Major, observing the love of Brigitta for her son, begins to cry. The Major tells the narrator that he had always wished to have a son himself. Brigitta overhears, looks at the Major, and they suddenly embrace passionately. The narrator learns that the Major is actually Stephan Murai. After running away from Brigitta, he could not forget about her and could never really think about another woman. He went the Hungary, where Brigitta was living and finds her feverish. She recognizes him as the father of her son when her illness is cured, and they promise to remain just friends. Tense feeling of more than friendship lurked under the surface for many years. When Brigitta’s son is ill, the Major’s heartfelt emotion breaks the treaty of friendship between Brigitta and the Major. Brigitta says that he has finally become a good person and they embrace, verifying the complete fulfillment of their love. All the while, the narrator stands somewhat awkwardly thereby (like he has for much of the story). He stays with the newly reunited family for the entire winter in Hungary and becomes almost like a member of the family himself. At the end, the narrator returns to his fatherland. de:Brigitta (Stifter)",0
1449439,Kidnapped,Robert Louis Stevenson,UNK,"{""/m/0dwly"": ""Children's literature"", ""/m/02xlf"": ""Fiction"", ""/m/08sdrw"": ""Adventure novel"", ""/m/0hwxm"": ""Historical novel""}","The full title of the book gives away major parts of the plot and creates the false impression that the novel is autobiographical. It is Kidnapped: Being Memoirs of the Adventures of David Balfour in the Year 1751: How he was Kidnapped and Cast away; his Sufferings in a Desert Isle; his Journey in the Wild Highlands; his acquaintance with Alan Breck Stewart and other notorious Highland Jacobites; with all that he Suffered at the hands of his Uncle, Ebenezer Balfour of Shaws, falsely so-called: Written by Himself and now set forth by Robert Louis Stevenson. The central character and narrator is a young man named David Balfour (Balfour being Stevenson's mother's maiden name), young and naive but resourceful, whose parents have recently died and who is out to make his way in the world. He is given a letter by the minister of Essendean, Mr. Campbell, to be delivered to the House of Shaws in Cramond, where David's uncle, Ebenezer Balfour, lives. On his journey, David asks many people where the House of Shaws is, and all of them speak of it darkly as a place of fear and evil. David arrives at the ominous House of Shaws and is confronted by his paranoid Uncle Ebenezer, armed with a blunderbuss. His uncle is also niggardly, living on ""parritch"" and small ale, and indeed the House of Shaws itself is partially unfinished and somewhat ruinous. David is allowed to stay, and soon discovers evidence that his father may have been older than his uncle, thus making himself the rightful heir to the estate. Ebenezer asks David to get a chest from the top of a tower in the house, but refuses to provide a lamp or candle. David is forced to scale the stairs in the dark, and realizes that not only is the tower unfinished in some places, but that the steps simply end abruptly and fall into the abyss. David concludes that his uncle intended for him to have an ""accident"" so as not to have to give over his inheritance. David confronts his uncle, who promises to tell David the whole story of his father the next morning. A ship's cabin boy, Ransome, arrives the next day, and tells Ebenezer that Captain Hoseason of the brig Covenant needs to meet him to discuss business. Ebenezer takes David to Queensferry, where Hoseason awaits, and David makes the mistake of leaving his uncle alone with the captain while he visits the shore with Ransome. Hoseason later offers to take them on board the brig briefly, and David complies, only to see his uncle returning to shore alone in a skiff. He is then immediately struck senseless. David awakens bound hand and foot in the hold of the ship. He becomes weak and sick, and one of the Covenant's officers, Mr. Riach, convinces Hoseason to move David up to the forecastle. Mr. Shuan, a mate on the ship, finally takes his routine abuse of Ransome too far and murders the unfortunate youth. David is repulsed at the crew's behaviour, and learns that the Captain plans to sell him into servitude in the Carolinas. David replaces the slain cabin boy, and the ship encounters contrary winds which drive her back toward Scotland. Fog-bound near the Hebrides, they strike a small boat. All of its crew are killed except one man, Alan Breck {Stewart}, who is brought on board and offers Hoseason a large sum of money to drop him off on the mainland. David later overhears the crew plotting to kill Breck and take all his money. The two barricade themselves in the round house, where Alan kills the murderous Shuan and David wounds Hoseason. Five of the crew are killed outright, and the rest refuse to continue fighting. Alan is a Jacobite who supports the claim of the House of Stuart to the throne of Scotland. He is initially suspicious of the pro-Whig David, who is also loyal to King George. Still, the young man has given a good account of himself in the fighting and impresses the old soldier. Hoseason has no choice but to give Alan and David passage back to the mainland. David tells his tale of woe to Alan, and Alan explains that the country of Appin where he is from is under the tyrannical administration of Colin Roy of Glenure, a Campbell and Government agent. Alan vows that, should he find the ""Red Fox,"" he will kill him. The Covenant tries to negotiate a difficult channel without a proper chart or pilot, and is soon driven aground on the notorious Torran Rocks. David and Alan are separated in the confusion, with David being washed ashore on the isle of Erraid near Mull, while Alan and the surviving crew row to safety on that same island. David spends a few days alone in the wild before getting his bearings. David learns that his new friend has survived, and has two encounters with beggarly guides: one who attempts to stab him with a knife, and another who is blind but an excellent shot with a pistol. David soon reaches Torosay where he is ferried across the river and receives further instructions from Alan's friend Neil Roy McRob, and later meets a Catechist who takes the lad to the mainland. As he continues his journey, David encounters none other than the Red Fox (Colin Roy) himself, who is accompanied by a lawyer, servant, and sheriff's officer. When David stops the Campbell man to ask him for directions, a hidden sniper kills the hated King's agent. David is denounced as a conspirator and flees for his life, but by chance reunites with Alan. The youth believes Breck to be the assassin, but Alan denies responsibility. The pair flee from Redcoat search parties until they reach James (Stewart) of the Glens, whose family is burying their hidden store of weapons and burning papers that could incriminate them. James tells the travellers that he will have no choice but to ""paper"" them (distribute printed descriptions of the two with a reward listed), but provides them with weapons and food for their journey south, and David with a change of clothes (which the printed description will not match). Alan and David then begin their flight through the heather, hiding from Government soldiers by day. As the two continue their journey, David's health rapidly deteriorates, and by the time they are set upon by wild Highlanders who serve a chief in hiding, Cluny Macpherson, he is barely conscious. Alan convinces Cluny to give them shelter. The Highland Chieftain takes a dislike to David, but defers to the wily Breck's opinion of the lad. David is tended by Cluny's people and soon recovers, though in the meantime Alan loses all of their money playing cards with Cluny, only for Cluny to give it back. As David and Alan continue their flight, David becomes progressively more ill, and he nurses anger against Breck for several days over the loss of his money. The pair nearly come to blows, but eventually reach the house of Duncan Dhu, who is a brilliant piper. While staying there, Alan meets a foe of his, Robin Oig—son of Rob Roy MacGregor, who is a murderer and renegade. Alan and Robin nearly fight a duel, but Duncan persuades them to leave the contest to bagpipes. Both play brilliantly, but Alan admits Robin is the better piper, so the quarrel is resolved. Alan and David prepare to leave the Highlands and return to David's country. In one of the most humorous passages in the book, Alan convinces an innkeeper's daughter from Limekilns that David is a dying young Jacobite nobleman, in spite of David's objections, and she ferries them across the Firth of Forth. There they meet a lawyer of David's uncle, Mr. Rankeillor, who agrees to help David receive his inheritance. Rankeillor explains that David's father and uncle had once quarrelled over a woman, David's mother, and the older Balfour had married her, informally giving the estate to his brother while living as an impoverished school teacher with his wife. This agreement had lapsed with his death. David and the lawyer hide in bushes outside Ebenezer's house while Breck speaks to him, claiming to be a man who found David nearly dead after the wreck of the Covenant and is representing folk holding him captive in the Hebrides. He asks David's uncle whether to kill him or keep him. The uncle flatly denies Alan's statement that David had been kidnapped, but eventually admits that he paid Hoseason ""twenty pound"" to take David to ""Caroliny"". David and Rankeillor then emerge from their hiding places and speak with Ebenezer in the kitchen, eventually agreeing that David will be provided two-thirds of the estate's income for as long as his wicked uncle survived. The novel ends with David and Alan parting ways, Alan going to France, and David going to a bank to settle his money. At one point in the book, a reference is made to David's eventually studying at the University of Leyden, a fairly common practice for young Scottish gentry seeking a law career in the eighteenth century.",0
1449448,True at First Light,Ernest Hemingway,1999,"{""/m/02xlf"": ""Fiction""}","The book is set in mid-20th century Kenya Colony during the Mau-Mau rebellion. In his introduction to True at First Light, Patrick Hemingway describes the Kikuyu and Kamba tribes at the time of the Mau-Mau rebellion. He explains that if the Kamba had joined the rebellion, Ernest and Mary Hemingway ""would have then stood a good chance of being hacked to death in their beds as they slept by the very servants they so trusted and thought they understood."" The book takes place in December while the narrator, Ernest, and his wife, Mary, are in a safari camp in the Kenyan highlands on the flank of Mt. Kilimanjaro, where they find themselves temporarily at risk when a group of Mau-Mau rebels escape from jail. The blend of travel memoir and fiction opens with the white hunter Philip Percival leaving the safari group to visit his farm, handing control of the camp to Ernest, who is worried about being attacked and robbed, because there are guns, alcohol, and food in the camp. Deputized as an assistant game warden, he makes daily rounds in the game reserve, and maintains communication with the local tribes. He is accompanied by two African game scouts, Chungo and Arap Meina and, for a period, the district game warden G.C (Gin Crazed). Other camp members include Keiti, who runs the camp, the safari cook, Mbebia, and two stewards, Nguili and Msembi. For six months Mary has been tracking a large black-maned lion, determined to finish the hunt by Christmas. In subsequent chapters, Ernest worries that Mary is unable to kill the lion for various reasons: she is too short to see the prey in the tall grass; she misses her shots with other game; and he thinks she is too soft-hearted to kill the animal. During this period, Ernest becomes entranced with Debba, a woman from a local village, whom the others jokingly refer to as his second wife. From her and the villagers he wants to learn tribal practices and customs. When Mary's lion is finally killed at the book's halfway mark, the local shamba (village) gathers for a ngoma (dance). Because she has dysentery, Mary leaves for Nairobi to see a doctor; while she is gone Ernest kills a leopard, after which the men have a protracted ngoma. When Mary returns from Nairobi, she asks Ernest for an airborne sightseeing tour of the Congo Basin as a Christmas present. Ernest describes his close relationships with the local men; indulges in memories of previous relationships with writers such as George Orwell, and D.H. Lawrence; and satirizes the role of organized religion. Subjects as diverse as the smell of the pine woods in Michigan, the nature of Parisian cafés , and the quality of Simenon's writing are treated with stream of consciousness digressions. The back of the book includes a section titled ""Cast of Characters"", a Swahili glossary, and the editor's acknowledgments.",0
