id,title,author,published_date,categories,summary,page_count
20843815,Pirate Freedom,Gene Wolfe,2007,"{""/m/014dfn"": ""Speculative fiction"", ""/m/01hmnh"": ""Fantasy""}","The hero is named Christopher (Chris, Crisóforo, Christophe). He recounts his childhood and career as a pirate, interspersed with digressions about events in his later life, including the time when he is writing the book (as in The Book of the Short Sun). The following summarizes his story in the order in which he experiences it. Chris is a Sicilian-American. When he is ten, Communism ends in Cuba, and his father (apparently a ""wiseguy"") moves there with him to run a casino. Chris goes to school at a monastery, where he becomes a novice and helps a Brother Ignacio with the farm work. At one point, he notices that many of the people he knew are gone, Mass is in Latin, and no one wears a watch. Somewhat later, he walks away from the monastery. A farmer in a horse-drawn wagon picks him up and takes him to Havana&mdash;but the roads are unpaved and Havana is much smaller than he remembers. Chris lives by theft until he signs on to a Spanish brig bound for Veracruz, Mexico. He is raped twice by shipmates, but thereafter manages to avoid them, and he enjoys learning military seamanship. In Veracruz he meets an English captain, Abraham Burt. Then Chris's ship sails to Spain, where he becomes infatuated with Estrellita, the maid of a wealthy young married woman. Her master puts a stop to the relationship. He returns to his ship, but on the way back to Mexico they are captured by English pirates under Captain Burt, who takes him on to the pirate ship. They capture a Spanish slave ship, and Burt puts Chris in charge of taking it to Port Royal. When he returns, having freed a few of the slaves, he refuses to join in piracy and Burt abandons him on Hispaniola. There a French buccaneer (a settler in the wilderness) helps him survive. They and other buccaneers capture a small Spanish warship sent against them, and Chris assumes command. A ""boy"" on the ship reveals herself as a woman who Chris knew in Spain; Chris takes her to be the maid Estrellita, but calls her ""Novia"", meaning ""sweetheart"". They become lovers. After fights against the Spanish, Chris and his crew meet with Burt. An allied ship has captured a Spanish galley and its owner. The passengers had included one Jaime Guzmán and his wife. Chris deduces Señora Guzmán's hiding place and finds that she is Estrellita; Novia is Guzmán's real wife and Estrellita's former mistress. Guzmán had beaten Novia because&mdash;she says&mdash;she too was in love with Chris. Though Chris is angry with Novia for lying to him, she still loves him and they reconcile. Chris rejoins Burt, and their fleet engages in successful and unsuccessful piracy, sailing around South America. At Río Hato, Panama, they rob a mule train of Peruvian gold. That night one crew massacres the rest of the pirates and takes the gold. Chris escapes and finds the dying Burt, who gives him his maps to the treasure he has buried on the Pearl Islands. Chris and Novia marry in Veracruz. Chris runs into Brother Ignacio and hires him to take care of Novia while Chris reclaims Burt's treasure. He sets out single-handed, but is wrecked and on the last page of the book is rescued by Mexican fishermen who have a radio. He makes his way to the United States and enters a seminary, then becomes a priest. He resists the temptation to visit the home where his child self lives. The Cuban Communists fall, and Chris heads to Cuba. He has realized Brother Ignacio was his older self. Finishing his manuscript on a plane to Miami, he explains that he plans to enter his childhood monastery as a lay brother named Ignacio, follow young Chris out of the monastery into 17th-century Cuba, go to Veracruz to meet him and take care of Novia, and eventually take his place as her husband and recover Burt's treasure.",0
20846893,The Boy In The Dress,David Walliams,2008-10-01,"['Juvenile Fiction', ""Children's stories""]","The story follows a boy named Dennis and his older brother John, whose parents got divorced when he was only 7 and his brother 9. The boys remain with their father, who resorts to comfort eating to cope after his wife leaves; Dennis finds comfort in his mother's left-behind clothes. Dennis buys a copy of Vogue magazine, but is caught by his horrified father; John calls him 'Denise'. At school that day Dennis is given detention, where he meets the glamorous Lisa James, who ultimately lends him a dress which he wears to school. This makes Dennis very embarrassed even though he fancies Lisa.",242
20851940,Aunt Jane's Nieces Abroad,L. Frank Baum,1906,"{""/m/03mfnf"": ""Young adult literature""}","The second book in the Aunt Jane's series picks up where the first left off. The eccentric and down-to-earth millionaire John Merrick decides to take his three beloved nieces &mdash; Patsy Doyle, Elizabeth de Graf, and Louise Merrick &mdash; on a tour of Europe. The parents of the three girls react variously, but don't oppose the trip; Mrs. Merrick, Louise's mother, wants to accompany them as chaperone, a prospect that Uncle John rejects out of hand. Still, Mrs. Merrick allows her daughter to go; she wants to separate Louise from Arthur Weldon, the young man who has been courting her. (The social-climbing Mrs. Merrick is desperate for Louise to land a rich husband. Weldon's father is a wealthy railroad magnate, but the father and son are in a clash of generations and the elder Weldon threatens to disown the younger). Uncle John and the three cousins embark for Europe, and make new acquaintances aboard ship. Among them is a somewhat sinister and mysterious man called Victor Valdi, who combines ""refinement and barbarity"" in his manner. Patsy goes out of her way to draw him out of his sullen silence, to ""make him talk and 'be sociable'."" The tourists reach Italy, where they witness an eruption by Vesuvius and cope with the public's fears and a layer of ash in the streets of Naples. They consider a detour, but decide to carry on intrepidly. They encounter a local aristocrat, the Count of Ferralti, who fancies Louise &mdash; though the clever Uncle John quickly realizes that he is only a pretend nobleman. John warns Louise of the young man's pretense, but otherwise allows the acquaintance, especially when Ferralti proves a courageous help in a near-disaster on the road. At Taormina, the travelers meet Victor Valdi again; he appears more sinister and mysterious than ever in his native element, where he is called ""Il Duca."" There is much talk of the danger of ""brigands"" in Sicily &mdash; though the local people cheerfully insist that ""There are no brigands"" in Sicily, an ironic refrain that winds through the book. Quickly enough, both Uncle John and Ferralti are waylaid by Valdi, who is the chief local brigand, and makes a living for his family and followers by kidnapping tourists and holding them for ransom. Uncle John learns the ways of Valdi's curious establishment, which includes his ruthless mother and his daughter Tato, who masquerades as a boy to serve as her father's henchman. After initial resistance, Uncle John reconciles himself to paying the ransom for his life and freedom; but his nieces and friends are unwilling to yield to bandits, and stage a bold and effective rescue of Uncle John and Ferralti. It is revealed that the false Count Ferralti is actually Arthur Weldon; he has come to Europe in disguise to be with Louise. Uncle John lets the two young people continue to see each other, as long as there is no talk of marriage yet. (News has arrived that Weldon's father has died in a railway accident, and that Arthur is now a wealthy heir.) The Americans are surprised a few days later, when Valdi and Tato appear at their hotel. While Tato was acting as the go-between in the ransom plot, the girl and Patsy had become something like friends; with typical generosity of spirit, Patsy does not blame the girl for the actions of her family. Now, Valdi asks the Americans to take Tato under their charge for a time; Valdi is trying to leave brigandage behind and take up an honest life. The cousins naively accept Tato, and enjoy dressing her in a new wardrobe and teaching her manners. They are surprised again when Tato absconds with the ransom cash ($50,000 of Uncle John's money and $30,000 of Weldon's); the girl leaves a cheerful but mocking letter behind her, explaining the ruse. Having learned their lesson, the travelers complete their tour through Italy, Switzerland, and France, and gratefully return home.",368
20854948,Quofum,Alan Dean Foster,2008,"{""/m/06n90"": ""Science Fiction""}","Sent by the Humanx Commonwealth Science Council, a team of explorers manage to find the planet Quofum—which only occasionally appears on long range scans. Since the planet is outside of the Commonwealth territory their mission is deemed minor and unimportant. The team’s four scientists—two human males, one human female and one male thranx—initially discover four separate, unique sentient species. Combined with Quofum’s nine percent alcohol oceans, its unstable appearance is seemingly part of the nature of Quofum: every species on Quofum is seemingly unrelated—casting well-established scientific notions of evolution into doubt. When the team’s mechanic, Salvador Araza murders the ship’s captain—revealing himself to be a member of the assassin clan, the Qwarm—the scientific exploration nearly ends. Before stranding the scientists on Quofum, Araza kills one member of the team who tries to stop him from stealing the ship’s shuttle. Upon returning to the ship Araza leaves Quofum but quickly discovers he is not in any part of the known universe. Unknowingly he left the planet while it was in an alternate universe where it periodically hides. Upon realizing his mistake, Araza tries to re-locate Quofum, but fails—stranding himself in the alternate universe. The three remaining scientists fall into a survivor’s depression realizing their small expedition won’t be missed while also lacking a means to return home on their own. They continue to explore and document Quofum’s flora and fauna, documenting upwards of ten different sentient species of various degrees of technological development. Eventually they happen upon an entrance to the inner workings of the planet. The ancient race (unnamed, but obviously the Xunca) that once inhabited Quofum altered their planet when they realized the inter-galactic Great Evil was eventually coming to their corner of the universe. The main alternation was to give Quofum the ability to shift to a different universe to protect itself. They also started multiple experiments to create different diverse races in an attempt to find a species that could trigger the ""Great Attractor device"" they set up in the Norma cluster to fight the Great Evil. The solution to the problem, and the conclusion to the storyline is actually revealed in Flinx Transcendent.",0
20857540,Curious George,Margret Rey,1941,"{""/m/0dwly"": ""Children's literature""}","The man with the yellow hat captures a monkey called George in the jungle. They sail aboard a ship for a big city and George falls into the sea while imitating some birds. He is rescued and the ship finally puts into port. The man goes home with George but the monkey plays with the telephone and inadvertently calls the fire station, and is unfortunately taken to jail. Luckily, he escapes jail. Later, he tries to grab a balloon from a vendor, but takes the entire bunch and sails away high into the sky. The wind dies down and George descends, landing on a traffic signal. The man rescues him, buys all the balloons from the vendor, and takes George and the balloons to the zoo, George's new home.",0
20857690,Curious George Takes a Job,H. A. Rey,1947,"{""/m/0dwly"": ""Children's literature""}","The book picks up where the first book ends. George is living in the zoo, but escapes. He enters a restaurant and eats a pot of spaghetti. The cook makes him wash the dishes. He does a splendid job and the cook takes him to a friend who gives him a job as a window washer at an apartment building. George discovers a room being painted and gives it a jungle theme but the painters chase him and he breaks his leg falling from a fire escape. He recovers in the hospital, but tampers with a bottle of ether and is overcome by the fumes. The man with the yellow hat and a nurse waken him with a cold shower. George's story is made into a movie and the book ends with George watching the film in a theater with his friends.",0
20857858,The Eye of the Forest,Philip Kerr,2009-01,"{""/m/01hmnh"": ""Fantasy""}","Mrs. Gaunt will be going to go to a plastic surgeon djinn named Dr. Kowalski to make Mrs. Gaunt's body look just like her former one. However, djinn can no longer ride whirlwinds safely because of global warming, so she has to fly down to the doctor in Brazil on a regular airplane. Meanwhile, Mr. Gaunt is kidnapped while his wife is away by three black druids from near Stonehenge. John and Philippa were at Mr. Vodyannoy's other house when that happened. The west wing is safe but the east wing in not able to be navigated. The butler's sister is lost in the east wing. Also, no djinn power can be used in this Nightshakes house. John goes to see the talking boards there to try to contact Mr. Rakshasas' spirit, but he awakens an ancient Incan named Manco Capac instead. He escapes and regains his mummy from a museum. John brings Grace back to her brother and goes to the museum in his ethereal form. Another unrelated thief stole three sacred gold disks and broke somethings, and the news says a thief in Berlin stole an ancient Incan staff. The news then shows a picture of a door shaped like an eye in the Peruvian forests that leads to...nowhere. Nimrod says that it's the Eye of the Forest and leads to a place that could cause the end of the world. They fly down to Peru after consulting with Faustina, the Blue Djinn, and getting the one copy of the map to the Eye in the world. They bring Zadie Eloko with them. The tour guide is ""Sicky,"" who has a tattoo on his stomach that acts like Medusa. His head is abnormally small due to an accident with enemy Indians when he was young. They are nearly killed several times by unusually large animals. John later discovers that Zadie is causing it. She was hypnotized by Virgil Macreeby. Zadie accidentally makes a wish that Pizarro would ""teach a lesson"" to the Indians chasing them. John and Nimrod reach the Eye - the news story was a hoax. The real door is rectangular and tied with a knotted string made from human hair. John leans against a lupuna tree and gains some of its knowledge. He unties the knot and rescues the others from mummified Indians. Nimrod awakens some Inca kings who go to fight Pizarro's army. Soon Virgil Macreeby, Dybbuk and Zadie arrive. They get the disks that Nimrod stole from Zadie. They are intent on using them to make an obviously fake ritual to remake Dybbuk's powers and turn lead to gold. The three go through the door, keeping back the others by showing them a video that their father is kidnapped. Nimrod connects the dots and realizes that the disks are really polonium, lithium, and steel. The staff has a rod made of pure uranium. These could cause a nuclear explosion. A piece of uranium the size of a baseball destroyed Hiroshima—But if it is bigger (namely the uranium the land is built on) the whole world could blow up. They decide to follow after sending Layla a message through djinnternal mail. The way to Paititi is guarded by enantodromia (i.e. a wish becomes its opposite). Layla flies to America in a jet at 1500&nbsp;mph and finds out where Mr. Gaunt is. She rescues him and turns the druids into rare animals. But she shared Edward's body-he is so scared that she renounces her powers(even though Nimrod said in book 2 that you can only renounce once). Meanwhile, Macreeby leaves Zadie entangled to a human hair bridge that absorbed her and goes on with Buck. John releases her and Nimrod dehypnotizes her. She follows them. While that happens, the other two cross through a row of vampire plants that want their blood. They get across but Macreeby had a concussion. They reach the temple but in the middle of the process realize Macreeby dropped the third gold disk near the plants (the polonium one). Macreeby gets it but Phil somehow apparates across. Then the plants disappear. Nimrod says her slippers are ""gestalt"" and that they make her desires come true. They follow to Paititi capturing Macreeby on the way. But just before they reach the city, their electronic devices stop working. Buck dropped the rod without the polonium - there will be no explosion, but only deadly radiation instead. Phil wishes up a bomb shelter with Hazmat suits. She goes up to Buck - he has split into 2 beings, one good, one bad. The bad one crushes the good one and Phil goes back to the others brokenhearted. They are ""gestalted"" back to the real world and Phil buries the slippers for fear of their power. Zadie stays behind in the forest to make a school for the Indians. The bad ones lost their bad chief to Pizarro and are good now. Sicky is their new chief. Macreeby's punishment is that he stays behind to help Zadie. Nimrod plants accelerated growth lupuna trees made by Faustina near the Eye and makes them invisible so loggers don't cut them. When they grow up tall in a few years (they grow 10 times as fast as other lupunas) whirlwind travel will be safe again. The team heads home to New York, with their family back to normal",0
20857999,Curious George Rides a Bike,H. A. Rey,1952,"{""/m/0dwly"": ""Children's literature""}","The man with the yellow hat buys George a bicycle. He helps a newspaper boy with his route, but makes boats of the newspapers and sets them adrift in a stream. He runs into a rock, damaging the bike's front wheel. Workers with an animal show fix the wheel and George joins the show. He is given a bugle to play. He is told not to feed the ostrich but the bird gets the bugle lodged in his throat. The workers retrieve it, but George is fired. A baby bear escapes and climbs a tree. George rescues him by lowering him to the ground in the newspaper bag. For his heroism, George is reinstated in the show. He rides his bike and plays the bugle. He is a great success, and is allowed to keep the bugle.",0
20864019,Syren,Angie Sage,2009-09-29,"{""/m/01hmnh"": ""Fantasy""}","The story picks up where Queste ended. Jenna, Nicko, Snorri, Ullr and Beetle are in the harbor known as the Trading Post, where Jenna encounters her father, Milo Banda, who persuades them to spend the night on his ship. Back in The Castle, Septimus gets a promotion to Senior Apprentice by Marcia Overstrand, for being the only apprentice wizard to complete the Queste. This enables him to head off on an adventure of his own. His escapade begins as he plans a simple flight on board his dragon, Spit Fyre, to retrieve his friends from the Trading Post. Around this time, Aunt Zelda sends Wolf Boy from the Marram Marshes. She is giving him a challenging test for becoming the first male Keeper. As soon as Wolf Boy leaves, Zelda retrieves a SafeCharm, which appears to be a tiny, pear-shaped gold bottle. She needs to deliver it to Septimus, however, by the time she arrives he has already left. Due to an unfortunate mix-up, the SafeCharm falls into the hands of Merrin Meredith who stole it believing it to be a rare perfume. When he takes the top off to sniff it, a jinnie comes out of it. ""Jim Knee"" as he is called by Merrin, sets off on his own adventure. Meanwhile, Wolf Boy bumps into Simon Heap in the Port; he was looking for his fiancee Lucy Gringe who had been missing. Wolf Boy approaches the House of the Port Witch Coven. There he reads Zelda's letter which tells him to feed a creature called Grim and cut-off its tentacle tip. The Port Witch takes him inside her kitchen and wakes the Grim, which is a giant octopus. The witches bring forth a captive Lucy to feed to the Grim. Under the pretense of feeding Lucy to the Grim, Wolf Boy and Lucy escape from the coven. They are chased by a senior witch, Linda, but they escape by riding straight into a leaving ship. While flying towards the Trading Post, Septimus sees a bunch of seven islands on the sea and hears a voice calling him. Ignoring the voice, Septimus continues his journey and reaches Milo's ship The Cerys. There Milo shows Jenna a big trunk which is full of tiny lead tubes and which he declares to be brought specially for Jenna's safety. Jenna, getting tired of Milo's hospitality decides to leave the ship and fly off home with Septimus and Beetle on Spit Fyre. But while flying home, they get caught in a raging storm. They try to find the Cattrokk Light, a lighthouse in the middle of the ocean, and fall onto a nearby island when Spit Fyre's tail gets struck by lightning. Septimus tries his best to cure the tail with Physik but his attempts fail. He is also perplexed by a voice calling his name continuously. One day Septimus sees a girl approaching him. The girl introduces herself as Syrah Syara; Septimus remembers meeting her when he went back in time 500 years, during the events from Physik. She fled from The Castle during the Queste and hid on the island. Syrah heals Spit Fyre's tail and reveals that she is under a terrible enchantment by the resident evil ghost of the island known as Syren. The Syren, a singing ghost who attracts sailors by her voice and leads them to their doom by possessing them, stays in a tower atop the hills of the island. Syrah takes Septimus there to show him an opened ice-tunnel latch beneath the island; she mentions that danger is approaching the Castle. Before Septimus can close the ice-tunnel, the Syren takes hold of Syrah while Septimus flees. Meanwhile Marcia goes to the Manuscriptorium vaults and finds that the ice tunnel latches, which pass from The Castle to the Seven Isles of Syren, through Cattrokk Light to the House of Foryx, are opened. Suspecting that the evil ghost Tertius Fume may be behind this, she returns to the Wizard Tower to find Zelda who informs Marcia about Septimus' danger. Together they find the jinnie and lock him in a sealed chamber in the Wizard Tower and devises a plan to help Septimus. Lucy and Wolf Boy continue their journey aboard the ship whose captain is a pirate. They reach Cattrokk light and there, the pirate's henchmen throw the lighthouse guard overboard. Lucy and Wolf Boy hide from them in one of the rooms of the Lighthouse. Surprisingly, they find that the lighthouse guard, Miarr, who is half-cat half-human, is still alive because cats have nine lives. The ship's captain and his henchmen take the light from the lighthouse and transport it to the island where Jenna and Beetle reside, and they see them coming. Miarr then leads Lucy and Wolf Boy to an underwater machine which allows them to approach the island unseen. While they are entering the underwater machine, it is hinted at that the Septimus Heap series takes place in the future. The Cerys travels towards The Castle under Nicko's steering. However, near Cattrokk Light, Nicko hears the Syren's song and believing mistakenly that the light on the island is coming from the lighthouse, he sails the ship onto the rocks. The pirate ship's captain and his henchmen then ambush Cerys' passengers, but Septimus and the others are able to lock them in the hold and save them all on board. The captain and his henchmen open the trunk, which contains thousands of bottles of jinnie and release them. To their horror, Septimus and the others find that the jinnie warriors come on board and address Tertius Fume as their master; he is on the island directing them towards the Syren tower ice tunnel. Meanwhile under Marcia's order, Septimus' jinnie finds him. Septimus and Beetle come to the conclusion that since Jim Knee was in a golden bottle, he has the power to overcome the warrior jinnie because gold is purer than lead. Septimus orders Jim Knee to go and freeze one of the warriors so that all the others will be simultaneously frozen. The front line of warriors had already reached through the ice-tunnel to the Wizard Tower, where just as they are about to kill Marcia under Fume's supervision, Jim Knee freezes the last jinnie; hence freezing all the other jinnie warriors. Marcia triumphs and informs a surprised Fume that she will see to it that his ghost is eradicated forever. Septimus and the others rejoice and Lucy and Wolf Boy help Miarr to put back the light atop Cattrokk. Septimus also orders Jim Knee to go and capture the Syren and force it into a small sealed bottle; hence Syrah is saved from her terrible enchantment. However, learning that more than 500 years have been passed since she arrived there and that Julius Pike is long dead, Syrah becomes comatose. The whole company returns to The Castle, where Marcia, Sarah and Silas Heap and Aunt Zelda meet them.",0
