id,title,author,published_date,categories,summary,page_count
1287642,Persian Letters,"Charles de Secondat, baron de Montesquieu",1721,UNK,"In 1711 Usbek leaves his seraglio in Isfahan to take the long journey to France, accompanied by his young friend Rica. He leaves behind five wives (Zachi, Zéphis, Fatmé, Zélis, and Roxane) in the care of a number of black eunuchs, one of whom is the head or first eunuch. During the trip and their long stay in Paris (1712–1720), they comment, in letters exchanged with friends and mullahs, on numerous aspects of Western, Christian society, particularly French politics and mores, ending with a biting satire of the System of John Law. Over time, various disorders surface back in the seraglio, and, beginning in 1717 (Letter 139 [147]), the situation there rapidly unravels. Usbek orders his head eunuch to crack down, but his message does not arrive in time, and a revolt brings about the death of his wives, including the vengeful suicide of his favorite, Roxane, and, it appears, most of the eunuchs. The Chronology breaks down as follows: *Letters 1–21 [1–23]: The journey from Isfahan to France, which lasts almost 13 months (from 19 March 1711 to 4 May 1712). *Letters 22 [24]–89 [92]: Paris in the reign of Louis XIV, 3 years in all (from May 1712 to September 1715). *Letters 90 [93]–137 [143] or [supplementary Letter 8 =145]: the Regency of Philippe d’Orléans, covering five years (from September 1715 to November 1720). *Letters 138 [146]– 150 [161]: the collapse of the seraglio in Isfahan, approximately 3 years (1717–1720). The novel consisting of 150 letters appeared in May 1721 under the rubric Cologne: Pierre Marteau, a front for the Amsterdam publisher Jacques Desbordes whose business is now run by his widow, Susanne de Caux. Called edition A, this is the text utilized in the recent critical edition of Lettres persanes for the complete works of Montesquieu published by the Voltaire Foundation in 2004. A second edition (B) by the same publisher later in the same year, for which there is so far no entirely satisfactory explanation, curiously included three new letters but omitted thirteen of the original ones. All subsequent editions in the author’s lifetime (i.e., until 1755) derive from A or B. A new edition in 1758, prepared by Montesquieu’s son, included eight new letters – bringing the total to 161 – and a short piece by the author entitled ""Quelques réflexions sur les Letters persanes."" This latter edition has been used for all subsequent editions until the Œuvres complètes of 2004, which reverts to the original edition but includes the added letters marked as ""supplementary"" and, in parentheses, the numbering scheme of 1758.",0
1290331,Bonjour Tristesse,Françoise Sagan,1954,"{""/m/05hgj"": ""Novel""}","Seventeen-year-old Cécile spends her summer in a villa on the French Riviera with her father and his mistress. Her father, Raymond, is a seductive, worldly, amoral man who has had many affairs. His latest woman friend is Elsa Mackenbourg: she and Cécile get on well. When Elsa comes to the villa to spend her summer with Raymond, it is clear that she is the latest of many women whom Cécile has seen enter the life of her father and exit fairly quickly: young, superficial, and fashionable. Raymond excuses his philandering with an Oscar Wilde quote about sin: ""Sin is the only note of vivid colour that persists in the modern world."" Cécile says, ""I believed that I could base my life on it"", and accepts their lifestyle as typical. Cécile, at 17, is still somewhat naive and tries to disguise this by attempting to attract men of the same age as her father. Her love life is unsuccessful until she meets a younger man, Cyril, with whom she has a romantic but ultimately dissatisfying relationship. Raymond, Elsa and Cécile are spending an uneventful summer together until Anne Larsen arrives by way of an earlier invitation from Raymond. A friend of Cécile's late mother, Anne is very different from Raymond's other girlfriends. She is cultured, educated, principled, intelligent, and is his age. Raymond eventually leaves Elsa for Anne, and the next morning Anne and Raymond announce their impending marriage. At first, Cécile admires Anne, but soon a struggle begins between Cécile and Anne for Raymond's attentions. The plot begins to focus on the relationship between the two women. Realizing that Anne will do away with their carefree lifestyle, Cécile devises a plan to prevent the marriage. She arranges for Elsa and Cyril to pretend to be a couple, and to appear together at specific moments in the hopes of making Raymond jealous of Cyril so that if Raymond decides he wants Elsa back, he'll leave Anne. Cécile is jealous and desperate for Anne to recognize the life she and her father have shared, but she misjudges Anne's sensitivity with tragic results. When Raymond finally relents and goes into town to see Elsa, Anne leaves, only to drive her car off a cliff in an apparent suicide after she sees Elsa and Raymond in the woods together. It is later known that they were kissing. Cécile and her father return to the empty, desultory life they were living before Anne interrupted their summer.",0
1291008,Return to Peyton Place,Grace Metalious,1959,"{""/m/02xlf"": ""Fiction""}","After the phenomenal success of her first novel, Metalious hastily penned a sequel centering on the life and loves of bestselling author Allison MacKenzie, who ironically follows in the footsteps of her mother by having an affair with a married man, her publisher Lewis Jackman. In the finale of the book, Lewis is killed, which destroys Allison. The similarity of their situations bond Allison and her mother, whom advises Allison to live for him by returning to her writing, which she does. When she returns to her hometown following the publication of her first novel, Samuel's Castle, she is forced to face the wrath of most of its residents, who are incensed by their barely disguised counterparts and the revelation of town secrets in the book. Certain members of the community stood by the MacKenzies, most notably, Seth Buswell, the newspaper editor; and his oldest friend, Dr. Matthew Swain. In fact, whenever anyone came into Dr. Swain's office and complained about Allison's book, he would roar them down and after a tongue lashing from him, that person wouldn't ever complain about Allison's novel after that. However, Roberta Carter, a member of the school board, makes it her mission to ban the book from the high school library. She also punishes Allison by firing her stepfather, Michael Rossi (a decision which she eventually reverses, to the anger of her former friend, Marion Partridge); while at the same time trying to dissolve her son Ted's marriage to his snobbish bride. Roberta is eventually murdered by her scheming daughter in-law, Jennifer Burbank. Another union in trouble is that of Allison's mother Constance, who is shocked by her daughter's exposé, but nonetheless stands by her, and stepfather Michael Rossi, the school principal and one of the novel's defenders. Betty Anderson returns from New York, after giving birth to Roddy, the child she had by Rodney Harrington and, along with her co-hort and Roddy's babysitter, Agnes, moves to Peyton Place, so she can allow Leslie, Roddy's grandfather to know him. Selena Cross, who had been acquitted of murder in the previous novel, was trying to make a life for herself and her brother, Joey. She is manager of the Thrifty Corner Apparel Shoppe, and is a success. She meets Timothy Randlett, an itinerant actor, who after attacking her, ended up getting hit with fireplace tongs, similar to how Lucas Cross was killed. She eventually decides to marry Peter Drake, her former attorney. In this book, Selena and Allison had rebonded as friends, and Allison's roommate, Stephanie, was also part of their circle. Return to Peyton Place had many of the same soap opera elements of the original. Although it sold well, its total sales did not equal those of its predecessor.",0
1292785,Eastern Standard Tribe,Cory Doctorow,2004-03-01,"{""/m/06n90"": ""Science Fiction"", ""/m/014dfn"": ""Speculative fiction""}","The protagonist, Art Berry, has been sent to an insane asylum as a result of a complex conspiracy. The novel takes place in a world where online ""tribes"" form, where all members set their circadian rhythms to the same time zone even though members may be physically located throughout the world. He works in London as a consultant for the Greenwich 0 tribe (though he and his associate Fede are in fact double-agents for the Eastern Standard Tribe). Despite his talents as a human experience engineer, he delivers subtly flawed proposals to them in order to undermine them and enable his own tribe to get a coveted contract. He meets a girl, Linda, after he hits her with his car at 3am. Art has an idea for peer-to-peer music sharing between automobiles, and plans to give it to the EST (taking a cut to himself.) However, his girlfriend meets his coworker, Fede, and they plan to double cross the EST and sell the idea to another tribe. Knowing Art won't approve of the plan, they do it behind his back. Fede later claims he would have cut Art in on the deal afterwards. However, Art figures out what is going on, and as a result they have him committed to an insane asylum to protect their plot. The book alternates between two points of view: Art meeting Linda in London, and Art in the asylum. The London plot culminates in his attack on Fede when he discovers his betrayal. The asylum plot takes place after his attack on Fede, and culminates in his escape from the asylum and founding of a new company to market health care products using his inside knowledge of psychiatric institutions.",0
1296027,The Gold Bug Variations,Richard Powers,1991-08-01,"{""/m/014dfn"": ""Speculative fiction"", ""/m/02xlf"": ""Fiction"", ""/m/05hgj"": ""Novel""}","The novel intertwines the discovery of the chemical structure of DNA with the musicality of Johann Sebastian Bach's harpsichord composition, the Goldberg Variations. A similar theme is explored by Douglas Hofstadter in his 1979 book Gödel, Escher, Bach: an Eternal Golden Braid. The title also alludes to Edgar Allan Poe's 1843 short story ""The Gold-Bug"", which is also incorporated in the plot of the novel. The plot hinges on two love affairs: the first, set in the 1950s, between two scientists intent on discovering the mysteries of DNA; the second, in the 1980s, between two lovers who befriend the scientist featured in the novel's flashbacks.",0
1297091,The Golem,Gustav Meyrink,1914,UNK,"The novel centers on the life of Athanasius Pernath, a jeweler and art restorer who lives in the ghetto of Prague. But his story is experienced by an anonymous narrator, who, during a visionary dream, assumes Pernath's identity thirty years before. This dream was perhaps induced because he inadvertently swapped his hat with the real (old) Pernath's. While the novel is generally focused on Pernath's own musings and adventures, it also chronicles the lives, the characters, and the interactions of his friends and neighbors. The Golem, though rarely seen, is central to the novel as a representative of the ghetto's own spirit and consciousness, brought to life by the suffering and misery that its inhabitants have endured over the centuries. The story itself has a disjointed and often elliptical feel, as it was originally published in serial form and is intended to convey the mystical associations and interests which the author himself was exploring at the time. The reality of the narrator's experiences are often called into question, as some of them may simply be dreams or hallucinations and others may be metaphysical or transcendent events which are taking place outside the ""real"" world. Similarly, it is revealed over the course of the book that Pernath apparently suffered from a mental breakdown on at least one occasion, but has no memory of any such event; he is also unable to remember his childhood and most of his youth, a fact that may or may not be attributable to his previous breakdown. His mental stability is constantly called into question by his friends and neighbors, and the reader is left to wonder what if anything that has taken place in the narrative actually happened.",0
1297582,Storm of Steel,Ernst Jünger,1920,"{""/m/016chh"": ""Memoir""}","Storm of Steel begins with Jünger as a private entering the line with the 73rd Hanoverian Regiment in Champagne. His first taste of combat came at Les Eparges in April 1915 where he was first wounded. After recuperating, he took an officer's course and achieved the rank of Ensign. He rejoined his regiment on the Arras sector. In 1916, with the Battle of the Somme underway, Jünger's regiment moved to Combles in August for the defence of the village of Guillemont. Here Jünger was fortunate to be wounded again, shortly before the final British assault which captured the village &mdash; his platoon was annihilated. In 1917 Jünger saw action during the Battle of Arras in April, the Third Battle of Ypres in July and October, and the German counter-attack during the Battle of Cambrai in November. Jünger led a company of assault troops during the final German Spring Offensive, 21 March 1918 when he was wounded again. On 23 August he suffered his most severe wound when he was shot through the chest. In total, Jünger was wounded 14 times during the war, including five bullet wounds. He was awarded the Iron Cross 1st Class and was the youngest ever recipient of the Pour le Mérite.",0
1298672,Timeline,Michael Crichton,1999-11,"{""/m/06n90"": ""Science Fiction"", ""/m/02xlf"": ""Fiction"", ""/m/0c3351"": ""Suspense""}","In the middle of the New Mexico desert, a vacationing couple comes across an ill man wandering miles from town. They find the man, Joe Traub, is a physicist and an employee of a company called ITC. However, ITC's headquarters are mysteriously far from where Traub was found. Traub soon dies of a cardiac arrest. The hospital receives an MRI scan later, which reveals that Traub's blood veins did not match up to each other. Traub, being the last of his family, is taken and cremated by ITC to prevent any further evidence about his death from coming through to the public. In the Dordogne region of France, Professor Edward Johnston leads a team of historians and archaeologists studying the remains of the medieval towns of Castelgard and La Roque. Suspicious of the detailed knowledge of the site shown by ITC (their funder), Johnston flies to ITC's headquarters in New Mexico to investigate. While he is gone, the archeologists make a startling discovery in the ruins; a lens from a pair of glasses as well as parchment with a request for help written in modern English, apparently in Professor Johnston's handwriting. Researchers Chris Hughes, Kate Erickson, André Marek and David Stern fly to ITC and meet Robert Doniger, its founder, who tells them Johnston has used their quantum technology to travel to Dordogne in the year 1357, but has not returned as expected. Chris, Kate, and Marek agree to travel back themselves to find him. Stern remains behind, distrusting ITC's technology and believing they aren't telling them everything. They dress in period specific clothing, but Doniger allows only biodegradable modern advances to go back, banning plastic and weapons. When they arrive in the past, the team is plagued by misfortune. They are attacked by a group of horsemen led by Sir Guy, who kills the ITC military escorts and causing a grenade snuck on the mission to go to the present, destroying the transit pad. Unable to return, Kate and Marek are taken away by the men of Lord Oliver of Castelgard. Separated from the others, Chris accidentally declares himself as a noble to a boy who helps him and is led to Castelgard. The boy is revealed to be the Lady Claire in disguise, trying to escape from the leader of the horsemen, Sir Guy de Malegant. In the castle, Chris and André Marek find themselves challenged to a joust by Sir Guy and his second, Sir Charles de Gaune. Chris, instructed by Marek, lies on the ground after Sir guy hits him on the chest on his second run. While Marek fought with Sir Charles de Gaune, Sir Guy tried to kill Chris. However, André fights with Sir Guy and manages to beat him. Lord Oliver orders the death of André and Chris, but Kate helps them escape Castelgard and they are pursued by Guy and his knight Sir Robert de Kere. Lord Oliver believes that Johnston knows a secret passageway into the otherwise impenetrable castle of La Roque. Oliver's enemy Arnaut de Cervole, otherwise known as the Archpriest, is approaching the Dordogne to lay siege and Oliver wants the secret to defend La Roque. Johnston helps Oliver develop a weapon despite knowing that historically Oliver loses the siege, while Chris, André, and Kate use clues from the future to search for the passage themselves. Chris realizes that someone else is in the past with them and spying on their transmissions. Eventually Robert de Kere reveals that he is Rob Deckard, an ITC employee and former marine driven insane from the accumulation of ""transcription errors,"" deformities that build up over multiple quantum trips. De Kere intends to take their trip home for himself. Meanwhile at ITC, Stern and the vice president, Gordon, try desperately to repair the transit pads. It is revealed that Doniger is trying to use the past as a marketing tool. After Lady Claire helps Kate, Chris, and André elude Arnaut's men, André enters La Roque as Johnston's assistant while Chris and Kate discover the passage. As Arnaut begins his siege, Oliver decides that Johnston is hiding information and takes him to a torture device known as Milady's Bath to drown him. Kate fights and kills Guy on the rafters of the Great Hall, while André and Chris are able to rescue Johnston when Arnaut himself intervenes and defeats Oliver in a duel. Arnaut thanks them and leaves Oliver to die. As the battle rages, de Kere attacks Chris to get his ceramic marker, but Chris manages to set him on fire with Johnston's automatic fire and spittle. ITC and Stern finally repair the landing area just in time for the travelers to return. André—who realizes he has longed for this life—decides to remain in the past with Lady Claire while Chris, Kate, and Johnston return to 1999. When it becomes clear that Doniger had little regard for the lives of the travelers, the researchers and engineers, mainly John Gordon, send him to 1348—the outbreak of the Black Death. In the epilogue, Chris and Kate are expecting a child together. The researchers find André and Lady Claire's graves and discover that André lived out a good and satisfying life. His gravestone reads a message in French to his companions, quoted from Richard Lionheart, - ""Companions who I love, and still do love,... tell them my song.""",0
1298894,Time in Advance,William Tenn,1958-06,"{""/m/06n90"": ""Science Fiction""}","The Earth is visited by large, enigmatic alien spheres, who take up residence in colonies on several prairies and deserts across the world. They make visits to cities, factories and other areas of human activity, seemingly to merely float and observe. All attempts at communication are unsuccessful and despite the best efforts of mankind, no one is able to decipher their intentions. Some, however, have come in to close encounter with the aliens, and emerged dramatically altered beings. These people, called humanity-prime, and dubbed 'primeys', are highly intelligent, can bend matter to their will, but are also, by human standards, quite, quite mad. Algernon Hebster is a highly successful businessman, owing mostly to his dealings with primeys, who supply him with the knowledge for advanced technologies which he puts to use in commerce. The problem is that primeys are so dangerous that dealing with them is highly illegal and every attempt is made to confine them to the reservations around their perceived alien masters.",0
