id,title,author,published_date,categories,summary,page_count
14427278,The Man Nobody Knows,Bruce Barton,2011,['Self-Help'],"In this book Barton paints a picture of a strong Jesus, who worked with his hands, slept outdoors and travelled on foot. This is very different from what he saw as the ""Sunday School Jesus"", a physically weak, moralistic man - the ""lamb of God"" Barton describes Jesus as ""the world's greatest business executive"", and according to one of the chapter headings, ""The Founder of Modern Business"",",128
14428322,Who Wrote The Dead Sea Scrolls?,UNK,1995-06-01,"{""/m/03g3w"": ""History""}","* Part I - A new Theory of Scroll Origins *#The Qumran Plateau *# The Manuscripts of the Jews *# 1947; The First Scroll Discoveries *# The Qumran-Essene Theory: A paradigm reconsidered *# The Copper Scroll, the Masada manuscripts, and the Siege of Jerusalem *# Scroll origins: Rengstorf's Theory and Edmund Wilson's response * Part II - Science, Politics, and the Dead Sea Scrolls *# The Temple Scroll, the Acts of Torah, and the Qumranologists' dilemma *# Power Politics and the Collapse of the Scrolls Monopoly *#:This chapter discusses Géza Vermes' involvement in the purchase of photographs of the Dead Sea Scrolls by Oxford University under the condition that they only be shown to scholars selected by the official editorial team that controlled access to the scrolls. Golb states that ""Vermes could not possibly have avoided knowing of the financial agreement that facilitated the transfer of photographs"" (p.&nbsp;236), and that Vermes' statement of November 8, 1991, ""directly contradicted the position taken by him and the [Oxford] Centre in the [London] Times correspondence published three months earlier"" (p.&nbsp;237). The chapter also describes how Vermes used the media ""to promote his support for the traditional Essene hypothesis,"" but showed ""disdain"" for the similar use of the media by Dr. Robert Eisenman to promote a different view (p.&nbsp;241). *# Myth and Science in the World of Qumranology *# The deepening Scrolls Controversy *# The New York Conference and Some Academic Intrigues *# The importance of the Dead Sea Scrolls",0
14430298,The Diversion,K. A. Applegate,2001,UNK,"The Yeerks begin to realize the ""Andalite bandits"" are humans. The Animorphs discover the Yeerks have been testing the DNA patterns in the blood they have left in their countless battles. When they discover the traces of human DNA they begin running massive amounts of tests on blood which has been stored in the area in order to discover a genetic match or root out the Animorphs' families. Using this process a genetic match between Tobias and his mother, Loren, is discovered and gives the Yeerks proof that at least some the 'Andalite bandits' are in fact human. They go through a brutal battle at the laboratory where they discover this information in which Marco is nearly killed. After they retreat to Cassie's barn, Jake orders that they all go home and 'sleep on it', the Animorphs will meet in the morning to decide whether or not to evacuate their families thereby revealing their identities and taking the fight into the open. Tobias does not return to his meadow but goes to the address the blood databank gave for his mother. He is crestfallen to discover that it is only a few blocks from the house in which he lived with his uncle yet his mother never once came to visit him or showed any interest in her son at all. Tobias easily spots that she is being watched by the Yeerks. He observes Loren leaving the house with a dog, and quickly realizes that Loren is blind. With the guide dog she walks to a church where she apparently volunteers as a crisis phone line operator, and Tobias follows her. In the morning the Animorphs unanimously agree to immediately evacuate their families. Cassie and Rachel reveal to their families the truth of the invasion and evacuate them to the Hork-Bajir valley. Ax helps with rescuing Rachel's mother and sisters. Jake tries to rescue his parents as well with the plan that they will subdue Tom and starve the Yeerk out of him at long last freeing Jake's brother. But they appear to be out of the house when the Animorphs arrive, in fact Tom's Yeerk has already had Jake's parents infested and they spring a trap for the waiting Animorphs. They escape and Jake morphs falcon in front of the Yeerks, because he wants to show that he has been fighting all along to inspire fear in the Yeerks and hope in his family that he will rescue them. Tobias morphs his mother's guide dog and spends the night at his mother's house. In the morning he finally meets Loren, who he discovers had lost her memory in an accident years before. But she knew she did have a son, and hoped that he was happy. Tobias laments the fact that he never knew her, and tells her he needed a mother. Tobias then hatches a scheme to help Loren escape by giving her the morphing power. She morphs Tobias in hawk form and they embark on a desperate escape which leads to another battle that they barely escape. During the battle Loren throws herself in front of danger to protect Tobias and is nearly killed. Loren is then evacuated to the Hork-Bajir valley. The morphing ability restores Loren's vision, but not her memories. Tobias still longs for his mother's love and affection which she displays for her beloved guide dog but not for him, however Tobias remembers that she did throw herself in front of danger to protect Tobias. The book ends with Jake as an emotional wreck and the Animorphs safely evacuated to the Hork-Bajir valley with their families. Tobias sits beside Jake and thinks that he and Jake have almost switched places, Tobias has always been the loner without a family and now his family is here with him and Jake is all alone. Tobias reassures Jake that they will keep fighting and they will rescue his family. *The Yeerks finally realize the ""Andalite bandits"" are, in fact, human. *Loren from the book The Andalite Chronicles shows up again in the series in this story. *Tobias is reunited with his biological mother. *Cassie and Rachel reveal the war to their families, who evacuate to the Hork-Bajir colony to join Marco's parents. *Jake's parents are infested by Yeerks of a low rank, as will be revealed in the subsequent book. *Loren receives the morphing power.",0
14431088,Old Masters,Thomas Bernhard,1985,"{""/m/05hgj"": ""Novel""}","The book is set in Vienna on one day around the year of its publication, 1985. (p. 193) Reger is an 82-year-old music critic who writes pieces for The Times. For over thirty years he has sat on the same bench in front of Tintoretto's White-bearded Man in the Bordone Room of the Kunsthistorisches Museum for four or five hours of the morning of every second day. He finds this environment the one in which he can do his best thinking. He is aided in this habit by the gallery attendant Irrsigler, who prevents other visitors from using the bench when Reger requires it. The book is narrated entirely by Atzbacher, who met Reger in the museum the day before and with whom Reger then arranged to meet again in the museum on this day - thus, exceptionally, visiting the museum on two consecutive days. They had arranged to meet in the Bordone Room at 11.30, but they both arrive early, and the first 170 pages of the book consist of Atzbacher's thoughts and recollections as he surreptitiously watches Reger in his usual position. These are dominated by Reger's thoughts and recollections, as previously related to Atzbacher. Atzbacher tells of the deaths of Reger's wife and sister, and of his contempt for various aspects of Austrian and occasionally German society, including Stifter, Bruckner and Heidegger, the state and ""state artists"" in general, and the sanitary condition of Viennese toilets. Reger considers the idea of a supposed ""perfect"" work of art to be unbearable, and so seeks to render them bearable by finding flaws within them. The second half of the book, once Atzbacher and Reger have met, is formed of the intertwined reports of Reger's speech now, in the museum, with what he had earlier said at a meeting of the two in the Ambassador hotel after his wife's death, and his statements when they had met in Reger's flat before her death. This death of Reger's wife - its circumstances and its effects on him - increasingly dominate the book as it moves towards its conclusion. It is revealed that Reger had first met his wife while sitting on the Bordone Room bench, and that she had then accompanied him on his visits to the museum. It was while walking there in winter that she had suffered an ultimately fatal fall, for which Reger blames the town authorities (for failing to maintain the path), the state (the owner of the museum, which failed to provide timely aid), and the Catholic church, which runs the Merciful Brethren Hospital which Reger believes botched an operation which could have saved her. Despite his continued attacks on the ""Catholic National Socialist"" museum and state (p. 301) and his contempt for humanity, exemplified by the conduct of his housekeeper in taking advantage of him after his wife's death, Reger describes how he overcame his initial inclination to suicide and managed to survive her. He found himself let down by art, which proved useless to him at the decisive moment: Convinced that people are the only possible means of survival, Reger re-engages with the world, aided only by his ""misuse"" of Schopenhauer (p. 288) and by the White-bearded Man, the only work in the museum to have stood up to his scrutiny for thirty years. The book concludes with Reger revealing the true purpose of his arranging to meet Atzbacher: to invite him to a performance of ""The Broken Jug"" that evening, despite his own hatred for drama. Atzbacher accepts, reporting that ""the performance was terrible"".",0
14434638,Under the Green Star,Lin Carter,1972-11,"{""/m/06n90"": ""Science Fiction"", ""/m/014dfn"": ""Speculative fiction"", ""/m/01hmnh"": ""Fantasy"", ""/m/02xlf"": ""Fiction""}","One night the narrator sees a green star in the night sky, and casts his soul towards it. He finds a cloud-covered planet which revolves around it and sees that its surface is covered with trees that (from his perspective) seem several miles high. Later, he follows a retinue of humans riding on horse-sized (based on humans retaining earthly size, as he explains at one later point in the novel and another later in the series) dragonflies (which he finds out later are known as zaiphs) to a splendid city which sparkles like a jewel collection. One of the men in the retinue, cruel-faced and clad in bright yellow, presents a proposal (which the author cannot yet hear) to the ruler of the city, a princess who looks about 14. At that point, the author is drawn to a large man's body preserved inside a casket—which he revives to the consternation of the yellow retinue, and the cheers of the jewel-city's nobles. As he has taken the body of a man preserved for over a hundred years (whose soul was banished by a sorcerer), the author has to ""relearn"" Laonese, the universal language of the planet; he learns that the Jewel-city is known as Phaolon, considered the most splendid city on the planet; that its beautiful ruler is princess Niamh the Fair; that the yellow-clad man was Akhmim ruler of the rival city of Ardha (also known as ""yellow city""). He is also ""brought up to speed"" (the body he took was that of a warrior named Chong The Mighty) on swords, bows, and other weapons. One day, when Chong and Niamh are out on a hunt for celebrating the Festival of mating zaiph, they are confronted by a huge (somewhat larger than a Bengal Tiger) lizard known as ythid; the lizard is killed by an arrow from Chong's friend Panthon, but the spilled blood causes Niamh and Chong to fall into the web of an elephant-sized spider or xoph. As they escape from it, Niamh is drawn to a flower, which turns out to be a vampire species—but before it can kill her and Chong, the two are rescued by a band of outlaws. The outlaw band is led by a female, Siona, who falls in (unrequited, as he loves Niamh) love with Chong. Chong makes friends with one of the rescuers, Yurgon—but an enemy of another of the band, weasel-faced Sligon (who manages to find out about the secret of Niamh and Chong). Later, Sligon reveals the secret to Siona (whose father was banished by Niamh's) and strikes Chong with a poisoned dagger—only to be immediately slain by Siona. Chong aids Niamh in getting to the zaiph pens (to escape) prior to succumbing to the wound and poison—at which point the narrator (on earth) regains consciousness. Under the Green Star was followed a year later by When the Green Star Calls.",0
14434701,When the Green Star Calls,Lin Carter,1973-07,"{""/m/06n90"": ""Science Fiction"", ""/m/014dfn"": ""Speculative fiction"", ""/m/01hmnh"": ""Fantasy"", ""/m/02xlf"": ""Fiction""}","This time, when he reaches the Green Star planet, he sees a boy about 16 spreadeagled to a branch with rawhide, so as to be killed by marauding animals (or to die of starvation, so his body may be scavenged). A huge scorpion or phuol attacks the boy and then withdraws (waiting for its venom to paralyse, so it can then consume his still-living flesh later). At that point, a man comes out from concealment behind branches, kills the phuol with a lightning-emitting wand, and rescues the boy in a sky-sled, which the narrator follows to a city which appears dead (later finding out this is so). The rescuer applies salves and injections to the boy, who dies during the night (known to the narrator, but not the rescuer) whereupon the narrator takes possession of the just-dead body; it takes him a little while to reconcile the memories of this new body, whose name he finds to be Karn the Hunter (of Red Dragon Tribe—the ""Red Dragon"" being a reference to the ythid), with his soul memories from his earlier incarnation as Chong The Mighty. Karn soon finds out that the dead city (known as Sotaspra) is a taboo area of the planet, only visited (or inhabited) by some scientists/savants such as his rescuer Sarchimus (self-titled ""The Wise""). Indeed, Sarchimus considers all of the other savants of the city as rivals, chief of them Hume ""Of The Many Eyes"". Sarchimus warns Karn not to go exploring on his own—when Karn disobeys, he discovers the city is full of many mutant creatures, including a ""death-fungus"" which he narrowly misses, ""crawler-vines"" which try to strangle him and an amorphous creature Sarchimus calls ""saloog"", all of which were formed due to radiation from the crystals of which Sotaspra was constructed (when the crystals had energy, and the city was alive). Karn is astute enough to understand that Sarchimus did not rescue him for altruistic reasons. Sometime later, when Sarchimus has gone on an errand, Karn goes to another area where Sarchimus has forbidden him access—a set of doors sealed with Sarchimus' symbol, a scarlet hand. Doing so, he discovers that Sarchimus' experiments are partly guided by an original inhabitant of the city. Karn had earlier seen some statues of winged humanoids in very commonplace positions—but these were made of chalk, a rather brittle material; the inhabitant is the last living member of these ""genii"" as Karn thinks of them, over a million years old. The immortal, Zarqa the kalood (meaning ""flying ones"") tells him that the statues are the result of a failed experiment of immortality which produced a compound known as ""Elixir of Light"". Even correctly formulated, the Elixir lengthened the lives of male kaloodha but sterilised them as a price—while having no effect on the females, thus causing a slow extinction of this noble race; the statues are the result of consuming this elixir mixed lacking a crucial ingredient. Sarchimus has much-tortured Zarqa to find out the formulation—at the time Karn finds him, he has revealed all except one ingredient but not the correct formula. Karn is also told that there is another human captive, a Phaolonian, in the tower (who he finds at a later opportunity—recognising by face, but not by name—to be named Janchan). Eventually, Sarchimus treats Karn to a drugged feast (and then chains him) as a prelude to testing the Elixir on him—boasting that Zarqa (he doesn't reveal the name, as he does not know of Karn's knowledge) has revealed the correct formula to him. Karn is invigorated and strengthened greatly by the Elixir, but cannot break the chains fastened to him. Pleased at this sight, Sarchimus consumes the rest—and finds himself petrifying to chalk. Zarqa (who had been held in an energy-barrier set to Sarchimus' frequency) then releases Karn (and reveals to him the missing ingredient to be a component distilled from phuol venom—Karn was protected by residues of the venom from the stinging he had earlier received), who then releases Janchan. The three then find a map to Ardha and Phaolon—which they find are about 3,000 farasang (a unit of time misused by Laonese also for distance) away. Janchan enters Ardha and obtains employment as a soldier. In this employ, he finds Niamh (who was recaptured by Siona's band after her escape attempt and then given to Arjala the ""goddess"" of Ardha as captive—due to rivalry between Arjala and Akhmim, this allowed some power-josting). Soldiers in Arjala's employ have also captured Zarqa and display him as an amphasand, a mythical creature sacred to the Laonese. Janchan makes careful plans to rescue Niamh and Zarqa. Karn meanwhile has been attacked by a large bumblebee or zzumalak, which he mortally wounds—only to land in a swimming pool where the bee drops him. Taking some coins from this house, he runs into a trio of men who fight and capture him—who turn out to be of the assassin guild. One of this trio, Klygon, soon trains Karn in the arts of the guild. The chief of the guild, an obese man named Gurjan Tor (who most-closely resembles Jabba The Hutt of Star Wars), asks Karn to kill Niamh and Zarqa with a poisoned stiletto—and posts Klygon as his ""partner"" to ensure that Karn will not fluff the job or run away. Karn and Klygon fly to the temple tower (where Niamh is held) on zaiphs, and find that Janchan (and Zarqa) in the process of rescuing Niamh. Janchan's rescue goes somewhat awry as Arjala is present with two (very large, muscular eunuch) temple guards. Janchan's plans have been made in order to AVOID having a fight with these toughs (as he particularly fears they may raise an alarm); in desperation, he throws a lamp at one, breaking both it and the eunuch's skull (and discovers that the doomed eunuchs are also mute). The dead eunuch's body strikes Arjala knocking her unconscious—and forcing Janchan to rescue her as well. He quickly grabs Arjala and Niamh and puts them in the sky-sled with Zarqa. Karn who has seen this is now afraid that Klygon may kill him—as promised to Gurjan Tor. The cliffhanger above is the starting point for the series' third novel, By the Light of the Green Star.",0
14440432,Traveller,Richard Adams,1988,"{""/m/014dfn"": ""Speculative fiction"", ""/m/01hmnh"": ""Fantasy"", ""/m/02xlf"": ""Fiction"", ""/m/098tmk"": ""War novel""}","Traveller, the favorite horse of retired Civil War general Robert E. Lee, relates the story of his life and experiences to his feline friend. His narrative, meant to begin early spring of 1866, follows the events of the war as seen through his eyes, from the time he was bought by General Lee in 1862, until Lee's death in 1870. At the end of the novel, Traveller, with undying faith in Lee, becomes convinced that the Confederate Army beat the Union and that Lee is now ""commander of the country"" (versus his actual postbellum role as president of Washington and Lee University). And despite marching in Lee's funeral procession, Traveller does not understand that his master has died and will not return to ride again.",0
