id,title,author,published_date,categories,summary,page_count
10535507,Demons of Chitrakut,Ashok Banker,2004,"{""/m/06bvp"": ""Religion""}","The story picks off where it left in Siege of Mithila. Rama and Lakshmana have collectively annihilated Ravana's massive invasion force with the most powerful divine weapon in history, the Brahmastra. The entire army, reduced to dust, is washed away with the waters of the holy Ganga, replaced by a beautiful flowering forest, with no trace of the invasion left for human history. Rama and Sita are married, as are Lakshmana and Urmila. Their brothers, Bharat and Shatrughna, are married to Sita's cousins Mandavi and Shrutakirti respectively. Following the ceremony, Vishwamitra takes his leave of the two boys and leaves Rama with an important piece of advice: to follow his dharma at all costs, as it will help him prepare for the trials ahead that he has foreseen. While the wedding party of Ayodhya travels home with the princes and their new brides, they are interrupted by Parashurama, the warrior known as Rama of the Axe, who, upon hearing the destruction of Shiva's bow by Rama, has erupted in a rage from his meditation to slaughter him. However, upon realizing that Rama is the one responsible, he becomes skeptical, and believes Rama is lying to him about having destroyed Ravana's army. He gives Rama the Bow of Vishnu, the exact brother to the Bow of Shiva which Rama split in two and challenges him to single combat. Rama single-handedly defeats Parashurama and, upon his request, destroys the fruit of all of Parashurama's penances with a single celestial arrow. Parashurama comes to a conclusion about Rama which remains largely unrevealed, and he gifts Rama with the Bow, claiming that it ""always belonged to him"". The wedding party arrives back in Ayodhya amidst great pomp and celebration, aided by a light show orchestrated by Vashishta. Manthara, who had previously been put under house arrest, kills the guard confining her and escapes with the help of Ravana's mayavic power. It is revealed here that Ravana is alive, although incapacitated, and can still bestow his followers with evil powers. During the grand welcome back to Ayodhya, a woman identified as Kaikeyi attempts to run into the paths of the elephants, crying out to Rama in order to warn him about something. She is taken away by royal guards, but not before Kausalya sees her. They are subsequently very surprised when Kaikeyi turns up, fully groomed, to greet the new bride upon her arrival, despite the fact that they saw her bloodied and dirty upon the streets only seconds earlier. Sumitra accuses Kaikeyi of employing witchcraft, to which Kaikeyi angrily replies that she is innocent of any crime, and stalks off to her chambers. Dasaratha once again begins to fall ill. The princes celebrate their suhaag raats (nuptials) upon returning home, after performing the necessary rituals. Dasharatha announces that Rama's coronation as Crown Prince will occur the following morning. Dasaratha, feeling ill once more, lies in his bed and tells Kaikeyi that he is ashamed of the wrong things he has done or indirectly caused, and is more than proud of his eldest son. Manthara then enters and tells Dasaratha that Kaikeyi has taken a vow to fast unto death in the palace kosaghar. Dasaratha, upset by this news, agrees to go to the kosaghar to see what she needs. Meanwhile, Kausalya, Sumitra and a number of handmaidens discover that the woman seen upon the streets with Kaikeyi's voice was in fact one of Manthara's handmaidens, who has been witness to the fact that Manthara is a devil-worshipper and has performed human sacrifices to the Dark Lord, Ravana. Kaikeyi projected her consciousness through the girl's body when it was forced out of her own body at one point. In the presence of Vashishta and Kausalya, she reveals that an act of great evil is soon to occur but it is not of her doing, and asks Kausalya to ""save Rama"". Kausalya and Vashishta confront Kaikeyi in the kosaghar, where Dasaratha lies motionless in a coma-like state. They discover to their horror that Kaikeyi is in fact Dasaratha's first wife, and that they married at a small shrine off the battle plains of the Asura Wars following Dasaratha being near-mortally wounded. Along with their marriage, Dasaratha promised Kaikeyi two boons which she was allowed to call back later on, and using that to her advantage, she has called for Rama to go south into exile for fourteen years and for Bharata to be crowned King. Due to the events which transpired in the kosaghar while granting the boons, Dasaratha is now dying and there is no way to save him this time. Vashishta then reveals that Manthara, the ""green witch"" as she is now called, has used sorcery to possess and drug Kaikeyi. Manthara reveals her true colors and threatens to kill Dasaratha, but Vashishta reveals to her that the Dark Lord's promises to her are entirely false, and that she was shaped while in her mother's womb into the deformed crone that she is. Manthara refuses to believe this revelation and flees. Rama, after receiving instructions to leave Ayodhya and its borders by the following dusk, returns to his chambers only to find Sita tearfully pleading to let her go with him. He relents, and while attempting to leave with her, is stopped by a crowd at the gates of Ayodhya led by General Dheeraj Kumar. He tells Rama that Kaikeyi was being manipulated and that he should not honor the boons, but Rama refuses, saying that regardless of the circumstances, he is dharma-bound to honor his father. Realizing that Rama will not change his decision, Lakshmana makes the decision to come with him. In the palace, Kausalya confronts Kaikeyi, who has assumed regentship of Kosala. She utters a mantra to release Kaikeyi of her curse, and she realizes with horror what she has done. Manthara appears again and threatens to kill Kausalya. She injures her but before she can deliver a killing blow, she is distracted by Bharata, who has returned. With the help of Vashishta, he overheard the entire conversation and decides to execute Manthara. Kausalya asks him to show mercy, and she flees, having lost her powers. Dasaratha, in his final moments, is visited by Kaikeyi. However, before she is able to explain her actions, Dasaratha divorces her by royal decree. In his final moments, Kausalya states that she will return Rama home, and he passes away quietly. Following the Battle of Mithila, Ravana's brother Vibhishana had rescued him and the only survivor of the battle - Jatayu with the aid of the Pushpak Vimana, the royal divine chariot and taken him back to Lanka. The entire city was in shambles, with the few remaining rakshasas catapulted to leaders overnight, belligerently rebellious. Jatayu believes that Ravana is now dead, but Vibhishana knows better... Ravana is briefly revived when Vibhishana is forced to call him and deal with the squabbling chiefs, who all appear to believe that he is dead. He is able to speak to Vibhishana but is unable to do anything because of the energy prison he is trapped in. Vibhishana promises to release him if he swears to forgo any further invasion of the mortal world. Reluctantly, Ravana agrees, but begins to lose his power once again. Vibhishana decides to use the energy of the Narak-portal to destroy the cage around Ravana, but the act closes up the portal for good. Meanwhile, Jatayu, somewhat elated that Ravana is dead, begins to think about performing penance for his misdeeds. He sees a black flag declaring Ravana's death, and follows it, intrigued. He wanders by accident into Kumbhakarna's chambers, and....",0
10539531,The Hosts of Rebecca,Alexander Cordell,UNK,"{""/m/02p0szs"": ""Historical fiction"", ""/m/02xlf"": ""Fiction""}","The plot concerns the Rebecca Riots in the 19th century. The action is seen through the eyes of young Jethro Mortymer.It is based on the true events of the Rebecca Riots in which the people of West Wales protested against the toll gate charges of the business men and land owners of the time. The Rebecca name refers to the leader of the campaign, which was a man dressing in women's attire to protect his identity. On reading the book you understand the reasons for such protests and its manner. The book is a worthy sequel to The Rape of the Fair Country.",0
10540283,Twelve Years a Slave,Solomon Noethup,UNK,UNK,"The book tells how Solomon Northrup, a free carpenter and fiddler, was deceived by two men who originally offered him work as a musician in New York state and Washington, DC; then drugged him, and kidnapped and sold him into slavery while in the nation's capital. Two men presenting themselves as circus promoters offered Northup work as a fiddler, first in New York City and then in Washington, DC. They offered a generous amount of money to work for their circus in the capital and offered to pay for his transportation and a hotel. After they arrived and watched some of President Harrison's funeral procession, Northup was drugged at the hotel room. He was bound and moved to a slave pen owned by James Burch, a slave trader. It was located in the Yellow House, one of several slave markets on the National Mall. This and Robey’s Tavern were located in the area between the present-day buildings housing the Department of Education and the Smithsonian Air and Space Museum, within view of the Capitol. Burch coerced Northup into accepting a new name and past as having been born a slave in Georgia. Burch told Northup that if he were to tell his true story to another person, he would be killed. When he asserted his status as a free man, Burch beat him violently; Northup finally stopped protesting. Northup was transported with other slaves to New Orleans, Louisiana by ship, where he and others contracted smallpox and some slaves died. He asked a sympathetic sailor to get a message to his family, which the man did, but they did not know how to find him in Louisiana. Northup was sold by Burch's partner in New Orleans to a planter on a bayou of the Red River, and had several different owners during his 12 years as a slave in Louisiana. In some places his carpentry and other skills earned him good treatment. The contrast with his previous life made the deprivations and sufferings of slavery worse: the meager slave diet, a cabin with a dirt floor, poor clothing; restrictions on his freedom, and numerous beatings and physical punishment. At one time, he was leased to a man named Tibbets, who lost his temper and attacked him with an axe. Northup fought back and ran back to his old master, who finally took him in. Northup eventually regained his freedom. He met Samuel Bass, a white carpenter from Canada, who was hired by Northup’s owner. Northup learned that Bass did not share the racial prejudice of white men in America, and ultimately confided his story to him, with a letter describing where he was located. Bass delivered the letters to Northup’s wife, who called on Henry Northup, an attorney who was a family friend and son of the man who had held and freed Northup's father. Henry Northup contacted New York state officials and the governor appointed him as an agent, under current state law, to go to Louisiana to free Solomon Northup. Bass and Northup took a great risk in starting this process; when forced to free Northup, his master said he would have killed the man who took his account to the north.",0
10541995,Behind Enemy Lines,John Vornholt,UNK,"{""/m/06n90"": ""Science Fiction"", ""/m/014dfn"": ""Speculative fiction"", ""/m/02xlf"": ""Fiction""}","The book begins with Ro Laren, former Enterprise crew member turned Maquis officer taking command of a ship in the hopes of heading to Federation lines to safety. But they soon run into trouble when they are attacked by Jem'Hadar attack craft. Another Starfleet ship, the Aurora comes to assist, but it is no use. Both ships send distress calls, and one ship comes to their aid: the Enterprise. As this is happening, in a distant galaxy, another former Enterprise crewman witnesses the destruction of a Cardassian mining craft as he is herded onto a Dominion space station. The space station not only houses prisoners of war, but also serves as a base of operations as the Dominion attempts to construct an artificial wormhole. Sam Lavelle finds Taurik, yet another former crewman also being herded into the station up to the male prisoners compound. Upon entering, Sam is berated for agreeing to be the Liaison Officer of their pod, but he is ""rescued"" by the call of the Vorta in command of the station, and upon entering a ball, is confronted by a Founder, with the message that he is to be given command of a ship. On his crew are Taurik, and the mastermind of the whole wormhole operation, Enrak Grof, a Trill who values his work over alliances. The Enterprise enters the battle, and rescues the Bajoran transport, but unfortunately the Aurora is destroyed in the battle. Captain Jean-Luc Picard learns of the wormhole's construction, and prepares to take Laren, Chief Engineer Geordi LaForge, and a small crew in an attempt to destroy it. The crew disembarks, and after some run ins with Cardassians, Jem'Hadar, Ferengi and Romulans, they reach the wormhole, and using a tractor beam, they attempt to send thousands of small asteroids careening into it, but decide to instead destroy the mining craft and apparently halt any chance of completing the wormhole. They prepare to fire, but learn that the craft is actually full of Federation prisoners. They save the prisoners and destroy the craft. But returning home, they learn from Grof that their ship wasn't the only one sent to mine the metal, meaning that the wormhole still could be completed.",0
10547094,Philaster,Francis Beaumont,UNK,UNK,"The play is set in a fictionalized version of the Kingdom of Sicily, ruled by an otherwise-unnamed king. This king's father and predecessor, the ruler of Southern Italy (the Kingdom of Naples), had conquered the island of Sicily and displaced the native royal house; but the heir of that house, and rightful king of Sicily, is Philaster, who lives as a nobleman in the royal court. The king fears him, but cannot kill him, because of the passionate loyalty of the people. The king has a plan, however: with no son of his own, he will marry his daughter Arethusa to a Spanish prince named Pharamond, and make the Spaniard his heir. Arethusa, however, is in love with Philaster, and disdains the Spaniard. Philaster reciprocates the princess's affections, and sends his page Bellario to serve her and to be their intermediary. Arethusa is able to frustrate her father's plan by exposing Pharamond's affair with Megra, a loose gentlewoman of the court; but the Spaniard seeks revenge, by spreading reports that Arethusa is having an affair with Bellario. The passionate Philaster is deceived by the slander, and accepts it as true. During a hunt, Philaster confronts Arethusa; the overwrought protagonist stabs the princess (the incident that gives the play its subtitle). Philaster is interrupted by a passing countryman; they fight, and both men are wounded. Philaster crawls off, and Arethusa is discovered by nobles of the court. Arethusa's and Philaster's wounds are not fatal; both recover. Philaster is found, arrested, and sentenced to death. The king places Philaster in Arethusa's custody; she quickly marries him, which causes the king to decree her death as well. The executions are frustrated when the rebellious citizens capture Pharamond and hold him hostage. The falsehood of Pharamond's accusation against Arethusa is exposed when Bellario is revealed to be a disguised female (she is Eufrasia, a courtier's daughter, infatuated with Philaster). Pharamond retreats to Spain. Since the rightful ruler of Sicily is now the king's son and no alternative presents itself, Philaster is restored to his crown. In creating the play, Beaumont and Fletcher were influenced by the works of Sir Philip Sidney, especially the Arcadia. The play bears relationships with a range of contemporaneous works, including The Faithful Shepherdess and Cymbeline.",0
10550517,Flint the King,Mary Kirchoff,1990-05,"{""/m/014dfn"": ""Speculative fiction"", ""/m/01hmnh"": ""Fantasy"", ""/m/02xlf"": ""Fiction""}","Flint The King is set in the five years before Dragons of Autumn Twilight where the Heroes of the Lance split up and look for signs of gods returning and a new evil stirring in the world. Flint Fireforge returns to his sleepy boyhood village in the foothills near Solace to discover that everything has changed. The village is now prosperous and producing weapons for an unknown buyer. When Flint starts poking around he is discovered and pushed into the ""Beast Pit"" and expected to die. He is rescued by a group of Gully Dwarves who make him their king. Flint struggles to bring the gully dwarves together and form a fighting force so that he can escape and use them to foil the enemies' plans.",0
10550530,The Day of the Djinn Warrior,Philip Kerr,2007,"{""/m/014dfn"": ""Speculative fiction"", ""/m/01hmnh"": ""Fantasy"", ""/m/0dwly"": ""Children's literature""}","Djinn twins, John and Philippa Gaunt, are off on another trip around the world in book four of the bestselling Children of the Lamp series. It's a race against time as the twins attempt to save their mother, Layla Gaunt from her destiny of being Blue Djinn of Babylon, save their father, Edward Gaunt, from an aging curse brought from a binding their mother Layla put on their father to make sure the twins were home with him, and museums worldwide from unexplained robberies and bizarre hauntings. As John and Philippa and their friends travel across the globe on their rescue mission, they notice that something very strange is happening: An evil force has woken the terracotta warriors created by an ancient Chinese emperor, and a spell has been cast possessing the soldiers with wicked spirits. Now, the very fate of the world hangs in the balance. It's up to the twins to solve the mysterious robberies, stop the terracotta warriors, rescue their parents, and save the world before it's too late.",0
10550854,"Tanis, the Shadow Years",Barbara Siegel,1990-11,"{""/m/01hmnh"": ""Fantasy""}","Tanis, the Shadow Years is set in the five years before Dragons of Autumn Twilight where the Heroes of the Lance split up and look for signs of gods returning and a new evil stirring in the world. Tanis leaves Solace with Clotnik after the promise that the dwarven juggler can lead him to his long-lost human father. On the way they are trapped in a grass fire but manage to save themselves and a mage, Kispha. Kispha is injured and dying and offers to help Tanis find his father in the mage's own memory as long as he saves Brandella and bring her back.",0
10555115,Schrödinger's Kitten,George Alec Effinger,UNK,UNK,"The story follows a Middle-Eastern woman, Jehan Fatima Ashûfi, through various realities, ranging from one in which she is raped when still a girl, subsequently abandoned by her family and dies alone, to one in which she is sentenced to death for killing her would-be rapist and being unable to pay the ""blood price"" to his family, and another in which she becomes a physicist and companion to well-known German scientists ranging from Heisenberg to Schrödinger, and subsequently prevents the Nazis from developing nuclear weapons during World War II by simply forwarding ""unintelligible scientific papers"" to key politicians looking into the idea. She is, unusually, aware of the existence of these realities, which she perceives as ""visions"" and assumes might come to her from Allah. Throughout different points in the story, the adult Jehan of some realities struggles to reconcile her religious upbringing and ""visions"" with her scientific profession; in the end, however, an aged Jehan finds satisfaction in the explanation of Hugh Everett's theory regarding the possibility of alternate realities, which fits with her personal experiences.",0
10555897,"100,000,000 Guinea Pigs",Arthur Kallet,UNK,UNK,"The book's key proposition is that a great deal of products sold to the public - particularly pharmaceuticals and food products - are released with little regard or knowledge of how these products adversely impact the consumer. Corporations, often knowingly, release products which either do not do what they purport to, or have dangerous side effects or defects. Furthermore, many officials and government departments, namely the U.S. Food and Drug Administration, have fallen victim to regulatory capture. The book goes on to state that the Pure Food and Drug Act of 1906 is not effective in arresting these trends, and real reform or consumer protection is obstructed by the powerful connections that offending corporations have with the government. ""If the poison is such that it acts slowly and insidiously, perhaps over a long period of years (and several such will be considered in later chapters), then we poor consumers must be test animals all our lives; and when, in the end, the experiment kills us a year or ten years sooner than otherwise we would have died, no conclusions can be drawn and a hundred million others are available for further tests"". The authors develop ideas such as synergy effects, and the precautionary and substitution principles. They claim that many toxic substances, even in low concentrations, can act together to cause much more harmful effects than each substance would individually. Prolonged exposure to low amounts of toxic substances, even at very mild concentrations, can potentially have serious negative health impacts that consumers are not made aware of. These impacts are felt by all consumers because harmful substances are being ingested by consumers due to the use of dangerous pesticides, herbicides and other chemicals in food production. Preservatives are particularly criticized, and the increase in canned or packaged foods in cited as evidence of an increasing risk of such synergy effects due to the high amount of chemical byproducts these products include. The book argues that many products would not be sold if properly labeled, and this has been a key failing of the Food and Drug Administration. Extensive reform and overhaul in government regulation and inspection of the food and drug industry is needed in order to adequately protect consumers from corporations and manufacturers who do not place the health of the consumer before profit. Examples cited include beauty products, which in the first quarter of the 20th century were found to contain arsenic, lead and even radium - the health effects of which were not understood or known to consumers at the time. The true label for a pineapple pie, they argue, would be closer to this: ""corn starch-filled, glucose-sweetened pie with made with sub-standard canned pineapple, artificial (citric acid) lemon flavor and artificial coal tar color"". The book takes particular aim at the pharmaceutical market in the United States during the period, citing extensive lists of drugs which are often the subject of very strong and widespread campaigns of media promotion as &#39;wonder-drugs&#39;, yet which do not have any effect on the conditions they purport to cure, and often carry with them serious side effects that are not revealed to consumers. The authors claim that advertising for these drugs is deliberately misleading and use a variety of dishonest techniques from false testimonials to fake experts. The authors also questioned the value of statements made by scientists who vouched for the safety of products, citing the example of a dean of the College of Pharmacy of Columbia University who had vouched for the safety of a drug that later proved fatal to many. In the final analysis, the authors encourage consumers to be more active and questioning in their purchasing habits. Consumers should be vigilant in finding out more information about products and ingredients, and boycotting products with dangerous ingredients and their producers. They also call for stronger laws, tougher penalties for offending companies, and a much more concerted effort from authorities to implement consumer protection laws. The book concludes with the statement that &#34;Above all, let your voice be heard loudly and often, in protest against indifference, ignorance, and avarice responsible for the uncontrolled adulteration and misrepresentation of foods, drugs, and cosmetics&#34;.",0
10557163,"I Got a ""D"" in Salami",Henry Winkler,2003,"{""/m/0dwly"": ""Children's literature""}","Hank gets his first report card from 4th grade. He goes to his mom's deli to show her. While this is going on, his mom is making a special salami to give to a leader of a supermarket chain. Hank decides to get rid of his report card before his parents see it. He gives it to Robert to destroy. Robert puts it in a batch of salami. Once his mom is done making many batches of the salami, she picks the one with the report card in it. Hank and his friends try to put a stop to the delivery but they don't stop the deliveryman in time. While this is going on Hank figures out he has learning problems. In the end Hank begins eating his sandwich while visiting the Press for the large Supermarket chain and gets a business deal for his mom's deli. pt:I Got a ""D"" in Salami",0
