id,title,author,published_date,categories,summary,page_count
2845808,The Simulacra,Philip K. Dick,1964,"{""/m/06n90"": ""Science Fiction"", ""/m/014dfn"": ""Speculative fiction"", ""/m/02xlf"": ""Fiction""}","Set in the middle of the twenty-first century, The Simulacra is the story of several protagonists within the United States of Europe and America (USEA), formed by the merger of (West) Germany and the United States, where the whole government is a fraud and the President (der Alte, ""the Old Man"") is a simulacrum (android). As well as the USEA, other global superpowers are the French Empire, People's Republic of China and Free (Black) Africa. There is some mention of a World War Three, which may have involved some tactical nuclear weapons, and a possibility that the Soviet Union exists. Communism still exists, but Poland has become its global centre of authority, with its administrative centre now based in Warsaw. Society is stratified into 'Ges' (German Geheimnisträger, ""bearers of the secret"" (the elite)) and 'Bes' (German Befehlsträger, ""implementers of instruction"" (professional and artisanal)) classes, and there is conspicuous consolidation of political and broadcast media power. The Democratic and Republican Parties merged into a single party, the 'Democrat-Republican Party' and the 'United Triadic Network' presumably resulted from an amalgamation of NBC, CBS and ABC. In addition, actual political power has devolved to a permanent First Lady, Nicole Thibodeaux, whose consorts are a series of male presidents – die Alten. While the current der Alte, Rudi Kalbfleisch, is a simulacrum, ""Nicole"" is human, although the original Nicole Thibodeaux died several decades ago. Since the death of the original, her role has been portrayed by four consecutive actors, and the latest such figure is Kate Rupert. This is a Geheimnis (secret), and insider possession of this secret is enough to insure elite membership through conferral of Ges status. A secretive governing council controls the USEA, although 'Karp und Söhne Werke', as manufacturers of the current der Alte-simulacrum, exerts some power. The next simulacrum contract, for Dieter Hogbein, however, will be given to 'Frauenzimmer Associates', and Karp und Söhne is unhappy about this new contractual arrangement. One subplot involves the Karp und Söhne Werke threatened exposure of what has been a state secret over the last five decades. Nicole dislikes Kalbfleisch, although inbuilt obsolescence means that he is about to suffer an obligatory heart attack and he will be replaced in his turn. Kalbfleisch only momentarily appears in this novel. Doctor Egon Superb encounters additional difficulties because A. G. Chemie, the leading USEA psycho-pharmaceutical drug cartel, has engineered the prohibition of psychotherapy under the ""MacPhearson Act."" However, the USEA is willing to let him continue to practice, and treat Richard Kongrosian, a well known pianist who performs in the White House. Richard Kongrosian believes that his body odor is lethal; this belief is delusional, he has no such body odor. Kongrosian has telekinetic abilities: he can play piano using only his mind. Nicole Thibodeaux is anxious to keep his abilities under control, as are Wilder Pembroke, head of the National Police, and members of the covert national governance council. Bertold Goltz (an alleged neofascist) is seemingly trying to overthrow the government, and runs the 'Sons of Job', a religious paramilitary organisation, although he is not what he seems, and is secretly head of the covert USEA governing council. In addition, there is a subplot that involves Charles (Chic) Strikerock, Vince, his brother and a cut-price colonisation spacecraft sales firm (known as ""Loony Lukes"") involved in Martian colonisation. Mars boasts insectoid life, the sentient and empathic 'papoola', while Ganymede is inhabited by multicellular primitive life forms. Nothing is as it seems, and the novel ends inconclusively. The der Alte-simulacrum has been revealed as an android and Kate/Nicole has been disclosed as an impostor- therefore undoing the Geheimnis (secret) raison d'etre for ges/bes class stratification. Bertold Goltz is killed by a National Police detachment, as is the rest of the covert governing council. Using telekinesis, Kongrosian kills Pembroke before he can overthrow Nicole in a coup d'etat and teleports her to safety at his secluded Northern US home. Karp und Sohnen rebel against the abortive coup, however, and soon the National Police and USEA armed forces are engaged in civil war, with active use of low-yield nuclear weapons. Recrudescent Neanderthals (or ""chuppers"") seem happy at this turn of events, as they gather near Kongrosian's home: the imminent self-destruction of Homo sapiens might give them another opportunity to dominate Earth.",0
2846264,HMS Ulysses,Alistair MacLean,1955,"{""/m/02p0szs"": ""Historical fiction"", ""/m/05hgj"": ""Novel""}","The novel features HMS Ulysses, a light cruiser that is extremely well armed and among the fastest ships in the world. (Ulysses is similar to the real Dido-class cruisers. MacLean had served in of that class.) Her crew is pushed well beyond the limits of endurance and the book starts in the aftermath of a mutiny. Ulysses puts to sea again to escort FR-77, a vital convoy heading for Murmansk. (The fictitious convoy FR-77 is based on the ill-fated convoy PQ-17.) They are beset by numerous challenges: an unusually fierce Arctic storm, German ships and U-boats, as well as air attacks. All slowly reduce the convoy from 32 ships to only five. The Ulysses' is sunk in a failed attempt to ram a German cruiser after all her other weapons had been destroyed. This echoes events in which British G-class destroyer and HMS Jervis Bay, an armed merchant cruiser, sacrificed themselves by engaging larger opponents. The book uses a set of events to paint moving portrayals of the crew and the human aspects of the war. His heroes are not especially motivated by ideals, they rarely excel at more than one task and they are outfoxed by a respectable enemy. It is only their resilience, as they redefine the word, that pushes this bunch of seamen to genuine acts of heroism. The realism of the descriptions, the believable motivations of the characters and the simplicity of the line of events make the story all the more credible, though the number of coincidental accidents that plague the crew are startling, robbing them of any real victory.",0
2846537,Tunnel Through the Deeps,Harry Harrison,1972,"{""/m/0mz2"": ""Alternate history"", ""/m/06n90"": ""Science Fiction"", ""/m/014dfn"": ""Speculative fiction""}","In an alternative history, the United States lost the American Revolutionary War, George Washington was shot as a traitor, and America is still, in 1973, under the control of the British Empire. The divergence point between this world and our own occurred far earlier, however, when the Moors won the battle of Navas de Tolosa on the Iberian peninsula, on July 16, 1212. Thus it was that Spain was unable to become unified, owing to the survival of an Islamic presence in its territory, and therefore could not finance the expedition of Christopher Columbus in 1492. Instead, it was John Cabot who discovered America, just a few years later. The protagonist, Captain Augustine Washington, is a direct descendant of George Washington, and labors in his 'traitorous' shadow. Captain Washington and Sir Isambard Brassey-Brunel (descendant of Isambard Kingdom Brunel) get together to link the heart of the British Empire with its far-flung Atlantic colony in North America, although they fall out over Augustine's wooing of Isabard's young daughter, Iris, and as a result of disputes over engineering techniques. However, the two are reconciled on Sir Isambard's deathbed, and the lovers later marry. Detective Richard Tracy also makes an appearance, as do 'Lord' Amis and 'Reverend' Aldiss.",0
2846549,Herr Lehmann,Sven Regener,2001,UNK,"Frank Lehmann will soon turn 30 years old which is why all his friends tease him by calling him by his last name, Herr Lehmann. He works in a bar in Kreuzberg and drinks a lot of beer. Episodes in the story include his daily life in Kreuzberg; his parents' visit to Berlin; his love affair with Katrin, the beautiful cook; taking care of his best friend Karl, who slowly goes insane; and the fall of the Berlin Wall.",0
2847098,Two Steps From Heaven,Mikhail Evstafiev,UNK,UNK,"The events of the novel take place in the mid-1980s during the Soviet invasion of Afghanistan and soon after the troop withdrawal, back in the then Soviet Union. It is a stirring account of the trials of Lieutenant Oleg Sharagin, a platoon commander in the elite Soviet airborne forces, his fellow officers and soldiers. It also portrays the ordinary Afghans who suffered enormously under the Soviet occupation. Sharagin survives many combat operations but is critically wounded just a few months before the end of his tour of duty when his platoon is ambushed in the course of a major offensive against the Mujahideen. He is evacuated to a hospital in Kabul, undergoes surgery, and finally finds himself reunited with his family. But back home he realizes his military career is over. The war haunts Sharagin and the pain caused by the wound turns his life into a nightmare, leading to a dramatic finale. The novel is a good example of Russian ""accurate fiction."" It puts a human face on the Soviet soldier without sparing the gory details, like the hard to comprehend top-down authority and license for physical punishment and humiliation within the Russian army, the mental suffering which young soldiers and officers endured during their catastrophic experience in Afghanistan, or the gruesome killings of innocent Afghan civilians. The novel first came out in Russian in 1997 in an abridged version. In 2006, it was published by Eksmo, one of the largest publishing houses in Russia. The Russian and English versions can also be found on ""Art of War"" http://artofwar.ru/e/english/, a project dedicated to the soldiers of the recent wars, which was created in 1998 by Afghan war veteran Vladimir Grigoriev. It features short stories, novels, poetry and essays by veterans of the wars in Afghanistan and Chechnya, as well as in the Middle East, Nagorno-Karabakh, Yugoslavia and contributions from veterans of the Vietnam and Korea wars. ru:В двух шагах от рая (роман)",0
2847572,And Having Writ…,Donald R. Bensen,1978,"{""/m/0mz2"": ""Alternate history"", ""/m/06n90"": ""Science Fiction"", ""/m/014dfn"": ""Speculative fiction""}","According to the novel, the Siberian explosion was originally caused by the crash landing of the spaceship Wanderer. In this alternate reality, however, the alien astronauts are able to commandeer their failing vessel so that it lands in the Pacific Ocean, just outside of San Francisco. Shortly after landing, the quartet of spacemen are rescued from the sea by an American ship and taken to California. The Wanderer sinks into the ocean, and the team reasons that they must find a way to accelerate Earth’s technological advances so that they can get back home. The eventual conclusion they arrive at is that they must provoke the planet into what Ari says as an inevitable global conflict, one that, through weaponry innovations, will result in boom of new science and industry.",0
2848492,Space Opera,Jack Vance,UNK,"{""/m/06n90"": ""Science Fiction"", ""/m/014dfn"": ""Speculative fiction"", ""/m/02xlf"": ""Fiction""}","On Earth, audiences are entranced by the musical entertainments staged by an alien troupe, the Ninth Company of the planet Rlaru. Dame Isabel Grayce (one of a long line of formidable society matrons in Vance’s works) has sponsored the entertainments; when the Ninth Company disappears without a trace, she proposes to recoup her losses and bring culture to the wastes of space by forming an opera company which Adolph Gondar (the discoverer of Rlaru) will pilot on a tour of suitable planets, with Rlaru as ultimate destination. Singers, orchestra, a British conductor (Sir Henry Rixon) are engaged; an argumentative critic, Bernard Bickel, who thinks the Ninth Company were fakes, is hired as musical consultant. Dame Isabel’s indolent and aptly named nephew Roger Wool (one of a long line of Vancian put-upon nephews) tags along also, smuggling his new girlfriend Madoc Roswyn, who claims to be a simple girl from Merioneth in Wales, aboard the ship as a stowaway. Like many of Vance’s works, the novel is a picaresque; Gondar has his own reasons for not returning to Rlaru, and diverts the company half way round the galaxy, with various adventures or humiliations occurring on the different planets they touch down on. (There are some similarities with Vance’s later novel Showboat World, which has a travelling company presenting performances of Shakespeare’s Macbeth to generally uncomprehending audiences along an immense river on a distant planet.) Over the course of the voyage, the company stages several celebrated works, such as Beethoven’s Fidelio, Mozart’s The Magic Flute and Così fan tutte, Rossini’s The Barber of Seville, and Wagner’s Tristan und Isolde and Flying Dutchman. These are performed before various human or non-human audiences, the libretti and costumes sometimes having to be adapted to become understandable to alien cultures. On the whole, due to such cultural disparities, their reception is far from that expected by Dame Isabel: on a penal colony planet, for instance, the performances are made the cover for a jail-break; on a planet inhabited by a race priding themselves on their musical talents, the productions are vetted by an artistic inspector and the company is fined for every unresolved dissonance in the scores performed; on still another, the performance is mistaken for a trade exhibition and the aliens attempt to buy some of the singers. While Gondar is confined to his cabin, apparently insane, Madoc Roswyn induces his deputy to take the ship to the distant planet Yan. It emerges that her remote ancestors inhabited a land now sunk beneath the Bay of Biscay whose people had colonized that planet and there developed a high civilization. (Here we detect the germ of Vance’s later major fantasy trilogy Lyonesse, the heroine of whose third volume is named Madouc.) A group had returned to Earth thousands of years later, but their spacecraft was destroyed and they were forced to settle in Wales, ever intending to return to Yan. Madoc is their last descendant. She is disappointed by what she finds: Yan’s cities are dust and its folk have reverted to barbarism, hiding in the forests. Although the company present Debussy's Pelléas to try to establish communication with the unseen inhabitants, they barely escape with their lives. Eventually the voyage ends at Rlaru. It turns out that Gondar had abducted the Ninth Company from the planet; he is suitably punished by the natives, who demonstrate a capacity to creatively manipulate illusion and environment far beyond anything their Earth visitors can achieve. They listen to several operas with mounting boredom, but are utterly entranced by an impromptu washboard jazz band formed by some members of the crew, which has been a source of annoyance to the opera-lovers throughout the voyage. (Vance was at one time a jazz musician.) Dame Isabel returns to Earth, chastened but determined not to admit it; Roger marries Madoc Roswyn and begins writing a book describing the voyage.",0
2849115,In the Wet,Nevil Shute,UNK,"{""/m/014dfn"": ""Speculative fiction"", ""/m/02xlf"": ""Fiction""}","The story is opened by its initial narrator - an Anglican priest named Roger Hargreaves - who describes his ordinary circumstances in a large parish of the Australian outback in 1953. As part of his duties, he has to minister the dying and this brings him into contact with an aged, alcoholic, opium smoking, diseased, ex-pilot and ex-ringer named Stevie. Caught in Stevie's squalid cabin in a heavy rainy season, Hargreaves struggles with recurring malaria whilst on deathwatch for Stevie. As both men are in altered mental states the story shifts and Stevie becomes David 'Nigger' Anderson, a decorated member of the Royal Australian Air Force, telling his story to Hargreaves. But this is a story yet to happen - in 1983, to be exact. 'Nigger' (the name is used quite unselfconsciously and in a manner which may make the modern reader uncomfortable) is a quadroon, of mixed European and Aboriginal ancestry. As a first rate pilot he is chosen by his country to be a member of an elite test pilot team in the UK. Although of humble origins, Nigger has advanced quickly in the RAAF and is soon offered a position commanding one of two aircraft of the Queen's Flight. The England of the 1983 in the story is a technically advanced country that has been abused and bled dry by Socialism. Austerity is the watchword, and rationing is still in force. It is an England in which the Royal Family is both revered, and abused - revered by the common people, and abused by politicians who use them as whipping boys for the economic woes of England. When the politicians attempt to control the foreign travel of the monarch by curtailing her use of government aircraft, the Canadian and Australian governments each donate a modern jet transport to the Queen's Flight, provide for operating expenses, and furnish crews. Nigger is chosen as the captain of the Australian plane. Both Canada and Australia are heavily royalist countries, and Nigger is shocked at one point by the suggestion that Australia could become a republic. Both are democracies, though subject to the ""multiple vote""--everyone gets one vote, but other votes can be earned by individuals, up to a maximum of seven. Nigger himself has three votes in Australian elections. At first absorbed by the job, Nigger slowly becomes aware of what is going on around him. He sees the Secretary of State for Air, Lord Coles, inspect the advanced aircraft, and insist that a signal gun be placed in the radio-equipped aircraft in case it needs to land in a field. The Prime Minister, Iorweth Jones, is more intelligent, but only interested in scoring political points. The Royal family, though, is delighted at the gift of the aircraft, and the middle-aged Queen and Consort come down to inspect them. Nigger repeatedly meets, and slowly falls for, a junior secretary to the Queen, Rosemary, daughter of an Oxford don, who is assigned to help streamline the administrative aspects of the Commonwealth aircraft joining the Queen's Flight. Nigger learns of the difficult political situation the Queen is faced with. The Queen's visit to Canada in the Canadian craft coincides with another attack on the Royal Family by Labour politicians. The Prince of Wales has Nigger fly him to Ottawa so he can meet with the Queen. It is later made clear that the Prince carries an ultimatum from himself and his sister (the Queen has only two children)--they will not take the job of monarch as it now stands. Nigger is ordered to fly the Queen and her entourage, including Rosemary not back to England, but on to Australia to meet with politicians there. En route, they have a lengthy refueling delay on Christmas Island, allowing the Queen to relax a bit—until local officials show up with their wives, in formal dress. Nigger, struck with food poisoning, dreams of the scene with Hargreaves and Stevie in the cabin in the wet. After he recovers, the party move on to Australia. The Queen meets not only with current Australian politicians but with elder statesmen Sir Robert Menzies and Arthur Calwell. After the meetings, the Queen is flown back to England but ground control diverts the flight hundreds of miles to Yorkshire on the pretext that the Australian airmen are not qualified to land at a commercial airport - Heathrow - in poor weather. In reality the Australian and Canadian crews which have been trained by BOAC are well qualified to make the landing and the diversion to Yorkshire is apparently for no other purpose than to cause the Queen inconvenience. After Royal intervention the crews are all granted accreditation as civil aviators without further ado. Nigger asks Rosemary to marry him, but she refuses so long as the Queen needs her. Rosemary arranges for Nigger to meet her father, a political scientist, who inadvertently spills the beans of what the Queen is contemplating doing to make the monarchy bearable for her and her family—Britain is to have a Governor General who will deal with the politicians, while the monarch devotes herself to Commonwealth affairs. The Queen announces this on her Christmas broadcast, and makes it clear that she and her family will not return to Britain without the country having undergone political reforms, meaning the multiple vote. Though David takes every precaution to protect the aircraft, which takes off with the Queen soon afterwards, a sixth sense, deriving from his Aboriginal heritage, tells him something is wrong. He searches the party's luggage, and finds a sealed metal box, obviously a bomb. It seems impossible to get the box outside due to winds, but through skilled flying, he is able to create the right conditions. The Queen swears all to secrecy, and awards David the Seventh Vote, given only by Royal commission. The party makes it to Australia safely. Meanwhile, in Britain, the new Governor General has summoned Parliament to debate the multiple vote. Prime Minister Jones' government falls, and a new government, still Labour, is expected to institute the political reform. Now that the Queen is no longer in a crisis situation, Rosemary can leave the royal employment and marry David. In an epilogue, the framing story resumes. Stevie has died peaceably and an exhausted Hargreaves tries to separate dream from reality. This becomes more difficult when the child who will grow to be Nigger is presented to him for christening.",0
