id,title,author,published_date,categories,summary,page_count
1473955,The Kraken Wakes,John Wyndham,UNK,"{""/m/06n90"": ""Science Fiction"", ""/m/014dfn"": ""Speculative fiction"", ""/m/01hmnh"": ""Fantasy""}","The novel describes escalating phases of what appears to be an invasion of Earth by never-seen aliens, as told through the eyes of Mike Watson, who works for the English Broadcasting Company with his wife and co-reporter Phyllis. A major role is also played by Professor Alastair Bocker – more clear-minded and far-sighted about the developing crisis than everybody else, but with the habit of telling brutally unvarnished and unwanted truths. Mike and Phyllis are witness to several major events of the invasion, which proceeds in a series of drawn-out phases; it in fact takes years before the bulk of humanity even realize that their world has been invaded. In the first phase, objects from outer space land in the oceans. Mike and Phyllis happen to see five of the ""meteors"" falling into the sea, from the ship where they are sailing on their honeymoon. Eventually the distribution of the objects' landing points – always at ocean deeps, never on land – implies intelligence. The aliens are speculated to come from a gas giant, and thus can only survive under conditions of extreme pressures in which humans would be instantly crushed. The deepest parts of the oceans are the only parts of Earth in any way useful to them, and they presumably have no need or use for the dry land or even the shallower parts of the seas. In theory, the two species could have co-existed indefinitely, hardly noticing each other's presence. Humanity nevertheless feels threatened by this new phenomenon – particularly since the newcomers show signs of intensive work to adapt the ocean deeps to their needs. A British bathysphere is sent down to investigate, and is destroyed by the aliens. The British government responds by exploding a nuclear device on the spot. As it turns out, the aliens have more means of getting at the humans than the other way around; a similar American attempt ends in disaster. Moreover, humanity is not united in the face of the mounting threat – the Cold War between West and East is well under way, with the two sides often suspiciously attributing the effects of the alien attacks to their human opponents, to the point the invasion threatens to trigger a nuclear exchange. Phase two of the war starts when ships all over the globe begin to be attacked by unknown weapons and are rapidly sunk, causing havoc to the world economy. Shortly after, the aliens also start 'harvesting' the land by sending up biological 'sea tanks' which capture humans from seaside settlements, for reasons that are never made clear; the Watsons witness one of these assaults on a Caribbean island. These attacks are eventually met with enough retaliation from the various human militaries that ""...their percentage of losses mounted and their returns diminished"". And so, in the final phase, the aliens begin melting the polar ice caps, causing sea levels to rise. London and other ports are inexorably flooded (the government relocates to Harrogate), causing widespread social and political collapse. The Watsons cover the ongoing story for the EBC until the radio (and organized social and political life in general) cease to exist whereupon they can only try to survive and escape a now-flooded London. At the end, scientists in Japan develop an underwater ultrasonic weapon that kills the aliens. However, the global population has been reduced to between a fifth and an eighth of its pre-invasion level, and the world's climate has been unalterably changed. As stated by the protagonist in the book itself, the book aims to demonstrate that an alien invasion of Earth could take a very different form from that in ""The War of The Worlds""; publication of the book coincided with the release of 1953 film ""The War of the Worlds"", an adaptation of H.G. Wells' classic work which at the time got considerable attention in the general public and among SF fans in particular.",0
1475010,Aristoi,Walter Jon Williams,1992,"{""/m/06n90"": ""Science Fiction"", ""/m/014dfn"": ""Speculative fiction""}","Gabriel, a minor Aristos, runs a group of planets containing societies devoted to artistic pursuits, assisted by his several daimones, each of whom has his or her own personality and special area of interest. Attending oneirochronon parties and composing operas, having sex with both men and women (at one point, he has sex with two women at once -- one in physical reality, one in the oneirochronon) he seems to live a leisurely, decadent life. An elder Ariste, Cressida, warns Gabriel that something is up in a nearby solar system. There appear to be some extra planets in an area which astronomical surveys had said contained none. Cressida is murdered before she can explain more but Gabriel begins to suspect that Saito, the Aritos whose domain is closest to the mystery solar system, is using it for some undisclosed purpose. Gabriel and some of his advisers leave on a secret mission to the mystery solar system. When they arrive there they discover a horrifying truth: the planets contain life, human life. The most advanced of the planets contains a society similar in nature and technological development to Renaissance Europe. The people here have been left without the guidance and control of an Aristos and are mired in constant warfare and squalor, perishing of diseases which modern technology can easily cure. Someone, presumably Saito, has created human life here and consigned it to perpetual suffering for some unknown reason. Horrified by the suffering they see, Gabriel and some of his companions travel down to the planet to investigate. Posing as visitors from a distant country they identify a local nobleman who they believe to be Saito and arrange a confrontation. While they are waiting for their chance to assassinate Saito they see their spaceship, which had been orbiting the planet, destroyed. Their assassination attempt fails when they realize that the nobleman is actually an artificial lifeform. Gabriel and his companions are captured and imprisoned. It is then that Gabriel is confronted with the truth: the mastermind behind this horrifying experiment is not Saito, but Captain Yuan, the architect of the current galactic civilization who had long been presumed dead. Yuan explains his motives behind creating new life: the galactic society of the Logarchy has become staid and stultifying. Protected from any danger, the people have stopped improving and have become slaves of the Aristoi. He created this new solar system and the life within it in order to give a new start to humanity and create a society free from the restrictions of the Logarchy. Yuan, Saito, and Zhenling, an Ariste who Gabriel had considered an ally and even taken as a lover, then begin a brainwashing program on Gabriel, eventually breaking his will and convincing him to help them with minor duties on their project. However, their plan is foiled when a previously hidden sub personality of Gabriel, that he dubs The Voice, uses his computer privileges to escape. Gabriel manages to defeat Saito and escape along with his friends. He informs the rest of the Logarchy about what has happened and rallies them to a war footing. The Logarchy's forces swarm into the new solar system to provide humanitarian relief and begin to integrate the societies into the galactic society. As Yuan's secrets are revealed it is also discovered that he had tampered with the examination process which forms the backbone of the Logarchy, promoting people to Aristoi who he believed could help him and keeping others back. Captain Yuan himself has escaped to parts unknown and Gabriel makes it his life's mission to track him down and bring him to justice. As he does so he is warned by Zhenling, now imprisoned, that in doing so he will only fulfill Yuan's plan to shake up the galactic status quo.",0
1475691,The Prometheus Deception,Robert Ludlum,2000-10-31,"{""/m/02n4kr"": ""Mystery"", ""/m/06wkf"": ""Spy fiction"", ""/m/02xlf"": ""Fiction"", ""/m/0c3351"": ""Suspense""}","The story begins with the protagonist, under the alias the Technician, who is in deep cover to stop the Hezbollah terrorist organization from overthrowing the government of Tunisia. The operation appears to be going well, until the terrorists discover that the weapons the Technician has supplied them are defective. Before the ensuing battle is over, though, Abu (the leader of the terrorist agency) manages to stab him in the abdomen. He is helicoptered out, and we next find him entering the headquarters of the Directorate. We meet his boss, Ted Waller, a lover of puzzles. Waller fires Bryson from the Directorate, saying he's lost his touch; Bryson is now told to live as a professor of Byzantine history under the alias of Jonas Barett. After some initial drunkenness and a search for oblivion because his wife, Elena, has left him, he agrees to take the job. He lives under this alias for 5 years and becomes a popular professor, until the Deputy Director of Central Intelligence at the CIA, Harry Dunne, confronts him with a shocking revelation. We learn that the Directorate is really a Russian intelligence operation created by GRU masterminds: essentially a penetration operation on American soil. He learns that his boss is really Gennady Rosovsky, who assumed the name of Ted Waller after the English poet Edmund Waller. Dunne says that Bryson's entire life, including his parents' death, was engineered by the Directorate to lead him to be a part of the agency. Every mission Bryson has undertaken was designed to hurt American interests, which horrifies him. Bryson is convinced to go after the Directorate and infiltrates a weapons tanker to find out what they're doing with weapons they're amassing. There he meets Layla, and after blowing up the tanker and amassing an arsenal, he continues to search for the Directorate; however, it seems that everywhere he goes there is a terrorist attack that follows. He pursues the trail of his former contacts with the Directorate. He meets with a former colleague, Jan Vansina, only to have Vansina killed before his eyes. At another point, when he is about to be shot by a former enemy, he is saved by Waller, who explains that Harry Dunne is really a part of Prometheus, an organization of business executives and powerful politicians around the world. The members of Prometheus are pushing the Treaty on Surveillance, which would allow for an international super-FBI, and their own Richard Lanchester (a former businessman turned politician) would be at the head. The implication is that this organization, because its members own information companies would then be able to monitor everything that went on in the world, and thereby control it. The Directorate's headquarters are destroyed, and he and his wife, Elena, united again, barely escape. He learns that money is being wired to members of the organization through a bank owned by Meredith Waterman, a respected bank. He goes to the bank headquarters and sneaks into their archives. There he learns of a business choice that forced the company to be sold to a certain Gregson Manning, the CEO of the world's largest company, Systematix, which owns health insurance companies, satellites, software, and thus many ways to get information on people. Manning, of course, is a member of Prometheus. Now, Bryson and Elena must infiltrate Manning's mansion to crash the meeting of Prometheus's leaders, days before they assume control. However, he finds Ted Waller at the mansion, escaped from the Directorate's destruction and a double agent. He is surrounded and about to be executed when a machine he's purchased, a virtual cathode oscillator, destroys the machinery in Manning's home and disables all the ""smart guns"" that are trained on him. Most of the guests in the mansion are trapped and killed, seemingly ending the Prometheus Group. Nick and Elena quietly move to a tropical location somewhat assured to be isolated and away from any monitoring devices. Their peace is interrupted when Waller taps into their satellite TV, and promises that they will meet again.",0
1476205,Loamhedge,Brian Jacques,2003,"{""/m/0dwly"": ""Children's literature"", ""/m/01hmnh"": ""Fantasy"", ""/m/014dfn"": ""Speculative fiction"", ""/m/02xlf"": ""Fiction""}","One day while Abruc the otter and his son Stugg are out foraging for food, they find the bodies of two badgers; an old one, dead, and a giant one who is barely clinging to life. The otters take the giant back to their colony, where he is revived and reveals himself to be called Lonna Bowstripe. He is told that his attacker was most likely the pirate Raga Bol, whose ship has been lost, and his crew of sea-rats, who are moving inland. Lonna vows to hunt down and kill the entire crew. Armed with his bow and arrows, he sets out to exact his revenge. Meanwhile at Redwall Abbey, there is a young hare maid named Martha Braebuck, who is totally incapable of walking, thus restricting her to a wheelchair. She is wheeled around by her hyperactive brother Hortwill Braebuck (Horty) and his friends, Springald and Fenna. While napping in front of the tapestry of Martin the Warrior, Martin and Sister Amyl appear to Martha in a dream, and she is told that the secret to make her able to walk can be found within the ancient walls of Loamhedge Abbey and that two individuals are coming that can help her. As it so happens, the two in question are Bragoon and Sarobando, two lifelong friends who ran away from the Abbey as Dibbuns. They survive by tricking small vermin bands and taking their food. This time, it's the gang of the weasel Burrad, whose numbers are at about 13. After Bragoon enters the camp (and Skrodd accidentally kills Burrad) they tell the gang that they must leave Mossflower Woods and never return. Skrodd has other plans, however, and convinces the gang to head to Redwall, where there is a rumor of a magical sword. One night, Skrodd gets killed by the rat Dargle, who gets decapitated during Skrodd's death throes. The bodies are discovered by a young fox named Little Redd (Later named Badredd), who convinces the gang he was the one who had killed Dargle. They continue on to Redwall, though no one really takes the fox seriously. Bragoon and Sarobando arrive at the Abbey during the Summer festival and are told Martha's sad story and where the cure can be found. They decide to set out to Loamhedge, but not before Horty's group asks if they can go too. When Abbot Carrul refuses, the trio create a distraction and escape the Abbey. Though they wind up being captured by Darrats, they are rescued by Bragoon and Saro, who are not too entirely pleased to see them. Since they are already fairly far from the Abbey and could risk recapture, however, they are allowed to join the quest. Meanwhile, Badredd's group has arrived at Redwall and hold it under siege by slipping in through the east wall gate. Realizing he could do with some more troops, Badredd sends Flinky and Crinktail out to recruit some new vermin. The two stoats unwittingly run into Raga Bol and his crew, who take over management of besieging the Abbey. Elsewhere, the group of questers scale the tall cliffs leading to Loamhedge and enter a cave to avoid the rain. There they find Lonna and exchange stories. Lonna encounters Martin the Warrior's spirit during the night, telling him the whereabouts of Raga Bol. Lonna sets out, and the gang from Redwall continue up the cliff face and keep walking to the ancient Abbey. At Redwall, Raga Bol continues to try to break into the Abbey. After an escapade of using a ladder to scale one of the windows, one sea rat manages to enter the Abbey and is about to kill Carrul when Martha suddenly lunges out of her chair and pushes him away, realizing she now has the ability to stand and all she needed was will power. Badredd's group managed to escape the Abbey during the battle, and Bol sends a rat named Blowfly after them. Instead of finding the escapees, Blowfly encounters Lonna, who asks him where the Abbey is and then kills him. When Lonna arrives at Redwall, he manages to kill many sea rats, and due to the efforts of the now mobile Martha, gets inside of the main building and is able to snipe out the crew from there. In a last-ditch attempt to kill the badger, Raga Bol tricks Lonna into coming out to the open where a group of spear chuckers wait to slay him. Things go wrong when Lonna seizes Bol and uses him as a living shield against the spears. Then he goes on a rampage and kills every last rat. In the meantime, the five travelers find a stream but get ambushed by reptiles. Fortunately, Sarobando sneaks out and gets Log-a-log Briggy to help them get out of the ambush. They soon get into another wasteland and get lost. When Horty finds a dormouse named Toobledum and his pet lizard Bubbub, Toobledum shows them the way to Loamhedge. The expedition to find Loamhedge has finally arrived at the dead Abbey, but all the things in Abbess Sylvaticus' grave have rotted away to nothing or turned into dust. Rather than return empty pawed, Bragoon and Saro tell the young ones to wait outside while they write their own cure, essentially saying that one just needs faith in oneself. On the way back, the group encounters the Abyss and are attacked by Kharanjul the Wearet. In an attempt to allow Horty, Fenna, and Springald to get to safety, Sarobando and Bragoon hold off the oncoming forces, eventually pushing the bridge over the edge of the abyss. Though they won the battle, the duo is badly injured, and they die shortly after. Ten seasons after they return to the Abbey, we find that Springald has become Abbey Recorder, Fenna has become Abbess, Horty has joined the Long Patrol at Salamandastron, adding the nom de guerre 'Longblade' to his name, Lonna has become ruler of Salamandastron, and Martha sings and dances on the walls every season in memory of the two who left to try to find her a cure.",0
1476686,The Castle of Iron,Fletcher Pratt,1950,"{""/m/014dfn"": ""Speculative fiction"", ""/m/01hmnh"": ""Fantasy""}","In the wake of the events of The Mathematics of Magic, Harold Shea and his lady love Belphebe of Faerie have married and settled happily into a mundane earthly existence. But after Belphebe disappears at a picnic, Shea is questioned by the police on suspicion of foul play. The authorities also question his work colleagues at the Garaden Institute, Walter Bayard and Vaclav Polacek, and then decide to take in the three of them for further interrogation. At that point the whole group, including police officer Pete Brodsky, are spirited away to another world, that of the Xanadu which is the subject of Samuel Taylor Coleridge's poem Kubla Khan. After they have all languished there for a time, Shea and Polacek are pulled away from this world as well and into that represented by Ludovico Ariosto's epic, the Orlando Furioso. The person responsible for their plight turns out to be Reed Chalmers, aspiring magician and former head of the Garaden Institute, who had accompanied Shea to Faerie in his previous adventure. He had been attempting to retrieve Shea alone, but had erroneously pulled in Belphebe first, and then misplaced his three colleagues and the police officer before at last getting things (nearly) right. Aside, that is, from getting Polacek too and leaving Bayard and Brodsky stranded in Xanadu. Moreover, as Ariosto's epic was a source text for Edmund Spenser's The Faerie Queen, Belphebe's mind has become confused, reverting in accord with the setting to that of her Furioso prototype, Belphagor. As a result, she now believes herself a native of the world into which they have been plunged, no longer recognizing Shea as her husband! Chalmer's goal was to seek Shea's assistance in transforming his own love, the lady Florimel, a human simulacrum magically made of snow, into a real person. It was also to that end that he himself had come to this world, where he is now the guest of the wizard Atlantès de Carena in the latter's marvelous iron castle in northern Spain. The world of the Furioso is based on Carolingian legend, and the Moorish Spain in which the extradimensional travelers find themselves is in the midst of a conflict with the Frankish empire of Charlemagne and his paladins. Somehow they must manage to negotiate their way through the delicate international politics, tiptoe around the treacherous Atlantès, achieve Chalmers' ambitions for Florimel, restore Belphebe's sanity — and survive! Beyond that there are still Bayard and Brodsky to rescue, though those are tasks for later tales...",0
1478845,"Repent, Harlequin! Said the Ticktockman",Harlan Ellison,1965-12,"{""/m/02xlf"": ""Fiction""}","The story opens with a passage from Civil Disobedience by Henry David Thoreau. The story is a satirical look at a dystopian future in which time is strictly regulated and everyone must do everything according to an extremely precise time schedule. In this future, being late is not merely an inconvenience, but a crime. The crime carries a hefty penalty in that a proportionate amount of time is ""revoked"" from one's life. The ultimate consequence is to run out of time and be ""turned off"". This is done by the Master Timekeeper, or ""Ticktockman"", who utilizes a device called a ""cardioplate"" to stop a person's heart once his time has run out. The story focuses on a man named Everett C. Marm who, disguised as the anarchical Harlequin, engages in whimsical rebellion against the Ticktockman. Everett is in a relationship with a girl named pretty Alice, who is exasperated by the fact that he is never on time. The Harlequin disrupts the carefully kept schedule of his society with methods such as distracting factory workers from their tasks by showering them with thousands of multicolored jelly beans or simply using a bullhorn to publicly encourage people to ignore their schedules, forcing the Ticktockman to pull people off their normal jobs to hunt for him. Eventually, the Harlequin is captured. The Ticktockman tells him that pretty Alice has betrayed him, wanting to return to the punctual society everyone else lives in. The Harlequin sneers at the Ticktockman's command for him to repent. The Ticktockman decides not to stop the Harlequin's heart, and instead sends him to a place called Coventry, where he is converted in a manner similar to how Winston Smith is converted in George Orwell's Nineteen Eighty-Four. The brainwashed Harlequin reappears in public and announces that he was wrong before, and that it is always good to be on time. At the end, one of the Ticktockman's subordinates tells the Ticktockman that he is three minutes behind schedule. The Ticktockman walks away to his office ""going mrmee, mrmee, mrmee, mrmee"".",0
1478917,Esther: A Novel,UNK,UNK,UNK,"The comic story deals with a young, freethinking socialite who falls desperately in love with an Episcopal minister. The result is a clash of intellects, a confrontation between faith and reason and a battle of the sexes.",0
