id,title,author,published_date,categories,summary,page_count
24073162,An Imaginative Experience,Mary Wesley,1994,"{""/m/05hgj"": ""Novel""}","Julia Piper lives alone in her London apartment after having lost her son and husband in a car crash. Julia's relationship with her mother is not a loving one. Her mother blames Julia for the accident, and Julia blames herself. Unwilling and unable to confide in anyone about her feelings Julia keeps to herself and distances herself from her surroundings. Julia makes a living as a cleaning lady and one of her clients is Sylvester Wykes, publisher and divorcee. When they eventually meet, Sylvester immediately is fascinated by the young and unapproachable woman. But, haunted by guilt and self-reproach, Julia is not interested in entering into a relationship with Sylvester. Instead, unable to talk to anyone about her loss, Julia keeps her feelings to herself and becomes increasingly reserved and isolated. In addition to her grief, Julia is being stalked. Ever since the funeral she has been terrorized by a stranger who keeps following her and makes phone calls late at night, pushing her closer to the edge.",0
24085138,Three Dollars,Elliot Perlman,1998,"{""/m/05hgj"": ""Novel""}","The novel is set in Melbourne. The first-person narrator, Eddie Harnovey, is a Chemical Engineer, married to Tanya, an aspiring but ultimately uncontracted Political Science academic. Eddie is from middle class origins, his father being a clerk for a local council. His childhood friend Amanda, however, was a class above them. As a Chemical Engineer, her father wore starched cotton shirts while Eddie's father wore drip-dry poly-cotton shirts. Amanda's family banned Eddie from meeting her. Nevertheless, Eddie meets Amanda every nine and half years. The next time is as undergraduates, where Eddie notices her in a queue for more fashionable food than he is in the queue for. The next time is as fellow shoppers in a department store, as Eddie looks for formal wear for his marriage to Tanya. The next time he meets her is in much straitened circumstances. Downsized, jobless, and with only three dollars in his bank account, Eddie skips an appointment with Amanda - now an employment consultant - and ends up beaten unconscious protecting a friend of a now indigent man Eddie befriended while still solvent. Eddie's report on Amanda's father's smelter expansion was the reason Eddie was downsized. Amanda identifies Eddie from the appointment card he had in his shirt pocket.",0
24089712,Saint Peter's Fair,Edith Pargeter,1981-05,"{""/m/0lsxr"": ""Crime Fiction"", ""/m/0py65"": ""Historical whodunnit""}","13 June 1139. The feast of Saint Peter is important for Shrewsbury Abbey. A meeting of the monks is interrupted by Geoffrey Corviser, the town provost, and a delegation from the town's merchant guilds. They appeal to Abbot Radulfus for a share of the money raised by the fair as the civil war has taken a heavy toll on the town, parts of which need rebuilding. Radulfus listens sympathetically but his responsibilities to the monastery force him to adhere to the exact terms of the fair's charter, granted to the Abbey by the crown. Cadfael meets Hugh Beringar and his wife, Aline, who is with child. They talk of the war. King Stephen has the advantage, the Empress Maud has strongholds in the west of England and is abroad building support for a renewed attempt on the throne. Hugh mentions Ranulf, Earl of Chester, married to a daughter of Robert of Gloucester. Robert of Gloucester is half brother to the Empress. Earl Ranulf is powerful in his own right, and has not yet chosen to stand with one or the other in this war for the crown of England. 31 July 1139. Traders arrive from far and wide for the fair. Cadfael is called to translate for Rhodri, a Welsh merchant who speaks no English. While discussing the civil war Rhodri points out a glover, Euan of Shotwick. Euan, Rhodri says, is an ""intelligencer"" working for Earl Ranulf. Soon afterwards a boat arrives carrying Thomas of Bristol, a wealthy and important wine merchant. Rhodri notes that Bristol is in the west country, that Thomas is in ""good odour"" with Robert of Gloucester. Young men from the town arrive to cause trouble with the visiting merchants. Philip Corviser tries to convince them to support the town's cause. Thomas of Bristol dismisses the young men of the town as rabble. Pursue the debate, Philip places his hand on Thomas's arm, and Thomas strikes him with a staff. A riot breaks out. Philip regains his senses after the blow. He sees Thomas's niece, Emma, and is smitten by her beauty on the spot. Philip and his friends flee. Thomas and Emma are endangered by some rolling barrels. Emma is saved by Ivo Corbière, with whom she immediately falls in love. Hugh Beringar complains about his lot in life; dragging silly but basically good young men to prison. Cadfael speaks in defence of Philip Corviser, noting that he came only to speak, never threaten. They are interrupted by Emma searching for her missing uncle, Thomas of Bristol. Hugh, Cadfael and Ivo Corbière search for Thomas of Bristol as it is too dark for Emma to be on the streets. Corbière stumbles across his drunken and unconscious archer, Turstan Fowler, and leaves the search to carry him back to the Abbey. The search ends when a boat arrives with the naked body of Thomas of Bristol, who has been murdered with a dagger. Hugh, Aline and Emma discuss Thomas's death. It appears he was killed and robbed by sneak thieves. The young men of the town did not commit this crime as most were already in prison. Emma decides to continue trading at the fair as she believes her uncle would have wanted. Cadfael is charged to investigate the death by Abbot Radulfus who fears his decision not to aid the town may have led to Thomas's murder. At the hearing, Emma, Cadfael and Turstan the drunken archer, give testimony about what they witnessed in the confrontation between the young men and Thomas of Bristol. Turstan claims Philip issued threats against Thomas after the riot. Philip is ignorant of the merchant's death until Cadfael specifically mentions it. Philip protests his innocence of murder, continuing as prisoner to Sheriff Prestcote. Cadfael accompanies Emma back to her boat, which has been broken into and searched by someone. Emma at first says nothing is missing, then says that several small items she did not at first notice as missing are gone from her boat. Thomas's expensive robes are found, making theft an unlikely motive. Thomas's stall is broken into. Warin the ineffective watchman is bound, blindfolded, and gagged, and the strongbox stolen. The day's takings are safe on Emma's boat; the strongbox contains Thomas's business papers. Cadfael deduces that the murderer seeks something they believe Thomas brought with him. Emma knows more than she is telling. Emma wants to visit Euan of Shotwick, but stays with Aline instead. She wants a pair of gloves but Cadfael thinks she has another reason. Corbière visits Emma, for whom he seems to have romantic feelings. Emma visits her uncle's coffin in the Abbey, placing a rose in full bloom with his body, before the coffin is sealed by the carpenter. That evening, Cadfael notices a petal on the floor from that rose. Someone has searched the coffin. Early in the morning, Emma seeks out Euan, for the gloves she desires. His stall is not open. Others succeed in opening it. Euan is found dead inside by Cadfael and Rhodri, his neck broken. Hugh investigates the scene, finding a dagger in Euan's hand. The blade yields clues. Cadfael and Hugh piece together the situation. Thomas of Bristol and Euan of Shotwick were partisans or compatriots who had come to the fair to conduct secret business, involving an item of great value. A third man arrives, killing both of them and searching in vain for the item. Cadfael considers Rhodri as a suspect but his lack of English makes the Welshman unlikely. Philip Corviser is released before noon. After his parents celebrate his return, he visits Emma to thank her for her honest witness on his behalf. She still wishes to see justice done for her uncle. Philip tells Cadfael that he intends to retrace his steps of the evening of the murder to see if anyone set him up as a scapegoat for the murder. Cadfael speaks with Brother Mark, who tells him of a man who received treatment for a knife wound to the arm. The wounded man is identified as Ewald, a groom in the employ of Ivo Corbière. Cadfael believes that Euan injured his killer in the fatal struggle the night before. Cadfael informs Hugh. Together with Sheriff Prestcote and Corbière they confront Ewald, who shows his neatly bandaged arm at Beringar's request. When asked to show his cotte, he throws it in their faces, jumps on Corbière's horse and tries to escape. Corbière orders Turstan, who gave evidence against Philip at the hearing, to loose an arrow at Ewald, who is killed. Corbière justifies his actions, saying that his villein Ewald was a murderer and as his master, he had the right to administer justice. Cadfael reports to the Abbot, confirming Ewald was a murderer but warning that he does not think Ewald acted alone. Later Cadfael comforts Brother Mark, who is sorely distressed that someone whose injuries he recently tended was killed so soon afterwards. Philip questions his friends seeking to learn what happened during the evening he cannot remember. After being with them, he went to Wat's Tavern. Wat, the proprietor, tells him that Turstan came twice to the tavern, first just to look at the patrons. Philip was among those patrons. On second visit, Turstan drank only a single measure of ale, purchased a large bottle of hard liquor to carry away, and was sober when he followed Philip out of the tavern. Further, he was dressed in his proper clothes. Philip recalls that this is not what Turstan claimed when he gave evidence at the hearing, and not how he appeared. Later, seeking the place where he passed out from drink, Philip stumbles across the scene of Thomas's murder. Philip tells Cadfael and Hugh about his discovery. They visit the scene of Thomas's murder. Ivo Corbière offers to provide Emma with transport to her home in Bristol, saying he will be escorting his sister to a convent near Bristol from their Shropshire manor. Emma accepts, with Aline's approval for the brief time when Emma will travel unescorted with this single man. At the riverbank, Cadfael makes sense of the events of the last four days: Thomas arrived bearing something for the glover Euan. Turstan the archer followed Philip; once ensuring that Philip had no alibi, murdered Thomas. He established his own alibi by dousing himself in strong liquor, feigning unconsciousness. They view the place where Turstan was found unconscious. Servants clearing up after the fair have found the empty flagon of strong liquor. Cadfael realises that Ewald and Turstan acted on the orders of Corbière. Turstan had overdone it with his liquor alibi. When Corbière learned Turstan failed, he sent Ewald to search Thomas's boat while everyone was at the hearing. That same night Ewald and Turstan broke into Thomas's booth, again finding nothing. The next night they tried Euan's booth, killing him when he defended himself. Cadfael and Hugh approach Corbière, telling him they have discovered Ewald's role in Euan's murder. They have figured out Corbière's scheme to fool Ewald and order Turstan to attack him. Cadfael and Hugh both believe Emma to be safe with Aline, but Philip knows that Corbière has been visiting her. He is so horrified by what he hears that he rushes off to protect her. Cadfael and Hugh realise Philip is right. By the time they arrive at the Foregate, Emma has left with Corbière and Philip has stolen a merchant's horse to give chase. Aline tells them he has three hours lead, and is concerned at her own error of judgment. At Stanton Cobbold manor Ivo Corbière locks Emma in a room while he searches her baggage. She hides in her hair the small packet hanging round her neck, feeling unsafe both by the locked door and the nonappearance of his sister. Corbière returns, locks them both in the room, pockets the key and instantly changes tone. He demands the letter Thomas intended to deliver to Euan of Shotwick, the glover and spy. He threatens to strip her naked, even to rape her, to find it. Stalling, Emma asks what letter? She never admits she knows of any letter, and keeps the braiser between the two of them. Then she asks, what could be so important in a letter? Corbière tells her the letter is from Robert of Gloucester to Earl Ranulf, urging him to support the Empress's cause and naming fifty nobles in Stephen's camp who secretly support her. Corbière hopes the letter is worth an earldom to him. That is the price he will charge the King in exchange for the list of traitors. In a tense scene, Emma carefully removes the letter from her hair, unseen by the lordling just in front of her, to destroy it by fire in the room's brazier. Her uncle told her nothing of the contents, only that if not delivered it must be returned, and failing that, destroyed. To assure it burns, she pushes it into the fire, with her coif net attached inadvertently, at the cost of burning her hand. The hair net took fire rapidly, then spread to the wax-sealed letter. Corbière fails to retrieve the letter. She knocks over the unstable brazier, setting fire to the tapestries. Emma moves to the door, doing what she can to keep the fire from reaching her. She knocks and shouts, but cannot escape, since the door is locked. She lowered herself to breathe the air coming in under the door,slowly losing consciousness. Philip arrives to finds Corbière's manor ablaze with no servant willing to attempt a rescue. Instead, they bring out what goods they can save. Using an antique battle axe from the walls of the manor, Philip breaks down the door and rescues Emma. Hugh and Cadfael arrive. Cadfael tends to Philip's and Emma's injuries. Hugh arrests Turstan. He had not fled, thinking no one knew his role in the murders. Corbière is killed by the fire, a satisfying end to such a viper. Philip takes Emma back to his parent's home in Shrewsbury. Emma has recognized the value of Philip, whose honest character is the opposite of the brutally selfish man whose good looks and good manners once charmed her. Further, she and he are both tradespeople. A man of Ivo Corbière's class would not have considered her seriously, she realizes in retrospect. Cadfael recounts the events to Abbot Radulfus. Radulfus summons the town provost, Philip's father, to the morning chapter meeting at the abbey. Radulfus notes that by adhering to the letter of the fair's charter he has secured the rights of future abbots, doing what he must. Now he is free to do what he will with the money earned by the abbey at the fair. He donates ten percent to the rebuilding of the town. Hugh Beringar and his wife return to their own manor. Cadfael continues to tend to Emma's burns. At one meeting, Emma confesses what she learned of the contents of the letter and asks whether she did the right thing. Cadfael tells her that if she has scars from these burns, she should ""wear them like jewels"" for the rest of her life"". Emma asks Cadfael never to tell Philip the details behind the letter and her own actions, as she considers him too innocent to deal with such matters. Cadfael agrees and privately thinks Emma is correct in her assessment of Philip, and that this bodes well for their marriage. The novel concludes two months later with the news that on 30 September 1139, Empress Maud invaded England, establishing herself at Arundel Castle in West Sussex. Earl Ranulf of Chester did nothing to aid her cause.",0
24093007,Taking On the System: Rules for Radical Change in a Digital Era,Markos Moulitsas,2008-08-20,UNK,"Taking On the System is presented as a political primer for a new generation of progressive activists. The book is centered on the argument that in order to bring about change in the Information Age, activists will need to learn how to bypass traditional barriers to mass communication by effectively exploiting newly emerging media such as blogs, podcasts and video hosting services like YouTube. Moulitsas has cited Saul Alinsky's Rules for Radicals as a direct inspiration for Taking On the System, referring to his book as ""sort of a Rules for Radicals for the digital age"": It’s no secret that I have little love for the old-school street protest model of activism – not because I’m opposed to street theater, but because it’s simply not effective in today’s world. So how do you change the world in today’s world, with its fragmented media landscape, with democratizing technologies, with dramatic changes in how we interact with each other, and with a culture evolving at neck-breaking speeds? That’s what I’m trying to decipher.",0
24095373,Knight Crusader,Ronald Welch,1954,"{""/m/0dwly"": ""Children's literature"", ""/m/0hwxm"": ""Historical novel""}","The novel is divided into three parts: the first part leads up to the Battle of Hattin; the second part, set four years later, shows Philip d'Aubigny's escape from captivity at the time of the Third Crusade, and the final part deals with Philip's reclaiming his ancestral lands in the Welsh Marches. At the beginning of the novel, Outremer has been in existence for nearly one hundred years since the capture of Jerusalem in 1099. However, the Emir Saladin is uniting the Islamic forces against the Crusader states. The great military orders of the Knights Templar and Knights Hospitaller are eager for the fray, but others are concerned that there are not enough Christian knights in Outremer to form a field army while continuing to garrison the castles that protect the Kingdom. Saladin invades Outremer and besieges Tiberias. The weak-willed King of Jerusalem is swayed by advisers to march to the relief of the besieged city across a waterless plain at the height of summer. Debilitated by the desert conditions before the battle even begins, the Christian army suffers a devastating defeat at Hattin. Most of the Christian held fortresses of Outremer fall to Saladin and Jerusalem falls to the Muslim armies. These events are shown through the experiences of Philip d'Aubigny, a young English nobleman who was born in Outremer. He befriends a Turk, Jusuf, whom he rescues from robbers, and later impresses the king by his superior swordsmanship in a duel, gaining his knighthood. Philip overhears much discussion about the political and military situation. He suffers on the desert march, sees his father die in battle and is taken prisoner. Philip has a relatively easy captivity in the household of Jusuf's father Usamah in Damascus, but chafes to be free. With Hospitaller help he and his friend Gilbert escape over the walls. They make their way to Krak, the great Hospitaller fortress, after an encounter with the Assassins. Philip commits himself to the service of Richard of England and during the campaigns of the Third Crusade becomes one of the most celebrated knights of Christendom. In the final chapters of the novel, Philip and his company of Crusaders arrive in Britain, where he takes part in a jousting tournament at Cardiff Castle. He learns from his squire's father that his family's castle at Llanstephan has been taken by an ally of Prince John's and leads a raiding party to win it back. A notable aspect of the book is the bringing into contrast of the refinements of the medieval Islamic civilization, which had been adopted by the Outremer noblemen, with the comparatively stark and crude European living conditions of the time, and the suggestion that the returning Crusaders brought Eastern standards of culture to the West.",0
24107193,The Wizard of Linn,A. E. van Vogt,1962,"{""/m/06n90"": ""Science Fiction""}","A war between humanity and an extraterrestrial race, known as the Riss had led to the decay of the solar system, and the mutated human genius Clane Linn had defeated the hordes of the barbarian chief Czinczar, as described in the prequel. Linn repudiated Czinczar's exhortation to usurp control of the Linn Empire. After realizing the technological retardation of humanity, he conceives a plan to go on an interstellar expedition in search of technological restoration, to eventually rescue humanity.",0
24111341,Of Walking In Ice,Werner Herzog,2014,"{""/m/02gsv"": ""Personal journal""}","The book is the diary by Werner Herzog. It was written and takes place between November 23 and December 14, 1974. In the foreword Herzog says that he had a call from a friend in Paris, informing him that his close friend and film historian Lotte Eisner was ill, and was probably going to die. He sets off to Paris from Munich believing that he would save Eisner from death by arriving on foot. The book is the complete diary during his journey, only a few private remarks have been omitted.",80
24112752,Twitter Power,Joel Comm,2009-02,UNK,Twitter Power begins with a review of social media and the rise of microblogging — the practice of posting very short messages for public view. The book then talks the user through the registration procedure; offers design suggestions for the profile page; offers advice on building a following; describes the messages themselves and how to write them; discusses ways to connect with customers and team members on Twitter; and describes how companies are using Twitter to build their brands and drive behavior.,0
24113599,FruITion,UNK,UNK,UNK,"The story opens with Ian and members of his IT management team reviewing the company’s IT Strategy in a hotel meeting room, something that anyone involved in this process will find familiar. Ian then takes the strategy paper they produce to Juliette, who reacts in a way Ian is not expecting. She pushes Ian to articulate the company’s strategy for IT in one sentence, which he is initially unable to do. When he does, she pulls it apart and then asks Ian to start again, mentored by Graham. She sets him a timescale of a week to come back with an entirely new strategy, squarely focused on how the company creates value by exploiting IT. This is the beginning of a journey of discovery and change for Ian, at the end of which he will either become one of Juliette’s inner-circle corporate strategists or, it seems, lose his job. He rapidly discovers, for example, that the company’s difficulties with creating value from IT are actually nothing to do with IT, but originate in the organization’s culture towards investing in change. This is one of the book’s central insights, and one which takes Ian time to understand and then apply. As well as formulating the new ‘corporate strategy for exploiting IT’, Ian is expected to say what his own future role in the organization will be. Ian’s discomfort with the personal implications of the strategy he has been asked to formulate begin to undermine the chances of success. As the story progresses, Ian formulates his strategy in a number of iterations, and has mainly one-to-one conversations with the other key characters. Underlining the theme of relationships, the implications of Ian’s history with each of these people, and feelings about them, are both explicit and implicit in his narrative. The climax of the story is Ian’s formal meeting with Juliette, Graham and James to propose the new strategy and his role in its success. In the aftermath of their decision, we learn what happens to the various parts of Ian’s old IT department and to the members of Ian’s senior team. The result, like the book’s original question, is unorthodox — yet by then somehow obvious.",0
24115065,Part of the Furniture,Mary Wesley,1997,"{""/m/05hgj"": ""Novel""}","Seventeen-year-old Juno Marlowe is in love with Jonty and Francis and has just waved them off to war (World War II when the air raid sirens sound across London. Juno finds shelter in the house of a stranger, the frail Evelyn Copplestone. Juno spends the night with Evelyn and tells him the story of her life, and Evelyn decides to help her by writing her a letter of introduction to his family in the West Country. Evelyn, who is ill, dies of lungfailure due to gas in WWI during the night, and Juno flees the house. Reluctant to join her mother who has emigrated to Canada, and having nowhere else to go, Juno soon finds herself on her way to the West Country to see Evelyn's family at a farm named Copplestone. The owner of the farm, Robert Copplestone, Evelyn's father and only relative, is short of labour and hires Juno as a landgirl. Shortly after her arrival at Copplestone, Juno, to her surprise, finds out that she is pregnant. When her mother in Canada hears that Juno has given birth to a pair of illegitimate twins, the social embarrassment makes her break off any further contact with her daughter. Juno is left to fend for herself and the hard work at the farm helps her to blot out any unwelcome memories of her past. Gradually she learns to trust the other people at Copplestone, and the withdrawn and quiet Juno grows into an independent and determined woman, who is more than merely part of the furniture.",0
