id,title,author,published_date,categories,summary,page_count
20797033,Found,Margaret Haddix,2008-04,"{""/m/06n90"": ""Science Fiction"", ""/m/03mfnf"": ""Young adult literature""}","In the beginning of the story Jonah and his friend Chip Winston, who also learns that he is adopted, receive letters from an unknown person. The letters say “You are one of the missing” and “Beware! They are coming to get you”. At first they take it as some kind of joke but soon to wonder more and more about who are their birth parents and why they got these letters. They decide that the best way to figure out is to go into Chip’s parent's safe. There they find a phone number to an FBI agent named James Reardon. Soon Jonah asks his parents if they can call the adoption agency and ask who his birth parents really are. They only tell his dad to contact the FBI to talk to James Reardon. Jonah, his parents, and his sister Katherine meet James Reardon. Right before the meet, a janitor gives Jonah a bottle of Mountain Dew. When they finally meet with James Reardon, he tells them Jonah was illegally adopted from a foreign country and might be deported. He refuses to tell them the country's name, though. When Jonah goes to the bathroom to throw up thanks to the Mountain Dew, another, younger janitor appears out of nowhere in the bathroom and tells him a file would appear on the desk by the time he got back. He tells Jonah to memorize as many names as possible. Back in the room, he distracts the adults while Katherine takes pictures of the documents. It turns out to be the addresses and phone numbers of 36 teenagers, including Chip and Jonah. It also includes the names of several adults, including a woman named Angela DuPre. Chip and Katherine begin calling the numbers. The adults all hung up. Most of the kids turn out to live in the vicinity of Chip and Jonah. After a while they receive a letter from Angela DuPre, telling them to meet her at the library to talk about the things that are happening and get more information. At the library, Angela DuPre tells them that time travelers exist and that she had been researching. She tells them that she used to work at an airport, until an airplane, full of babies, appeared out of nowhere. After the babies were removed, the plane disappeared. She speculates that the babies on the plane were originally adults who were turned into babies by time traveling. Then a man breaks into the room and is promptly tackled by the ""janitor"" from the FBI who talked to Jonah in the bathroom. Chip, Jonah, and Katherine escape through a window, but Angela stays behind for more information. Later, when they're leaving the library, they see Angela, who disappears into thin air. When they get home, they find out the lists of names was deleted from Chip's computer. Shortly afterwards, Jonah's mom receives a flyer in the mail advertising an adoption conference for teen adoptees and their parents. Jonah persuades his parents to let him bring Katherine along, too. At the conference, all the adoptees are divided into two groups, with Jonah, Chip, and all the kids on the list in one group, and everyone else in another. Katherine pretends to be a girl named Daniella McCarthy to get into Jonah's group. The kids are led to a cave in the woods by two men name Gary and Mr. Hodge. Then the cave is transported to a place called a time hollow. The ""janitor"" from the FBI, whom Jonah, Chip, and Katherine have nicknamed JB, appears and attacks Gary and Mr. Hodge. Soon Angela arrives too. They find out that Gary and Hodge work for an organization called Interchronological Rescue, an organization dedicated to rescuing children from history, such as toddlers trapped in burning houses and people left for dead during the Bubonic Plague; taking them to the distant future; turning them into babies; and putting them up for adoption. The organization got greedy, however, and they started taking famous babies whose disappearances were noticed. Finally, when they were flying to the future with a load of babies, JB chased after the plane and caused it to crash in the twenty-first century. Gary and Hodge want to turn all the kids into babies and take them to the future, and JB wants to send them all back to die. Finally, JB sends Chip and another boy named Alex back to the fifteenth century , but Jonah and Katherine grab Chip's arms right before he disappears and find themselves falling backwards through time. On the way, Jonah manages to convince JB to let him and Katherine help Chip and Alex repair time so everyone can go home to the twenty-first century.",0
20797038,Compelling Evidence,UNK,UNK,UNK,"Ben Potter is found dead; his wife, Talia, is indicted and arrested. She turns to brilliant criminal defense lawyer, Paul Madriani, her former lover, to defend her.",0
20797941,The People of Kau,UNK,1976,['Nuba (African people)'],"This is a photographic monograph on the life of the people of Kau. Leni Riefenstahl spent 16 weeks with the Nuba of Kau in 1975. These people, known as the ""South East Nuba"", live only 100 miles away from the Mesakin Nuba. Yet, they speak another language, follow different customs, and are very different in character and temperament. The knife-fights, dances of love and elaborately painted faces and bodies are photographed in the book.",174
20798854,Handles,Jan Mark,1983-10-26,"{""/m/026llv5"": ""Literary realism"", ""/m/0dwly"": ""Children's literature""}","Erica Timperley, a city girl who loves motorcycles, is bored with her holiday in Norfolk where her Uncle and Aunt grow acres of vegetables. Then she sees a cat with false teeth and discovers Mercury Motor Cycles, an unusual motorcycle repair shop down an alley. There she meets the enigmatic young man ""Elsie"" Wainwright, who allows her the honour of helping out in the workshop. Apart from beginning to learn the trade, Erica learns a whole new arcane vocabulary and meets an array of curious characters including Bunny and Bill Birdcycle. Eventually she gets a ""handle"" of her own, and by the end of the summer is determined to become a mechanic.",0
20805713,Le Chercheur d'or,Jean-Marie Gustave Le Clézio,1985,"{""/m/05hgj"": ""Novel""}",Alexis L'Estang becomes obsessed with finding the treasure of the legendary Unknown Corsair on the island of Mauritius. The child recalls the sea around the island of Rodrigues in the Indian Ocean. The author situated the plot of this book in the village of Anse aux Anglais.,0
20805812,Étoile errante,Jean-Marie Gustave Le Clézio,1992,"{""/m/05hgj"": ""Novel""}","In the year 1944 in a mountainous area on the French-Italian border Esther and her mother and all the Jews in the village of Saint-Martin must cross from France to Italy to avoid the SS. After the war, she and her mother, Elizabeth, begin their long journey to France, to the sailing ship Sette Fratelli which will take them to Palestine. When Esther finally arrives in Jerusalem, she briefly meets and exchanges names with Nejma, a Palestinian, another wanderer, one who ends up, in the summer of 1948, in the Nour Chams Refugee Camp.",0
20806051,Ourania,Jean-Marie Gustave Le Clézio,2006,"{""/m/05hgj"": ""Novel""}","Le Clézio lived for fifteen years in a small village in Mexico called Valle de Bravo. Children invented an imaginary country and ideal, Ourania, and this book describes a near-Utopian society in Mexico. Two types of Utopias are compared to each other: a modest Utopia from the Jesuits and the other an ideal city called Santa Fe de la Laguna. The book mentions the transhumant movement Rainbows (1970–1980) and the Salvadoran revolution and its leader, Monsignor Romero. Failure was inevitable. Dreams are necessessary, even if reality isn't.",0
20806268,Ritournelle de la faim,Jean-Marie Gustave Le Clézio,2008-10-01,"{""/m/05hgj"": ""Novel""}","Set in Paris in the 1930s, it tells the story of Ethel, a young woman who must save herself and her parents, torn by the age's politics and their hatred for each other.The story seems so simple. A narrator who is and is not the author tells the story of a young girl – Ethel Brown – who is and is not the mother of JMG Le Clézio. French language text sample from ""Ritournelle de la faim"" can be read online",0
20808837,Vanishing Africa,Mirella Ricciardi,1974,"['Africa, Eastern']",The pictures are evidence of Riefenstahl's passion for Africa and an attempt to capture the region's soul before it lost its innocence to the technical age.,300
20814896,The Gray Cloth,UNK,UNK,"{""/m/06n90"": ""Science Fiction""}","The novel is set in the middle of the twentieth century, and opens in Chicago, where the protagonist Edgar Krug has designed an enormous colored-glass exhibition hall. An art exhibit is held there, accompanied by an organ concert. Krug, fiercely dedicated to his esthetic concepts, is unhappy that the bright colors of women's fashions clash with his architectural scheme. When he meets Clara Weber, the organist, he is struck by her gray dress with white lace trim; he finds it the perfect compliment to the color effect of his hall. Krug impulsively asks Clara to marry him &mdash; providing she agrees to wear the same style of clothing. Clara accepts Krug's terms, which are specified in their marriage contract. Once married, the couple leave for the Fiji Islands in Krug's private dirigible (it has a glass-walled cupola, and air conditioning). Though Clara accepts Krug's strange terms for their marriage, other women do not. Clara maintains a telegraphic correspondence with her American friend, Amanda Schmidt; and Amanda is highly critical of Clara's subservience in the arrangement. Later in the book, other women also protest its terms. Scheerbart provides portrayals of a number of strong female characters through the book, supporting its subtitle, ""a Ladies' novel."" Krug goes to Fiji because he has an ongoing project there, a retirement home for airship pilots. He clashes with the project's sponsor over how much colored glass the building will accommodate. From Fiji, Krug and Clara travel to other sites throughout the world, to visit other projects. Their first stop is ""Makartland"" at the South Pole, an artists' colony for twenty women artists. There, a seamstress makes outfits for Clara that arrange her gray-and-white wardrobe scheme in imaginative ways. Käte Bandel, one of the artists, joins the Krugs in their further travels; she debates artistic assumptions and values with Krug as they travel to Australia and then to Borneo. Bandel enrages Krug when she convinces Clara to wear a plaid scarf. Leaving Bandel behind, they fly to Japan; but Japanese women also react negatively to the gray and white. In the Himalayas and in Ceylon, Krug visits another projects; later the couple travel to an experimental station by the Aral Sea. They also visit Babylon and Egypt. Despite his enthusiasm for colored glass, Krug turns down an offer to build large glass obelisks atop the Pyramids of Giza. In the ""Kurian Murian Islands"" off the eastern coat of Arabia, Krug meets the tycoon Li-Tung, who commissions him to design houses suspended in mid-air (so that they don't scratch the majolica tiles with which the islands are paved). Li-Tung is passionate about color, and has Clara change into more varied silk outfits. Krug allows this. Their journey is not a parade of triumphs, however; in most places, Krug's ideas are resisted, criticized, and rejected to greater or lesser degrees. At Malta, though, a glass architecture museum in established. The Krugs end the novel at their glass house in Switzerland. At Babylon, Krug gives up on his determination about Clara's wardrobe, and agrees to strike the binding clause out of their marriage contract. By this time, though, Clara has become a convert to her husband's ideas about glass architecture, and maintains the gray fashion by her own choice.",0
20815127,Along for the Ride,Sarah Dessen,2009-06-16,"{""/m/03mfnf"": ""Young adult literature""}","It's been so long since Auden slept at night. Ever since her parent's divorce—or since the fighting started. Now she has the chance to spend a carefree summer with her dad and his new family in the charming beach town where they live. A job in a clothes boutique introduces Auden to the world of girls: their talk, their friendship, their crushes. She missed out on all that, too busy being the perfect daughter to her demanding mother. Then she meets Eli, an intriguing loner and a fellow insomniac who becomes her guide to the nocturnal world of the town. Together they embark on parallel quests: for Auden, to experience the carefree teenage life she’s been denied; for Eli, to come to terms with the guilt he feels for the death of a friend.",0
20819071,A Crooked Kind of Perfect,Linda Urban,2009,['Juvenile Fiction'],"A normal girl in Michigan, Zoe Elias has dreams of becoming a pianist just like Vladimir Horowitz. Zoe's mom is obsessed with her work and her dad doesn't have a job, and doesn't like to interact with others. When her father brings home a Perfectone D60 Organ, Zoe is upset because she was hoping for a baby grand piano. The organ comes with free lessons and her teacher is Miss Person. After a lesson, Zoe disobeys Miss Person and instead of practicing with her tempo, she uses Ramba version. Miss Person realizes that Zoe has talent and decides that Zoe should enter the Perform-O-Rama. Zoe's mom misses her birthday and Zoe is very upset. After things go wrong, and her mother can no longer drive her to the Perform-O-Rama on the following day, she thinks that she won't make it to Perform-O-Rama. She takes out her anger on her dad, and Mr. Elias decides to take Zoe to the Perform-O-Rama, knowing she really wants to do it. Her first performance, at the Perform-O-Rama, doesn't go as well as she'd wanted. But during her second, she looks up in the audience and sees her mom, by her dad. Zoe gets motivated and later comes home with a 4th place trophy.",224
20819671,Near to the Wild Heart,Clarice Lispector,2012,['Fiction'],"Near to the Wild Heart does not have a conventional narrative plot. It instead recounts flashes from the life of Joana, between her present, as a young woman, and her early childhood. These focus, like most of Lispector's works, on interior, emotional states. The book opens with a scene of the child Joana playing in the garden, making up poems for her father. Joana's wildness and barely suppressed violence, along with her linguistic creativity, are her most notable features. She is frequently compared to animals: over the course of the book Lispector describes her to a bird, a snake, a wildcat, a horse, and a dog. She commits transgressive acts—as a child she throws a book at an old man's head, for example, and as a married woman she leaves her husband, Otávio, and greets the news of his adultery—he has made another woman, his old friend Lídia, pregnant—with utter indifference. She is not so much immoral as she is amoral: “Evil is not living, and that’s it. Dying is already something else. Dying is different from good and evil.” In the book, she cites long passages from Spinoza, the longest quotes that appear anywhere in her novels; it seems that she felt an affinity with the Dutch philosopher's amoral conception of the world.",220
20820681,Sent,Margaret Haddix,2008-04-22,"{""/m/06n90"": ""Science Fiction"", ""/m/03mfnf"": ""Young adult literature""}","The children Jonah, Katherine, Chip, and another boy, Alex, have no preparation before they are sent back to 1483 at the Tower of London by way of time travel. JB promises them that they can return to the present if they can fix Time. Katherine gets time sickness from the dramatic time warp. Jonah and Chip help her to her feet while they are talking to JB through a futuristic machine called the Elucidator. They quickly discover that Chip and Alex’s true identities are the 12-year-old King Edward V and his 10-year-old brother, Richard, the Duke of York. Chip tells Katherine she can be his queen and Jonah becomes annoyed, replying that ""she's my sister."" In the Tower they find two ghostlike boys. JB explains that they are tracers, which show how time would have gone on if time travelers had not messed with them. Chip blends in with his tracer, and realizes he can think like King Edward V. He realizes that they are the princes and kings of London, that Richard III wants them dead, and that their mother has a plan for their escape. Soon, two men come to the room the tracers are in and throw the boys out the window. However, Jonah and Katherine pull Chip and Alex from their tracers. The group thinks that they succeeded in fixing time. However, the men search for their bodies and the group is forced to hide. Chip gets frustrated at JB and throws the Elucidator at the wall. Jonah picks it up and finds that the Elucidator is critically damaged. They reset it, and use one of its functions to become invisible. The next morning, the group leaves the Tower and joins the coronation of Richard III. Chip and Alex run off, angry after seeing their uncle take the throne. Jonah and Katherine go to a chapel where Richard III is praying, and they pretend to be angels. They tell him that the princes are in heaven, but that he will never be able to go there himself. However, the Elucidator finishes resetting and Jonah and Katherine become visible again. They run away and eventually find Chip and Alex, who are with their mother and their sisters. JB explains, through the Elucidator, that one of the two men who threw the boys out of the window was sent by the queen to protect them. He brings them out of time to tell them how and when to save Chip and Alex, and then drops them two years later in time. Katherine and Jonah meet Richard III again during the night, and tell him that if he gives the throne to Edward V/Chip, he will be forgiven and will go to Heaven. In the Battle of Bosworth Field, pitting Richard III against Henry VII of England. Jonah and Katherine try to get Alex and Chip out of their tracers so they can tell them they need to leave. When Jonah can't, Katherine gets Chip out by telling him she would be his girlfriend if he asked. Chip gets Alex out but then Richard III comes to Edward V/Chip and tells him that he will give Edward V back the throne after the battle. The battle ensues, and Richard III is killed. Jonah and Katherine pull Chip and Alex out just before they get killed in original history. JB makes them come back to the cave using the Elucidator. JB explains to the group that they succeeded - they did save Chip and Alex, yet managed to keep history the same because Richard III was dead, the princes were considered dead, and all the people who knew that Richard III planned to give back the throne were dead in the battle. When they are back in the present, JB asks Jonah and Katherine to ""help"" another kid. JB gives them another ""traveling companion,"" a girl named Andrea, who is really Virginia Dare from the lost colony of Roanoke. JB tells Chip and Alex they have to stay in the present while Jonah and Katherine are gone. JB replies that it will seem they were gone for a few minutes, but Chip says he knows it will be longer. Chip and Alex are just about to resent but then Jonah and Katherine are sent back into time.",0
20829007,Lullaby,Jean-Marie Gustave Le Clézio,1980,"{""/m/0707q"": ""Short story""}","The adolescent Lullaby strolls the beaches, cliffs and caves on the outskirts of her home town (this is situated in an unnamed Mediterranean environment). Her getting in groove with the ocean and the elements is what gets her going, and finally she can return to the life she once knew as meaningless, only now adding a bit of meaning to it.",0
20830044,The Redeemer,Jo Nesbø,2005,"{""/m/0lsxr"": ""Crime Fiction""}","The Redeemer begins by describing an incident which took place a number of years in the past, in 1991, at a youth camp run by the Norwegian Salvation Army. A young, 14-year old girl – the daughter of a senior official in the Salvation Army – is raped in a public toilet on the site. Due to the Salvation Army's strict hierarchical setup, and also because revelation of the rape will severely damage the Salvation Army's reputation, she does not tell anyone about the ordeal. The name of the assailant is not given; the chapter includes mention of several young men who would play major roles in the later plot, and it could have been any of them. Another aspect of the past, scattered in numerous flashbacks throughout the book, are vivid reminiscences of the 1991 Battle of Vukovar during the Breakup of Yugoslavia, and of the atrocities committed in its aftermath by the victorious Serb militias. Similar to the flashbacks to the Second World War in ""The Redbreast"", these are integral to the book's plot - having formed the character of a young Vukovar Croat fighter who received the nickname ""Little Redeemer"", who would later become a professional hitman, carrying out contract killings in various European cities. The action moves to the present day (2003), and the Croat assassin – calling himself Stankic – arrives in Oslo and kills a Salvation Army officer during a Christmas street concert. The hitman has a facial anomaly known as hyperelasticity, wherein his facial muscles can be manipulated voluntarily to stop people from recognizing him. As such, despite the murder happening in a public place the Norwegian police get little useful information regarding the murderer. The reader already does know who pulled the trigger – however, the identity of the customer who paid for the killing and this customer's motives remain unknown, and are at the center of the mystery which must be unravelled. Meanwhile, the senior Police Inspector from the Oslo Police, Bjarne Møller, retires. As a parting gesture, he gives his three main officers, Jack Halvorsen (called Halvorsen by his colleagues), Beate Lønn – Halvorsen's girlfriend – and Harry Hole gifts. Harry's is a wristwatch which grows to annoy Harry due to the incessant ticking of the second-hand. At one point, he even throws it out of the window of his apartment, though later recovers it from the packed snow. Møller is replaced by Gunnar Hagen. Harry, Halvorsen and Beatte are assigned to the murder of the Salvation Army officer – a man called Robert Karlsen. When a murder attempt is made on Robert's brother, Jon Karlsen it is believed that the Karlsen family is being attacked. Harry's former girlfriend, Rakel, has now left him and is with another man, Matthias Lund-Helgesen (who is to become a major character in the next Harry Hole novel, The Snowman) and Harry meets up – and eventually begins a relationship – with Martine, the young woman who (unbeknownst to Harry) was raped at the start of the novel. Harry finds clues that lead him to Croatia and he makes contact with the hitman's minder who is revealed to be the Stankic's mother. He makes a deal with her to save her son's life, but upon returning to Norway discovers that a man wearing Stankic's clothes has been shot and killed by an armed police marksman. The dead man's face is all but obliterated and identification is near-impossible. There is a clue, however, in the dead man's DNA, after Halvorsen is fatally wounded outside Jon Karlsen's flat. The blood of the dead man does not match that of Stankic, whose blood was found at the scene of the attack on Halvorsen. Harry continues to follow Stankic, but now knows that Stankic was contracted to kill Jon Karlsen by Jon Karlsen himself. Jon switched places with his brother (the two looked very similar so Stankic did not notice the difference) in order for that murder of his brother could not be blamed on him. When in Croatia, setting up the hit, Jon had posed as Robert. Jon is also swindling the Salvation Army out of 5,000,000 krone for an apartment block. On the night of an indoor Christmas concert in a concert hall, Jon Karlsen stands up his girlfriend, Thea, claiming that his father – in Thailand – is ill and that he is going to fly out to him. Stankic and - later - Harry Hole both get the details from Thea that Jon is about to flee the country. Stankic catches up with Jon Karlsen in a toilet block some distance from the main airport terminal. Harry also catches up with the two of them there, and gets Jon Karlsen to give a full confession, stating that anything said with a gun (Stankic's) to his head is inadmissible in court. Jon tells everything, believing that he will be set free, but Harry instead tells Stankic that Jon's bag contains the 5,000,000 krone and walks away. Behind him a single shot is heard. In effect, Harry has become Accessory Before the Act to murder. Part of the confession includes that it was Jon Karlsen, not Stankic, who fatally wounded Halvorsen. Harry also knows that it was Jon who raped Martine some years earlier, and that he has been raping young girls regularly ever since. Jon is seen to have been an unreliable narrator, as numerous episodes told from his point of view in earlier parts of the book gave the impression of his being a honest, well-meaning person. Owing to the high valuation that an antique dealer puts on the watch given to him by Bjarne Møller, Harry also realises that his former boss was involved in the same group of corrupt police officers as his former nemesis, Tom Waaler. Harry goes to Bergen to speak with Møller but – after Møller describes that he was trying to do what was best for the Force, Harry elects not to arrest him.",0
