id,title,author,published_date,categories,summary,page_count
3667266,The Fall of Kelvin Walker: A Fable of the Sixties,Alasdair Gray,UNK,"{""/m/014dfn"": ""Speculative fiction""}","Kelvin, freed from his strict Calvinist upbringing through discovering Nietzsche and 'the divine Ingersoll' in the library of his home town of Glaik, travels to swinging-sixties London to succeed as a television interviewer and newspaper columnist through nothing more than his aptitude for spin and a diabolical will to power, only to return, chastened, to Scotland and to God. Drawing on a mixture of Scottish archetypes and British stereotypes and expressing all the author's cynicism towards religion, the media and the imperial British centre, this brief fable was reportedly inspired by Gray's own visit to London as a struggling artist to record a documentary called Under The Helmet (in which he tried to increase his sales by suggesting that he was dead).",0
3670857,Fugitive Pieces,Anne Michaels,1996,"{""/m/02xlf"": ""Fiction"", ""/m/05hgj"": ""Novel""}","In the first part of the book, Jakob Beer is a 13 year old child of a Jewish family living in Poland. His house is stormed by Nazis; he escapes the fate of his parents and his sister, Bella, by hiding behind the wallpaper in a cabinet. He hides in the forest, burying himself up to the neck in soil. After some time, he runs into an archaeologist, Athos, working on Biskupin. Athos secretly takes him to Zakynthos in Greece. Athos is also a geologist, and is fascinated with ancient wood and stones. Jakob learns Greek and English, but finds that learning new languages erases his memory of the past. After the war, Athos and Jakob move to Toronto, where after several years Jakob meets Alexandra in a music library. Alex is a fast-paced, outspokenly philosophical master of wordplay. Jakob and Alex fall in love and marry, but the relationship fails because Alex expects Jakob to change too fast and abandon his past. Jakob dwells constantly on his memories of Bella, especially her piano-playing, and they end up divorcing. Jakob meets and marries Michaela, a much younger woman but one who seems to understand him, and with Michaela's help he is able to let go of Bella. Together they move to Greece into the former home of several generations of the Roussos family. The second part of the book is told from the perspective of Ben, a Canadian professor of Jewish descent who was born in Canada to survivors of the Holocaust. In 1954 the family home in Weston, Ontario is destroyed by Hurricane Hazel. Ben becomes an expert on the history of weather, and marries a girl named Naomi. He is a big admirer of Jakob's poetry and respects the way he deals with the Holocaust, when Ben himself has trouble coping with the horrors his parents must have endured. At the end of the novel, Ben is sent to retrieve Jakob's journals from his home in Greece, where Ben spends hours swimming in Jakob's past.",0
3670937,Pubis angelical,Manuel Puig,1979,"{""/m/02xlf"": ""Fiction"", ""/m/05hgj"": ""Novel""}","The narrative alternates between separate narratives. One is reality, an Argentine woman confined to a Mexican sanitarium in the 1970s. The others are a representation of her unconscious. In this second narrative, the woman is in Central Europe in the years leading up to World War II. She is here involved in various intrigues, and carries on an extramarital romance. The third narrative, another representation of the protagonist's unconscious, is a science fiction tale involving a cyborg woman named W218 in a post-apocalyptic Polar Age, who serves the government by performing sexual therapy on aging men, and is therefore in a sense a government sponsored prostitute.",0
3672431,Thirsty,Matthew Tobin Anderson,1997,"{""/m/014dfn"": ""Speculative fiction"", ""/m/03npn"": ""Horror""}","The story is set in the town of, and in the areas surrounding, Bradley, Massachusetts. A Vampire Lord, Tch'muchgar, is magically imprisoned in isolation at the bottom of the town reservoir. The townsfolk performs rituals at the annual The Sad Festival] of Vampires to maintain the bonds holding Tch'muchgar prisoner. Early in the book the young hero, Chris, witnesses a vampiress being lynched]. Soon after, he starts to feel a strange sensation — a growing thirst for blood. Chris later notices that his friend Tom is casting a reflection on the water of the reservoir but Chris himself has no reflection. He realizes that he must be suffering from vampirism. Chris is afraid to tell anyone, even his friends, because vampires are killed immediately upon being discovered. Chris is soon confronted by a mysterious person dressed in black, who introduces himself as Chet the Celestial Being. Chet says that he serves the Forces of Light, and that he can cure Chris of his vampirism. But first Chet must place a holy object, The Arm of Moriator, with Tch'muchgar. Once activated, the Arm cannot be moved or deactivated by evil beings. Chet explains that if Tch'muchgar tries to escape from his prison, the Arm will cause him to become trapped between worlds, just like ""opening an elevator between floors"". Chet leaves for two weeks to retrieve the Arm. Meanwhile, Chris's vampirism grows at a steady rate. He starts sleeping during the day and staying awake at night. He drinks warm water to simulate drinking blood, and even considers his family as potential ""beverages"". Chris also begins receiving letters through mail from vampires living underground in the community. One of these letters is from a female vampire named Lolli, who appears to be Chris's age and behaves like a popular adolescent girl. Chris starts to notice he is being stalked by a creepy humanoid figure he describes as ""The Thing with the One-Piece Hair"", or simply The Thing. The Thing corners Chris in the woods, but Chet appears and ""kills"" The Thing. He warns Chris that The Thing is not really dead and will rematerialize within a few minutes. So Chet places a mark on Chris' wrist, which he said will protect him from the Thing. Chet gives Chris the Arm and bring him to a congregation of vampires in an abandoned church. Chris is accepted as a vampire by the others and learns that they plan to summon Tch'muchgar. He takes this opportunity to enter the realm of Tch'muchgar and drops the Arm. Chris returns to his ""normal"" life and waits for Chet to return with further instruction. His vampiric symptoms continue to grow. Crazed with thirst, Chris almost bites his friend's dog. He resorts to going hunting for raccoons to drink from. After he cuts himself shaving for the first time, Chris begins drinking his own blood. He eventually resorts to biting himself in the arm. One evening, his mother tells him a story about how Chris nearly died as a newborn, but that a strange nurse took him away for a few minutes. When she brought him back, he was fine. His mother believes that the woman was an angel. Chris fears that the nurse must have been a vampire who infected him with vampirism to save his life. At the Sad Festival of Vampires, Chris is talked into going to a party with Lolli and another young vampire called Bat. They tell him that to become initiated into the vampire community he must make his first kill that night and smear his blood on his cheeks. Chris shies away from the challenge, saying that he couldn't find anyone yet, but Lolli quickly calls his bluff. Chris escapes from the party and finds his crush, Rebecca Schwartz, in the area. He tells her that he needs to talk, but his teeth start to grow in bloodlust. Chris flees back to the vampire party, only to find that everyone save one high student has left. The student tells Chris that Lolli killed a student. Afterwards, she was hit by a car and broke her back. The authorities arrived and took her to be killed. Chris hears Bat coming, and runs outside. He meets Chet, who confirms the story about Lolli's death. Bat hears this and attacks Chet, but Chet makes Bat vanish with a wave of his hand, presumably killing him. At the climax of the story, Tch'muchgar attempts to leave his prison but is shoved out of the dimension and into nonexistence by the Arm of Moriator. Chet reveals that he was actually working for Tch'muchgar, who had realized that he would never escape his prison and was looking for a way to end his miserable life. He also taunts that he was lying about being able to help Chris, because vampirism is incurable. Chet gleefully points out to Chris that he is now doomed. If he kills mortals for blood, they will eventually hunt him down and execute him. If he refuses to drink blood, he will die. If he seeks help from the Forces of Light, they will torment him in place of the vampire lord. If he tries to get help from other vampires, they will kill him themselves for destroying their god. At the end of the story, in Chris's home, his mother is suspicious, and wants him to be tested for vampirism. His brother treats this with derision, but Chris wonders how his mother would react. He has a flashback to when he was young, that a mother bird would not take in her own child if it had been touched by a human; it would rather bash its skull in. The flashback ends with some older boys throwing stones at a hatchling, yelling ""This is mercy!"" with other children joining in. As the book ends, Chris's fate is uncertain, leaving the main plot of the book unresolved though Chris is certainly doomed either way. In the end, Chris realizes that he needs to feed, but he cannot feed. The story ends with the words, in this order: Oh God I am So Thirsty",0
3673869,Pirates of Venus,Edgar Rice Burroughs,1934,"{""/m/06n90"": ""Science Fiction"", ""/m/014dfn"": ""Speculative fiction"", ""/m/02xlf"": ""Fiction""}","Carson Napier When the author receives a letter saying a woman in white will come to him on the night of the thirteenth, he dismisses it as nonsense. Jason Gridley calls, and the author visits him to discuss the latest news about von Horst, Tarzan, David Innes, Captain Zuppner and Abner Perry in Pellucidar. Having forgetten the letter, however, the woman does appear on the thirteenth, walking through a closed door. She tells him that ""he"" awaits a reply. Aided by his secretary Ralph Rothmund, the letter is found again and a reply to the sender, Carson Napier, is sent. A few days later Carson shows up at Tarzana, telling the story of his life including how he grew up in India, learning telepathy from the Hindu mystic Chand Kabi, how he lived with his mother's grandfather John Carson, and how he lost his mother. Revealing an intent to fly a rocket to Mars, he fades from view only to enter through the door again. He has used telepathy for the meeting to ascertain they can uphold telepathic communication so that the author may become the medium through which he tells the story of his adventures. Before returning to his rocket on Guadalupe Island Napier also leaves the author in charge of his personal fortune. Off for Mars Arriving at Guadalupe, Carson finds that everything has been made ready under the surveillance of his friend Jimmy Welsh. Jimmy begs for Carson to take him along, but Carson refuses. After a final inspection (during which the rocket ship and plans for the journey are described) Carson bids his workers farewell and takes his place in the rocket. Take-off! At first, everything appears to go well, but after two hours signs indicate that the rocket is moving off course. Eventually, Carson realizes that he forgot to take the moon's gravity into account. Two days later it is clear that his new course will take him towards the Sun and certain death. On the thirtieth day he spots a crescent. Rushing toward Venus The crescent turns out to be Venus. It becomes clear the rocket is going to hit the planet. Venus is said to be unable to support life, but Carson nevertheless does not give up. As the rocket enters the atmosphere he opens its parachutes, then jumps, opening his own parachute. He discovers the air is breathable. Falling through two thick layers of clouds he is unaware of his surroundings (except for a faint luminosity from below) until the parachute gets stuck in the branches of a tree. Freeing himself from the parachute he starts descending and soon learns the trees are of enormous proportions. After climbing down a thousand feet he finds a causeway, apparently built by intelligent beings, where he encounters a hideous wild beast. He discovers a door in the bole of a tree. Hearing a voice speaking in a foreign language, he calls for help. The beast attacks, but he temporarily stops it by snaring it with a piece of rope salvaged from the parachute. Fleeing for his life Napier is rescued by three humans, armed with spears, emerging from the door. Taking him inside, the men give him food and a bed. He soon falls asleep. To the House of the King When he wakes up, Carson discovers he appears to be in a city built in the enormous tree boles. He dresses in his overall, in spite of the heat. His hosts offer him breakfast. During the course of the meal he tries to learn his first few words of the language. The men of the house are named Duran, Olthar and Kamlot. The women are Zuro and Alzo. After breakfast, the men take him to another house where a man by the name Tofar leads them to a man called Jong, who appears to have a high social status. Carson is thoroughly examined and then placed in the care of a man called Danus. During the following three weeks Carson learns the language (which is briefly described), history and customs of Amtor, as the Venusians call their planet. Danus also shows a map, pointing out different regions of Amtor: Trabol, Strabol and Karbol. His explanations make it obvious that the Amtoran view of the world is very limited. They know of nothing beyond the cloud-covered skies, and they think that the equator is the center of the world and that the north pole is its edge. The Girl in the Garden Carson is in the house of Mintep, king (jong) of Vepaja. Duran, father of Olthar and Kamlot, is of the house of Zar. Zuro is attached to Duran, as Alzo to Olthar. Marriage is unknown on Amtor, but couples are usually loyal. Several officers live to the left of Carson. To the right is a garden with a girl. One day five men creep into the garden. Carson follows, killing three. Guards butcher the others, then throw the bodies from the tree. Danus never mentions the incident. Danus tells the history of the Vepajans: There were four classes who lived happily by the millions on thousands of islands. A criminal, Thor, formed the Thorists, who revolted. Everyone became virtual slaves. Some escaped, forming these classless tree cities. Thorists search for them because they themselves have no intelligent people. Vepajans never get sick or grow old because of a serum. Half their women are sterile. Children are only allowed when someone dies by accident. Carson (now 27) is given blood tests for the longevity serum and is found to be filled with bacteria. He loves swimming, boxing, wrestling, and fencing. He exercises because he is overweight. The girl in the garden watches him. He smiles, she runs away. Carson thinks it might be his beard. Danus gives him a depilatory. Asking about the girl, Carson is told he should not even see her. Carson is a prisoner. His apartment is guarded, and he may not leave. Gathering Tarel Carson gets the longevity serum. Not many doctors are needed on Amtor. One day Carson sees the girl and leaps into her garden. When he touches her arm, he gets slapped, but he declares his love. Carson is summoned before Mintep, the jong. He was suspected as a Thorist spy, but now he is to be trained to collect tarel and hunt. Tarel is the strong, silky fiber from which their cloth and cordage are made. Carson is moved to the house of Duran where he is given primitive weapons. (There is an R-ray gun on Amtor, but the Thorists control the rare elements that produce the ray.) That evening he plays a Vepajan game, ""tork,"" with Zuro and Alzo. On the morning hunt Kamlot and Carson climb high in their tree, go through a little door, then pass to other trees. Tarel turns out to be the web of a spider. Carson saves Kamlot from a giant spider (targo), but Kamlot dies. By Kamlot's Grave While Carson carries Kamlot home for burial, he falls into a spider web and kills the targo. He climbs down to the ground (some trees tower 6000 feet and are 1000 feet around the base). He digs a grave to give Kamlot a ""Christian burial"" but discovers he is still alive, just paralyzed by the spider's venom. Kamlot describes a basto (a bison with the teeth of a carnivore) and the decimal system of weights and measures. Some trees are marked with numbered nails as a mapping system, and the entire map is memorized by the Vepajans. The variety of trees is described. Kamlot kills a basto, kind of like bull-fighting, when Carson suddenly sees a startling sight overhead. On Board the Sofal Five ""voo klangan"" (the bird-men) capture Carson and Kamlot with wire nooses attached to ropes. They are carried through the air accompanied by klangan singing songs ""vaguely reminiscent of Negro spirituals"". They have very dark skin and are a mixture of bird and man, having feathers and bat-like wings. They fly for eight hours to the Venusian sea and a ship manned by Thorists. They are questioned and Carson tells them he is a doctor. We also learn that Kamlot's home city is called Kooaad. Thrown into the hold of the ship, Kamlot meets a friend, Honan, with the Amtorian greeting ""Jodades"" (luck-to-you). They learn that Duare (Doo-ah-ree) has been captured, but held on another ship. Kamlot and Carson are set to polishing the guns on deck. They fire T-rays that destroy everything. They are locked by a master key, which Carson wants. The guns and ship propulsion are explained—lor is the propulsive substance—and element 93 (vik-ro), element 97, element 105 (yor-san) are described. They always sail in sight of land. Honan tells Carson that Duare is ""the hope of Vepaja, perhaps the hope of a world."" Soldiers of Liberty Tensions ease on the ship; Napier becomes friendly with both crew and captives. Telling stories of Earth, he makes new friends. Gamfor, Kiron, and Zog, who become the nucleus for a rebellion. Meanwhile, Carson learns about the Amtorian compass and sonar. Because the map concepts were skewed, reliance upon the maps was fraught with error—large areas are marked joram (ocean), but Carson believes he knows the location of Thora. Named vookor (captain) among the growing secret rebel faction, Napier later learns from Gamfor that Anoos had reported his suspicions to the ship's captain and that his friend among the ship soldiers had given him a key to the armory. Napier suggest they strike that night, but the hold is sealed when it was usually left open. During the night Anoos is murdered. Mutiny The ship's captain conducts an investigation. Napier's clever reply (said loud enough for the Soldiers of Liberty to hear) suggests Anoos despised the Thorists and was a rabble rouser. They all answer similarly. The captain retires. Napier remarks upon Amtorian time measure. At the seventh hour the mutiny commences. The battle is fierce, Kamlot participates in the attack on the ship's upper decks. The ship's officers are slaughtered, many of the soldiers joining the mutineers. Later, Kodj objects to Napier as vookor, Zog disarms him. Napier plans his assault on the Sovang (where Duare is held) from the Sofal's conning tower. Napier addresses the ship's crew, and Kodj and the malcontents as regards the attack: there will be profit for those who participate. Duare Napier's officers report on the crew's temper through the night, most agree with embarking on piracy as regards Thorian shipping—some wish to go home. Exercising caution, Napier arms the loyal hundred and confines the remainder below. Bringing the Sofal near, the Sovang is boarded. Battle ensues. Napier orders the transfer of the Sovang's prisoners (mostly women) and the removal of the Sofal's malcontents to the other ship. Kamlot later reports the virgin Vepajan princess is on board and is grateful that Napier (upon reply) personally killed the captain who affronted her. Later Napier is summoned to the princess' cabin. He whistles (Amtorian custom instead of knocking) and is astonished to see the princess is the girl from the garden! A Ship! Carson again declares his love, much to the girl's distress and anger saying the Vepajans and her father would immediately kill him. Napier restrains his impulses, questioning her. She pardons his affront due to services rendered, reveals she is not yet nineteen, says they can never speak again, and departs into another room. Amtorian language lesson regarding ""sofal"" and ""sovang"" (killer and defender). Kamlot explains majority for Vepajan females (age 20) and penalties of death in particular to royal daughters. Carson reveals his intent to marry Duare, Kamlot responds with sword, then cannot kill his friend. Napier remarks on the differences between both worlds. Kamlot becomes a confused party regarding the possible love between Napier and Duare. Days later Vilor requests audience with Napier to offer his service as guard to the janjong—denied. ""Voo notar!"" (a ship!). The Sofal pursues the Thorian vessel to take her prize. An ongyan's pennant is displayed (exempt from search) and as the Sofal nears—then presents her guns—Moosko, the ongyan commands his soldiers to repel any boarders. Catastrophe Moosko sends the Yan racing away. Carson pursues in the Sofal. After much T-ray fire, and many casualties on the Yan, Carson catches and boards Moosko's ship. Carson is relieved that those under his command obey him rather than turn to personal looting. After destroying the Yan's guns, Carson allows her captain his freedom with the admonition to tell all he meets that the Sofal is to be obeyed. Moosko is kept hostage, housed in the cabin of Vilor, at Vilor's request. Chasing the Yan has led them near the coast of Noobol. A gale rises. Carson finds an angan with Vilor and Moosko and orders the birdman back to his quarters. Carson then visits Duare who hesitates, then allows him entrance. Carson tells her again that he loves her and Duare tells him she cannot listen. He kisses her by force and she draws her dagger. Carson apologizes and leaves. In the early morning, awakened by storm, Carson discovers Duare missing and fears she may have killed herself because of his assault. Then he finds Vilor and Moosko also missing. The lookout has been murdered. A Vepajan woman, Byea, informs Carson that Vilor was a Thoran spy. Storm A search reveals five klangan also missing. Kamlot, Gamfor, Kiron and Zog meet with Carson and reconstruct the scheme wherein Vilor abducted Duare and Moosko regained his freedom with the help of trusted klangan. Carson orders the Sofal to remain offshore until the gale abates, then launch a rescue party. Leaving the cabin, Carson is swept out to sea. He swims with the waves toward shore. The rough surf betokens death as does eternal swimming. But, Carson concludes, ""in the midst of death there is life."" Fate washes him past the rocks to a sandy beach. He climbs the inlet wall and sets out across the tableland. Later, hearing fighting, he finds Duare and some klangan beset by manlike creatures. Carson charges, scattering the creatures. One angan remains alive. Duare thanks Carson perfunctorily for saving her from the kloonobargan, a word Burroughs explains. Carson offers pardon to the angan in return for faithful service. They return to the coast. Duare confesses as they travel that the rules forbidding conversation may be relaxed in their present circumstances. Speechless at first, Carson tells her about Earth. At the coast, they build a signal fire. Men on land, led by Vilor and Moosko, come to investigate as does the Sofal. Carson orders the angan to carry Duare to the Sofal; she refuses to leave. Carson grabs her, kisses her, and hands her to the angan. She protests, telling Carson that she loves him as they fly away. Carson is taken captive with that knowledge.",0
3673882,Wizard of Venus,Edgar Rice Burroughs,1964,"{""/m/06n90"": ""Science Fiction""}","""The Wizard of Venus"". Carson Napier is trapped in the castle of an insane Venusian ""wizard"" who holds the local population in thrall through the use of hypnotic powers. Napier, who is possessed of comparable powers he has hitherto utilized solely to transmit his account of his Venusian adventures back to Earth, successfully counters the tyrant and frees his victims. ""Pirate Blood"". A modern-day young man named Lafitte, a descendant of the New Orleans pirate of the same name, finds himself thrown by a bizarre set of events into his ancestor's profession. The tale is a semi-serious takeoff on the hoary theory that heredity equals destiny.",0
